title,author,tags
"If you change the way you look at things, the things you look at change.",Wayne Dyer,"Look, Way, Things"
Change will not come if we wait for some other person or some other time. We are the ones we've been waiting for. We are the change that we seek.,Barack Obama,"Time, Waiting, Wait"
You must be the change you wish to see in the world.,Mahatma Gandhi,"World, Wish, See"
When we are no longer able to change a situation - we are challenged to change ourselves.,Viktor E. Frankl,"Situation, Longer, Able"
"God grant me the serenity to accept the things I cannot change, the courage to change the things I can, and the wisdom to know the difference.",Reinhold Niebuhr,"Wisdom, Courage, God"
"We cannot change anything until we accept it. Condemnation does not liberate, it oppresses.",Carl Jung,"Accept, Anything, Cannot"
"The only way to make sense out of change is to plunge into it, move with it, and join the dance.",Alan Watts,"Dance, Way, Make"
"If we don't change, we don't grow. If we don't grow, we aren't really living.",Gail Sheehy,"Grow, Living, Really"
"They always say time changes things, but you actually have to change them yourself.",Andy Warhol,"Time, Always, Yourself"
The first step toward change is awareness. The second step is acceptance.,Nathaniel Branden,"Step, Acceptance, Awareness"
Sometimes it's the smallest decisions that can change your life forever.,Keri Russell,"Life, Your, Sometimes"
I cannot say whether things will get better if we change; what I can say is they must change if they are to get better.,Georg C. Lichtenberg,"Better, Will, I Can"
The world is changing very fast. Big will not beat small anymore. It will be the fast beating the slow.,Rupert Murdoch,"World, Will, Slow"
"If you don't like something, change it. If you can't change it, change your attitude.",Maya Angelou,"Attitude, Your, Something"
"Some people don't like change, but you need to embrace change if the alternative is disaster.",Elon Musk,"Disaster, People, Some People"
Change is the law of life. And those who look only to the past or present are certain to miss the future.,John F. Kennedy,"Life, Future, Past"
"Progress is impossible without change, and those who cannot change their minds cannot change anything.",George Bernard Shaw,"Impossible, Progress, Anything"
There is nothing permanent except change.,Heraclitus,"Nothing, Permanent, Except"
"Everyone thinks of changing the world, but no one thinks of changing himself.",Leo Tolstoy,"World, Everyone, Thinks"
"Life is about not knowing, having to change, taking the moment and making the best of it, without knowing what's going to happen next.",Gilda Radner,"Life, Best, Moment"
Just because everything is different doesn't mean anything has changed.,Irene Peter,"Just Because, Everything, Anything"
He who rejects change is the architect of decay. The only human institution which rejects progress is the cemetery.,Harold Wilson,"Progress, Cemetery, Human"
"My friends, love is better than anger. Hope is better than fear. Optimism is better than despair. So let us be loving, hopeful and optimistic. And we'll change the world.",Jack Layton,"Love, Hope, Anger"
Money and success don't change people; they merely amplify what is already there.,Will Smith,"Success, Money, People"
To improve is to change; to be perfect is to change often.,Winston Churchill,"Perfect, Often, Improve"
"Just when I think I have learned the way to live, life changes.",Hugh Prather,"Life, I Have Learned, Way"
"Because things are the way they are, things will not stay the way they are.",Bertolt Brecht,"Will, Way, Stay"
The truth does not change according to our ability to stomach it.,Flannery O'Connor,"Truth, Ability, Stomach"
"Without change, something sleeps inside us, and seldom awakens. The sleeper must awaken.",Frank Herbert,"Us, Inside, Something"
"I have noticed even people who claim everything is predestined, and that we can do nothing to change it, look before they cross the road.",Stephen Hawking,"Look, Road, Nothing"
"Miracles happen everyday, change your perception of what a miracle is and you'll see them all around you.",Jon Bon Jovi,"Your, Perception, Miracles"
"Since we cannot change reality, let us change the eyes which see reality.",Nikos Kazantzakis,"Eyes, Reality, See"
There is nothing so stable as change.,Bob Dylan,"Nothing, Stable"
Change is inevitable. Change is constant.,Benjamin Disraeli,"Inevitable, Constant"
Things do not change; we change.,Henry David Thoreau,Things
"Never believe that a few caring people can't change the world. For, indeed, that's all who ever have.",Margaret Mead,"Believe, World, Change The World"
Progress is a nice word. But change is its motivator. And change has its enemies.,Robert Kennedy,"Progress, Enemies, Nice"
Very often a change of self is needed more than a change of scene.,A. C. Benson,"Self, More, Scene"
"Any change, even a change for the better, is always accompanied by drawbacks and discomforts.",Arnold Bennett,"Always, Better, Even"
"The thing that lies at the foundation of positive change, the way I see it, is service to a fellow human being.",Lech Walesa,"Positive, Service, Foundation"
"All change is not growth, as all movement is not forward.",Ellen Glasgow,"Growth, Forward, Movement"
"The world hates change, yet it is the only thing that has brought progress.",Charles Kettering,"Progress, World, Only"
You're only as young as the last time you changed your mind.,Timothy Leary,"Time, Your, Mind"
Change before you have to.,Jack Welch,"Before, You"
We all have big changes in our lives that are more or less a second chance.,Harrison Ford,"Chance, Big, Second Chance"
"I hope everyone that is reading this is having a really good day. And if you are not, just know that in every new minute that passes you have an opportunity to change that.",Gillian Anderson,"Hope, Good, Opportunity"
"Sometimes if you want to see a change for the better, you have to take things into your own hands.",Clint Eastwood,"Your, Better, Hands"
"If you want to change the culture, you will have to start by changing the organization.",Mary Douglas,"Culture, Organization, Start"
"All changes, even the most longed for, have their melancholy; for what we leave behind us is a part of ourselves; we must die to one life before we can enter another.",Anatole France,"Life, Die, Behind"
"If you want to change attitudes, start with a change in behavior.",William Glasser,"Behavior, Start, Want"
"If you do not change direction, you may end up where you are heading.",Lao Tzu,"Direction, End, May"
"If you want to make enemies, try to change something.",Woodrow Wilson,"Enemies, Try, Make"
"The more things change, the more they are the same.",Alphonse Karr,"Things, More, Same"
"For the past 33 years, I have looked in the mirror every morning and asked myself: 'If today were the last day of my life, would I want to do what I am about to do today?' And whenever the answer has been 'No' for too many days in a row, I know I need to change something.",Steve Jobs,"Life, Morning, Today"
"Change your opinions, keep to your principles; change your leaves, keep intact your roots.",Victor Hugo,"Your, Keep, Roots"
Only the wisest and stupidest of men never change.,Confucius,"Men, Never, Only"
What's dangerous is not to evolve.,Jeff Bezos,"Dangerous, Evolve"
I think you should always bear in mind that entropy is not on your side.,Elon Musk,"Always, Your, Mind"
"Change the changeable, accept the unchangeable, and remove yourself from the unacceptable.",Denis Waitley,"Yourself, Accept, Unacceptable"
"In times of rapid change, experience could be your worst enemy.",J. Paul Getty,"Experience, Your, Enemy"
The foolish and the dead alone never change their opinions.,James Russell Lowell,"Alone, Dead, Never"
"In order to change the world, you have to get your head together first.",Jimi Hendrix,"Your, Together, World"
Change brings opportunity.,Nido Qubein,"Opportunity, Brings"
"Change alone is eternal, perpetual, immortal.",Arthur Schopenhauer,"Alone, Immortal, Eternal"
"You must take personal responsibility. You cannot change the circumstances, the seasons, or the wind, but you can change yourself. That is something you have charge of.",Jim Rohn,"Responsibility, Yourself, Wind"
"The curious paradox is that when I accept myself just as I am, then I can change.",Carl Rogers,"Myself, I Am, Curious"
"It is change, continuing change, inevitable change, that is the dominant factor in society today. No sensible decision can be made any longer without taking into account not only the world as it is, but the world as it will be.",Isaac Asimov,"Society, Today, Decision"
A fanatic is one who can't change his mind and won't change the subject.,Winston Churchill,"Mind, Who, Subject"
Ignorance is always afraid of change.,Jawaharlal Nehru,"Always, Ignorance, Afraid"
What we call progress is the exchange of one nuisance for another nuisance.,Havelock Ellis,"Progress, Exchange, Call"
"A small group of thoughtful people could change the world. Indeed, it's the only thing that ever has.",Margaret Mead,"World, Change The World, People"
"I read and walked for miles at night along the beach, writing bad blank verse and searching endlessly for someone wonderful who would step out of the darkness and change my life. It never crossed my mind that that person could be me.",Anna Quindlen,"Life, Mind, Step"
Nothing endures but change.,Heraclitus,"Nothing, Endures"
"When you blame others, you give up your power to change.",Robert Anthony,"Power, Your, Blame"
"It may be hard for an egg to turn into a bird: it would be a jolly sight harder for it to learn to fly while remaining an egg. We are like eggs at present. And you cannot go on indefinitely being just an ordinary, decent egg. We must be hatched or go bad.",C. S. Lewis,"Bird, Fly, Bad"
Our dilemma is that we hate change and love it at the same time; what we really want is for things to remain the same but get better.,Sydney J. Harris,"Love, Time, Hate"
"Life belongs to the living, and he who lives must be prepared for changes.",Johann Wolfgang von Goethe,"Life, Living, Be Prepared"
"Excuses change nothing, but make everyone feel better.",Mason Cooley,"Better, Nothing, Feel"
There are two kinds of fools: those who can't change their opinions and those who won't.,Josh Billings,"Opinions, Fools, Two"
"If there is no struggle, there is no progress.",Frederick Douglass,"Progress, Struggle"
People are always looking for the single magic bullet that will totally change everything. There is no single magic bullet.,Temple Grandin,"Always, Will, People"
Things don't have to change the world to be important.,Steve Jobs,"World, Change The World, Important"
"Action and reaction, ebb and flow, trial and error, change - this is the rhythm of living. Out of our over-confidence, fear; out of our fear, clearer vision, fresh hope. And out of hope, progress.",Bruce Barton,"Hope, Fear, Vision"
The main dangers in this life are the people who want to change everything... or nothing.,Nancy Astor,"Life, Nothing, People"
Change will never happen when people lack the ability and courage to see themselves for who they are.,Bryant H. McGill,"Courage, Will, People"
I can't really change my life to accommodate people who are jealous. I don't see why I should.,Sting,"Life, My Life, People"
"Change does not roll in on the wheels of inevitability, but comes through continuous struggle. And so we must straighten our backs and work for our freedom. A man can't ride you unless your back is bent.","Martin Luther King, Jr.","Work, Freedom, Man"
"Without accepting the fact that everything changes, we cannot find perfect composure. But unfortunately, although it is true, it is difficult for us to accept it. Because we cannot accept the truth of transience, we suffer.",Shunryu Suzuki,"Truth, Difficult, True"
Change is such hard work.,Billy Crystal,"Work, Hard Work, Hard"
"There are good and bad times, but our mood changes more often than our fortune.",Thomas Carlyle,"Good, Mood, Bad"
Opinions are made to be changed - or how is truth to be got at?,Lord Byron,"Truth, Opinions, Got"
"I believe that history has shape, order, and meaning; that exceptional men, as much as economic forces, produce change; and that passe abstractions like beauty, nobility, and greatness have a shifting but continuing validity.",Camille Paglia,"Beauty, History, Men"
We live in a moment of history where change is so speeded up that we begin to see the present only when it is already disappearing.,R. D. Laing,"History, Moment, Live"
Change means that what was before wasn't perfect. People want things to be better.,Esther Dyson,"Better, People, Perfect"
We must all obey the great law of change. It is the most powerful law of nature.,Edmund Burke,"Nature, Great, Law"
"If there is anything that we wish to change in the child, we should first examine it and see whether it is not something that could better be changed in ourselves.",Carl Jung,"Better, Wish, First"
To change ones life: Start immediately. Do it flamboyantly.,William James,"Life, Start, Immediately"
All great change in America begins at the dinner table.,Ronald Reagan,"Great, Dinner, America"
"All things must change to something new, to something strange.",Henry Wadsworth Longfellow,"New, Things, Strange"
A hero is someone right who doesn't change.,George Foreman,"Hero, Right, Someone"
"Face the facts of being what you are, for that is what changes what you are.",Soren Kierkegaard,"Face, Facts, Being"
"Could we change our attitude, we should not only see life differently, but life itself would come to be different.",Katherine Mansfield,"Life, Attitude, Be Different"
Change is inevitable. Change for the better is a full-time job.,Adlai Stevenson I,"Better, Job, Inevitable"
One of my favorite philosophical tenets is that people will agree with you only if they already agree with you. You do not change people's minds.,Frank Zappa,"Will, People, Only"
The world changes in direct proportion to the number of people willing to be honest about their lives.,Armistead Maupin,"World, People, Willing"
"Loss is nothing else but change, and change is Nature's delight.",Marcus Aurelius,"Nature, Nothing, Loss"
"If you feel like it's difficult to change, you will probably have a harder time succeeding.",Andrea Jung,"Time, Difficult, Will"
"Lord, where we are wrong, make us willing to change; where we are right, make us easy to live with.",Peter Marshall,"Easy, Live, Right"
"Things alter for the worse spontaneously, if they be not altered for the better designedly.",Francis Bacon,"Better, Things, Worse"
I shall not change my course because those who assume to be better than I desire it.,Victoria Woodhull,"Better, Desire, Who"
He that will not apply new remedies must expect new evils; for time is the greatest innovator.,Francis Bacon,"Time, Will, New"
"When you jump for joy, beware that no one moves the ground from beneath your feet.",Stanislaw Jerzy Lec,"Your, Feet, Joy"
Change in all things is sweet.,Aristotle,"Sweet, Things, All Things"
"When you are through changing, you are through.",Bruce Barton,"Through, Changing, You"
Anyone who thinks there's safety in numbers hasn't looked at the stock market pages.,Irene Peter,"Stock Market, Numbers, Safety"
"Relentless, repetitive self talk is what changes our self-image.",Denis Waitley,"Talk, Self, Self-Image"
He who is fixed to a star does not change his mind.,Leonardo da Vinci,"Mind, Who, Star"
"To change a habit, make a conscious decision, then act out the new behavior.",Maxwell Maltz,"Decision, Behavior, New"
"They must often change, who would be constant in happiness or wisdom.",Confucius,"Wisdom, Happiness, Must"
Slowness to change usually means fear of the new.,Phil Crosby,"Fear, New, Means"
The changes in our life must come from the impossibility to live otherwise than according to the demands of our conscience not from our mental resolution to try a new form of life.,Leo Tolstoy,"Life, Try, New"
It's the most unhappy people who most fear change.,Mignon McLaughlin,"Fear, Unhappy, People"
One must change one's tactics every ten years if one wishes to maintain one's superiority.,Napoleon Bonaparte,"Ten Years, Must, Superiority"
I'm a catalyst for change. You can't be an outsider and be successful over 30 years without leaving a certain amount of scar tissue around the place.,Rupert Murdoch,"Place, Outsider, Catalyst"
Future shock is the shattering stress and disorientation that we induce in individuals by subjecting them to too much change in too short a time.,Alvin Toffler,"Future, Time, Stress"
"Taste may change, but inclination never.",Francois de La Rochefoucauld,"Never, May, Taste"
"I'm not going to change the way I look or the way I feel to conform to anything. I've always been a freak. So I've been a freak all my life and I have to live with that, you know. I'm one of those people.",John Lennon,"Life, Always, Look"
Change alone is unchanging.,Heraclitus,"Alone, Unchanging"
Everything in life that we really accept undergoes a change.,Katherine Mansfield,"Life, Accept, Everything"
Let the great world spin for ever down the ringing grooves of change.,Alfred Lord Tennyson,"Great, World, Down"
All things are only transitory.,Johann Wolfgang von Goethe,"Things, Only, All Things"
"Weep not that the world changes - did it keep a stable, changeless state, it were cause indeed to weep.",William Cullen Bryant,"World, Keep, State"
In a progressive country change is constant; change is inevitable.,Benjamin Disraeli,"Country, Progressive, Inevitable"
Remember that life's big changes rarely give advance warning.,"H. Jackson Brown, Jr.","Life, Remember, Big"
"We emphasize that we believe in change because we were born of it, we have lived by it, we prospered and grew great by it. So the status quo has never been our god, and we ask no one else to bow down before it.",Carl T. Rowan,"God, Great, Believe"
The garden is growth and change and that means loss as well as constant new treasures to make up for a few disasters.,May Sarton,"Growth, New, Loss"
"To change what you get, you must change who you are.",Vernon Howard,"Must, Who, Get"
"Change is tough, people don't like it, but it is necessary. Take two aspirins and call me in the morning.",Christopher Bond,"Morning, Me, People"
When it becomes more difficult to suffer than to change... you will change.,Robert Anthony,"Difficult, Will, More"
All I want to do is change the world.,W. Clement Stone,"World, Change The World, Want"
One change always leaves the way open for the establishment of others.,Niccolo Machiavelli,"Always, Way, Others"
"Things of this world are in so constant a flux, that nothing remains long in the same state.",John Locke,"World, Long, Nothing"
"As with anything creative, change is inevitable.",Enya,"Anything, Inevitable, Creative"
"Change, like sunshine, can be a friend or a foe, a blessing or a curse, a dawn or a dusk.",William Arthur Ward,"Sunshine, Blessing, Dawn"
"Not only is women's work never done, the definition keeps changing.",Bill Copeland,"Work, Women, Done"
Illness strikes men when they are exposed to change.,Herodotus,"Men, Illness, Exposed"
"For changes to be of any true value, they've got to be lasting and consistent.",Tony Robbins,"Value, True, True Value"
"Change is not only likely, it's inevitable.",Barbara Sher,"Only, Inevitable, Likely"
"If you can change three lives in 10, three lives in a hundred, that's got to be good, hasn't it?",Ian Botham,"Good, Three, Got"
I try to contrast; life today is full of contrast... We have to change.,Gianni Versace,"Life, Today, Try"
"Perfection is immutable. But for things imperfect, change is the way to perfect them.",Owen Feltham,"Perfection, Way, Perfect"
True change takes place in the imagination.,Unknown,"Imagination, True, Place"
"Change occurs in direct proportion to dissatisfaction, but dissatisfaction never changes.",Douglas Horton,"Never, Direct, Changes"
Most people already know what they're doing wrong. When I get them to church I want to tell them that you can change.,Joel Osteen,"Doing, Know, People"
"In not my, but our collective hands, is held the promise of change.",Mark Sanford,"Hands, Collective, Promise"
Change is the only constant. Hanging on is the only sin.,Denise McCluggage,"Sin, Only, Hanging"
"I don't know if you can change things, but it's a drop in the ocean.",Julie Walters,"Know, Ocean, Things"
A lot of people get impatient with the pace of change.,James Levine,"People, Pace, Impatient"
"Christians are supposed not merely to endure change, nor even to profit by it, but to cause it.",Harry Emerson Fosdick,"Endure, Profit, Even"
Our fathers valued change for the sake of its results; we value it in the act.,Alice Meynell,"Value, Act, Results"
"The moral world is as little exempt as the physical world from the law of ceaseless change, of perpetual flux.",James G. Frazer,"World, Law, Moral"
"Serve the dinner backward, do anything - but for goodness sake, do something weird.",Elsa Maxwell,"Dinner, Weird, Goodness"
"I can't change the direction of the wind, but I can adjust my sails to always reach my destination.",Jimmy Dean,"Inspirational, Always, Destination"
"Never doubt that a small group of thoughtful, committed citizens can change the world; indeed, it's the only thing that ever has.",Margaret Mead,"Environmental, World, Change The World"
The pessimist complains about the wind; the optimist expects it to change; the realist adjusts the sails.,William Arthur Ward,"Wisdom, Wind, Sails"
"Change your life today. Don't gamble on the future, act now, without delay.",Simone de Beauvoir,"Motivational, Life, Future"
Only I can change my life. No one can do it for me.,Carol Burnett,"Motivational, Life, Me"
Change your thoughts and you change your world.,Norman Vincent Peale,"Inspirational, Thoughts, Your"
"The most difficult thing is the decision to act, the rest is merely tenacity. The fears are paper tigers. You can do anything you decide to do. You can act to change and control your life; and the procedure, the process is its own reward.",Amelia Earhart,"Life, Your, Decision"
"You cannot control what happens to you, but you can control your attitude toward what happens to you, and in that, you will be mastering change rather than allowing it to master you.",Brian Tracy,"Attitude, Your, Control"
Vision without action is merely a dream. Action without vision just passes the time. Vision with action can change the world.,Joel A. Barker,"Time, Vision, World"
"No matter what people tell you, words and ideas can change the world.",Robin Williams,"Inspirational, World, Change The World"
Time changes everything except something within us which is always surprised by change.,Thomas Hardy,"Time, Always, Time Changes"
"Always Do Your Best. Your best is going to change from moment to moment; it will be different when you are healthy as opposed to sick. Under any circumstance, simply do your best, and you will avoid self-judgment, self-abuse and regret.",Don Miguel Ruiz,"Positive, Best, Do Your Best"
"I can't change my personality. I'll always smile, but I'll be more focused.",Katarina Johnson-Thompson,"Smile, Personality, Always"
"Let us remember: One book, one pen, one child, and one teacher can change the world.",Malala Yousafzai,"Inspirational, Teacher, World"
Education is the most powerful weapon which you can use to change the world.,Nelson Mandela,"Education, World, Change The World"
"Together we can change the world, just one random act of kindness at a time.",Ron Hall,"Time, Kindness, Together"
Each one of us can make a difference. Together we make change.,Barbara Mikulski,"Together, Make A Difference, Difference"
"Growth is painful. Change is painful. But, nothing is as painful as staying stuck where you do not belong.",N. R. Narayana Murthy,"Growth, Nothing, Stuck"
In times of change learners inherit the earth; while the learned find themselves beautifully equipped to deal with a world that no longer exists.,Eric Hoffer,"Learning, World, Find"
"We have a powerful potential in out youth, and we must have the courage to change old ideas and practices so that we may direct their power toward good ends.",Mary McLeod Bethune,"Courage, Good, Power"
Intelligence is the ability to adapt to change.,Stephen Hawking,"Intelligence, Ability, Adapt"
Music can change the world because it can change people.,Bono,"Music, World, Change The World"
"Most people don't want to change. They're comfortable and set in their ways. But in order to change, you have to be able to agitate people at times. And I think that's something that's very necessary for us to improve as a country.",Colin Kaepernick,"Country, People, Comfortable"
"Climate change is happening, humans are causing it, and I think this is perhaps the most serious environmental issue facing us.",Bill Nye,"Environmental, Climate Change, Serious"
"Acting is magical. Change your look and your attitude, and you can be anyone.",Alicia Witt,"Attitude, Your, Look"
"You can't change who you are, but you can change what you have in your head, you can refresh what you're thinking about, you can put some fresh air in your brain.",Ernesto Bertarelli,"Brain, Your, Thinking"
Ethics and equity and the principles of justice do not change with the calendar.,D. H. Lawrence,"Justice, Ethics, Principles"
"Sometimes, change is a good thing.",Christian Yelich,"Good, Sometimes, Thing"
"Wherever you are, be there totally. If you find your here and now intolerable and it makes you unhappy, you have three options: remove yourself from the situation, change it, or accept it totally. If you want to take responsibility for your life, you must choose one of those three options, and you must choose now. Then accept the consequences.",Eckhart Tolle,"Life, Your, Responsibility"
Journalism is what maintains democracy. It's the force for progressive social change.,Andrew Vachss,"Democracy, Journalism, Social Change"
