title,author,tags
"Climate change is real. Climate change is being substantially increased by humans and the carbon we put into the atmosphere. And it appears to be speeding up. If science has made any mistakes, science has been underestimating it.",James Balog,"Science, Climate Change, Mistakes"
"In my estimation, there should always be a mixture of economic liberalism - which means small government, a great emphasis on markets - but also a certain degree of social conservatism, not to favor change unless that change is beneficial. So I describe myself as an economic liberal and a social conservative.",John Howard,"Great, Government, Myself"
"For the first time in my adult lifetime, I am really proud of my country. And not just because Barack has done well, but because I think people are hungry for change. And I have been desperate to see our country moving in that direction.",Michelle Obama,"Time, Done, I Am"
"Words are powerful; if you change your words, you can change your life.",Joyce Meyer,"Life, Your, Words"
"The North Star has always been the same, which for us, is about making insanely great products that really change the world in some way - enrich people's lives.",Tim Cook,"Great, Always, World"
"Just by making a decision to stay out of politics, you are making the decision to allow others to shape politics and exert power over you. And if you are alienated from the current political system, then just by staying out of it, if you do nothing to change it, you simply entrench it.",Joan Kirner,"Politics, Power, Political"
Us boss chicks have to continue to stick together and change the game.,Megan Thee Stallion,"Together, Boss, Game"
What motivates most people to change their behavior is consequences. No consequences? No behavior modification.,Drew Pinsky,"Behavior, People, Consequences"
"You cannot change your destination overnight, but you can change your direction overnight.",Jim Rohn,"Destination, Your, Direction"
"When you want something so bad and when something great happens, I think it's instinct that you say, 'This is gonna be the moment that's gonna change everything. Everybody is gonna see me a different way.'",Joan Smalls,"Great, Moment, Me"
"As human beings, we are vulnerable to confusing the unprecedented with the improbable. In our everyday experience, if something has never happened before, we are generally safe in assuming it is not going to happen in the future, but the exceptions can kill you and climate change is one of those exceptions.",Al Gore,"Future, Experience, Climate Change"
Metamorphosis has always been the greatest symbol of change for poets and artists. Imagine that you could be a caterpillar one moment and a butterfly the next.,Louie Schwartzberg,"Always, Moment, Butterfly"
"Changing the world is not easy, but its pursuit will change you profoundly.",Leroy Hood,"World, Will, Easy"
I want tension in my business. Tension creates change. Change is necessary to evolve and prosper. I am never satisfied.,Kenneth C. Griffin,"Business, I Am, Never"
"Climate change is moving faster than we are, but we don't give up because we know that climate action is the only path.",Antonio Guterres,"Path, Climate Change, Know"
We understand bringing girls into the tech space is about giving them skills to create social impact and change in their community.,Kimberly Bryant,"Space, Community, Impact"
It is really interesting to change your hair color after being blond your entire life.,Ross Lynch,"Life, Your, Hair"
"If someone doesn't like something, it's their prerogative not to like it. It's not possible to please everyone. That doesn't mean that I'm going to change my mental make-up. I follow my instinct.",Ekta Kapoor,"Please Everyone, Follow, Everyone"
"The thing about the basics is they don't really change - it's the details and the proportions that change. The shirt may be cut slimmer or looser, the suit might be darker or lighter, the sneakers might not have laces, but you're still talking about shirts and suits and sneakers.",John Varvatos,"Shirt, Details, Sneakers"
"There are those people who are in your corner no matter what, you can't do any wrong, even when you do wrong. And then there are those people that no matter what you do they are going to dislike you and that's not going to change.",Brett Favre,"Your, Matter, People"
"A visit to a cinema is a little outing in itself. It breaks the monotony of an afternoon or evening; it gives a change from the surroundings of home, however pleasant.",Ivor Novello,"Home, Cinema, Evening"
Historical change is like an avalanche. The starting point is a snow-covered mountainside that looks solid. All changes take place under the surface and are rather invisible.,Norman Davies,"Historical, Place, Invisible"
"A great revolution in just one single individual will help achieve a change in the destiny of a society and, further, will enable a change in the destiny of humankind.",Daisaku Ikeda,"Society, Great, Destiny"
"I wouldn't change myself at all. Being transgender makes me who I am: a strong person, a confident person. Being transgender gives me my personality.",Jazz Jennings,"Personality, Myself, I Am"
"I would tell my younger self not to change for anyone. There's only one you, which makes you unique.",Jasmine Cephas Jones,"Unique, Tell, Self"
Don't fear change - embrace it.,Anthony J. D'Angelo,"Fear, Embrace"
"I wouldn't change anything about my past, because it's made me who I am today. You have to remember: You need to crack some eggs to make omelettes. And I did crack some eggs.",Herschel Walker,"Today, Past, I Am"
You must welcome change as the rule but not as your ruler.,Denis Waitley,"Welcome, Your, Must"
One of the many things nobody ever tells you about middle age is that it's such a nice change from being young.,Dorothy Canfield Fisher,"Age, Nobody, Young"
"Most women set out to try to change a man, and when they have changed him they do not like him.",Marlene Dietrich,"Women, Man, Try"
Change means movement. Movement means friction. Only in the frictionless vacuum of a nonexistent abstract world can movement or change occur without that abrasive friction of conflict.,Saul Alinsky,"World, Conflict, Abstract"
"Some of our important choices have a time line. If we delay a decision, the opportunity is gone forever. Sometimes our doubts keep us from making a choice that involves change. Thus an opportunity may be missed.",James E. Faust,"Time, Opportunity, Decision"
Middle age is when your broad mind and narrow waist begin to change places.,E. Joseph Cossman,"Age, Your, Mind"
"Education is and will be the most powerful tool for individual and social change, and we must do all that it takes to facilitate it.",Shiv Nadar,"Education, Will, Social Change"
"No one wants to hear that, but life changes. If it changes, you have to change with it, to whatever degree.",Bob Stoops,"Life, Degree, Whatever"
"Obviously, there are moments that you look back at and cringe - things in the past involving violence or disrespect to women or disrespect to other people that are so far away from what I want to put out there now. But it's actually a privilege to be able to change and be making records that reflect that change.",Mike D,"Women, Past, Look"
You had to feel the swell change. You had to go with the change. He told me that. No eye is on the sparrow but he did tell me that.,Joan Didion,"Me, Feel, Eye"
"There are a lot of people in the animal rights movement who can be very passionate and aggressive, and I applaud people's passion, but when people are judgmental and aggressive, all you end up doing is getting other people to turn away in irritation. To change people's minds, you have to respect the people you're talking to.",Moby,"Respect, Passion, Doing"
There are pros and cons of experience. A con is that you can't look at the business with a fresh pair of eyes and as objectively as if you were a new CEO. Fire yourself on a Friday night and come in on Monday morning as if a search firm put you there as a turn-around leader. Can you be objective and make the bold change?,Andrea Jung,"Morning, Experience, Business"
"We have all been there: we see that gorgeous person across the room, and we want to go and speak to them so badly. However, the 'rules' of society mean we usually don't end up doing it, despite our friends' best efforts to convince us to. Time for a change. Be empowered and say hi! It's proven that people really like it when you take initiative.",Whitney Wolfe Herd,"Best, Time, Society"
"When you forgive, you in no way change the past - but you sure do change the future.",Bernard Meltzer,"Future, Forgiveness, Past"
"If you're old, don't try to change yourself, change your environment.",B. F. Skinner,"Age, Your, Yourself"
"Today, actors aren't forced to ditch their regional accents like they used to. The best example's Tom Baker, a Scouser who went to great lengths to change his accent and ended up with something alien - and fantastic. It's sad that when the likes of him go, there won't be those sorts of accents any more.",Matt Berry,"Best, Sad, Great"
Yankees don't understand that the Southern way of talking is a language of nuance. What we can do in the South is we can take a word and change it just a little bit and make it mean something altogether different.,Lewis Grizzard,"Language, Way, Understand"
The hardest thing in life to do is to change.,Mickey Rourke,"Life, Hardest, The Hardest Thing"
"Persistence and determination are incredibly important. But sometimes you need to analyze the situation and understand when you're wrong. You need to be able to cop to being wrong, learn to change, and continue to grow as a human being.",Sasha Grey,"Determination, Persistence, Grow"
"People are going to say what they want to say and think what they want to think, and I can't change their minds.",Hilary Duff,"People, Think, Say"
People don't change their behavior unless it makes a difference for them to do so.,Sharon Stone,"Behavior, People, Difference"
"My notion of a wife at 40 is that a man should be able to change her, like a bank note, for two 20s.",Warren Beatty,"Age, Man, Wife"
The real sadness of fifty is not that you change so much but that you change so little.,Max Lerner,"Age, Sadness, Real"
"When you run a company, you want to hand it off in better shape than you found it. In the same way, just as we shouldn't leave our children or grandchildren with mountains of national debt and unsustainable entitlement programs, we shouldn't leave them with the economic and environmental costs of climate change.",Henry Paulson,"Environmental, Better, Climate Change"
We can't change the past. We can only get ready for the future.,Marcus Smart,"Future, Past, Ready"
I want to change the bad boy image that has stuck for a bit because I don't think I am at all how I have been portrayed. I would like that to change because it's awful to hear and read what is said of you.,Luis Suarez,"I Am, Bad Boy, Bad"
"The ultimate end of all revolutionary social change is to establish the sanctity of human life, the dignity of man, the right of every human being to liberty and well-being.",Emma Goldman,"Life, Man, Well-Being"
"It was fans... who understood 'Star Trek' and brought it back to life. 'Hill Street Blues,' 'The Paper Chase,' and 'Til Fly Away' all got second chances... So did 'Gunsmoke' and 'Cheers.' It's very hard to change a network's mind, but it can be done.",John de Lancie,"Life, Done, Fly"
"The terrorists thought they would change my aims and stop my ambitions, but nothing changed in my life except this: weakness, fear and hopelessness died. Strength, power and courage were born.",Malala Yousafzai,"Life, Courage, Strength"
"I'm a Gemini, so I change my mind every day.",Natalie Portman,"Day, Mind, Every Day"
The whole idea of deterrence is to convince your enemy that you are willing and able to make it so painful for them to continue on a threatening or bellicose course that they change their behavior.,Martha McSally,"Your, Behavior, Enemy"
"Climate changes are caused by solar radiation and other natural phenomena, so I don't worry one bit about that. Nothing we do can change anything in the climate.",Varg Vikernes,"Nothing, Worry, Solar"
"When you're a catalyst for change, you make enemies - and I'm proud of the ones I've got.",Rupert Murdoch,"Enemies, Proud, Make"
"My goal for the #1000BlackGirlBooks campaign is to create systemic change across all school systems. I want there to be diverse books that reflect the lives of every person, regardless of whether or not they are in the majority.",Marley Dias,"Person, School, Create"
The world will always need revolution. That doesn't mean shooting and violence. A revolution is when you change your thinking. Confucianism and Christianity were both revolutionary.,Jose Mujica,"Always, Your, World"
Some people change when they think they're a star or something.,Paris Hilton,"People Change, People, Some People"
"The speed of change today is faster than the human psyche seems able to handle, and it's increasingly difficult to reconcile the rhythms of our personal lives with the rapidity of a twenty-four-hour news cycle.",Marianne Williamson,"Today, Difficult, News"
"Poetry is not only dream and vision; it is the skeleton architecture of our lives. It lays the foundations for a future of change, a bridge across our fears of what has never been before.",Audre Lorde,"Future, Poetry, Architecture"
Time does not change us. It just unfolds us.,Max Frisch,"Time, Us, Just"
"If you don't change, you're dead, so I try to keep changing.",Wavy Gravy,"Try, Keep, Dead"
There's a lot of politics in the Rock and Roll Hall of Fame. There's a lot us artists would change about the induction ceremony and who they pick.,Joe Walsh,"Politics, Rock And Roll, Fame"
"Nothing is as real as a dream. The world can change around you, but your dream will not. Your life may change, but your dream doesn't have to. Responsibilities need not erase it. Duties need not obscure it.",Tom Clancy,"Life, Your, World"
"Win as if you were used to it, lose as if you enjoyed it for a change.",Ralph Waldo Emerson,"Lose, Win, Enjoyed"
"Real, sustainable community change requires the initiative and engagement of community members.",Helene D. Gayle,"Community, Real, Initiative"
"Now is not the time for us to shy away from challenging ourselves to make substantive change for the better. We have the opportunity to raise the bar in the faith-based world by forging a culture in which inclusivity, diversity, and equality are paramount.",Lynn Schusterman,"Time, Equality, Culture"
"One of my favorite things about what I do for a living is that there is no certainty that, at any hour of any day, I could get a phone call that could change everything. Good or bad. I never know.",Samm Levine,"Good, Day, Bad"
"One thing I'm not going to do is change up anything. Like, I'm always gonna be me.",Trippie Redd,"Always, Me, Anything"
"I like to say that the greatest handicap of deafness does not lie in the ear, it lies in the mind. I hope that through my example, such as my role on 'The West Wing,' I can help change attitudes on deafness and prove we can really do everything... except hear.",Marlee Matlin,"Hope, Mind, Lie"
"I'm confident in who I am. I've come to a place in my life where I've accepted things that are me, as opposed to feeling pressure to explain myself to people around me. That's just the way I've always tried to be. It didn't change when I became a star.",Lady Gaga,"Life, Myself, Always"
"Usually when people are sad, they don't do anything. They just cry over their condition. But when they get angry, they bring about a change.",James Russell Lowell,"Sad, Anger, Angry"
"Each new generation of children grows up in the new environment its parents have created, and each generation of brains becomes wired in a different way. The human mind can change radically in just a few generations.",Alison Gopnik,"Mind, Parents, Generation"
"Maybe you're not perfect, but you're willing to actually look at yourself and take some kind of accountability. That's a change. It might not mean that you can turn everything around, but I think there's something incredibly hopeful about that.",Brie Larson,"Not Perfect, Yourself, Look"
"All parents all over the world want their children to lead a better life than themselves, but they need to believe that change is possible.",Shukla Bose,"Life, Believe, World"
"I don't think my personality will change. No matter how much time passes or how old I get, I'd like to be considered a playful person to everyone.",Kim Tae-hyung,"Time, Personality, Matter"
"They are allowing young kids in primary school to be able to have the permission to change their gender if they want by taking away the permission of the parents. They are trying to take control, as a government, to make those decisions for young kids who are basically 16 years old, or young.",Israel Folau,"Government, Parents, Control"
"Complainers change their complaints, but they never reduce the amount of time spent in complaining.",Mason Cooley,"Time, Never, Complaining"
"Remember, each one of us has the power to change the world. Just start thinking peace, and the message will spread quicker than you think.",Yoko Ono,"Power, Peace, World"
"To change the media, you're gonna have to totally throw out every journalism school and get rid of everybody in every newsroom, and then you're gonna have to change the grade school and middle school and high school curriculum.",Rush Limbaugh,"Journalism, Media, School"
"If people don't vote, everything stays the same. You can protest until the sky turns yellow or the moon turns blue, and it's not going to change anything if you don't vote.",Dolores Huerta,"Sky, Moon, Blue"
"We will hire someone with less experience, less education, and less expertise than someone who has more of those things and has a rotten attitude. Because we can train people. We can teach people how to lead. We can teach people how to provide customer service. But we can't change their DNA.",Herb Kelleher,"Attitude, Education, Experience"
"If the pace of change outside is moving more quickly than the pace of change inside, you get a bit left behind.",Steve Easterbrook,"Moving, Behind, Outside"
Change can be for good if you combine audacity with safety.,Pedro Sanchez,"Good, Safety, Audacity"
"People talk about tactics, but when you look at it, tactics are just players. You change things so that the team can get the most out of the skills they have to offer, but you don't go any further than that.",Pep Guardiola,"Look, People, Talk"
"The only way to permanently change the temperature in the room is to reset the thermostat. In the same way, the only way to change your level of financial success 'permanently' is to reset your financial thermostat. But it is your choice whether you choose to change.",T. Harv Eker,"Success, Finance, Your"
"My main goal in life is to be happy. If I can make other people happy by doing what I love, then I feel like I've done everything in life that I've wanted. I just want to make people feel good and change people's lives with music, and that's it.",Cyrille Aimee,"Life, Love, Good"
I want society to feel they are part of a process of change.,Gonzalo Sanchez de Lozada,"Society, Process, Feel"
"Now, I have always believed that women are not victims; we are agents of change, we are drivers of progress, we are makers of peace - all we need is a fighting chance.",Hillary Clinton,"Women, Peace, Chance"
"Epigenetics doesn't change the genetic code, it changes how that's read. Perfectly normal genes can result in cancer or death. Vice-versa, in the right environment, mutant genes won't be expressed. Genes are equivalent to blueprints; epigenetics is the contractor. They change the assembly, the structure.",Bruce Lipton,"Death, Result, Right"
Instead of focusing on that circumstances that you cannot change - focus strongly and powerfully on the circumstances that you can.,Joy Page,"Focus, Circumstances, Cannot"
"I don't think people change; electronics change, the things we have change, but the way we live doesn't change.",Judy Blume,"Way, People Change, People"
There is at least one point in the history of any company when you have to change dramatically to rise to the next level of performance. Miss that moment - and you start to decline.,Andy Grove,"History, Moment, Start"
People are always telling me that change is good. But all that means is that something you didn't want to happen has happened.,Meg Ryan,"Good, Always, Me"
"From time to time, you have seminal personalities who really change the way the world sees itself - people like Gandhi, Martin Luther King, Nelson Mandela. Warren Buffett is that kind of person in the business world.",Guy Spier,"Time, Business, King"
In the long term we can hope that religion will change the nature of man and reduce conflict. But history is not encouraging in this respect. The bloodiest wars in history have been religious wars.,Richard M. Nixon,"Nature, Hope, History"
"It's so different when you change your hair color, you're treated so differently. It's a very funny experience. It's fun - I love changing up my hair.",Kate Bosworth,"Funny, Love, Experience"
I stand before you a changed man. Use me as an example of an instrument of change.,Michael Vick,"Man, Me, Stand"
I don't think you can create art out of anger; it has to come out of some form of understanding. You have to feel good about who you are and that you could do something to change things.,Faith Ringgold,"Good, Art, Anger"
"But I think it's more that when you're young, you're invincible, you're immortal - or at least you think you are. The possibilities are limitless, you're inventing the future. Then you get older and suddenly you have a history. It's fixed. You can't change anything. I find that a bit disturbing, to be honest.",Damien Hirst,"Future, History, Find"
"As a leader, the first person I need to lead is me. The first person that I should try to change is me.",John C. Maxwell,"Me, Try, Person"
"The reason I got into filmmaking was super naive: to change the world, you know? To really make the voices that we don't get to hear heard and the images and the stories that we don't get to see seen. I would like to normalize that.",Melina Matsoukas,"World, Change The World, Know"
Vengeance is not the point; change is. But the trouble is that in most people's minds the thought of victory and the thought of punishing the enemy coincide.,Barbara Deming,"Victory, Enemy, People"
"The Internet's a driving force in the change from mass media to 'my media,' in which consumers will be their own programmers.",Jerry Yang,"Internet, Media, Will"
"I've always been interested in public health approaches because it seems to me we have this yearning for silver bullets, and that is not in fact how change comes about. Change comes through silver buckshot - a lot of little things that achieve results. That's a classic public health approach.",Nicholas Kristof,"Health, Always, Me"
I wanted to use sports for social change.,Billie Jean King,"Sports, Social Change, Use"
The heart of man will always be dark. There will always be evil people. The problem is that there is nothing we can humanly do to change them.,Leon Bridges,"Always, Heart, Man"
Pop music has greater power to change people and to affect people because it's a universal language. You don't have to understand music to understand the power of a pop song.,Paul Epworth,"Power, Music, Song"
"Although circumstances may change in the blink of an eye, people change at a slower pace. Even motivated people who welcome change often encounter stumbling blocks that make transformation more complicated than they'd originally anticipated.",Amy Morin,"Welcome, Transformation, People Change"
"If there's something in your life that you know needs changing, make sure you change it before God's got to change it. Because if God's got to change it, you ain't going to like it.",Ray Lewis,"Life, God, Your"
The universe is change; our life is what our thoughts make it.,Marcus Aurelius,"Life, Thoughts, Universe"
Some things never change and the intriguing things you fall in love with will become the things you don't like.,Courteney Cox,"Love, Will, Fall"
"Donald Trump is a symptom, not a disease. The disease is the death of real political conservatism: a cool, intelligent reluctance to believe that all change is good, a love for the established, the particular, and the well-worn.",Peter Hitchens,"Love, Death, Good"
I know that my race must change.,Chief Joseph,"Know, Race, Must"
"I think the tiniest little thing can change the course of your day, which can change the course of your year, which can change who you are.",Taylor Swift,"Your, Day, Think"
"What matters is this: Being fearless of failure arms you to break the rules. In doing so, you may change the culture and just possibly, for a moment, change life itself.",Malcolm Mclaren,"Life, Failure, Culture"
"Change makes you find your calling, your legacy, and God's divine plan for your life. Don't run from it.",Iman,"Life, God, Your"
There is no fundamental social change by being simply of individual and interpersonal actions. You have to have organizations and institutions that make a fundamental difference.,Cornel West,"Difference, Social Change, Make"
"I am who I am, and I can't change that. It's not something I've labored over.",Nick Jonas,"I Am, Something, Who"
"I can't change history, I don't want to change history. I can only change the future. I'm working on that.",Boris Becker,"Future, History, I Can"
Great companies start because the founders want to change the world... not make a fast buck.,Guy Kawasaki,"Great, World, Change The World"
The Titanic hit the iceberg not because they could not see it coming but because they could not change direction.,Dean Devlin,"Direction, Coming, See"
