title,author,tags
"Change is never easy, and it often creates discord, but when people come together for the good of humanity and the Earth, we can accomplish great things.",David Suzuki,"Good, Great, Together"
"Prayer does not change God, but it changes him who prays.",Soren Kierkegaard,"God, Religion, Prayer"
No real social change has ever been brought about without a revolution... revolution is but thought carried into action.,Emma Goldman,"Politics, Action, Revolution"
I don't know that love changes. People change. Circumstances change.,Nicholas Sparks,"Love, People Change, Know"
"As nightfall does not come at once, neither does oppression. In both instances, there is a twilight when everything remains seemingly unchanged, and it is in such a twilight that we all must be most aware of change in the air - however slight - lest we become unwitting victims of darkness.",William O. Douglas,"Darkness, Oppression, Air"
"When you change the way you think, you can change the way you feel.",David D. Burns,"Way, Feel, Think"
"The robots are coming, whether we like it or not, and will change our economy in dramatic ways.",Kristen Soltis Anderson,"Will, Robots, Coming"
"Our thoughts are mainly controlled by our subconscious, which is largely formed before the age of 6, and you cannot change the subconscious mind by just thinking about it. That's why the power of positive thinking will not work for most people. The subconscious mind is like a tape player. Until you change the tape, it will not change.",Bruce Lipton,"Positive, Work, Power"
"The most important thing about global warming is this. Whether humans are responsible for the bulk of climate change is going to be left to the scientists, but it's all of our responsibility to leave this planet in better shape for the future generations than we found it.",Mike Huckabee,"Future, Environmental, Responsibility"
"I think music is the greatest art form that exists, and I think people listen to music for different reasons, and it serves different purposes. Some of it is background music, and some of it is things that might affect a person's day, if not their life, or change an attitude. The best songs are the ones that make you feel something.",Eddie Vedder,"Life, Attitude, Best"
"This stand wasn't because I feel like I'm being put down in any kind of way. This is because I'm seeing things happen to people that don't have a voice: people that don't have a platform to talk and have their voices heard and affect change. So I'm in the position where I can do that, and I'm going to do that for people that can't.",Colin Kaepernick,"Voice, Stand, Way"
"I'm definitely open to change, but at the same time I am quite stubborn.",Andy Murray,"Time, I Am, Stubborn"
"If you skew the endocrine system, you lose the pathways to self. When endocrine patterns change, it alters the way you think and feel. One shift in the pattern tends to trip another.",Hilary Mantel,"Lose, Way, Feel"
"If I want to knock a story off the front page, I just change my hairstyle.",Hillary Clinton,"Funny, Story, Hairstyle"
"We are all born with a unique genetic blueprint, which lays out the basic characteristics of our personality as well as our physical health and appearance... And yet, we all know that life experiences do change us.",Joan D. Vinge,"Life, Health, Personality"
"Like the Internet, Bitcoin will change the way people interact and do business around the world.",Erik Voorhees,"Business, Internet, Bitcoin"
"Fashion is a way to transform yourself. By choosing your own silhouette and shape, you can constantly change who you are.",Christine and the Queens,"Your, Yourself, Silhouette"
The power of social media is it forces necessary change.,Erik Qualman,"Power, Social Media, Media"
The great growling engine of change - technology.,Alvin Toffler,"Technology, Great, Engine"
"Music is sunshine. Like sunshine, music is a powerful force that can instantly and almost chemically change your entire mood. Music gives us new energy and a stronger sense of purpose.",Michael Franti,"Music, Your, Sunshine"
"When we change the way we communicate, we change society.",Clay Shirky,"Society, Way, Communicate"
"Negative emotions like loneliness, envy, and guilt have an important role to play in a happy life; they're big, flashing signs that something needs to change.",Gretchen Rubin,"Life, Loneliness, Emotions"
Climate change knows no borders. It will not stop before the Pacific islands and the whole of the international community here has to shoulder a responsibility to bring about a sustainable development.,Angela Merkel,"Community, Responsibility, Will"
Change comes from reflection.,Genesis P-Orridge,Reflection
I was born not knowing and have had only a little time to change that here and there.,Richard P. Feynman,"Time, Born, Not Knowing"
"If you want to have clean ideas, change them as often as your shirt.",Francis Picabia,"Your, Shirt, Ideas"
"One encounter with Jesus Christ is enough to change you, instantly, forever.",Luis Palau,"Jesus Christ, Enough, Forever"
What is necessary to change a person is to change his awareness of himself.,Abraham Maslow,"Awareness, Person, Necessary"
"You are never too young to learn, never too old to change.",Russell M. Nelson,"Never, Young, Old"
"You don't have the same mentality as you did five years ago - even one year. People are always changing, and I believe that everyone deserves the space to change and for people to recognize their change.",Bad Bunny,"Space, Always, Believe"
"No one wants to die. Even people who want to go to heaven don't want to die to get there. And yet death is the destination we all share. No one has ever escaped it. And that is as it should be, because Death is very likely the single best invention of Life. It is Life's change agent. It clears out the old to make way for the new.",Steve Jobs,"Life, Best, Death"
Teachers can change lives with just the right mix of chalk and challenges.,Joyce Meyer,"Teacher, Challenges, Right"
"When two people talk with mutual respect and listen with a real interest in understanding another point of view, when they try to put themselves in the place of another, to get inside their skin, they change the world, even if it is only by a minute amount, because they are establishing equality between two human beings.",Theodore Zeldin,"Equality, Respect, World"
"It's always good to change and keep things fresh, whether it's a hairstyle or wardrobe.",Sheamus,"Good, Always, Keep"
"As life runs on, the road grows strange with faces new - and near the end. The milestones into headstones change, Neath every one a friend.",James Russell Lowell,"Life, Milestones, Road"
"Men make history and not the other way around. In periods where there is no leadership, society stands still. Progress occurs when courageous, skillful leaders seize the opportunity to change things for the better.",Harry S Truman,"Leadership, Courage, History"
"Make no mistake about it: Change is hard, but change is necessary.",Lori Lightfoot,"Mistake, Hard, Make"
"Our economic system, run for profit and waste and based primarily on the extractive industries, is the cause of climate change. We have wasted the earth's treasure and we can no longer exploit it cheaply.",Vivienne Westwood,"Climate Change, Treasure, Earth"
"If you don't like how things are, change it! You're not a tree.",Jim Rohn,"Motivational, Tree, Things"
Change is the end result of all true learning.,Leo Buscaglia,"Education, Learning, Result"
"Terrorism is a psychological warfare. Terrorists try to manipulate us and change our behavior by creating fear, uncertainty, and division in society.",Patrick J. Kennedy,"Society, Fear, Uncertainty"
Only idiots refuse to change their minds.,Brigitte Bardot,"Idiots, Only, Refuse"
"Climate change is a terrible problem, and it absolutely needs to be solved. It deserves to be a huge priority.",Bill Gates,"Environmental, Climate Change, Climate"
"Peace, unity, love, and nonviolence should be our rallying cry and the catalyst for change in our nation.",Tony Evans,"Love, Peace, Unity"
We shall never change our political leaders until we change the people who elect them.,Mark Skousen,"Political, Political Leaders, People"
"Sports is the common denominator in the world that brings everyone together. If there's any one place in the world where there is equality, it is probably sports. That was something that didn't always exist. We've come a long way in sports. Why can't society use sports as a way to bring people together and create change?",Stephen M. Ross,"Equality, Society, Sports"
"Whenever you're feeling moments of discomfort, that means true change is happening for you.",John David Washington,"True, Feeling, Discomfort"
The reality is that the only way change comes is when you lead by example.,Anne Wojcicki,"Reality, Way, Lead"
"Change is the only constant, whether it's in music, culture, dance or fashion.",Sonu Nigam,"Music, Culture, Dance"
The only person who is educated is the one who has learned how to learn and change.,Carl Rogers,"Education, Person, Educated"
"My dad always said, 'Don't worry what people think, because you can't change it.'",Daisy Donovan,"Dad, Always, Worry"
"Climate change is the environmental challenge of this generation, and it is imperative that we act before it's too late.",John Delaney,"Environmental, Challenge, Generation"
"You can change your world by changing your words... Remember, death and life are in the power of the tongue.",Joel Osteen,"Life, Communication, Death"
"Certainly, travel is more than the seeing of sights; it is a change that goes on, deep and permanent, in the ideas of living.",Mary Ritter Beard,"Travel, Living, Ideas"
"Mum didn't have shoes. She was the eldest of 10 kids, and some nights they went without food. That's why, from a young age, I wanted to work hard and change that cycle, to provide not only for my parents but my siblings, too.",Israel Folau,"Work, Age, Food"
"I can't change the past, but one person can change the future - anything can happen.",Paul Mooney,"Future, Past, Person"
"Everybody is going to have an opinion on you; not everyone is going to like you. You can't live your life based on other people's opinions of you or let that change what you do or how you feel about yourself, because then you're not living.",Rumer Willis,"Life, Your, Yourself"
"No one can persuade another to change. Each of us guards a gate of change that can only be opened from the inside. We cannot open the gate of another, either by argument or emotional appeal.",Marilyn Ferguson,"Gate, Argument, Open"
"Exploring and colonizing Mars can bring us new scientific understanding of climate change, of how planet-wide processes can make a warm and wet world into a barren landscape. By exploring and understanding Mars, we may gain key insights into the past and future of our own world.",Buzz Aldrin,"Future, World, Past"
"As the world we live in is so unpredictable, the ability to learn and to adapt to change is imperative, alongside creativity, problem-solving, and communication skills.",Alain Dehaze,"Communication, World, Creativity"
"I realized if you can change a classroom, you can change a community, and if you change enough communities you can change the world.",Erin Gruwell,"Community, World, Change The World"
"We cannot change the political system, we cannot change the economic system, we cannot change the social system, until the people control the land, and then we take it out of the hands of that sick minority that chooses to pervert the meaning and the intention of humanity.",John Trudell,"Political, Humanity, Control"
One good teacher in a lifetime may sometimes change a delinquent into a solid citizen.,Philip Wylie,"Good, Teacher, Good Teacher"
Life is tough - and you have to be tougher than life to change the world.,Sebastian Pinera,"Life, World, Change The World"
"If you begin to understand what you are without trying to change it, then what you are undergoes a transformation.",Jiddu Krishnamurti,"Transformation, Trying, Understand"
"If you don't like the way the world is, you change it. You have an obligation to change it. You just do it one step at a time.",Marian Wright Edelman,"Time, Step, World"
"Human settlements are like living organisms. They must grow, and they will change. But we can decide on the nature of that growth - on the quality and the character of it - and where it ought to go. We don't have to scatter the building blocks of our civic life all over the countryside, destroying our towns and ruining farmland.",James Howard Kunstler,"Life, Nature, Growth"
There are many things we do not want about the world. Let us not just mourn them. Let us change them.,Ferdinand Marcos,"World, Things, Us"
"Media is a double-edged sword and has the power to change hearts and minds through authentic storytelling as well as the power to paint a person, or an entire community, in a dim and misleading light.",Angelica Ross,"Power, Light, Community"
"Change is definitely every day. It's an ever-changing world. Everything changes, so I really don't know. I just hope I become a better person, a better man.",J.I.D,"Hope, Man, Day"
"Real change is always violent, but it may hurt a lot less than what's in place before the violence occurs.",John Edgar Wideman,"Always, Violence, Hurt"
"If anything is certain, it is that change is certain. The world we are planning for today will not exist in this form tomorrow.",Phil Crosby,"Today, Tomorrow, World"
"Failure is not fatal, but failure to change might be.",John Wooden,"Failure, Might, Fatal"
"We live in a changing world, but we need to be reminded that the important things have not changed, and the important things will not change if we keep our priorities in proper order.",S. Truett Cathy,"World, Will, Keep"
"Change is inevitable, and you can't stop that change. You say, 'Wait, stop,' and it just drives right over you.",Randy Bachman,"Wait, Stop, Right"
"God, give us grace to accept with serenity the things that cannot be changed, courage to change the things which should be changed and the wisdom to distinguish the one from the other.",Reinhold Niebuhr,"Wisdom, Courage, God"
"Money is always there but the pockets change; it is not in the same pockets after a change, and that is all there is to say about money.",Gertrude Stein,"Money, Always, Say"
"Art was, seriously, the only thing I'd ever wanted to own. It has always been for me a stable nourishment. I use it. It can change the way that I feel in the mornings.",David Bowie,"Art, Always, Me"
Enjoying success requires the ability to adapt. Only by being open to change will you have a true opportunity to get the most from your talent.,Nolan Ryan,"Success, Opportunity, Your"
"It hasn't always been easy. There's a lot of hard moments. Sometimes you learn from the end of the bench. Sometimes you learn from injuries. Sometimes you learn the most through the hard things. If you can keep a good attitude and keep on working, eventually situations change, and you can put those things to use.",Kyle Korver,"Attitude, Good, Always"
This life is a hospital in which every patient is possessed with a desire to change his bed.,Charles Baudelaire,"Life, Life Is A, Hospital"
There's a lot of things that need to change. One specifically? Police brutality.,Colin Kaepernick,"Police, Brutality, Things"
We can change the world if we change ourselves. We just need to get hold of the old patterns of thinking and dealing with things and start listening to our inner voices and trusting our own superpowers.,Nina Hagen,"World, Thinking, Change The World"
"I had been educated in the rhythms of the mountain, rhythms in which change was never fundamental, only cyclical. The same sun appeared each morning, swept over the valley, and dropped behind the peak. The snows that fell in winter always melted in the spring.",Tara Westover,"Morning, Always, Spring"
Empathy is the starting point for creating a community and taking action. It's the impetus for creating change.,Max Carver,"Community, Empathy, Action"
"Life is full of tough decisions, and nothing makes them easy. But the worst ones are really your personal koans, and tormenting ambivalence is just the sense of satori rising. Try, trust, try, and trust again, and eventually you'll feel your mind change its focus to a new level of understanding.",Martha Beck,"Life, Trust, Your"
The good and bad things are what form us as people... change makes us grow.,Kate Winslet,"Good, Grow, Bad"
Change is always good. It brings you to a new place.,Lee Ranaldo,"Good, Always, New"
"I've always been the type that, every few months, I'm like, 'Let's change the haircut one more time.'",Coco Rocha,"Time, Always, Haircut"
"I change my style maybe every month. I'm, like, punk one month, ghetto fab the next, classy the next. I'm just young and finding out who I am.",Kylie Jenner,"I Am, Classy, Style"
There is no question that climate change is happening; the only arguable point is what part humans are playing in it.,David Attenborough,"Climate Change, Climate, Point"
"Change can be frightening, and the temptation is often to resist it. But change almost always provides opportunities - to learn new things, to rethink tired processes, and to improve the way we work.",Klaus Schwab,"Work, Always, Tired"
"It's important to think good, speak good, and do good. If we want to see positive change in the world, then we need to connect to goodness. I try in everything I do, both in business and philanthropy, to make a positive change and do that by doing good.",Shari Arison,"Positive, Good, Business"
Our only security is our ability to change.,John Lilly,"Security, Ability, Only"
You cannot carry out fundamental change without a certain amount of madness.,Thomas Sankara,"Madness, Cannot, Carry"
The way to change the world is through individual responsibility and taking local action in your own community.,Jeff Bridges,"Your, Community, Responsibility"
"Climate change is the Everest of all problems, the thorniest challenge facing humankind.",Lewis Gordon Pugh,"Problems, Challenge, Climate Change"
"Real change occurs from the bottom up; it occurs person to person, and it almost always occurs in small groups and locales and then bubbles up and aggregates to larger vectors of change.",Paul Hawken,"Always, Person, Real"
Repentance means you change your mind so deeply that it changes you.,Bruce Wilkinson,"Your, Mind, Repentance"
"People with high blood pressure, diabetes - those are conditions brought about by life style. If you change the life style, those conditions will leave.",Dick Gregory,"Life, Pressure, Will"
A zebra does not change its spots.,Al Gore,"Spots, Does"
"If you want to change the world, start off by making your bed.",William H. McRaven,"Your, World, Change The World"
Climate change is destroying our path to sustainability. Ours is a world of looming challenges and increasingly limited resources. Sustainable development offers the best chance to adjust our course.,Ban Ki-moon,"Best, Chance, Path"
The first resistance to social change is to say it's not necessary.,Gloria Steinem,"Politics, First, Social Change"
"The proud do not change to improve, but defend their position by rationalizing. Repentance means change, and it takes a humble person to change.",Ezra Taft Benson,"Humble, Repentance, Proud"
"In a liquid modern life there are no permanent bonds, and any that we take up for a time must be tied loosely so that they can be untied again, as quickly and as effortlessly as possible, when circumstances change - as they surely will in our liquid modern society, over and over again.",Zygmunt Bauman,"Life, Time, Society"
"Hair color is the easiest way to change your appearance, but a bad dye job might draw more attention to you.",Lisa Lutz,"Your, Hair, Bad"
"Don't underestimate the power of your vision to change the world. Whether that world is your office, your community, an industry or a global movement, you need to have a core belief that what you contribute can fundamentally change the paradigm or way of thinking about problems.",Leroy Hood,"Power, Vision, Your"
"I feel like music can affect you in so many ways. When you hear a song with a happy melody, it can change your mood; it can change your day.",Kygo,"Music, Your, Day"
"When you start in life, if you find you are wrongly placed, don't hesitate to change, but don't change because troubles come up and difficulties arise. You must meet and overcome and conquer them. And in meeting and overcoming and conquering them, you will make yourself stronger for the future.",Charles M. Schwab,"Life, Future, Yourself"
"The truth doesn't change. It was the same when Moses got the Ten Commandments as it is today. That's the thing about the truth. That's the thing about real. It doesn't change and it doesn't have to change. Now you can put it in a different book, but it's still real. It's still the truth.",DMX,"Truth, Today, Real"
"When I was in college, I wanted to be involved in things that would change the world.",Elon Musk,"Teen, World, Change The World"
"Few will have the greatness to bend history itself; but each of us can work to change a small portion of events, and in the total; of all those acts will be written the history of this generation.",Robert Kennedy,"Work, History, Greatness"
The key to change... is to let go of fear.,Rosanne Cash,"Fear, Go, Key"
"Try to realize it's all within yourself no one else can make you change, and to see you're only very small and life flows on within you and without you.",George Harrison,"Life, Yourself, Try"
"Prayer doesn't just change things - it changes us. If we are diligent in seeking God, slowly and surely we become better people.",Joyce Meyer,"God, Prayer, Better"
The question is not whether we are able to change but whether we are changing fast enough.,Angela Merkel,"Enough, Fast, Question"
"You can't change somebody's character, but you can change the way a person presents themselves.",Paul Manafort,"Character, Way, Person"
"The leaders who we admire who have been able to bring great change in the past - Gandhi, Martin Luther King, Nelson Mandela - they're all inspirational religious leaders and smart tacticians. It would be nice to find the Muslim Gandhi, wouldn't it?",Dennis C. Blair,"Inspirational, Great, Smart"
"We always make so many excuses for ourselves - 'I'm so busy, I'm so tired, I don't want to do it.' You know? 'I'm passionate about it, but I'm not going to be the person that changes things.' Why do we tell ourselves that? We totally could. There are so many people who are making so much change just because they're passionate.",Cameron Boyce,"Always, Busy, Tired"
Weight loss can change your whole character. That always amazed me: Shedding pounds does change your personality. It changes your philosophy of life because you recognize that you are capable of using your mind to change your body.,Jean Nidetch,"Life, Personality, Always"
"If you love someone - like, truly love someone - I don't think that ever goes away. But what does change is your perspective on the relationship and the dynamic.",Noah Centineo,"Love, Relationship, Your"
Every single person has the power to change the world and help people.,Laura Marano,"Power, World, Change The World"
"Help young people. Help small guys. Because small guys will be big. Young people will have the seeds you bury in their minds, and when they grow up, they will change the world.",Jack Ma,"World, Change The World, Grow"
"When you can't change what's bothering you, one typical response is to convince yourself that it doesn't actually bother you.",Stephanie Coontz,"Yourself, Convince, Bother"
"You may not be able to change the world, but at least you can embarrass the guilty.",Jessica Mitford,"World, Change The World, Guilty"
"There is no progress without risk, and in an environment where change is accelerating, risks are multiplying and businesses are increasingly complex, companies need strong, innovative partners to help manage their risk. Our brand clearly sets XL apart as the strong, innovative partner needed in today's market.",Mike McGavick,"Today, Progress, Risks"
"I've heard people say South Africans are arrogant, that they act no differently from their colonial masters. That needs to change. It's in your business interest as an entrepreneur to form meaningful partnerships. That's how you do well for your shareholders.",Patrice Motsepe,"Business, Your, People"
"I'm saying to be a hero is means you step across the line and are willing to make a sacrifice, so heroes always are making a sacrifice. Heroes always take a risk. Heroes always deviant. Heroes always doing something that most people don't and we want to change - I want to democratise heroism to say any of us can be a hero.",Philip Zimbardo,"Always, Hero, Sacrifice"
The moment of change is the only poem.,Adrienne Rich,"Poetry, Moment, Only"
"We stand united, facing the big responsibility to change our country into a nation of justice, solidarity, humanity and green development.",George Papandreou,"Justice, Responsibility, Green"
"It's always better to shock people and change people's expectations than to give them exactly what they think you can do. It's not unexpected for me to be in a comedy film anymore; I'm no longer the underdog in that world. Not that I'm great or good at it or anything, it's just that I've done a bunch of them, so you're not shocked.",Jonah Hill,"Good, Great, Done"
"I am unapologetic about the need for social change, greater inclusion, and equity.",Marley Dias,"I Am, Inclusion, Equity"
"Without change there is no innovation, creativity, or incentive for improvement. Those who initiate change will have a better opportunity to manage the change that is inevitable.",William Pollard,"Opportunity, Improvement, Better"
"No economy can succeed without a high-quality workforce, particularly in an age of globalization and technical change.",Ben Bernanke,"Age, Globalization, Succeed"
