title,author,tags
"Things change all the time, and they'll probably never be the same again. It's just the natural evolution of the human condition. Things change, and whatever it is is what it is. I mean, you try to start second guessing that, you either get rich or die broke.",Guy Clark,"Time, Die, Rich"
"We should learn to accept that change is truly the only thing that's going on always, and learn to ride with it and enjoy it.",Alice Walker,"Always, Ride, Accept"
"Achievers have an enabling attitude, realism, and a conviction that they themselves were the laboratory of innovation. Their ability to change themselves is central to their success. They have learned to conserve their energy by minimizing the time spent in regret or complaint. Every event is a lesson to them, every person a teacher.",Marilyn Ferguson,"Attitude, Success, Time"
My view of myself doesn't change. I know who I am. I'm Cuban American; both my parents are Cuban - one was a little browner than the other one. That's who I am. I feel sorry that it's taken so long for the film industry to figure it out and to catch up.,Gina Torres,"Myself, Long, Parents"
Your surroundings may change but your essence and your personality pretty much stay the same.,Jenna Dewan,"Personality, Your, May"
Either you change with the times or you get rolled over.,B. J. Armstrong,"Either, Over, Get"
You really can change the world if you care enough.,Marian Wright Edelman,"World, Change The World, Care"
You don't have to be the Dalai Lama to tell people that life's about change.,John Cleese,"Life, People, Tell"
TikTok helped me change my life. TikTok brought my song to several different audiences at once.,Lil Nas X,"Life, Me, Song"
"We are not victims of aging, sickness and death. These are part of scenery, not the seer, who is immune to any form of change. This seer is the spirit, the expression of eternal being.",Deepak Chopra,"Death, Scenery, Sickness"
Change is not merely necessary to life - it is life.,Alvin Toffler,"Life, Necessary, Merely"
"I think the thing about love is that even though the things around us change, we as human beings, a lot of the ways we interact, and the ways we love each other is timeless. It requires trust, honesty, commitment, romance, and physical chemistry.",John Legend,"Love, Trust, Love Is"
"The middle way is a view of life that avoids the extreme of misguided grasping born of believing there is something we can find, or buy, or cling to that will not change. And it avoids the despair and nihilism born from the mistaken belief that nothing matters, that all is meaningless.",Sharon Salzberg,"Life, View, Nothing"
"I've never felt like I needed to change. I've always thought, 'If you want somebody different, pick somebody else.' But sure, criticism can sometimes still get to me. Some things are so malicious, they knock the wind out of you.",Melissa McCarthy,"Always, Wind, Me"
"Change doesn't always mean progress, but the status quo isn't always the best result either. It is merely the most convenient.",Harsha Bhogle,"Best, Always, Progress"
"Don't try to change anybody. And they should let you be yourself, 'You loved me when you met me, so let's keep going!'",Willie Nelson,"Keep Going, Yourself, Me"
"The rate of change is not going to slow down anytime soon. If anything, competition in most industries will probably speed up even more in the next few decades.",John P. Kotter,"Competition, Will, Slow"
"Aging gracefully means being flexible, being open, allowing change, enjoying change and loving yourself.",Wendy Whelan,"Yourself, Aging, Open"
"There is a lot of suffering and injustice in the world, and there is also a great deal of hope. When you step forward and start speaking about what you see and what you want to change, you can begin living in that hope instead of despair.",Sonita Alizadeh,"Hope, Great, Step"
"I studied to be a lawyer, and after that I did something, obviously, completely different. With change, you learn something. If you do the same thing over and over again, you never learn anything.",Andrea Bocelli,"Lawyer, Never, Anything"
'Tulip Fever' did change my life. It did that thing that sometimes happens when a book takes off - it opened doors on to whole other worlds.,Deborah Moggach,"Life, Tulip, My Life"
"By the time we see that climate change is really bad, your ability to fix it is extremely limited... The carbon gets up there, but the heating effect is delayed. And then the effect of that heat on the species and ecosystem is delayed. That means that even when you turn virtuous, things are actually going to get worse for quite a while.",Bill Gates,"Time, Your, Climate Change"
"Climate change is the greatest threat to humanity, perhaps ever. Global temperatures are rising at an unprecedented rate, causing drought and forest fires and impacting human health.",Cary Kennedy,"Health, Humanity, Climate Change"
"New Year's Day. A fresh start. A new chapter in life waiting to be written. New questions to be asked, embraced, and loved. Answers to be discovered and then lived in this transformative year of delight and self-discovery. Today carve out a quiet interlude for yourself in which to dream, pen in hand. Only dreams give birth to change.",Sarah Ban Breathnach,"Life, Dreams, New Year's"
A change of season calls for a change of scent that is both energizing and refreshing.,Hannah Bronfman,"Refreshing, Scent, Energizing"
"If I said it once, I'll say it again: 'We have the power to change everything.'",Yehuda Berg,"Power, Everything, Say"
For time and the world do not stand still. Change is the law of life. And those who look only to the past or the present are certain to miss the future.,John F. Kennedy,"Life, Future, Time"
"Climate change is a consequence of the build up of greenhouse gases over the past 200 years in the atmosphere, and virtually all these emissions came from the rich countries.",Gordon Brown,"Past, Rich, Climate Change"
"It seems to me that more and more we've come to expect less and less from each other, and I think that should change.",Aaron Sorkin,"Me, Think, More"
Desperation is the raw material of drastic change. Only those who can leave behind everything they have ever believed in can hope to escape.,William S. Burroughs,"Hope, Escape, Everything"
Everything will change. The only question is growing up or decaying.,Nikki Giovanni,"Will, Everything, Growing Up"
"The best way to change it is to do it. Right? And then after a while you become it, and it's easy.",Ursula Burns,"Best, Way, Easy"
"One of the most predictable things in life is there will be change. You are better off if you can have a say in the change. But you are ignorant or naive if you don't think there will be change, whether you want it to or not.",Julius Erving,"Life, Better, Will"
There are things I can't force. I must adjust. There are times when the greatest change needed is a change of my viewpoint.,Denis Diderot,"Adjust, Things, Must"
"One day, I know the struggle will change. There's got to be a change - not only for Mississippi, not only for the people in the United States, but people all over the world.",Fannie Lou Hamer,"Struggle, Day, World"
"It is often when night looks darkest, it is often before the fever breaks that one senses the gathering momentum for change, when one feels that resurrection of hope in the midst of despair and apathy.",Hillary Clinton,"Hope, Night, Gathering"
"It's funny how things change slowly, until the day we realize they've changed completely.",Nancy Gibbs,"Funny, Day, Things"
"Education is the key solution for change, for peace, and for help in the fight against racism and discrimination in general.",Clarence Seedorf,"Education, Peace, Fight"
"Americans have so far put up with inequality because they felt they could change their status. They didn't mind others being rich, as long as they had a path to move up as well. The American Dream is all about social mobility in a sense - the idea that anyone can make it.",Fareed Zakaria,"Path, Mind, Long"
"All we need, really, is a change from a near frigid to a tropical attitude of mind.",Marjory Stoneman Douglas,"Attitude, Mind, Need"
"What I'm asking for is hard. It's easier to be cynical; to accept that change isn't possible, and politics is hopeless, and to believe that our voices and actions don't matter. But if we give up now, then we forsake a better future.",Barack Obama,"Future, Politics, Believe"
"When I started coming to the U.S., they were offering me only the typical stereotypical roles: the druggard, the criminal, the gang member, or in the best-case scenario, the gardener or the cook. I was fed up with all these roles that were always the same. And I promised I would try to change the image of Latinos in Hollywood.",Eugenio Derbez,"Always, Me, Try"
"If only 7 percent of the 2 billion Christians in the world would care for a single orphan in distress, there would effectively be no more orphans. If everybody would be willing to simply do something to care for one of these precious treasures, I think we would be amazed by just how much we could change the world.",Steven Curtis Chapman,"World, Change The World, Care"
"The mind has exactly the same power as the hands; not merely to grasp the world, but to change it.",Colin Wilson,"Power, Mind, World"
"The central conservative truth is that it is culture, not politics, that determines the success of a society. The central liberal truth is that politics can change a culture and save it from itself.",Daniel Patrick Moynihan,"Success, Politics, Truth"
"That's something we real big on - just being real, authentic, being yourself, not letting this lifestyle change you.",YG,"Yourself, Lifestyle, Real"
"We don't hold anything back. We go for broke, and if we have a good idea for a story line, we just use it because you never know and because the dynamics of the show are going to change.",Josh Schwartz,"Good, Know, Never"
"The power of mathematics is often to change one thing into another, to change geometry into language.",Marcus du Sautoy,"Power, Mathematics, Language"
You are who you are and what you are because of what has gone into your mind. You can change who you are and what you are by changing what goes into your mind.,Zig Ziglar,"Your, Mind, Who"
We have to raise the consciousness; the only way poets can change the world is to raise the consciousness of the general populace.,Lawrence Ferlinghetti,"World, Change The World, Way"
"If you don't like Scottish weather, wait 30 minutes, and it is likely to change.",Raymond Bonner,"Weather, Wait, Like"
"The entire planet is drawn to Indian culture and soft power. The global community looks to us for solutions to international problems - whether terrorism, money laundering or climate change. In a globalised world, our responsibilities are also global.",Ram Nath Kovind,"Power, Money, Culture"
"Places change all the time, and the type of people who live there change.",Martin Parr,"Time, People, Live"
"If you embrace that the things that you can do are limitless, you can put your ding in the universe. You can change the world.",Tim Cook,"Your, World, Universe"
"Any revolutionary change must be preceded by a passive, affirmative, non-challenging attitude toward change among the mass of our people. They must feel so frustrated, so defeated, so lost, so futureless in the prevailing system that they are willing to let go of the past and chance the future.",Saul Alinsky,"Attitude, Future, Chance"
"I don't know what religious people do. I kind of wished I'd been a Christian with the blind faith that God is doing the right thing. As a Buddhist, you feel like you have more control over the situation, and that you can change your karma.",Marcia Wallace,"Faith, God, Your"
"Be greedy for social change, and your life will be endlessly enriched. The only failure lies in not trying, or giving up.",Ann Cotton,"Life, Failure, Your"
"In 1984, when I was a rookie member of the House, there was a bill introduced to make Martin Luther King's birthday a state holiday. It didn't have a chance. As time passed, though, more and more states adopted the holiday. Finally, after about five years, we passed it and, I think, almost unanimously. As I said, change is slow and hard.",John Grisham,"Birthday, Time, Chance"
Change before you're forced to change.,Roger Goodell,"Forced, Before, You"
"An Internet meme is a hijacking of the original idea. Instead of mutating by random change and spreading by a form of Darwinian selection, Internet memes are altered deliberately by human creativity. There is no attempt at accuracy of copying, as with genes - and as with memes in their original version.",Richard Dawkins,"Internet, Random, Creativity"
"Climate change, if unchecked, is an urgent threat to health, food supplies, biodiversity, and livelihoods across the globe.",John F. Kerry,"Health, Food, Climate Change"
You cannot change me; this is the way I am.,Marat Safin,"I Am, Me, Way"
What politicians want to create is irreversible change because when you leave office someone changes it back again.,Estelle Morris,"Politics, Politicians, Create"
"One volcano puts out more toxic gases - one volcano - than man makes in a whole year. And when you look at this 'climate change,' and when you look at the regular climate change that we all have in the world, we have warm and we have cooling spells.",John Raese,"Man, World, Look"
"We are volcanoes. When we women offer our experience as our truth, as human truth, all the maps change. There are new mountains.",Ursula K. Le Guin,"Women, Truth, Experience"
"A lot of people change for good. Some people just fall off. Just trying to progress in anything, no matter what you're doing, I feel like any progression you make some people aren't gonna be around you that were around you.",Dave East,"Good, Progress, Doing"
"You can't change anyone else, but people do change in relationship to your change.",Jack Canfield,"Relationship, Your, People"
"One of my greatest fears is not being able to change, to be caught in a never-ending cycle of sameness. Growth is so important.",Matt Dillon,"Growth, Important, Caught"
"The change I want to see is a start-up environment where everyone, regardless of gender and background, feels welcome and safe; where sexual harassment or discrimination will not impede great talent from producing great impact.",Christine Tsai,"Great, Welcome, Talent"
"I don't think fashion has to change every five minutes. I'd like these to be clothes you can wear for a long time - ten, 20 years; pass on to your daughter. Why buy vintage when you can open your own closet!",Tom Ford,"Time, Your, Long"
The blockchain is going to change everything more than the Internet has.,Brock Pierce,"Internet, Everything, Blockchain"
"You can't change nothing unless you want to change it, and then if you don't like whatever situation it is, just grow from it, learn from it, don't let it happen again.",Blac Chyna,"Grow, Nothing, Situation"
"Blockchain technology isn't just a more efficient way to settle securities. It will fundamentally change market structures, and maybe even the architecture of the Internet itself.",Abigail Johnson,"Technology, Architecture, Internet"
"As a rock star, I have two instincts, I want to have fun, and I want to change the world. I have a chance to do both.",Bono,"Chance, World, Change The World"
Solar power is going to be absolutely essential to meeting growing energy demands while staving off climate change.,Ramez Naam,"Power, Energy, Climate Change"
"Urbanization is not about simply increasing the number of urban residents or expanding the area of cities. More importantly, it's about a complete change from rural to urban style in terms of industry structure, employment, living environment and social security.",Li Keqiang,"Living, Style, Security"
A new car is not going to change your life.,Monica Ali,"Life, Car, Your"
I truly do feel like scent can change your mood and the feeling in a room.,Tish Cyrus,"Your, Mood, Feel"
Don't knock the weather; nine-tenths of the people couldn't start a conversation if it didn't change once in a while.,Kin Hubbard,"Nature, Weather, Start"
"I'm interested in things that change the world or that affect the future and wondrous, new technology where you see it, and you're like, 'Wow, how did that even happen? How is that possible?'",Elon Musk,"Future, Technology, World"
"There are women who make things better, there are women who change things, there are women who make things happen, who make a difference. I want to be one of those women.",Vera Farmiga,"Women, Better, Make A Difference"
Turbulence is life force. It is opportunity. Let's love turbulence and use it for change.,Ramsey Clark,"Life, Love, Opportunity"
"From the top of a high rock, I obtained a good few of the most extensive and dreary wilderness I ever beheld. It chilled the heart to gaze on these barrens of Labrador. Indeed, I now dread every change of harbor, so horridly rugged and dangerous is the whole coast and country to the eye, and to the experienced man either of the sea or the land.",John James Audubon,"Good, Heart, Man"
It is not strange... to mistake change for progress.,Millard Fillmore,"Progress, Mistake, Strange"
"As the time goes by, you change, your learn new things, your attitude is different. For the moment, I'm still enjoying ski racing so much that it would be difficult for me to think about ending my career.",Hermann Maier,"Attitude, Time, Moment"
"Most people don't like change. They revolt against it unless they can clearly see the advantage it brings. For that reason, when good leaders prepare to take action or make changes, they take people through a process to get them ready for it.",John C. Maxwell,"Good, Process, Action"
"As an explorer, I know firsthand there are many places in the ocean so full of life that they should be protected. Coral reefs and mangrove coastlines are stressed already by climate change and ocean acidification, and poor planning will just make their plight worse.","Philippe Cousteau, Jr.","Life, Will, Poor"
"We are legislators, not public works contractors. People look up to us to make serious laws that could change the lives of a great number of people or could change the way society is run or managed.",Miriam Defensor-Santiago,"Society, Great, Look"
"Motherhood has most definitely changed me and my life. It's so crazy how drastic even the small details change - in such an amazing way. Even silly things, like the fact that all of my pictures on my cell phone used to be of me at photo shoots - conceited, I know! - but now every single picture on my phone is of Mason.",Kourtney Kardashian,"Life, Amazing, Cell Phone"
"We are taught you must blame your father, your sisters, your brothers, the school, the teachers - but never blame yourself. It's never your fault. But it's always your fault, because if you wanted to change you're the one who has got to change.",Katharine Hepburn,"Motivational, Always, Your"
I never want to change so much that people can't recognize me.,Taylor Swift,"Me, People, Never"
I'm living with every step. I can't live with regret. The past is the past. I'm not worried about it. I can't change it. I can't fix it. It is what it is. I'm just living.,Ryan Sheckler,"Regret, Step, Past"
"People are spending way too much time thinking about climate change, way too little thinking about AI.",Peter Thiel,"Time, Thinking, Climate Change"
"People change with time. There are things that happened to a person in his childhood and years later they seem to him alien and strange. I am trying to decipher that child. Sometimes he is a stranger to me. When you think about when you were 14, don't you feel a certain alienation?",Gunter Grass,"Time, Childhood, I Am"
"My biggest song in the world is 'Nothing's Gonna Change My Love for You.' All over the world, it's number one on the whole planet.",George Benson,"Love, World, Song"
"The experience of reading a printed comic book will never change, but now, thanks to the digital age, there are many different ways to enjoy the same story. Digital comic books, of course, can be interactive in many different ways, allowing the reader to feel like a participant in the story.",Stan Lee,"Experience, Age, Will"
"Dictators are allergic to reform, and they are cunning survivors. They will do whatever it takes to preserve their power and wealth, no matter how much blood ends up on their hands. They are master deceivers and talented manipulators who cannot be trusted to change.",George Ayittey,"Power, Wealth, Matter"
"You can go slow. Allow your dreams and goals to change, but live an intentional life.",Kumail Nanjiani,"Life, Dreams, Your"
I believe activism is the true source of change in the world. Pushing to change social structures in communities that you are a part of is critical for making real lasting change.,Marley Dias,"Believe, World, True"
"Polls can change; people's opinions can change. Voting intentions can change, and I think it would be a silly leader, a silly political party, that would assume that we have it sewn up.",Nicola Sturgeon,"Political, People, Political Party"
"Effectively, change is almost impossible without industry-wide collaboration, cooperation and consensus.",Simon Mainwaring,"Impossible, Collaboration, Cooperation"
"Throughout the western world, new systems have risen up whose job is to constantly record and monitor the present - and then compare that to the recorded past. The aim is to discover patterns, coincidences and correlations, and from that, find ways of stopping change. Keeping things the same.",Adam Curtis,"World, Aim, Past"
"If you get stuck, draw with a different pen. Change your tools; it may free your thinking.",Paul Arden,"Your, Thinking, Pen"
I think music is an instrument. It can create the initial thought patterns that can change the thinking of the people.,John Coltrane,"Music, Thinking, People"
"You are always free to change your mind and choose a different future, or a different past.",Richard Bach,"Inspirational, Future, Always"
The Marines was a fresh start - that is why they shave your head. I wish they would let you change your name.,Drew Carey,"Moving On, Your, Start"
"So you start one person at a time. Change one person, you can change a village.",Robin Quivers,"Time, Village, Start"
Audiences are shifting. Platforms are shifting. Ages are shifting. It's better to be in charge of change than to have to react to change.,Roger Ailes,"Better, React, Shifting"
"I'm convinced of this: Good done anywhere is good done everywhere. For a change, start by speaking to people rather than walking by them like they're stones that don't matter. As long as you're breathing, it's never too late to do some good.",Maya Angelou,"Good, Done, Long"
I was taught over and over again that the accumulation of random mutations led to evolutionary change - led to new species. I believed it until I looked for evidence.,Lynn Margulis,"Random, New, Until"
You can't change the world; you can't fix the whole environment. But you can recycle. You can turn the water off when you're brushing your teeth. You can do small things.,Patti Smith,"Small Things, Your, Water"
"We all have cultural bias, racial bias. One of the difficult things around this subject matter is to deny that we have places we go to subconsciously, and unless you consciously decide that that's wrong and you've got to do something about it, especially if you're in a position of power, it won't change.",David Oyelowo,"Power, Difficult, Matter"
The problem with existing biology is you change only one or two genes at a time.,Craig Venter,"Time, Biology, Genes"
"Music is changing. I'm just doing what I'm doing, and hopefully in the next 20, 30 years, some kids can take what I'm doing and change it again. If the music doesn't move, then it's dead.",Trombone Shorty,"Music, Doing, Dead"
"Time is neutral and does not change things. With courage and initiative, leaders change things.",Jesse Jackson,"Leadership, Courage, Time"
The price of every thing rises and falls from time to time and place to place; and with every such change the purchasing power of money changes so far as that thing goes.,Alfred Marshall,"Power, Time, Money"
We did wanna change the name. We were actually putting names in a hat. It was the people making an income off Motley Crue that talked us out of it. The booking agent was getting them between a half a million and a million dollars a show as Motley Crue. Then there was the manager who got 10 to 15 percent off Motley Crue.,John Corabi,"Hat, Name, People"
Don't change on me. Don't extort me unless you intend to do it forever.,Tupac Shakur,"Me, Forever, Unless"
I think it's naive to pray for world peace if we're not going to change the form in which we live.,Godfrey Reggio,"Peace, World, Live"
"You have to change the set, stay ahead of the curve.",Carson Daly,"Ahead, Stay, Curve"
"A person needs at intervals to separate himself from family and companions and go to new places. He must go without his familiars in order to be open to influences, to change.",Katharine Butler Hathaway,"Family, New, Person"
Kids deserve the right to think that they can change the world.,Lois Lowry,"World, Change The World, Deserve"
"Change is hard, but change is good.",Henry Rollins,"Good, Hard"
"Change comes with both fear and some pain. Those two ingredients create mistrust, misunderstanding and misinformation. Such is the process of democracy.",David Mixner,"Fear, Pain, Democracy"
"We are living toward incredible times where the only constant is change, and the rate of change is increasing.",Peter Diamandis,"Living, Only, Where"
"Instead of giving a politician the keys to the city, it might be better to change the locks.",Doug Larson,"Politics, City, Better"
