title,author,tags
"There are so many things to talk about between black people, Hispanic people, white people, gay people, men, women, it's all based on fear. We all have fears, this thing that stops us from embracing as we are one. We are never going to be one. People are messed up, but humor lets us see how ignorant we can be.",Marlon Wayans,"Women, Humor, Men"
"I partly know why I have not led a perfect life like other believers. But I avow to my Lord, and I do not lie, that from the time when I first knew him, the love of God and the fear of him has grown in me from my youth so that I have, by the power of God, always till now kept the faith.",Saint Patrick,"Life, Love, Faith"
"In order to properly understand the big picture, everyone should fear becoming mentally clouded and obsessed with one small section of truth.",Xun Kuang,"Truth, Picture, Everyone"
"Remembering that I'll be dead soon is the most important tool I've ever encountered to help me make the big choices in life. Because almost everything - all external expectations, all pride, all fear of embarrassment or failure - these things just fall away in the face of death, leaving only what is truly important.",Steve Jobs,"Life, Death, Failure"
"The First World War was a horror of gas, industrialised slaughter, fear, and appalling human suffering.",Nick Harkaway,"War, World, Suffering"
"One of the greatest gifts we can give people is the hope that their death is nothing to fear - you know, not that it has no fear in it, but the promise of scripture is that God will lead us through the valley of the shadow of death.",Max Lucado,"God, Death, Hope"
"Action cures fear, inaction creates terror.",Douglas Horton,"Action, Inaction, Terror"
"I had to confront my fears and master my every demonic thought about inferiority, insecurity, or the fear of being black, young, and gifted in this Western culture.",Lauryn Hill,"Culture, Black, Insecurity"
"Where there is charity and wisdom, there is neither fear nor ignorance.",Francis of Assisi,"Wisdom, Ignorance, Charity"
Grab the broom of anger and drive off the beast of fear.,Zora Neale Hurston,"Anger, Drive, Beast"
"Communities of color don't understand what it means to be a police officer, the fear that police officers have in just being on the streets.",Eric Holder,"Police, Understand, Police Officers"
"From my perspective, I absolutely believe in a greater spiritual power, far greater than I am, from which I have derived strength in moments of sadness or fear. That's what I believe, and it was very, very strong in the forest.",Jane Goodall,"Strength, Power, Believe"
"The truths are universal: Every kid knows fear. Every kid knows family and friendship. Loss, love, laughter. Everything else is just detail.",Jason Reynolds,"Friendship, Love, Family"
"There comes a time in the history of nations when fear and forgetfulness cause a nation to hesitate, to waver, and perhaps even to succumb. When that time comes, those who love liberty must rise to the occasion. Will you lovers of liberty rise to the occasion?",Rand Paul,"Love, History, Time"
Fear is a relative thing; its effects are relative to power.,Sarah Hall,"Power, Relative, Thing"
"I'm a strong believer that you can build great companies in time of both greed and fear. But you have to be paying attention and operating under the right assumptions. You don't have to believe history repeats itself, but you should accept that history rhymes.",Brad Feld,"History, Time, Great"
Do the thing you fear most and the death of fear is certain.,Mark Twain,"Death, Most, Thing"
"When we say that black lives matter, it's not because others don't: it's simply because we must affirm that we are worthy of existing without fear, when so many things tell us we are not.",Clint Smith,"Black, Matter, Others"
Behaving morally because of a hope of reward or a fear of punishment is not morality. Morality is not bribery or threats. Religion is bribery and threats. Humans have morality. We don't need religion.,Penn Jillette,"Hope, Religion, Morality"
I'm not one of those guys that has a great worldview. I kind of deal with terror and fear and isolation and abandonment.,David Bowie,"Great, Isolation, Abandonment"
"Politics hates a vacuum. If it isn't filled with hope, someone will fill it with fear.",Naomi Klein,"Politics, Hope, Will"
Poverty entails fear and stress and sometimes depression. It meets a thousand petty humiliations and hardships. Climbing out of poverty by your own efforts that is something on which to pride yourself but poverty itself is romanticized by fools.,J. K. Rowling,"Your, Yourself, Hardships"
"So fear helps me from making mistakes, but I make lot of mistakes.",Steve Irwin,"Me, Mistakes, Making Mistakes"
"Turning pro is a mindset. If we are struggling with fear, self-sabotage, procrastination, self-doubt, etc., the problem is, we're thinking like amateurs. Amateurs don't show up. Amateurs crap out. Amateurs let adversity defeat them. The pro thinks differently. He shows up, he does his work, he keeps on truckin', no matter what.",Steven Pressfield,"Work, Adversity, Thinking"
Hunger and fear are the only realities in dog life: an empty stomach makes a fierce dog.,Robert Falcon Scott,"Life, Dog, Fierce"
"The biggest obstacle to wealth is fear. People are afraid to think big, but if you think small, you'll only achieve small things.",T. Harv Eker,"Small Things, Wealth, People"
It's not necessary to fear the prospect of failure but to be determined not to fail.,Jimmy Carter,"Failure, Necessary, Prospect"
The thing you fear most has no power. Your fear of it is what has the power. Facing the truth really will set you free.,Oprah Winfrey,"Truth, Power, Your"
"I think there's a weapon of cynicism to say, 'Protest doesn't work. Organizing doesn't work. Y'all are a bunch of hippies. You know, it doesn't do anything,' because, frankly, it's said out of fear, because it is a potent force for political change.",Alexandria Ocasio-Cortez,"Work, Change, Political"
Fear has a very concrete power of keeping us from doing and saying the things that are our purpose.,Luvvie Ajayi,"Power, Doing, Purpose"
My main focus in sobriety has been to replace fear with faith or love.,Steve-O,"Love, Faith, Focus"
"As long as enough people can be frightened, then all people can be ruled. That is how it works in a democratic system and mass fear becomes the ticket to destroy rights across the board.",James Bovard,"Long, Enough, People"
"He doesn't know the meaning of the word fear, but then again he doesn't know the meaning of most words.",Bobby Bowden,"Words, Know, Meaning"
"I think when we wake up in the morning, we can choose between fear and love. Every morning. And every morning, if you choose one, that doesn't define you until the end... The way you end your story is important. It's important that we choose love over fear, because love is the answer.",Guillermo del Toro,"Love, Morning, Love Is"
"When people are frightened about going hungry and paying their mortgages, a scarcity model begins to prevail; they fear someone else will get their piece of the pie.",Barbara Kingsolver,"Will, People, Someone"
"We can put fear of the future in front of us to block us, or behind us to drive us forward. I feel like telling all the people who look like me to start trying to write. You don't know it's possible because it's not often in front of you.",Michaela Coel,"Future, Me, Look"
Every journey starts with fear.,Jake Gyllenhaal,"Journey, Every, Starts"
My only fear is the unknown.,David Blaine,"Unknown, Only"
"Fear not, we are of the nature of the lion, and cannot descend to the destruction of mice and such small beasts.",Elizabeth I,"Nature, Lion, Cannot"
Chemistry itself knows altogether too well that - given the real fear that the scarcity of global resources and energy might threaten the unity of mankind - chemistry is in a position to make a contribution towards securing a true peace on earth.,Kenichi Fukui,"Peace, Unity, Energy"
"Our society must make it right and possible for old people not to fear the young or be deserted by them, for the test of a civilization is the way that it cares for its helpless members.",Pearl S. Buck,"Society, Way, People"
Out of ignorance and fear comes judgment and division.,David Furnish,"Ignorance, Division, Judgment"
"Too much self-centered attitude, you see, brings, you see, isolation. Result: loneliness, fear, anger. The extreme self-centered attitude is the source of suffering.",Dalai Lama,"Attitude, Anger, Loneliness"
Fear is a terrible thing. It makes you do awful things.,Kirk Douglas,"Things, Terrible, Makes"
"Ritual is another word for fear, manifested in a different way.",Conor McGregor,"Way, Different Way, Different"
"Fear of something is at the root of hate for others, and hate within will eventually destroy the hater.",George Washington Carver,"Hate, Will, Others"
Neither a man nor a crowd nor a nation can be trusted to act humanely or to think sanely under the influence of a great fear.,Bertrand Russell,"Great, Man, Influence"
"You can like or dislike me. You are entitled to form an opinion about me, and I don't fear being judged.",Hina Khan,"Me, Opinion, Being Judged"
"You have to be sincere in your feelings. And fear is one of those, sometimes; doubt is one of those; jealousy, anger - all your emotions are not going to be considered the strong emotions; all of them are not going to be love, happiness, joy.",Common,"Love, Happiness, Anger"
There are only two forces that unite men - fear and interest.,Napoleon Bonaparte,"Men, Interest, Only"
People fear leaving their safe harbor of the known and venturing off into the unknown. Human beings crave certainty - even when it limits them.,Robin S. Sharma,"Limits, People, Safe"
"Our immigration system is fundamentally broken, and ICE's role in supporting the existing system - including separating families seeking refuge in the United States and conducting indiscriminate deportation raids in our communities - is creating an atmosphere of toxic fear and mistrust in immigrant communities.",Ayanna Pressley,"Ice, Broken, Immigration"
"You can defeat fear through humor, through pain, through honesty, bravery, intuition, and through love in the truest sense.",John Cassavetes,"Love, Humor, Pain"
"I haven't grown since I was 13, and every girl cast opposite me isn't allowed to wear heels on camera, for fear that I would look minuscule. In all of the casting calls for my best friends on every project, it says in big, bold, red letters: 'Please no high heels.' It's a little embarrassing.",Dove Cameron,"Best, Me, Look"
I fear my enthusiasm flags when real work is demanded of me.,H. P. Lovecraft,"Work, Me, Enthusiasm"
"In contrast, fear societies are societies in which dissent is banned.",Natan Sharansky,"Dissent, Contrast, Banned"
There is not a truth existing which I fear... or would wish unknown to the whole world.,Thomas Jefferson,"Truth, World, Wish"
"The moment you feel yourself hesitate on something you know you should do, count 5-4-3-2-1 to activate your prefrontal cortex and interrupt the habit of overthinking, self-doubt, and fear.",Mel Robbins,"Moment, Your, Yourself"
"If you were born really ugly like me, have no fear. There's steps you can take to be good-looking. Kind of.",Jenna Marbles,"Me, Ugly, Born"
The more I traveled the more I realized that fear makes strangers of people who should be friends.,Shirley MacLaine,"People, Strangers, More"
I believe that every single event in life happens in an opportunity to choose love over fear.,Oprah Winfrey,"Life, Love, Opportunity"
"All religions have periods in their history which are looked back to with retrospective fear and trembling as eras of persecution, and each religion has its own book of martyrs.",Richard Le Gallienne,"History, Religion, Own"
"If there is one thing I fear less than everything else, it is, I believe, persecution for my opinions. There are a good many points about which I may be diffident, but when it comes to questions of Truth and intellectual independence, there is no holding me - I can envisage no finer end than to sacrifice oneself for a conviction.",Pierre Teilhard de Chardin,"Truth, Good, Independence"
A writer of fiction lives in fear. Each new day demands new ideas and he can never be sure whether he is going to come up with them or not.,Roald Dahl,"New Day, Day, New"
Fear is always there; it's a survival instinct. You just need to know how to manage it.,Jimmy Chin,"Always, Survival, Know"
"You have to get outside of your comfort zone if you're going to make significant changes in your life, and since few things scare people like the unknown, feeling fear is an excellent sign that you're on the right track.",Jen Sincero,"Life, Your, Comfort"
"Fear comes from uncertainty. When we are absolutely certain, whether of our worth or worthlessness, we are almost impervious to fear.",William Congreve,"Uncertainty, Worth, Almost"
I have a wish. It as a fear as well - that in my end will be my beginning.,Che Guevara,"Beginning, Will, Wish"
"We need Big Ideas, as we are in a time of small people, and as Kennedy showed with Apollo, doing something grand in space is the biggest. At a time of huge national doubt and fear of losing our leadership as a nation to others, it focused us, gave us something positive and inspired a generation.",Rick Tumlinson,"Positive, Leadership, Time"
"I don't fear death because I don't fear anything I don't understand. When I start to think about it, I order a massage and it goes away.",Hedy Lamarr,"Death, Start, Understand"
"Greatness comes from fear. Fear can either shut us down and we go home, or we fight through it.",Lionel Richie,"Home, Fight, Greatness"
Many of us crucify ourselves between two thieves - regret for the past and fear of the future.,Fulton Oursler,"Future, Regret, Past"
I want you to panic. I want you to feel the fear I feel every day. And then I want you to act.,Greta Thunburg,"Day, Feel, Every Day"
"Some people ask why people would go into a dark room to be scared. I say they are already scared, and they need to have that fear manipulated and massaged. I think of horror movies as the disturbed dreams of a society.",Wes Craven,"Dreams, Society, Movies"
"When I speak of the fear, intimidation, arrests, and public shaming of intellectuals and religious leaders who dare to speak their minds, and then I tell you that I'm from Saudi Arabia, are you surprised?",Jamal Khashoggi,"Speak, Dare, Tell"
I wish for a world where everyone understands that discomfort is the price of legendary. And fear is just growth coming to get you.,Robin S. Sharma,"Growth, World, Wish"
Scalded cats fear even cold water.,Thomas Fuller,"Water, Cats, Cold"
I have a fear of being broke. That's what I have a fear of. I'm not kidding.,Loni Love,"Being, Being Broke, Kidding"
No American should live in fear of going to work or sending their kids to school. Let's end the fear. Let's enforce existing gun laws.,Charles B. Rangel,"Work, Gun, End"
"The underbelly of the human psyche, what is often referred to as our dark side, is the origin of every act of self-sabotage. Birthed out of shame, fear, and denial, it misdirects our good intentions and drives us to unthinkable acts of self-destruction and not-so-unbelievable acts of self-sabotage.",Debbie Ford,"Good, Dark Side, Dark"
"Writing is a form of therapy; sometimes I wonder how all those who do not write, compose or paint can manage to escape the madness, melancholia, the panic and fear which is inherent in a human situation.",Graham Greene,"Escape, Situation, Sometimes"
"Quite a lot of our contemporary culture is actually shot through with a resentment of limits and the passage of time, anger at what we can't do, fear or even disgust at growing old.",Rowan Williams,"Time, Anger, Culture"
"There is no official censorship in literature, but I feel a certain fear when I see that a kind of self-censorship is developing in Poland. Authors are somehow afraid of expressing what they really think or feel because they fear political consequences.",Olga Tokarczuk,"Political, Feel, Censorship"
"We are afraid to care too much, for fear that the other person does not care at all.",Eleanor Roosevelt,"Relationship, Care, Person"
It is better by noble boldness to run the risk of being subject to half the evils we anticipate than to remain in cowardly listlessness for fear of what might happen.,Herodotus,"Better, Boldness, Noble"
Silence is the residue of fear.,Clint Smith,Silence
We keep score in life because it matters. It counts. It matters. Too many people opt out and never discover their own abilities because they fear failure. They don't understand commitment.,Pat Summitt,"Life, Failure, Commitment"
"All religion, my friend, is simply evolved out of fraud, fear, greed, imagination, and poetry.",Edgar Allan Poe,"Religion, Poetry, Imagination"
Fear of failure is caused by lack of self-esteem and confidence. Dealing with fear is the key to super success.,Dan Pena,"Success, Failure, Confidence"
"The raccoons, foxes, beavers, chinchillas, minks, rabbits, and yes, sometimes even dogs and cats that are killed for fur are not very different from your beloved dog or cat. They all have eyes, ears and hearts. They all experience pain when they are physically maimed. They shake with fear when they experience terror.",Jane Velez-Mitchell,"Experience, Eyes, Pain"
"Basically, there are two paths you can walk: faith or fear. It's impossible to simultaneously trust God and not trust God.",Charles Stanley,"Faith, God, Trust"
"Fear is not in the habit of speaking truth; when perfect sincerity is expected, perfect freedom must be allowed; nor has anyone who is apt to be angry when he hears the truth any cause to wonder that he does not hear it.",Tacitus,"Truth, Freedom, Angry"
The process of spotting fear and refusing to obey it is the source of all true empowerment.,Martha Beck,"Process, True, Empowerment"
"I can recall, as a young adult, running through the rain forest at the Forest Reserve, at times feeling a sense of fear when I felt I was in danger. In danger of confronting an ugly snake or a coral snake, which represented the greatest fear of someone in a rural area when you traverse the forest.",Anthony Carmona,"Rain, Snake, Ugly"
"I have a fear of poverty in old age. I have this vision of myself living in a skip and eating cat food. It's because I'm freelance, and I've never had a proper job. I don't have a pension, and my savings are dwindling. I always thought someone would just come along and look after me.",Jenny Eclair,"Age, Food, Myself"
Fear of failure must never be a reason not to try something.,Frederick W. Smith,"Failure, Try, Never"
"A child's fear is a world whose dark corners are quite unknown to grownup people; it has its sky and its abysses, a sky without stars, abysses into which no light can ever penetrate.",Julien Green,"Sky, Light, Stars"
It is said that those whom the gods wish to destroy they first make mad. It may well be that a war neurosis stirred up by propaganda of fear and hatred is the prelude to destruction.,John Boyd Orr,"War, Wish, First"
"Unlike accredited zoos like the Bronx Zoo, San Diego Zoo, the Los Angeles Zoo, these are private menageries, and these people are frightened and there is an existential fear that they are going to be shut down by the government, by PETA, by HSUS, by animal rights groups. So they, generally, are very guarded.",Eric Goode,"Government, Zoo, People"
Action conquers fear.,Peter Nivio Zarlenga,"Action, Conquers"
"The topic of leadership is a touchy one. A lot of leaders fail because they don't have the bravery to touch that nerve or strike that chord. Throughout my years, I haven't had that fear.",Kobe Bryant,"Leadership, Strike, Touch"
"By climbing mountains we were not learning how big we were. We were finding out how breakable, how weak and how full of fear we are.",Reinhold Messner,"Learning, Finding, Big"
"Shame is the most powerful, master emotion. It's the fear that we're not good enough.",Brene Brown,"Good, Enough, Not Good Enough"
"Love is the total absence of fear. Love asks no questions. Its natural state is one of extension and expansion, not comparison and measurement.",Gerald Jampolsky,"Love, Love Is, Questions"
I have accepted fear as a part of life - specifically the fear of change... I have gone ahead despite the pounding in the heart that says: turn back.,Erica Jong,"Life, Change, Heart"
Fear nothing; attack everything.,Eric Berry,"Nothing, Everything, Attack"
Men! The only animal in the world to fear.,D. H. Lawrence,"Men, World, Animal"
Constant reference to a 'war on terror' did accomplish one major objective: It stimulated the emergence of a culture of fear.,Zbigniew Brzezinski,"War, Culture, Accomplish"
"I've come to the conclusion that mythology is really a form of archaeological psychology. Mythology gives you a sense of what a people believes, what they fear.",George Lucas,"People, Sense, Mythology"
"I'm always interested in trying to investigate different personalities. I want to keep myself guessing and keep the fear element alive, so that I don't get too comfortable.",Michael Fassbender,"Myself, Always, Keep"
"I'm a vegetarian, so I have a huge fear of blood.",Lana Condor,"Blood, Vegetarian, Huge"
"A lot of what I've done as Nine Inch Nails has been governed by fear. I was trying to keep the songs in a framework that was tough, and I learnt a lot from Jesus and Mary Chain about how to bury nice pop songs in unlistenable noise - the idea being if you can get behind that wall, you find there's a pearl inside.",Trent Reznor,"Done, Keep, Find"
There is nothing in this world that I fear to say.,Dmitri Mendeleev,"World, Nothing, Say"
"To work without attachment is to work without the expectation of reward or fear of any punishment in this world or the next. Work so done is a means to the end, and God is the end.",Ramakrishna,"Work, God, Done"
"If we're not careful, we become that which we most fear.",Dean Ornish,"Careful, Become, Most"
He who has conquered doubt and fear has conquered failure.,James Lane Allen,"Failure, Doubt, Who"
"An elite class that is free to operate without limits - whether limits imposed by the rule of law or fear of the responses from those harmed by their behavior - is an elite class that will plunder, degrade, and cheat at will, and act endlessly to fortify its own power.",Glenn Greenwald,"Power, Law, Free"
"Audacity augments courage; hesitation, fear.",Publilius Syrus,"Courage, Audacity, Hesitation"
There's two sorts of fear: one you embrace and one you should listen to and turn the other way.,Matthew McConaughey,"Way, Turn, Embrace"
He whose head is in heaven need not fear to put his feet into the grave.,Matthew Henry,"Feet, Heaven, Head"
"I believe in the sun. In the tangle of human failures of fear, greed and forgetfulness, the sun gives me clarity.",Joy Harjo,"Believe, Sun, Greed"
"To drive an F1 car you have to be a little mad. On the morning of a race there's a mix of excitement and fear. If it's a wet track, then it's worse as you're not in control most of the time, which is the thing all drivers fear the most.",Jenson Button,"Morning, Time, Car"
"Sailing is the closest I can get to nature - it's adrenaline, fear, a constant challenge and learning experience, an adventure into the unknown. And of course there is nothing better than wearing the same T-shirt for days and not brushing my hair for weeks.",Daria Werbowy,"Nature, Experience, Learning"
"Let children read whatever they want and then talk about it with them. If parents and kids can talk together, we won't have as much censorship because we won't have as much fear.",Judy Blume,"Together, Parents, Censorship"
"Our fear of hypocrisy is forcing us to live in a world where gluttons are fine, so long as they champion gluttony.",Jonah Goldberg,"World, Long, Champion"
I do not fear Satan half so much as I fear those who fear him.,Saint Teresa of Avila,"Satan, Much, Half"
"Cry, the beloved country, for the unborn child that is the inheritor of our fear. Let him not love the earth too deeply... For fear will rob him of all if he gives too much.",Alan Paton,"Love, Will, Country"
"Action is a great restorer and builder of confidence. Inaction is not only the result, but the cause, of fear. Perhaps the action you take will be successful; perhaps different action or adjustments will have to follow. But any action is better than no action at all.",Norman Vincent Peale,"Great, Confidence, Better"
"We can either be governed by fear - fear of immigrants, fear of Muslims, call the press the enemy of the people, tear kids away from their parents at the U.S.-Mexico border - or we can be governed by our ambitions and our aspirations and our desire to make the most out of all of us. And that's America at its best.",Beto O'Rourke,"Best, Parents, America"
"All different religions have laws based on fear, the fear of going to hell.",Shannon Briggs,"Hell, Religions, Laws"
"Jealousy, greed, fear. We're all full of these things. But also love and compassion. If you saw a drowning baby, it wouldn't matter if you were wearing a tuxedo on the way to your own wedding. You'd jump in to save him.",John McAfee,"Love, Jealousy, Wedding"
The unmerited fear of genetically modified organism crops threatens scientific advancements in biotechnology needed to meet the growing global demand for safe and affordable food.,Mike Pompeo,"Food, Safe, Biotechnology"
Fear of a name increases fear of the thing itself.,J. K. Rowling,"Name, Itself, Thing"
"Stage fright is my worst problem. A voice is very intimate. It's something of your own. So there's always this fear, because you feel naked. There's a fear of not reaching up to expectations.",Andrea Bocelli,"Always, Your, Expectations"
"You don't know fear until it's 7 A.M. and freezing cold on live television, and you're not sure if Justin Bieber is going to kiss you or not.",Halsey,"Know, Kiss, Cold"
