title,author,tags
"It is better to be feared than loved, if you cannot be both.",Niccolo Machiavelli,"Better, Loved, Cannot"
If you know the enemy and know yourself you need not fear the results of a hundred battles.,Sun Tzu,"Yourself, Battles, Know Yourself"
"I have learned over the years that when one's mind is made up, this diminishes fear; knowing what must be done does away with fear.",Rosa Parks,"Done, Mind, I Have Learned"
Have no fear of perfection - you'll never reach it.,Salvador Dali,"Perfection, No Fear, Never"
"The oldest and strongest emotion of mankind is fear, and the oldest and strongest kind of fear is fear of the unknown.",H. P. Lovecraft,"Unknown, Mankind, Emotion"
I tremble for my country when I reflect that God is just; that his justice cannot sleep forever.,Thomas Jefferson,"God, Justice, Sleep"
We can easily forgive a child who is afraid of the dark; the real tragedy of life is when men are afraid of the light.,Plato,"Life, Men, Light"
Never be afraid to sit a while and think.,Lorraine Hansberry,"Never, Sit, Afraid"
"I may be compelled to face danger, but never fear it, and while our soldiers can stand and fight, I can stand and feed and nurse them.",Clara Barton,"Fight, Face, Stand"
Great work is done by people who are not afraid to be great.,Fernando Flores,"Work, Great, Done"
Ultimately we know deeply that the other side of every fear is freedom.,Marilyn Ferguson,"Freedom, Know, Side"
There is no such thing as paranoia. Your worst fears can come true at any moment.,Hunter S. Thompson,"Moment, Your, True"
"So then learn to conquer your fear. This is the only art we have to master nowadays: to look at things without fear, and to fearlessly do right.",Friedrich Durrenmatt,"Art, Your, Look"
Fear is excitement without breath.,Robert Heller,"Excitement, Breath, Without"
The only thing we have to fear is fear itself.,Franklin D. Roosevelt,"Only, The Only Thing, Itself"
"Show me a guy who's afraid to look bad, and I'll show you a guy you can beat every time.",Lou Brock,"Time, Me, Look"
Do what you fear and fear disappears.,David Joseph Schwartz,"Disappears, You"
Find out what you're afraid of and go live there.,Chuck Palahniuk,"Find, Live, Go"
There are times when fear is good. It must keep its watchful place at the heart's controls.,Aeschylus,"Good, Heart, Keep"
I think fearless is having fears but jumping anyway.,Taylor Swift,"Fearless, Think, Jumping"
Always do what you are afraid to do.,Ralph Waldo Emerson,"Always, Afraid, You"
"Fear keeps us focused on the past or worried about the future. If we can acknowledge our fear, we can realize that right now we are okay. Right now, today, we are still alive, and our bodies are working marvelously. Our eyes can still see the beautiful sky. Our ears can still hear the voices of our loved ones.",Thich Nhat Hanh,"Future, Today, Beautiful"
Nothing gives a fearful man more courage than another's fear.,Umberto Eco,"Courage, Man, Nothing"
Only when we are no longer afraid do we begin to live.,Dorothy Thompson,"Live, Afraid, Only"
"We should not be afraid to go into a new era, to leave the old beyond.",Zach Wamp,"New, Go, Beyond"
"I'm not afraid of storms, for I'm learning how to sail my ship.",Louisa May Alcott,"Learning, Ship, Sail"
Hate is the consequence of fear; we fear something before we hate it; a child who fears noises becomes a man who hates noise.,Cyril Connolly,"Hate, Man, Noise"
I say I am stronger than fear.,Malala Yousafzai,"I Am, Stronger, Say"
"Fear stifles our thinking and actions. It creates indecisiveness that results in stagnation. I have known talented people who procrastinate indefinitely rather than risk failure. Lost opportunities cause erosion of confidence, and the downward spiral begins.",Charles Stanley,"Failure, Confidence, Thinking"
Thinking will not overcome fear but action will.,W. Clement Stone,"Thinking, Will, Action"
"I hasten to laugh at everything, for fear of being obliged to weep.",Pierre Beaumarchais,"Laugh, Everything, Being"
Love is what we were born with. Fear is what we learned here.,Marianne Williamson,"Love, Love Is, Born"
"Fear can be good when you're walking past an alley at night or when you need to check the locks on your doors before you go to bed, but it's not good when you have a goal and you're fearful of obstacles. We often get trapped by our fears, but anyone who has had success has failed before.",Queen Latifah,"Success, Good, Your"
"I love the man that can smile in trouble, that can gather strength from distress, and grow brave by reflection. 'Tis the business of little minds to shrink, but he whose heart is firm, and whose conscience approves his conduct, will pursue his principles unto death.",Thomas Paine,"Love, Smile, Death"
To him who is in fear everything rustles.,Sophocles,"Everything, Who, Him"
"There is no hope unmingled with fear, and no fear unmingled with hope.",Baruch Spinoza,"Hope, No Fear, No Hope"
We simply attempt to be fearful when others are greedy and to be greedy only when others are fearful.,Warren Buffett,"Others, Greedy, Only"
We consume our tomorrows fretting about our yesterdays.,Persius,"About, Our, Consume"
"What is needed, rather than running away or controlling or suppressing or any other resistance, is understanding fear; that means, watch it, learn about it, come directly into contact with it. We are to learn about fear, not how to escape from it.",Jiddu Krishnamurti,"Escape, Understanding, Resistance"
We fear things in proportion to our ignorance of them.,Christian Nestell Bovee,"Ignorance, Things, Them"
We are afraid of the enormity of the possible.,Emil Cioran,"Possible, Afraid, Enormity"
"What is a fear of living? It's being preeminently afraid of dying. It is not doing what you came here to do, out of timidity and spinelessness. The antidote is to take full responsibility for yourself - for the time you take up and the space you occupy. If you don't know what you're here to do, then just do some good.",Maya Angelou,"Good, Time, Space"
Fear has many eyes and can see things underground.,Miguel de Cervantes,"Eyes, See, Things"
I have a fear of being boring.,Christian Bale,"Boring, Being"
A nation that is afraid to let its people judge the truth and falsehood in an open market is a nation that is afraid of its people.,John F. Kennedy,"Truth, People, Nation"
Avoiding danger is no safer in the long run than outright exposure. The fearful are caught as often as the bold.,Helen Keller,"Long, Bold, Danger"
There are very few monsters who warrant the fear we have of them.,Andre Gide,"Monsters, Who, Them"
"By adversity are wrought the greatest works of admiration, and all the fair examples of renown, out of distress and misery are grown.",Samuel Daniel,"Adversity, Misery, Fair"
Fear is the mother of foresight.,Thomas Hardy,"Mother, Foresight"
"Grief has limits, whereas apprehension has none. For we grieve only for what we know has happened, but we fear all that possibly may happen.",Pliny the Elder,"Limits, Know, Grief"
"One of the greatest discoveries a man makes, one of his great surprises, is to find he can do what he was afraid he couldn't do.",Henry Ford,"Great, Man, Find"
Fears are nothing more than a state of mind.,Napoleon Hill,"Mind, Nothing, More"
Fear tastes like a rusty knife and do not let her into your house.,John Cheever,"Your, Knife, House"
Don't be afraid to see what you see.,Ronald Reagan,"See, Afraid, You"
True success is overcoming the fear of being unsuccessful.,Paul Sweeney,"Success, True, Overcoming"
He will never have true friends who is afraid of making enemies.,William Hazlitt,"Enemies, Will, True"
"As soon as the fear approaches near, attack and destroy it.",Chanakya,"Attack, Destroy, Soon"
Fear is static that prevents me from hearing myself.,Samuel Butler,"Myself, Me, Hearing"
Prosperity is not without many fears and distastes; adversity not without many comforts and hopes.,Francis Bacon,"Adversity, Prosperity, Without"
Minds that are ill at ease are agitated by both hope and fear.,Ovid,"Hope, Ease, Minds"
"Pick the day. Enjoy it - to the hilt. The day as it comes. People as they come... The past, I think, has helped me appreciate the present - and I don't want to spoil any of it by fretting about the future.",Audrey Hepburn,"Future, Day, Past"
I have never known any distress that an hour's reading did not relieve.,Montesquieu,"Never, Reading, Distress"
"Boldness is a mask for fear, however great.",John Dryden,"Great, Mask, Boldness"
Tell us your phobias and we will tell you what you are afraid of.,Robert Benchley,"Your, Will, Afraid"
"To fight fear, act. To increase fear - wait, put off postpone.",David Joseph Schwartz,"Fight, Wait, Act"
True nobility is exempt from fear.,Marcus Tullius Cicero,"True, Nobility, Exempt"
"I fear the Greeks, even when they bring gifts.",Virgil,"Even, Greeks, Bring"
"An ugly sight, a man who is afraid.",Jean Anouilh,"Man, Ugly, Afraid"
The pleasures of love are always in proportion to our fears.,Stendhal,"Love, Always, Pleasures"
The fear of becoming a 'has-been' keeps some people from becoming anything.,Eric Hoffer,"People, Some People, Anything"
"There are things which a man is afraid to tell even to himself, and every decent man has a number of such things stored away in his mind.",Fyodor Dostoevsky,"Man, Mind, Afraid"
No one ever told me that grief felt so like fear.,C. S. Lewis,"Me, Grief, Like"
"The first duty of man is to conquer fear; he must get rid of it, he cannot act till then.",Thomas Carlyle,"Man, Conquer, Duty"
There is no passion so contagious as that of fear.,Michel de Montaigne,"Passion, Contagious"
"My 'fear' is my substance, and probably the best part of me.",Franz Kafka,"Best, Me, Substance"
We fear the thing we want the most.,Robert Anthony,"Want, Most, Thing"
You are only afraid if you are not in harmony with yourself. People are afraid because they have never owned up to themselves.,Hermann Hesse,"Yourself, Harmony, People"
"It is the strange fate of man, that even in the greatest of evils the fear of the worst continues to haunt him.",Johann Wolfgang von Goethe,"Man, Fate, Worst"
"I'm different, and my manner invites questions. I'm never afraid to answer.",Marlee Matlin,"Never, Questions, Afraid"
I'd rather give my life than be afraid to give it.,Lyndon B. Johnson,"Life, My Life, Afraid"
"It is the perpetual dread of fear, the fear of fear, that shapes the face of a brave man.",Georges Bernanos,"Brave, Man, Face"
"He whom many fear, has himself many to fear.",Publilius Syrus,"He, Himself, Whom"
"We fear violence less than our own feelings. Personal, private, solitary pain is more terrifying than what anyone else can inflict.",Jim Morrison,"Pain, Feelings, Own"
Fear makes us feel our humanity.,Benjamin Disraeli,"Humanity, Feel, Us"
"Every man, through fear, mugs his aspirations a dozen times a day.",Brendan Behan,"Man, Day, Through"
"Why is it that when we get older, we get more fearful?",Sandra Bullock,"Why, More, Older"
Even death is not to be feared by one who has lived wisely.,Buddha,"Death, Who, Even"
"The thinner the ice, the more anxious is everyone to see whether it will bear.",Josh Billings,"Will, Ice, Everyone"
I think what weakens people most is fear of wasting their strength.,Etty Hillesum,"Strength, People, Think"
"Let the fear of danger be a spur to prevent it; he that fears not, gives advantage to the danger.",Francis Quarles,"Danger, Advantage, He"
To pity distress is but human; to relieve it is Godlike.,Horace Mann,"Human, Pity, Distress"
"We should not fret for what is past, nor should we be anxious about the future; men of discernment deal only with the present moment.",Chanakya,"Future, Men, Moment"
The fearful unbelief is unbelief in yourself.,Thomas Carlyle,"Yourself, Unbelief, Fearful"
One had to take some action against fear when once it laid hold of one.,Rainer Maria Rilke,"Action, Take, Hold"
"Having a child, that's always been my biggest fear. I want a child and I fear a child.",Marilyn Monroe,"Always, Want, Child"
"When you're fearful, you stumble.",Jenna Jameson,"Stumble, Fearful, You"
A person's fears are lighter when the danger is at hand.,Lucius Annaeus Seneca,"Person, Danger, Lighter"
That man is prudent who neither hopes nor fears anything from the uncertain events of the future.,Anatole France,"Future, Man, Anything"
Some movie stars wear their sunglasses even in church. They're afraid God might recognize them and ask for autographs.,Fred Allen,"God, Stars, Sunglasses"
"This is all you have. This is not a dry run. This is your life. If you want to fritter it away with your fears, then you will fritter it away, but you won't get it back later.",Laura Schlessinger,"Life, Your, Will"
No good work is ever done while the heart is hot and anxious and fretted.,Olive Schreiner,"Work, Good, Done"
"If you let your fear of consequence prevent you from following your deepest instinct, your life will be safe, expedient and thin.",Katharine Butler Hathaway,"Life, Your, Will"
The mark of fear is not easily removed.,Ernest Gaines,"Mark, Easily"
"We often pretend to fear what we really despise, and more often despise what we really fear.",Charles Caleb Colton,"Pretend, More, Despise"
"As a child, I was more afraid of tetanus shots than, for example, Dracula.",Dave Barry,"Afraid, More, Example"
"You know, sometimes I feel well and vital in the world, and sometimes I just feel so distressed I want to pull my hair out by the roots.",Sharon Stone,"World, Hair, Roots"
One thing about being successful is that I stopped being afraid of dying. Once you're a star you're dead already. You're embalmed.,Dustin Hoffman,"Dead, Afraid, Dying"
A lot of people live in fear because they haven't figured out how you're going to react when faced with a certain set of circumstances. I've come to terms with this by looking deeply into whatever makes me fearful - what are the key elements that get the hairs up on the back of my neck - and then figuring out what I can do about it.,Chris Hadfield,"Me, React, People"
What we have most to fear is failure of the heart.,Sonia Johnson,"Failure, Heart, Most"
"We lavish on animals the love we are afraid to show to people. They might not return it; or worse, they might.",Mignon McLaughlin,"Love, People, Animals"
There is nothing that fear and hope does not permit men to do.,Luc de Clapiers,"Hope, Men, Nothing"
Humble souls are fearful of their own strength.,William Gurnall,"Strength, Humble, Own"
No one should have to live in fear.,Jeff Fortenberry,"Live, Should"
"Sleep makes people calmer, more alert, less fearful - just plain happier, or so I see around me and in me. I am sure that if this great nation were to concentrate on getting more sleep, we would be a happier, more confident people, and that by itself would be a major achievement.",Ben Stein,"Great, Achievement, I Am"
"We have perhaps a natural fear of ends. We would rather be always on the way than arrive. Given the means, we hang on to them and often forget the ends.",Eric Hoffer,"Always, Way, Forget"
Everyone wishes that the man whom he fears would perish.,Ovid,"Man, Everyone, Wishes"
"I'm not at the point where I'd feel safe in a house alone. I would be really scared. I'm the kind of person that when I get up to go use the bathroom I have this big long hallway, and I just know someone's going to jump out and get me.",Britney Spears,"Alone, Long, Me"
Courage is a peculiar kind of fear.,Charles Kennedy,"Courage, Peculiar, Kind"
"When we are afraid we ought not to occupy ourselves with endeavoring to prove that there is no danger, but in strengthening ourselves to go on in spite of the danger.",Hale White,"Prove, Go, Afraid"
"A child understands fear, and the hurt and hate it brings.",Nadine Gordimer,"Hate, Hurt, Child"
"I am convinced that it is not the fear of death, of our lives ending that haunts our sleep so much as the fear... that as far as the world is concerned, we might as well never have lived.",Harold Kushner,"Death, World, I Am"
"I was a very fearful little kid, and I would always see the worst in everything. The glass was half-empty. I would see people kissing, and I would think one was trying to bite the other.",Daniel Clowes,"Always, People, Trying"
"Nothing in life is to be feared, it is only to be understood. Now is the time to understand more, so that we may fear less.",Marie Curie,"Life, Time, Nothing"
"I must not fear. Fear is the mind-killer. Fear is the little-death that brings total obliteration. I will face my fear. I will permit it to pass over me and through me. And when it has gone past, I will turn the inner eye to see its path. Where the fear has gone, there will be nothing. Only I will remain.",Frank Herbert,"Path, Face, Past"
"I fear not the man who has practiced 10,000 kicks once, but I fear the man who has practiced one kick 10,000 times.",Bruce Lee,"Man, Kick, Who"
Curiosity will conquer fear even more than bravery will.,James Stephens,"Curiosity, Conquer, Will"
"Time is too slow for those who wait, too swift for those who fear, too long for those who grieve, too short for those who rejoice, but for those who love, time is eternity.",Henry Van Dyke,"Love, Time, Long"
"Inaction breeds doubt and fear. Action breeds confidence and courage. If you want to conquer fear, do not sit home and think about it. Go out and get busy.",Dale Carnegie,"Courage, Home, Busy"
Don't let the fear of the time it will take to accomplish something stand in the way of your doing it. The time will pass anyway; we might just as well put that passing time to the best possible use.,Earl Nightingale,"Best, Time, Your"
I fear all we have done is to awaken a sleeping giant and fill him with a terrible resolve.,Isoroku Yamamoto,"Done, Terrible, Awaken"
A company is stronger if it is bound by love rather than by fear.,Herb Kelleher,"Love, Company, Stronger"
Being brave isn't the absence of fear. Being brave is having that fear but finding a way through it.,Bear Grylls,"Brave, Way, Finding"
You always have two choices: your commitment versus your fear.,"Sammy Davis, Jr.","Wisdom, Always, Your"
He who doesn't fear death dies only once.,Giovanni Falcone,"Death, Only, Who"
The greatest want of the world is the want of men - men who will not be bought or sold; men who in their inmost souls are true and honest; men who do not fear to call sin by its right name; men whose conscience is as true to duty as the needle to the pole; men who will stand for the right though the heavens fall.,Ellen G. White,"Men, World, Duty"
A life lived in fear is a life half lived.,Baz Luhrmann,"Life, Half, Lived"
Love will find a way through paths where wolves fear to prey.,Lord Byron,"Love, Valentine's Day, Will"
"If fear is cultivated it will become stronger, if faith is cultivated it will achieve mastery.",John Paul Jones,"Faith, Will, Stronger"
"Let us not look back in anger, nor forward in fear, but around in awareness.",James Thurber,"Anger, Look, Awareness"
"Never fear to deliberately walk through dark places, for that is how you reach the light on the other side.",Vernon Howard,"Walk, Light, Dark"
I hope for nothing. I fear nothing. I am free.,Nikos Kazantzakis,"Hope, Freedom, I Am"
"Fear is the only true enemy, born of ignorance and the parent of anger and hate.",Edward Albert,"Anger, Hate, Ignorance"
"Don't let fear or insecurity stop you from trying new things. Believe in yourself. Do what you love. And most importantly, be kind to others, even if you don't like them.",Stacy London,"Love, Believe In Yourself, Believe"
"I've learned that fear limits you and your vision. It serves as blinders to what may be just a few steps down the road for you. The journey is valuable, but believing in your talents, your abilities, and your self-worth can empower you to walk down an even brighter path. Transforming fear into freedom - how great is that?",Soledad O'Brien,"Freedom, Great, Journey"
"I learned that courage was not the absence of fear, but the triumph over it. The brave man is not he who does not feel afraid, but he who conquers that fear.",Nelson Mandela,"Courage, Brave, Man"
"Business is war. I go out there, I want to kill the competitors. I want to make their lives miserable. I want to steal their market share. I want them to fear me and I want everyone on my team thinking we're going to win.",Kevin O'Leary,"Business, War, Thinking"
It is not power that corrupts but fear. Fear of losing power corrupts those who wield it and fear of the scourge of power corrupts those who are subject to it.,Aung San Suu Kyi,"Power, Power Corrupts, Losing"
"To live a creative life, we must lose our fear of being wrong.",Joseph Chilton Pearce,"Life, Lose, Live"
"My friends, love is better than anger. Hope is better than fear. Optimism is better than despair. So let us be loving, hopeful and optimistic. And we'll change the world.",Jack Layton,"Love, Change, Hope"
We crucify ourselves between two thieves: regret for yesterday and fear of tomorrow.,Fulton Oursler,"Regret, Tomorrow, Yesterday"
"So much of what is best in us is bound up in our love of family, that it remains the measure of our stability because it measures our sense of loyalty. All other pacts of love or fear derive from it and are modeled upon it.",Haniel Long,"Love, Best, Family"
"America was not built on fear. America was built on courage, on imagination and an unbeatable determination to do the job at hand.",Harry S Truman,"Courage, Patriotism, Imagination"
"My biggest fear is death because I don't think I'm going anywhere. And since I don't think that, and I don't have a belief... I'm married to someone who has the belief, so she knows she's going somewhere.",Larry King,"Death, Someone, Belief"
"Failure isn't an option. I've erased the word 'fear' from my vocabulary, and I think when you erase fear, you can't fail.",Alicia Keys,"Failure, Erase, Vocabulary"
Stand before the people you fear and speak your mind - even if your voice shakes.,Maggie Kuhn,"Your, Mind, Voice"
"As we let our light shine, we unconsciously give other people permission to do the same. As we are liberated from our own fear, our presence actually liberates others.",Marianne Williamson,"Light, Shine, Own"
"Authority has every reason to fear the skeptic, for authority can rarely survive in the face of doubt.",Vita Sackville-West,"Face, Survive, Doubt"
"I'll tell you what freedom is to me: no fear. I mean really, no fear!",Nina Simone,"Freedom, Me, No Fear"
"Knowledge is power, and it can help you overcome any fear of the unexpected. When you learn, you gain more awareness through the process, and you know what pitfalls to look for as you get ready to transition to the next level.",Jay Shetty,"Knowledge, Power, Unexpected"
Vaccines save lives; fear endangers them. It's a simple message parents need to keep hearing.,Jeffrey Kluger,"Vaccines, Simple, Parents"
"Human spirit is the ability to face the uncertainty of the future with curiosity and optimism. It is the belief that problems can be solved, differences resolved. It is a type of confidence. And it is fragile. It can be blackened by fear and superstition.",Bernard Beckett,"Future, Confidence, Face"
"You gain strength, courage, and confidence by every experience in which you really stop to look fear in the face. You are able to say to yourself, 'I lived through this horror. I can take the next thing that comes along.'",Eleanor Roosevelt,"Courage, Experience, Strength"
"It is not death that a man should fear, but he should fear never beginning to live.",Marcus Aurelius,"Death, Man, Beginning"
"To fear love is to fear life, and those who fear life are already three parts dead.",Bertrand Russell,"Life, Love, Love Is"
FOMO (fear of missing out) is the enemy of valuing your own time.,Andrew Yang,"Time, Your, Enemy"
"Red is such an interesting color to correlate with emotion, because it's on both ends of the spectrum. On one end you have happiness, falling in love, infatuation with someone, passion, all that. On the other end, you've got obsession, jealousy, danger, fear, anger and frustration.",Taylor Swift,"Love, Happiness, Anger"
"When I have a camera in my hand, I know no fear.",Alfred Eisenstaedt,"Art, Know, No Fear"
The eagle has no fear of adversity. We need to be like the eagle and have a fearless spirit of a conqueror!,Joyce Meyer,"Courage, Adversity, Eagle"
"I don't run away from a challenge because I am afraid. Instead, I run toward it because the only way to escape fear is to trample it beneath your feet.",Nadia Comaneci,"Your, Feet, I Am"
Power does not corrupt. Fear corrupts... perhaps the fear of a loss of power.,John Steinbeck,"Power, Loss, Corrupts"
"The moment we begin to fear the opinions of others and hesitate to tell the truth that is in us, and from motives of policy are silent when we should speak, the divine floods of light and life no longer flow into our souls.",Elizabeth Cady Stanton,"Life, Truth, Moment"
Resist your fear; fear will never lead to you a positive end. Go for your faith and what you believe.,T. D. Jakes,"Positive, Faith, Your"
Healthy children will not fear life if their elders have integrity enough not to fear death.,Erik Erikson,"Life, Death, Integrity"
"Our heavenly Father understands our disappointment, suffering, pain, fear, and doubt. He is always there to encourage our hearts and help us understand that He's sufficient for all of our needs. When I accepted this as an absolute truth in my life, I found that my worrying stopped.",Charles Stanley,"Life, God, Truth"
Fear makes strangers of people who would be friends.,Shirley MacLaine,"Friendship, People, Strangers"
I delight in what I fear.,Shirley Jackson,Delight
"Living with fear stops us taking risks, and if you don't go out on the branch, you're never going to get the best fruit.",Sarah Parish,"Best, Fruit, Risks"
