title,author,tags
"To me, Ann Romney sounds like a better candidate than her husband. She put her MS into remission through horseback riding, alternative therapies, and a healthy diet. She knows how to pace herself. She has a sense of humor and an innate honesty, and her hair moves in the wind. Maybe she should run.",Patti Davis,"Diet, Honesty, Wind"
"I grew up on EC comic books and 'Tales From the Crypt,' which were all loaded with humor, bad jokes, and puns. I can have that kind of fun and make these comic book movies but, at the same time, talk about things I want to talk about - whether it's consumerism or the Bush administration or war.",George A. Romero,"Time, War, Movies"
"It's self-effacing, it's hard-luck, the shtetl stories. All those Coasters things are an amalgam of Yiddish and black humor.",Jerry Leiber,"Black, Things, Those"
I used to watch 'The Waltons' and sob because my family was nothing like that. We had a cruel sense of humor in my family.,Paula Poundstone,"Family, Nothing, Sense Of Humor"
"So, I'm thinking of a name for a villain that has a sense of humor. I thought of 'The Joker' as a name, and as soon as I thought that, I associate it with the playing card, as my family had a tradition of champion playing; my brother was a contract champion bridge player. There were always cards around the house.",Jerry Robinson,"Family, Always, Champion"
"I think people are sexy when they have a sense of humor, when they are smart, when they have some sense of style, when they are kind, when they express their own opinions, when they are creative, when they have character.",Suzanne Vega,"Sexy, Character, Smart"
I've met a lot of people who've lost their jobs and they still have a sense of humor.,Louis C. K.,"Lost, People, Sense Of Humor"
"I still haven't found the humor in getting hit by a cement truck. My knees still hurt when I think about it, so no jokes about that yet.",Adam DeVine,"Hurt, Truck, Think"
"Humor must not professedly teach and it must not professedly preach, but it must do both if it would live forever.",Mark Twain,"Live, Forever, Must"
I can't live without a sense of humor. I need to be laughing and entertained at all times.,Carlos Ponce,"Sense Of Humor, Live, Need"
"My dad's sense of humor was direct and sometimes surreal - his quick wit is well known amongst our family and friends. He raised me on Spike Jones records and W.C. Fields movies, and his sense of humor fell somewhere in between.",Tony Visconti,"Family, Movies, Dad"
I'm strange! I have a weird sense of humor! I look crazy!,Trixie Mattel,"Look, Crazy, Sense Of Humor"
"I think the Canadian sense of humor is dryer than America's and juicier than Britain's. I think it's a cross between the two of them, really.",Scott Thompson,"America, Sense Of Humor, Cross"
I loved Peter Sellers. I thought he was the perfect mix of physical comedy with out-of-the-box humor. I loved his tone; I loved his physicality; I loved everything about what he was doing as a comedic actor.,J. B. Smoove,"Doing, Comedy, Perfect"
"If you're playing a good guy, you show some darkness. If you're playing a dark guy, you show something different, like humor, that will mix it up and hopefully surpass the audience's expectations. What I'm battling all the time is complacency in the audience. I try to bring a little mystery to what might happen because that engages people more.",Campbell Scott,"Good, Time, Darkness"
"Congratulations, you have a sense of humor. And to those who didn't: Go stick your head in the mud.",Jesse Ventura,"Your, Sense Of Humor, Go"
I was born with a mother who loved me unconditionally and with a sense of humor.,Anthony Ray Hinton,"Me, Mother, Sense Of Humor"
"I wore goofy hats to school and did musical theater. Most people thought I was a dork. But if you have a sense of humor about it, no one can bring you down.",Zac Efron,"People, Sense Of Humor, School"
There are psychological repercussions to illness and we need a little more help to get through the effects not only on the afflicted but on the family. And I think there's even a place for humor in that.,Alan Thicke,"Family, Place, Help"
"Those who knew Lincoln described him as an extraordinarily funny man. Humor was an essential aspect of his temperament. He laughed, he explained, so he did not weep.",Doris Kearns Goodwin,"Funny, Man, Who"
"I know, being a band that's mostly gay and has women in it, I just think that there are the male icon bands: they are always - and they deserve it - but they are always touted as, 'These guys are heavy-duty.' I think bands, because we have a sense of humor, we are not always taken as seriously.",Kate Pierson,"Women, Always, Gay"
I definitely need a girl that has a good sense of humor because there are some girls that are just very uptight.,Romeo Santos,"Good, Sense Of Humor, Girl"
"I like to be able to feel as many parts of myself while watching a movie at one time. I think that's what 'Super' is - it's funny, but it's also sad. It's very touching in certain ways, and it's also got a very dark sense of humor. So it's allowed to go anywhere.",James Gunn,"Funny, Sad, Time"
I don't understand how somebody wouldn't have a sense of humor about themselves.,John Malkovich,"Sense Of Humor, Understand, Sense"
"OK, in all seriousness, I would say I couldn't be in a relationship without equality, generosity, integrity, spirit, kindness and humor. And awesomeness.",Jennifer Aniston,"Equality, Relationship, Kindness"
"I've never met a person who has more integrity than my husband. I respect that. There's his humor and intelligence, too, and he's really cute, all those things - but if you don't respect your partner, you'll get sick of him.",Michelle Pfeiffer,"Respect, Intelligence, Your"
I think great humor lies in playing the truth of a situation. I see myself as a performer and that applies to a Greek drama or a modern comedy.,Brendan Coyle,"Truth, Great, Myself"
"I'm not just a big-haired redhead country singer who dresses flamboyantly, has this wicked sense of humor and wears rhinestones.",Naomi Judd,"Country, Sense Of Humor, Wicked"
"Back in 2004, Kellie Overbey handed me her play 'Girl Talk' to read. I fell in love with her brutally delicious humor and the fearlessly deft way in which she drew her characters. They jumped off the page and begged me to give them a space in which to stomp around.",Carrie Preston,"Love, Space, Me"
Humor and seriousness are not in opposition to each other.,Al Franken,"Opposition, Seriousness, Other"
"Anyone who knows me, and most of my fans, know that I have a sense of humor.",Glenn Danzig,"Me, Know, Fans"
"I'll speak for myself, but there's a lot of humor to be found in sarcasm and darkness. You talk to any paramedic, they survive by developing a pretty off-kilter sense of humor.",Nicolas Cage,"Myself, Darkness, Speak"
I have a very dark sense of humor.,Andy Dick,"Sense Of Humor, Dark, Sense"
And how can you be happy if you don't laugh or appreciate humor?,Mary L. Trump,"Laugh, Happy, Be Happy"
"I think sometimes my humor is extremely dry, and a lot of times I would say things that I thought were very funny but... I have a reputation of - people think of me as a very fundamentalist, humorless fellow.",Ian MacKaye,"Funny, Reputation, Me"
"I think 'Star Trek' has a really beautiful legacy of humor, along with the more philosophical and action parts of 'Star Trek.' And so I felt pretty honored to get to keep that legacy going.",Mary Wiseman,"Beautiful, Legacy, Keep"
I love the vulgar. I kind of have the humor of a 17-year-old boy.,Judy Gold,"Love, Boy, Vulgar"
It doesn't take many people to have a bad sense of humor to get in trouble at a corporation.,Scott Adams,"Bad, People, Sense Of Humor"
"As an actor, I'm attracted to drama; as a director, it's humor - because it's the story of my life, and I can't be that serious about it. Being alone is a big theme in all my movies, both as a director and as an actress.",Jodie Foster,"Life, Alone, Movies"
Married people should not be quick to hear what is said by either when in ill humor.,Samuel Richardson,"People, Hear, Quick"
President Ford used humor a great deal.,Robert Orben,"Great, Deal, Great Deal"
Cameron Crowe can write dialogue and shoot it with warmth and humor like nobody else.,Emma McLaughlin,"Nobody, Dialogue, Shoot"
Humor helps ease the tension of race and the differences in society. If there wasn't comedy I don't know if Obama could have ever become president.,Marlon Wayans,"Society, Differences, Know"
"Humor does not rescue us from unhappiness, but enables us to move back from it a little.",Mason Cooley,"Back, Us, Rescue"
Humor is so important to the American scene throughout history.,Bob Newhart,"History, Important, American"
"It's an amusing idea to some, this feminism thing - this audacious notion that women should be able to move through the world as freely, and enjoy the same inalienable rights and bodily autonomy, as men. At least, that's the impression given when feminism and feminists are all too often the targets of lazy humor.",Roxane Gay,"Women, Men, World"
"Those years on the golf course as a caddie, boy, those people were something. They were vulgar, some were alcoholics, racist, they were very difficult people to deal with. A lot of them didn't have a sense of humor.",Martin Sheen,"Difficult, People, Sense Of Humor"
"My dad is and was very funny and had a really dry sense of humor, which, as a kid, seemed un-fun. But in retrospect, it's kind of hilarious.",John Mulaney,"Funny, Dad, Sense Of Humor"
"My dad instilled in me a great sense of humor. I wasn't bullied at school because my outward attitude was confident, and that helps.",Warwick Davis,"Attitude, Great, Dad"
Bands from Akron have a sense of humor and don't tend to take themselves too seriously.,Dan Auerbach,"Sense Of Humor, Seriously, Sense"
"Sometimes I used to think to myself, 'Have I lost a sense of humor?' but I don't think that I have. I think one can be as snarky and sarcastic as lots of people, but I have never found that it makes me particularly happy.",Kenneth Branagh,"Myself, Me, Lost"
"In my first story, 'Mr. Mysterious & Company'... I was asked to take out some of the humor because editors were afraid reviewers would dismiss the book as a joke. Today, humor is enjoyed and no longer regarded as literary brummagem.",Sid Fleischman,"Today, Mysterious, Story"
"All the greatest comedians use comedy and humor to release pain and sadness, and I think that instead of wanting to live within my pain, or live within my sadness, I try to be funny and look at things with a funny view.",Princess Nokia,"Funny, Pain, View"
"With song titles, I try to keep a healthy sense of humor while saying something at the same time.",Arca,"Time, Song, Try"
"I think American guys tend to be a bit more forward, a bit more chatty and open than the Brits. The Brits seem to have a darker sense of humor, though I have met some Americans who have adopted bits of the British dry sense of humor as well.",Hayley Atwell,"Sense Of Humor, American, Open"
"The guys in my band are great-we watch movies, we eat pizza, take walks, read books. Everybody has a really great sense of humor. And my boyfriend comes and visits me on the road.",Lisa Loeb,"Great, Movies, Me"
"I like beautiful writing, pain, unexpected humor, and the message that, at the last second, people are going to be kind to each other. It almost doesn't matter what the genre is.",Jeff Giles,"Beautiful, Pain, Unexpected"
"Who I was was not acceptable to black L.A. youth: the way I spoke and my sense of humor. Everybody else had relaxers and pressed hair. I wore my hair in an Afro puff. Nappy. The way I dressed. It was all about name brands at the time in L.A. I had no idea. All those things, I failed miserably at.",Issa Rae,"Time, Youth, Hair"
"I don't think that I could have survived in my family without a naughty sense of humor; yeah, absolutely. I think my brother and I both get our senses of humor from our parents. I mean, my mother was absolutely hilarious and foul. She had the most ridiculously off color sense of humor, so that was sort of what we grew up with.",Rachael MacFarlane,"Family, Naughty, Parents"
Athletes tend to have less of a sense of humor than most people. They are heroes to so many. That might be part of it.,Jeff Ross,"People, Sense Of Humor, Sense"
I think that humor is part of what saves us from despair.,John Perry Barlow,"Despair, Us, Think"
"I guess, for me, I've always thought that there was humor everywhere. And as a kid, I just, you know, I grew up an only child, and I - sort of nothing made me happier than to make my parents laugh. I remember I had costumes and things laying around the house that I was, you know, anything that I could do to make my parents laugh.",Justin Timberlake,"Always, Parents, Remember"
"I didn't want to perform comedy. I always loved humor. Loved making people laugh. I was a big stand up fan, but it wasn't until I was managing a restaurant that had a comedy night and one of the producers asked me to go on stage that I wanted to do it.",Andrew Schulz,"Always, Me, Restaurant"
"I like bawdy humor. I love bawdy humor, but not dirty humor.",Betty White,"Love, Dirty, Like"
"And for my family, comedically, that was the key to a lot of the humor.",Damon Wayans,"Family, Key, Lot"
I think 'Country Girl' is one song that can veer into country or hip-hop or rap. You can listen to it and enjoy the humor and the fun in it.,Luke Bryan,"Song, Country, Fun"
"A sense of humor is important. I'm always attracted to a girl with confidence. In terms of looks, I don't have a type. I think a lot of girls think that they have to be super-thin, to meet the Hollywood image, but I think a girl who is voluptuous is very beautiful.",Corey Sevier,"Beautiful, Always, Confidence"
"When you say a friend has a sense of humor do you mean that he makes you laugh, or that he can make you laugh?",Max Frisch,"Laugh, Sense Of Humor, Friend"
Humor's an excellent way to make a point more palatable and/or relatable.,Jen Lancaster,"Way, Make, Point"
"I always felt different as a kid, and the Kinks were like, 'Yeah, we're the Kinks.' Celebrate your difference; don't be afraid of your sense of humor, or your personality, or who you are. It emboldened me.",Michael Weatherly,"Personality, Always, Celebrate"
My view of life is colored by humor and looking at the best in any situation.,Michael J. Fox,"Life, Best, View"
"I'm sure there are people who survive tragedy without humor, but I've never met any of them. Nor would I be particularly interested in writing about them if I did meet them.",Ayelet Waldman,"People, Survive, Never"
"A lot of my humor centers on the act of telling jokes and I think this can prevent certain audiences from suspending their feeling of disbelief. It might piss a few people off, but I can't help it.",Michael Showalter,"People, Feeling, Help"
'Big Bang Theory' is not my kind of show. It's not my humor. I don't like multicam comedies. I don't want an audience to tell me when to laugh.,Zachary Knighton,"Me, Laugh, Audience"
"There's some sort of unspoken license... when outlandish things come out of an inanimate object, somehow it equals humor.",Jeff Dunham,"Things, Come, License"
"When you finish a drama, you go, 'I can't wait to do a comedy.' When you finish a comedy, you go, 'I want to do a dramedy, dark humor.'",Michael Pena,"Wait, Dark, Comedy"
"Humor can inform and break down stigma, which is a huge issue in the military.",Garry Trudeau,"Down, Break, Stigma"
"The President has a wonderful sense of humor, which is one of the reasons it is so much fun to work for him.",Karen Hughes,"Work, Sense Of Humor, Fun"
"We're a family with a pretty light sense of humor but, still, on the anniversary of my mom's passing we don't feel like getting 'colorful' and remembering her favorite foods. Every March 5th, the anniversary of her passing, we go to church and are sad for pretty much the rest of the day.",Marcela Valladolid,"Family, Sad, Anniversary"
One of my favorite things about 'Star Trek' wasn't just the overt banter but the humor in that show about the relationships between the main characters and their reactions to the situations they would face; there was a lot of comedy in that show without ever breaking its reality.,J. J. Abrams,"Face, Reality, Comedy"
"Down the road, I'll probably have a kid or two or three. And there will probably be political events or spiritual things to comment on, and humor.",Alanis Morissette,"Political, Spiritual, Road"
"Today's business and health care climate may not be pleasant. Cutbacks, pay cuts and layoffs do not make anyone's job easy. But that does not mean that the humor need stop.",Allen Klein,"Health, Business, Today"
"Funny is a good foil. Humor is illuminating, and it also gives you power.",Josh Tillman,"Funny, Good, Power"
"Men will confess to treason, murder, arson, false teeth, or a wig. How many of them will own up to a lack of humor?",Frank Moore Colby,"Men, Will, Own"
"My mother was very funny. My dad had a great sense of humor. My grandmother, too.",Carol Burnett,"Funny, Great, Dad"
"Suspense is very important. Even though this is humor and they're short stories, that theory of building suspense is still there.",Sergio Aragones,"Important, Building, Suspense"
If I ever have sex with someone I might be able to develop a sense of humor.,Kate Beckinsale,"Sex, Sense Of Humor, Someone"
"My stories are very somber, so I think I need the comic ingredient. Besides, life has so much humor.",Manuel Puig,"Life, Much, Comic"
"I love doing comedy. You don't get many good comedy scripts. They're rare. But, I do love playing comedy. Even in drama, I like to try to find the humor because I think it's very human.",Colm Meaney,"Love, Good, Doing"
"My parents armed me with an amazing sense of humor, and it's what you need when, well, it's what anyone needs in this world.",Warwick Davis,"Amazing, World, Parents"
I think there's something about the Irish experience - that we had to have a sense of humor or die.,Frank McCourt,"Experience, Die, Sense Of Humor"
Denzel Washington has a great sense of humor. He did all those 'Nutty Professor' movies.,Seth MacFarlane,"Great, Movies, Sense Of Humor"
People who know me know I have a sense of humor that can really push the envelope.,Carmen Electra,"Me, Know, People"
"I love a girl with a sense of humor. Someone who can make me laugh and that I can get along with and talk with and who is just sweet overall, inside and out.",Logan Henderson,"Love, Sweet, Me"
"Sense of humor is important in life, not just in clothing. How boring to live a life in beige.",Jean Pigozzi,"Life, Boring, Important"
I really hate sitcoms on television with canned laughter and stuff. What really makes me laugh is the real-life stuff. I've got a dry sense of humor.,Katie Price,"Hate, Laughter, Me"
"However, frat-boy humor is funny and it always will be.",Craig Kilborn,"Funny, Always, Will"
"There are certain things I learned when I first started learning about acting, to try and place the character physically and emotionally. And the way you place them emotionally is often with humor.",David Duchovny,"Learning, Character, Try"
I think that sense of humor is important in marriage. A sense of humor gets people through marriage.,Connie Britton,"Marriage, Important, People"
"The book, '12 Rules For Life,' is a very serious book. There's elements of humor in it, but I'm trying to struggle with things at the deepest possible level and to explain to people why it's necessary to live a upstanding and noble and moral and truthful and responsible life, and why there's hell to pay if you don't do that.",Jordan Peterson,"Life, Struggle, Life Is A"
"My father could be very witty, even if the humor was always on the darker side of irony.",Maurice Sendak,"Always, Father, Irony"
"I read the script and decide if a particular character looks fun to play. I look for complexity and a sense of humor. Those are crucial, real things to life.",Steve Buscemi,"Life, Character, Look"
"And I loved Fats Waller. I love his instrumental abilities, his vocal abilities and his sense of humor.",Paul McCartney,"Love, Sense Of Humor, Loved"
I don't really like using ridicule as a form of humor.,Alison Jackson,"Like, Ridicule, Really"
"I think if I would have started BIG in America, I would probably never have called it BIG. There was nothing but a little bit of local small country humor in the idea.",Bjarke Ingels,"Nothing, Country, America"
I stay far away from political humor.,Anjelah Johnson,"Political, Far Away, Stay"
Dali had a good sense of humor - obviously you could tell just looking at him; he was funny.,Joe Grant,"Funny, Good, Looking"
"If you look at terrorists, they really have no sense of humor.",Al Franken,"No Sense, Look, Sense Of Humor"
"We're all screwed up. And the way Christians mess things up is we act like we've got it going on. And if we would just stay in that place of, 'Hey, we're all screwed up and but for the grace of God, none of us have a shot here.' We need to have a sense of humor about it; that's kind of the way I've always faced my comedy.",Jeff Foxworthy,"God, Always, Grace"
"With Portlandia, I don't think our intention is always to find something funny. Sometimes the humor comes from taking something really seriously. We're okay with making somebody feel uncomfortable or uneasy.",Carrie Brownstein,"Funny, Always, Find"
"It's curious that apart from the baroque ranting, 'Sarah & Duck' is very similar to 'The Thick Of It' - great characters, excellent writing and lots of humor!",Roger Allam,"Great, Duck, Curious"
The one thing I didn't expect was to learn how much of a sense of humor Jerry Reinsdorf has. He's really funny. I never got a chance to see his sense of humor when I was working for him or playing for him.,B. J. Armstrong,"Funny, Chance, Sense Of Humor"
"Kerry Washington is the most fun: she cracks me up! Everyone talks about how drop-dead gorgeous, smart, and fashionable she is, and she is all of that, but I must add she's the hugest goofball. She has the best sense of humor and lightheartedness that makes coming into work every day so delightful.",Darby Stanchfield,"Work, Best, Day"
I find intelligence sexy. I find a sense of humor sexy. I find sensitivity sexy.,Nicole Appleton,"Intelligence, Sexy, Find"
"Low' was probably the album that influenced me more than any other, because of how it combined humor and impressive, glamorous, driving energy with this totally surreal soundscape production.",Caroline Polachek,"Energy, Me, Glamorous"
I have a very dark sense of humor. I swear. I have a very playful relationship with Jesus.,Anne Lamott,"Relationship, Sense Of Humor, Dark"
"The waltz is a very important part of my life. It's a very important way for me to express my positiveness, bringing humor to the world.",Andre Rieu,"Life, World, Me"
Humor has become so cliche and boring that nothing's funny anymore unless it involves something totally disgusting that offends somebody or makes them feel really uncomfortable.,Tom DeLonge,"Funny, Boring, Nothing"
"I think a lot of people, when they don't quite fit in in the world, use humor to combat that and to find their place in society.",Kaya Scodelario,"Society, World, Find"
"He used humor more effectively than any president since Abraham Lincoln. Reagan was not an especially warm person, but he appeared to be. Many people disliked his policies, but almost no one disliked him.",H. W. Brands,"People, Person, Warm"
"The rejection that we all take and the sadness and the aggravation and the loss of jobs and all of the things that we live through in our lives, without a sense of humor, I don't know how people make it.",Marlo Thomas,"Sadness, Know, People"
I don't think humor is forced upon my universe; it's a part of it.,Manuel Puig,"Universe, Think, Forced"
"True humor springs not more from the head than from the heart. It is not contempt; its essence is love. It issues not in laughter, but in still smiles, which lie far deeper.",Thomas Carlyle,"Love, Heart, Laughter"
"I've always liked using humor, but what I had to with 'Chewing Gum' was take out a lot of darkness so it would be a bit more feel-good.",Michaela Coel,"Always, Darkness, More"
"You can't do anything to be funny. That's cringeworthy. If your humor comes out of a place of love every time, you don't make the joke bigger than you. The funniest comedians are in touch with their emotional level.",John Krasinski,"Funny, Love, Time"
People are wired for lots of things. We're wired for novelty. We're wired for humor. We're wired for new pieces of information that surprise us in some way or add value to our lives. We're wired for fear.,Ramez Naam,"Fear, Value, Surprise"
"But because it was able to balance that kind of humor with a sweet story and characters you really rooted for and also got across the girls' point of view, I've heard nothing but great things from younger and older females as well.",Jason Biggs,"Great, Sweet, View"
"Two young actresses I admire are Emma Stone and Emma Watson, because they are intelligent, talented actresses and have a great sense of humor. They have learned to balance what they love in life - acting, school and everything else.",Kara Hayward,"Life, Love, Great"
"I'd probably describe my sense of humor as 'twisted,' I guess. It's not hard to make me laugh, especially when I'm surrounded by my close friends, especially my bandmates.",Mac DeMarco,"Me, Laugh, Sense Of Humor"
I think empathy is romantic. I think humor is romantic. Kindness is romantic. I think those kind of gestures of caring and love are romantic.,Michael Buble,"Love, Romantic, Kindness"
"My wife has a good sense of humor, and instead of calling me psychic with my novels, she simply refers to me as being 'psycho.' That's because multiple things in my books have come true.",Brad Thor,"Good, Wife, Me"
