title,author,tags
A day without laughter is a day wasted.,Charlie Chaplin,"Day, Laughter, Wasted"
"There is a thin line that separates laughter and pain, comedy and tragedy, humor and hurt.",Erma Bombeck,"Pain, Laughter, Hurt"
Analyzing humor is like dissecting a frog. Few people are interested and the frog dies of it.,E. B. White,"People, Frog, Interested"
Everywhere is within walking distance if you have the time.,Steven Wright,"Time, Walking, Distance"
Laughter is the closest distance between two people.,Victor Borge,"Laughter, People, Distance"
"If you could choose one characteristic that would get you through life, choose a sense of humor.",Jennifer Jones,"Life, Sense Of Humor, Choose"
Humor is one of the best ingredients of survival.,Aung San Suu Kyi,"Best, Survival, Ingredients"
"You may not be able to change a situation, but with humor you can change your attitude about it.",Allen Klein,"Attitude, Change, Your"
Start every day off with a smile and get it over with.,W. C. Fields,"Smile, Day, Start"
A person without a sense of humor is like a wagon without springs. It's jolted by every pebble on the road.,Henry Ward Beecher,"Road, Person, Sense Of Humor"
Laughter is an instant vacation.,Milton Berle,"Laughter, Vacation, Instant"
Humor is just another defense against the universe.,Mel Brooks,"Universe, Defense, Against"
The most wasted of all days is one without laughter.,e. e. cummings,"Laughter, Wasted, Days"
A sense of humor... is needed armor. Joy in one's heart and some laughter on one's lips is a sign that the person down deep has a pretty good grasp of life.,Hugh Sidey,"Life, Good, Heart"
It's always funny until someone gets hurt. Then it's just hilarious.,Bill Hicks,"Funny, Always, Hurt"
"Like a welcome summer rain, humor may suddenly cleanse and cool the earth, the air and you.",Langston Hughes,"Cool, Rain, Welcome"
Imagination was given to man to compensate him for what he isn't. A sense of humor was provided to console him for what he is.,Horace Walpole,"Imagination, Man, Sense Of Humor"
Comedy is simply a funny way of being serious.,Peter Ustinov,"Funny, Way, Serious"
"It is the ability to take a joke, not make one, that proves you have a sense of humor.",Max Eastman,"Sense Of Humor, Ability, Make"
Humor is by far the most significant activity of the human brain.,Edward de Bono,"Brain, Human Brain, Human"
Humour is the weapon of unarmed people: it helps people who are oppressed to smile at the situation that pains them.,Simon Wiesenthal,"Smile, Situation, People"
"A taste for irony has kept more hearts from breaking than a sense of humor, for it takes irony to appreciate the joke which is on oneself.",Jessamyn West,"Sense Of Humor, Irony, Taste"
"Everything is funny, as long as it's happening to somebody else.",Will Rogers,"Funny, Long, Everything"
"A little perspective, like a little humor, goes a long way.",Allen Klein,"Long, Way, Perspective"
Comedy has to be based on truth. You take the truth and you put a little curlicue at the end.,Sid Caesar,"Truth, End, Comedy"
"Common sense and a sense of humor are the same thing, moving at different speeds. A sense of humor is just common sense, dancing.",Clive James,"Sense Of Humor, Common Sense, Moving"
Humor is everywhere in that there's irony in just about anything a human does.,Bill Nye,"Irony, Human, Anything"
Imagination was given to man to compensate him for what he is not; a sense of humor to console him for what he is.,Francis Bacon,"Imagination, Man, Sense Of Humor"
Humor is mankind's greatest blessing.,Mark Twain,"Blessing, Mankind, Greatest"
"I have seen what a laugh can do. It can transform almost unbearable tears into something bearable, even hopeful.",Bob Hope,"Laugh, Tears, Something"
"Most comedy is based on getting a laugh at somebody else's expense. And I find that that's just a form of bullying in a major way. So I want to be an example that you can be funny and be kind, and make people laugh without hurting somebody else's feelings.",Ellen DeGeneres,"Funny, Bullying, Laugh"
"When humor goes, there goes civilization.",Erma Bombeck,"Civilization, Goes"
A joke's a very serious thing.,Charles Churchill,"Serious, Joke, Thing"
"Good planning is important. I've also regarded a sense of humor as one of the most important things on a big expedition. When you're in a difficult or dangerous situation, or when you're depressed about the chances of success, someone who can make you laugh eases the tension.",Edmund Hillary,"Success, Good, Laugh"
"I have a fine sense of the ridiculous, but no sense of humor.",Edward Albee,"No Sense, Sense Of Humor, Ridiculous"
I don't think it's possible to have a sense of tragedy without having a sense of humor.,Christopher Hitchens,"Sense Of Humor, Possible, Tragedy"
"If I had no sense of humor, I would long ago have committed suicide.",Mahatma Gandhi,"Long, Suicide, No Sense"
Humor is laughing at what you haven't got when you ought to have it.,Langston Hughes,"Got, Ought, Laughing"
"I realize that humor isn't for everyone. It's only for people who want to have fun, enjoy life, and feel alive.",Anne Wilson Schaef,"Life, Enjoy Life, Alive"
I can imagine no more comfortable frame of mind for the conduct of life than a humorous resignation.,W. Somerset Maugham,"Life, Mind, Resignation"
I think the scariest person in the world is the person with no sense of humor.,Michael J. Fox,"World, No Sense, Person"
A sense of humor is a major defense against minor troubles.,Mignon McLaughlin,"Sense Of Humor, Sense, Defense"
The duty of comedy is to correct men by amusing them.,Moliere,"Men, Duty, Comedy"
Good humor is a tonic for mind and body. It is the best antidote for anxiety and depression. It is a business asset. It attracts and keeps friends. It lightens human burdens. It is the direct route to serenity and contentment.,Grenville Kleiser,"Best, Good, Business"
"I love people who make me laugh. I honestly think it's the thing I like most, to laugh. It cures a multitude of ills. It's probably the most important thing in a person.",Audrey Hepburn,"Love, Me, Laugh"
Humor brings insight and tolerance. Irony brings a deeper and less friendly understanding.,Agnes Repplier,"Understanding, Tolerance, Irony"
Get well cards have become so humorous that if you don't get sick you're missing half the fun.,Flip Wilson,"Cards, Fun, Sick"
"From there to here, and here to there, funny things are everywhere.",Dr. Seuss,"Funny, Things, Here"
"Sometimes in the most tragic situation, something just profoundly funny happens.",David Hyde Pierce,"Funny, Situation, Sometimes"
Humor is reason gone mad.,Groucho Marx,"Reason, Mad, Gone"
"Comedy, we may say, is society protecting itself - with a smile.",J. B. Priestley,"Smile, Society, Comedy"
I think God has a tremendous sense of humor.,Rainn Wilson,"God, Sense Of Humor, Think"
The problem with having a sense of humor is often that people you use it on aren't in a very good mood.,Lou Holtz,"Good, Good Mood, Mood"
The secret source of humor is not joy but sorrow; there is no humor in Heaven.,Mark Twain,"Joy, Heaven, Sorrow"
Impropriety is the soul of wit.,W. Somerset Maugham,"Soul, Wit"
It's a funny old world.,Margaret Thatcher,"Funny, World, Old"
"A pun is the lowest form of humor, unless you thought of it yourself.",Doug Larson,"Yourself, Thought, Unless"
You can't be funny if you don't have good material.,Matt LeBlanc,"Funny, Good, Material"
"If it gets laughs, it's funny.",Rachel Dratch,"Funny, Laughs, Gets"
I've learned to have a sense of humor about myself. Lord knows everyone else does!,Debbie Gibson,"Myself, Sense Of Humor, Everyone"
"We are, in the comics, the last frontier of good, wholesome family humor and entertainment.",Bil Keane,"Family, Good, Entertainment"
"If you can get humor and seriousness at the same time, you've created a special little thing, and that's what I'm looking for, because if you get pompous, you lose everything.",Paul Simon,"Time, Lose, Looking"
Humor is emotional chaos remembered in tranquility.,James Thurber,"Chaos, Tranquility, Remembered"
The secret to humor is surprise.,Aristotle,"Surprise, Secret"
I think the next best thing to solving a problem is finding some humor in it.,Frank A. Clark,"Best, Finding, Think"
"Humor has bailed me out of more tight situations than I can think of. If you go with your instincts and keep your humor, creativity follows. With luck, success comes, too.",Jimmy Buffett,"Success, Luck, Your"
Humor is merely tragedy standing on its head with its pants torn.,Irvin S. Cobb,"Tragedy, Head, Standing"
"One can never speak enough of the virtues, the dangers, the power of shared laughter.",Francoise Sagan,"Power, Laughter, Virtues"
"The more I live, the more I think that humor is the saving sense.",Jacob Riis,"Live, Think, More"
I'm not funny. What I am is brave.,Lucille Ball,"Funny, Brave, I Am"
Everything human is pathetic. The secret source of humor itself is not joy but sorrow. There is no humor in heaven.,Mark Twain,"Joy, Heaven, Sorrow"
Humor is the affectionate communication of insight.,Leo Rosten,"Communication, Insight, Affectionate"
"Honest good humor is the oil and wine of a merry meeting, and there is no jovial companionship equal to that where the jokes are rather small and laughter abundant.",Washington Irving,"Good, Laughter, Wine"
You are not angry with people when you laugh at them. Humor teaches tolerance.,W. Somerset Maugham,"Angry, Laugh, Tolerance"
A sense of humor is good for you. Have you ever heard of a laughing hyena with heart burn?,Bob Hope,"Good, Heart, Burn"
Different taste in jokes is a great strain on the affections.,George Eliot,"Great, Taste, Jokes"
There is no defense against adverse fortune which is so effectual as an habitual sense of humor.,Thomas Wentworth Higginson,"Sense Of Humor, Fortune, Sense"
You can't study comedy; it's within you. It's a personality. My humor is an attitude.,Don Rickles,"Attitude, Personality, Comedy"
Humor is the first of the gifts to perish in a foreign tongue.,Virginia Woolf,"Tongue, First, Perish"
"Humor is a serious thing. I like to think of it as one of our greatest earliest natural resources, which must be preserved at all cost.",James Thurber,"Serious, Think, Resources"
Wit is the lowest form of humor.,Alexander Pope,"Wit, Lowest, Form"
There seems to be no lengths to which humorless people will not go to analyze humor. It seems to worry them.,Robert Benchley,"Will, Worry, People"
"Humor distorts nothing, and only false gods are laughed off their earthly pedestals.",Agnes Repplier,"Nothing, Only, False"
What a strange world this would be if we all had the same sense of humor.,Bernard Williams,"World, Sense Of Humor, Strange"
"Humor is something that thrives between man's aspirations and his limitations. There is more logic in humor than in anything else. Because, you see, humor is truth.",Victor Borge,"Truth, Man, Logic"
"Humor is richly rewarding to the person who employs it. It has some value in gaining and holding attention, but it has no persuasive value at all.",John Kenneth Galbraith,"Value, Person, Attention"
"Humor is perhaps a sense of intellectual perspective: an awareness that some things are really important, others not; and that the two kinds are most oddly jumbled in everyday affairs.",Christopher Morley,"Awareness, Important, Perspective"
Humor is the instinct for taking pain playfully.,Max Eastman,"Pain, Instinct, Taking"
Humor is the most engaging cowardice.,Robert Frost,"Cowardice, Most, Engaging"
A well-developed sense of humor is the pole that adds balance to your steps as you walk the tightrope of life.,William Arthur Ward,"Life, Walk, Your"
Humor can alter any situation and help us cope at the very instant we are laughing.,Allen Klein,"Situation, Help, Us"
Puns are a form of humor with words.,Guillermo Cabrera Infante,"Words, Puns, Form"
Nothing like a little judicious levity.,Robert Louis Stevenson,"Nothing, Like, Little"
"Gags die, humor doesn't.",Jack Benny,Die
"A humorist is a person who feels bad, but who feels good about it.",Don Herold,"Good, Bad, Person"
This I conceive to be the chemical function of humor: to change the character of our thought.,Lin Yutang,"Change, Character, Chemical"
The satirist shoots to kill while the humorist brings his prey back alive and eventually releases him again for another chance.,Peter De Vries,"Chance, Alive, Back"
The best way to make your audience laugh is to start laughing yourself.,Oliver Goldsmith,"Best, Your, Yourself"
Humor comes from self-confidence.,Rita Mae Brown,Self-Confidence
"A laugh is a surprise. And all humor is physical. I was always athletic, so that came naturally to me.",Chevy Chase,"Always, Surprise, Me"
A sense of humor is the ability to understand a joke - and that the joke is oneself.,Clifton Fadiman,"Sense Of Humor, Ability, Understand"
"Women, as they grow older, rely more and more on cosmetics. Men, as they grow older, rely more and more on a sense of humor.",George Jean Nathan,"Women, Men, Grow"
Laughter is involuntary. If it's funny you laugh.,Tom Lehrer,"Funny, Laughter, Laugh"
All I know about humor is that I don't know anything about it.,Fred Allen,"Know, Anything, About"
"In conversation, humor is worth more than wit and easiness more than knowledge.",George Herbert,"Knowledge, Conversation, Worth"
I think being funny is not anyone's first choice.,Woody Allen,"Funny, Choice, First"
Humor does not diminish the pain - it makes the space around it get bigger.,Allen Klein,"Space, Pain, Bigger"
Great men are rarely isolated mountain peaks; they are the summits of ranges.,Thomas Wentworth Higginson,"Men, Great, Great Men"
Wit - the salt with which the American humorist spoils his intellectual cookery by leaving it out.,Ambrose Bierce,"American, Intellectual, Salt"
Our humor turns our anger into a fine art.,Mary Kay Blakely,"Art, Anger, Fine"
One doesn't have a sense of humor. It has you.,Larry Gelbart,"Sense Of Humor, Sense, You"
Wit is an explosion of the compound spirit.,Karl Wilhelm Friedrich Schlegel,"Spirit, Wit, Explosion"
"My mission in life is not merely to survive, but to thrive; and to do so with some passion, some compassion, some humor, and some style.",Maya Angelou,"Inspirational, Life, Passion"
"Smiling is definitely one of the best beauty remedies. If you have a good sense of humor and a good approach to life, that's beautiful.",Rashida Jones,"Life, Smile, Beauty"
"I love a man with a great sense of humor and who is intelligent - a man who has a great smile. He has to make me laugh. I like a man who is very ambitious and driven and who has a good heart and makes me feel safe. I like a man who is very strong and independent and confident - that is very sexy - but at the same time, he's very kind to people.",Nicole Scherzinger,"Love, Smile, Good"
"Your attitude is like a box of crayons that color your world. Constantly color your picture gray, and your picture will always be bleak. Try adding some bright colors to the picture by including humor, and your picture begins to lighten up.",Allen Klein,"Positive, Attitude, Always"
"Good humor is the health of the soul, sadness is its poison.","Philip Stanhope, 4th Earl of Chesterfield","Health, Sad, Good"
"It's your outlook on life that counts. If you take yourself lightly and don't take yourself too seriously, pretty soon you can find the humor in our everyday lives. And sometimes it can be a lifesaver.",Betty White,"Positive, Life, Your"
"My life is part humor, part roses, part thorns.",Bret Michaels,"Life, My Life, Thorns"
"Transparency, honesty, kindness, good stewardship, even humor, work in businesses at all times.",John Gerzema,"Work, Good, Kindness"
One of the things that binds us as a family is a shared sense of humor.,Ralph Fiennes,"Family, Sense Of Humor, Things"
Putting a little time aside for clean fun and good humor is very necessary to relieve the tensions of our time.,Hattie McDaniel,"Good, Time, Fun"
"As a person, he was wonderful. He really was a great person. He was full of life. He had a great sense of humor. Very talented, of course, but very caring to his parents. There was a very endearing quality about Elvis.",Priscilla Presley,"Life, Great, Parents"
"Keep your sense of humor, my friend; if you don't have a sense of humor it just isn't funny anymore.",Wavy Gravy,"Funny, Your, Keep"
"I think the sexiest thing about a woman is confidence, but confidence in a humble way, not in an arrogant way. Sense of humor is definitely important. And sunglasses always hide a multitude of sins. Sunglasses and a great pair of heels can turn most outfits around.",Victoria Beckham,"Great, Always, Humble"
"When humor can be made to alternate with melancholy, one has a success, but when the same things are funny and melancholic at the same time, it's just wonderful.",Francois Truffaut,"Funny, Success, Time"
"Humor is an affirmation of dignity, a declaration of man's superiority to all that befalls him.",Romain Gary,"Man, Dignity, Superiority"
You've got to have a sense of humor to keep your sanity.,Lance Bass,"Your, Keep, Sense Of Humor"
"A woman has to be intelligent, have charm, a sense of humor, and be kind. It's the same qualities I require from a man.",Catherine Deneuve,"Intelligence, Man, Woman"
Good humor is one of the best articles of dress one can wear in society.,William Makepeace Thackeray,"Attitude, Best, Good"
Celebrate your successes. Find some humor in your failures.,Sam Walton,"Celebrate, Your, Find"
People with a sense of humor tend to be less egocentric and more realistic in their view of the world and more humble in moments of success and less defeated in times of travail.,Bob Newhart,"Success, Humble, World"
"When a chick has a sense of humor, there's nothing more attractive.",Dylan O'Brien,"Nothing, Sense Of Humor, Attractive"
"We get to live in a time that we get to use social media as a tool. It's not just a face on a piece of paper, and that's what makes you someone's favorite model. We can have a very similar sense of humor as someone, and that's why we're their favorite model, or our personal style, off the runway, is why we're their favorite.",Gigi Hadid,"Time, Social Media, Face"
"Being a Hot Mom means being respected as a mom and a woman. And, the key to being a Hot Mom is having a sense of humor about yourself and all the crazy situations that arise.",Jami Gertz,"Mom, Yourself, Crazy"
"I believe that singing is the key to long life, a good figure, a stable temperament, increased intelligence, new friends, super self-confidence, heightened sexual attractiveness, and a better sense of humor.",Brian Eno,"Life, Good, Intelligence"
Kindness and a generous spirit go a long way. And a sense of humor. It's like medicine - very healing.,Max Irons,"Kindness, Long, Way"
"If you get a diagnosis, get on a therapy, keep a good attitude and keep your sense of humor.",Teri Garr,"Attitude, Good, Your"
"In the household in which I was raised, the themes were pretty simple. 'Work hard. Don't quit. Be appreciative, be thankful, be grateful, be respectful. Also, never whine, never complain. And always, for crying out loud, keep a sense of humor.'",Michael Keaton,"Work, Thankful, Always"
"Our subconscious minds have no sense of humor, play no jokes and cannot tell the difference between reality and an imagined thought or image. What we continually think about eventually will manifest in our lives.",Robert Collier,"Reality, No Sense, Will"
I've always thought the word cow was funny. And cows are sort of tragic figures. Cows blur the line between tragedy and humor.,Gary Larson,"Funny, Always, Cow"
"I am attracted to intelligence, a witty sense of humor, an adventurous outlook on life and spiritual awareness about one's self and the world.",Tanit Phoenix,"Life, Intelligence, World"
It's good to be able to laugh at yourself and the problems you face in life. Sense of humor can save you.,Margaret Cho,"Life, Good, Yourself"
I do not have a sense of humor of any recognizable sort.,Tommy Lee Jones,"Sense Of Humor, Sense, Any"
"Dad needs to show an incredible amount of respect and humor and friendship toward his mate so the kids understand their parents are sexy, they're fun, they do things together, they're best friends. Kids learn by example. If I respect Mom, they're going to respect Mom.",Tim Allen,"Friendship, Best, Respect"
This is a feminist bookstore. There is no humor section.,John Callahan,"Bookstore, Feminist, Section"
"I have no idea what a British sensibility or a British sense of humor is. I have no concept of what that is. I have no concept of what American sensibility is. I was born in Great Britain, but I was only there for six months, and we moved to Belgium, where I grew up.",Frank Oz,"Great, Sense Of Humor, Born"
"Be strong, believe in freedom and in God, love yourself, understand your sexuality, have a sense of humor, masturbate, don't judge people by their religion, color or sexual habits, love life and your family.",Madonna Ciccone,"Life, Love, God"
"Absurdity is what I like most in life, and there's humor in struggling in ignorance. If you saw a man repeatedly running into a wall until he was a bloody pulp, after a while it would make you laugh because it becomes absurd.",David Lynch,"Life, Man, Ignorance"
Humor is always based on a modicum of truth. Have you ever heard a joke about a father-in-law?,Dick Clark,"Truth, Dad, Always"
"What a newspaper needs in its news, in its headlines, and on its editorial page is terseness, humor, descriptive power, satire, originality, good literary style, clever condensation, and accuracy, accuracy, accuracy!",Joseph Pulitzer,"Good, Power, News"
"Wit is a weapon. Jokes are a masculine way of inflicting superiority. But humor is the pursuit of a gentle grin, usually in solitude.",Frank Muir,"Solitude, Gentle, Way"
"One seldom expects the country's president to adequately note the passing of a rocker, but Jimmy Carter's assessment of Elvis Presley's appeal - 'energy, rebelliousness and good humor' - is remarkably close to the mark.",Molly Ivins,"Good, Energy, Country"
I believe that economists put decimal points in their forecasts to show they have a sense of humor.,William Gilmore Simms,"Believe, Sense Of Humor, I Believe That"
You're not going to see my sense of humor on the football field. That's not a place for me to joke around.,Tom Brady,"Football, Me, Sense Of Humor"
It is characteristic of all deep human problems that they are not to be approached without some humor and some bewilderment.,Freeman Dyson,"Problems, Human, Deep"
"There are so many things to talk about between black people, Hispanic people, white people, gay people, men, women, it's all based on fear. We all have fears, this thing that stops us from embracing as we are one. We are never going to be one. People are messed up, but humor lets us see how ignorant we can be.",Marlon Wayans,"Women, Men, Fear"
Humor is the truth; wit is an exaggeration of the truth.,Stan Laurel,"Truth, Wit, Exaggeration"
"You can defeat fear through humor, through pain, through honesty, bravery, intuition, and through love in the truest sense.",John Cassavetes,"Love, Fear, Pain"
"I want to have fun. Life ain't no dress rehearsal. I want to have fun. I'm a comedian; I ain't no politician. So everything I do is with humor, with love.",Bernie Mac,"Life, Love, Dress"
"People ask if I feel pigeon-holed by always doing the same kind of humorous role. But my tool has always been humor because it's the most entertaining way to put any ideology across, and it's fun, and it's positive, and it's a healer. Laughter is God's gift. I feel privileged to be able to do it.",Goldie Hawn,"Positive, God, Always"
"And you know, whether it's drama or comedy, the best work is based on truth. It's just that, with comedy, the circumstances are just crazy-heightened, and you have these crazy things thrown at you. But you still have to do it truthfully, because that's where the humor comes from. So it's not that difficult to cross over.",Tony Hale,"Work, Best, Truth"
The man with the real sense of humor is the man who can put himself in the spectator's place and laugh at his own misfortune.,Bert Williams,"Man, Laugh, Own"
Total absence of humor renders life impossible.,Sidonie Gabrielle Colette,"Life, Impossible, Absence"
Humor is an antidote to all ills.,Patch Adams,"Antidote, Ills"
"Bathroom humor, fart, and poo poo humor in movies gets a laugh. It's a pretty easy audience, and that's been around for ages.",Selma Blair,"Movies, Laugh, Easy"
You are not just a funny person or just a journalist. Most people are hybrids of having a smart opinion and a great sense of humor.,Katie Nolan,"Funny, Great, Smart"
"Well, I mean, if a joke or humor is bawdy, it's got to be funny enough to warrant it. You can't just have it bawdy or dirty just for the sake of being that - it's got to be funny.",Betty White,"Funny, Enough, Dirty"
"I wasn't shy, but I was really hyper. Nobody got my sense of humor. I was a black skater kid.","Tyler, The Creator","Black, Nobody, Sense Of Humor"
"You hear people say, 'We take our Tennessee Williams very seriously. There is no laughter here.' It's full of humor! Not to laugh is a big, bad mistake!",Ruby Dee,"Mistake, Laughter, Laugh"
"Don't wish me happiness - I don't expect to be happy it's gotten beyond that, somehow. Wish me courage and strength and a sense of humor - I will need them all.",Anne Morrow Lindbergh,"Happiness, Courage, Strength"
The Good Humor man can only be pushed so far.,Nancy Cartwright,"Good, Man, Far"
"Poop humor is fun. If you do the toilet scenes well and commit to them, they can be really, really powerful.",Sandra Bullock,"Fun, Well, Toilet"
"My childhood, adolescence and high school days are unusually important. If there has ever been a time that I developed a uniqueness and sense of humor and the ability to organize, it was then. In those early days, I developed the skills that gave me a certain degree of success in American politics.",Lee Atwater,"Success, Politics, Time"
