title,author,tags
"I have the most guilty, abusive relationship with McDonald's. Left to my own devices, I'd probably eat four Big Macs a week.",Armie Hammer,"Own, Guilty, Week"
"A lot of the songs are based on my previous relationship. It didn't work out. I lost him, and it ruined me. I had to learn to get back on my feet. I used that heartbreak to create something really beautiful.",Yuna,"Work, Beautiful, Feet"
"All of our great traditions, religious, contemplative and artistic, say that you must a learn how to be alone - and have a relationship with silence. It is difficult, but it can start with just the tiniest quiet moment.",David Whyte,"Alone, Great, Moment"
I had a really complicated relationship with acting for a long time.,Cole Sprouse,"Time, Long, Long Time"
North Americans as a whole need to embrace having clothes altered to their body. I hear it all the time: why do the Europeans always look so good? They have a relationship with their tailor and spend the time and money to make their clothes look their best.,Michael Kors,"Best, Good, Time"
"I know I'm likeable, but living with me is different. Yes, I can be charming. That desire to please people and learning what to do to charm their socks off is something many of us do. But you get into a relationship, and the party's over at some point. They see the real you.",John Grant,"Learning, Me, Living"
My relationship with fashion is playful and very expressive of what I'm feeling at the time.,Phoebe Philo,"Time, Fashion, Feeling"
"The most important relationship a head coach has on his team isn't with the other coaches, the owner or the general manager. It's with the quarterback. He's the one who runs the show on the field; He's the ultimate extension of his coach. If there isn't a high level of mutual trust between them, both coach and quarterback will be doomed.",Bruce Arians,"Trust, Will, Important"
"Jose Mourinho was a difficult coach for me, and we had a respectful but complicated relationship. When I thought he would give me a chance, I couldn't prove to him that I was in good shape.",Kaka,"Good, Chance, Me"
"You are a child of the sun, you come from the sun, and that is something true with the Earth also... your relationship with the Earth is so deep, and the Earth is in you and this is something not very difficult, much less difficult then philosophy.",Thich Nhat Hanh,"Your, Sun, Difficult"
"When I was climbing, I built up a close relationship with the Sherpa people.",Edmund Hillary,"People, Up, Close"
"My dad and I didn't talk much. Our relationship was OK but not amazing. So there I was, dressed up in my sort of uniform, the clothes my band was wearing at the time. He could tell I was I getting serious. I guess he knew I was going to go for it. So he told me how to handle myself professionally, not to take what people write about me to heart.",Timothy B. Schmit,"Time, Amazing, Dad"
"I think if we want to find happiness by finding a life partner, then it's a little selfish. You should be complete within yourself, so that when you're in a relationship, you can give out happiness rather than expect it.",Shahid Kapoor,"Life, Happiness, Yourself"
"The biggest mistake is believing there is one right way to listen, to talk, to have a conversation - or a relationship.",Deborah Tannen,"Mistake, Way, Conversation"
"Whether you're keeping a journal or writing as a meditation, it's the same thing. What's important is you're having a relationship with your mind.",Natalie Goldberg,"Your, Mind, Important"
"The single woman is a free woman, and being single does not mean being alone - it means being free to have a relationship or not. This can be scary, but it's also very interesting.",Monica Bellucci,"Alone, Free, Woman"
"Over the years, I have found a way to use this business and this platform to talk with people about important issues. To the degree you can bring a sense of purpose to what you do, it makes the relationship with the customer that much more meaningful and purposeful.",Kenneth Cole,"Business, Purpose, Way"
"Rules help govern and steer a relationship along, so they're good things. But they become bad things when they become the narrow gate though which the relationship must always pass. When this happens, the rules become the basis for the relationship and, in a sense, become a substitute for the relationship.",Miroslav Volf,"Good, Always, Bad"
"I needed to take a break from acting, because I really idolized it. So I came off from it, and I went on a journey to discover my relationship with God, and I became a Christian. It really just gave me so much love and light within myself. I felt secure, like I didn't need validation from anyone else, or getting a part.",Letitia Wright,"Love, God, Myself"
God is the name people give to the reason we are here. But I think that reason is the laws of physics rather than someone with whom one can have a personal relationship. An impersonal God.,Stephen Hawking,"God, Name, Physics"
"An ultimate joint challenge for the biological and the computational sciences is the understanding of the mechanisms of the human brain, and its relationship with the human mind.",Tony Hoare,"Brain, Mind, Human Brain"
"I think that anyone who lives in New York, who's lived here, who's spent any time here, knows that it's basically a love-hate relationship, you might say. Even though I still think it's the greatest city in the world and I wouldn't live anywhere else, there're still things about it one doesn't like. The love far outweighs the negative.",Spike Lee,"Love, Time, World"
I believe a relationship with a country is simply bound to the interests of two countries and not by personal issues.,Saad Hariri,"Believe, Country, I Believe"
"I don't have the relationship that I thought I did with my fans. Maybe I did early on when I had a couple thousand fans, but it's not like us anymore. It's the idea of Notch and the 'Minecraft' community.",Markus Persson,"Community, Fans, Us"
"If your social media addiction comes between your relationship, you might want to quit.",Retta,"Social Media, Your, Media"
"My relationship with God has gotten so much stronger. He's always had his hand on me. He always guided me. I didn't always go where he wanted me to go. But He always had me. Now that I'm actually listening and being obedient, life is so much better.",DMX,"Life, God, Always"
"Any relationship should have love, and if there is no love, it is better to call off a relationship. People say that love happens only once, but I don't believe in it because for me, if one relationship doesn't work, you should move on and seek love in another relationship. Who knows; you might find love in the second relationship.",Bipasha Basu,"Love, Work, Believe"
"When you have that privilege of being able to talk directly with your chairman, like I've had with Daniel Levy, that make things a lot easier. Afterwards, I know what we've said to each other, and we have a relationship built on trust.",Hugo Lloris,"Trust, Your, Know"
I've had lunch with Alisson when he arrived at Liverpool. We have a very good relationship. He's a friend.,Ederson,"Good, Lunch, Friend"
I've lost count of the interviews I've done about my illness and its relationship to my ideas and writing.,Tony Judt,"Done, Lost, Ideas"
"The real issue is not talent as an independent element, but talent in relationship to will, desire, and persistence. Talent without these things vanishes and even modest talent with those characteristics grows.",Milton Glaser,"Persistence, Talent, Will"
"In my early professional years I was asking the question: How can I treat, or cure, or change this person? Now I would phrase the question in this way: How can I provide a relationship which this person may use for his own personal growth?",Carl Rogers,"Change, Growth, Treat"
"I'm Nigerian. I'm African. I have a lot to say. Apart from what I say, though, is the feeling. People can relate to that feeling. It's a reciprocal relationship. They feed off me and I feed off them.",Burna Boy,"Me, People, Feeling"
"I have a very wonderfully, bizarrely amazing relationship with my mother in that we've been through a myriad of emotions because we've acted together and played all these different kinds of mother-daughters.",Laura Dern,"Amazing, Together, Emotions"
"My dad owns his own towing business, and my dad used to tow Hulk Hogan's cars back and forth from Clearwater to different shops and stuff. And they had a relationship where when the cars would get done getting fixed, he'd pick it back up and take it back to Hulk Hogan's house.",Shaquem Griffin,"Business, Dad, Done"
"For me, I'm not a jealous person. That's just not my thing. You have to have trust in your relationship.",Fergie,"Trust, Your, Me"
The U.K.'s relationship with the U.S. has proved strong enough over time to bear the weight of honest disagreement. It does not require unconditional support where our interests or judgements differ.,John Chilcot,"Time, Support, Enough"
"I have my relationship with God and myself, and that's what matters to me. I really don't care what most people think.",Britney Spears,"God, Myself, Me"
"When you work together in a creative way, you have to be less selfish about your ideas and learn to let both parties feel valued. Of course, that's also a really great quality to have in a relationship, too.",St. Lucia,"Work, Great, Your"
I hate the whole concept of comfort! It's like when people say: 'Well we're not really in love but we're in a comfortable relationship.' You're abandoning a lot of ideas when you're too into comfort.,Christian Louboutin,"Love, Hate, Comfort"
Till now I have never shot a scene without taking account of what stands behind the actors because the relationship between people and their surroundings is of prime importance.,Michelangelo Antonioni,"People, Never, Behind"
"Anxiety and spiritual searching have been consistent themes with me, and that figures into my worldview. But I tend to make my songs sound like relationship songs.",David Bowie,"Me, Spiritual, Sound"
I used to do an impersonation of Hulk Hogan and Randy Savage in a romantic relationship.,Big Show,"Romantic, Used, Savage"
"If the relationship of father to son could really be reduced to biology, the whole earth would blaze with the glory of fathers and sons.",James Baldwin,"Biology, Father, Son"
"My personal belief is that you carry your own water in a relationship. If you see a girl and you think she's hot, that's a very human reaction, but you don't go and tell your spouse that, you know? So in one way it's how you behave.",Mark Ruffalo,"Your, Water, Way"
"AI does not keep me up at night. Almost no one is working on conscious machines. Deep learning algorithms, or Google search, or Facebook personalization, or Siri or self driving cars or Watson, those have the same relationship to conscious machines as a toaster does to a chess-playing computer.",Ramez Naam,"Learning, Me, Night"
"There was such a relationship between the buffalo and the American Indian - the Indians would eat them, live inside their pelts, use every part of the body. There was almost no separation between the people and the animals.",Val Kilmer,"Body, People, American"
"History shows us that in times of people feeling like they are in need of some sort of rebellion or protests, the artists rise because the poetry we create about pain and its relationship to culture in the world begins to soothe and heal people who are feeling confused or afraid.",Lady Gaga,"History, Poetry, Pain"
"You can be heartbroken about a relationship but also, from it, realize you are you, and you're okay with who you are or where you came from.",Mitski,"Okay, Realize, Where"
"We're producing spaces that accommodate human activity. And what I'm interested in is not the styling of that, but the relationship of that as it enhances that activity. And that directly connects to ideas of city-making.",Thom Mayne,"Ideas, Human, Activity"
"When you think about it, we actors are kind of prostitutes. We get paid to feign attraction and love. Other people are paying to watch us kissing someone, touching someone, doing things people in a normal monogamous relationship would never do with anyone who's not their partner. It's really kind of gross.",Megan Fox,"Love, Doing, People"
"Friendship brings in a lot of honesty and trust into any relationship, especially a marriage.",Farhan Akhtar,"Friendship, Trust, Marriage"
"I was in high school when Bill Clinton was impeached for lying under oath about his relationship with Lewinsky. We didn't have social media back then - hell, we didn't have a computer with the Internet in our home - so the details of it all escaped me.",Shaun King,"Home, Social Media, Internet"
"America has a love-hate relationship with celebrity. We love to follow celebrities, but we also love to mock them. And secretly, we believe we're better than they are.",Chuck Todd,"Love, Believe, Better"
"The relationship between parents and children, but especially between mothers and daughters, is tremendously powerful, scarcely to be comprehended in any rational way.",Joyce Carol Oates,"Parents, Way, Children"
But the relationship of morality and power is a very subtle one. Because ultimately power without morality is no longer power.,James Baldwin,"Power, Morality, Without"
"The attack on ObamaCare was that Congress does not have the power under the Commerce Clause to force a private citizen into a private contractual relationship. If such a thing is permitted to stand, the anti-ObamaCare forces argue, there will be no limit to Congress's power in the future.",John Podhoretz,"Future, Power, Stand"
There's going to be a symbiotic relationship between the edge and the cloud.,Peter Levine,"Edge, Cloud, Going"
"No one can live without relationship. You may withdraw into the mountains, become a monk, a sannyasi, wander off into the desert by yourself, but you are related. You cannot escape from that absolute fact. You cannot exist in isolation.",Jiddu Krishnamurti,"Yourself, Escape, Desert"
I think a primal role of a man in a relationship is to protect his woman.,Armie Hammer,"Man, Woman, Protect"
Royalties are not how most writers or musicians make their living. Musicians by and large make a living with a relationship with an audience that is economically harnessed through performance and ticket sales.,John Perry Barlow,"Living, Performance, Musicians"
"Both spiritual companionship and spiritual motherliness are not limited to the physical wife and mother relationship, but they extend to all people with whom woman comes into contact.",Edith Stein,"Wife, Spiritual, Woman"
"My stepdad didn't have a father growing up, so he didn't know how to have a father-son style conversation. Plus, we had a tense relationship in which he never really offered me advice.",Lecrae,"Me, Advice, Father"
"I wouldn't know what to do on a date. I don't have the time. To make a relationship work, I'd have to give something up, and I'm not so sure I'm willing to do that.",Tim Gunn,"Work, Time, Know"
"I've had a contemptuous relationship with authority throughout my life. I found myself at odds with authority, and I'm disdainful of blind authority.",J. K. Simmons,"Life, Myself, My Life"
The mentor-mentee relationship is ideally like that of the guru and disciple: motivated by the desire of the guru to impart knowledge to the disciple.,Vivek Wadhwa,"Knowledge, Desire, Guru"
"For most of us, relationship with another is based on dependence, either economic or psychological. This dependence creates fear, breeds in us possessiveness, results in friction, suspicion, frustration.",Jiddu Krishnamurti,"Fear, Frustration, Us"
Using no control and using humor will build a relationship and make a dent to where the client puts the counselor in their quality world and then begins to relate and seek out the counselor. Effective therapy begins with the acceptance of the therapist into the client's quality world.,William Glasser,"Humor, World, Quality"
"My relationship with my brothers... it's almost weird. We've never fought, we finish each other's sentences, but not in a creepy way. We talk about the things that we love and share music with each other.",Porter Robinson,"Love, Music, Way"
"We are involved in youth testing internationally. We want to try to prove without a shadow of a doubt the relationship between physical fitness and health, not just physical fitness and ability to perform.",Kenneth H. Cooper,"Health, Fitness, Shadow"
"I wanted very much to do Traffic and at one point it looked like I was going to work on it. And then, of course, Catherine Zeta-Jones had her relationship with Michael Douglas and it suddenly didn't happen.",Kevin Costner,"Work, Traffic, Much"
"Everybody dates these days. Like you get to know someone before you end up getting married, committing for a lifetime relationship. So dating is cool, date as much as you want, get to know the person.",Vaani Kapoor,"Cool, Dating, Know"
"Perhaps the main stumbling block to a better, and more fruitful, theological relationship with Judaism and the Jewish people has been the tendency of many Christian theologians to see the Christ event as the end of history.",David Novak,"History, Better, People"
I think a lot of a man's outlook in life - at least mine - is shaped by his relationship with his father.,Saif Ali Khan,"Life, Man, Father"
"Begin within. If it shows up in your life, it's coming to tell you something about you that you're acting like you don't know. Something about yourself, or your relationship with God.",Iyanla Vanzant,"Life, God, Your"
"The perception of Donald Trump in capitals around the world is shaped, in many ways, by CNN. Continuing to have an adversarial relationship with that network is a mistake.",Jeff Zucker,"World, Mistake, Perception"
"I've had a lot of mother figures. But by the time my mom came into my life, it wasn't a 'mommy' thing. It's more of an adult relationship.",Paris Jackson,"Life, Time, Mom"
"I've never done online dating, but first of all, I have a book out called 'Make It Last Forever: The Do's and The Dont's,' which led me to do the online dating thing. A lot of people respect my relationship songs, so they can pretty much trust me.",Keith Sweat,"Trust, Respect, Dating"
"Have gratitude for the things you're discarding. By giving gratitude, you're giving closure to the relationship with that object, and by doing so, it becomes a lot easier to let go.",Marie Kondo,"Gratitude, Doing, Go"
"There's something about a toy to a child where the relationship is real, where the kid is playing, and it's just really amazing.",Charles Ray,"Amazing, Real, Something"
"Like most people, I have this sort of love-hate relationship with Pittsburgh. This is my home, and at times I miss it and find it tremendously exciting, and other times I want to catch the first thing out that has wheels.",August Wilson,"Home, Find, People"
I love the idea that you develop a relationship over time that yields new projects and more creative freedom and trust.,Oneohtrix Point Never,"Love, Trust, Freedom"
I'm not really a relationship expert but... I'm an expert on manhood and what men think.,Steve Harvey,"Men, Expert, Think"
"In order to be able to give a girlfriend the amount of time she deserves, you would need time, and I just can't give her that. So, rather than being selfish or stupid enough to go into a relationship, it's just been easier to be single.",Ryan Kwanten,"Time, Stupid, Selfish"
"Once you accept the existence of God - however you define him, however you explain your relationship to him - then you are caught forever with his presence in the center of all things.",Morris West,"God, Your, Accept"
"I would love to direct one day. I value the relationship that I have with a director so much, and I would be really excited to be on the other end of that relationship.",Dakota Fanning,"Love, Day, Value"
"You're gonna lose looks when it comes with age, but if you have that sense of humor, it will always keep things great in a relationship.",Brie Bella,"Age, Humor, Great"
"I studied Paul Simon's 'Slip Slidin' Away' and 'Still Crazy After All These Years.' I wanted to explore adult themes, portraying the hurt that's in even a good relationship.",LP,"Good, Crazy, Hurt"
"When you have a fruitful relationship with someone, and you've both chosen to work together, then it can spawn really good things.",Tobias Forge,"Work, Good, Together"
"Failure is not an option. So, we're committed to the success of not just our relationship but to raising two amazing girls... It's dedication. We've anchored ourselves to a foundation of accountability, and we've set out to be successful at this, so we're going to do it.",Ian Ziering,"Success, Failure, Amazing"
"The more we can be in a relationship with those who might seem strange to us, the more we can feel like we're neighbors and all members of the human family.",Fred Rogers,"Family, Feel, Human"
"I won't have a traditional marriage; I don't find the value in that anymore. But I am such a hopeless romantic and I really want love and I want a committed relationship, so I am going to reinvent marriage for myself.",Halle Berry,"Love, Marriage, Romantic"
"My relationship with aging is cozy. I'm not trying to play 29 and holding on with white knuckles, you know?",Diane Lane,"Cozy, White, Know"
"As a child and a teenager, my attitudes and actions assumed the superiority of my race in almost every way without knowing or wanting to know anybody who was black, except Lucy. Lucy came to our house on Saturdays to help my mother clean. I liked Lucy, but the whole structure of the relationship was demeaning.",John Piper,"Black, Way, Know"
What was a really private and nice relationship was judged and made to be something ugly.,Marla Maples,"Ugly, Nice, Something"
"One of the reasons Krushna fell for me was my sexiness, and for any relationship to be alive, I believe physical attraction is a must.",Kashmira Shah,"Believe, Me, Alive"
"You can't really fake chemistry: either you have it or you don't, and you can't have a relationship on screen if you don't have one off screen. I love Sarah Paulson. I absolutely adore her. My wife has given me full permission to love Sarah Paulson, and I look forward to doing that for the rest of my life.",Sterling K. Brown,"Life, Love, Wife"
"The military infrastructure grew me. My faith in God is important, my belief in my country is important, my relationship to my family is important, the things that Mom and Dad tell you growing up are important.",Tommy Franks,"Faith, God, Family"
"I think that Bill and Hillary Clinton have a very special relationship and I think in very many ways to them it's a very satisfying relationship. I think that it's a mutual respect with a goal of power to achieve, maintain power. And I think that they have been good partners in that.",Gennifer Flowers,"Good, Power, Respect"
Sometimes I think the world is divided into those who have a comfortable relationship with power and those who have a naturally adversarial relationship with power.,Arundhati Roy,"Power, World, Sometimes"
"There is but one way for a president to deal with Congress, and that is continuously, incessantly, and without interruption. If it is really going to work, the relationship has got to be almost incestuous.",Lyndon B. Johnson,"Work, Way, Congress"
"My dad had been very absent, even when he was there. Then he left the family and moved away. Our relationship, it feels to me, ended when I was 13.",Olly Alexander,"Family, Dad, Me"
"All writers have a love-hate relationship with writing. Performing is fun, too, but I wouldn't say it's my favorite. But the most fulfilling is producing.",Larry Wilmore,"Fun, Writing, Say"
"Even in the deepest love relationship - when lovers say 'I love you' to each other - we don't really know what we're saying, because language isn't equal to the complexity of human emotions.",Duane Michals,"Love, Emotions, Language"
It is beautiful to see two people in a lasting relationship.,Divyanka Tripathi,"Beautiful, People, See"
First-past-the-post builds a direct relationship between a community and their MP. Residents come together to decide who most people want as their national representative. No one has more than one vote and it has to be cast responsibly.,Emily Thornberry,"Community, Together, People"
The relationship I have with my Hispanic fans is very deep and intricate.,Shakira,"Fans, Deep, Intricate"
"When my last relationship broke up, I bought a house one door along from my ex so that our daughter could continue to see as much of both of us as possible. This seems to me eminently sane and civilised.",John Niven,"Me, Door, Daughter"
"How do you conduct an intimate relationship where no one ever loses it? Where no one ever lashes out, where no one ever smacks anyone in the mouth?",Jo Brand,"Mouth, Lashes, Where"
"The whole of science, and one is tempted to think the whole of the life of any thinking man, is trying to come to terms with the relationship between yourself and the natural world. Why are you here, and how do you fit in, and what's it all about.",David Attenborough,"Life, Science, Man"
"I didn't marry to have children. I married to have a relationship, and I was blessed with one child. I was an only child, too - my mother was smarter than most women today; she just had me.",Carmen Dell'Orefice,"Women, Today, Me"
"Everyone is different, and every relationship is different, and I think the rules can change, and feelings can change. It's not only about who you're with, but also where you are in your own life and your own process.",Andrew Rannells,"Life, Change, Your"
Our relationship was cursed by the fact that we agreed on everything.,Elia Kazan,"Everything, Cursed, Fact"
