title,author,tags
"When someone shows you who they are, believe them the first time.",Maya Angelou,"Time, Believe, First"
"If you love someone, set them free. If they come back they're yours; if they don't they never were.",Richard Bach,"Love, Free, If You Love Someone"
How people treat you is their karma; how you react is yours.,Wayne Dyer,"Treat, React, People"
Nothing is perfect. Life is messy. Relationships are complex. Outcomes are uncertain. People are irrational.,Hugh Mackay,"Life, Nothing, People"
"I believe that two people are connected at the heart, and it doesn't matter what you do, or who you are or where you live; there are no boundaries or barriers if two people are destined to be together.",Julia Roberts,"Heart, Together, Believe"
"There is no love without forgiveness, and there is no forgiveness without love.",Bryant H. McGill,"Love, Forgiveness, No Love"
Assumptions are the termites of relationships.,Henry Winkler,"Assumptions, Relationships"
"Find joy in everything you choose to do. Every job, relationship, home... it's your responsibility to love it, or change it.",Chuck Palahniuk,"Love, Change, Home"
I'm lucky in having found the perfect partner to spend my life with.,Sara Paretsky,"Life, My Life, Partner"
What does it matter how many lovers you have if none of them gives you the universe?,Jacques Lacan,"Universe, Matter, How"
Truth is everybody is going to hurt you: you just gotta find the ones worth suffering for.,Bob Marley,"Truth, Suffering, Find"
"Yet, taught by time, my heart has learned to glow for other's good, and melt at other's woe.",Homer,"Good, Time, Heart"
"If civilization is to survive, we must cultivate the science of human relationships - the ability of all peoples, of all kinds, to live together, in the same world at peace.",Franklin D. Roosevelt,"Science, Peace, Together"
People change and forget to tell each other.,Lillian Hellman,"Change, People Change, People"
"You can never control who you fall in love with, even when you're in the most sad, confused time of your life. You don't fall in love with people because they're fun. It just happens.",Kirsten Dunst,"Life, Love, Sad"
Never above you. Never below you. Always beside you.,Walter Winchell,"Always, Never, Above"
"Absence diminishes mediocre passions and increases great ones, as the wind extinguishes candles and fans fires.",Francois de La Rochefoucauld,"Great, Wind, Fans"
We don't develop courage by being happy every day. We develop it by surviving difficult times and challenging adversity.,Barbara De Angelis,"Courage, Adversity, Day"
A healthy relationship is built on unwavering trust.,Beau Mirchoff,"Trust, Healthy, Built"
"The heart of another is a dark forest, always, no matter how close it has been to one's own.",Willa Cather,"Always, Heart, Matter"
There is always some madness in love. But there is also always some reason in madness.,Friedrich Nietzsche,"Love, Always, Madness"
Sometimes I wonder if men and women really suit each other. Perhaps they should live next door and just visit now and then.,Katharine Hepburn,"Women, Men, Door"
"Some think love can be measured by the amount of butterflies in their tummy. Others think love can be measured in bunches of flowers, or by using the words 'for ever.' But love can only truly be measured by actions. It can be a small thing, such as peeling an orange for a person you love because you know they don't like doing it.",Marian Keyes,"Love, Doing, Words"
In a relationship each person should support the other; they should lift each other up.,Taylor Swift,"Support, Person, Lift"
"Truth is, I'll never know all there is to know about you just as you will never know all there is to know about me. Humans are by nature too complicated to be understood fully. So, we can choose either to approach our fellow human beings with suspicion or to approach them with an open mind, a dash of optimism and a great deal of candour.",Tom Hanks,"Nature, Truth, Great"
"God gives us relatives; thank God, we can choose our friends.",Addison Mizner,"God, Thank God, Relatives"
"I am convinced that material things can contribute a lot to making one's life pleasant, but, basically, if you do not have very good friends and relatives who matter to you, life will be really empty and sad and material things cease to be important.",David Rockefeller,"Life, Sad, Good"
Everybody needs somebody.,Mahalia Jackson,"Needs, Somebody, Everybody"
A person isn't who they are during the last conversation you had with them - they're who they've been throughout your whole relationship.,Rainer Maria Rilke,"Your, Person, Conversation"
"Treasure your relationships, not your possessions.",Anthony J. D'Angelo,"Your, Treasure, Possessions"
"The beginning of love is to let those we love be perfectly themselves, and not to twist them to fit our own image. Otherwise we love only the reflection of ourselves we find in them.",Thomas Merton,"Love, Love Is, Reflection"
"When a woman is talking to you, listen to what she says with her eyes.",Victor Hugo,"Eyes, Woman, She"
We can improve our relationships with others by leaps and bounds if we become encouragers instead of critics.,Joyce Meyer,"Others, Become, Critics"
"Love sought is good, but given unsought, is better.",William Shakespeare,"Love, Good, Better"
We cannot really love anyone with with whom we never laugh.,Agnes Repplier,"Love, Laugh, Never"
"Love is never lost. If not reciprocated, it will flow back and soften and purify the heart.",Washington Irving,"Love, Love Is, Heart"
"Between men and women there is no friendship possible. There is passion, enmity, worship, love, but no friendship.",Oscar Wilde,"Friendship, Love, Women"
You have people come into your life shockingly and surprisingly. You have losses that you never thought you'd experience. You have rejection and you have learn how to deal with that and how to get up the next day and go on with it.,Taylor Swift,"Life, Experience, Your"
"The one who loves the least, controls the relationship.",Robert Anthony,"Who, Least, Controls"
I was born when you kissed me. I died when you left me. I lived a few weeks while you loved me.,Humphrey Bogart,"Me, Born, Loved"
You never lose by loving. You always lose by holding back.,Barbara De Angelis,"Always, Lose, Never"
"Friendship may, and often does, grow into love, but love never subsides into friendship.",Lord Byron,"Friendship, Love, Grow"
I want a man who's kind and understanding. Is that too much to ask of a millionaire?,Zsa Zsa Gabor,"Man, Understanding, Much"
I don't need anyone to rectify my existence. The most profound relationship we will ever have is the one with ourselves.,Shirley MacLaine,"Will, Existence, Need"
"We've got this gift of love, but love is like a precious plant. You can't just accept it and leave it in the cupboard or just think it's going to get on by itself. You've got to keep watering it. You've got to really look after it and nurture it.",John Lennon,"Love, Love Is, Plant"
I think it's healthy for couples to be away from each other for short periods.,Liv Tyler,"Short, Think, Healthy"
Before machines the only form of entertainment people really had was relationships.,Douglas Coupland,"Entertainment, People, Machines"
Each relationship nurtures a strength or weakness within you.,Mike Murdock,"Strength, Weakness, Within"
"Never trust a husband too far, nor a bachelor too near.",Helen Rowland,"Trust, Never, Bachelor"
"Once a woman has forgiven her man, she must not reheat his sins for breakfast.",Marlene Dietrich,"Man, Breakfast, Woman"
I think it matters whether someone has a good heart.,Elon Musk,"Good, Heart, Good Heart"
"It takes one person to forgive, it takes two people to be reunited.",Lewis B. Smedes,"People, Person, Two People"
The only time a woman really succeeds in changing a man is when he is a baby.,Natalie Wood,"Time, Man, Woman"
"What love we've given, we'll have forever. What love we fail to give, will be lost for all eternity.",Leo Buscaglia,"Love, Lost, Will"
Falling in love and having a relationship are two different things.,Keanu Reeves,"Love, Falling, Things"
"In human relationships, kindness and lies are worth a thousand truths.",Graham Greene,"Kindness, Human, Worth"
"Love thou the rose, yet leave it on its stem.",Edward G. Bulwer-Lytton,"Love, Rose, Leave"
To catch a husband is an art; to hold him is a job.,Simone de Beauvoir,"Art, Job, Husband"
The relationship between husband and wife should be one of closest friends.,B. R. Ambedkar,"Wife, Husband, Friends"
"I can't even find someone for a platonic relationship, much less the kind where someone wants to see me naked.",Gilbert Gottfried,"Me, Find, Naked"
"Be honest, brutally honest. That is what's going to maintain relationships.",Lauryn Hill,"Going, Relationships, Maintain"
"I love you, and because I love you, I would sooner have you hate me for telling you the truth than adore me for telling you lies.",Pietro Aretino,"Love, Truth, Hate"
But let there be spaces in your togetherness and let the winds of the heavens dance between you. Love one another but make not a bond of love: let it rather be a moving sea between the shores of your souls.,Khalil Gibran,"Love, Your, Sea"
"You can't stop loving or wanting to love because when its right it's the best thing in the world. When you're in a relationship and its good, even if nothing else in your life is right, you feel like your whole world is complete.",Keith Sweat,"Life, Love, Best"
A relationship requires a lot of work and commitment.,Greta Scacchi,"Work, Commitment, Lot"
"I'm 31 now. I think I'm beginning to understand what life is, what romance is, and what a relationship means.",Adam Sandler,"Life, Beginning, Understand"
How can a woman be expected to be happy with a man who insists on treating her as if she were a perfectly normal human being.,Oscar Wilde,"Man, Woman, Happy"
A relationship isn't going to make me survive. It's the cherry on top.,Jennifer Aniston,"Me, Survive, Make"
"If you're married, and you have a wife, and you really love your wife, is it good enough to only say to your wife 'I love her' the day you get married? Or should you tell her every single day when you wake up and every opportunity? And that's how I feel about my relationship with Jesus Christ is that it is the most important thing in my life.",Tim Tebow,"Life, Love, Good"
Who cares about the clouds when we're together? Just sing a song and bring the sunny weather.,Dale Evans,"Weather, Clouds, Together"
I believe everyone has a soul mate that they can spend the rest of their life together.,Ryan Lochte,"Life, Together, Soul"
"Blood relatives often have nothing to do with family, and similarly, family is about who you choose to make your life with.",Oliver Hudson,"Life, Family, Your"
I'm done with men... I'm going to be alone. I have no luck with relationships. I don't think I'm made for marriage.,Halle Berry,"Alone, Men, Marriage"
"Do you know that other than my father, I've never had a man take care of me?",Dionne Warwick,"Man, Me, Father"
They do not love that do not show their love.,William Shakespeare,"Love, Show"
"We are afraid to care too much, for fear that the other person does not care at all.",Eleanor Roosevelt,"Fear, Care, Person"
"Flatter me, and I may not believe you. Criticize me, and I may not like you. Ignore me, and I may not forgive you. Encourage me, and I will not forget you. Love me and I may be forced to love you.",William Arthur Ward,"Love, Believe, Me"
Relationships based on obligation lack dignity.,Wayne Dyer,"Dignity, Obligation, Relationships"
The heart is forever inexperienced.,Henry David Thoreau,"Heart, Forever, Inexperienced"
"The most important things to do in the world are to get something to eat, something to drink and somebody to love you.",Brendan Behan,"Love, World, Important"
Care is a state in which something does matter; it is the source of human tenderness.,Rollo May,"Care, Matter, Human"
"It is not our purpose to become each other; it is to recognize each other, to learn to see the other and honor him for what he is.",Hermann Hesse,"Honor, Purpose, See"
"If you cannot inspire a woman with love of you, fill her above the brim with love of herself; all that runs over will be yours.",Charles Caleb Colton,"Love, Woman, Will"
Men and women have strengths that complement each other.,Edwin Louis Cole,"Women, Men, Men And Women"
"I, with a deeper instinct, choose a man who compels my strength, who makes enormous demands on me, who does not doubt my courage or my toughness, who does not believe me naive or innocent, who has the courage to treat me like a woman.",Anais Nin,"Courage, Strength, Man"
"Almost all of our relationships begin and most of them continue as forms of mutual exploitation, a mental or physical barter, to be terminated when one or both parties run out of goods.",W. H. Auden,"Continue, Exploitation, Almost"
"Every relationship I've been in, I've overwhelmed the girl. They just can't handle all the love.",Justin Timberlake,"Love, Girl, Handle"
I present myself to you in a form suitable to the relationship I wish to achieve with you.,Luigi Pirandello,"Myself, Wish, Present"
Girls we love for what they are; young men for what they promise to be.,Johann Wolfgang von Goethe,"Love, Men, Young"
God is more interested in your future and your relationships than you are.,Billy Graham,"Future, God, Your"
I felt a tremendous sadness for men who can't deal with a woman of their own age.,Michael Caine,"Age, Men, Woman"
"If so many men, so many minds, certainly so many hearts, so many kinds of love.",Leo Tolstoy,"Love, Men, Hearts"
Love comes when manipulation stops; when you think more about the other person than about his or her reactions to you. When you dare to reveal yourself fully. When you dare to be vulnerable.,Joyce Brothers,"Love, Yourself, Person"
"It's nice to be with someone, but I don't think you need to be in a relationship to feel complete. That would be really sad.",Kristin Davis,"Sad, Feel, Someone"
"Well, a girlfriend once told me never to fight with anybody you don't love.",Jack Nicholson,"Love, Fight, Me"
"Love does not claim possession, but gives freedom.",Rabindranath Tagore,"Love, Freedom, Claim"
"I have developed a very strong partiality for the dead: they don't talk back, they don't sue, and they don't have angry relatives.",Ron Chernow,"Angry, Dead, Talk"
There is not love where there is no will.,Indira Gandhi,"Love, Will, Where"
"Kindness in women, not their beauteous looks, shall win my love.",William Shakespeare,"Love, Women, Kindness"
Real intimacy is only possible to the degree that we can be honest about what we are doing and feeling.,Joyce Brothers,"Doing, Feeling, Possible"
Don't smother each other. No one can grow in the shade.,Leo Buscaglia,"Grow, Shade, Other"
It destroys one's nerves to be amiable every day to the same human being.,Benjamin Disraeli,"Day, Every Day, Human"
I don't want to be married to someone who feels inferior to my success or because I make more money than he does.,Grace Kelly,"Success, Money, Someone"
He who loves 50 people has 50 woes; he who loves no one has no woes.,Buddha,"People, Who, He"
Being flirty is a way of letting a guy know you're interested without making a fool out of yourself.,Carmen Electra,"Fool, Yourself, Way"
"Love casts out fear, but we have to get over the fear in order to get close enough to love them.",Dorothy Day,"Love, Fear, Enough"
"There is a time for risky love. There is a time for extravagant gestures. There is a time to pour out your affections on one you love. And when the time comes - seize it, don't miss it.",Max Lucado,"Love, Time, Your"
The easiest kind of relationship for me is with ten thousand people. The hardest is with one.,Joan Baez,"Me, People, Hardest"
"Intense love does not measure, it just gives.",Mother Teresa,"Love, Measure, Just"
"My husband and I have known each other since kindergarten. I had a crush on him in school, but we never dated. Then we saw each other again after high school, and there was something instantly familiar about him. I'm a very shy person and was very closed off. But he allowed me to be myself. And there's a safety in that.",Alison Sweeney,"Myself, Me, Person"
"I honestly believe you can never tell if a relationship is going to last. In my own marriage, which is going on 14 years, I don't think of it as 'I'm going to be with this person forever.' Instead, I think of more like, 'I'll probably be with this person for the next six weeks. Then I'll re-evaluate.'",Michael Ian Black,"Marriage, Believe, Own"
Women still remember the first kiss after men have forgotten the last.,Remy de Gourmont,"Women, Men, Remember"
"The only real security is not in owning or possessing, not in demanding or expecting, not in hoping, even. Security in a relationship lies neither in looking back to what it was, nor forward to what it might be, but living in the present and accepting it as it is now.",Anne Morrow Lindbergh,"Looking Back, Living, Security"
"Courage means to keep working a relationship, to continue seeking solutions to difficult problems, and to stay focused during stressful periods.",Denis Waitley,"Courage, Problems, Difficult"
It's better to have loved and lost than to have to do forty pounds of laundry a week.,Laurence J. Peter,"Better, Lost, Week"
"Some people are your relatives but others are your ancestors, and you choose the ones you want to have as ancestors. You create yourself out of those values.",Ralph Ellison,"Your, Yourself, People"
"Every man sees in his relatives, and especially in his cousins, a series of grotesque caricatures of himself.",H. L. Mencken,"Man, Relatives, Every Man"
Adapt yourself to the things among which your lot has been cast and love sincerely the fellow creatures with whom destiny has ordained that you shall live.,Marcus Aurelius,"Love, Your, Destiny"
"We must learn to regard people less in light of what they do or omit to do, and more in the light of what they suffer.",Dietrich Bonhoeffer,"Light, People, More"
"Ultimately, we wish the joy of perfect union with the person we love.",Mortimer Adler,"Love, Joy, Person"
Men should only believe half of what women say. But which half?,Jean Giraudoux,"Women, Men, Believe"
I get along with guys; most of my friends are guys. It's easier to trust men sometimes. I only have a few close girlfriends that I trust.,Paris Hilton,"Trust, Men, Sometimes"
"The man as he converses is the lover; silent, he is the husband.",Honore de Balzac,"Man, Husband, Silent"
I see when men love women. They give them but a little of their lives. But women when they love give everything.,Oscar Wilde,"Love, Women, Men"
"So many people prefer to live in drama because it's comfortable. It's like someone staying in a bad marriage or relationship - it's actually easier to stay because they know what to expect every day, versus leaving and not knowing what to expect.",Ellen DeGeneres,"Marriage, Day, Bad"
The loss of young first love is so painful that it borders on the ludicrous.,Maya Angelou,"Love, Love Is, First"
"When you make his sandwiches, put a sexy or loving note in his lunch box.",Anne Rice,"Sexy, Lunch, Loving"
Remember that no relationship is a total waste of time. You can always learn something about yourself.,"H. Jackson Brown, Jr.","Time, Always, Yourself"
My husband and I are either going to buy a dog or have a child. We can't decide whether to ruin our carpet or ruin our lives.,Rita Rudner,"Dog, Husband, Decide"
"My view is that marriage is a relationship between a man and a woman. That's the position I've had for some time, and I don't intend to make any adjustments at this point... Or ever, by the way.",Mitt Romney,"Time, Marriage, Man"
Men and women are not born inconstant: they are made so by their early amorous experiences.,Andre Maurois,"Women, Men, Born"
My wife and I have been together since 1986. I graduated in '86 and she graduated in '88. We began dating when she was 17. Actually she turned 18 when we started kissing and stuff.,"Cuba Gooding, Jr.","Dating, Wife, Together"
"That common cold of the male psyche, fear of commitment.",Richard Schickel,"Fear, Commitment, Cold"
"A sensible woman should be guided by her head when taking a husband, and by her heart when taking a lover.",Ninon de L'Enclos,"Heart, Woman, Husband"
Never assume that the guy understands that you and he have a relationship.,Dave Barry,"Never, Guy, He"
"When I got my first television set, I stopped caring so much about having close relationships.",Andy Warhol,"Caring, First, Television"
"If you love somebody, you love them. My parents had a 25-year age gap between them and my mum was the breadwinner, my dad the house husband. I'm a strong believer that a good relationship can work, whatever the situation.",Katherine Jenkins,"Love, Work, Good"
It's funny about men and women. Men pay in cash to get them and pay in cash to get rid of them. Women pay emotionally coming and going. Neither has it easy.,Hedy Lamarr,"Funny, Women, Men"
"I have stepped off the relationship scene to come to terms with myself. I have spent most of my adult life being 'someone's girlfriend', and now I am happy being single.",Penelope Cruz,"Life, Myself, I Am Happy"
"If you want a love message to be heard, it has got to be sent out. To keep a lamp burning, we have to keep putting oil in it.",Mother Teresa,"Love, Keep, Lamp"
"A grandchild is a miracle, but a renewed relationship with your own children is even a greater one.",T. Berry Brazelton,"Your, Own, Children"
"In any relationship, after the first year is over, you can't help but want your own space.",Helena Bonham Carter,"Space, Your, Own"
"It is always the same: women bedeck themselves with jewels and furs, and men with wit and quotations.",Maurice Chevalier,"Women, Men, Always"
Absences are a good influence in love and keep it bright and delicate.,Robert Louis Stevenson,"Love, Good, Keep"
"I was in a relationship with a girl I loved for three years. Where do you go after three years? Then you've got to start thinking about other things, and I'm too young to think about those things.",Shia LaBeouf,"Thinking, Start, Young"
Spiritual relationship is far more precious than physical. Physical relationship divorced from spiritual is body without soul.,Mahatma Gandhi,"Soul, Body, Spiritual"
To marry unequally is to suffer equally.,Henri Frederic Amiel,"Suffer, Marry, Equally"
You are not alone with a guy until you are a proper age. You don't go to certain levels with men until you are married or you have a certain relationship.,Daisy Fuentes,"Alone, Age, Men"
Maybe the most that you can expect from a relationship that goes bad is to come out of it with a few good songs.,Marianne Faithfull,"Good, Bad, Expect"
"People are so fearful about opening themselves up. All you want to do is to be able to connect with other people. When you connect with other people, you connect with something in yourself. It makes you feel happy. And yet it's so scary - it makes people feel vulnerable and unsafe.",Toni Collette,"Yourself, Feel, People"
It isn't necessary to have relatives in Kansas City in order to be unhappy.,Groucho Marx,"City, Unhappy, Relatives"
I want to be very close to someone I respect and admire and have somebody who feels the same way about me.,Richard Bach,"Respect, Me, Way"
"When you start falling for somebody and you can't stop thinking about when you're going to see them again, I love that. Women are beautiful. They deserve to be cherished and respected.",Orlando Bloom,"Love, Women, Beautiful"
I don't even like to use the word relationship. I don't know what it means.,Ron Silver,"Know, Use, Like"
No partner in a love relationship... should feel that he has to give up an essential part of himself to make it viable.,May Sarton,"Love, Feel, Partner"
"The more connections you and your lover make, not just between your bodies, but between your minds, your hearts, and your souls, the more you will strengthen the fabric of your relationship, and the more real moments you will experience together.",Barbara De Angelis,"Experience, Your, Together"
"Caresses, expressions of one sort or another, are necessary to the life of the affections as leaves are to the life of a tree. If they are wholly restrained, love will die at the roots.",Nathaniel Hawthorne,"Life, Love, Tree"
I don't think it's necessarily healthy to go into relationships as a needy person. Better to go in with a full deck.,Anjelica Huston,"Better, Person, Go"
"For the most part, that message hasn't changed a lot over the years - love is still love, and heartbreak is still heartbreak.",Casey Kasem,"Love, Love Is, Over"
In a relationship you have to open yourself up.,Neil LaBute,"Yourself, Open, Up"
It is only when we no longer compulsively need someone that we can have a real relationship with them.,Anthony Storr,"Real, Someone, Need"
"When one has love for God, one doesn't feel any physical attraction to wife, children, relatives and friends. One retains only compassion for them.",Ramakrishna,"Love, God, Wife"
He who lives in our mind is near though he may actually be far away; but he who is not in our heart is far though he may really be nearby.,Chanakya,"Heart, Mind, Far Away"
It is almost always a fault of one who loves not to realize when he ceases to be loved.,Francois de La Rochefoucauld,"Always, Fault, Loved"
"I am very sad for men and women trapped in any relationship where there is cruelty, dominance, inequity. I long for the liberation of all people.",Jasmine Guy,"Women, Sad, Men"
"Caesar might have married Cleopatra, but he had a wife at home. There's always something.",Will Cuppy,"Home, Always, Wife"
"You show your vulnerability through relationships, and those feelings are your soft spot. You need to have a soft spot.",Victoria Pratt,"Your, Feelings, Soft"
