title,author,tags
"Our modern understanding of cultural appropriation is highly individualised. It's all about what Halloween costume you wear, or who's cooking biryani. But the way in which the idea was first used was to describe a relationship of dominance and exploitation between a global ruling class and a globally subjugated one.",Ash Sarkar,"Cooking, Way, Understanding"
"Freedom of movement in Europe has been all but abandoned as a cause in British politics. Brexit was far more about freedom of movement than our exact trading relationship with the EU, and the electorate rejected it.",Owen Jones,"Politics, Freedom, Brexit"
I've always got time for a relationship.,Caroline Flack,"Time, Always, Got"
I find it quite hard to sum up my relationship in a sound bite. I feel that it trivializes it for other people's pleasure. It's an adventure.,Emily Blunt,"Find, Feel, People"
"President Bush will come here and there will be new 'friends' of America to open a new relationship with the world, new economic fortunes for those who 'liberated' them.",Robert Fisk,"New Friends, World, Will"
"I'm really muscular because my mother had to teach me how to straighten my own spine. It wasn't good for my relationship with her because she was dictatorial about it, but in the end I was able to disguise what I had.",Toyah Willcox,"Good, Me, Own"
Life is hard so why does my relationship have to be hard at the same time?,Rachel Lindsay,"Life, Time, Life Is Hard"
I feel like you don't know if someone's equipped for a romantic relationship until they're out of their twenties.,Lena Dunham,"Romantic, Know, Feel"
I have no plans to go public if I get into a relationship. I will do my best to safeguard the privacy of the person I love and respect her feelings.,Song Joong-ki,"Love, Best, Respect"
That's the awful thing about dating. Tight underwear. We would all like to be in a big bra and pants and when you are in a secure relationship you can do that.,Dawn French,"Dating, Underwear, Big"
"Daniel Bryan is a friend of mine. It's sort of funny that the relationship that you saw between Team Hell No on screen, it sometimes goes the same way off screen as well. He is a great human being and good friend of mine, and frankly, the Team Hell No stuff helped me.",Kane,"Funny, Good, Great"
All of my relationships have happened organically with people who are super cool and in my life and it just moved into a relationship zone.,Hannah Simone,"Life, Cool, My Life"
"I have no problem with commitment - you can't have a real relationship without it. I can flip on a switch in my brain, and even if the next Brad Pitt is standing next to me, I won't look at him. But I can also turn that switch off, and then I collect attractive boys.",Megan Fox,"Brain, Me, Look"
"Managing the relationship with a giant neighbour has been central to our foreign policy for more than a century. Trade and investment, as well as people, have flowed back and forth across the border, and the U.S. is, by far, our biggest trading partner.",Margaret MacMillan,"People, Partner, Investment"
"You just got to remember that mine and Dana White's relationship is like we're a husband and wife. I do the man's stuff around the house. I do the fighting, all the man's stuff, and he does all the woman stuff - all the yapping.",Roy Nelson,"Man, Wife, Remember"
The dynamic of a relationship changes when one person gets sober.,Trent Reznor,"Sober, Person, Dynamic"
I mean... in life... what relationship is easy?,The Weeknd,"Life, Easy, Mean"
"If you're lucky like me, your relationship with your brother has resolved itself on the peaceful side of the fence and has stayed there. But if you're someone who's got a family that's all fractured and finding it hard to relate, that's a very sad place to be.",Tom Hardy,"Family, Sad, Your"
"I think marriage initially involves a lot of people who have nothing to do with your relationship, because it's a legally binding contract, and that has a weight to it.",Scarlett Johansson,"Marriage, Your, Nothing"
"The biggest piece is my family... From watching films like The Godfather on our dining room wall, to having a great relationship with my sibling. Or going on weekend trips with our cousins to the beach and eating all day... it's been a crazy childhood; a 'bohemian one'.",Zoya Akhtar,"Family, Great, Day"
It's ridiculous to have to base your relationship on money.,Goldie Hawn,"Money, Your, Ridiculous"
"Brooklyn has a strong, historic relationship with both music and basketball, and I look forward to working with BSE Global to find new ways to deepen and celebrate that relationship within our community.",Angela Yee,"Music, Celebrate, Community"
"I've never been very successful in a monogamous relationship, but I'm looking forward to the day when I can assume that responsibility.",Don Johnson,"Day, Responsibility, Looking Forward"
"As long as possible, I want to have that relationship with Liverpool, to be a Liverpool player. To say I have done that for the whole of my career is something I have dreamed of being able to say.",Trent Alexander-Arnold,"Done, Long, Possible"
"Living in a capital in Europe but still surrounded by mountains and ocean, my relationship to music was strongest walking to school and back. I would sing to myself and very quickly started mapping out my melodies to landscapes - at the time I just thought it was very matter of fact, a common thing to do.",Bjork,"Time, Music, Myself"
By measuring the proportion of children living with the same parents from birth and whether their parents report a good quality relationship we are driving home the message that social programmes should promote family stability and avert breakdown.,Iain Duncan Smith,"Family, Good, Home"
I wasn't smart enough to read relationship books when I was coming up. I learned everything the hard way.,Michael Ealy,"Smart, Way, Enough"
"I am not married yet, but I think ultimately in a good marriage it is the relationship which is the most important thing. It is not a matter of who is right and who is wrong; it is a one plus one equals more than two.",Lawrence Bender,"Good, Marriage, I Am"
"I love exploring the relationship between fathers and daughters. I think that's a special thing, especially with daughters who are dealing with being adults.",Tim Daly,"Love, Special, Think"
"There's no shortage of orphans in 19th-century literature, but it's hard to find a single happy, communicative, functional parental relationship in the whole of 'Great Expectations,' even among the minor characters.",David Nicholls,"Great, Expectations, Find"
"At the very core of my relationship to learning is the idea that we should be as organic as possible. We need to cultivate a deeply refined introspective sense, and build our relationship to learning around our nuance of character.",Joshua Waitzkin,"Learning, Character, Possible"
"You can't have a relationship with a device whose limits are unknown to you, because without limits, it keeps becoming something else.",Brian Eno,"Limits, Unknown, Something"
The Russians are turning east to the Chinese - to the Europeans' surprise. It always seemed to me that the relationship between Russia and China would shift from being based in Marx and Lenin to being based in oil and gas.,Daniel Yergin,"Always, Surprise, Me"
"Every relationship that we have in our lives - our contact with each person, place, and event - serves a very special, if yet to be realized purpose: They are mirrors that can serve to show us things about ourselves that can be realized in no other way.",Guy Finley,"Purpose, Way, Person"
I'm all about building a relationship with viewers and getting to know them.,Bethany Mota,"Know, Building, Them"
"I was very interested in the relationship between the man who speaks and the woman who listens. I was drawn to the idea that the relationship between a man and a woman can be something like a war itself, very cruel and violent.",Antonio Lobo Antunes,"War, Man, Woman"
"In a relationship when things are really great you don't need to say anything and just enjoy the other person. Sometimes with a couple, it gets dark and you don't know what to say and that silence can last all day. Other times you don't want to stop talking because you don't want to lose one another.",Anton Yelchin,"Great, Silence, Day"
It is better to have a relationship with someone who cheats on you than with someone who does not flush the toilet.,Uma Thurman,"Better, Someone, Toilet"
"And across Afghanistan, every single day, Afghan soldiers, Afghan police and ISAF troops are serving shoulder-to-shoulder in some very difficult situations. And our engagement with them, our shoulder-to-shoulder relationship with them, our conduct of operations with them every single day defines the real relationship.",John R. Allen,"Day, Police, Difficult"
"I'm attracted to how fraught the parent-child relationship is, swerving so easily between love and hostility, with almost no plausible way to end, unless someone dies.",Ben Marcus,"Love, Way, End"
It's easy in a novel to be completely unambiguous about the relationship between animal and daemon simply by stating it outright; whereas you get very few opportunities to do this in an elegant way in a film.,Chris Weitz,"Way, Animal, Easy"
"For a man, there's a big responsibility that comes with having a boy because men are made by their fathers. If you've got a good productive man around it's better. I have such a close relationship with my dad and that responsibility to produce a good man is something I think about.",Rafe Spall,"Good, Men, Dad"
"I've stepped more into my womanhood, I'm a mother now, I'm having a beautiful relationship as a wife and as a friend.",Alicia Keys,"Beautiful, Wife, Mother"
"If some people try to make a prenup into a pre-negotiation of a divorce... Well, that's really sad. But I do think that it's important to understand what each person has coming into the relationship, and what each person expects from the relationship. They aren't always fun discussions to have, and they can be very eye-opening.",Laura Wasser,"Sad, Always, Try"
"When you're in a relationship, if you just break it down to regular terms, people are attracted to something, and that's what they want you to be, and that's what you should just be, and for me, it's very simple - if I meet a girl and I say, 'This is what I like about you. Just continue. Every day.'",Marilyn Manson,"Day, Simple, Me"
"I think very few people do find a relationship where, every moment of every day, everything they do comes together. That's why, in a nutshell, everyone loved Barbara in 'The Good Life.' She was the perfect partner. It was a formula. She wasn't glamorous. She wasn't clever. But she was a good partner. That's too easy, too perfect.",Felicity Kendal,"Life, Good, Moment"
People of noble character are afraid of keeping friendship with dishonorable people. But people of discreditable character consider friendship with the dishonorable as a blood relationship.,Thiruvalluvar,"Friendship, Character, People"
"I have a lot of people in my life, and I think there's something key: the thing that leads to intimacy and relationship and connection is tenderness.",Greg Boyle,"Life, My Life, Connection"
"I'm genuine and I'm available. I want people to be at their best. I want them to love and be loved to their fullest ability. My friends call me their relationship nanny, so we have a good time working through problems. Now, I don't claim to be an expert, but I am a woman who has been through everything.",Niecy Nash,"Love, Best, Good"
"I was a very romantic, overly dramatic young lady, which served me well as a songwriter. Especially as someone who had to focus on lyrics and melody, because if you're a dramatic and romantic person, lyrics come easy, and you turn every single short-term relationship into the biggest 'Romeo-and-Juliet' story ever.",Jane Wiedlin,"Romantic, Focus, Me"
"That was an organic relationship. He reached out to me, and I was like, 'Oh my God, I cannot believe somebody like Laquan Smith wants to put his clothes on me.' He comes from a small place, and he has big dreams, and what I like about him the most is that his clothes curve with your body.",Cardi B,"Dreams, God, Your"
"On a serious level, I wouldn't tell the press if I was in a relationship or not. I wouldn't ever reveal that, because it takes you down a certain road... I have no desire to be courting the press with my love life.",Kit Harington,"Life, Love, Road"
"I've got five kids and I'm married, Tommy's got two kids and he's been married, Vince just got married again, Mick's out of a relationship, Tommy's single as well. We've done a lot in our life, we've covered a lot of miles.",Nikki Sixx,"Life, Done, Miles"
My relationship and the bond with the people in Montreal was kind of special and doesn't happen very often.,Saku Koivu,"Bond, People, Special"
"Complaining is dangerous business. It can damage or even destroy your relationship with God, your relationships with other people, and even with your relationship with yourself.",Joyce Meyer,"God, Business, Your"
We had a relationship that lasted 44 years. Herbert and I lived together 10 years before we were married. He always gave me a little heart for whatever anniversary.,Uta Hagen,"Anniversary, Always, Heart"
The formula for achieving a successful relationship is simple: you should treat all disasters as if they were trivialities but never treat a triviality as if it were a disaster.,Quentin Crisp,"Simple, Treat, Disaster"
"I had my footballing heroes such as Bryan Robson and Diego Maradona but my dad was a rugby league star, and he was my real hero. But the relationship with my mum was rocky and we saw things that would affect any youngster.",Ryan Giggs,"Dad, Hero, Real"
There are musicians who want to make a living making music. There are listeners who want to listen to music. Complicating this relationship is a whole bunch of history: some of the music I want to listen to was made a while ago in a different economy. Some of the models of making a living making music are no longer valid but persist.,Kent Beck,"History, Music, Living"
"I would love to have seen a male-female relationship that had nothing to do with falling in love, I'd love to prove, even on TV - even if it's not true! - that men and women can be friends without any kind of involvement.",Nana Visitor,"Love, Women, Men"
"A conversation goes sometimes into personal things and that's nicer. You look to each other and you have a different picture, you get into a relationship.",Maximilian Schell,"Look, Picture, Sometimes"
"If you understand the importance of developing a relationship with the director and making that director see that you're the best technical adviser and resource in the world on your subject, you'll be invited on set as a respected and integral part of the process.",John Fusco,"Best, Your, World"
I don't want to have a relationship with someone if I'm not going to work with them.,Bill Murray,"Work, Someone, Want"
Religion is man's attempt to bind himself back to a relationship with God.,Victoria Jackson,"God, Religion, Man"
"I find Jesus my confidant and companion, brother and savior; our relationship is intimate, vulnerable, demanding yet comfortable and reassuring.",Malcolm Boyd,"Find, Brother, Comfortable"
"Puerto Rico's relationship with music is everything. It's an island full of talent and if you grow up there, you grow up living and breathing music.",Bad Bunny,"Music, Talent, Grow"
My mother killed herself when I was 12. I won't complete that relationship. But I can try to understand her.,Jane Fonda,"Try, Mother, Understand"
"If you're going to take a jab at someone, you should at least have a bit more of a personal relationship with them. I feel like you can be funny and clever, as opposed to just outright vile.",Harland Williams,"Funny, Feel, Someone"
Sidney Poitier became a star in part by helping black and white Americans negotiate their new relationship in the post-Civil Rights era.,Wesley Morris,"Black And White, Black, New"
I hope my desire to travel so much isn't forever because it's not the most conducive lifestyle for a relationship or a family by any means.,Lisa Ling,"Family, Hope, Travel"
"My longest relationship with my first boyfriend was eight and a half years. We broke up a handful of times over those years, but he was my first love, I was his, and we were each other's firsts.",Ashleigh Murray,"Love, First, Half"
"It's strange. At some point in your career, the situation between yourself and the camera reverses. For a certain number of years, you court it and you need it, but ultimately, it needs you more, and it's a bit like a relationship. The minute that happens, it turns you off... and it does feel like it is taking something from you.",George Michael,"Your, Yourself, Situation"
Androgyny is not trying to manage the relationship between the opposites; it is simply flowing between them.,June Singer,"Trying, Opposites, Simply"
"In our relationship, we don't have that situation. I don't require what he needs, and he doesn't require what I need. I know what I do; I have an amazing life that nobody knows about.",John Oates,"Life, Amazing, Situation"
I think taking design out of the studio and really having a relationship with the people that you're making it for really convinced me of how powerful a thing design is. It's not just an aesthetic decoration.,Genevieve Gorder,"Design, Me, People"
"To pass from estrangement from God to be a son of God is the basic fact of conversion. That altered relationship with God gives you an altered relationship with yourself, with your brother man, with nature, with the universe.",E. Stanley Jones,"Nature, God, Man"
"Then, of course, there are those sad occasions when a poet or a writer has not grown, and one has to let them go because they're just not making headway. But we have a very clear personal relationship with the authors.",James Laughlin,"Sad, Go, Personal"
"Me and Vince are like cool, man. Good relationship with Vince, man, and I've been on a lot of trips with Vince, as far as with overseas, going to visit the military. And even at work, man, ideas, he's open to a lot of people, everybody, pretty much. If you have a good idea, he wants you to go in there and prepare with it.",R-Truth,"Work, Good, Cool"
What students lack in school is an intellectual relationship or conversation with the teacher.,William Glasser,"Teacher, Conversation, School"
I always felt like I could go to my mom and speak to her about anything. We have a great relationship.,Ella Mai,"Great, Mom, Always"
"'Traveling with Pomegranates' is a very personal, very honest story about my relationship with my daughter and Ann's with her mother.",Sue Monk Kidd,"Mother, Daughter, Story"
"I'm pretty sensitive. My feelings get hurt a lot easier than people think, but I try take it all with grain of salt. For a relationship, I want someone who is really secure, confident and fulfilled, not tripping with what I do.",Maxwell,"Try, Feelings, People"
"We know that no algorithm can solve global poverty; no pill can cure a chronic illness; no box of chocolates can mend a broken relationship; no educational DVD can transform a child into a baby Einstein; no drone strike can end a terrorist conflict. Sadly, there is no such thing as 'One Tip to a Flat Stomach.'",Carl Honore,"Conflict, Poverty, Know"
It's more necessary than ever before to ensure that discernment and the development of a critical mind guide our take on the world and inform our relationship to the media and information.,Najat Vallaud-Belkacem,"Mind, World, Media"
"I was loved in Liverpool, I had good relationship with the fans and my team-mates but I felt I could do better.",Ryan Babel,"Good, Better, Fans"
"You don't want to be ungenerous toward people who give you prizes, but it is never the social or political message that interests me in a novel. I begin with an interest in a relationship, a situation, a character.",John Irving,"Character, Political, Me"
"It's not like a boss and artist relationship; it's like a big brother to a younger brother relationship, and he's a great guy. So big shout-out to Akon and the Konvict Muzik crowd.",WizKid,"Great, Boss, Brother"
"I've been working on my relationship with God, and when you work on your relationship with God, it gets to a point where you don't want to walk down the sinful road anymore.",Hopsin,"Work, God, Walk"
"I lived Tom Girardi's legal life with him first 10 years of our relationship. I went to every legal organization, every event - all of those groups he belonged to and those speeches he gave.",Erika Jayne,"Life, Legal, Organization"
What makes a fulfilling relationship or fulfilling life is not simply found in another. It's found in a group of others.,Hanya Yanagihara,"Life, Group, Others"
"But when my mother ran for City Council, that was the moment when I knew I wanted to be a political reporter. Some reporters asked her about being married to my father - they have an interracial relationship - as if that was somehow a negative thing.",Kristen Welker,"Moment, Political, City"
If a relationship is founded on love it doesn't end.,Rosanne Cash,"Love, End, Founded"
Having a two-year-old is very hard. I feel like I'm in a relationship with an emotionally unstable woman who is also physically abusive and never gets in trouble for it.,Ali Wong,"Woman, Feel, Trouble"
"We must then build a proper relationship between the richest and the poorest countries based on our desire that they are able to fend for themselves with the investment that is necessary in their agriculture, so that Africa is not a net importer of food, but an exporter of food.",Gordon Brown,"Food, Agriculture, Investment"
My sister is a lesbian and I want her to have that same feeling. A civil partnership is not the same as marriage. She's in a serious relationship with a girl I am obsessed with. I would love her to marry her girlfriend because I love her so much.,Vogue Williams,"Love, Marriage, I Am"
"We're thrilled to expand our relationship, knowing that with the great team at the Music Group, Word, and Warner Bros., and with their proven record of excellence, we're looking ahead to an even brighter future for Curb.",Mike Curb,"Future, Great, Music"
"We all think that this relationship thing is a game out here. All I'm saying to women is, 'Okay. If it's a game, here are the rules that we play by.'",Steve Harvey,"Women, Game, Rules"
"When I was dancing, whether it was the music or the story, the question was 'Why am I doing this piece, and why am I dancing?' It is exactly the same when you are acting. You have a very close relationship with your body movement. You have to find the physicality of your character.",Sofia Boutella,"Music, Character, Your"
"I lived to play basketball. Growing up as a kid, Bill Russell and the Boston Celtics were my favorite team. The way they played, the teamwork, the sacrifice, the commitment, the joy, the camaraderie, the relationship with the fans.",Bill Walton,"Sacrifice, Joy, Commitment"
"In any relationship, there's gonna be conflict.",Solange Knowles,"Conflict, Gonna, Any"
"My sister is raised to know her value and to know that she stands behind no man. You know, when she gets a husband, you stand side by side, equal partnership. You stand behind no one cause you have to lift each other up. You can't do that if you're 30 percent of the value in your relationship or the household.",Aldis Hodge,"Man, Your, Value"
"I'm not really into religion, OK. I saw a lot of things I did not like when I got into organized religion. I think a lot of people abuse it, I think a lot of people use it, I think a lot of people make it what they want. And me, my faith and my relationship with God is very personal. And it's not anybody's damn business how we talk.",Jake Roberts,"Faith, God, Business"
"There is no inherent power in the office of the vice presidency. Zero. None. It's all a reflection of your relationship with the president. I mean, Kennedy never let Johnson in the office.",Joe Biden,"Power, Your, Reflection"
"There are ups and downs in so many relationships, but with Shah Rukh, there is deep love. There's no other way of communicating the respect and love I have for him. And I believe that ours will be a dynamic, and relationship and connect that will be forever.",Karan Johar,"Love, Respect, Ups And Downs"
The reason for fasting is to understand the relationship between what's you and what's the accumulative body.,Jaggi Vasudev,"Body, Fasting, Understand"
"In general, the problem in a relationship is when the couple stagnate.",Simon Baker,"Problem, General, Couple"
I always believe that it's better to be idealistic in love than be that cynic. That's the only way to survive a relationship.,Sonam Kapoor,"Love, Always, Believe"
"Couples counseling gets many couples back together. But not all, and not always. For your own sake and that of your children, however, I recommend it - I almost insist on it - as the first step for anyone unhappy in a relationship.",Laura Wasser,"Always, Your, Together"
I think our strength is this strong relationship we have all together.,Guy Forget,"Strength, Together, Strong"
"On Amazon, you find retailers that want Amazon to do part of their services. Those, you don't find to the same degree on Google Shopping. On Google Shopping, you find sort of the bigger brands, those who want to have the customer relationship themselves - the data, the payment details, the search patterns.",Margrethe Vestager,"Search, Find, Shopping"
Seeing the world differently is one of the toughest incompatibilities to reconcile in a relationship.,Mariella Frostrup,"World, Seeing, Differently"
