title,author,tags
"There are some good space battles in some of the later series, but that wasn't why you were tuning in every week. You were tuning in every week because Spock was a fascinating character. Because his friendship with Kirk was profound and really unusual.",Ronald D. Moore,"Friendship, Good, Character"
"I am naturally to myself, and I would rather have my own space, but I do realize what the effect I have is.",6lack,"Myself, I Am, Own"
Anything that stimulates the public's imagination about the nobility and the importance of space exploration is something that I'm very excited to be a part of.,Ron Howard,"Imagination, Excited, Anything"
"Space is a laboratory, an experiment in all forms of all things, an infinity of possibilities, properties, and places that cry out for investigation and exploration.",Rick Tumlinson,"Cry, Possibilities, Laboratory"
"You get this overview effect where you realize how small we are and how fragile our planet is and how we're really all in it together. You don't see borders from space, you don't see diversity and differences in people on Earth.",Anne McClain,"Together, Diversity, Differences"
"Graphic Design, which fulfills aesthetic needs, complies with the laws of form and exigencies of two-dimensional space; which speaks in semiotics, sans-serifs, and geometrics; which abstracts, transforms, translates, rotates, dilates, repeats, mirrors, groups, and regroups, is not good design if it is irrelevant.",Paul Rand,"Design, Good, Aesthetic"
"Starbucks was founded around the experience and the environment of their stores. Starbucks was about a space with comfortable chairs, lots of power outlets, tables and desks at which we could work and the option to spend as much time in their stores as we wanted without any pressure to buy. The coffee was incidental.",Simon Sinek,"Work, Experience, Power"
"In a small space, you want to keep the bedding as simple as possible so it looks clean, calm and collected.",Nate Berkus,"Simple, Calm, Keep"
Losing my daughter was a very serious pain. There was always some empty space in my heart.,Yoko Ono,"Pain, Always, Heart"
"It is our duty, as parents and as teachers, to give all children the space to build their emotional strength and provide a strong foundation for their future.",Kate Middleton,"Future, Strength, Parents"
"In some sense, prose fiction is just a way of unlocking a space. If I can unlock the space, it comes out and it's vivid, I find that I care about it, and it's part of me.",Ben Marcus,"Me, Care, Way"
"Environmental degradation has one cause above all others: the propensity of human beings to take the benefit and leave the costs to someone else, preferably someone far away in space or time, whose protests can be safely ignored.",Roger Scruton,"Time, Environmental, Far Away"
We were talking about the space between us all and the people who hide themselves behind a wall of illusion. Never glimpse the truth - then it's far too late when they pass away.,George Harrison,"Truth, Illusion, People"
In the United States there is more space where nobody is than where anybody is. That is what makes America what it is.,Gertrude Stein,"America, Nobody, More"
I am able to take a wire line and go into the air and define the air without stealing from anyone. A line can enclose and define space while letting the air remain air.,Ruth Asawa,"I Am, Air, Go"
I think what's important is to give space to the range of human experience.,Judy Chicago,"Experience, Important, Human"
People automatically associate the caliber of the space based on the appliances.,Scott McGillivray,"People, Appliances, Based"
"I've always hankered after going into space and walking on the moon and Mars. I did want to be an astronaut, and had there been a manned space flight programme in the U.K., I would have been knocking on the door.",David Mackay,"Always, Moon, Mars"
"When we look out into space, we're looking back in time; the light from a galaxy a billion light-years away, for instance, will take a billion years to reach us. It's an amazing thing. The history is there for us to see. It's not mushed up like the geologic record of Earth. You can just see it exactly as it was.",Margaret Geller,"History, Time, Amazing"
Develop a mind so filled with love that it resembles space.,Sharon Salzberg,"Love, Mind, Develop"
"Our streets should be inviting and safe so anyone can feel comfortable choosing to ride a bike, walk, or take transit, and so it is clear which space is for which mode of travel.",London Breed,"Travel, Walk, Ride"
"As a designer, the mission with which we have been charged is simple: providing space at the right cost.",Harry von Zell,"Architecture, Simple, Mission"
"You can't ignore mobile. We are doing a lot of stuff in the game space, mostly nonconsole stuff, and those are primarily mobile/pad games.",Jon Feltheimer,"Game, Doing, Ignore"
"Time and space - time to be alone, space to move about - these may well become the great scarcities of tomorrow.",Edwin Way Teale,"Alone, Time, Great"
"The majority of the world is empty space. Empty space, empty space, empty space. All that we see in the world, the life, the animals, plants, people - it's all empty space. That's amazing!",Chris Evans,"Life, Amazing, World"
"As long as you don't forgive, who and whatever it is will occupy rent-free space in your mind.",Isabelle Holland,"Your, Mind, Long"
"When the space shuttle's engines cut off, and you're finally in space, in orbit, weightless... I remember unstrapping from my seat, floating over to the window, and that's when I got my first view of Earth. Just a spectacular view, and a chance to see our planet as a planet.",Sally Ride,"Chance, Window, Remember"
"I've become a workaholic. When the shows slow down and there's no press and I can get my time to myself in the studio with my music, I get into this zone, man. I enter this incredible space where I'm just making music. And I feel like I can work with anybody - with Elton John, with Hanson - and I can make something incredible.",Wale,"Work, Time, Music"
Our life is full of empty space.,Umberto Eco,"Life, Empty, Empty Space"
"We must learn how to live in the space of inner peace in our everyday lives. This takes consistent, conscious effort because I know so many black women are hurting and sad, and we don't easily express our heartache or show our wounds.",Susan L. Taylor,"Women, Sad, Peace"
"I think about that 'empty' space a lot. That emptiness is what allows for something to actually evolve in a natural way. I've had to learn that over the years - because one of the traps of being an artist is to always want to be creating, always wanting to produce.",Meredith Monk,"Always, Way, Emptiness"
Space excites me. My dream is to go to space.,Karen Gillan,"Me, Dream, Go"
"I have won this lottery. It's a gigantic lottery, and it's called Amazon.com. And I'm using my lottery winnings to push us a little further into space.",Jeff Bezos,"Push, Lottery, Us"
"I learned about serif and san serif typefaces, about varying the amount of space between different letter combinations, about what makes great typography great. It was beautiful, historical, artistically subtle in a way that science can't capture, and I found it fascinating.",Steve Jobs,"Science, Great, Beautiful"
"The reality is the majority of us will not get off this planet. So the long run is, some kind of space exploration has to benefit us here on Earth.",Mae Jemison,"Long, Reality, Will"
Space travel for everyone is the next frontier in the human experience.,Buzz Aldrin,"Experience, Travel, Everyone"
Technology has opened up the music business 100-fold and provided space for all kinds of new faces.,Andy Mineo,"Technology, Business, Music"
The key to creating the mental space before responding is mindfulness. Mindfulness is a way of being present: paying attention to and accepting what is happening in our lives. It helps us to be aware of and step away from our automatic and habitual reactions to our everyday experiences.,Elizabeth Thornton,"Step, Way, Attention"
When we're growing up there are all sorts of people telling us what to do when really what we need is space to work out who to be.,Ellen Page,"Work, People, Growing Up"
"From day one, I have been told I am no different from the male astronauts. As a pilot, I flew in the sky. Now that I am an astronaut, I will fly in space.",Liu Yang,"Sky, Fly, Day"
Your billion-dollar ideas don't show up in the middle of dramatic distraction. They show up when you have the business and personal discipline to make space for your creative mind to flourish.,Robin S. Sharma,"Business, Your, Discipline"
"Drones ply the liminal space between the physical and the digital - pilots fly them, but aren't in them. They are versatile and fascinating objects - the things they can do range from the mundane (aerial photography) to the spectacular - killing people, for example.",John Battelle,"Fly, Drones, People"
"Harlem was a development, a developer's dream and a place where residents had more space and more amenities than ever before. The subway reached 145th street about 1904, and it seemed that Harlem's destiny was to become largely a preserve of successful ethnics relocating and arriving. Then, overnight, the bust took place.",David Levering Lewis,"Destiny, Street, Place"
"'2001: A Space Odyssey' is a movie that really impressed me as a teenager. And also 'Blade Runner.' And 'Close Encounters of the Third Kind' is also one of my favorites. I'm always looking for sci-fi material, and it's difficult to find original and strong material that's not just about weaponry.",Denis Villeneuve,"Always, Me, Difficult"
"I had always planned to make a large painting of the early spring, when the first leaves are at the bottom of the trees, and they seem to float in space in a wonderful way. But the arrival of spring can't be done in one picture.",David Hockney,"Art, Done, Always"
"Faffing is good. It is an important part of life. Faffing is when we disconnect from the matrix and idle for a while, like a car. Our body and spirit know deep down that human beings were not made for constant toil so subconsciously creates space through the mechanism of faffing.",Tom Hodgkinson,"Life, Good, Car"
"We never had books at home, but my dad, seeing how keen I was to read, took me to Islington Library when I was about eight and we pulled out two - a Biggles and a science fiction novel. I never got the ace fighter pilot but fell in love with all things to do with the future and space. Isaac Asimov soon became my guiding star.",Gary Kemp,"Love, Science, Future"
I've played four roles on 'Star Trek.' My favorite episode was 'The Visitor' on 'Deep Space Nine.',Tony Todd,"Deep, Four, Star"
"Yes, I did feel a special responsibility to be the first American woman in space.",Sally Ride,"Responsibility, Woman, Feel"
"The obvious thing to me was, let's take freely floating masses in space and measure the time it takes light to travel between them. The presence of a gravitational wave would change that time. Using the time difference, one could measure the amplitude of the wave.",Rainer Weiss,"Change, Time, Travel"
"'Storm Warnings' is a poem about powerlessness - about a force so much greater than our human powers that while it can be measured and even predicted, it is beyond human control. All 'we' can do is create an interior space against the storm, an enclave of self-protection, though the winds of change till penetrate keyholes and 'unsealed apertures.'",Adrienne Rich,"Change, Storm, Control"
"A lot of my works deal with a passage, which is about time. I don't see anything that I do as a static object in space. It has to exist as a journey in time.",Maya Lin,"Time, Journey, See"
"Space exploration is important research to our economic and national defense, and America's space program is a symbol of our success as a scientifically and technologically advanced nation.",Randy Forbes,"Success, Research, Important"
"I'm not scared. I always go forward, trying to create space and make my way toward the goal.",Neymar,"Always, Way, Trying"
"I don't see myself in competition with anyone, I am in my own space; I don't follow anyone, though I appreciate good work always.",Guru Randhawa,"Work, Good, Myself"
"Somehow, I see music as a garden which has a lot of different styles: contemporary, classic, ethnic, Japanese, rock & roll, and so on. I can enjoy them all, and there is space for them all.",Ryuichi Sakamoto,"Music, I Can, Garden"
The space within becomes the reality of the building.,Frank Lloyd Wright,"Design, Reality, Building"
"The mysteriousness and mystique of space is such, that science fiction attempts to tantalize you by telling you a story that could possibly be out there and that's the appeal of science fiction.",William Shatner,"Science, Science Fiction, Story"
"I'm a fully trained cosmonaut and have completed 800 hours training, which has made me the No. 1 civilian reserve ready to visit the International Space Station. I am determined to go up, and I want to explore the Moon, Mars and beyond!",Brian Blessed,"Moon, Mars, Training"
"Any type of operating system that I wanted to be able to hack, I basically compromised the source code, copied it over to the university because I didn't have enough space on my 200 megabyte hard drive.",Kevin Mitnick,"Drive, Enough, University"
"There are people who take on different objectives and missions in life. When you grow older, there's a a void - and right now, I'm filling a space where a lot of old rock, grime, hip-hop, punk artists left a vacant space.",Skepta,"Life, Grow, People"
"I started playing the guitar when we started filming the pilot to 'Lost in Space,' which was way back in December of 1964, and there's a little bit in the pilot that was used in the first season where Will Robinson is sitting around some bad foam rubber rock playing and singing 'Greensleeves.'",Bill Mumy,"Guitar, Lost, Will"
I probably wore out my VHS copy of 'Office Space.',Kim Shaw,"Copy, Office, Out"
"My fascination has been the space between cloth and the body, and using a two-dimensional element to clothe a three-dimensional form.",Issey Miyake,"Body, Three-Dimensional, Two-Dimensional"
"I've always seen TV as... it didn't occupy the same rarefied space as literature, but it's art you can use day to day. I've never been hung up on where it figures in the hierarchy of learning.",Louis Theroux,"Learning, Art, Always"
"Two subsequent incidents of import established CNN: the explosion of the space shuttle Challenger in 1986, which CNN was the only network to cover as it happened, and the 1991 Gulf War, which CNN chronicled round the clock from a proximity as irresistible as it was alarming, bomb blasts and gunfire lighting up TV screens from coast to coast.",Steve Erickson,"War, Clock, Only"
"The most important part of my work on The Orion Building was the creation within the apartments of living space which inspires people and the way they live their lives, whether they have bought a one-bedroom apartment or the penthouse. This building is beautiful to see, sense, and experience.",John Rocha,"Work, Experience, Beautiful"
It is only in the world of objects that we have time and space and selves.,T. S. Eliot,"Time, Brainy, World"
"Psychology is still trying to explain the perception of the position of an object in space, along with its shape, size, and so on, and to understand the sensations of color.",James J. Gibson,"Perception, Trying, Understand"
"Many people may not recognize that the development of space exploration technologies has already helped benefit Earth in many ways, especially when it comes to communications, Earth observation and even fostering economic growth. Space technologies are surprisingly critical in impacting government, industry and personal daily decision-making.",Dylan Taylor,"Government, Daily, Growth"
I think I understand something about space. I think the job of a sculptor is spatial as much as it is to do with form.,Anish Kapoor,"Job, Understand, Sculptor"
"Architecture is always the will of the age conceived as space - nothing else. Until this simple truth is clearly recognized, the struggle over the foundation of a new architecture confident in its aims and powerful in its impact cannot be realized; until then, it is destined to remain a chaos of uncoordinated forces.",Ludwig Mies van der Rohe,"Truth, Age, Architecture"
"When museums are built these days, architects, directors, and trustees seem most concerned about social space: places to have parties, eat dinner, wine-and-dine donors. Sure, these are important these days - museums have to bring in money - but they gobble up space and push the art itself far away from the entrance.",Jerry Saltz,"Art, Money, Dinner"
"There was a point in my life where I either wanted to be an astronaut, an actor, a veterinarian, or a pirate. I just thought being in space would be really cool, but then you have to have 20/20 vision, which I don't have, so there.",Emily Bett Rickards,"Life, Cool, Vision"
"The whole world appears to me like a huge vacuum, a vast empty space, whence nothing desirable, or at least satisfactory, can possibly be derived; and I long daily to die more and more to it; even though I obtain not that comfort from spiritual things which I earnestly desire.",David Brainerd,"Daily, World, Long"
The Space Station is primarily made of aluminum. The smell is really weird and sort of like burning metal. It is absolutely distinct and totally repeatable.,Sunita Williams,"Weird, Smell, Metal"
"Each one of us decides to incarnate upon this planet at a particular point in time and space. We have chosen to come here to learn a particular lesson that will advance us upon our spiritual, evolutionary pathway.",Louise L. Hay,"Life, Time, Spiritual"
"The first news event I understood as a small child was the loss of the space shuttle Challenger, which President Reagan eloquently mourned from the Oval that evening.",Pete Buttigieg,"Evening, News, First"
"King Princess is like an attitude. I take comfort in it as kind of a shield to exist in, where I can make cohesive art. And it's androgynous, which is intentional. It's important to me that my art exist in a kind of neutral space, genderless to some degree. And give the listener some imagery to hold on to.",King Princess,"Attitude, Art, King"
"The universe is a symphony of strings, and the mind of God that Einstein eloquently wrote about for thirty years would be cosmic music resonating through eleven-dimensional hyper space.",Michio Kaku,"God, Music, Mind"
"When time and space and change converge, we find place. We arrive in Place when we resolve things. Place is peace of mind and understanding. Place is knowledge of self. Place is resolution.",Abdullah Ibrahim,"Change, Knowledge, Time"
"I thought I was prepared for space, and it still absolutely defied every expectation and dream. It is an incredible thing to put yourself on a rocket and launch off the planet. It is an amazing thing to see the planet from space. This blue sphere is almost indescribably beautiful.",Kathleen Rubins,"Amazing, Beautiful, Yourself"
Hospitality is about trying to support multiple functions in one space.,Miguel McKelvey,"Support, Trying, Hospitality"
"If I hadn't been inside of Biosphere 2 and really lived a biological life-support system, I definitely would not be involved in life-support systems for space.",Jane Poynter,"Inside, System, Lived"
"A cigarette is a breathing space. It makes a parenthesis. The time of a cigarette is a parenthesis, and if it is shared, you are both in that parenthesis. It's like a proscenium arch for a dialogue.",John Berger,"Time, Cigarette, Dialogue"
"We live with incessant music, all the time. It's like some weird musical purgatory, there is absolutely no rest for the ears, no space to absorb and reflect.",James Blake,"Time, Music, Rest"
"When walking, you see things that you miss in a motor car or on the train. You give your mind space to ponder.",Tom Hodgkinson,"Car, Your, Mind"
"With any luck, by the time NASA's space probe hits Pluto, you'll be booking a spaceflight with a privately run suborbital airline.",Burt Rutan,"Time, Luck, NASA"
"Here we were, the only seven humans in space, repairing a telescope whose only purpose is to enrich the minds of people on planet Earth and increase our understanding of the workings of the universe. I can think of no better peaceful use of space for all humankind.",John M. Grunsfeld,"Universe, Better, Purpose"
We won't sit idly by when a crime is committed in the real world. So why should we when it happens in cyber space?,Max Baucus,"World, Crime, Real"
"Then I became a mother and it just fills every space, that isn't filled with something else important. It's just like this incredible balloon that blows up and fills life up.",Thandie Newton,"Life, Important, Mother"
"Isn't it crazy to think that we've explored space more than we have explored the depths of our ocean? That just fires up my imagination about potential sea monsters and cool creatures, that kind of stuff.",James Wan,"Cool, Imagination, Sea"
"When you talk to crews that went to Mir or have gone up to International Space Station, they say that you go through different phases of adaptation or getting used to the space environment.",Laurel Clark,"Talk, They Say, Go"
"Our imagination just needs space. It's all it needs, that moment where you just sort of stare into the distance where your brain gets to sort of somehow rise up.",Glen Hansard,"Imagination, Brain, Moment"
Filecoin is a decentralized storage market - think of it like Airbnb for cloud storage - where anybody with extra hard drive space can sell it on the network.,Juan Benet,"Drive, Hard, Market"
"It was Apollo 8 that first showed us the tiny blue marble of Earth floating in the void of space, one of the great psychological shifts in human history. From out there, we can both appreciate and begin to solve the problems of our world in ways unavailable to us otherwise.",Rick Tumlinson,"History, Great, World"
"Space, and space again, is the infinite deity which surrounds us and in which we are ourselves contained.",Max Beckmann,"Us, Infinite, Which"
I like black because it is a vacant space.,Lady Gaga,"Black, Like, Because"
"Every bit of me is devoted to love and art. And I aspire to try to be a teacher to my young fans who feel just like I felt when I was younger. I just felt like a freak. I guess what I'm trying to say is I'm trying to liberate them, I want to free them of their fears and make them feel that they can make their own space in the world.",Lady Gaga,"Love, Art, Teacher"
"I get to decide how my body shows up in any space. When I'm walking into a place like the Globes, I want to make it very clear that how I show up is to further the freedom of everybody.",Indya Moore,"Freedom, Body, Walking"
"We never deal with propaganda. We never deal with politics. We never deal with newspaper headlines. We deal with the harsh realities of our lives. We will only comment when there is more bread to eat, more space in which to move, time in which to open your mouth and sing. As long as these things have not happened, we do not talk about politics.",John Kani,"Politics, Time, Your"
"I've dealt with a lot of couples over the years, and most cite the battle for closet and bathroom space as one of the most frequent causes of marital discord.",Candice Olson,"Battle, Bathroom, Discord"
"Even up here on Vancouver on the weekends, I go work out in a studio space.",Dule Hill,"Work, Go, Studio"
"Minnesota is legit. There's so much space to run, like back home in Texas.",Jimmy Butler,"Home, Back, Much"
"If I have to point to something specific with the way I move my camera, I love to do it with a wide lens. I like to show you as much of the space as I can, even if I'm following a character.",James Wan,"Love, Character, Way"
"Sometimes, we have to turn our camera to a mirror to shoot something, and people think, 'Oh, that's very stylish.' Yes it is, but at the same time, we did it because we are shooting in a very small space, and that was our only option.",Wong Kar-wai,"Time, Mirror, People"
"To be white in America is to have the confidence to say, without a second thought: this space, this neighborhood, this city, this county, this country is mine.",Joy Reid,"Confidence, City, Country"
"If I had a magic wand, I would live in a building in New York, big enough so my friends, my family could all have apartments in it. We'd raise our kids in the same space and have backyard barbecues and get old and fat together.",Liz Murray,"Family, Together, Fat"
"There are definitely parts of Asia, Central America that when you look at them from space, you're always looking through a haze of pollution. As far as the atmosphere is concerned, and being able to see the surface, you know, I would say definitely those areas that I mentioned look kind of sick.",Scott Kelly,"Always, Look, Pollution"
"Their Internet usage is growing very rapidly, and even they can do the math: If everyone in China needed an IPv4 address - just one - this country would use up one third of the entire public IP address space.",Vint Cerf,"Internet, Country, Everyone"
"I suppose that every time there is difficulty. I remember about Space Mountain: It took us ten years before we found the technology that would allow such a ride. And during these ten years, I had a model that I kept, waiting for the technology we needed.",John Hench,"Technology, Time, Waiting"
The James Webb Space Telescope was specifically designed to see the first stars and galaxies that were formed in the universe.,John M. Grunsfeld,"Stars, Universe, First"
