title,author,tags
"When I first started going out to lesbian clubs, I felt a very binary recreation of hetero culture. There are butches and femmes, and I felt like I was neither of those things. I'm in a turtleneck and jeans and just learning to be comfortable in that space. I realized I don't have to be a certain way.",Dee Rees,"Learning, Culture, Binary"
"For the last several years and culminating in six months in orbit next year, I've been training for my third space flight. This one is almost in a category completely different than the previous two, specifically to live in on the space station for six months, to command a space ship and to fly a new rocket ship.",Chris Hadfield,"Work, Fly, Training"
I do strive to find projects that are trying to carve out some new space. I enjoy projects that leap away from the crowd a little bit.,Emily Blunt,"New, Find, Trying"
There's always space for me to grow and I think that experimenting and making mistakes is gonna get me to this position where I'm trying to be is always changing.,Benee,"Always, Grow, Me"
My obsession with outer space is my way of being different. I make astronaut music. It takes an astronaut so long to get to space - that's how long it takes to catch up on my music.,Future,"Music, Long, Way"
"I don't consider myself a competition to anyone. There is ample space for everyone here. When there are directors who create characters for me, why should I feel bothered or insecure? When it comes to updating myself, I work very hard to relate to the emotions of characters I play.",Kajal Aggarwal,"Work, Myself, Competition"
We'd never have got a chance to go outside and look at the earth if it hadn't been for space exploration and NASA.,James Lovelock,"Chance, Look, Earth"
"When I came into stand-up, I found a certain safe space of intellectualism, of camaraderie, of excellence that really has always been natural to me but always felt foreign in the other spaces I've been in.",Amanda Seales,"Always, Excellence, Me"
"After the Challenger accident, NASA put in a lot of time to improve the safety of the space shuttle to fix the things that had gone wrong.",Sally Ride,"Time, NASA, Safety"
My brain is just so busy. I'm inattentive; I'm a daydreamer: the space cadet kind.,Hannah Gadsby,"Brain, Busy, Just"
The kitchen is a sacred space.,Marc Forgione,"Food, Kitchen, Sacred"
"I love New York, but I can't deal with the cold and the small space.",Katya Zamolodchikova,"Love, New, Cold"
"I've always held the view that great states need strategic space. I mean, George Washington took his space from George III. Britain took it from just about everybody. Russia took all of Eastern Europe. Germany's taken it from everywhere they can, and China will want its space too.",Paul Keating,"Great, Always, View"
Karma is only in space time and causality. Your real self resides non-locally.,Deepak Chopra,"Time, Your, Karma"
"Some day we'll move into space and start ensuring the survival of our species beyond Earth, whether it happens in a hundred years or a thousand.",Neil Turok,"Day, Survival, Start"
Criticism is nonsense. TV shows and newspapers just want to fill the space.,Ronaldo,"Criticism, Nonsense, Want"
"The best bands kept making records and had this evolution, where by the end, by their commercial phase or sellout phase, the records are from outer space.",Ariel Rechtshaid,"Best, Evolution, End"
I like bags that are easy to wear and are pretty to look at. But I don't like them when they have no space and you can't put anything in them.,Alice Dellal,"Look, Easy, Anything"
"For clothes, I like Anna on Regent's Park Road. Anna Park, who owns it, has an amazing eye for fresh, exciting clothes. I also love Arrogant Cat on Kensington Church Street. Space NK on Duke of York Square for exciting potions. I think I stretch the term 'tester' way beyond its boundaries.",Sophie Winkleman,"Love, Amazing, Street"
"I never, ever romanticise life in the pit. It was a hard, dirty, noisy, tiring, dangerous job in a confined space, a very dark world with no toilets or running water to drink or wash with.",Dennis Skinner,"Life, Water, World"
"Sometime in the future, science will be able to create realities that we can't even begin to imagine. As we evolve, we'll be able to construct other information systems that correspond to other realities, universes based on logic completely different from ours and not based on space and time.",Robert Lanza,"Science, Future, Time"
"They're the last human beings susceptible to human shame. Politicians are the only people left for whom, occasionally, shame hurts them. Everyone else, we've sort of done away with it as a concept, and we're hurtling through space like animals, basically.",Jon Lovett,"Done, People, Politicians"
"People are fascinated by space flight. It makes them interested in science, gets them asking questions and motivates them.",Helen Sharman,"Science, People, Questions"
"The Electoral College is provided for in Article II, Section 1 of the Constitution. More space in the Constitution is devoted to laying out the Electoral College than to any other concept in the document.",Kayleigh McEnany,"Constitution, Electoral College, College"
"At the moment I'm doing this space movie, so I'm obsessed with physics and space travel. I know three months down the line it's gone. Then I'll be able to superficially say stuff about space.",Cillian Murphy,"Travel, Moment, Doing"
"When I left NASA, I was looking at how you could use space technologies for developing countries' work.",Mae Jemison,"Work, Looking, NASA"
Why not a space flower? Why do we always expect metal ships?,W. D. Richter,"Always, Flower, Why"
"After 1980, you never heard reference to space again. Surface, the most convincing evidence of the descent into materialism, became the focus of design. Space disappeared.",Arthur Erickson,"Design, Focus, Never"
Spiritual space is lost in gaining convenience. I saw the need to create a mixture of Japanese spiritual culture and modern western architecture.,Tadao Ando,"Architecture, Culture, Spiritual"
"I love being in a public space where teenagers are talking. And the funny thing is that it hasn't changed that much. There's certainly slang that I'm not familiar with, but among the average teen, it's still the same.",Marti Noxon,"Funny, Love, Teen"
Google is intending to compete with Uber in the ridesharing space.,David Drummond,"Google, Uber, Compete"
"I'd say, for me, it's cooking that gives me a space beyond music. I love food. And somehow, music and food go together so well. Cooking is very therapeutic. That preparation, the fragrance of spices, the wafting aromas - it just sweeps aside my depression, tiredness and name what you may.",Shreya Ghoshal,"Love, Food, Music"
"Retain the vision for space exploration. If we turn our backs on the vision again, we're going to have to live in a secondary position in human space flight for the rest of the century.",Buzz Aldrin,"Vision, Rest, Live"
"Kids today aren't listening to music audio-only. They're picking up a CD and looking at the lyric sheet and wondering why the pictures aren't moving around. Who wants to do that? It's like Bam Bam Flintstone hanging with the dinosaurs vs. Elroy Jetson who's flying around space. If I'm a kid, I wanna be kicking it with Elroy.",will.i.am,"Music, Today, Listening"
"Science fiction writers didn't predict the fade-out of NASA's manned space operations, and they weren't prepared with alternative routes to space when that decline became undeniable.",Gregory Benford,"Science, Predict, Science Fiction"
"There's a Danish architecture firm called BIG. I love architecture, and I always check out their work; they're very good at reimagining the way we live. They put the human experience as the focus, with access to air and outdoor space.",Nikolaj Coster-Waldau,"Love, Work, Good"
"I like leaving a space hollowed out, where as I change I can inject new meaning in the shell of the songs all of the time. Where anyone who listens can hopefully inhabit them in their own way.",Adrianne Lenker,"Change, Time, Way"
"When I was a child, and I was at our school, everybody's parents were involved in space program. In every class, we have several kids whose fathers were flown cosmonauts or who prepared for the flight.",Sergey Volkov,"Parents, School, Flight"
"Strange indeed would it be if all the space around us be empty, mere waste void, and the inhabitants of Earth the only forms in which intelligence could clothe itself.",Annie Besant,"Intelligence, Earth, Empty"
"The ballet makes us look at those bodies, it makes us listen to that music, it makes us wonder at the geometry, of the way they come together. The way that extraordinary space is controlled and given such emotional force.",John Guare,"Music, Together, Look"
"From the beginning I thought about working with the body in movement, the space between the body and clothes. I wanted the clothes to move when people moved. The clothes are also for people to dance or laugh.",Issey Miyake,"Body, Dance, Laugh"
"We are creatures of the moment; we live from one little space to another, and only one interest at a time fills these.",William Dean Howells,"Time, Moment, Live"
"Roman civilization had achieved, within the bounds of its technology, relatively as great a mastery of time and space as we have achieved today.",Arthur Erickson,"Technology, Time, Great"
"Laughter is binary: It either happens or it doesn't. As each joke arrives in the course of a film, the cavernous space of the theater is either filled with joy and laughter or with the quiet of cringing embarrassment. Every time you step to the plate to make a joke, you're going to experience one or the other.",David Dobkin,"Experience, Time, Step"
The James Webb Space Telescope was specifically designed to see the first stars and galaxies that were formed in the universe. So we're gonna see the snapshot of when stars started. When galaxies started. The very first moments of the universe. And my bet? There's gonna be some big surprises.,John M. Grunsfeld,"Stars, Universe, First"
"Since the Columbia accident, the Russian space agency, or the Russian space program, has been literally carrying the load bringing us all the supplies we need on the Progress vehicle, smaller amounts on the Soyuz vehicles.",John L. Phillips,"Progress, Us, Vehicle"
"From the age of four, I was a huge comic fan and still am. When Lost in Space came along it was like being in a huge comic so we jumped at the chance of being part of that project and it proved to be a good choice.",Bill Mumy,"Good, Age, Chance"
"It's coming home to roost over the next 50 years or so. It's not just climate change; it's sheer space, places to grow food for this enormous horde. Either we limit our population growth or the natural world will do it for us, and the natural world is doing it for us right now.",David Attenborough,"Change, Home, Food"
"Inner space is so much more interesting, because outer space is so empty.",Theodore Sturgeon,"Empty, Much, Interesting"
"I founded io9 back in 2008, and I watched it journey from the farthest reaches of space to its current home under this atmosphere bubble on Ceres.",Annalee Newitz,"Home, Journey, Bubble"
"I have always looked for growth, and in TV, you are as good as your last show. So I only care about my personal space, my family, and close friends.",Mouni Roy,"Family, Good, Always"
"Absolutely the most fun thing to do in space and rewarding thing, in many ways, is to look back at planet Earth.",John M. Grunsfeld,"Look, Earth, Fun"
"Space exploration has taken a tremendous technological leap. India as a developing nation has been recognized globally for how it has economized its missions, which have been comparatively low-cost compared with other countries.",Rakesh Sharma,"Nation, Leap, Exploration"
"The total number of people that do a job that has the same description as mine in the entire world is fewer than 10. There's a lot of effort looking for life in space - that's a lot of what NASA does, but they're not necessarily looking for the kind of life that can hold up its side of a conversation.",Seth Shostak,"Life, Effort, World"
"So many times, when you're doing a job, you feel like you're a nuisance at times to people, intruding on their space when you ask them questions; maybe they don't want to deal with you at the time. And now, it's, 'Hey, welcome, where's Craig?' Whereas, now, it's kind of different.",Craig Sager,"Time, Welcome, Doing"
"Sites need to be able to interact in one single, universal space.",Tim Berners-Lee,"Technology, Need, Universal"
"I think size is the most unused quotient in the sculptor's repertoire because it requires lots of commitment and time. To me it's the best tool. With size you get space and atmosphere: atmosphere becomes volume. You stand in the shape, in the zone.",Michael Heizer,"Best, Time, Me"
"There was a lake beneath me, but the big, heavy parachute which had to be opened two miles above the ground couldn't be steered. My first thought was, 'Lord, they send just one woman into space, and she has to end up in the water.'",Valentina Tereshkova,"Water, Me, Woman"
"I love my music, so I want to produce, write, and serve my music. I've had to learn about EQ frequencies and programming and space and clutter and how to be a better piano or bass player - everything.",FKA twigs,"Love, Music, Better"
"I came out of UCB and, before that, punk rock, and the whole deal was you do it yourself. Get up and rent the space, get up and press your own records, get up and silkscreen your own tees, get it done yourself. That sort of self-reliance will only serve me. Any time I lose sight of that, my career suffers.",John Ross Bowie,"Time, Done, Your"
Something people don't recognize is that being on the space station is probably a lot like being in some kind of confinement - like isolation.,Scott Kelly,"People, Isolation, Something"
"Trending topics helped make Twitter a more relevant metric of what the world was talking about at any given moment. Google has worked for years in the space, most notably with Google Trends and Hot Searches, but Google+ offers the search giant the ability to see what is truly trending in real time.",Ben Parr,"Time, Moment, World"
"I think space, architectural space, is my thing. It's not about facade, elevation, making image, making money. My passion is creating space.",Peter Zumthor,"Money, Passion, Making Money"
"You can't get around certain stuff, whether it's in Darfur or on your block at home. What makes us political is your home turf, your family, your life space. You walk down the street, and automatically a human being is territorial, and political happens in that.",Sixto Rodriguez,"Life, Family, Home"
"Redwood time moves at a more stately pace than human time. To us, when we look at a redwood tree, it seems to be motionless and still, and yet redwoods are constantly in motion, moving upward into space, articulating themselves and filling redwood space over redwood time, over thousands of years.",Richard Preston,"Time, Tree, Look"
"Pollution is everywhere, in that ancient Greek sense of miasma: guilt experienced as abject body fluid, moral pollution defining what kinds of beings count in social space.",Timothy Morton,"Body, Pollution, Guilt"
"The Fifties and Sixties were years of unreal optimism about weather forecasting. Newspapers and magazines were filled with hope for weather science, not just for prediction but for modification and control. Two technologies were maturing together: the digital computer and the space satellite.",James Gleick,"Science, Hope, Weather"
"Yosemite Valley, to me, is always a sunrise, a glitter of green and golden wonder in a vast edifice of stone and space.",Ansel Adams,"Nature, Always, Green"
"When I finished 'P.S. I Still Love You,' I truly was done with the series. I kept saying the books were two halves of a heart. But I suppose time and space had made me nostalgic, because my mind kept drifting back to Lara Jean and Peter, wondering what they were up to.",Jenny Han,"Love, Time, Done"
"Each work has its own space, which should neither be conceived as a sort of cage nor regarded as extending to infinity.",Marino Marini,"Work, Own, Infinity"
Britain's Got Talent' is about those moments when an unknown person takes to the stage and changes their life in the space of a few minutes.,Michael McIntyre,"Life, Talent, Person"
"I suppose there's a melancholy tone at the back of the American mind, a sense of something lost. And it's the lost world of Thomas Jefferson. It is the lost sense of innocence that we could live with a very minimal state, with a vast sense of space in which to work out freedom.",George Will,"Work, Freedom, Mind"
"Two kids in their dorm room can't start anything important in space today. That's why I want to take the assets I have from Amazon and translate that into the heavy-lifting infrastructure that will allow the next generation to have dynamic entrepreneurialism in space, to build that transportation network.",Jeff Bezos,"Today, Start, Generation"
"An airplane cabin isn't the first place people think of when they choose an exhibition space, but I'm all for doing things differently.",Ben Eine,"Airplane, Doing, People"
"I still dream about being on the space station with the feeling of being weightless. The weightlessness is the most amazing, relaxing and natural feeling.",Helen Sharman,"Amazing, Feeling, Dream"
"While human space travel is daunting, machines - with their indefinitely long lifetimes - could travel the galaxy. It might make little difference to them that bridging the distance from one star to the next could take hundreds of thousands of years or more.",Seth Shostak,"Travel, Long, Distance"
"I've always fantasized about being on TV. And I was. Then I fantasized about being in the movies. What could be better than captain of a space ship? I get to ride horses, shoot guns, have adventures.",Nathan Fillion,"Movies, Always, Ride"
"I am always in my space and it's a happy space. It gets stressful at times, but that's a part and parcel of our job.",Amit Trivedi,"Always, I Am, Job"
"Throughout the movies' golden age, the Western enriched Hollywood financially and artistically. But in the 1970s, the genre lost its audience appeal to fantasy films of the 'Star Wars' stripe, which told more or less the same story - elemental animosities leading to an armed showdown - but at a faster tempo, and in outer space.",Richard Corliss,"Age, Movies, Lost"
"I haven't really thought about where to scatter my ashes when the time comes, but I doubt that it would be in space.",Scott Bakula,"Time, Doubt, Ashes"
"The novel is not so much a literary genre, but a literary space, like a sea that is filled by many rivers.",Jose Saramago,"Sea, Much, Like"
"Find joy and solace in the simple, and cultivate your utopia by feeling the Tao in every cubic inch of space.",Wayne Dyer,"Your, Simple, Joy"
"With 'Deep Space Nine,' I learned that when you get a script, you should give honor to the writer. On 'Larry Sanders,' even on '24,' you could make up stuff.",Penny Johnson Jerald,"Honor, Make, Deep"
"The fascination to go into space has existed for hundreds of years. But as we do things and they're successful, people get bored.",Jim Lovell,"People, Go, Bored"
"There's no real music scene in Guyana, but there's a music space. So there's no scene because there's no economy for it, but there's a space because everything that spills over dancehall and reggae, spills over.",Saint Jhn,"Music, Real, Everything"
"For so much of my life, I lived feeling as if, if I spoke, if I said something, I would lose everything. I would be pushed out. No one will want me. No one will love me. No one would want to be friends with me. It took me decades to get to a space of saying, 'This is my truth. This is who I am, and I don't care if you like me or you don't like me.'",Janet Mock,"Life, Love, Truth"
"I grew up in a two-bedroom house with my grandfather, my mom and dad and four kids. I slept on the couch or on the floor, and I always wanted to have my own space.",John Searles,"Mom, Dad, Always"
"In design-speak, 'a library' means a room lined with books, floor-to ceiling, but it all depends on the space you have. You may have a free-standing bookshelf of your favorite books if that's all you have room for.",Nate Berkus,"Your, Library, Room"
"In football, time and space are the same thing.",Graham Taylor,"Time, Sports, Football"
"My space expedition has changed my perspective towards people. Looking down at the Earth, we could not see borders or people with different nationalities. It was then that realisation dawned on us that all of us are a group of human beings and citizens of the universe.",Sunita Williams,"Universe, Perspective, People"
"We have responsibilities for others, not just across space but across time. We have responsibilities to people who came before us. They left us a world of institutions, ideas or possibilities for which we, in turn, owe them something. One of the things we owe them is not to squander them.",Tony Judt,"Time, World, Ideas"
"In 1987, Merrill Lynch asked me to open a Swiss capital markets operation. I was 27. In hindsight, I was lucky enough to start a business from scratch. And I mean from zero - no offices, even, just a space with walls between different areas. We decided to tear down the walls.",Sergio Ermotti,"Business, Me, Start"
"On a standard space shuttle crew, two of the astronauts have a test pilot background - the commander and the pilot.",Sally Ride,"Test, Pilot, Two"
"We're in the space exploration business, and the outer solar system is a wild, wooly place. We haven't explored it very well.",Alan Stern,"Business, Wild, Place"
"Now and then, someone is able to look at an empty space, conclude it would be a great place to start a revolution, and bravely go forward.",Henry Rollins,"Great, Look, Start"
"Through a shared aim, shared needs, shared love of a shared result in theatre, from the creation of space... the coming-together of an endlessly repeated climax of shared performance, again and again, something special can appear.",Peter Brook,"Love, Aim, Result"
"This moment exhibits infinite space, but there is a space also wherein all moments are infinitely exhibited, and the everlasting duration of infinite space is another region and room of joys.",Thomas Traherne,"Moment, Room, Infinite"
"We have one planet in our solar system that's habitable, and that's the Earth, and space travel can transform things back here for the better. First of all, by just having people go to space and look back on this fragile planet we live on. People have come back transformed and have done fantastic things.",Richard Branson,"Travel, Done, Better"
"Space has always fascinated me. As a young boy looking up at the stars, I found it impossible to resist thinking what was out there and if I ever would experience space first-hand.",Richard Branson,"Experience, Impossible, Always"
We have teams of people working on electric cars. So you never know - you may find Virgin competing with the Tesla in the car business as we do in the space business.,Richard Branson,"Business, Car, Electric Cars"
"Showing young children in these communities, that there are outlets for their feelings, that there is room in a space for their stories to be told, and that they will be applauded - and it's not about ego, it's about connection: that their pain is everybody else's pain.",Tom Hiddleston,"Pain, Will, Feelings"
"Each organism, no matter how simple or complex, has around it a sacred bubble of space, a bit of mobile territoriality which only a few other organisms are allowed to penetrate and then only for short periods of time.",Edward Hall,"Time, Simple, Matter"
"In my opinion, future space exploration will require us to inhabit the moon, initially, and later Mars. This is a humongous task for any one nation to carry out.",Rakesh Sharma,"Future, Moon, Mars"
"Now if you're using Twitter or other social networks, and you didn't realize this was a space with a lot of Brazilians in it, you're like most of us. Because what happens on a social network is you interact with the people that you have chosen to interact with.",Ethan Zuckerman,"People, Happens, Realize"
"If you're going to lead a space frontier, it has to be government; it'll never be private enterprise. Because the space frontier is dangerous, and it's expensive, and it has unquantified risks. And under those conditions, you cannot establish a capital-market evaluation of that enterprise. You can't get investors.",Neil deGrasse Tyson,"Government, Risks, Dangerous"
"Football doesn't depend just on your brain. It's not like on a computer. It depends on your body, too, and sometimes you are tired. Sometimes the opponent closes the space very well and marks you very well. Football depends on many things, not just on you.",Fernandinho,"Football, Brain, Tired"
"The causes for my eating disorder ran along the usual lines: depression, an inability to express my rage, a desire to exert control, a desire to feel less, a desire to have my body express the things my voice could not. That, and I had gotten in the habit of believing it was better to take up less space.",Zoe Kazan,"Body, Better, Voice"
Drag has always been an open space where anyone within the LGBT community can express their creativity.,Carmen Carrera,"Always, Community, Creativity"
"I love actors, and I love projects that give them space and room, and I aim for these projects where the characters are that important.",Jean-Marc Vallee,"Love, Aim, Important"
I am grateful to the motherland and the people. I feel honored to fly into space on behalf of hundreds of millions of female Chinese citizens.,Liu Yang,"Fly, I Am, Grateful"
