title,author,tags
The original idea of the web was that it should be a collaborative space where you can communicate through sharing information.,Tim Berners-Lee,"Technology, Information, Sharing"
"I believe that the future of humans, and the future of Earth, depends on space exploration. That's not a French problem, or a problem for Alabama: it's a planet-wide problem. International cooperation is crucial.",John M. Grunsfeld,"Future, Believe, Earth"
"We are aware only of the empty space in the forest, which only yesterday was filled with trees.",Anna Freud,"Environmental, Yesterday, Forest"
"Everything was so new - the whole idea of going into space was new and daring. There were no textbooks, so we had to write them.",Katherine Johnson,"New, Everything, Daring"
"When we developed written language, we significantly increased our functional memory and our ability to share insights and knowledge across time and space. The same thing happened with the invention of the printing press, the telegraph, and the radio.",Jamais Cascio,"Knowledge, Time, Memory"
"The human brain now holds the key to our future. We have to recall the image of the planet from outer space: a single entity in which air, water, and continents are interconnected. That is our home.",David Suzuki,"Future, Home, Brain"
"We are seeing more managed money and, to an extent, institutional money entering the space. Anecdotally speaking, I know of many people who are working at hedge funds or other investment managers who are trading cryptocurrency personally, the question is, when do people start doing it with their firms and funds?",Olaf Carlson-Wee,"Money, Start, Doing"
Space has always been the spiritual dimension of architecture. It is not the physical statement of the structure so much as what it contains that moves us.,Arthur Erickson,"Architecture, Always, Spiritual"
The really wonderful thing that happened to me when I was in space was this feeling of belonging to the entire universe.,Mae Jemison,"Universe, Me, Feeling"
"All architecture is shelter, all great architecture is the design of space that contains, cuddles, exalts, or stimulates the persons in that space.",Philip Johnson,"Design, Great, Architecture"
"Even in empty space, time and space still exist.",Sean M. Carroll,"Time, Empty, Empty Space"
"I didn't understand at first why I couldn't meet a guy for so long. But as time goes by, I understood why actresses usually get married late. I think their hearts for work become bigger and happiness from the work takes the most space in their hearts.",Son Ye-jin,"Happiness, Work, Time"
"Our time here is magic! It's the only space you have to realize whatever it is that is beautiful, whatever is true, whatever is great, whatever is potential, whatever is rare, whatever is unique, in. It's the only space.",Ben Okri,"Inspirational, Time, Great"
Vanity can create a very cruel space for you if you don't know how to manage it.,Lady Gaga,"Attitude, Know, Create"
"An end of something means the beginning of something else, and I don't think that something else is going to be the death of the manned space program.",John Glenn,"Death, Beginning, End"
Language is a virus from outer space.,William S. Burroughs,"Communication, Language, Virus"
"When it comes to social media, there are just times I turn off the world, you know. There are just some times you have to give yourself space to be quiet, which means you've got to set those phones down.",Michelle Obama,"Social Media, Yourself, World"
"In many a piece of music, it's the pause or the rest that gives the piece its beauty and its shape. And I know I, as a writer, will often try to include a lot of empty space on the page so that the reader can complete my thoughts and sentences and so that her imagination has room to breathe.",Pico Iyer,"Beauty, Music, Imagination"
"Coming home to a tidy, pulled-together space will help everything in your life feel the same way.",Bobby Berk,"Life, Home, Your"
"Every single day, I wake up and take a glimpse of where I am now compared to where I was before, and the work that we have all put in to be in this space. I think of that, and being able to express myself through my art and show up and be present - that's activism, advocacy, and artistry in itself.",Mj Rodriguez,"Work, Art, Myself"
"Black people, we are fully deserving of the room and space to fully express our humanity. This is what Black Lives Matter is truly about.",Opal Tometi,"Humanity, Black, Matter"
"It's like everything in football - and life. You need to look, you need to think, you need to move, you need to find space, you need to help others. It's very simple in the end.",Johan Cruyff,"Life, Football, Simple"
Major actions by courageous and wise men will be necessary to avoid our continuing to blunder into the space age like unenlightened and selfish idiots.,Fritz Zwicky,"Age, Men, Wise"
"You don't have to live on a farm to have chickens; in some places, you just need a little bit of green space and a tidy chicken coop. To me, they're nearly ideal pets. They feed us more often than we feed them! We have 2 chickens, Goldie and Paprika, and they each produce 1 egg a day, sometimes more.",Amy Robach,"Day, Green, Me"
"I feel like I'm at a really happy, good space.",Kim Kardashian,"Good, Feel, Happy"
"I have learned the hard way to mind my business, without judging who people are and what they do. I am more troubled by the lack of space being provided for the truth to unfold. Humans cannot seem to wait for or honor the truth. Instead, we make it up based on who we believe people should or should not be.",Iyanla Vanzant,"Truth, Business, Mind"
"The promise of any artwork is that it can hold us - viewer and maker - in a conflicted or contestable space, without real-world injury or loss.",Kara Walker,"Loss, Us, Injury"
Architecture is the will of an epoch translated into space.,Ludwig Mies van der Rohe,"Architecture, Will, Epoch"
An all-white space has a purity that is refreshing and serene.,Mary Helen Bowers,"Refreshing, Purity, Serene"
Science at NASA is all about exploring the endless frontier of the Earth and space.,John M. Grunsfeld,"Science, Earth, NASA"
Space is the breath of art.,Frank Lloyd Wright,"Design, Art, Breath"
"Asteroids have us in our sight. The dinosaurs didn't have a space program, so they're not here to talk about this problem. We are, and we have the power to do something about it. I don't want to be the embarrassment of the galaxy, to have had the power to deflect an asteroid, and then not, and end up going extinct.",Neil deGrasse Tyson,"Science, Power, End"
"Each of us can manifest the properties of a field of consciousness that transcends space, time, and linear causality.",Stanislav Grof,"Time, Consciousness, Us"
"As photographs give people an imaginary possession of a past that is unreal, they also help people to take possession of space in which they are insecure.",Susan Sontag,"Past, People, Help"
Role-playing games are just an organic improvised space for storytelling.,Matthew Mercer,"Organic, Storytelling, Games"
Canada and space are a natural fit.,Marc Garneau,"Canada, Natural, Fit"
Sculpture occupies real space like we do... you walk around it and relate to it almost as another person or another object.,Chuck Close,"Walk, Person, Real"
Well-run libraries are filled with people because what a good library offers cannot be easily found elsewhere: an indoor public space in which you do not have to buy anything in order to stay.,Zadie Smith,"Good, Library, People"
"I acknowledge the privilege of being alive in a human body at this moment, endowed with senses, memories, emotions, thoughts, and the space of mind in its wisdom aspect.",Alex Grey,"Wisdom, Memories, Thoughts"
"What is a fear of living? It's being preeminently afraid of dying. It is not doing what you came here to do, out of timidity and spinelessness. The antidote is to take full responsibility for yourself - for the time you take up and the space you occupy. If you don't know what you're here to do, then just do some good.",Maya Angelou,"Good, Time, Fear"
"If women can be railroad workers in Russia, why can't they fly in space?",Valentina Tereshkova,"Women, Fly, Why"
I love the desert and its incomparable sense of space.,Robyn Davidson,"Love, Desert, Sense"
Every day sees humanity more victorious in the struggle with space and time.,Guglielmo Marconi,"Time, Struggle, Day"
"When the history books are written in a thousand years, when space travel would have become routine, the moment that humans first left Earth will be of huge importance. Star City is a central part of this story and it deserves more recognition.",Helen Sharman,"History, Travel, Moment"
Nothing puzzles me more than the time and space; and yet nothing troubles me less.,Charles Lamb,"Time, Me, Nothing"
"When we're in that kind of childish space, we're more genuine and feel more comfortable with our friends.",Evan Spiegel,"Childish, Feel, Genuine"
I always begin a room with the rug; it is literally the foundation of the space. I then go on to the furniture.,Lee Radziwill,"Always, Foundation, Furniture"
"The Learning Hub is a collection of handmade concrete towers surrounding a central space that brings everyone together, interspersed with nooks, balconies and gardens for informal collaborative learning.",Thomas Heatherwick,"Learning, Together, Handmade"
"Why does everyone think the future is space helmets, silver foil, and talking like computers, like a bad episode of Star Trek?",Tracey Ullman,"Funny, Future, Computers"
We understand bringing girls into the tech space is about giving them skills to create social impact and change in their community.,Kimberly Bryant,"Change, Community, Impact"
"Because of technologies from space exploration, we can begin to understand our world's origins, and our lives are improving. These are the reasons why dedicating a life to the sciences and space exploration is so meaningful and rewarding.",Emily Calandrelli,"Life, World, Understand"
Equality and separation cannot exist in the same space.,Jason Mraz,"Equality, Cannot, Separation"
"It's important to understand how Coinbase thinks about regulation and compliance in the digital currency space. As an exchange, we view compliance as key to digital currency's success.",Brian Armstrong,"Success, View, Important"
"Pleasure is a shadow, wealth is vanity, and power a pageant; but knowledge is ecstatic in enjoyment, perennial in frame, unlimited in space and indefinite in duration.",DeWitt Clinton,"Knowledge, Power, Shadow"
"NASA is an engine of innovation and inspiration as well as the world's premier space exploration agency, and we are well served by politicians working to keep it that way, instead of turning it into a mere jobs program, or worse, cutting its budget.",Bill Nye,"Politics, World, Keep"
"The Earth reminded us of a Christmas tree ornament hanging in the blackness of space. As we got farther and farther away it diminished in size. Finally it shrank to the size of a marble, the most beautiful marble you can imagine.",James Irwin,"Christmas, Beautiful, Tree"
"When it comes to space, I see it as my job, I'm building infrastructure the hard way. I'm using my resources to put in place heavy lifting infrastructure so the next generation of people can have a dynamic, entrepreneurial explosion into space.",Jeff Bezos,"Generation, Way, People"
"My buildings should have an emotional core - a space which, in itself, has an emotional nice feeling.",Peter Zumthor,"Buildings, Feeling, Nice"
String theory envisions a multiverse in which our universe is one slice of bread in a big cosmic loaf. The other slices would be displaced from ours in some extra dimension of space.,Brian Greene,"Universe, Bread, Big"
President Obama has outsourced a major portion of the U.S. space program to the Russians. That's national policy. Taxpayer money. So let's stop playing games with this outsourcing distortion and talk about the fact that when we need is a president that knows how to manage big enterprise and create jobs.,John Sununu,"Money, Playing Games, Create"
Be intentional with your space. Don't be afraid to step on a limb and design your home the way you love it.,Joanna Gaines,"Love, Design, Home"
"If I go into the place in myself that is love, and you go into the place in yourself that is love, we are together in love. Then you and I are truly in love, the state of being love. That's the entrance to Oneness. That's the space I entered when I met my guru.",Ram Dass,"Love, Myself, Together"
Architecture is how the person places herself in the space. Fashion is about how you place the object on the person.,Zaha Hadid,"Architecture, Person, Fashion"
"There may be aliens in our Milky Way galaxy, and there are billions of other galaxies. The probability is almost certain that there is life somewhere in space.",Buzz Aldrin,"Life, Way, Probability"
"If we die, we want people to accept it. We're in a risky business, and we hope that if anything happens to us, it will not delay the program. The conquest of space is worth the risk of life.",Gus Grissom,"Life, Hope, Business"
"Almost everything worthwhile carries with it some sort of risk, whether it's starting a new business, whether it's leaving home, whether it's getting married, or whether it's flying in space.",Chris Hadfield,"Business, Home, New"
Social media is not a safe space.,Tarana Burke,"Social Media, Media, Safe"
Nearly everybody I know does something to try to remove herself to clear her head and to have enough time and space to think... All of us instinctively feel that something inside us is crying out for more spaciousness and stillness to offset the exhilarations of this movement and the fun and diversion of the modern world.,Pico Iyer,"Time, World, Try"
"I want people to fall in love with themselves and to be really proud and full of joy for the space they take up. If someone else appreciates the space you take up, then that's icing on the cake.",Jonathan Van Ness,"Love, Joy, Cake"
"Private enterprise can never lead a space frontier. It's not possible because a space frontier is expensive, it has unknown risks and it has unquantified risks.",Neil deGrasse Tyson,"Risks, Possible, Never"
"In a modern loft, you can't just fill a space with furniture. Each piece has to be perfect.",Nate Berkus,"Furniture, Perfect, Just"
The most amazing thing to me about the sea is the tide. A harbour like St. Ives is totally transformed in a very short space of time by the arrival or departure of the sea.,John Dyer,"Time, Amazing, Sea"
Architecture is about public space held by buildings.,Richard Rogers,"Architecture, Buildings, About"
I find texting to be kind of a safe space.,Mary H.K. Choi,"Find, Be Kind, Safe"
"I always believe that Kar-Wai has a complete script: he just doesn't show it to us. He wants us to experience and explore the character. He gives you a lot of space, and you know every time will be a very long journey. You just live in the character, and that's very different from other directors.",Tony Leung Chiu-Wai,"Experience, Time, Journey"
"I'm happy that I have my family, and I'm happy that I had Virginia, where I grew up, to retreat to any time I felt overwhelmed. Whenever there were times when I felt like the rug was being pulled out from under me and I was floating in this crazy space, I would stop and go back to that neighborhood and realize nothing's changed, really.",Dave Grohl,"Family, Time, Me"
"Architecture is the will of an epoch translated into space. Living, Changing, New. Not yesterday, not tomorrow, only today can be given form. Only such architecture is creative.",Ludwig Mies van der Rohe,"Architecture, Today, Tomorrow"
"Jupiter, Pluto, pick a planet: we can go there. I just got a bit more work to do in the music industry, and we're going to space, baby.",Future,"Work, Music, Go"
Space and light and order. Those are the things that men need just as much as they need bread or a place to sleep.,Le Corbusier,"Design, Men, Light"
"In my mind I needed a symbol of today's technology, and I realized that what I wanted to photograph was the Space Shuttle. And so that's where Places of Power came into being.",John Sexton,"Power, Technology, Today"
"For me, architecture is not just creating a space to protect people but to make them dream as well.",Mario Botta,"Architecture, Me, People"
"A library is a place that is a repository of information and gives every citizen equal access to it. That includes health information. And mental health information. It's a community space. It's a place of safety, a haven from the world.",Neil Gaiman,"Health, Community, World"
"I have values. But morals are Christian. There's no religion here. Values. Don't hurt when you don't need to, but don't let anybody step over that line - it's an invisible line, but it's respect for somebody's space.",John Lydon,"Respect, Religion, Step"
"A just laicism allows religious freedom. The state does not impose religion but rather gives space to religions with a responsibility toward civil society, and therefore it allows these religions to be factors in building up society.",Pope Benedict XVI,"Freedom, Society, Religion"
Words are like untying a corset - you can move into this great space with them.,Ali Smith,"Great, Words, Corset"
"I love the freedom of having my own space and my own place and doing things on my terms, and not really having to think about anybody else's schedule.",Danielle Fishel,"Love, Freedom, Doing"
"I have an idea about building almost like a studio for some of the best Tropfest filmmakers, so they can come together and support and be given space and resources they need to tell great stories year around, so it's not just about the festivals. You know, the sky's the limit with this thing, and I'm still making it up as I go along.",John Polson,"Best, Great, Sky"
"The greatest propaganda coup of the American Right has been to convince its citizens that we are in the grip of a liberal conspiracy. As a result, Obama is to the right of Richard Nixon on most issues. And there is we believe, certainly some space to exploit there. And we, VICE, aim to exploit it.",Shane Smith,"Believe, Aim, Result"
"We are bombarded on all sides by a vast number of messages we don't want or need. More information is generated in a single day than we can absorb in a lifetime. To fully enjoy life, all of us must find our own breathing space and peace of mind.",James E. Faust,"Life, Peace, Day"
Rhythm is the life of space of time danced through.,Cecil Taylor,"Life, Time, Rhythm"
"Something I like to do a lot is just sit by water when there's a current and just stare into the water. I don't fish, I don't hunt, I don't scuba, I don't spear, don't boat, don't play basketball or football - I excel at staring into space. I'm really good at that.",Iggy Pop,"Good, Football, Water"
No one cares about race or religion or nationality in space travel. We're all just part of Team Human.,Anne McClain,"Religion, Travel, Race"
"I think 'Lost in Space' certainly shifted from being an ensemble adventure series about a family facing the unknown alien environment to this trio of comedians - Dr. Smith, the Robot, and Will Robinson being the straight guy. It definitely changed its tone over the three seasons and 84 episodes we did.",Bill Mumy,"Family, Lost, Will"
"Trees bear fruits only to be eaten by others; the fields grown grains, but they are consumed by the world. Cows give milk, but she doesn't drink it herself - that is left to others. Clouds send rain only to quench the parched earth. In such giving, there is little space for selfishness.",Munshi Premchand,"Rain, Clouds, World"
"A pedestal is as much a prison as any small, confined space.",Gloria Steinem,"Prison, Much, Small"
"The modern artist is working with space and time, and expressing his feelings rather than illustrating.",Jackson Pollock,"Time, Art, Feelings"
We look forward with great anticipation to see the course that the National Space Council charts for America's future in space.,Bruce Pittman,"Future, Great, Look"
"Traditional Chinese art looked at the Earth from a Confucian mountain top; Japanese art looked closely around screens; Italian Renaissance art surveyed conquered nature through the window or door-frame of a palace. For the Cro-Magnons, space is a metaphysical arena of continually intermittent appearances and disappearances.",John Berger,"Nature, Art, Window"
"I'm an artiste... I dance, I act, and I do a lot of things that's got to do with arts, and that's my space. I feel happiest in that space.",Nora Fatehi,"Dance, Feel, Act"
"I think maths is the root of everything. If we understood every area of math, it would lead to improving our sense of science, physics, engineering, space travel... all those great things. Maths is a backbone for it.",Matt Haig,"Science, Great, Travel"
"On the whole, books are indeed less finite than ourselves. Even the worst among them outlast their authors - mainly because they occupy a smaller amount of physical space than those who penned them. Often they sit on the shelves absorbing dust long after the writer himself has turned into a handful of dust.",Joseph Brodsky,"Long, Worst, Sit"
What I didn't know was I was deeply attracted to the big space.,David Hockney,"Art, Know, Big"
I take the invasion of my personal space very seriously.,Kid Rock,"Seriously, Personal, Take"
The rhythm of relations of color and size makes the absolute appear in the relativity of time and space.,Piet Mondrian,"Time, Rhythm, Color"
"Underwater, I experience space with my body. I'll see a school of fish gathering and moving together and I'll exclaim, 'This is architecture.'",Antoine Predock,"Experience, Architecture, Together"
"I spend the entire 90 minutes looking for space on the pitch. I'm always between the opposition's two holding midfielders and thinking, 'The defence is here, so I get the ball and I go there to where the space is.'",Xavi,"Always, Thinking, Looking"
"Perhaps I seek certain utopian things, space for human honour and respect, landscapes not yet offended, planets that do not exist yet, dreamed landscapes.",Werner Herzog,"Respect, Landscapes, Human"
"As someone who flew two space capsules and twice landed in the ocean, I can attest from personal experience how much logistics work is needed to get you home.",Buzz Aldrin,"Work, Experience, Home"
"My plays are for the kind of black people who relate to funk music, to Parliament-Funkadelic. When those guys get out of a spaceship - the idea that black people are from outer space, there's a poetic truth to that. We are this vast people.",Suzan-Lori Parks,"Truth, Music, Black"
"You don't see any borders between countries from space. That's man-made, and one experiences it only when you return to Earth.",Sunita Williams,"Earth, See, Only"
"When looking through the spiritual eye, or the third eye encased within the human mind, one can see vividly beyond the ken of human eyesight, beyond the material atom, and into the future, thereby transcending the limitations of time and space.",Alice Coltrane,"Future, Time, Mind"
"I think getting your head in the right mental space is important, and maybe I do need to go back to my rookie vibes to where I'm very happy-go-lucky, nothing really matters.",Xander Schauffele,"Your, Nothing, Important"
"Time and space always change, but there is something which is eternal and changeless. For example, the world and time, past or future, nothing exists for us in sleep. But we exist. Let us try to find out that which is changeless and which always exists.",Ramana Maharshi,"Future, Change, Time"
"Geez, all that money we waste on space exploration; just think how many bombs that would buy!",Craig Bruce,"Money, Exploration, Space Exploration"
"I love working with a set designer because, in many respects, you meet the set designer before you meet the actors. So it's a chance for me as a director to figure out what I'm thinking and to explore how the space is going to actually be activated.",George C. Wolfe,"Love, Chance, Thinking"
"Bumble is all about community and safe, empowered connections, and the Hive represents a natural extension of our brand and our values. We love that we've given people an opportunity to connect digitally, and the Hive allows us and our users to take that to the next level in a space where connections can come to life in person.",Whitney Wolfe Herd,"Life, Love, Opportunity"
"We need Big Ideas, as we are in a time of small people, and as Kennedy showed with Apollo, doing something grand in space is the biggest. At a time of huge national doubt and fear of losing our leadership as a nation to others, it focused us, gave us something positive and inspired a generation.",Rick Tumlinson,"Positive, Leadership, Time"
"Chernobyl happened in April of 1986. A few months earlier, in January 1986, the Challenger space shuttle exploded. It did not have the impact on the environment and the amount of lives that Chernobyl did, but it was the result of the same exact problem: a failure of a lot of people and institutions over a long period of time.",Craig Mazin,"Failure, Time, Long"
"In an enclosed space, a camel's breath can change the atmosphere of the room. Not only just the smell, they literally seem to change the atmospheric pressure. It's so disgusting. It's like they have eight stomachs each more rancid then the next and it just comes out of their mouth.",Steve Carell,"Change, Pressure, Smell"
"Finally my dream came true in that there was a possibility that I could travel to the International Space Station. I've gone through the medicals and the training and now I'm officially, by the Russian Space Federation, a cosmonaut in training.",Sarah Brightman,"Travel, Training, True"
