title,author,tags
"My motto was always to keep swinging. Whether I was in a slump or feeling badly or having trouble off the field, the only thing to do was keep swinging.",Hank Aaron,"Always, Keep, Motto"
"When the going gets weird, the weird turn pro.",Hunter S. Thompson,"Weird, Turn, Going"
You can't win unless you learn how to lose.,Kareem Abdul-Jabbar,"Lose, Win, Learn"
Success is where preparation and opportunity meet.,Bobby Unser,"Success, Opportunity, Preparation"
"Football is a simple game. Twenty-two men chase a ball for 90 minutes and at the end, the Germans always win.",Gary Lineker,"Men, Always, Football"
People ask me what I do in winter when there's no baseball. I'll tell you what I do. I stare out the window and wait for spring.,Rogers Hornsby,"Spring, Window, Wait"
"Gold medals aren't really made of gold. They're made of sweat, determination, and a hard-to-find alloy called guts.",Dan Gable,"Determination, Gold, Sweat"
Some people are born on third base and go through life thinking they hit a triple.,Barry Switzer,"Life, Thinking, People"
"I've missed more than 9000 shots in my career. I've lost almost 300 games. 26 times, I've been trusted to take the game winning shot and missed. I've failed over and over and over again in my life. And that is why I succeed.",Michael Jordan,"Life, Game, My Life"
Trying to sneak a fastball past Hank Aaron is like trying to sneak the sunrise past a rooster.,Joe Adcock,"Past, Sunrise, Trying"
Champions keep playing until they get it right.,Billie Jean King,"Keep, Right, Until"
"Every day is a new opportunity. You can build on yesterday's success or put its failures behind and start over again. That's the way life is, with a new game every day, and that's the way baseball is.",Bob Feller,"Life, Success, Opportunity"
"I'm tired of hearing about money, money, money, money, money. I just want to play the game, drink Pepsi, wear Reebok.",Shaquille O'Neal,"Money, Tired, Game"
Football is football and talent is talent. But the mindset of your team makes all the difference.,Robert Griffin III,"Football, Your, Talent"
Many men go fishing all of their lives without knowing that it is not fish they are after.,Henry David Thoreau,"Men, Fishing, Fish"
Sports do not build character. They reveal it.,Heywood Broun,"Character, Build, Reveal"
"I went to a fight the other night, and a hockey game broke out.",Rodney Dangerfield,"Fight, Game, Hockey"
The only way to prove that you're a good sport is to lose.,Ernie Banks,"Good, Lose, Way"
"You can't put a limit on anything. The more you dream, the farther you get.",Michael Phelps,"Dream, Limit, Anything"
"Just be patient. Let the game come to you. Don't rush. Be quick, but don't hurry.",Earl Monroe,"Game, Rush, Patient"
Do you know what my favorite part of the game is? The opportunity to play.,Mike Singletary,"Opportunity, Game, Know"
There are only two seasons - winter and Baseball.,Bill Veeck,"Winter, Seasons, Baseball"
"The way a team plays as a whole determines its success. You may have the greatest bunch of individual stars in the world, but if they don't play together, the club won't be worth a dime.",Babe Ruth,"Success, Together, Stars"
"To find a man's true character, play golf with him.",P. G. Wodehouse,"Character, Man, True"
Winners never quit and quitters never win.,Vince Lombardi,"Win, Never, Quit"
Fans don't boo nobodies.,Reggie Jackson,"Fans, Boo"
"God made me fast. And when I run, I feel His pleasure.",Eric Liddell,"God, Me, Feel"
All hockey players are bilingual. They know English and profanity.,Gordie Howe,"Hockey, Know, Players"
Hockey is a sport for white men. Basketball is a sport for black men. Golf is a sport for white men dressed like black pimps.,Tiger Woods,"Men, Hockey, Black"
"I always turn to the sports pages first, which records people's accomplishments. The front page has nothing but man's failures.",Earl Warren,"Always, Man, Nothing"
One man practicing sportsmanship is far better than a hundred teaching it.,Knute Rockne,"Man, Better, Far"
I'll let the racket do the talking.,John McEnroe,"Talking, Racket"
Don't look back. Something might be gaining on you.,Satchel Paige,"Look, Back, Something"
You spend a good piece of your life gripping a baseball and in the end it turns out that it was the other way around all the time.,Jim Bouton,"Life, Good, Time"
"If a tie is like kissing your sister, losing is like kissing you grandmother with her teeth out.",George Brett,"Your, Losing, Sister"
Don't play too much golf. Two rounds a day are plenty.,Harry Vardon,"Day, Golf, Much"
Every strike brings me closer to the next home run.,Babe Ruth,"Home, Me, Strike"
"I am building a fire, and everyday I train, I add more fuel. At just the right moment, I light the match.",Mia Hamm,"Moment, Light, Fire"
A good hockey player plays where the puck is. A great hockey player plays where the puck is going to be.,Wayne Gretzky,"Good, Great, Hockey"
Just play. Have fun. Enjoy the game.,Michael Jordan,"Game, Fun, Enjoy"
Nobody roots for Goliath.,Wilt Chamberlain,"Roots, Nobody, Goliath"
Life is about timing.,Carl Lewis,"Life, Timing, About"
Sometimes in football you have to score goals.,Thierry Henry,"Football, Goals, Sometimes"
"If you think it's hard to meet new people, try picking up the wrong golf ball.",Jack Lemmon,"Try, New, People"
"These are my new shoes. They're good shoes. They won't make you rich like me, they won't make you rebound like me, they definitely won't make you handsome like me. They'll only make you have shoes like me. That's it.",Charles Barkley,"Good, Shoes, Handsome"
"Show me a good loser, and I'll show you a loser.",Vince Lombardi,"Good, Me, Loser"
Finding good players is easy. Getting them to play as a team is another story.,Casey Stengel,"Good, Easy, Story"
"The fewer rules a coach has, the fewer rules there are for players to break.",John Madden,"Rules, Players, Break"
Fishing is much more than fish. It is the great occasion when we may return to the fine simplicity of our forefathers.,Herbert Hoover,"Great, Fishing, Fish"
I want to rip out his heart and feed it to Lennox Lewis. I want to kill people. I want to rip their stomachs out and eat their children.,Mike Tyson,"Heart, Children, People"
All sports for all people.,Pierre de Coubertin,"People, All People"
"It's just a job. Grass grows, birds fly, waves pound the sand. I beat people up.",Muhammad Ali,"Fly, People, Job"
"To me, it doesn't matter how good you are. Sport is all about playing and competing. Whatever you do in cricket and in sport, enjoy it, be positive and try to win.",Ian Botham,"Positive, Good, Cricket"
"You win some, lose some, and wreck some.",Dale Earnhardt,"Lose, Win, Some"
"You don't play against opponents, you play against the game of basketball.",Bobby Knight,"Game, Play, Basketball"
"Serious sport has nothing to do with fair play. It is bound up with hatred, jealousy, boastfulness, disregard of all rules and sadistic pleasure in witnessing violence. In other words, it is war minus the shooting.",George Orwell,"Jealousy, War, Nothing"
Nobody's a natural. You work hard to get good and then work to get better. It's hard to stay on top.,Paul Coffey,"Work, Good, Better"
Most people never run far enough on their first wind to find out they've got a second.,William James,"Wind, Find, Enough"
New Yorkers love it when you spill your guts out there. Spill your guts at Wimbledon and they make you stop and clean it up.,Jimmy Connors,"Love, Your, New"
I won't predict anything historic. But nothing is impossible.,Michael Phelps,"Impossible, Nothing Is Impossible"
"The triple is the most exciting play in baseball. Home runs win a lot of games, but I never understood why fans are so obsessed with them.",Hank Aaron,"Home, Win, Fans"
The difference in golf and government is that in golf you can't improve your lie.,George Deukmejian,"Government, Your, Lie"
"If it doesn't matter who wins or loses, then why do they keep score?",Vince Lombardi,"Matter, Keep, Why"
Approach the game with no preset agendas and you'll probably come away surprised at your overall efforts.,Phil Jackson,"Your, Game, Surprised"
"It's a round ball and a round bat, and you got to hit it square.",Pete Rose,"Bat, Ball, Round"
"Baseball was, is and always will be to me the best game in the world.",Babe Ruth,"Best, Always, World"
Tennis is a perfect combination of violent action taking place in an atmosphere of total tranquillity.,Billie Jean King,"Action, Perfect, Place"
"I don't want to play golf. When I hit a ball, I want someone else to go chase it.",Rogers Hornsby,"Someone, Go, Golf"
You know it's going to hell when the best rapper out there is white and the best golfer is black.,Charles Barkley,"Best, Hell, Black"
We didn't lose the game; we just ran out of time.,Vince Lombardi,"Time, Lose, Game"
"If you watch a game, it's fun. If you play it, it's recreation. If you work at it, it's golf.",Bob Hope,"Work, Game, Fun"
"Golf is a game in which you yell 'fore,' shoot six, and write down five.",Paul Harvey,"Game, Down, Shoot"
I know I am getting better at golf because I am hitting fewer spectators.,Gerald R. Ford,"Better, I Am, Know"
I'm a competitive person and I love the challenge of mastering new things.,Sasha Cohen,"Love, Challenge, New"
"What other people may find in poetry or art museums, I find in the flight of a good drive.",Arnold Palmer,"Good, Art, Poetry"
The trouble with jogging is that the ice falls out of your glass.,Martin Mull,"Your, Jogging, Ice"
The only thing a golfer needs is more daylight.,Ben Hogan,"Daylight, Only, More"
Golf is a good walk spoiled.,Mark Twain,"Good, Walk, Golf"
Skiing combines outdoor fun with knocking down trees with your face.,Dave Barry,"Your, Face, Fun"
Gray skies are just clouds passing over.,Frank Gifford,"Clouds, Gray, Just"
Adversity causes some men to break; others to break records.,William Arthur Ward,"Men, Adversity, Others"
"You always get a special kick on opening day, no matter how many you go through. You look forward to it like a birthday party when you're a kid. You think something wonderful is going to happen.",Joe DiMaggio,"Birthday, Always, Day"
The only time my prayers are never answered is on the golf course.,Billy Graham,"Time, Never, Golf"
"If a man watches three football games in a row, he should be declared legally dead.",Erma Bombeck,"Football, Man, Dead"
Sports are a microcosm of society.,Billie Jean King,"Society, Microcosm"
Olympism is the marriage of sport and culture.,Juan Antonio Samaranch,"Marriage, Culture, Sport"
Half the lies they tell about me aren't true.,Yogi Berra,"Me, True, Tell"
My concentration level blocks out everything. Concentration is why some athletes are better than others. You develop that concentration in training and concentrate in a meet.,Edwin Moses,"Better, Training, Everything"
Baseball is drama with an endless run and an ever-changing cast.,Joe Garagiola,"Drama, Baseball, Endless"
Wrestling is ballet with violence.,Jesse Ventura,"Violence, Wrestling, Ballet"
Every great batter works on the theory that the pitcher is more afraid of him than he is of the pitcher.,Ty Cobb,"Great, Afraid, Theory"
Play is the only way the highest intelligence of humankind can unfold.,Joseph Chilton Pearce,"Intelligence, Way, Play"
"Reverse every natural instinct and do the opposite of what you are inclined to do, and you will probably come very close to having a perfect golf swing.",Ben Hogan,"Will, Perfect, Swing"
"The game of basketball has been everything to me. My place of refuge, place I've always gone where I needed comfort and peace. It's been the site of intense pain and the most intense feelings of joy and satisfaction. It's a relationship that has evolved over time, given me the greatest respect and love for the game.",Michael Jordan,"Love, Time, Respect"
Baseball is the only field of endeavor where a man can succeed three times out of ten and be considered a good performer.,Ted Williams,"Good, Man, Succeed"
You wouldn't have won if we'd beaten you.,Yogi Berra,"Beaten, Won, You"
"If you meet the Buddha in the lane, feed him the ball.",Phil Jackson,"Lane, Meet, Ball"
I went through baseball as 'a player to be named later.',Joe Garagiola,"Baseball, Through, Later"
A lifetime of training for just ten seconds.,Jesse Owens,"Training, Just, Lifetime"
Boxing has become America's tragic theater.,Joyce Carol Oates,"America, Boxing, Become"
"Most ball games are lost, not won.",Casey Stengel,"Lost, Ball, Games"
If you drink don't drive. Don't even putt.,Dean Martin,"Drive, Drink, Putt"
You can make a lot of money in this game. Just ask my ex-wives. Both of them are so rich that neither of their husbands work.,Lee Trevino,"Work, Money, Game"
"Winning is habit. Unfortunately, so is losing.",Vince Lombardi,"Winning, Losing, Habit"
"The uglier a man's legs are, the better he plays golf - it's almost a law.",H. G. Wells,"Man, Better, Law"
"Give me golf clubs, fresh air and a beautiful partner, and you can keep the clubs and the fresh air.",Jack Benny,"Beautiful, Me, Keep"
"One thing you learned as a Cubs fan: when you bought you ticket, you could bank on seeing the bottom of the ninth.",Joe Garagiola,"Bank, Seeing, Bottom"
Pitching is the art of instilling fear.,Sandy Koufax,"Art, Fear, Pitching"
I overcame size with mechanics.,Edwin Moses,"Size, Mechanics, Overcame"
"Baseball happens to be a game of cumulative tension but football, basketball and hockey are played with hand grenades and machine guns.",John Leonard,"Football, Game, Hockey"
Any time Detroit scores more than 100 points and holds the other team below 100 points they almost always win.,Doug Collins,"Time, Always, Win"
Bobby Knight told me this: 'There is nothing that a good defense cannot beat a better offense.' In other words a good offense wins.,Dan Quayle,"Good, Better, Me"
I see great things in baseball. It's our game - the American game.,Walt Whitman,"Great, Game, American"
"Perhaps the single most important element in mastering the techniques and tactics of racing is experience. But once you have the fundamentals, acquiring the experience is a matter of time.",Greg LeMond,"Experience, Time, Matter"
Golf appeals to the idiot in us and the child. Just how childlike golf players become is proven by their frequent inability to count past five.,John Updike,"Past, Idiot, Childlike"
"Basketball is like war in that offensive weapons are developed first, and it always takes a while for the defense to catch up.",Red Auerbach,"War, Always, First"
"He has the finest, fundamentally sound golf swing I've ever seen.",Jack Nicklaus,"Sound, Swing, Golf"
Hitting is timing. Pitching is upsetting timing.,Warren Spahn,"Timing, Pitching, Hitting"
"I guess there is nothing that will get your mind off everything like golf. I have never been depressed enough to take up the game, but they say you get so sore at yourself you forget to hate your enemies.",Will Rogers,"Hate, Your, Mind"
The difference between the old ballplayer and the new ballplayer is the jersey. The old ballplayer cared about the name on the front. The new ballplayer cares about the name on the back.,Steve Garvey,"Name, New, Difference"
"Football is an incredible game. Sometimes it's so incredible, it's unbelievable.",Tom Landry,"Football, Game, Sometimes"
"If a lot of people gripped a knife and fork the way they do a golf club, they'd starve to death.",Sam Snead,"Death, Way, People"
Other sports play once a week but this sport is with us every day.,Peter Ueberroth,"Day, Every Day, Week"
Baseball is a man maker.,Al Spalding,"Man, Baseball, Maker"
Bulls do not win bull fights. People do.,Norman Ralph Augustine,"Win, People, Bull"
Football is violence and cold weather and sex and college rye.,Roger Kahn,"Football, Weather, Sex"
Boxing is a celebration of the lost religion of masculinity all the more trenchant for its being lost.,Joyce Carol Oates,"Religion, Lost, Boxing"
"Pro football is like nuclear warfare. There are no winners, only survivors.",Frank Gifford,"Football, Winners, Only"
"Baseball is almost the only orderly thing in a very unorderly world. If you get three strikes, even the best lawyer in the world can't get you off.",Bill Veeck,"Best, World, Lawyer"
The team has come along slow but fast.,Casey Stengel,"Slow, Fast, Team"
"You don't suffer, kill yourself and take the risks I take just for money. I love bike racing.",Greg LeMond,"Love, Money, Risks"
The game of golf would lose a great deal if croquet mallets and billiard cues were allowed on the putting green.,Ernest Hemingway,"Great, Lose, Green"
It's good sportsmanship to not pick up lost golf balls while they are still rolling.,Mark Twain,"Good, Lost, Golf"
I was always a mean and lean athlete - not tall - not large.,Edwin Moses,"Always, Tall, Lean"
"If a man can beat you, walk him.",Satchel Paige,"Walk, Man, Beat"
"If you are going to throw a club, it is important to throw it ahead of you, down the fairway, so you don't have to waste energy going back to pick it up.",Tommy Bolt,"Energy, Important, Ahead"
Golf is a game in which one endeavors to control a ball with implements ill adapted for the purpose.,Woodrow Wilson,"Game, Control, Purpose"
"As athletes, we're used to reacting quickly. Here, it's 'come, stop, come, stop.' There's a lot of downtime. That's the toughest part of the day.",Michael Jordan,"Day, Stop, Come"
"In football, time and space are the same thing.",Graham Taylor,"Time, Space, Football"
You don't hurt 'em if you don't hit 'em.,Chesty Puller,"Hurt, Hit, You"
The only athletic sport I ever mastered was backgammon.,Douglas William Jerrold,"Only, Ever, Sport"
He hits it long. His shoulders are impressively quick through the ball. That's where he's getting his power from. He's young and has great elasticity.,Nick Faldo,"Power, Great, Long"
Eighteen holes of match play will teach you more about your foe than 18 years of dealing with him across a desk.,Grantland Rice,"Your, Will, Desk"
"If I weren't earning $3 million a year to dunk a basketball, most people on the street would run in the other direction if they saw me coming.",Charles Barkley,"Me, Street, Direction"
"Many baseball fans look upon an umpire as a sort of necessary evil to the luxury of baseball, like the odor that follows an automobile.",Christy Mathewson,"Look, Evil, Fans"
"Baseball is a game where a curve is an optical illusion, a screwball can be a pitch or a person, stealing is legal and you can spit anywhere you like except in the umpire's eye or on the ball.",James Patrick Murray,"Legal, Game, Illusion"
"I had pro offers from the Detroit Lions and Green Bay Packers, who were pretty hard up for linemen in those days. If I had gone into professional football the name Jerry Ford might have been a household word today.",Gerald R. Ford,"Today, Football, Green"
"I'm not buddy-buddy with the players. If they need a buddy, let them buy a dog.",Whitey Herzog,"Dog, Players, Need"
The bell that tolls for all in boxing belongs to a cash register.,Bob Verdi,"Boxing, Bell, Register"
Golf is a day spent in a round of strenuous idleness.,William Wordsworth,"Day, Golf, Round"
"If you got the game, you got the game. That's why Tiger Woods is out there playing golf with Greg Norman.",Shaquille O'Neal,"Game, Tiger, Woods"
I started playing ball when I was a kid. My dad was a pro ball player and he passed on his knowledge to me.,Kurt Russell,"Knowledge, Dad, Me"
I'd just as soon play tennis with the net down.,Robert Frost,"Down, Play, Tennis"
"Watching baseball under the lights is like observing dogs indoors, at a pedigree show. In both instances, the environment is too controlled to suit the species.",Melvin Maddocks,"Watching, Baseball, Environment"
"Thus so wretched is man that he would weary even without any cause for weariness... and so frivolous is he that, though full of a thousand reasons for weariness, the least thing, such as playing billiards or hitting a ball, is sufficient enough to amuse him.",Blaise Pascal,"Man, Enough, Ball"
"He's got an overall flair for the game. It looks to me like he really loves what he does and he can't wait to get up in the morning, go hit some balls and go play.",Gary McCord,"Morning, Game, Wait"
"There isn't a flaw in his golf or his makeup. He will win more majors than Arnold Palmer and me combined. Somebody is going to dust my records. It might as well be Tiger, because he's such a great kid.",Jack Nicklaus,"Great, Win, Me"
I regard golf as an expensive way of playing marbles.,Gilbert K. Chesterton,"Way, Golf, Expensive"
"He's going to be around a long, long time, if his body holds up. That's always a concern with a lot of players because of how much they play. A lot of guys can't handle it. But it looks like he can.",Jack Nicklaus,"Time, Always, Long"
You know they're not going to lose 162 consecutive games.,Harry Caray,"Lose, Know, Games"
What's a good tournament for him? Winning it. He's good enough.,Greg Norman,"Good, Winning, Enough"
Baseball has the great advantage over cricket of being sooner ended.,George Bernard Shaw,"Great, Cricket, Baseball"
"Baseball is a public trust. Players turn over, owners turn over and certain commissioners turn over. But baseball goes on.",Peter Ueberroth,"Trust, Turn, Baseball"
The two most important things in life are good friends and a strong bullpen.,Bob Lemon,"Life, Good, Important"
"Academe, n.: An ancient school where morality and philosophy were taught. Academy, n.: A modern school where football is taught.",Ambrose Bierce,"Football, Morality, School"
"I play in the low 80s. If it's any hotter than that, I won't play.",Joe E. Lewis,"Play, Low, Than"
The integrity of the game is everything.,Peter Ueberroth,"Integrity, Game, Everything"
The crowd makes the ballgame.,Ty Cobb,"Crowd, Makes, Ballgame"
He hits the ball a long way and he knows how to win.,Gary McCord,"Long, Win, Way"
You cannot win if you cannot run.,Hank Stram,"Win, Cannot, Run"
"My family knew, but most of the sporting world did not realize that my right hand been some 75% paralyzed.",Bill Toomey,"Family, World, Right"
"There are two theories on hitting the knuckleball. Unfortunately, neither of them works.",Charley Lau,"Two, Them, Hitting"
I don't know why people question the academic training of an athlete. Fifty percent of the doctors in this country graduated in the bottom half of their classes.,Al McGuire,"Training, Country, Know"
It is almost impossible to remember how tragic a place the world is when one is playing golf.,Robert Wilson Lynd,"Impossible, World, Remember"
Baseball life is a tough life on the family.,Nolan Ryan,"Life, Family, Life Is A"
Overall the fundamentals seem to be there and he's obviously got a very mature head on his shoulders. He's got a kind of presence.,Nick Price,"Mature, Shoulders, Head"
"He's got everything. He' not a great player yet because he hasn't won any major championships, but it's a matter of time. He's an outstanding talent. I didn't realize how tall he is.",Nick Price,"Time, Great, Talent"
Golf is played by twenty million mature American men whose wives think they are out having fun.,Jim Bishop,"Men, Mature, Fun"
Have you ever noticed what golf spells backwards?,Al Boliska,"Golf, Backwards, Ever"
What's unfortunate about buying a pitcher for $12 million is that he carries no warranty.,Bob Verdi,"Pitcher, Unfortunate, Buying"
"When I was 40, my doctor advised me that a man in his 40s shouldn't play tennis. I heeded his advice carefully and could hardly wait until I reached 50 to start again.",Hugo Black,"Man, Doctor, Wait"
Baseball players are smarter than football players. How often do you see a baseball team penalized for too many men on the field?,Jim Bouton,"Men, Football, See"
"Relax? How can anybody relax and play golf? You have to grip the club, don't you?",Ben Hogan,"Relax, Golf, Play"
I was showing early symptoms of becoming a professional baseball man. I was lying to the press.,Roger Kahn,"Man, Professional, Baseball"
"Tennis and golf are best played, not watched.",Roger Kahn,"Best, Golf, Tennis"
Don't sell yourself short because without that you can't go far in life because after sports the only thing you know is sports and you can't do anything else with that.,Bo Jackson,"Life, Yourself, Know"
"I am a sports enthusiast, and if given an opportunity, I want to be a sportsman, even today. I want to promote the sport that is indigenous to India. Kabaddi is a matter of national pride. Why can't cricket, hockey, football and kabaddi be given equal platforms and co-exist? I believe that can happen.",Abhishek Bachchan,"Today, Football, Opportunity"
"I couldn't find the sports car of my dreams, so I built it myself.",Ferdinand Porsche,"Dreams, Car, Myself"
"The thing that all sports have in common is that they have no fantasy elements, which is a little weird.",Jesse Schell,"Weird, Fantasy, Common"
"I don't know if God is a sports fan or not, but I do know this: He loves a good comeback.",Lane Kiffin,"God, Good, Comeback"
"Sports have always been a big part of my life. At school, I played a lot of different sports, and I was competing with other schools. I did everything: running, volleyball, basketball, soccer, Olympic-style gymnastics, and more! My history with sports gave me good concentration, focus, strength, and motivation to stay healthy.",Izabel Goulart,"Life, Good, History"
"I like playing many other sports, such as basketball.",Guan Tianlang,"Basketball, Like, Other"
I wasn't into sports when I was younger. I was one of those kids who always tried to get a note from the doctor to say I had a cold so I didn't have to go play hockey in bad weather and be miserable.,Eliza Doolittle,"Always, Weather, Doctor"
"I was an All-American in wrestling in high school, was National Champion in Chinese kickboxing in 1999 and have spent a lot of time around professional athletes, which includes my eight-plus years as CEO of a sports nutrition company.",Tim Ferriss,"Time, Champion, School"
