title,author,tags
"I think that in any group activity - whether it be business, sports, or family - there has to be leadership or it won't be successful.",John Wooden,"Leadership, Family, Business"
"There isn't quite a feeling you get from playing video games that you get when you're playing sports, which is like a sense of euphoria. You just get the satisfaction of doing something active and feeling good after.",Patrick Chan,"Good, Video Games, Satisfaction"
"When you play sports like tennis, you're alone, and that's a good school for life, but it's also a good school for life to bring your best and make those around you better, too - helping others in difficult moments.",Jurgen Klopp,"Life, Alone, Best"
I hope that my 'Jeopardy' run helps destigmatize sports betting because I have certainly dealt with some stigmas.,James Holzhauer,"Hope, Betting, Dealt"
"The media circus surrounding Sports Direct... only proves that whatever progress Sports Direct makes, it will always be subject to disproportionate scrutiny and misrepresentation.",Mike Ashley,"Always, Progress, Media"
I liked baseball and sports and Garbage Pail Kids and comic books. I know what it's like to really adore something.,Todd Lowe,"Know, Garbage, Baseball"
Sports has given me the opportunity to travel around the world and see new countries and meet so many different people. I've gained new perspectives.,Vitali Klitschko,"Travel, Opportunity, World"
"I definitely want to fight Breazeale. It doesn't need to be PBC; it can be Matchroom and Sky Sports. If he wants to fight, we can fight. It's an easy fight to make. Let's make it.",Dillian Whyte,"Sky, Fight, Easy"
"Ethnic prejudice has no place in sports, and baseball must recognize that truth if it is to maintain stature as a national game.",Branch Rickey,"Truth, Game, Prejudice"
"My uncles and other relatives are against encouraging girls in every aspect, and that includes sports. I hardly interact with them. My parents are more open. They back me all the way.",Saina Nehwal,"Parents, Me, Way"
"When you play sports, when you're on a team with people from different walks of life, and you have to look after each other and count on each other, race and all that stuff goes out the window when you are in the locker room.",Ed Reed,"Life, Window, Look"
"My love for sports will never die. I love martial arts and I want to promote it in whichever way I can. I am a fighter first, then an actor.",Akshay Kumar,"Love, Die, I Am"
I wanted to be a doctor in sports medicine; I was into sailing and all that sort of thing.,Christopher Atkins,"Doctor, Medicine, Sailing"
There are people who love on weekends to go out when the sun comes out. I just want to lie in bed and watch sports and relax.,Juan Pablo Galavis,"Love, Relax, Sun"
"I started my cooking 'career' aged 15, almost 20 years ago. At the time it was quite a shock suddenly working 75 to 80 hours a week, without time to play football or other sports.",Rene Redzepi,"Time, Football, Cooking"
"You can't do sports for the rest of your life; I don't care how good you are. You can be the best ever, but it's still going to go away.",Terry Crews,"Life, Best, Good"
I was into sports and swimming as a kid and didn't spend a whole lot of time sitting down. I was a gymnast.,Mads Mikkelsen,"Time, Swimming, Down"
"When I grew up, my father taught us the value of hard work. He wanted us to enjoy ourselves, but he also wanted to know what it took to be successful. He coached a lot of our sports teams growing up. We weren't very good, but we learned about hard work and enjoying life and your teammates.",Andrew Luck,"Life, Work, Good"
"In high school, despite my involvement on four different sports teams, I threw my duties of being a jock out the window and spent my spare time in wrestling training or on the PS2.",Kenny Omega,"Time, Window, Training"
"After my first 'Sports Illustrated' cover, I felt terrible about myself for a solid month. People deal with models like they are children. They think they can pull one over on you. I'm not a toy; I'm a human. I'm not here to be used.",Kate Upton,"Myself, Children, People"
"Sports have become increasingly more specialized, but that doesn't mean they shouldn't be fun.",Mia Hamm,"Fun, More, Become"
"I had a big brother so I always wanted him to hang out with me, but he wouldn't. So I always did sports and I always really liked it, but I just was never good at it.",Lindsey Morgan,"Good, Always, Me"
"I was a really low-confident kid. I did have friends from playing sports - I played water polo and I swam. But at the heart of it, I was really scared of talking to people, and making friends, and making relationships.",Jonny Kim,"Heart, Water, People"
"As a general rule, Las Vegas sports books take boxing bets only on major fights.The same is true of most Internet gaming sites. Within that framework, not only does boxing allow participants to bet on their own bouts, it sometimes encourages them to do so.",Thomas Hauser,"Internet, True, Own"
"I like both athletic girls and girly girls. It depends on their personality. I like girls who can go out and play sports with me and throw the football around, but you don't want a girl who's too much tougher than you. I like brainy girls who can respond to what I'm saying.",Josh Hutcherson,"Brainy, Personality, Football"
"I've always wanted to buy a sports car. After the England series, I went up to my dad and said that I wanted to buy a sports car and got his consent. On his birthday, I surprised him by bringing it home. It's a Porsche Boxter Limited Edition, and my family was thrilled to see it.",Suresh Raina,"Birthday, Family, Home"
"Sports has always been a pass-through. You pay for something, and then you pass it through to television, you pass it through to advertisers, or you pass it through to season-ticket holders, luxury boxes and then the fans. Then it all adds up, and you take in more than you pass out.",John Madden,"Always, Fans, Luxury"
"Anytime I'm like, 'Ho-hum,' trying to go about my business like anyone else, I'll have a father or someone come up to me and say, 'You know, my daughter never realized she could be in the booth for sports, and now that's what she wants to do.'",Jessica Mendoza,"Business, Me, Father"
"In sports, every day you can be the hero or the goat.",Geoff Stults,"Hero, Day, Every Day"
"Sports fandom transcends gender, race, language, political preference, socioeconomic status, or any other way you can think of slicing this planet.",Mary Pilon,"Political, Language, Way"
"Though I loved books as a young boy, I loved sports even more. I wanted to be a quarterback in the CFL.",David Bergen,"Young, Boy, Loved"
"The things that people do now in sports, you can't even believe. These are complete total athletes. To see what human beings can do in the highest level is amazing.",Billie Joe Armstrong,"Amazing, Believe, People"
I don't care what they say about me when I'm through with sports. I don't want to be known as anything else in life but a great father.,Deion Sanders,"Life, Great, Me"
The farther I go East in the U.S. the more I get recognized because of more sports crazy the East Coast is.,Ryan Leaf,"Crazy, Go, More"
"I'm not a huge fan of improv theater or improv sports or whatever, because it still just looks like a tool. It looks like a technique to me.",John Michael Higgins,"Me, Whatever, Looks"
"One of the most basic factors in sports is that winning becomes a habit, and losing is the same way. When failure starts to feel normal in your life or your work or even your darkest vices, you won't have to go looking for trouble, because trouble will find you. Count on it.",Hunter S. Thompson,"Life, Work, Failure"
I'm really into extreme sports and just having fun.,Kellan Lutz,"Fun, Having Fun, Extreme Sports"
I am much more wired to be an athlete than anything else. I understand the 'hard work = payoff' equation in sports. I run marathons and I box. And that's my Puerto Rican flag hanging in Freddie Roach's Wild Card Boxing gym. I gave it to him. My last N.Y.C. marathon time I ran in three hours flat.,Kirk Acevedo,"Work, Time, Hard Work"
"I was all-state in four sports in New Jersey, but sometimes I couldn't get served at a restaurant two blocks from my high school. There were no job opportunities then... the only thing a black youth could aspire to be was a bellboy or a pullman or an elevator operator, or, maybe, a teacher. There was a time when all we had was black baseball.",Monte Irvin,"Time, Teacher, Youth"
"If your man is a sports enthusiast, you may have to resign yourself to his spouting off in a monotone on a prize fight, football game or pennant race.",Marilyn Monroe,"Football, Man, Your"
"I would love to fall in love and get married and have beautiful children. I mean that's one of the goals in life, I think, to have, and it's a beautiful thing. My sister has kids and all my friends have kids. They show me their, you know their report cards. And I can show them my sports car.",Tiesto,"Life, Love, Car"
"Through the years I have received my share of recognition for efforts in the fields of sports, the arts, the struggle for full citizenship for the Negro people, labor's rights and the fight for peace.",Paul Robeson,"Peace, Struggle, Fight"
There's something about beautiful moments in sports that alters our experience of time. And I'd say the same thing about poetry and gardening. Gardening slows me down. I want to stop and observe everything.,Ross Gay,"Experience, Time, Gardening"
"My older brother, he did everything. He played baseball, he played basketball. Just being able to watch him as a youngster, wanting to be like him, wanting to play on the team with him and watching those older guys in my neighborhood play sports.",Ed Reed,"Everything, Watching, Brother"
Sports is human life in microcosm.,Howard Cosell,"Life, Human Life, Human"
"In sports, I was representing my country, but in politics I represent people directly. I have always lived with a cause. In army, it was the existence of the sanctity of nation and the men I was commanding, and in sports, it was the pride of my country, while in politics, it is the rights of citizens I am fighting for.",Rajyavardhan Singh Rathore,"Politics, Men, Always"
"I'm a golfer, and what are the two sports you can do till you drop? Golf and surfing. They're great for you limber-wise, they're great for you health-wise, and they put you in sweet locations.",Matthew McConaughey,"Great, Sweet, Golf"
"There's a lot of kids that don't even have a chance to live a balanced lifestyle. Not have to worry about food or clothes or education, or being able to play sports.",P.K. Subban,"Education, Food, Chance"
"Some anthems are great for sports. You've got the Russian national anthem... 'O Canada,' how wonderful is that for hockey... but I chose the Italian national song because at my first World Cup, I saw the Italians play four times, and they won all four times - they won the championship.",George Vecsey,"Great, World, Hockey"
I'm nothing more than a sports slave.,Dennis Rodman,"Nothing, Slave, More"
"I started off dancing and playing sports, and I joined the drama stuff, the theatre stuff in middle school because my friends were involved, and it was kind of the cool thing to do.",Kara Lindsay,"Cool, School, Drama"
"My father was an athlete, a great athlete, fought in the Marines in World War I. He was all sports and activity. My mother was all academics. I still have the complete works of Shakespeare that she had.",Marv Levy,"War, Great, World"
"I hated having my hair down because it got into my face when I was playing sports. My mom would always put my hair down and make it all pretty, and by the time I got to school, I would have it up in a ponytail.",Bayley,"Time, Mom, Always"
"About 1998, when 'Wide World of Sports' and the 'Footy Show' came to an end for me, I couldn't type. When I started architecture, it was a very aesthetic, creative, an almost art process, where lettering and thick line were how you expressed yourself on the paper.",Max Walker,"Art, Architecture, Yourself"
"I'll go out, but I leave early, before the shenanigans. I don't really do the Hollywood party thing. I'd rather watch sports or play videogames or work out or sleep, to be totally honest.",Cory Monteith,"Work, Sleep, Go"
I loved my time in Deep South Wrestling. We trained so hard and I got a crash course into the world of sports entertainment and pro wrestling.,Tyrus,"Time, World, Entertainment"
I want to model and I want to do whatever it takes to be a 'Sports Illustrated' swimsuit model.,Camille Kostek,"Whatever, Swimsuit, Want"
"I think I have always been a hard worker in school and in sports and everything. Growing up, my parents encouraged me to do that from day one.",Daya,"Always, Day, Parents"
"The addiction to sports, therefore, in a peculiar degree marks an arrested development in man's moral nature.",Thorstein Veblen,"Nature, Man, Degree"
"I got into sports broadcasting because I loved sports, not because I loved TV.",Samantha Ponder,"Loved, Broadcasting, Because"
"In sports, people reach their peak very early. You have to move on. I don't know if I will ever surpass what I did at the Olympics, but I'm still doing the work I always wanted to do.",Greg Louganis,"Work, Always, Doing"
It's not like I'm going to go out and change the world and convert everyone into MMA fans. There's going to be fans out there who are fans of combat sports and fans of contact sports but not everybody's going to be converted.,Dana White,"Change, World, Change The World"
I think every school in the world should have a sports program.,Abhishek Bachchan,"World, School, Think"
India has a population of over 1 billion people. There is place for all sports and for sure there is space for football.,Zico,"Space, Football, People"
"I would never tell anybody to give up hockey - the great sports we have here - basketball, lacrosse - rugby coming into its own - we've got so many great team sports, and I say hold on to them.",George Vecsey,"Great, Hockey, Own"
How does one control weight? By not overeating. How does one stay in shape? One plays sports. There are no magic pills here.,Vladimir Putin,"Control, Magic, Stay"
"Our philosophy is you need to give nonprofit money for health, nutrition, education, culture, and sports.",Carlos Slim,"Education, Health, Money"
Broadway shows in New York draw two times the attendance of all New York sports teams put together.,John Lahr,"Together, New, Attendance"
"The thing about ballet that I never knew about is that it's one of the most excruciating sports that I've ever been a part of. I say sports because they train constantly, every single day.",Mila Kunis,"Day, Never, Train"
"What's been missing from regions outside of Silicon Valley is a 'playbook.' In American football, a playbook contains a sports team's strategies and plays. It struck me that every region needs its own industry playbook on how to compete globally.",Steve Blank,"Football, Me, Own"
The power of a sports team in a community it's almost indescribable.,Wendell Pierce,"Power, Community, Team"
"I always had this curiosity about acting, but I was really into sports, and I never really thought about acting as a career. My senior year, I tried out for the high school production of 'The Wizard of Oz,' and that was it for me.",John DeLuca,"Always, Curiosity, Me"
My love of running developed when I got older. At school it filled me with dread and the idea of running around the sports pitches struck me with a nameless fear.,Freddie Fox,"Love, Fear, Me"
"The best thing about the Kentucky Derby is that it is only two minutes long. It is the quickest event in sports, except for Sumo-wrestling & Mike Tyson fights. Maybe Drag-racing is quicker, but I have never been attracted to it.",Hunter S. Thompson,"Best, Long, Never"
"Well, I'm not a big sports fan.",Jeff Bridges,"Well, Big, Fan"
"From my early days of playing 2:2 in basketball against my three older brothers to my years playing Division 1 college basketball and lacrosse, sports have played a big role in my leadership development.",Cathy Engelbert,"Leadership, Development, Three"
My dad is not a sports guy but was drawn to the theatrics of wrestling.,John Cena,"Dad, Guy, Wrestling"
"When 'Sports Illustrated' came out with their 50 most fashionable people in sport, that fact that I wasn't on that list is a travesty.",Stan Van Gundy,"People, Most, Out"
"We knew it was going to be the biggest event scheduled in the history of women's sports, but we didn't ever fathom we would be playing before sold-out stadiums all over the country.",Lorrie Fair,"Women, History, Country"
"This is sports. In sports, you win and you lose. That's the nature of sports. You can't get away from that part of it. And if you get too hung up on the losing part, then you miss the boat. The competition part, a game like that, is why you play sports. That is as good as it gets.",David Robinson,"Nature, Good, Competition"
I don't think there are many larger lessons to be found in sports.,Gregg Easterbrook,"Think, Lessons, Found"
"In recent generations, women's sports have been a blessing. Some of us can remember the bad old days in the '50s, when we would discover in casual schoolyard play that a girl could outrun most of us or hold her own in basketball or hit a softball - but there were no teams, no coaches, for girls.",George Vecsey,"Women, Remember, Blessing"
"I try not to make a habit of spending the whole year losing in the first rounds of events, but tennis is one of those sports where nothing is guaranteed.",John Isner,"Nothing, Try, Losing"
"The sports space is so full of opinion that you aren't hearing from the athletes just speaking for themselves. We are such a Twitter-oriented society with radio talk shows, TV talk shows and social media - what you are missing is the authentic, unfiltered aspect of who these people are.",Hannah Storm,"Society, Space, Social Media"
"The Women's Sports Foundation holds a unique position in developing opportunities for girls and women of all abilities to be active whether recreationally or competitively, and I'm excited to help lead the organization to impact even more lives. It is an honor to continue to build the legacy created by Billie Jean King and all of our leaders.",Angela Ruggiero,"Women, Legacy, King"
"Our team, in general, is in a position where people look up to us, and kids look up to us. I embrace that, and I think I have a huge LGBT following. I think it's pretty cool, the opportunity that I have, especially in sports. There's really not that many out athletes. It's important to be out and to live my life that way.",Megan Rapinoe,"Life, Cool, Opportunity"
"I'll always be into sports. Sports is part of my life forever. My TV stays on ESPN all day long, I'm one of those. I don't even listen to music in the car; all I listen to is sports talk.",Action Bronson,"Life, Music, Car"
Growing up in the time of Title IX - it was passed when I was 10 - I got a front-row seat to so many great moments in women's sports. Of course I didn't know it at the time.,Jackie Joyner-Kersee,"Women, Time, Great"
I love sports. So if I was like a sports anchor or something like that. I would love to do that.,Jana Kramer,"Love, Anchor, Something"
"My symbol was always a polo player because I liked sports, and polo has a stylishness to it.",Ralph Lauren,"Always, Polo, Because"
"When I'm thinking of sports, when I'm thinking of a boy growing up and being a man, I'm thinking of three things - honor, integrity, and toughness.",Ben Askren,"Man, Integrity, Honor"
"Anything can happen. That's why sports are so great, the unexpected.",Cody Bellinger,"Great, Unexpected, Why"
"A supermodel needed to be able to be on 'Sports Illustrated,' to be able to walk runways, to be able to do beauty ads, to be on covers. And the girls now can no longer be on covers and be in the ads because your actresses have taken over all the jobs. I don't know what happened, but we want our jobs back.",Kim Alexis,"Beauty, Walk, Your"
"Buying sports cars, going to expensive nightclubs, spraying people with champagne and things like that - what I learnt is that it wasn't for me, and, in fact, I feel pretty empty after doing that.",Daniel Ek,"Me, Doing, Feel"
The Odisha government is supporting the sports circuit very well. Athletes are getting jobs in the government sector and they are providing facilities for all athletes to perform as well.,Dutee Chand,"Government, Well, Facilities"
"Most people think the character I do onstage is the way I am offstage, but I'm just a regular guy who spends time with his family and who turns on the television and watches a lot of sports.",Don Rickles,"Family, Time, Character"
"I think what endurance sports teach you is to stay dedicated, stay focused, and also to understand you're going to have ups and downs, but you need to keep running right through them.",Kyrsten Sinema,"Ups And Downs, Endurance, Keep"
"I grew up in Baltimore. And yes, I am a big sports fan, especially when it comes to my local teams.",Josh Charles,"I Am, Big, Fan"
Let's face it. There is no setup in Pakistan to train and groom young players at the grassroots level in different sports. Those of us who did make a name for ourselves and became champions did it with our own initiative - there was no academy to back us till we reached a certain level on our own.,Jahangir Khan,"Face, Name, Own"
"I love eating it - grilled chicken, pasta, rice, and other foods that give me long term energy. Every once in a while, my sweet tooth gets the best of me and I have to snack on some candy. Beverage wise, I stick to sports drinks, water, milk, and juice.",Derrick Rose,"Love, Best, Wise"
"I'm apparently attracted to things that are on the edge of what America really wants to watch: 'Six Feet Under,' 'Sports Night,' 'Dirty Sexy Money,' and 'Parenthood' were always struggling in the ratings. It was kind of heartbreaking not knowing if we get to come back every season.",Peter Krause,"Money, Always, Sexy"
"I like action-based sports, and kabbadi is my favourite. I wanted to be associated with a sport on which I really believe in, and so I bought a team in World Kabbadi League, and Toronto will host my team.",Yo Yo Honey Singh,"Believe, World, Will"
"I am not only an athlete and sports entertainer, but also have a huge passion for fitness, beauty and fashion, so I am open to many different types of brands. When it comes to brands approaching me, I just need them to be very specific, to the point of what they want and need from me.",Mandy Rose,"Beauty, Fitness, Passion"
March Madness is an incredible three weeks. I firmly believe it's the greatest three weeks in sports. You have the Super Bowl; you have the World Series.,Dick Vitale,"Believe, World, March"
"Your dream, when you buy a sports franchise, is to win the championship, the Super Bowl.",Paul Allen,"Your, Win, Dream"
"I just loved going fast. I still enjoy go-karting. I was also good at rugby, and my dad wanted me to be a sportsman, but I never thought I could do sports professionally.",Alfie Allen,"Good, Dad, Me"
Sports fans have been mistreated for a long time. They have overpaid for inferior food and they have had poor service.,Dave Checketts,"Time, Food, Long"
"In terms of merit, sports has mathematical statistics. That's how you know who the best player is.",Norm MacDonald,"Best, Know, Statistics"
"I grew up being into sports and I wasn't trained to move my body in the right way for dancing. I'm the last one to get any moves correct. In rehearsals it's always, 'OK, one more take for Zac.'",Zac Efron,"Always, Body, Way"
"If I had a personal wish for the new ideas in this new book it would be that every parent, every counselor, every teacher, every professor, every sports coach that deals with young people would understand the three circle concept.",James Collins,"Teacher, Circle, New"
"We in the NFL unquestionably are in sports and competition, but we're also in entertainment, and that's the entertainment capital of the world. It just bowls you over when you see the opportunity in L.A.",Jerry Jones,"Opportunity, Competition, World"
Swimming is one of the hardest sports.,Stephanie Rice,"Swimming, Hardest"
The plays and sports of children are as salutary to them as labor and work are to grown persons.,Samuel Richardson,"Work, Children, Labor"
"I've been looking at companies that are on a positive path vs. a negative path and I've come to use the language of sports, winning streaks and losing streaks.",Rosabeth Moss Kanter,"Positive, Path, Winning"
"I'm a writer. I'm moonlighting on television. I never made any pretensions to that. As much as I like being on 'Real Sports,' I have been a writer since I was a little boy, and that's still my first love.",Frank Deford,"Love, Never, Real"
Maybe a day will come when we may have to just put on a pair of glasses and see sports events.,Kapil Dev,"Day, Will, Glasses"
Sports are one of the main cultural activities on the face of the earth.,Jack Kent Cooke,"Face, Earth, Activities"
"The BBC sports department when I was there was seriously to the right of Ghengis Khan, and if people think I am strange, they should have met some of the production staff I worked with. Margaret Thatcher and the Queen were the pin up girls for many of them.",David Icke,"Queen, I Am, People"
"Good spectator sports share certain fundamentals. Their competitors battle head-to-head. Their winners are determined objectively: fastest runner, most points. They are refereed, not judged.",Alex Berenson,"Good, Battle, Winners"
Good sports facilities are a blessing.,Kapil Dev,"Good, Blessing, Facilities"
