title,author,tags
By means of microscopic observation and astronomical projection the lotus flower can become the foundation for an entire theory of the universe and an agent whereby we may perceive Truth.,Yukio Mishima,"Flower, Universe, Foundation"
"A day spent without the sight or sound of beauty, the contemplation of mystery, or the search of truth or perfection is a poverty-stricken day; and a succession of such days is fatal to human life.",Lewis Mumford,"Life, Beauty, Perfection"
"What I claim is to live to the full the contradiction of my time, which may well make sarcasm the condition of truth.",Roland Barthes,"Time, Sarcasm, Live"
"When you are joyous, look deep into your heart and you shall find it is only that which has given you sorrow that is giving you joy. When you are sorrowful look again in your heart, and you shall see that in truth you are weeping for that which has been your delight.",Khalil Gibran,"Sad, Heart, Your"
"Even in literature and art, no man who bothers about originality will ever be original: whereas if you simply try to tell the truth (without caring twopence how often it has been told before) you will, nine times out of ten, become original without ever having noticed it.",C. S. Lewis,"Art, Man, Caring"
Humor is the truth; wit is an exaggeration of the truth.,Stan Laurel,"Humor, Wit, Exaggeration"
To get rich never risk your health. For it is the truth that health is the wealth of wealth.,Richard Baker,"Health, Your, Rich"
Stop holding your truth; speak your truth. Be yourself. It's the healthiest way to be.,Tiffany Haddish,"Your, Yourself, Be Yourself"
"Truth is absolute, truth is supreme, truth is never disposable in national political life.",John Howard,"Life, Political, Never"
"Above all, I would teach him to tell the truth Truth-telling, I have found, is the key to responsible citizenship. The thousands of criminals I have seen in 40 years of law enforcement have had one thing in common: Every single one was a liar.",J. Edgar Hoover,"Liar, Law, Citizenship"
"I feel truth, beauty, love, grief, anger, intimacy & alive in my body... Women in the global south live in their bodies much more than we in the global north. Not as distracted by patriarchy's controlling images - They know power is in their bodies. I am deeply grateful for the women who showed me the way home.",Jodie Evans,"Love, Beauty, Women"
"Dispassionate objectivity is itself a passion, for the real and for the truth.",Abraham Maslow,"Passion, Real, Objectivity"
He who knows nothing is closer to the truth than he whose mind is filled with falsehoods and errors.,Thomas Jefferson,"Knowledge, Mind, Nothing"
"My plays are for the kind of black people who relate to funk music, to Parliament-Funkadelic. When those guys get out of a spaceship - the idea that black people are from outer space, there's a poetic truth to that. We are this vast people.",Suzan-Lori Parks,"Space, Music, Black"
"The truth is often a terrible weapon of aggression. It is possible to lie, and even to murder, with the truth.",Alfred Adler,"Lie, Possible, Aggression"
"What is man's ultimate direction in life? It is to look for love, truth, virtue, and beauty.",Shinichi Suzuki,"Life, Love, Wisdom"
"As scarce as truth is, the supply has always been in excess of the demand.",Josh Billings,"Always, Truth Is, Excess"
"Just because someone said painting is dead doesn't mean that it's a fact or the truth - painting is the soul food of art, in a way.",Amy Sherald,"Art, Food, Soul"
"Truth of the matter is, jazz is American music. And that doesn't mean bebop. Jazz is really about improvising. All the music that's been created in America has been pretty much improvised... Whether it's hillbilly or rock n' roll for blues, it's basically jazz music... It's basically about another way of hearing what comes out of America.",Jaimoe,"Music, Matter, Way"
You don't have to sort of enhance reality. There is nothing stranger than truth.,Annie Leibovitz,"Reality, Stranger, Nothing"
There is not a truth existing which I fear... or would wish unknown to the whole world.,Thomas Jefferson,"Fear, World, Wish"
"Faith is a dynamic and ever-changing process, not some fixed body of truth that exists outside our world and our understanding. God's truth may be fixed and unchanging, but our comprehension of that truth will always be partial and flawed at best.",Gene Robinson,"Faith, Best, God"
"I believe in God, family, truth between people, the power of love.",Michael Landon,"Love, God, Family"
"Be calm in arguing; for fierceness makes error a fault, and truth discourtesy.",George Herbert,"Anger, Calm, Fault"
"'Eureka' moments are very, very rare in my experience. It normally takes several weeks of experiments to tease out the truth, even when you have a really pretty good idea of what is going on.",Tim Hunt,"Good, Experience, Rare"
"If there is one thing I fear less than everything else, it is, I believe, persecution for my opinions. There are a good many points about which I may be diffident, but when it comes to questions of Truth and intellectual independence, there is no holding me - I can envisage no finer end than to sacrifice oneself for a conviction.",Pierre Teilhard de Chardin,"Good, Fear, Independence"
Humanity appreciates truth about as much as a squirrel appreciates silver.,Vernon Howard,"Humanity, Squirrel, Silver"
"Every single immigrant we have, undocumented or documented, is a future American. That's just the truth of it.",Junot Diaz,"Future, American, Immigrant"
"When you tell your truth, you are coming from a real place, so you are automatically a leader.",Mary J. Blige,"Your, Real, Place"
"We all have a social mask, right? We put it on, we go out, put our best foot forward, our best image. But behind that social mask is a personal truth, what we really, really believe about who we are and what we're capable of.",Phil McGraw,"Best, Believe, Mask"
"Marriage, if one will face the truth, is an evil, but a necessary evil.",Menander,"Marriage, Face, Will"
"My style is in the 21st century. If you look at the process, it goes from photography through Photoshop, where certain features are heightened, elements of the photo are diminished. There is no sense of truth when you're looking at the painting or the photo or that moment when the photo was first taken.",Kehinde Wiley,"Moment, No Sense, Look"
"Only fools argue whether to eat meat or not. They don't understand truth, nor do they meditate on it. Who can define what is meat and what is plant? Who knows where the sin lies, being a vegetarian or a non-vegetarian?",Guru Nanak,"Plant, Sin, Understand"
"If you're on the fence about speaking your truth or sharing your world with a greater audience, don't be. We need each other badly.",Kerby Jean-Raymond,"Your, World, Fence"
"There are two ways of lying. One, not telling the truth and the other, making up statistics.",Josefina Vazquez Mota,"Statistics, Telling The Truth, Two"
"There's a gap somehow between empathy and activism. Rev. Dr. Martin Luther King, Jr. spoke of 'soul force' - something that emanates from a deep truth inside of us and empowers us to act. Once you identify your inner genius, you will be able to take action, whether it's writing a check or digging a well.",Sue Monk Kidd,"Your, Soul, King"
"The truth is that since childhood I had cultivated an existential independence. It came from perceiving the adults around me as unreliable, and without it I felt I wouldn't have survived. I cared deeply for everyone in my family, but in the end I depended on myself.",Sonia Sotomayor,"Family, Independence, Myself"
"I have very little fashion sense, and to tell you the truth, I give it very little thought. I dress to be as comfortable as I possibly can. Most of my clothing is either black, grey, or dark blue, and I don't really wear a lot of colours. But I do like jackets. I have a little bit of an obsession with them.",Leonardo DiCaprio,"Dress, Blue, Black"
"You shouldn't get too close to the truth, because then maybe you stop being funny.",Bob Newhart,"Funny, Stop, Being Funny"
"Here we have the Schengen agreement, and the truth is that for years we trusted each other and set border controls on the outer borders of the European Union. And as was the case with the economic and monetary union, with this step, regarding the management of the Schengen area, we did not go all the way in terms of political solutions.",Angela Merkel,"Political, Step, Management"
"It is by doubting that we come to investigate, and by investigating that we recognize the truth.",Peter Abelard,"Come, Investigate, Investigating"
"The one thing I was always told is you absolutely have to tell truth to power. Whether you're a second lieutenant working with a captain and a lieutenant colonel, or a four-star general working with the Office Secretary of Defense and the White House, the decision makers have got to have ground truth.",John F. Kelly,"Power, Always, Decision"
"In the end, I still have the same hope as my father - that unarmed truth and unconditional love will have the last word.",Bernice King,"Love, Hope, Father"
"A writer should have this little voice inside of you saying, Tell the truth. Reveal a few secrets here.",Quentin Tarantino,"Voice, Secrets, Tell"
Truth emerges more readily from error than from confusion.,Francis Bacon,"Confusion, More, Error"
"And you know, whether it's drama or comedy, the best work is based on truth. It's just that, with comedy, the circumstances are just crazy-heightened, and you have these crazy things thrown at you. But you still have to do it truthfully, because that's where the humor comes from. So it's not that difficult to cross over.",Tony Hale,"Work, Best, Humor"
Fiction is the truth inside the lie.,Stephen King,"Lie, Inside, Fiction"
You never find yourself until you face the truth.,Pearl Bailey,"Yourself, Face, Find"
"Bad religion is arrogant, self-righteous, dogmatic and intolerant. And so is bad science. But unlike religious fundamentalists, scientific fundamentalists do not realize that their opinions are based on faith. They think they know the truth.",Rupert Sheldrake,"Science, Faith, Religion"
"We live in a material world, not a dramatic one. And truth resides not in melodrama, but in the precise measure of material things.",Richard Flanagan,"World, Measure, Material Things"
"If truth is beauty, how come no one has their hair done in the library?",Lily Tomlin,"Funny, Beauty, Done"
There are only two ways of telling the complete truth - anonymously and posthumously.,Thomas Sowell,"Only, Two, Complete"
Jean-Luc Godard said that cinema is the truth 24 frames a second. I think cinema is lies 24 frames a second.,Stanley Donen,"Cinema, Think, Second"
"I sometimes wish I had been educated a Catholic, in order to unite the poetry of religion with its higher principles. Are they necessarily inseparable? Is man really so much of a philosopher, that he can conceive of truth in its abstract purity, and divest life and the affections of all the aids of the imagination?",James Fenimore Cooper,"Life, Religion, Poetry"
I've been called a recluse. There's definitely truth in that. I like to spend time alone.,Kendrick Lamar,"Alone, Time, Like"
"What I respect about my dad is he comes forth, and he tells the truth, and he's a very honorable person. I respect him a lot. He, I know deep down, has a good heart.",Brooke Hogan,"Good, Respect, Dad"
"I know that some people shy away from what I say. They think it is too blunt, but when you don't give people that, they feel like you are being fake and you're not telling the truth. So it's like, you want me to tell the truth, but when I do, it's too much for you.",Missy Elliott,"Me, Know, Feel"
The truth does not need to be defended.,Elisabeth Kubler-Ross,"Need, Does, Defended"
"In assisting his 'neighbour' every day to the best of his ability, and keeping truth, honesty, and kindness perpetually before him, the Boy Scout, with as little formality as possible, is pleasing God.",Robert Baden-Powell,"Best, God, Kindness"
Truth that is not undergirded by love makes the truth obnoxious and the possessor of it repulsive.,Ravi Zacharias,"Love, Makes, Obnoxious"
"Everyone wishes to have truth on his side, but not everyone wishes to be on the side of truth.",Richard Whately,"Everyone, Side, Wishes"
"I think that no woman has to defend her body, and she should just live her truth. It should never be about the number size of her pants, and it should be about what you're doing in the world. What does her brain look like and not her hip size.",Ashley Graham,"Brain, World, Body"
"Facts are facts, and fiction is fiction, and a lie doesn't become truth just because it appears on the front page of the newspaper.",Scott Pruitt,"Lie, Facts, Newspaper"
Sometimes people make it seem like you have to have certain prerequisites or a crazy life story in order to be successful in this world. But the truth is you really don't.,Stephen Curry,"Life, World, Crazy"
Poetry lies its way to the truth.,John Ciardi,"Poetry, Way, Lies"
"Science never gives up searching for truth, since it never claims to have achieved it. It is civilizing because it puts truth ahead of all else, including personal interests.",John Polanyi,"Science, Ahead, Never"
"If you want to be thought a liar, always tell the truth.",Logan Pearsall Smith,"Funny, Always, Liar"
"And, after all, what is a lie? 'Tis but the truth in a masquerade.",Alexander Pope,"Lie, After, Masquerade"
"I think dad would be very proud of young people standing up to promote truth, justice and equality.",Martin Luther King III,"Equality, Dad, Justice"
I think the truth is black-and-white.,Nancy Grace,"Truth Is, Think, I Think"
"When you want to fool the world, tell the truth.",Otto von Bismarck,"Fool, World, Tell"
"I have always felt that the truth is prophetic, and that if you describe precisely what you see and give it life with your imagination, then what you write ought to have lasting value, no matter what the mood of your prose.",Paul Theroux,"Life, Imagination, Always"
Read nature; nature is a friend to truth.,Edward Young,"Nature, Friend, Read"
The bud of victory is always in the truth.,Benjamin Harrison,"Always, Victory, Bud"
"A Lawyer will do anything to win a case, sometimes he will even tell the truth.",Patrick Murray,"Lawyer, Win, Will"
The truth is that men are tired of liberty.,Benito Mussolini,"Men, Tired, Liberty"
"It's in the history books, the Holocaust. It's just a phrase. And the truth is it happened yesterday. It happened to my mother. I never met my grandmothers or my grandfathers. They were all wiped up in the gas chambers of Nazi Germany.",Gene Simmons,"History, Yesterday, Mother"
"We must never be afraid to go too far, for truth lies beyond.",Marcel Proust,"Never, Go, Beyond"
"To tell the truth, I'd join a band with John Lennon any day, but I couldn't join a band with Paul McCartney, but it's nothing personal. It's just from a musical point of view.",George Harrison,"Day, View, Nothing"
"Sustainability makes good business sense, and we're all on the same team at the end of the day. That's the truth about the human condition.",Paul Polman,"Good, Business, Day"
"What do you mean by faith? Is faith enough for Man? Should he be satisfied with faith alone? Is there no way of finding out the truth? Is the attitude of faith, of believing in something for which there can be no more than philosophic proof, the true mark of a Christian?",Clifford D. Simak,"Attitude, Faith, Alone"
"While the family is under attack throughout the world, The Church of Jesus Christ of Latter-day Saints proclaims, promotes, and protects the truth that the family is central to the Creator's plan for the eternal destiny of His children.",Russell M. Nelson,"Family, Destiny, World"
"This nation was conceived in liberty and dedicated to the principle - among others - that honest men may honestly disagree; that if they all say what they think, a majority of the people will be able to distinguish truth from error.",Elmer Davis,"Men, Will, People"
A documentary film-maker can't help but use poetry to tell the story. I bring truth to my fiction. These things go hand in hand.,Chloe Zhao,"Poetry, Story, Help"
"Light is meaningful only in relation to darkness, and truth presupposes error. It is these mingled opposites which people our life, which make it pungent, intoxicating. We only exist in terms of this conflict, in the zone where black and white clash.",Louis Aragon,"Life, Light, Darkness"
Truth cannot be defeated.,Edwin Louis Cole,"Cannot, Defeated"
"The lowest form of popular culture - lack of information, misinformation, disinformation and a contempt for the truth or the reality of most people's lives - has overrun real journalism.",Carl Bernstein,"Culture, Journalism, Reality"
I was born in Hoboken. I am an American. Photography is my passion. The search for Truth my obsession.,Alfred Stieglitz,"Passion, I Am, Search"
"By and large, language is a tool for concealing the truth.",George Carlin,"Communication, Language, Large"
"Knowing so many people like myself who are singers and in traveling bands, the people you're in a relationship with feel slighted because they feel you're giving all your energy to your fans, and there's a lot of truth to that.",Kid Rock,"Relationship, Myself, Your"
We have to live today by what truth we can get today and be ready tomorrow to call it falsehood.,William James,"Today, Tomorrow, Live"
"When you hear 'Truth of Touch,' I believe you recognize that it is me; however it's not the typical Yanni album.",Yanni,"Believe, Me, I Believe"
"The calling of art is to extract us from our daily reality, to bring us to a hidden truth that's difficult to access - to a level that's not material but spiritual.",Abbas Kiarostami,"Art, Daily, Reality"
"Admitting the truth would have meant exposing us all. We spent our first decade in the country learning the ways of the new land and trying to fit in. Having a slave did not fit. Having a slave gave me grave doubts about what kind of people we were, what kind of place we came from.",Alex Tizon,"Learning, Me, Country"
Truth is the glue that holds government together.,Gerald R. Ford,"Government, Together, Truth Is"
"Like all dreamers, I mistook disenchantment for truth.",Jean-Paul Sartre,"Dreams, Dreamers, Like"
"Comedy is funny when it comes from truth, and that's always the rule of them. It's about how far you can push that boundary.",Ari Graynor,"Funny, Always, Push"
"Justice is rather the activity of truth, than a virtue in itself. Truth tells us what is due to others, and justice renders that due. Injustice is acting a lie.",Horace Walpole,"Justice, Lie, Injustice"
The pillars of truth and the pillars of freedom - they are the pillars of society.,Henrik Ibsen,"Freedom, Society, Pillars"
"Any fool knows that bravado is always a cover-up for insecurity. That's the truth. And on that note, I'll say goodnight. God love you.",Bobby Darin,"Love, God, Always"
"Educated guesswork' is what science is. You form hypotheses, test them against the evidence, and if they fit the evidence, you can assume you've got close to the truth.",Alice Roberts,"Science, Test, Educated"
"I love historical fiction because there's a literal truth, and there's an emotional truth, and what the fiction writer tries to create is that emotional truth.",Jewell Parker Rhodes,"Love, Historical, Create"
"It's easy to fall into victim mode and feel like the world is against you. The truth is, people aren't against you: they're just for themselves. The only thing within your control is how you react and respond to the chaotic dance of life.",Kerli,"Life, Your, World"
"I've led a school whose faculty and students examine and discuss and debate every aspect of our law and legal system. And what I've learned most is that no one has a monopoly on truth or wisdom. I've learned that we make progress by listening to each other, across every apparent political or ideological divide.",Elena Kagan,"Wisdom, Legal, Progress"
I think all good reporting is the same thing - the best attainable version of the truth.,Carl Bernstein,"Best, Good, Same Thing"
"Our society finds truth too strong a medicine to digest undiluted. In its purest form, truth is not a polite tap on the shoulder. It is a howling reproach.",Ted Koppel,"Society, Medicine, Shoulder"
A lie can be halfway round the world before the truth has got its boots on.,James Callaghan,"World, Lie, Boots"
Here is the surprising truth: It's often easier to make something 10 times better than it is to make it 10 percent better.,Astro Teller,"Better, Make, Something"
"Most people don't care if you're telling them the truth or if you're telling them a lie, as long as they're entertained by it.",Tom Waits,"Long, Lie, Care"
"You can't legislate into existence an act of forgiveness and a true confession; those are mysteries of the human heart, and they occur between one individual and another individual, not a panel of judges sitting asking questions, trying to test your truth.",Athol Fugard,"Forgiveness, Heart, Your"
"That which is false troubles the heart, but truth brings joyous tranquillity.",Rumi,"Heart, False, Troubles"
"I felt like all of the American people did not believe me because of the things that were said about me, and said that people would say that it was just for the money, and it wasn't about the money. It was about what he did to me. And I knew I was telling the truth.",Paula Jones,"Money, Believe, Me"
"In every truth, the beneficiaries of a system cannot be expected to destroy it.",A. Philip Randolph,"Cannot, Destroy, System"
"The truth is that intelligence, knowledge, and domain expertise are vastly overrated as the driving forces behind competitive advantage and sustainable success.",Patrick Lencioni,"Success, Knowledge, Intelligence"
"The stars of eternal truth and right have always shone in the firmament of human understanding. The process of bringing them down to earth, remolding them into practical forms, imbuing them with vitality, and then making use of them, has been a long one.",Bertha von Suttner,"Always, Stars, Long"
With a fascist the problem is never how best to present the truth to the public but how best to use the news to deceive the public into giving the fascist and his group more money or more power.,Henry A. Wallace,"Best, Power, Money"
Love is the only reality and it is not a mere sentiment. It is the ultimate truth that lies at the heart of creation.,Rabindranath Tagore,"Love, Love Is, Heart"
"Love is what makes the world go around. I know it's a big cliche to use, but it is the absolute truth. There is nothing else like it. I know that is what everybody is striving to feel: in relationships, in brother- and sisterhood, and in all of the things that we aspire to have in our lives.",Gladys Knight,"Love, Love Is, World"
You need to use data science and machine learning to get the ground truth of what's happening inside of a company.,Chamath Palihapitiya,"Science, Learning, Ground"
Respect for the truth comes close to being the basis for all morality.,Frank Herbert,"Respect, Morality, Being"
"I do have my own personal convictions and values, and I live by those. But as an artist, as a portrait photographer, my job is to tell the truth and to capture someone's spirit on a certain day. And it's never the whole truth; it's the truth I experience in a very intense and intimate fashion.",Platon,"Experience, Day, Own"
We must never forget that higher knowledge has to do with revering truth and insight and not with revering people.,Rudolf Steiner,"Knowledge, Never Forget, People"
"Argument is meant to reveal the truth, not to create it.",Edward de Bono,"Argument, Create, Reveal"
"If I could only give three words of advice, they would be, 'Tell the truth.' If I got three more words, I'd add, 'All the time.'",Randy Pausch,"Time, Advice, Words"
The truth is that technology is only valuable if it helps you run your organization better.,Safra A. Catz,"Technology, Your, Better"
Press freedom is the foundation of the rights of all Filipinos to the truth.,Maria Ressa,"Freedom, Foundation, Rights"
"Humanism was not wrong in thinking that truth, beauty, liberty, and equality are of infinite value, but in thinking that man can get them for himself without grace.",Simone Weil,"Beauty, Equality, Man"
My parents taught me the importance of telling the truth no matter what.,Marley Dias,"Parents, Me, Matter"
"My people are going to learn the principles of democracy, the dictates of truth and the teachings of science. Superstition must go.",Mustafa Kemal Ataturk,"Science, Democracy, People"
"The truth is cruel, but it can be loved, and it makes free those who have loved it.",George Santayana,"Free, Loved, Cruel"
"When we believe in lies, we cannot see the truth, so we make thousands of assumptions and we take them as truth. One of the biggest assumptions we make is that the lies we believe are the truth!",Don Miguel Ruiz,"Believe, Assumptions, See"
"Knowledge rests not upon truth alone, but upon error also.",Carl Jung,"Alone, Knowledge, Error"
"If men possessed wisdom, which stands in the same relation to the form of man as the sight to the eye, they would not cause any injury to themselves or to others; for the knowledge of truth removes hatred and quarrels, and prevents mutual injuries.",Maimonides,"Wisdom, Knowledge, Men"
I always say your truth is your compass to your purpose.,Amanda Seales,"Always, Your, Purpose"
Wine comes in at the mouth And love comes in at the eye; That's all we shall know for truth Before we grow old and die.,William Butler Yeats,"Love, Dating, Die"
"The truth is that the vast majority of Americans are good, fair, and just, and they want their country to reflect those ideals.",Kamala Harris,"Good, Country, Truth Is"
