title,author,tags
"When I can look life in the eyes, grown calm and very coldly wise, life will have given me the truth, and taken in exchange - my youth.",Sara Teasdale,"Life, Wisdom, Eyes"
"The truth is nobody was a Muslim until Public Enemy came out. Then, everybody was Muslim this and Muslim that. It's a bandwagon thing. Islam is a way of life... it's a religion. It's not just something you put on a record.",KRS-One,"Life, Religion, Way"
Poetry; a criticism of life under the conditions fixed for such a criticism by the laws of poetic truth and poetic beauty.,Matthew Arnold,"Life, Beauty, Poetry"
"My grandmother. She's someone I never met, and I would've loved to have met her. She's been a huge influence on our entire family, not just me. She is a mystery. It's not clear exactly what about her is truth and myth.",Amy Tan,"Family, Me, Mystery"
"I'm human, I feel, I understand. That's the highest level of love, is understanding - when you can understand someone, when you can love them with their flaws and their faults. So I understand, I consider. I may speak the truth, but I'll consider your feelings, too.",Tracy Morgan,"Love, Love Is, Your"
For Africa to me... is more than a glamorous fact. It is a historical truth. No man can know where he is going unless he knows exactly where he has been and exactly how he arrived at his present place.,Maya Angelou,"Man, Me, Historical"
There are those who so dislike the nude that they find something indecent in the naked truth.,F. H. Bradley,"Find, Naked, Something"
"Life is the game that must be played, this truth at least, good friends, we know; so live and laugh, nor be dismayed as one by one the phantoms go.",Arthur Rubinstein,"Life, Good, Game"
"The simple truth is that in order to become good, you have to be obsessed. You have to put in an awful lot of time and hard work and couple that with desire and unflagging perseverance.",Yngwie Malmsteen,"Work, Good, Time"
"The oblique paradox of propaganda is that the lie in the throat becomes, by repetition, the truth in the heart.",John Grierson,"Heart, Lie, Repetition"
"Art is a habit-forming drug. Art has absolutely no existence as veracity, as truth. People always speak of it with this great, religious reverence, but why should it be so revered?",Marcel Duchamp,"Art, Great, Always"
"Truth can be a matter of perspective, but I also think there's a truth that exists, that there are laws to the universe the way Gandhi and Dr. Martin Luther King believed.",Tom Shadyac,"King, Universe, Matter"
"We live in such a gullible world. Anything that's written, anything that's posted, anything picture that is interpreted one way is taken as truth.",Keri Hilson,"World, Way, Picture"
"Two qualities are indispensable: first, an intellect that, even in the darkest hour, retains some glimmerings of the inner light which leads to truth; and second, the courage to follow this faint light wherever it may lead.",Carl von Clausewitz,"Courage, Light, Follow"
"Purity is the feminine, truth the masculine of honor.",David Hare,"Honor, Purity, Masculine"
"My dad raised me with some good advice: 'Always tell the truth. Always shoot from the hip. You might not have many friends, but you'll never have enemies, because people will always know where you're coming from.'",Pink,"Good, Dad, Always"
It is hard to believe that a man is telling the truth when you know that you would lie if you were in his place.,H. L. Mencken,"Man, Believe, Lie"
"In the different voice of women lies the truth of an ethic of care, the tie between relationship and responsibility, and the origins of aggression in the failure of connection.",Carol Gilligan,"Women, Failure, Relationship"
"The People have a right to the Truth as they have a right to life, liberty and the pursuit of happiness.",Frank Norris,"Life, Happiness, People"
Trash talk? Smack talk? This is an American term that makes me laugh. I simply speak the truth. I'm an Irish man.,Conor McGregor,"Man, Me, Laugh"
Tell the truth and shame the devil.,Francois Rabelais,"Devil, Shame, Tell"
Speak the truth. People will forgive an honest mistake; they won't forgive you if you lie.,Mark Goulston,"Mistake, Lie, Will"
"Most people don't grow up. It's too damn difficult. What happens is most people get older. That's the truth of it. They honor their credit cards, they find parking spaces, they marry, they have the nerve to have children, but they don't grow up.",Maya Angelou,"Honor, Grow, Difficult"
"No matter how difficult and painful it may be, nothing sounds as good to the soul as the truth.",Martha Beck,"Good, Soul, Difficult"
"The truth of our faith becomes a matter of ridicule among the infidels if any Catholic, not gifted with the necessary scientific learning, presents as dogma what scientific scrutiny shows to be false.",Thomas Aquinas,"Faith, Learning, Matter"
"When the truth is spoken, it doesn't need to be adorned. It just needs to be simply stated, and often it only needs to be said once.",James Nachtwey,"Truth Is, Need, Only"
The said truth is that it is the greatest happiness of the greatest number that is the measure of right and wrong.,Jeremy Bentham,"Happiness, Measure, Right"
It is error alone which needs the support of government. Truth can stand by itself.,Thomas Jefferson,"Alone, Government, Stand"
If now isn't a good time for the truth I don't see when we'll get to it.,Nikki Giovanni,"Good, Time, See"
I insist on the truth. I surround myself with people who tell the truth.,Shelby Lynne,"Myself, People, Tell"
"The truth is, I've been lucky. But just like the waltz, life has its own rhythm of rise and fall.",Len Goodman,"Life, Rise, Fall"
Losing an illusion makes you wiser than finding a truth.,Ludwig Borne,"Illusion, Losing, Finding"
"It needs time. Nobody wants to hear it, but that's the truth: if you want to have success in the future, you have to be ready to work now.",Jurgen Klopp,"Success, Work, Future"
"I like all types of women. I accept them as they are when they come into my life... But I'm not a romantic. I'm just up-front. I like to be a part of something real, not make-believe. I tell women to tell me the truth, to just lay it out. Let me be the judge and decide if I want you around or not. Let me have my choice.",Future,"Life, Women, Romantic"
"New knowledge is the most valuable commodity on earth. The more truth we have to work with, the richer we become.",Kurt Vonnegut,"Work, Knowledge, New"
Bigotry dwarfs the soul by shutting out the truth.,Edwin Hubbel Chapin,"Soul, Out, Shutting"
"The truth knocks on the door and you say, go away, I'm looking for the truth, and it goes away. Puzzling.",Robert M. Pirsig,"Door, Looking, Go"
If you ever injected truth into politics you have no politics.,Will Rogers,"Politics, Ever, You"
I believe that in the end the truth will conquer.,John Wycliffe,"Believe, Conquer, Will"
People are not on a truth quest; they are on a happiness quest. They will continue to attend your church - even if they don't share your beliefs - as long as they find the content engaging and helpful.,Andy Stanley,"Happiness, Your, Long"
Beauty is but the sensible image of the Infinite. Like truth and justice it lives within us; like virtue and the moral law it is a companion of the soul.,George Bancroft,"Beauty, Justice, Soul"
"Friendship at first sight, like love at first sight, is said to be the only truth.",Herman Melville,"Friendship, Love, First"
Humor is always based on a modicum of truth. Have you ever heard a joke about a father-in-law?,Dick Clark,"Humor, Dad, Always"
"A memoir forces me to stop and remember carefully. It is an exercise in truth. In a memoir, I look at myself, my life, and the people I love the most in the mirror of the blank screen. In a memoir, feelings are more important than facts, and to write honestly, I have to confront my demons.",Isabel Allende,"Life, Love, Myself"
The trouble with lying and deceiving is that their efficiency depends entirely upon a clear notion of the truth that the liar and deceiver wishes to hide.,Hannah Arendt,"Liar, Efficiency, Trouble"
"Truth is a demure lady, much too ladylike to knock you on your head and drag you to her cave. She is there, but people must want her, and seek her out.","William F. Buckley, Jr.","Your, People, Lady"
The theatre was created to tell people the truth about life and the social situation.,Stella Adler,"Life, Situation, People"
"If you tell the truth about how you're feeling, it becomes funny.",Larry David,"Funny, Feeling, Tell"
"The will to label will always prevail over what's being labeled, usually at the expense of either truth or understanding.",Boyd Rice,"Always, Will, Understanding"
"In the spider-web of facts, many a truth is strangled.",Paul Eldridge,"Facts, Truth Is, Many"
"Everybody's got something. In the end, what choice does one really have but to understand that truth, to really take it in, and then shop for groceries, get a haircut, do one's work; get on with the business of one's life. That's the hope, anyway.",David Rakoff,"Life, Work, Hope"
"So far as hypotheses are concerned, let no one expect anything certain from astronomy, which cannot furnish it, lest he accept as the truth ideas conceived for another purpose, and depart from this study a greater fool than when he entered it.",Nicolaus Copernicus,"Fool, Purpose, Ideas"
Peace demands the most heroic labor and the most difficult sacrifice. It demands greater heroism than war. It demands greater fidelity to the truth and a much more perfect purity of conscience.,Thomas Merton,"War, Peace, Sacrifice"
"I, Master John Hus, in chains and in prison, now standing on the shore of this present life and expecting on the morrow a dreadful death, which will, I hope, purge away my sins, find no heresy in myself, and accept with all my heart any truth whatsoever that is worthy of belief.",Jan Hus,"Life, Death, Hope"
"Any fool can tell the truth, but it requires a man of some sense to know how to lie well.",Samuel Butler,"Fool, Man, Lie"
A lie would have no sense unless the truth were felt dangerous.,Alfred Adler,"No Sense, Lie, Dangerous"
"Let me tell you what the truth is... I have learned one thing in life: there is no such thing as bad press. There is not. That's a fundamental truth. The more bad things said about you, the more power they give to you.",John McAfee,"Life, Power, Me"
I'm concerned about truth and credibility in government.,George W. Romney,"Government, Credibility, About"
Fiction reveals truth that reality obscures.,Ralph Waldo Emerson,"Reality, Fiction, Reveals"
"Life is an unfoldment, and the further we travel the more truth we can comprehend. To understand the things that are at our door is the best preparation for understanding those that lie beyond.",Hypatia,"Life, Best, Travel"
"Truth, like light, blinds. Falsehood, on the contrary, is a beautiful twilight that enhances every object.",Albert Camus,"Beautiful, Light, Twilight"
"Comedy is an escape, not from truth but from despair; a narrow escape into faith.",Christopher Fry,"Faith, Escape, Comedy"
Truth is the daughter of time.,Aulus Gellius,"Time, Daughter, Truth Is"
"The source of all the material comes from nothingness, illusion is working more on things you can prove. That's the principle, the essence of life, it is actually an illusion, not immaterial. That's worth pursuing. So illusion is not nothing. In a way, that is the truth.",Ang Lee,"Life, Illusion, Nothing"
"The sad truth is that the civil rights movement cannot be reborn until we identify the causes of black suffering, some of them self-inflicted. Why can't black leaders organize rallies around responsible sexuality, birth within marriage, parents reading to their children and students staying in school and doing homework?",Henry Louis Gates,"Sad, Marriage, Suffering"
"You have to tell the whole truth, the good and the bad, maybe some things that are uncomfortable for some people.",John Lewis,"Good, Bad, People"
"Without accepting the fact that everything changes, we cannot find perfect composure. But unfortunately, although it is true, it is difficult for us to accept it. Because we cannot accept the truth of transience, we suffer.",Shunryu Suzuki,"Change, Difficult, True"
"When people talk about fake news, you know, a lot of folks just roll their eyes, like 'Oh, you know, whatever; people will figure it out.' The truth is, they don't always figure it out.",Megyn Kelly,"Eyes, Always, Fake News"
It is a clear truth that those who every day barter away other men's liberty will soon care little for their own.,James Otis,"Men, Day, Care"
"Until we have a better relationship between private performance and the public truth, as was demonstrated with Watergate, we as the public are absolutely right to remain suspicious, contemptuous even, of the secrecy and the misinformation which is the digest of our news.",John le Carre,"Relationship, Better, News"
"There are few earthly things more beautiful than a university a place where those who hate ignorance may strive to know, where those who perceive truth may strive to make others see.",John Masefield,"Beautiful, Hate, Ignorance"
"If I can get you to laugh with me, you like me better, which makes you more open to my ideas. And if I can persuade you to laugh at the particular point I make, by laughing at it you acknowledge its truth.",John Cleese,"Better, Me, Laugh"
"If you're going to tell people the truth, be funny or they'll kill you.",Billy Wilder,"Funny, People, Tell"
"I am not 'in pursuit of truth.' It is not my 'quarry.' I am of my human nature a thinker, and conscious of need, responsibility of thinking-speaking with truth. I do not go about hunting 'truths.'",Laura Riding,"Nature, Responsibility, I Am"
"People think SEALs are cold-blooded, heartless, wound-up, brainwashed killers. They imagine you can just point a SEAL in a direction and say, 'Go kill.' The truth is you're talking about a bunch of kind-hearted, jovial guys. The only thing that separates them is mental toughness.",Howard E. Wasdin,"Direction, People, Go"
"If readers, young and old, would take even a moment to reflect on our rapidly shifting culture and ideology, I would be happy. Many leaders of the older generation dismiss emerging culture. Those leaders are at risk of becoming a feeble voice-piece without followers. Most of the younger generation is going deaf to the truth.",Ted Dekker,"Culture, Moment, Generation"
"A magician pulls a rabbit from a hat, and actors pull truth from fiction.",Mia Goth,"Hat, Magician, Fiction"
"Art is not a study of positive reality, it is the seeking for ideal truth.",John Ruskin,"Positive, Art, Reality"
"Honesty is not found in revealing the truth, but in understanding how deeply afraid of it we are. To become honest is in effect to become fully and robustly incarnated into powerlessness.",David Whyte,"Honesty, Understanding, Afraid"
The best mind-altering drug is the truth.,Lily Tomlin,Best
"There are only two things. Truth and lies. Truth is indivisible, hence it cannot recognize itself; anyone who wants to recognize it has to be a lie.",Franz Kafka,"Lie, Things, Cannot"
"There are various eyes. Even the Sphinx has eyes: and as a result there are various truths, and as a result there is no truth.",Friedrich Nietzsche,"Eyes, Result, Even"
"As an atheist, I am angry that we live in a society in which the plain truth cannot be spoken without offending 90% of the population.",Sam Harris,"Society, Angry, I Am"
"When I was young, I read the Bible, and I already knew what it meant to be the good guy - and look what happened to Jesus. So, I already understood that you get ridiculed for telling the truth, and I've always been aware of that. But, I'm a guy with confidence, and I'm not afraid.",Damon Dash,"Good, Always, Bible"
"Only in men's imagination does every truth find an effective and undeniable existence. Imagination, not invention, is the supreme master of art as of life.",Joseph Conrad,"Life, Art, Men"
"The truth is, my life was made infinitely more difficult because I didn't read any books. But I didn't read any books. That's my story. That's my truth.",Jason Reynolds,"Life, My Life, Difficult"
Time discovers truth.,Lucius Annaeus Seneca,"Time, Discovers"
"Why waste time trying to discover the truth, when you can so easily create it?",David Baldacci,"Time, Trying, Create"
"The truth is hip hop has always complemented jazz and vice versa, but there's always been this communication barrier that exists based on music to lyrics.",Thundercat,"Communication, Music, Always"
There is a great power in speaking your truth and standing for something important.,Sonita Alizadeh,"Power, Great, Your"
"Once you go inside and weed through the muck, you will find the real beauty, the truth about yourself.",Lindsay Wagner,"Beauty, Yourself, Will"
"Truth stands, even if there be no public support. It is self-sustained.",Mahatma Gandhi,"Support, Even, Public"
A nation that is afraid to let its people judge the truth and falsehood in an open market is a nation that is afraid of its people.,John F. Kennedy,"Fear, People, Nation"
"The world is... the natural setting of, and field for, all my thoughts and all my explicit perceptions. Truth does not inhabit only the inner man, or more accurately, there is no inner man, man is in the world, and only in the world does he know himself.",Maurice Merleau-Ponty,"Thoughts, Man, World"
"A liar begins with making falsehood appear like truth, and ends with making truth itself appear like falsehood.",William Shenstone,"Liar, Like, Falsehood"
"Trust is a core currency of any relationship. Sometimes our need to control and micromanage everything erodes our confidence in ourselves and others. The truth: People are much more capable than we think. A hearty dose of trust is often what's needed to unlock the magic. Go ahead, have faith.",Kris Carr,"Faith, Trust, Relationship"
Opinions are made to be changed - or how is truth to be got at?,Lord Byron,"Change, Opinions, Got"
"In order to properly understand the big picture, everyone should fear becoming mentally clouded and obsessed with one small section of truth.",Xun Kuang,"Fear, Picture, Everyone"
My way of joking is to tell the truth. That's the funniest joke in the world.,Muhammad Ali,"World, Way, Tell"
"Life is a hideous thing, and from the background behind what we know of it peer daemoniacal hints of truth which make it sometimes a thousandfold more hideous.",H. P. Lovecraft,"Life, Life Is A, Know"
What for centuries raised man above the beast is not the cudgel but the irresistible power of unarmed truth.,Boris Pasternak,"Power, Man, Beast"
Let's not be afraid to speak the common sense truth: you can't have high standards without good discipline.,William Hague,"Good, Discipline, Speak"
"I keep pushing for the Crest Whitestrips thing. I get so many compliments on how white my teeth are, but I have to say it's not because of my brushing skills. It's from Crest Whitestrips, and that's the honest truth. I don't believe in going to the dentist and paying for whitening.",Jill Wagner,"Believe, Keep, White"
"When one lives in a society where people can no longer rely on the institutions to tell them the truth, the truth must come from culture and art.",John Trudell,"Society, Art, Culture"
We have but one permanent home: heaven - that's still the old truth that we always have to re-learn - and it's only through the impact of sad experiences that we assimilate it.,Pierre Teilhard de Chardin,"Sad, Home, Always"
"The truth is that transitioning to clean energy like wind and solar will create millions of new, good jobs that can't be outsourced, and spur economic growth - all while avoiding the inevitable, significant damages our economy will suffer should we keep building more pipelines.",Tom Steyer,"Good, Growth, Wind"
"If you cannot find the truth within yourself, where else do you expect to find it?",Dogen,"Yourself, Find, Cannot"
"Truth and mercy require the exertion - never the suppression, of man's noble rights and powers.",Gerrit Smith,"Man, Mercy, Never"
"If you tell Canadians that you want to interview them for a critical piece on the Canadian healthcare system, they'll put on their best trophy-wife smile for the camera and list its many accolades. Catch them on a day with their guard down in need of actual care, however, and the truth comes out.",Steven Crowder,"Smile, Best, Day"
"I'm fascinated with the stories that we tell. Real histories become fantasies and fairy tales, morality tales and fables. There's something interesting and funny and perverse about the way fairytale sometimes passes for history, for truth.",Kara Walker,"Funny, History, Morality"
All truth is not to be told at all times.,Samuel Butler,"Truth Is, Times"
"I've written about this before, but the sad truth is this: There are only a handful of Trump true believers in the Senate. The rest are chugging a toxic slurry of cowardice, ambition, and opportunism that has led members of the upper house of a co-equal branch of government to relinquish their power and prerogatives.",Rick Wilson,"Sad, Power, Government"
"It is a universal truth that the loss of liberty at home is to be charged to the provisions against danger, real or pretended, from abroad.",James Madison,"Freedom, Home, Liberty"
"I love new places, new people, new ideas. I love cultural differences, and I'm fascinated by the truth - all the different versions of it.",Martin Henderson,"Love, Differences, New"
"You believe happiness to be derived from the place in which once you have been happy, but in truth it is centered in ourselves.",Franz Schubert,"Happiness, Believe, Happy"
Truth is a great flirt.,Franz Liszt,"Great, Truth Is, Flirt"
"Truth, like a torch, the more it's shook it shines.",William Hamilton,"Torch, More, Like"
"To have the truth in your possession you can be found guilty, sentenced to death.",Peter Tosh,"Death, Your, Guilty"
"I am critical of modernity giving science and technology a blank check as if it were the fountain of all truth. That is not true. And I think I may have introduced a word which has now caught on quite a bit, scientism. Science is good. It simply reports a discovery.",Huston Smith,"Science, Good, Technology"
A single moment spent in a business meeting or at a pub is more than enough to reveal the basic human truth that we are all faking it most of the time. We congratulate a rival on a triumph when actually we are choking on spite. We are cordial and attentive to crashing bores.,Jeff Lindsay,"Time, Business, Moment"
"Unemployment is sky-rocketing; deflation is in our future for the first time since the Great Depression. I don't care whose fault it is, it's the truth.",John Mellencamp,"Future, Time, Great"
"But what is Hope? Nothing but the paint on the face of Existence; the least touch of truth rubs it off, and then we see what a hollow-cheeked harlot we have got hold of.",Lord Byron,"Hope, Face, Nothing"
"I learned a long time ago that some people would rather die than forgive. It's a strange truth, but forgiveness is a painful and difficult process. It's not something that happens overnight. It's an evolution of the heart.",Sue Monk Kidd,"Time, Forgiveness, Heart"
"The usefulness of religion - the fact that it gives life meaning, that it makes people feel good - is not an argument for the truth of any religious doctrine. It's not an argument that it's reasonable to believe that Jesus really was born of a virgin or that the Bible is the perfect word of the creator of the universe.",Sam Harris,"Life, Good, Religion"
The truth doesn't lie. It's up in your face. It's in your conscience. It challenges your very being with the intention of cleaning you of sin and its influence.,Monica Johnson,"Your, Challenges, Face"
"Every great discovery I ever made, I gambled that the truth was there, and then I acted in faith until I could prove its existence.",Arthur Compton,"Faith, Great, Discovery"
"I hope that people will say that 'she told the truth, she told her truth, she wasn't afraid to live her truth, and she wasn't afraid to live her truth out loud.' That's what I want my legacy to look like.",Lena Waithe,"Hope, Legacy, Look"
"In all science, error precedes the truth, and it is better it should go first than last.",Horace Walpole,"Science, Better, First"
I believe that truth has only one face: that of a violent contradiction.,Georges Bataille,"Believe, Face, I Believe That"
The thing you fear most has no power. Your fear of it is what has the power. Facing the truth really will set you free.,Oprah Winfrey,"Power, Fear, Your"
"There is nothing so powerful as truth, and often nothing so strange.",Daniel Webster,"Nothing, Strange, Powerful"
"The stream of time sweeps away errors, and leaves the truth for the inheritance of humanity.",Georg Brandes,"Time, Humanity, Inheritance"
"Truth, according to the Christian faith, is God's love for us in Jesus Christ. Therefore, truth is a relationship.",Pope Francis,"Love, Faith, God"
Truth is exact correspondence with reality.,Paramahansa Yogananda,"Reality, Truth Is, Correspondence"
"The older I get, the more I realize the truth is the simpler the food, the more exceptional it can be.",Joel Robuchon,"Food, Realize, Truth Is"
"Picasso said, 'Art is a lie that tells the truth.' What if you just want to tell the truth and not lie about it?",Nicolas Cage,"Art, Lie, What If"
I trust you: That's huge. That's truth. That's real love. Everyone uses 'I love you' so loosely.,Justin Chatwin,"Love, Trust, Everyone"
"Washington couldn't tell a lie, Nixon couldn't tell the truth, and Reagan couldn't tell the difference.",Mort Sahl,"Lie, Difference, Tell"
"Time is money says the proverb, but turn it around and you get a precious truth. Money is time.",George Gissing,"Time, Money, Precious"
Nothing can express the aim and meaning of our work better than the profound words of St. Augustine - 'Beauty is the splendor of Truth.',Ludwig Mies van der Rohe,"Beauty, Work, Aim"
