title,author,tags
Books and all forms of writing are terror to those who wish to suppress the truth.,Wole Soyinka,"Wish, Writing, Who"
Nothing gives rest but the sincere search for truth.,Blaise Pascal,"Rest, Nothing, Search"
"The best way to obtain truth and wisdom is not to ask from books, but to go to God in prayer, and obtain divine teaching.","Joseph Smith, Jr.","Wisdom, Best, God"
We too often bind ourselves by authorities rather than by the truth.,Lucretia Mott,"Rather, Than, Often"
"I have come to believe that the whole world is an enigma, a harmless enigma that is made terrible by our own mad attempt to interpret it as though it had an underlying truth.",Umberto Eco,"Believe, World, Own"
"The dream begins with a teacher who believes in you, who tugs and pushes and leads you to the next plateau, sometimes poking you with a sharp stick called 'truth'.",Dan Rather,"Teacher, Sometimes, Dream"
"If the Republicans will stop telling lies about the Democrats, we will stop telling the truth about them.",Adlai Stevenson I,"Will, Stop, Telling The Truth"
"It is impossible to struggle for civil rights, equal rights for blacks, without including whites. Because equal rights, fair play, justice, are all like the air: we all have it, or none of us has it. That is the truth of it.",Maya Angelou,"Impossible, Justice, Struggle"
"I left in love, in laughter, and in truth, and wherever truth, love and laughter abide, I am there in spirit.",Bill Hicks,"Love, Laughter, I Am"
There is not one single police officer in America that I am not afraid of and not one that I would trust to tell the truth or obey the laws they are sworn to uphold. I do not believe they protect me in any way.,Henry Rollins,"Trust, Believe, Police"
The truth is that many people set rules to keep from making decisions.,Mike Krzyzewski,"Keep, People, Rules"
A gaffe is when a politician tells the truth.,Michael Kinsley,"Politician, Tells"
"The truth is that love smashes into your life like an ice floe, and even if your heart is built like the Titanic you go down.",Jeanette Winterson,"Life, Love, Heart"
"The possession of arbitrary power has always, the world over, tended irresistibly to destroy humane sensibility, magnanimity, and truth.",Frederick Law Olmsted,"Power, Always, World"
Be Impeccable With Your Word. Speak with integrity. Say only what you mean. Avoid using the word to speak against yourself or to gossip about others. Use the power of your word in the direction of truth and love.,Don Miguel Ruiz,"Motivational, Love, Power"
All photographs are accurate. None of them is the truth.,Richard Avedon,"Them, Accurate, None"
"I'm actually a very honest person, and sometimes I end up like, 'Man, I said too much.' It's hard for me not to tell the truth when you ask me.",Drake,"Man, Me, Person"
"The whole point of the kingdom of God is Jesus has come to bear witness to the true truth, which is nonviolent. When God wants to take charge of the world, he doesn't send in the tanks. He sends in the poor and the meek.",N. T. Wright,"God, World, Poor"
The truth is on the march and nothing will stop it.,Emile Zola,"Inspirational, March, Nothing"
Believe those who are seeking the truth. Doubt those who find it.,Andre Gide,"Believe, Find, Doubt"
"Plato is my friend; Aristotle is my friend, but my greatest friend is truth.",Isaac Newton,"Friend, Greatest, My Friend"
"Truth is ever to be found in simplicity, and not in the multiplicity and confusion of things.",Isaac Newton,"Simplicity, Confusion, Things"
"The object of oratory alone in not truth, but persuasion.",Thomas Babington Macaulay,"Alone, Persuasion, Object"
I don't want any yes-men around me. I want everybody to tell me the truth even if it costs them their job.,Samuel Goldwyn,"Me, Job, Tell"
"When I grew up, in Taiwan, the Korean War was seen as a good war, where America protected Asia. It was sort of an extension of World War II. And it was, of course, the peak of the Cold War. People in Taiwan were generally proAmerican. The Korean War made Japan. And then the Vietnam War made Taiwan. There is some truth to that.",Ang Lee,"Good, War, World"
"I seek truth over a lie; I seek justice over injustice; I seek righteousness over the rewards of evildoers, and I love Allah more than I love the state.",H. Rap Brown,"Love, Justice, Allah"
"Violence does, in truth, recoil upon the violent, and the schemer falls into the pit which he digs for another.",Arthur Conan Doyle,"Violence, He, Which"
It's in literature that true life can be found. It's under the mask of fiction that you can tell the truth.,Gao Xingjian,"Life, Mask, True"
"Christlike communications are expressions of affection and not anger, truth and not fabrication, compassion and not contention, respect and not ridicule, counsel and not criticism, correction and not condemnation. They are spoken with clarity and not with confusion. They may be tender or they may be tough, but they must always be tempered.",L. Lionel Kendrick,"Respect, Anger, Always"
"Pleasure without God, without the sacred boundaries, will actually leave you emptier than before. And this is biblical truth, this is experiential truth. The loneliest people in the world are amongst the wealthiest and most famous who found no boundaries within which to live. That is a fact I've seen again and again.",Ravi Zacharias,"God, Famous, World"
"Your days are short here; this is the last of your springs. And now in the serenity and quiet of this lovely place, touch the depths of truth, feel the hem of Heaven. You will go away with old, good friends. And don't forget when you leave why you came.",Adlai Stevenson II,"Good, Your, Serenity"
"Love is the crowning grace of humanity, the holiest right of the soul, the golden link which binds us to duty and truth, the redeeming principle that chiefly reconciles the heart to life, and is prophetic of eternal good.",Petrarch,"Life, Love, Good"
Convictions are more dangerous foes of truth than lies.,Friedrich Nietzsche,"Dangerous, More, Convictions"
"Science moves with the spirit of an adventure characterized both by youthful arrogance and by the belief that the truth, once found, would be simple as well as pretty.",James D. Watson,"Science, Arrogance, Simple"
"My favourite kind of comedy comes from the awkwardness of living, the stuff that makes you cringe but borders on tragic - that is more interesting to me. It resonates; it comes from emotional truth.",Taika Waititi,"Me, Living, Comedy"
Truth is confirmed by inspection and delay; falsehood by haste and uncertainty.,Tacitus,"Uncertainty, Delay, Truth Is"
"Truth is, I cut my hair for freedom, not for beauty.",Chrisette Michele,"Beauty, Freedom, Hair"
"As long as the people don't fear the truth, there is hope. For once they fear it, the one who tells it doesn't stand a chance. And today, truth is still beautiful... but so frightening.",Alice Walker,"Hope, Fear, Chance"
"Nothing is more noble, nothing more venerable than fidelity. Faithfulness and truth are the most sacred excellences and endowments of the human mind.",Marcus Tullius Cicero,"Mind, Nothing, Faithfulness"
"There can be no knowledge without emotion. We may be aware of a truth, yet until we have felt its force, it is not ours. To the cognition of the brain must be added the experience of the soul.",Arnold Bennett,"Knowledge, Experience, Brain"
"Truth is a hard deer to hunt. If you eat too much truth at once, you may die of the truth.",Stephen Vincent Benet,"Die, Deer, May"
"When distant and unfamiliar and complex things are communicated to great masses of people, the truth suffers a considerable and often a radical distortion. The complex is made over into the simple, the hypothetical into the dogmatic, and the relative into an absolute.",Walter Lippmann,"Great, Simple, People"
"A man has to learn that he cannot command things, but that he can command himself; that he cannot coerce the wills of others, but that he can mold and master his own will: and things serve him who serves Truth; people seek guidance of him who is master of himself.",James Allen,"Inspirational, Man, Will"
It is a simple but sometimes forgotten truth that the greatest enemy to present joy and high hopes is the cultivation of retrospective bitterness.,Robert Menzies,"Simple, Joy, Enemy"
The word theatre comes from the Greeks. It means the seeing place. It is the place people come to see the truth about life and the social situation.,Stella Adler,"Life, Situation, People"
The goal of education is the advancement of knowledge and the dissemination of truth.,John F. Kennedy,"Education, Knowledge, Advancement"
Beauty is truth's smile when she beholds her own face in a perfect mirror.,Rabindranath Tagore,"Smile, Beauty, Mirror"
"The truth is that there is no actual stress or anxiety in the world; it's your thoughts that create these false beliefs. You can't package stress, touch it, or see it. There are only people engaged in stressful thinking.",Wayne Dyer,"Thoughts, Your, World"
We don't regard any scientific theory as the absolute truth.,Kenneth R. Miller,"Science, Theory, Scientific"
"It is proof of a base and low mind for one to wish to think with the masses or majority, merely because the majority is the majority. Truth does not change because it is, or is not, believed by a majority of the people.",Giordano Bruno,"Change, Mind, People"
"It takes two to speak the truth: one to speak, and another to hear.",Henry David Thoreau,"Speak, Two, Hear"
You may not like the way I deliver the truth - you may take umbrage with the way I handle most of my conflicts - but that's the way I do business.,Samoa Joe,"Business, Way, May"
"We cannot know the whole truth, which belongs to God alone, but our task nevertheless is to seek to know what is true. And if we offend gravely enough against what we know to be true, as by failing badly enough to deal affectionately and responsibly with our land and our neighbors, truth will retaliate with ugliness, poverty, and disease.",Wendell Berry,"Alone, God, Poverty"
"Give me the fruitful error any time, full of seeds, bursting with its own corrections. You can keep your sterile truth for yourself.",Vilfredo Pareto,"Time, Your, Yourself"
I chose to pursue a career in physics because there the truth isn't so easily bent.,Angela Merkel,"Physics, Pursue, Career"
A great truth is a truth whose opposite is also a truth.,Thomas Mann,"Great, Opposite, Truth Is"
You never monkey with the truth.,Ben Bradlee,"Monkey, Never, You"
"'Crazy-busy' is a great armor, it's a great way for numbing. What a lot of us do is that we stay so busy, and so out in front of our life, that the truth of how we're feeling and what we really need can't catch up with us.",Brene Brown,"Life, Great, Busy"
"Truth is, in fact, an elusive concept. It depends almost entirely on where you are standing at the time. It is a human instinct to confuse belief with truth.",Gwen Ifill,"Time, Human, Belief"
"The American fascists are most easily recognized by their deliberate perversion of truth and fact. Their newspapers and propaganda carefully cultivate every fissure of disunity, every crack in the common front against fascism.",Henry A. Wallace,"American, Propaganda, Fascism"
If you walk on the path of truth all the powers in the universe help you.,Arvind Kejriwal,"Walk, Path, Universe"
"Science is the search for truth, that is the effort to understand the world: it involves the rejection of bias, of dogma, of revelation, but not the rejection of morality.",Linus Pauling,"Science, Effort, World"
"Human identity is the most fragile thing that we have, and it's often only found in moments of truth.",Alan Rudolph,"Identity, Human, Only"
"People said my records were 'funky' and 'muddy,' but the truth is they were just demos.",J. J. Cale,"People, Truth Is, Said"
"The truth is, in order to get things like universal health care and a revamped education system, then someone is going to have to give up a piece of their pie so that someone else can have more.",Michelle Obama,"Education, Health, Care"
"The simple truth is that balding African-American men look cool when they shave their heads, whereas balding white men look like giant thumbs.",Dave Barry,"Cool, Men, Simple"
"In politics, a lie unanswered becomes truth within 24 hours.",Willie Brown,"Politics, Lie, 24 Hours"
Accusations fit on a bumper sticker; the truth takes longer.,Michael Hayden,"Sticker, Longer, Takes"
The challenge for a nonfiction writer is to achieve a poetic precision using the documents of truth but somehow to make people and places spring to life as if the reader was in their presence.,Simon Schama,"Life, Spring, Challenge"
"All your life, you live so close to truth, it becomes a permanent blur in the corner of your eye. And when something nudges it into outline, it is like being ambushed by a grotesque.",Tom Stoppard,"Life, Your, Blur"
Those who believe that they have absolute truth and the only moral system are destructive both to themselves and to those whom they try to convert.,Luke Rhinehart,"Believe, Try, Moral"
"I am certain of nothing but the holiness of the heart's affections, and the truth of imagination.",John Keats,"Imagination, Romantic, Heart"
He who does not bellow the truth when he knows the truth makes himself the accomplice of liars and forgers.,Charles Peguy,"Who, Liars, He"
There is but One God. His name is Truth; He is the Creator. He fears none; he is without hate. He never dies; He is beyond the cycle of births and death. He is self-illuminated. He is realized by the kindness of the True Guru. He was True in the beginning; He was True when the ages commenced and has ever been True. He is also True now.,Guru Nanak,"God, Death, Kindness"
I do not fear truth. I welcome it. But I wish all of my facts to be in their proper context.,Gordon B. Hinckley,"Fear, Welcome, Facts"
Seeing the bigger picture opens your eyes to what is the truth.,Wadada Leo Smith,"Eyes, Your, Picture"
It is a melancholy truth that even great men have their poor relations.,Charles Dickens,"Men, Great, Poor"
"It is an old maxim of mine that when you have excluded the impossible, whatever remains, however improbable, must be the truth.",Arthur Conan Doyle,"Impossible, Old, Mine"
"Who never doubted, never half believed. Where doubt is, there truth is - it is her shadow.",Ambrose Bierce,"Shadow, Doubt, Never"
Truth is the best defense.,Ward Churchill,"Best, Truth Is, Defense"
My religion is based on truth and non-violence. Truth is my God. Non-violence is the means of realising Him.,Mahatma Gandhi,"God, Religion, Truth Is"
You must accept the truth from whatever source it comes.,Maimonides,"Accept, Whatever, Must"
Mythology is a subjective truth. Every culture imagines life a certain way.,Devdutt Pattanaik,"Life, Culture, Way"
The defendant wants to hide the truth because he's generally guilty. The defense attorney's job is to make sure the jury does not arrive at that truth.,Alan Dershowitz,"Job, Guilty, Hide"
"My parents taught me honesty, truth, compassion, kindness and how to care for people. Also, they encouraged me to take risks, to boldly go. They taught me that the greatest danger in life is not taking the adventure.",Brian Blessed,"Life, Kindness, Risks"
"The truth is lived, not taught.",Hermann Hesse,"Truth Is, Taught, Lived"
I have discovered the art of deceiving diplomats. I tell them the truth and they never believe me.,Camillo di Cavour,"Art, Believe, Me"
Today we live in a world now where it is easy to confuse truth and popularity. And you can use money to amplify whatever you believe and get people to believe what is popular is now truthful. And what is not popular may not be truthful.,Chamath Palihapitiya,"Money, Today, Believe"
"You recognize the truth because sometimes it's hard to swallow, but if you hold it in your mouth, refusing to eat it, you are going to choke.",Monica Johnson,"Your, Sometimes, Mouth"
"When you get down to it, at it's root, Comedy is truth, absurdity, and pain. One of my little mottos is: 'Do you remember the Peanuts cartoon where Charlie Brown kicked the football and kissed the Little Red Haired Girl? Neither do I.'",Lev Yilmaz,"Pain, Football, Remember"
"I would love to have an ocean of love right now. That said, the number-one rule of acting is, 'Do not seek approval from the audience.' People don't realize that. You can't do stuff to get applause. You have to live in the truth.",Chadwick Boseman,"Love, People, Live"
"Pretty woman, I don't believe you, you're not the truth. No one could look as good as you, mercy.",Roy Orbison,"Good, Believe, Look"
"Doubt thou the stars are fire, Doubt that the sun doth move. Doubt truth to be a liar, But never doubt I love.",William Shakespeare,"Love, Valentine's Day, Stars"
"The key to wisdom is this - constant and frequent questioning, for by doubting we are led to question and by questioning we arrive at the truth.",Peter Abelard,"Wisdom, Key, Questioning"
"The role of the intellectual, so it is said, is to speak truth to power. Noam Chomsky has dismissed this pious tag on two grounds. For one thing, power knows the truth already; it is just busy trying to conceal it. For another, it is not those in power who need the truth, but those they oppress.",Terry Eagleton,"Power, Busy, Speak"
"The thing about the truth is, not a lot of people can handle it.",Conor McGregor,"People, Handle, Truth Is"
The most powerful element in advertising is the truth.,William Bernbach,"Advertising, Powerful, Most Powerful"
"People say they hate having fake people around, but when you keep it real, they hate you even more. People don't like the truth.",DeMarcus Cousins,"Hate, Keep, People"
The truth is that neither British nor American imperialism was or is idealistic. It has always been driven by economic or strategic interests.,Charley Reese,"Always, Imperialism, American"
"Trump's behavior is conscienceless, showing utter disregard for the safety of others, consistent irresponsibility, callousness, cynicism and disrespect of other human beings. Contempt for truth and honesty, and for norms, rules and laws. A complete inability to feel remorse, or guilt.",George T. Conway III,"Honesty, Behavior, Disrespect"
The color of truth is gray.,Andre Gide,"Gray, Truth Is, Color"
"Comedy is a way to make sense of chaos. It's a way of dealing with things that are overwhelming, that threaten you; it's a way to survive and get closer to the truth.",Laura Linney,"Chaos, Way, Survive"
Tell the truth. Sing with passion. Work with laughter. Love with heart. 'Cause that's all that matters in the end.,Kris Kristofferson,"Love, Work, Heart"
I can't say why people lie; they just do. Everyone has their own reasons for not telling the truth.,Eric Carr,"Lie, Own, People"
A truth which comes to us from outside always bears the stamp of uncertainty. We can believe only what appears to each one of us in our own hearts as truth.,Rudolf Steiner,"Always, Believe, Uncertainty"
"Yesterday we obeyed kings and bent our necks before emperors. But today we kneel only to truth, follow only beauty, and obey only love.",Khalil Gibran,"Inspirational, Love, Beauty"
Premature certainty is the enemy of the truth.,Nipsey Hussle,"Enemy, Certainty, Premature"
"I love you, and because I love you, I would sooner have you hate me for telling you the truth than adore me for telling you lies.",Pietro Aretino,"Love, Relationship, Hate"
"The central conservative truth is that it is culture, not politics, that determines the success of a society. The central liberal truth is that politics can change a culture and save it from itself.",Daniel Patrick Moynihan,"Success, Change, Politics"
Have the courage to say no. Have the courage to face the truth. Do the right thing because it is right. These are the magic keys to living your life with integrity.,W. Clement Stone,"Life, Courage, Your"
"The greatest friend of truth is Time, her greatest enemy is Prejudice, and her constant companion is Humility.",Charles Caleb Colton,"Time, Humility, Enemy"
People don't want to hear the truth; they never do. They wanna live in some kind of fantasy.,Paul Mooney,"People, Fantasy, Never"
"Seeing is no longer believing. The very notion of truth has been put into crisis. In a world bloated with images, we are finally learning that photographs do indeed lie.",Barbara Kruger,"Learning, World, Lie"
Country music is the people's music. It just speaks about real life and about truth and it tells things how they really are.,Faith Hill,"Life, Music, Country"
"The sheep-people don't think for themselves anymore. You can say anything and it's the gospel truth and they don't have to go research it or anything, and they believe everything the news tells them. People don't go and do their own investigations if it's relationships or politics or anything.",Big Boi,"Politics, Believe, Research"
The truth is I love being alive. And I love feeling free. So if I can't have those things then I feel like a caged animal and I'd rather not be in a cage. I'd rather be dead. And it's real simple. And I think it's not that uncommon.,Angelina Jolie,"Love, Freedom, Simple"
"Chase after the truth like all hell and you'll free yourself, even though you never touch its coat tails.",Clarence Darrow,"Yourself, Hell, Free"
Morality is the basis of things and truth is the substance of all morality.,Mahatma Gandhi,"Morality, Things, Truth Is"
"Now the true soldiers of Christ must always be prepared to do battle for the truth, and must never, so far as lies with them, allow false convictions to creep in.",Origen,"Faith, Always, Battle"
I've always loved yoga because you get to connect to a deep religious truth while stretching your legs.,Katya Zamolodchikova,"Always, Your, Stretching"
Art is magic delivered from the lie of being truth.,Theodor W. Adorno,"Art, Lie, Magic"
"Telling lies is the easy bit, but telling the truth and pretending you are lying is hard.",Lee Mack,"Easy, Hard, Pretending"
"I have learned the hard way to mind my business, without judging who people are and what they do. I am more troubled by the lack of space being provided for the truth to unfold. Humans cannot seem to wait for or honor the truth. Instead, we make it up based on who we believe people should or should not be.",Iyanla Vanzant,"Business, Space, Mind"
Hope is nature's veil for hiding truth's nakedness.,Alfred Nobel,"Nature, Hope, Veil"
Architecture is the reaching out for the truth.,Louis Kahn,"Architecture, Out, Reaching"
"We are volcanoes. When we women offer our experience as our truth, as human truth, all the maps change. There are new mountains.",Ursula K. Le Guin,"Change, Women, Experience"
"After many years of great mercy, after tasting of the powers of the world to come, we still are so weak, so foolish; but, oh! when we get away from self to God, there all is truth and purity and holiness, and our heart finds peace, wisdom, completeness, delight, joy, victory.",Charles Spurgeon,"Wisdom, God, Peace"
"This is a truth that should be repeated like a mantra: to have any chance of a ful - filling life, we require not only clean air and a steady climate, but also an abundance of meadows and woodlands, rivers and oceans, teeming with life and the mass existence of other living creatures.",John Burnside,"Life, Chance, Living"
"Every man has a right to utter what he thinks truth, and every other man has a right to knock him down for it. Martyrdom is the test.",Samuel Johnson,"Man, Down, Right"
Most jokes state a bitter truth.,Larry Gelbart,"Bitter Truth, Jokes, State"
"I believe that one key to success is to accept truth, no matter how it's spoken.",Robert Kiyosaki,"Success, Believe, Matter"
"Matangi's mantra is aim, which is MIA backwards. She fights for freedom of speech and stands for truth, and lives in the ghetto because her dad was the first person in Hindu mythology who came from the 'hood, but had gained enlightenment through not being a Brahmin.",M.I.A.,"Freedom, Dad, Aim"
"Whether you're a second lieutenant working with a captain and a lieutenant colonel, or a four-star general working with the Office Secretary of Defense and the White House, the decision makers have got to have ground truth. Otherwise, the decisions they make could be flawed - and that can be dangerous.",John F. Kelly,"Decision, White, Dangerous"
The scientist is motivated primarily by curiosity and a desire for truth.,Irving Langmuir,"Science, Curiosity, Desire"
The truth is overrated.,Paul Westerberg,"Truth Is, Overrated"
The oppressed peoples can liberate themselves only through struggle. This is a simple and clear truth confirmed by history.,Kim Il-sung,"History, Struggle, Simple"
Never wear your best trousers when you go out to fight for freedom and truth.,Henrik Ibsen,"Best, Freedom, Veterans Day"
Certainly all historical experience confirms the truth - that man would not have attained the possible unless time and again he had reached out for the impossible.,Max Weber,"Experience, Time, Impossible"
"I learned the truth at seventeen, That love was meant for beauty queens, And high school girls with clear skinned smiles, Who married young and then retired.",Janis Ian,"Love, Beauty, School"
"PR is premised on truth, trust, and transparency.",Richard Edelman,"Trust, Transparency"
"We know the truth, not only by the reason, but also by the heart.",Blaise Pascal,"Heart, Know, Reason"
"Truth in drama is forever elusive. You never quite find it, but the search for it is compulsive. The search is clearly what drives the endeavour. The search is your task.",Harold Pinter,"Your, Search, Find"
It's very easy to be judgmental until you know someone's truth.,Kate Winslet,"Know, Easy, Someone"
"Like the sand and the oyster, it's a creative irritant. In each poem, I'm trying to reveal a truth, so it can't have a fictional beginning.",Carol Ann Duffy,"Beginning, Sand, Trying"
