title,author,tags
"Once you eliminate the impossible, whatever remains, no matter how improbable, must be the truth.",Arthur Conan Doyle,"Impossible, Matter, Whatever"
"All truth passes through three stages. First, it is ridiculed. Second, it is violently opposed. Third, it is accepted as being self-evident.",Arthur Schopenhauer,"First, Three, Through"
It is only with the heart that one can see rightly; what is essential is invisible to the eye.,Antoine de Saint-Exupery,"Heart, Eye, See"
All truths are easy to understand once they are discovered; the point is to discover them.,Galileo Galilei,"Easy, Understand, Point"
"Truth is like the sun. You can shut it out for a time, but it ain't goin' away.",Elvis Presley,"Time, Sun, Truth Is"
If you do not tell the truth about yourself you cannot tell it about other people.,Virginia Woolf,"Yourself, People, Cannot"
"Man is least himself when he talks in his own person. Give him a mask, and he will tell you the truth.",Oscar Wilde,"Man, Mask, Will"
"The truth will set you free, but first it will make you miserable.",James A. Garfield,"Free, Will, First"
"We live in a fantasy world, a world of illusion. The great task in life is to find reality.",Iris Murdoch,"Life, Great, World"
"Never apologize for showing feeling. When you do so, you apologize for the truth.",Benjamin Disraeli,"Feeling, Never, Apologize"
"Rather than love, than money, than fame, give me truth.",Henry David Thoreau,"Love, Money, Me"
"If you would be a real seeker after truth, it is necessary that at least once in your life you doubt, as far as possible, all things.",Rene Descartes,"Life, Your, Possible"
"Three things cannot be long hidden: the sun, the moon, and the truth.",Buddha,"Long, Moon, Sun"
"I am a firm believer in the people. If given the truth, they can be depended upon to meet any national crisis. The great point is to bring them the real facts.",Abraham Lincoln,"Great, I Am, Facts"
Truth will ultimately prevail where there is pains to bring it to light.,George Washington,"Light, Will, Prevail"
"If you tell the truth, you don't have to remember anything.",Mark Twain,"Remember, Anything, Tell"
Truth exists; only lies are invented.,Georges Braque,"Only, Lies, Exists"
Sometimes the truth hurts. And sometimes it feels real good.,Henry Rollins,"Good, Sometimes, Real"
"By doubting we are led to question, by questioning we arrive at the truth.",Peter Abelard,"Questioning, Question, Led"
"We swallow greedily any lie that flatters us, but we sip only little by little at a truth we find bitter.",Denis Diderot,"Lie, Find, Us"
A lie gets halfway around the world before the truth has a chance to get its pants on.,Winston Churchill,"Chance, World, Lie"
The truth is of course is that there is no journey. We are arriving and departing all at the same time.,David Bowie,"Time, Journey, Truth Is"
Honesty is the first chapter in the book of wisdom.,Thomas Jefferson,"Wisdom, Honesty, First"
"Truth will always be truth, regardless of lack of understanding, disbelief or ignorance.",W. Clement Stone,"Always, Ignorance, Will"
Justice is truth in action.,Benjamin Disraeli,"Justice, Action"
The first reaction to truth is hatred.,Tertullian,"First, Hatred, Truth Is"
"If you look for truth, you may find comfort in the end; if you look for comfort you will not get either comfort or truth only soft soap and wishful thinking to begin, and in the end, despair.",C. S. Lewis,"Comfort, Thinking, Look"
A lot of truth is said in jest.,Eminem,"Truth Is, Said, Lot"
"Some people think that the truth can be hidden with a little cover-up and decoration. But as time goes by, what is true is revealed, and what is fake fades away.",Ismail Haniyeh,"Time, True, People"
Betrayal is the only truth that sticks.,Arthur Miller,"Only, Betrayal, Sticks"
Infinite love is the only truth. Everything else is illusion.,David Icke,"Love, Love Is, Illusion"
There's a world of difference between truth and facts. Facts can obscure the truth.,Maya Angelou,"World, Facts, Difference"
Perhaps the truth depends on a walk around the lake.,Wallace Stevens,"Walk, Lake, Depends"
"Even if you are a minority of one, the truth is the truth.",Mahatma Gandhi,"Minority, Truth Is, Even"
"There are no facts, only interpretations.",Friedrich Nietzsche,"Facts, Only, Interpretations"
"It is always the best policy to speak the truth, unless, of course, you are an exceptionally good liar.",Jerome K. Jerome,"Best, Good, Always"
No legacy is so rich as honesty.,William Shakespeare,"Legacy, Honesty, Rich"
I have a theory that the truth is never told during the nine-to-five hours.,Hunter S. Thompson,"Never, Truth Is, Theory"
"'Beauty is truth, truth beauty,' - that is all ye know on earth, and all ye need to know.",John Keats,"Beauty, Know, Earth"
I believe that it is better to tell the truth than a lie. I believe it is better to be free than to be a slave. And I believe it is better to know than to be ignorant.,H. L. Mencken,"Believe, Better, Lie"
People will generally accept facts as truth only if the facts agree with what they already believe.,Andy Rooney,"Believe, Facts, Will"
"On the mountains of truth you can never climb in vain: either you will reach a point higher up today, or you will be training your powers so that you will be able to climb higher tomorrow.",Friedrich Nietzsche,"Today, Tomorrow, Your"
A harmful truth is better than a useful lie.,Thomas Mann,"Better, Lie, Truth Is"
I don't believe it. Prove it to me and I still won't believe it.,Douglas Adams,"Believe, Me, Prove"
The great advantage about telling the truth is that nobody ever believes it.,Dorothy L. Sayers,"Great, Nobody, Telling The Truth"
"The truth is incontrovertible. Malice may attack it, ignorance may deride it, but in the end, there it is.",Winston Churchill,"Ignorance, End, Attack"
The object of the superior man is truth.,Confucius,"Man, Superior, Object"
We are either in the process of resisting God's truth or in the process of being shaped and molded by his truth.,Charles Stanley,"God, Process, Being"
"Be truthful, nature only sides with truth.",Adolf Loos,"Nature, Only, Sides"
A dog barks when his master is attacked. I would be a coward if I saw that God's truth is attacked and yet would remain silent.,John Calvin,"God, Dog, Coward"
The truth is rarely pure and never simple.,Oscar Wilde,"Simple, Never, Pure"
"Your problem is how you are going to spend this one odd and precious life you have been issued. Whether you're going to spend it trying to look good and creating the illusion that you have power over people and circumstances, or whether you are going to taste it, enjoy it and find out the truth about who you are.",Anne Lamott,"Life, Good, Power"
"The truth. It is a beautiful and terrible thing, and must therefore be treated with great caution.",J. K. Rowling,"Great, Beautiful, Terrible"
There is nothing more deceptive than an obvious fact.,Arthur Conan Doyle,"Nothing, More, Obvious"
My longing for truth was a single prayer.,Edith Stein,"Prayer, Longing, Single"
I tore myself away from the safe comfort of certainties through my love for truth - and truth rewarded me.,Simone de Beauvoir,"Love, Myself, Comfort"
The truth is more important than the facts.,Frank Lloyd Wright,"Facts, Important, Truth Is"
"Every truth has two sides; it is as well to look at both, before we commit ourselves to either.",Aesop,"Look, Well, Two"
Adversity is the first path to truth.,Lord Byron,"Adversity, Path, First"
Truth sits upon the lips of dying men.,Matthew Arnold,"Men, Lips, Dying"
All great truths begin as blasphemies.,George Bernard Shaw,"Great, Begin, Truths"
In a time of universal deceit - telling the truth is a revolutionary act.,Unknown,"Time, Act, Telling The Truth"
"Only enemies speak the truth; friends and lovers lie endlessly, caught in the web of duty.",Stephen King,"Lie, Duty, Enemies"
"Truth is stranger than fiction, but it is because Fiction is obliged to stick to possibilities; Truth isn't.",Mark Twain,"Stranger, Possibilities, Truth Is"
What is truth? Truth doesn't really exist. Who is going to judge whether my experience of an incident is more valid than yours? No one can be trusted to be the judge of that.,Tracey Emin,"Experience, Judge, Exist"
"The opposite of a fact is falsehood, but the opposite of one profound truth may very well be another profound truth.",Niels Bohr,"May, Well, Opposite"
"Plato is dear to me, but dearer still is truth.",Aristotle,"Me, Still, Dear"
A truth that's told with bad intent beats all the lies you can invent.,William Blake,"Bad, Lies, Intent"
There are some people so addicted to exaggeration that they can't tell the truth without lying.,Josh Billings,"People, Some People, Tell"
"Peace if possible, truth at all costs.",Martin Luther,"Peace, Possible, Costs"
"An error does not become truth by reason of multiplied propagation, nor does truth become error because nobody sees it.",Mahatma Gandhi,"Nobody, Reason, Become"
"Truth, like gold, is to be obtained not by its growth, but by washing away from it all that is not gold.",Leo Tolstoy,"Growth, Gold, Like"
"I believe that unarmed truth and unconditional love will have the final word in reality. This is why right, temporarily defeated, is stronger than evil triumphant.","Martin Luther King, Jr.","Love, Believe, Reality"
"Truth is strong, and sometime or other will prevail.",Mary Astell,"Will, Strong, Prevail"
"I am the Way, the Truth, and the Life. No one comes to the Father except through me.",Jesus Christ,"Life, I Am, Me"
Facts are stubborn things.,Ronald Reagan,"Facts, Stubborn, Things"
All the truth in the world adds up to one big lie.,Bob Dylan,"World, Lie, Big"
"Tell me I'm clever, Tell me I'm kind, Tell me I'm talented, Tell me I'm cute, Tell me I'm sensitive, Graceful and wise, Tell me I'm perfect - But tell me the truth.",Shel Silverstein,"Wise, Me, Perfect"
A lie which is half a truth is ever the blackest of lies.,Alfred Lord Tennyson,"Lie, Half, Truth Is"
"If you shut up truth, and bury it underground, it will but grow.",Emile Zola,"Grow, Will, Shut Up"
"In matters of truth and justice, there is no difference between large and small problems, for issues concerning the treatment of people are all the same.",Albert Einstein,"Justice, Problems, People"
"Truth makes on the ocean of nature no one track of light; every eye, looking on, finds its own.",Edward G. Bulwer-Lytton,"Nature, Light, Own"
Doubt is the incentive to truth and inquiry leads the way.,Hosea Ballou,"Way, Doubt, Incentive"
The absurd is the essential concept and the first truth.,Albert Camus,"First, Absurd, Essential"
Cynicism is an unpleasant way of saying the truth.,Lillian Hellman,"Way, Saying, Cynicism"
"The great enemy of the truth is very often not the lie, deliberate, contrived and dishonest, but the myth, persistent, persuasive and unrealistic.",John F. Kennedy,"Great, Lie, Enemy"
"My mother taught me that when you stand in the truth and someone tells a lie about you, don't fight it.",Whitney Houston,"Fight, Lie, Me"
"If I'd written all the truth I knew for the past ten years, about 600 people - including me - would be rotting in prison cells from Rio to Seattle today. Absolute truth is a very rare and dangerous commodity in the context of professional journalism.",Hunter S. Thompson,"Today, Journalism, Past"
Any truth is better than indefinite doubt.,Arthur Conan Doyle,"Better, Doubt, Truth Is"
It's no wonder that truth is stranger than fiction. Fiction has to make sense.,Mark Twain,"Stranger, Wonder, Make"
The truth of the matter is that you always know the right thing to do. The hard part is doing it.,Robert H. Schuller,"Always, The Right Thing, Doing"
"Truth is beautiful, without doubt; but so are lies.",Ralph Waldo Emerson,"Beautiful, Doubt, Truth Is"
"There are only two mistakes one can make along the road to truth; not going all the way, and not starting.",Buddha,"Road, Way, Mistakes"
Learn what is true in order to do what is right.,Thomas Huxley,"True, Right, Order"
"Truth can be stated in a thousand different ways, yet each one can be true.",Swami Vivekananda,"True, Be True, Different"
"I am bound to tell what I am told, but not in every case to believe it.",Herodotus,"Believe, I Am, Tell"
The earth is supported by the power of truth; it is the power of truth that makes the sun shine and the winds blow; indeed all things rest upon truth.,Chanakya,"Power, Sun, Rest"
"All credibility, all good conscience, all evidence of truth come only from the senses.",Friedrich Nietzsche,"Good, Conscience, Only"
Whatever satisfies the soul is truth.,Walt Whitman,"Soul, Whatever, Satisfies"
Half a truth is often a great lie.,Benjamin Franklin,"Great, Lie, Half"
The pursuit of truth will set you free; even if you never catch up with it.,Clarence Darrow,"Free, Will, Never"
"Fear is not in the habit of speaking truth; when perfect sincerity is expected, perfect freedom must be allowed; nor has anyone who is apt to be angry when he hears the truth any cause to wonder that he does not hear it.",Tacitus,"Freedom, Fear, Angry"
Light is the symbol of truth.,James Russell Lowell,"Light, Symbol"
Truth is not only violated by falsehood; it may be equally outraged by silence.,Henri Frederic Amiel,"Silence, May, Truth Is"
A taste for truth at any cost is a passion which spares nothing.,Albert Camus,"Passion, Nothing, Taste"
"Truth is tough. It will not break, like a bubble, at a touch; nay, you may kick it about all day like a football, and it will be round and full at evening.","Oliver Wendell Holmes, Sr.","Football, Day, Evening"
"We all know that Art is not truth. Art is a lie that makes us realize the truth, at least the truth that is given to us to understand.",Pablo Picasso,"Art, Lie, Know"
Whatever has happened in my quest for innovation has been part of my quest for immaculate reality.,George Lucas,"Reality, Innovation, Whatever"
"Sure I think it is healthy to speak the truth, and be who you are, and be proud of that.",Nathan Lane,"Proud, Speak, Think"
"Our duty is to encourage every one in his struggle to live up to his own highest idea, and strive at the same time to make the ideal as near as possible to the Truth.",Swami Vivekananda,"Time, Struggle, Duty"
Silence is the mother of truth.,Benjamin Disraeli,"Silence, Mother"
What the imagination seizes as beauty must be truth.,John Keats,"Beauty, Imagination, Must"
There are only two people who can tell you the truth about yourself - an enemy who has lost his temper and a friend who loves you dearly.,Antisthenes,"Yourself, Lost, Enemy"
Truth is the most valuable thing we have. Let us economize it.,Mark Twain,"Us, Truth Is, Valuable"
"Truth is by nature self-evident. As soon as you remove the cobwebs of ignorance that surround it, it shines clear.",Mahatma Gandhi,"Nature, Ignorance, Truth Is"
Truth is so rare that it is delightful to tell it.,Emily Dickinson,"Rare, Tell, Truth Is"
"For my part, whatever anguish of spirit it may cost, I am willing to know the whole truth; to know the worst and provide for it.",Patrick Henry,"I Am, Know, Worst"
Hard times arouse an instinctive desire for authenticity.,Coco Chanel,"Desire, Hard, Authenticity"
Truth is a deep kindness that teaches us to be content in our everyday life and share with the people the same happiness.,Khalil Gibran,"Life, Happiness, Kindness"
When in doubt tell the truth.,Mark Twain,"When In Doubt, Doubt, Tell"
Tell the children the truth.,Bob Marley,"Children, Tell"
"If you are out to describe the truth, leave elegance to the tailor.",Albert Einstein,"Tailor, Elegance, Leave"
"Facts are many, but the truth is one.",Rabindranath Tagore,"Facts, Truth Is, Many"
The water in a vessel is sparkling; the water in the sea is dark. The small truth has words which are clear; the great truth has great silence.,Rabindranath Tagore,"Great, Silence, Water"
"If any man seeks for greatness, let him forget greatness and ask for truth, and he will find both.",Horace Mann,"Man, Greatness, Will"
Truth is weirder than any fiction I've seen.,Hunter S. Thompson,"Truth Is, Seen, Fiction"
"Rebellion without truth is like spring in a bleak, arid desert.",Khalil Gibran,"Spring, Rebellion, Desert"
It becomes more necessary to see the truth as it is if you realize that the only vehicle for change are these people who have lost their personality.,Steven Biko,"Change, Personality, Lost"
Anyone who doesn't take truth seriously in small matters cannot be trusted in large ones either.,Albert Einstein,"Matters, Seriously, Cannot"
The words of truth are always paradoxical.,Lao Tzu,"Always, Words, Paradoxical"
Truth disappears with the telling of it.,Lawrence Durrell,"Disappears, Telling"
The universe is transformation: life is opinion.,Marcus Aurelius,"Life, Universe, Transformation"
"I always felt that a scientist owes the world only one thing, and that is the truth as he sees it.",Hans Eysenck,"Always, World, Only"
"Truth is always served by great minds, even if they fight it.",Jean Rostand,"Great, Always, Fight"
Sincerity is moral truth.,George Henry Lewes,"Sincerity, Moral"
Live truth instead of professing it.,Elbert Hubbard,"Live, Professing, Instead"
Gossip needn't be false to be evil - there's a lot of truth that shouldn't be passed around.,Frank A. Clark,"Evil, Gossip, False"
Reason is the natural order of truth; but imagination is the organ of meaning.,C. S. Lewis,"Imagination, Reason, Meaning"
"There is another old poet whose name I do not now remember who said, 'Truth is the daughter of Time.'",Abraham Lincoln,"Time, Remember, Name"
There are certain persons for whom pure Truth is a poison.,Andre Maurois,"Pure, Poison, Truth Is"
Virtue is the fount whence honour springs.,Christopher Marlowe,"Virtue, Honour, Whence"
Gossip is called gossip because it's not always the truth.,Justin Timberlake,"Always, Gossip, Because"
Truth is something which can't be told in a few words. Those who simplify the universe only reduce the expansion of its meaning.,Anais Nin,"Universe, Words, Meaning"
"Experience has shown, and a true philosophy will always show, that a vast, perhaps the larger portion of the truth arises from the seemingly irrelevant.",Edgar Allan Poe,"Experience, Always, Will"
"It is the nature of truth in general, as of some ores in particular, to be richest when most superficial.",Edgar Allan Poe,"Nature, General, Superficial"
"Tell the truth, but tell it slant.",Emily Dickinson,"Tell, Slant"
"I maintain that Truth is a pathless land, and you cannot approach it by any path whatsoever, by any religion, by any sect.",Jiddu Krishnamurti,"Religion, Path, Land"
"Scientific truth is marvelous, but moral truth is divine and whoever breathes its air and walks by its light has found the lost paradise.",Horace Mann,"Light, Lost, Paradise"
"Human love has little regard for the truth. It makes the truth relative, since nothing, not even the truth, must come between it and the beloved person.",Dietrich Bonhoeffer,"Love, Nothing, Person"
"Truth gets well if she is run over by a locomotive, while error dies of lockjaw if she scratches her finger.",William Cullen Bryant,"Well, She, Finger"
"I preach there are all kinds of truth, your truth and somebody else's. But behind all of them there is only one truth and that is that there's no truth.",Flannery O'Connor,"Your, Behind, Only"
Truth is a tendency.,R. Buckminster Fuller,"Truth Is, Tendency"
All fixed set patterns are incapable of adaptability or pliability. The truth is outside of all fixed patterns.,Bruce Lee,"Outside, Truth Is, Patterns"
Truth is certainly a branch of morality and a very important one to society.,Thomas Jefferson,"Society, Morality, Important"
The truth needs so little rehearsal.,Barbara Kingsolver,"Needs, Rehearsal, Little"
The sad truth is that excellence makes people nervous.,Shana Alexander,"Sad, Excellence, People"
"The stupid believe that to be truthful is easy; only the artist, the great artist, knows how difficult it is.",Willa Cather,"Great, Stupid, Believe"
Truth is stranger than fiction; fiction has to make sense.,Leo Rosten,"Stranger, Make, Truth Is"
Nobody speaks the truth when there is something they must have.,Elizabeth Bowen,"Nobody, Something, Must"
"In the last few years, the very idea of telling the truth, the whole truth, and nothing but the truth is dredged up only as a final resort when the alternative options of deception, threat and bribery have all been exhausted.",Michael Musto,"Nothing, Deception, Telling The Truth"
"No one ever tells us the truth, even those we love.",Anna Held,"Love, Us, Even"
"I'm for truth, no matter who tells it. I'm for justice, no matter who it's for or against.",Malcolm X,"Justice, Matter, Who"
The intuition of free will gives us the truth.,Corliss Lamont,"Free, Will, Free Will"
"The truth is you don't know what is going to happen tomorrow. Life is a crazy ride, and nothing is guaranteed.",Eminem,"Life, Tomorrow, Ride"
Truth is powerful and it prevails.,Sojourner Truth,"Power, Truth Is, Powerful"
A lie can travel half way around the world while the truth is putting on its shoes.,Charles Spurgeon,"Trust, Travel, World"
"For every good reason there is to lie, there is a better reason to tell the truth.",Bo Bennett,"Good, Trust, Better"
"I do not know what I may appear to the world, but to myself I seem to have been only like a boy playing on the seashore, and diverting myself in now and then finding a smoother pebble or a prettier shell than ordinary, whilst the great ocean of truth lay all undiscovered before me.",Isaac Newton,"Trust, Great, Myself"
"The truth does not require a majority to prevail, ladies and gentlemen. The truth is its own power. The truth will out. Never forget that.",Rush Limbaugh,"Power, Never Forget, Will"
"There really can be no peace without justice. There can be no justice without truth. And there can be no truth, unless someone rises up to tell you the truth.",Louis Farrakhan,"Peace, Justice, Someone"
"The truth is, we all face hardships of some kind, and you never know the struggles a person is going through. Behind every smile, there's a story of a personal struggle.",Adrienne C. Moore,"Smile, Struggle, Face"
We learned about honesty and integrity - that the truth matters... that you don't take shortcuts or play by your own set of rules... and success doesn't count unless you earn it fair and square.,Michelle Obama,"Success, Learning, Your"
"We curate our lives around this perceived sense of perfection, because we get rewarded in these short term signals: Hearts, likes, thumbs up. We conflate that with value, and we conflate it with truth, and instead, what it really is is fake, brittle popularity that's short term and leaves you even more vacant and empty before you did it.",Chamath Palihapitiya,"Perfection, Value, Fake"
To be afraid is to behave as if the truth were not true.,Bayard Rustin,"True, Afraid, Behave"
"Let us dream of tomorrow where we can truly love from the soul, and know love as the ultimate truth at the heart of all creation.",Michael Jackson,"Inspirational, Love, Tomorrow"
The poet is a liar who always speaks the truth.,Jean Cocteau,"Poetry, Always, Liar"
"I am the Doctor of Democracy. I am America's Truth Detector. And as the Doctor of Democracy, the deal you have with your doctor isn't changing. You get to keep your doctor. You get to keep your plan. You get to keep your station. Nothing's changing, and it really never was gonna change.",Rush Limbaugh,"Change, Democracy, Your"
There is no truth. There is only perception.,Gustave Flaubert,"Perception, Only"
"There's nothing so kingly as kindness, and nothing so royal as truth.",Alice Cary,"Kindness, Nothing, Royal"
I can prove anything by statistics except the truth.,George Canning,"I Can, Prove, Statistics"
I had purpose in my heart that I would stand up for the truth regardless of what I might lose in life.,Israel Folau,"Life, Heart, Lose"
Hinduism's basic tenet is that many roads exist by which men have pursued and still pursue their quest for the truth and that none has universal validity.,Kenneth Scott Latourette,"Men, Roads, Exist"
"To live in the light of a new day and an unimaginable and unpredictable future, you must become fully present to a deeper truth - not a truth from your head, but a truth from your heart; not a truth from your ego, but a truth from the highest source.",Debbie Ford,"Future, Heart, Light"
Truth is everybody is going to hurt you: you just gotta find the ones worth suffering for.,Bob Marley,"Relationship, Suffering, Find"
The truth does not change according to our ability to stomach it.,Flannery O'Connor,"Change, Ability, Stomach"
"Peace is the beauty of life. It is sunshine. It is the smile of a child, the love of a mother, the joy of a father, the togetherness of a family. It is the advancement of man, the victory of a just cause, the triumph of truth.",Menachem Begin,"Life, Love, Smile"
The truth of the matter is that you always know the right thing to do. The hard part is doing it.,Norman Schwarzkopf,"Always, The Right Thing, Doing"
"Honesty is more than not lying. It is truth telling, truth speaking, truth living, and truth loving.",James E. Faust,"Honesty, Living, Loving"
"The truth is, no one of us can be free until everybody is free.",Maya Angelou,"Free, Us, Truth Is"
"Science, my lad, is made up of mistakes, but they are mistakes which it is useful to make, because they lead little by little to the truth.",Jules Verne,"Science, Mistakes, Make"
"Belief is a wise wager. Granted that faith cannot be proved, what harm will come to you if you gamble on its truth and it proves false? If you gain, you gain all; if you lose, you lose nothing. Wager, then, without hesitation, that He exists.",Blaise Pascal,"Faith, Wise, Lose"
"The truth is: Belonging starts with self-acceptance. Your level of belonging, in fact, can never be greater than your level of self-acceptance, because believing that you're enough is what gives you the courage to be authentic, vulnerable and imperfect.",Brene Brown,"Courage, Your, Enough"
