title,author,tags
"Always keep your mind as bright and clear as the vast sky, the great ocean, and the highest peak, empty of all thoughts. Always keep your body filled with light and heat. Fill yourself with the power of wisdom and enlightenment.",Morihei Ueshiba,"Power, Great, Always"
"Year's end is neither an end nor a beginning but a going on, with all the wisdom that experience can instill in us.",Hal Borland,"Experience, New Year's, Beginning"
"The arts, quite simply, nourish the soul. They sustain, comfort, inspire. There is nothing like that exquisite moment when you first discover the beauty of connecting with others in celebration of larger ideals and shared wisdom.",Gordon Gee,"Beauty, Moment, Soul"
Our happiness depends on wisdom all the way.,Sophocles,"Happiness, Way, Depends"
"I think that music opens portals and doorways into unknown sectors that it takes courage to leap into. I always think that there's a potential that we all have, and we can emerge, rise up to this potential, when necessary. We have to be fearless, courageous, and draw upon wisdom that we think we don't have.",Wayne Shorter,"Courage, Music, Always"
"For the men and women of the FBI, bravery is reflected not only in the physical courage often necessary in the job. It can be seen in the courage of conviction, in the courage to act with wisdom in the face of fear, and in the courage it takes to admit mistakes and move forward.",Robert Mueller,"Courage, Women, Men"
Silence is the sleep that nourishes wisdom.,Francis Bacon,"Silence, Sleep, Nourishes"
"The more I draw and write, the more I realise that accidents are a necessary part of any creative act, much more so than logic or wisdom. Sometimes a mistake is the only way of arriving at an original concept, and the history of successful inventions is full of mishaps, serendipity and unintended results.",Shaun Tan,"History, Mistake, Way"
"Know what's important and what isn't. Have the wisdom to know the right thing to do, the integrity to do it, the character to stand up to those who don't, and the courage to stop those who won't.",Mark Goulston,"Courage, Character, Integrity"
"Fear is the main source of superstition, and one of the main sources of cruelty. To conquer fear is the beginning of wisdom.",Bertrand Russell,"Fear, Conquer, Beginning"
"The key to wisdom is this - constant and frequent questioning, for by doubting we are led to question and by questioning we arrive at the truth.",Peter Abelard,"Truth, Key, Questioning"
"America still has a race problem, though not the one that conventional wisdom would suggest: the racism of whites toward blacks. Old fashioned white racism has lost its legitimacy in the world and become an almost universal disgrace.",Shelby Steele,"World, Racism, Lost"
Not by age but by capacity is wisdom acquired.,Plautus,"Age, Capacity, Acquired"
Wisdom is oftentimes nearer when we stoop than when we soar.,William Wordsworth,"Soar, Than, Stoop"
"Our great power does not mean we can do whatever we want whenever we want, nor should we assume we have all the wisdom and knowledge necessary to succeed.",John McCain,"Knowledge, Power, Great"
"The wisdom of the wise, and the experience of ages, may be preserved by quotation.",Isaac D'Israeli,"Experience, Wise, May"
"We learn wisdom from failure much more than from success. We often discover what will do, by finding out what will not do; and probably he who never made a mistake never made a discovery.",Samuel Smiles,"Success, Failure, Mistake"
We can be knowledgable with other men's knowledge but we cannot be wise with other men's wisdom.,Michel de Montaigne,"Knowledge, Men, Wise"
The stupidity of people comes from having an answer for everything. The wisdom of the novel comes from having a question for everything.,Milan Kundera,"Stupidity, People, Everything"
"After many years of great mercy, after tasting of the powers of the world to come, we still are so weak, so foolish; but, oh! when we get away from self to God, there all is truth and purity and holiness, and our heart finds peace, wisdom, completeness, delight, joy, victory.",Charles Spurgeon,"God, Truth, Peace"
"People usually compare the computer to the head of the human being. I would say that hardware is the bone of the head, the skull. The semiconductor is the brain within the head. The software is the wisdom. And data is the knowledge.",Masayoshi Son,"Knowledge, Brain, People"
"Grief can be the garden of compassion. If you keep your heart open through everything, your pain can become your greatest ally in your life's search for love and wisdom.",Rumi,"Life, Love, Pain"
"The philosophy of life is this: Life is not a struggle, not a tension... Life is bliss. It is eternal wisdom, eternal existence.",Maharishi Mahesh Yogi,"Life, Struggle, Tension"
"If we continue to develop our technology without wisdom or prudence, our servant may prove to be our executioner.",Omar N. Bradley,"Technology, Continue, Prove"
To make no mistakes is not in the power of man; but from their errors and mistakes the wise and good learn wisdom for the future.,Plutarch,"Future, Good, Power"
"I acknowledge the privilege of being alive in a human body at this moment, endowed with senses, memories, emotions, thoughts, and the space of mind in its wisdom aspect.",Alex Grey,"Space, Memories, Thoughts"
"My aim, then, was to whip the rebels, to humble their pride, to follow them to their inmost recesses, and make them fear and dread us. Fear is the beginning of wisdom.",William Tecumseh Sherman,"Fear, Humble, Aim"
"True wisdom is less presuming than folly. The wise man doubteth often, and changeth his mind; the fool is obstinate, and doubteth not; he knoweth all things but his own ignorance.",Akhenaton,"Wise, Fool, Man"
"Music is your own experience, your own thoughts, your wisdom.",Charlie Parker,"Experience, Music, Thoughts"
Swim upstream. Go the other way. Ignore the conventional wisdom.,Sam Walton,"Way, Ignore, Go"
Let no one be slow to seek wisdom when he is young nor weary in the search of it when he has grown old. For no age is too early or too late for the health of the soul.,Epicurus,"Health, Age, Soul"
"The hours of folly are measured by the clock; but of wisdom, no clock can measure.",William Blake,"Clock, Measure, Folly"
"It is the province of knowledge to speak, and it is the privilege of wisdom to listen.","Oliver Wendell Holmes, Sr.","Knowledge, Speak, Privilege"
I have studied many philosophers and many cats. The wisdom of cats is infinitely superior.,Hippolyte Taine,"Pet, Cats, Superior"
"Sometimes I am happy and sometimes not. I am, after all, a human being, you know. And I am glad that we are sometimes happy and sometimes not. You get your wisdom working by having different emotions.",Yoko Ono,"Your, I Am Happy, I Am"
"Besides the noble art of getting things done, there is the noble art of leaving things undone. The wisdom of life consists in the elimination of non-essentials.",Lin Yutang,"Life, Art, Done"
"The more tranquil a man becomes, the greater is his success, his influence, his power for good. Calmness of mind is one of the beautiful jewels of wisdom.",James Allen,"Success, Good, Power"
Wisdom is knowing when you can't be wise.,Paul Engle,"Wise, Knowing, You"
"In life, all good things come hard, but wisdom is the hardest to come by.",Lucille Ball,"Life, Good, Good Things"
"The Gross National Product measures neither our wit nor our courage, neither our wisdom nor our learning, neither our compassion nor our devotion to our country. It measures everything, in short, except that which makes life worthwhile, and it can tell us everything about America - except whether we are proud to be Americans.",Robert Kennedy,"Life, Courage, Learning"
The most certain sign of wisdom is cheerfulness.,Michel de Montaigne,"Sign, Cheerfulness, Most"
"A good memory is surely a compost heap that converts experience to wisdom, creativity, or dottiness; not that these things are of much earthly value, but at least they may keep you amused when the world is keeping you locked away or shutting you out.",Michael Leunig,"Good, Experience, Value"
"Why would anyone walk through life satisfied with the light from the candle of their own understanding when, by reaching out to our Heavenly Father, they could experience the bright sun of spiritual knowledge that would expand their minds with wisdom and fill their souls with joy?",Dieter F. Uchtdorf,"Life, Knowledge, Experience"
That which seems the height of absurdity in one generation often becomes the height of wisdom in another.,Adlai Stevenson I,"Generation, Height, Absurdity"
"Community organizing is all about building grassroots support. It's about identifying the people around you with whom you can create a common, passionate cause. And it's about ignoring the conventional wisdom of company politics and instead playing the game by very different rules.",Tom Peters,"Politics, Community, Game"
Experiences are savings which a miser puts aside. Wisdom is an inheritance which a wastrel cannot exhaust.,Karl Kraus,"Experience, Inheritance, Cannot"
Start with God - the first step in learning is bowing down to God; only fools thumb their noses at such wisdom and learning.,King Solomon,"God, Learning, Step"
The all-seeing eye of God beheld our deplorable state; infinite pity touched the heart of the Father of mercies; and infinite wisdom laid the plan of our recovery.,David Brainerd,"God, Moving On, Heart"
"It's a horrible idea that God, this paragon of wisdom and knowledge, power, couldn't think of a better way to forgive us our sins than to come down to Earth in his alter ego as his son and have himself hideously tortured and executed so that he could forgive himself.",Richard Dawkins,"God, Knowledge, Power"
"Where there is charity and wisdom, there is neither fear nor ignorance.",Francis of Assisi,"Fear, Ignorance, Charity"
"To know how to grow old is the master work of wisdom, and one of the most difficult chapters in the great art of living.",Herman Melville,"Work, Art, Great"
My past is my wisdom to use today... my future is my wisdom yet to experience. Be in the present because that is where life resides.,Gene Oliver,"Life, Future, Experience"
"To enjoy good health, to bring true happiness to one's family, to bring peace to all, one must first discipline and control one's own mind. If a man can control his mind he can find the way to Enlightenment, and all wisdom and virtue will naturally come to him.",Buddha,"Happiness, Health, Family"
"Hurricane Katrina overwhelmed levees and exploded the conventional wisdom about a shared American prosperity, exposing a group of people so poor they didn't have $50 for a bus ticket out of town. If we want to learn something from this disaster, the lesson ought to be: America's poor deserve better than this.",Michael Eric Dyson,"Better, Disaster, Poor"
"Losing faith in your own singularity is the start of wisdom, I suppose; also the first announcement of death.",Peter Conrad,"Faith, Death, Your"
The sum of wisdom is that time is never lost that is devoted to work.,Ralph Waldo Emerson,"Work, Time, Lost"
"No party has a monopoly on wisdom. No democracy works without compromise. But when Governor Romney and his allies in Congress tell us we can somehow lower our deficit by spending trillions more on new tax breaks for the wealthy - well, you do the math. I refuse to go along with that. And as long as I'm President, I never will.",Barack Obama,"Democracy, Long, Will"
Wisdom comes from within. Knowledge is acquired and can sometimes put a screen on your wisdom.,A. R. Rahman,"Knowledge, Your, Sometimes"
"Imagination allows us to escape the predictable. It enables us to reply to the common wisdom that we cannot soar by saying, 'Just watch!'",Bill Bradley,"Imagination, Escape, Soar"
"Clearly older women and especially older women who have led an active life or elder women who successfully maneuver through their own family life have so much to teach us about sharing, patience, and wisdom.",Alice Walker,"Life, Patience, Family"
"We thought, because we had power, we had wisdom.",Stephen Vincent Benet,"Power, Thought, Because"
"I'm not wise, but the beginning of wisdom is there; it's like relaxing into - and an acceptance of - things.",Tina Turner,"Wise, Acceptance, Beginning"
The wisdom and experience of older people is a resource of inestimable worth. Recognizing and treasuring the contributions of older people is essential to the long-term flourishing of any society.,Daisaku Ikeda,"Experience, Society, People"
"Even when you have doubts, take that step. Take chances. Mistakes are never a failure - they can be turned into wisdom.",Cat Cora,"Failure, Chance, Step"
"The Founding Fathers in their wisdom decided that children were an unnatural strain on parents. So they provided jails called schools, equipped with tortures called an education.",John Updike,"Education, Parents, Children"
"Wisdom cannot come by railroad or automobile or aeroplane, or be hurried up by telegraph or telephone.",John Burroughs,"Railroad, Cannot, Telephone"
The final wisdom of life requires not the annulment of incongruity but the achievement of serenity within and above it.,Reinhold Niebuhr,"Life, Achievement, Serenity"
"America's freedom of religion, and freedom from religion, offers every wisdom tradition an opportunity to address our soul-deep needs: Christianity, Judaism, Islam, Buddhism, Hinduism, secular humanism, agnosticism and atheism among others.",Parker Palmer,"Freedom, Religion, Opportunity"
"The figure a poem makes. It begins in delight and ends in wisdom... in a clarification of life - not necessarily a great clarification, such as sects and cults are founded on, but in a momentary stay against confusion.",Robert Frost,"Life, Great, Confusion"
"Instant, soluble coffee has long been the unspeakable wasteland of the coffee business. Conventional wisdom would be that no premium brand should go near it. But Howard Schultz's vision from day one has been to bring quality coffee to the mass market.",John Quelch,"Business, Vision, Day"
"There are three methods to gaining wisdom. The first is reflection, which is the highest. The second is limitation, which is the easiest. The third is experience, which is the bitterest.",Confucius,"Experience, Reflection, First"
"There is a universal, intelligent, life force that exists within everyone and everything. It resides within each one of us as a deep wisdom, an inner knowing. We can access this wonderful source of knowledge and wisdom through our intuition, an inner sense that tells us what feels right and true for us at any given moment.",Shakti Gawain,"Life, Knowledge, Moment"
"You can only learn so much from books. You can only learn so much from education. Ultimately, it is the wisdom of God that will carry you through in the toughest situations of life.",Ravi Zacharias,"Life, Education, God"
'Star Trek' was an attempt to say humanity will reach maturity and wisdom on the day that it begins not just to tolerate but take a special delight in differences in ideas and differences in lifeforms.,Gene Roddenberry,"Maturity, Day, Humanity"
The function of wisdom is to discriminate between good and evil.,Marcus Tullius Cicero,"Good, Good And Evil, Evil"
Along with success comes a reputation for wisdom.,Euripides,"Success, Reputation, Along"
"For all my education, accomplishments, and so called 'wisdom'... I can't fathom my own heart.",Michael Caine,"Education, Heart, Own"
Has fortune dealt you some bad cards. Then let wisdom make you a good gamester.,Francis Quarles,"Good, Bad, Cards"
"Sometimes you surprise yourself with what you can handle, and if you come out the other end with some wisdom, then it's not such a bad thing.",Boy George,"Yourself, Surprise, Bad"
The world is a diverse place. Nobody has a monopoly on virtue or wisdom.,Lee Hsien Loong,"World, Nobody, Place"
Wisdom is a gift but has nothing to do with age. That was probably the case with me.,Ruby Bridges,"Age, Gift, Me"
"Authority is supposedly grounded in wisdom, but I could see from a very early age that authority was only a system of control. And it didn't have any inherent wisdom. I quickly realized that you either became a power or you were crushed.",Joe Strummer,"Power, Age, Control"
"Wisdom and penetration are the fruit of experience, not the lessons of retirement and leisure. Great necessities call out great virtues.",Abigail Adams,"Experience, Great, Fruit"
"What's different now is that while political leaders used to give talking points to talk radio, now talk-radio hosts are giving talking points to political leaders. It's all part of the suffocating spin cycle we're in. In media, politics and publishing, the conventional wisdom is to play to this base.",John Avlon,"Politics, Political, Media"
"If you have the guts to keep making mistakes, your wisdom and intelligence leap forward with huge momentum.",Holly Near,"Intelligence, Your, Keep"
"In complete darkness, it is only knowledge and wisdom that separates us.",Janet Jackson,"Knowledge, Darkness, Us"
"No one who cooks, cooks alone. Even at her most solitary, a cook in the kitchen is surrounded by generations of cooks past, the advice and menus of cooks present, and the wisdom of cookbook writers.",Laurie Colwin,"Alone, Past, Advice"
The 'Reader's Digest' used to run a feature called 'It Pays to Increase Your Word Power.' The new wisdom - post-Trump and Brexit - is that it doesn't.,Howard Jacobson,"Power, Your, New"
The invariable mark of wisdom is to see the miraculous in the common.,Ralph Waldo Emerson,"See, Mark, Common"
"Wisdom, prudence, forethought, these are essential. But not second to these that noble courage which adventures the right, and leaves the consequences to God.",Robert Dale Owen,"Courage, God, Right"
"What makes Superman a hero is not that he has power, but that he has the wisdom and the maturity to use the power wisely. From an acting point of view, that's how I approached the part.",Christopher Reeve,"Power, Hero, Maturity"
"There is as much wisdom in listening as there is in speaking - and that goes for all relationships, not just romantic ones.",Daniel Dae Kim,"Romantic, Listening, Much"
"I've led a school whose faculty and students examine and discuss and debate every aspect of our law and legal system. And what I've learned most is that no one has a monopoly on truth or wisdom. I've learned that we make progress by listening to each other, across every apparent political or ideological divide.",Elena Kagan,"Truth, Legal, Progress"
To keep your secret is wisdom; but to expect others to keep it is folly.,Samuel Johnson,"Your, Keep, Others"
"Our wisdom comes from our experience, and our experience comes from our foolishness.",Sacha Guitry,"Experience, Foolishness, Our"
"Silence at the proper season is wisdom, and better than any speech.",Plutarch,"Silence, Better, Speech"
Passion without purpose is kind of pointless. I think God gives us the vision and wisdom to help enforce what he sees for us. You don't just sit at home and end up on 'Empire.',BJ the Chicago Kid,"God, Home, Vision"
"But what is liberty without wisdom, and without virtue? It is the greatest of all possible evils; for it is folly, vice, and madness, without tuition or restraint.",Edmund Burke,"Freedom, Liberty, Madness"
"Success is a wonderful thing, but it tends not to be the sort of experience that we learn from. We enjoy it; perhaps we even deserve it. But we don't acquire wisdom from it.",Timothy Noah,"Success, Experience, Deserve"
"If men possessed wisdom, which stands in the same relation to the form of man as the sight to the eye, they would not cause any injury to themselves or to others; for the knowledge of truth removes hatred and quarrels, and prevents mutual injuries.",Maimonides,"Truth, Knowledge, Men"
"Wisdom lies neither in fixity nor in change, but in the dialectic between the two.",Octavio Paz,"Change, Two, Lies"
"But the Wisdom of God, which is His only-begotten Son, being in all respects incapable of change or alteration, and every good quality in Him being essential, and such as cannot be changed and converted, His glory is therefore declared to be pure and sincere.",Origen,"Change, God, Good"
"No one has a monopoly on truth, and science continues to advance. Yesterday's heresies may be tomorrow's conventional wisdom.",Dean Ornish,"Science, Truth, Tomorrow"
"Few people have the wisdom to prefer the criticism that would do them good, to the praise that deceives them.",Francois de La Rochefoucauld,"Good, Praise, People"
Much wisdom often goes with fewest words.,Sophocles,"Words, Much, Often"
"Wisdom is the abstract of the past, but beauty is the promise of the future.","Oliver Wendell Holmes, Sr.","Beauty, Future, Past"
Books are the ever burning lamps of accumulated wisdom.,George William Curtis,"Books, Ever, Burning"
"Wisdom lies neither in fixity nor in change, but in the dialectic between the two. A constant coming and going: wisdom lies in the momentary.",Octavio Paz,"Change, Coming, Two"
Follow your instincts. That's where true wisdom manifests itself.,Oprah Winfrey,"Your, True, Follow"
"A cardinal rule in budgeting and saving is to pay yourself first. Once your paycheck hits your account, wisdom has it that you should move some amount to savings even before you pay the bills.",John Rampton,"Your, Yourself, First"
In wisdom gathered over time I have found that every experience is a form of exploration.,Ansel Adams,"Experience, Time, Brainy"
"If suffering brings wisdom, I would wish to be less wise.",William Butler Yeats,"Wise, Suffering, Wish"
"Without courage, wisdom bears no fruit.",Baltasar Gracian,"Courage, Fruit, Without"
Doubt the conventional wisdom unless you can verify it with reason and experiment.,Steve Albini,"Doubt, Reason, Experiment"
"In your 20s you can be pretty, but you don't accomplish real beauty until you find wisdom and depth.",Evangeline Lilly,"Beauty, Your, Find"
Mistakes are the usual bridge between inexperience and wisdom.,Phyllis Theroux,"Bridge, Mistakes, Between"
"Books should to one of these fours ends conduce, for wisdom, piety, delight, or use.",John Denham,"Use, Delight, Should"
"In world mythology, there are countless examples of tragic characters whose greatest strength is also the source of their undoing. But the ancient Greeks and Romans also held the view that acceptance is the beginning of wisdom.",Simon Van Booy,"Strength, World, View"
"I am a poor student sitting at the feet of giants, yearning for their wisdom and begging for lessons that might one day make me a complete artist, so that if all goes well, I may one day sit beside them.",Rod Taylor,"Day, Feet, I Am"
I don't want to put a pause on the rest of my life; I'm really enjoying getting older and the wisdom that comes from that.,Rosemarie DeWitt,"Life, Getting Older, Rest"
Discipline is wisdom and vice versa.,M. Scott Peck,"Discipline, Vice, Vice Versa"
"The man who makes everything that leads to happiness depends upon himself, and not upon other men, has adopted the very best plan for living happily. This is the man of moderation, the man of manly character and of wisdom.",Plato,"Happiness, Best, Men"
Earthly wisdom is doing what comes naturally. Godly wisdom is doing what the Holy Spirit compels us to do.,Charles Stanley,"Doing, Holy Spirit, Spirit"
Contemplation and wisdom are highest achievements and man is not totally at home with them.,Gabriel Marcel,"Home, Man, Contemplation"
Enraging liberals is simply one of the more enjoyable side effects of my wisdom.,Rush Limbaugh,"More, Side, Simply"
To embrace the whole world in friendship is wisdom. This wisdom is not changeable like the flowers that bloom and fade.,Thiruvalluvar,"Friendship, World, Flowers"
To light one candle to God and another to the Devil is the principle of wisdom.,Jose Bergamin,"God, Candle, Light"
"As you walk in God's divine wisdom, you will surely begin to see a greater measure of victory and good success in your life.",Joseph Prince,"Life, Success, God"
It is unwise to be too sure of one's own wisdom. It is healthy to be reminded that the strongest might weaken and the wisest might err.,Mahatma Gandhi,"Own, Healthy, Sure"
The wisdom acquired with the passage of time is a useless gift unless you share it.,Esther Williams,"Time, Gift, Useless"
"Every one in the world ought to do the things for which he is specially adapted. It is the part of wisdom to recognize what each one of us is best fitted for, and it is the part of education to perfect and utilize such predispositions. Because education can direct and aid nature but can never transform her.",Maria Montessori,"Education, Nature, Best"
"The wisdom of crowds works when the crowd is choosing the price of an ox, when there's a single numeric average. But if it's a design or something that matters, the decision is made by committee, and that's crap. You want people and groups who are able to think thoughts before they share.",Jaron Lanier,"Design, Thoughts, Decision"
"I'll come to you with gifts of knowledge, wisdom and truth.",Barry White,"Truth, Knowledge, Come"
"Perhaps religious conscience upsets the designs of those who feel that the highest wisdom and authority comes from government. But from the beginning, this nation trusted in God, not man. Religious liberty is the first freedom in our Constitution.",Mitt Romney,"God, Freedom, Government"
"Knowledge is not just the preserve of the educated elite. Just because someone has not had a formal education, that does not mean he does not have wisdom and common sense.",Vikas Swarup,"Education, Knowledge, Common Sense"
Knowledge without justice ought to be called cunning rather than wisdom.,Plato,"Knowledge, Justice, Cunning"
Life is the only real counselor; wisdom unfiltered through personal experience does not become a part of the moral tissue.,Edith Wharton,"Life, Experience, Real"
