title,author,tags
I have seen life from the top down and the bottom up. I know how it looks both ways. And I know there is wisdom and that there is hope.,L. Ron Hubbard,"Life, Hope, Know"
"Those who improve with age embrace the power of personal growth and personal achievement and begin to replace youth with wisdom, innocence with understanding, and lack of purpose with self-actualization.",Bo Bennett,"Power, Age, Growth"
"Since human wisdom cannot secure us from accidents, it is the greatest effort of reason to bear them well.",John Paul Jones,"Effort, Accidents, Reason"
We are to seek wisdom and understanding only in the length of days.,Robert Hall,"Life, Understanding, Only"
"They must often change, who would be constant in happiness or wisdom.",Confucius,"Happiness, Change, Must"
"We live in a society bloated with data yet starved for wisdom. We're connected 24/7, yet anxiety, fear, depression and loneliness is at an all-time high. We must course-correct.",Elizabeth Kapu'uwailani Lindsey,"Society, Fear, Loneliness"
"To know one's self is wisdom, but not to know one's neighbors is genius.",Minna Antrim,"Know, Genius, Self"
Kindness is wisdom.,Philip James Bailey,Kindness
A short saying often contains much wisdom.,Sophocles,"Much, Short, Saying"
"It is essential to employ, trust, and reward those whose perspective, ability, and judgment are radically different from yours. It is also rare, for it requires uncommon humility, tolerance, and wisdom.",Dee Hock,"Leadership, Trust, Humility"
Kisses are a better fate than wisdom.,e. e. cummings,"Valentine's Day, Better, Fate"
Wisdom and knowledge are the most valuable things in the body.,Masayoshi Son,"Knowledge, Body, Things"
"The philosophies of one age have become the absurdities of the next, and the foolishness of yesterday has become the wisdom of tomorrow.",William Osler,"Age, Tomorrow, Yesterday"
There's no way in hell I could have achieved what I have without being a good student and listening to the wisdom of others who have been doing this a lot longer than I have.,Phil Heath,"Good, Hell, Doing"
"They whom truth and wisdom lead, can gather honey from a weed.",William Cowper,"Truth, Honey, Lead"
"No one ever found wisdom without also being a fool. Writers, alas, have to be fools in public, while the rest of the human race can cover its tracks.",Erica Jong,"Fool, Rest, Race"
"If to live is to progress, if you are lucky, from foolishness to wisdom, then to write novels is to broadcast the various stages of your foolishness.",Jane Smiley,"Progress, Your, Live"
"Who knows for what we live, and struggle, and die? Wise men write many books, in words too hard to understand. But this, the purpose of our lives, the end of all our struggle, is beyond all human wisdom.",Alan Paton,"Men, Wise, Struggle"
It is costly wisdom that is bought by experience.,Roger Ascham,"Experience, Bought, Costly"
"The virtue of justice consists in moderation, as regulated by wisdom.",Aristotle,"Justice, Virtue, Moderation"
"The wisdom of the wise and the experience of the ages is preserved into perpetuity by a nation's proverbs, fables, folk sayings and quotations.",William Feather,"Experience, Wise, Nation"
"The seat of knowledge is in the head; of wisdom, in the heart. We are sure to judge wrong, if we do not feel right.",William Hazlitt,"Knowledge, Heart, Feel"
"It used to be, it is accepted scientific wisdom the Earth is flat, and this heretic named Galileo was branded a denier.",Ted Cruz,"Earth, Scientific, Used"
Knowledge is going to make you stronger. Knowledge is going to let you control your life. Knowledge is going to give you the wisdom to teach their children. Knowledge is the thing that makes you smile in the face of disaster.,Avery Brooks,"Life, Smile, Knowledge"
"The United Nations' founders understood that decisions affecting war and peace should happen only by consensus, and with America's consent, the veto by Security Council permanent members was enshrined in the United Nations Charter. The profound wisdom of this has underpinned the stability of international relations for decades.",Vladimir Putin,"War, Peace, America"
"Morality comes with the sad wisdom of age, when the sense of curiosity has withered.",Graham Greene,"Sad, Age, Curiosity"
"In youth and beauty, wisdom is but rare!",Homer,"Beauty, Youth, Rare"
"I think with experience and age, you gain knowledge and wisdom.",Nick Foles,"Knowledge, Experience, Age"
"The first series of 'Open All Hours' came and went without much fanfare because the BBC, in its almighty wisdom, put it out on BBC2, reasoning that it was 'a gentle comedy', better suited to the calms of the second channel than to the noisier, choppier waters of the first.",David Jason,"Better, Gentle, Comedy"
"In my own personal life, God plays a great role in the risk, because I pray before I go into the operating room for every case, and I ask him to give me wisdom, to help me to know what to do - and not only for operating, but for everything.",Ben Carson,"Life, God, Great"
"This land, which we have watered with our tears and our blood, is now our mother country, and we are well satisfied to stay where wisdom abounds and gospel is free.",Richard V. Allen,"Free, Country, Tears"
There's always a miasma of misinformation emerging from the higher education sector as to which are the 'best' courses to take. My advice would always be to ignore the perceived wisdom and look for the most reliable evidence on the ground.,David Puttnam,"Education, Best, Always"
Men who know themselves are no longer fools. They stand on the threshold of the door of Wisdom.,Havelock Ellis,"Men, Stand, Know"
We can't really digest food unless there's hunger. So we can't really assimilate spiritual wisdom unless we feel the need for it.,Radhanath Swami,"Food, Spiritual, Feel"
"At the end of the day, if you're not spanking your child and instilling in them the ideas of selflessness, servitude, and wisdom, you're probably looking at a future P. Diddy in the making (maybe even a Keith Olbermann - take your pick).",Steven Crowder,"Future, Your, Day"
A man may learn wisdom even from a foe.,Aristophanes,"Man, May, Learn"
The hunger for facile wisdom is the root of all false philosophy.,George Santayana,"False, Philosophy, Hunger"
Practical wisdom is what's called for in situations that have a moral dimension to them.,Barry Schwartz,"Moral, Practical, Them"
"I have sympathy for young people, for their growing pains, but I balk when these growing pains are pushed into the foreground, when you make these young people the only vehicles of life's wisdom.",Wislawa Szymborska,"Life, Sympathy, People"
The novelist teaches the reader to comprehend the world as a question. There is wisdom and tolerance in that attitude. In a world built on sacrosanct certainties the novel is dead.,Milan Kundera,"Attitude, World, Tolerance"
"The Divine of the Lord in heaven is love, for the reason that love is receptive of all things of heaven, such as peace, intelligence, wisdom and happiness.",Emanuel Swedenborg,"Love, Happiness, Intelligence"
Magnanimity in politics is not seldom the truest wisdom; and a great empire and little minds go ill together.,Edmund Burke,"Politics, Great, Together"
"There is a particular set of values commonly associated with being professional. Experience, expertise, trustworthiness, wisdom, and good judgement are all attributes aspired to by senior professional people, be they doctors, engineers, lawyers, civil servants, or the clergy.",Mark Walport,"Good, Experience, People"
"Age does not bring you wisdom, age brings you wrinkles.",Estelle Getty,"Age, Wrinkles, Bring"
There is a trade off - as you grow older you gain wisdom but you lose spontaneity.,Kenny Rogers,"Lose, Grow, Gain"
"Wisdom is nothing but a preparation of the soul, a capacity, a secret art of thinking, feeling and breathing thoughts of unity at every moment of life.",Hermann Hesse,"Life, Art, Thoughts"
"The war... was an unnecessary condition of affairs, and might have been avoided if forebearance and wisdom had been practiced on both sides.",Robert E. Lee,"War, Sides, Unnecessary"
"Cultures have long heard wisdom in non-human voices: Apollo, god of music, medicine and knowledge, came to Delphi in the form of a dolphin. But dolphins, which fill the oceans with blipping and chirping, and whales, which mew and caw in ultramarine jazz - a true rhapsody in blue - are hunted to the edge of silence.",Jay Griffiths,"God, Knowledge, Music"
To profit from good advice requires more wisdom than to give it.,Wilson Mizner,"Good, Advice, Profit"
"You know, many people have said that I'm on the edge and I'm maverick for some of the big operations that I've done. I'm not at all. I pray; I ask God to give me wisdom, 'Should I do it?', guidance in terms of how to do it, who to consult with. All those kind of things are incredibly important.",Ben Carson,"God, Done, Me"
We have no words for speaking of wisdom to the stupid. He who understands the wise is wise already.,Georg C. Lichtenberg,"Stupid, Wise, Words"
"Most things break, including hearts. The lessons of life amount not to wisdom, but to scar tissue and callus.",Wallace Stegner,"Life, Things, Tissue"
"The gateways to wisdom and learning are always open, and more and more I am choosing to walk through them. Barriers, blocks, obstacles, and problems are personal teachers giving me the opportunity to move out of the past and into the Totality of Possibilities.",Louise L. Hay,"Learning, Always, Walk"
"It doesn't matter how much wisdom you have. If you don't have position, you have nothing. That's the tragedy of India.",Rahul Gandhi,"Nothing, Matter, Tragedy"
Strength and wisdom are not opposing values.,William J. Clinton,"Strength, Values, Opposing"
"The clouds may drop down titles and estates, and wealth may seek us, but wisdom must be sought.",Edward Young,"Clouds, Wealth, Down"
Who in their infinite wisdom decreed that Little League uniforms be white? Certainly not a mother.,Erma Bombeck,"Mom, White, Mother"
"Great wisdom is generous; petty wisdom is contentious. Great speech is impassioned, small speech cantankerous.",Zhuangzi,"Great, Petty, Speech"
"I find that to be a fool as to worldly wisdom, and to commit my cause to God, not fearing to offend men, who take offence at the simplicity of truth, is the only way to remain unmoved at the sentiments of others.",John Woolman,"God, Truth, Men"
"Christian, learn from Christ how you ought to love Christ. Learn a love that is tender, wise, strong; love with tenderness, not passion, wisdom, not foolishness, and strength, lest you become weary and turn away from the love of the Lord.",Saint Bernard,"Love, Strength, Wise"
"Teach your children poetry; it opens the mind, lends grace to wisdom and makes the heroic virtues hereditary.",Walter Scott,"Poetry, Your, Grace"
"During the long process of history, by relying on our own diligence, courage and wisdom, Chinese people have opened up a good and beautiful home where all ethnic groups live in harmony and fostered an excellent culture that never fades.",Xi Jinping,"Courage, Good, History"
"Being a survivor doesn't mean being strong - it's telling people when you need a meal or a ride, company, whatever. It's paying attention to heart wisdom, feelings, not living a role, but having a unique, authentic life, having something to contribute, finding time to love and laugh. All these things are qualities of survivors.",Bernie Siegel,"Life, Love, Time"
"Nobility of spirit has more to do with simplicity than ostentation, wisdom rather than wealth, commitment rather than ambition.",Riccardo Muti,"Ambition, Wealth, Commitment"
"The art of storytelling is reaching its end because the epic side of truth, wisdom, is dying out.",Walter Benjamin,"Truth, Art, End"
Words of wisdom are spoken by children at least as often as scientists.,James Newman,"Words, Children, Often"
It's time to listen to the stories of the Indigenous; we are blessed as a country to look to the wisdom of a really old country.,Gord Downie,"Time, Look, Blessed"
"Many sophisticated, intelligent people lack wisdom and common sense.",Joyce Meyer,"People, Common Sense, Intelligent"
"A thought transfixed me: for the first time in my life, I saw the truth as it is set into song by so many poets, proclaimed as the final wisdom by so many thinkers. The truth - that love is the ultimate and the highest goal to which man can aspire.",Viktor E. Frankl,"Life, Love, Truth"
The enemy of the conventional wisdom is not ideas but the march of events.,John Kenneth Galbraith,"March, Ideas, Enemy"
"I hope our wisdom will grow with our power, and teach us, that the less we use our power the greater it will be.",Thomas Jefferson,"Hope, Power, Grow"
"Bankruptcy, divorce, these are feathers in my cap, I suppose. I have a wisdom which has been born from these things.",Chris Eubank Sr.,"Born, Feathers, Cap"
Knowledge shrinks as wisdom grows.,Alfred North Whitehead,"Knowledge, Grows, Shrinks"
Wisdom oft times consists of knowing what to do next.,Herbert Hoover,"Knowing, Next, Times"
"God the Father, the supreme Architect, had already built this cosmic home we behold, the most sacred temple of His godhead, by the laws of His mysterious wisdom.",Giovanni Pico della Mirandola,"God, Home, Temple"
Memory is not wisdom; idiots can by rote repeat volumes. Yet what is wisdom without memory?,Martin Farquhar Tupper,"Memory, Idiots, Repeat"
Doubt is the vestibule through which all must pass before they can enter into the temple of wisdom.,Charles Caleb Colton,"Temple, Doubt, Through"
Spending two years on my uncle's ranch in Montana as a young man gave me the wisdom and the thrust to do westerns.,Robert Duvall,"Man, Me, Young Man"
Even youngish men can acquire wisdom as time goes by.,John Bercow,"Time, Men, Time Goes By"
"Sometimes it might seem like I'm using my songs to give other people pointers. But mainly, they're for me, just little notes to myself that I collected, and the wisdom that I've read. I give myself a lot of advice.",Seinabo Sey,"Myself, Me, Advice"
"After a gig I always head back to the hotel, remembering granny's words of wisdom. I cancel the late-night pizza and watch the Jonathan Ross show instead.",Jimmy Carr,"Always, Hotel, Words"
There is a difference between happiness and wisdom: he that thinks himself the happiest man is really so; but he that thinks himself the wisest is generally the greatest fool.,Francis Bacon,"Happiness, Fool, Man"
"Of all the things which wisdom provides to make us entirely happy, much the greatest is the possession of friendship.",Epicurus,"Friendship, Happy, Much"
We all admire the wisdom of people who come to us for advice.,Arthur Helps,"Advice, People, Admire"
"I have learned throughout my life as a composer chiefly through my mistakes and pursuits of false assumptions, not by my exposure to founts of wisdom and knowledge.",Igor Stravinsky,"Life, Knowledge, My Life"
With age comes common sense and wisdom.,Nas,"Age, Common Sense, Sense"
"Back of every mistaken venture and defeat is the laughter of wisdom, if you listen.",Carl Sandburg,"Laughter, Defeat, Back"
Only people who lack wisdom would say that a project should be pursued even if it leads to wanton destruction of forests.,Sreenivasan,"People, Only, Say"
I prefer the folly of enthusiasm to the indifference of wisdom.,Anatole France,"Enthusiasm, Indifference, Folly"
"For me, the perfect romantic suspense hero has got to be tough on the outside but tender at his core. A take-charge kind of guy who has his own inner strength and a strong sense of right and wrong - which might not dovetail with the conventional wisdom. I mean, he might bend the law if he thinks the ends justify the means.",Ruth Glick,"Strength, Romantic, Hero"
"In the long-run every Government is the exact symbol of its People, with their wisdom and unwisdom; we have to say, Like People like Government.",Thomas Carlyle,"Government, People, Say"
"When you get older, you learn certain life lessons. You apply that wisdom, and suddenly you say, 'Hey, I've got a new lease on this thing. So let's go.'",Robert Redford,"Life, New, Go"
"As a husband, father and public servant, I'm thankful for the counsel and wisdom of my older brothers - Bill, who was a priest, and Kevin, who is a priest.",Denis McDonough,"Thankful, Father, Husband"
"'Swan,' by Mary Oliver. Poems and prose. Reading from this book is as if visiting a very wise friend. There is wisdom and welcoming kindness on every page.",Jessye Norman,"Kindness, Wise, Swan"
The marvel of the Bhagavad-Gita is its truly beautiful revelation of life's wisdom which enables philosophy to blossom into religion.,Hermann Hesse,"Life, Religion, Beautiful"
One part of wisdom is knowing what you don't need anymore and letting it go.,Jane Fonda,"Knowing, Go, Need"
Wisdom consists not so much in knowing what to do in the ultimate as knowing what to do next.,Herbert Hoover,"Knowing, Much, Next"
One reason the human race has such a low opinion of itself is that it gets so much of its wisdom from writers.,Wilfrid Sheed,"Opinion, Reason, Race"
"Science gives us knowledge, but only philosophy can give us wisdom.",Will Durant,"Science, Knowledge, Us"
Science is always discovering odd scraps of magical wisdom and making a tremendous fuss about its cleverness.,Aleister Crowley,"Science, Always, Cleverness"
A wholesome oblivion of one's neighbours is the beginning of wisdom.,Richard Le Gallienne,"Beginning, Wholesome, Neighbours"
"I decided that it was not wisdom that enabled poets to write their poetry, but a kind of instinct or inspiration, such as you find in seers and prophets who deliver all their sublime messages without knowing in the least what they mean.",Socrates,"Poetry, Find, Knowing"
"When a president makes life and death decisions, he should draw strength and wisdom from broad and deep experience with the reasons for and the risks of committing our children to our defense. For no matter how many others are involved in the decision, the president is a lonely man in a dark room when the casualty reports come in.",John McCain,"Life, Death, Experience"
"My first spoken word poem, packed with all the wisdom of a 14-year-old, was about the injustice of being seen as unfeminine. The poem was very indignant, and mainly exaggerated, but the only spoken word poetry that I had seen up until that point was mainly indignant, so I thought that that's what was expected of me.",Sarah Kay,"Poetry, Me, Injustice"
"The truest greatness lies in being kind, the truest wisdom in a happy mind.",Ella Wheeler Wilcox,"Mind, Greatness, Happy"
"The greatest obstacle to being heroic is the doubt whether one may not be going to prove one's self a fool; the truest heroism is to resist the doubt; and the profoundest wisdom, to know when it ought to be resisted, and when it be obeyed.",Nathaniel Hawthorne,"Courage, Fool, Know"
"If we talk about 'Groundhog Day' as a humanistic text - we only have one life, and there's no punishment or reward afterwards - then the wisdom is, just be kind because that will make you happy and the people around you happy.",Tim Minchin,"Life, Day, Reward"
The tradition is a fence around the law; tithes are a fence around riches; vows are a fence around abstinence; a fence around wisdom is silence.,Akiva ben Joseph,"Silence, Law, Fence"
"At sixty, I know little more about wisdom than I did at thirty, but I know a great deal more about folly.",Mason Cooley,"Great, Know, Sixty"
"History is filled with tragic examples of wars that result from diplomatic impasse. Whether in our local communities or in international relations, the skillful use of our communicative capacities to negotiate and resolve differences is the first evidence of human wisdom.",Daisaku Ikeda,"History, Result, Differences"
"Every indication of wisdom, taken from the effect, is equally an indication of power to execute what wisdom planned.",Thomas Reid,"Power, Planned, Effect"
"He was gifted with the sly, sharp instinct for self-preservation that passes for wisdom among the rich.",Evelyn Waugh,"Rich, Gifted, Sharp"
"Bitcoin is a swarm of cyber hornets serving the goddess of wisdom, feeding on the fire of truth, exponentially growing ever smarter, faster, and stronger behind a wall of encrypted energy.",Michael J. Saylor,"Truth, Technology, Bitcoin"
Better than the strength of men and horses is our wisdom.,Xenophanes,"Strength, Men, Better"
"And it is no less true, that personal security and private property rest entirely upon the wisdom, the stability, and the integrity of the courts of justice.",Joseph Story,"Justice, Integrity, Rest"
"I look forward to a great future for America - a future in which our country will match its military strength with our moral restraint, its wealth with our wisdom, its power with our purpose.",John F. Kennedy,"Future, Strength, Power"
The older I get the more wisdom I find in the ancient rule of taking first things first. A process which often reduces the most complex human problem to a manageable proportion.,Dwight D. Eisenhower,"Process, Find, First"
"I don't believe in a golden mean; I don't believe you find policy wisdom between two polar points. I don't dismiss that possibility, but I look at the platform that's so ideologically based, that's so dismissive of facts, of evidence, of science, and it's frankly hard to take seriously.",Thomas E. Mann,"Science, Believe, Look"
"I am not too much into political awareness, but I had known a lot about Indira Gandhi's strong persona. Obviously, she had a powerful personality and a lot of clarity and wisdom to rule India for so long.",Kirti Kulhari,"Personality, Political, Long"
"I think that we have a great opportunity to impart our wisdom and our knowledge and our experience to this younger generation. It may be different times, but experience transcends time, and wisdom transcends time.",Victoria Osteen,"Knowledge, Experience, Time"
"It's now our responsibility to prove to ourselves, to other nations, and especially to our children and our grandchildren, that politics is full of fun; politics has some wisdom. Politics is freedom.",Joko Widodo,"Politics, Freedom, Responsibility"
"Now that I am sixty, I see why the idea of elder wisdom has passed from currency.",John Updike,"I Am, Why, See"
"We must expect reverses, even defeats. They are sent to teach us wisdom and prudence, to call forth greater energies, and to prevent our falling into greater disasters.",Robert E. Lee,"Falling, Us, Prudence"
"There should be a point to movies. Sure, you're giving people a diversion from the cold world for a bit, but at the same time, you pass on some facts and rules and maybe a little bit of wisdom.",George Lucas,"Time, Movies, World"
Putting is like wisdom - partly a natural gift and partly the accumulation of experience.,Arnold Palmer,"Experience, Gift, Like"
Irony is the gaiety of reflection and the joy of wisdom.,Anatole France,"Reflection, Joy, Irony"
In the frank expression of conflicting opinions lies the greatest promise of wisdom in governmental action.,Louis D. Brandeis,"Action, Expression, Opinions"
"I am profoundly indebted to the legacy of Wilhelm Reich, whose monumental contribution to the understanding of energy was taught to me by Philip Curcurruto, a man of simple wisdom and compassionate heart.",Peter A. Levine,"Heart, Man, Legacy"
"To comprehend the Wisdom of this Injunction the better, and explain the Duty before us, it should be considered, that Government is the only Means by which human Happiness can be attained.",Charles Inglis,"Happiness, Government, Better"
The wisdom of man never yet contrived a system of taxation that would operate with perfect equality.,Andrew Jackson,"Equality, Man, Never"
"What a company's been earning doesn't mean anything. What you have to look at is what people think it's going to earn. If you can see something in two years is going to be entirely different than the conventional wisdom, that's how you make money.",Stanley Druckenmiller,"Money, Look, People"
I believe the continually advancing Information Revolution will lend us the wisdom and strength to address humanity's previously unsolvable problems and help us make a positive impact on all of society.,Masayoshi Son,"Positive, Strength, Society"
"We learned in World War II that no single nation holds a monopoly on wisdom, morality or right to power, but that we must fight for the weak and promote democracy.",Joe Baca,"Power, War, Democracy"
"If you are bitter, you are like a dry leaf that you can just squash, and you can get blown away by the wind. There is much more wisdom in forgiveness.",Vusi Mahlasela,"Forgiveness, Wind, Leaf"
Women are stronger than men - they do not die of wisdom.,James Stephens,"Women, Men, Die"
"The conventional wisdom is that if you are gay, you cannot play the romantic straight lead in a movie.",Ian Mckellen,"Romantic, Gay, Play"
In order to have wisdom we must have ignorance.,Theodore Dreiser,"Ignorance, Must, Order"
Experience - the wisdom that enables us to recognise in an undesirable old acquaintance the folly that we have already embraced.,Ambrose Bierce,"Experience, Old, Us"
"Because in the school of the Spirit man learns wisdom through humility, knowledge by forgetting, how to speak by silence, how to live by dying.",Johannes Tauler,"Knowledge, Learning, Silence"
"The weak have remedies, the wise have joys; superior wisdom is superior bliss.",Edward Young,"Wise, Weak, Bliss"
The beginning of wisdom is to desire it.,Solomon Ibn Gabirol,"Beginning, Desire"
Before we acquire great power we must acquire wisdom to use it well.,Ralph Waldo Emerson,"Power, Great, Well"
"Wisdom is not attained by years, but by ability.",Plautus,"Ability, Years, Attained"
"It seems to me that, in every culture, I come across a chapter headed 'Wisdom.' And then I know exactly what is going to follow: 'Vanity of vanities, all is vanity.'",Ludwig Wittgenstein,"Culture, Me, Know"
