title,author,tags
Our experience is composed rather of illusions lost than of wisdom acquired.,Joseph Roux,"Experience, Lost, Rather"
One of the greatest pieces of economic wisdom is to know what you do not know.,John Kenneth Galbraith,"Know, Economic, Greatest"
"The thing that we possess, that machines don't, is the ability to exhibit wisdom.",Herbie Hancock,"Ability, Machines, Thing"
"Knowledge which is divorced from justice, may be called cunning rather than wisdom.",Marcus Tullius Cicero,"Knowledge, Justice, May"
"Both in thought and in feeling, even though time be real, to realise the unimportance of time is the gate of wisdom.",Bertrand Russell,"Time, Gate, Feeling"
"If you have a vaccine or an antidote that people can benefit from, you're not going to want to keep it to yourself. You're going to want to spread that wisdom or whatever to as many people as you can, so everybody can benefit from it.",will.i.am,"Yourself, Keep, People"
All free governments are managed by the combined wisdom and folly of the people.,James A. Garfield,"Free, People, Folly"
"Mixing one's wines may be a mistake, but old and new wisdom mix admirably.",Bertolt Brecht,"Mistake, New, May"
"I love wisdom. And you can never be great at anything unless you love it. Not be in love with it, but love the thing, admire the thing. And it seems that if you love the thing, and you don't just want to possess it, it will find you.",Maya Angelou,"Love, Great, Will"
Cunning... is but the low mimic of wisdom.,Plato,"Cunning, Low, Mimic"
"Where fear is present, wisdom cannot be.",Lactantius,"Fear, Present, Cannot"
"I'm no expert. I have no psychic powers, and I sure don't possess any secret wisdom. I'm just Janet. I have strengths, weaknesses, fears, happiness, sadness. I experience joy and I experience pain. I'm highly emotional. I'm very vulnerable.",Janet Jackson,"Happiness, Experience, Pain"
"And I pray thee, loving Jesus, that as Thou hast graciously given me to drink in with delight the words of Thy knowledge, so Thou wouldst mercifully grant me to attain one day to Thee, the fountain of all wisdom and to appear forever before Thy face.",Venerable Bede,"Knowledge, Day, Face"
"Wisdom I know is social. She seeks her fellows. But Beauty is jealous, and illy bears the presence of a rival.",Thomas Jefferson,"Beauty, Know, Jealous"
"I learned some valuable lessons about the legislative process, the importance of bipartisan cooperation and the wisdom of taking small steps to get a big job done.",Hillary Clinton,"Done, Process, Job"
God in His wisdom has decided that He will reward no works but His own.,Johannes Tauler,"God, Reward, Will"
"Given the unprecedented ignorance of the Bible in contemporary America, it is likely that more young Americans will only know the Noah of 'Noah.' We can only hope that the film offers even a fraction of the wisdom of the original.",Dennis Prager,"Hope, Bible, Ignorance"
"There is no greater privilege in living than bringing a tiny new human being into the world and then trying to raise him or her properly during the next eighteen years. Doing that job right requires all the intelligence, wisdom, and determination you will be able to muster from day to day.",James Dobson,"Intelligence, Determination, Day"
"Because of my upbringing, I believe in things like limited government, fiscal responsibility and personal accountability. I believe in the wisdom of our founders and the sanctity of our Constitution.",John Thune,"Government, Responsibility, Believe"
"Instead of looking at life as a narrowing funnel, we can see it ever widening to choose the things we want to do, to take the wisdom we've learned and create something.",Liz Carpenter,"Life, Looking, Create"
"When you're young, you wonder what all these old people are droning on about, trying to impart their wisdom. It's not relevant to you because being young is such a specific thing. Thank God for that. Thank God for the young people who go out and demonstrate against rampant capitalism or whatever.",Helen Mirren,"God, Thank God, Capitalism"
"Just as a cautious businessman avoids investing all his capital in one concern, so wisdom would probably admonish us also not to anticipate all our happiness from one quarter alone.",Sigmund Freud,"Happiness, Alone, Us"
"For those of you who pray, I ask that you pray that I will always judge with wisdom and integrity as a faithful servant of the law.",Charles T. Canady,"Always, Integrity, Law"
Pain is the doorway to wisdom and to truth.,Keith Miller,"Truth, Pain, Doorway"
"I am ever thankful to my fans for making me who I am today. I feel I have a real commitment to them-the responsibility to make music with soul, warmth and a bit of wisdom.",Jose Jose,"Thankful, Music, Today"
The attempt to combine wisdom and power has only rarely been successful and then only for a short while.,Albert Einstein,"Power, Short, Only"
"Your art kind of changes as you get older, by nature of the fact that you're hopefully gaining wisdom and you're starting to watch things with a better overview.",Sheryl Crow,"Nature, Art, Your"
Kabbalah is all about change. It isn't about being proud of our good qualities: the wisdom is about transforming our darkness into light.,Yehuda Berg,"Change, Good, Light"
"Come, come, leave business to idlers, and wisdom to fools: they have need of 'em: wit be my faculty, and pleasure my occupation, and let father Time shake his glass.",William Congreve,"Time, Business, Father"
"I think we perhaps are, with sleep, where we were with smoking about 50 years ago, in that we had all of the science, and it was right there for the public discussion, but it's not yet adequately sort of percolated out into policy or even just public wisdom.",Matthew Walker,"Science, Smoking, Sleep"
"I want to sit in my own sorrow, cry it out, talk to God, and say, 'Give me strength, wisdom.'",Charles Bradley,"God, Strength, Me"
"This, and this alone, is Christianity, a universal holiness in every part of life, a heavenly wisdom in all our actions, not conforming to the spirit and temper of the world but turning all worldly enjoyments into means of piety and devotion to God.",William Law,"Life, Alone, God"
Wit and playfulness represent a desperately serious transcendence of evil. Humor is both a form of wisdom and a means of survival.,Tom Robbins,"Humor, Survival, Evil"
"I always want to be a messenger, a person that, you know, that's not afraid to pass on wisdom.",Mary J. Blige,"Always, Know, Person"
"The woods were a boon; all too often, the forest offered danger and mystery. Yet it could be liberating. If you entered that wild place on its own terms, you might be accorded wisdom.",John Burnside,"Mystery, Woods, Own"
"Everyone has always underestimated a company headquartered in Salt Lake City, Utah. The New York boys thought they could take me on, that nobody out here has any knowledge or wisdom.","Jon Huntsman, Sr.","Knowledge, Always, City"
"Pain and foolishness lead to great bliss and complete knowledge, for Eternal Wisdom created nothing under the sun in vain.",Khalil Gibran,"Knowledge, Great, Pain"
"There's a lot of wisdom that my dad and my grandparents and my uncle have been able to impart on me, and what I've treasured the most is I've seen examples in my life of people embracing their creativity, not feeling insecure about their artistic inclinations.",Bryce Dallas Howard,"Life, Dad, Me"
"The greater the step forward in knowledge, the greater is the one taken backward in search of wisdom.",Stephen Gardiner,"Knowledge, Step, Search"
"Our ascendancy of the past two centuries - first Europe and then the U.S. - has bred a western-centric mentality: the West is the fount of all wisdom. We think of ourselves as open-minded, but our sense of superiority has closed our minds. We never entertained the idea that China could surpass the U.S.",Martin Jacques,"Past, Never, First"
"There is no pain equal to that which two lovers can inflict on one another. This should be made clear to all who contemplate such a union. The avoidance of this pain is the beginning of wisdom, for it is strong enough to contaminate the rest of our lives.",Cyril Connolly,"Pain, Rest, Beginning"
"With age comes a greater wisdom, an ease and comfort with oneself.",Cherie Lunghi,"Age, Comfort, Ease"
"Whatever position I occupied, it was the result of colleagues - of my comrades in the movement - who had decided in their wisdom to use me for the purpose of focusing the attention of the country and the international community on me.",Nelson Mandela,"Colleagues, Community, Result"
"Gray hairs are signs of wisdom if you hold your tongue, speak and they are but hairs, as in the young.",Rabindranath Tagore,"Your, Speak, Tongue"
"Pure, holy simplicity confounds all the wisdom of this world and the wisdom of the flesh.",Francis of Assisi,"World, Simplicity, Pure"
Unhappy is that Grandeur which makes us too great to be good; and that Wit which sets us at a distance from true Wisdom.,Mary Astell,"Good, Great, True"
"The first point of wisdom is to discern that which is false; the second, to know that which is true.",Lactantius,"True, Know, First"
"Wisdom has its root in goodness, not goodness its root in wisdom.",Ralph Waldo Emerson,"Goodness, Root"
More helpful than all wisdom is one draught of simple human pity that will not forsake us.,George Eliot,"Simple, Will, Human"
"Real history is far more complex and interesting than the simplistic summaries presented in Wikipedia articles. Knowing this allows you to question received wisdom, to challenge 'facts' 'everybody' knows to be true, and to imagine worlds and characters worthy of our rich historical heritage and our complex selves.",Ken Liu,"History, Rich, Heritage"
"The more you meditate on the laws of Moses, the more striking and brighter does their wisdom appear.",John Quincy Adams,"Laws, More, Brighter"
Wisdom comes out of dialogue so you have to develop the capacity to expose your own ignorance in order that they may discover their own wisdom.,John B. Goodenough,"Your, Ignorance, Own"
"Never accept ultimatums, conventional wisdom, or absolutes.",Christopher Reeve,"Accept, Never, Conventional Wisdom"
"It is not from reason that justice springs, but goodness is born of wisdom.",Maurice Maeterlinck,"Justice, Born, Reason"
"Even by common wisdom, there seem to be both people and objects in my dream that are outside myself, but clearly they were created in myself and are part of me, they are mental constructs in my own brain.",Ray Kurzweil,"Myself, Brain, Me"
"Let my skin and sinews and bones dry up, together with all the flesh and blood of my body! I welcome it! But I will not move from this spot until I have attained the supreme and final wisdom.",Buddha,"Welcome, Together, Skin"
"I'm married. My wife, Stella - a beautiful woman. She's brought a lot of peace to my life, a lot of wisdom.",Anthony Hopkins,"Life, Peace, Beautiful"
"Thinking is not enough. There is no final enough of wisdom, experience - any... thing.",William S. Burroughs,"Experience, Thinking, Enough"
It has become part of the accepted wisdom to say that the twentieth century was the century of physics and the twenty-first century will be the century of biology.,Freeman Dyson,"Biology, Will, Physics"
"One could surely argue that the Buddhist tradition, taken as a whole, represents the richest source of contemplative wisdom that any civilization has produced.",Sam Harris,"Civilization, Tradition, Source"
Science investigates; religion interprets. Science gives man knowledge which is power; religion gives man wisdom which is control.,"Martin Luther King, Jr.","Science, Knowledge, Power"
"It is plain to me that our prelates, in granting indulgences, do commonly blaspheme the wisdom of God.",John Wycliffe,"God, Me, Plain"
Rightly defined philosophy is simply the love of wisdom.,Marcus Tullius Cicero,"Love, Philosophy, Simply"
Wisdom is not acquired save as the result of investigation.,Sara Teasdale,"Result, Save, Investigation"
I reject most conventional wisdom.,Rush Limbaugh,"Most, Conventional Wisdom, Conventional"
"Let us be about setting high standards for life, love, creativity, and wisdom. If our expectations in these areas are low, we are not likely to experience wellness. Setting high standards makes every day and every decade worth looking forward to.",Greg Anderson,"Life, Love, Experience"
"I love Winston Churchill. I love the wisdom he had, the sagacity. I like people who are independent-minded. People who aren't part of clans or systems, who are talented and free, and able to do things without being corrupted by the system.",Lapo Elkann,"Love, Free, People"
The wisdom of age: don't stop walking.,Mason Cooley,"Age, Walking, Stop"
"Where can we find greater structural clarity than in the wooden buildings of old? Where else can we find such unity of material, construction and form? here, the wisdom of whole generations is stored.",Ludwig Mies van der Rohe,"Unity, Construction, Find"
"We are all responsible to Jesus first, and then, under him, to various other persons and offices. Discerning the path of love and obedience when two or more of these submissive relationships collide is a call to humble, Bible-saturated, spiritual wisdom.",John Piper,"Love, Humble, Path"
What I want is to have people's notion of adulthood no longer be so defined by being a parent. There is some kind of conventional wisdom that you're not really a mature person until you become a parent.,Meghan Daum,"People, Person, Mature"
Intuition is the wisdom formed by feeling and instinct - a gift of knowing without reasoning... Belief is ignited by hope and supported by facts and evidence - it builds alignment and creates confidence. Belief is what sets energy in motion and creates the success that breeds more success.,Angela Ahrendts,"Success, Hope, Confidence"
Women always excel men in that sort of wisdom which comes from experience. To be a woman is in itself a terrible experience.,H. L. Mencken,"Women, Experience, Men"
"I always told, Sandra Bullock was my student when she was younger, I always told her it's important that we hold on to our insecurity, the wisdom of insecurity.",Sally Kirkland,"Always, Important, Insecurity"
I haven't any wisdom - just a child like everybody else. I'm not as great as Frank Lloyd Wright.,Philip Johnson,"Great, Child, Else"
"To be asked to perform a new 'Talking Head' was beyond any expectation. The matchless brilliance of Alan Bennett's words coupled with the extraordinary wisdom of Nick Hytner's direction made this a thrilling and quite simply unforgettable experience, and I'm enormously grateful.",Sarah Lancashire,"Experience, Grateful, Direction"
"India is known for its sobriety and wisdom, balanced and sensible thinking. We need strong institutions and we need good governance in the country.",Pratibha Patil,"Good, Thinking, Good Governance"
"Lord, bless me with the ability to achieve all that I can, and the wisdom to realize it doesn't all have to be by tomorrow!",William Eardley IV,"Tomorrow, Me, Ability"
It isn't right to judge strength as better than good wisdom.,Xenophanes,"Good, Strength, Better"
"As great as Ed is, the wisdom out here is that he can't carry a movie. They'll pay him $3 million to be the second banana in Julia Roberts things. But they won't put up $3 million for an Ed Harris movie.",George A. Romero,"Great, Banana, Things"
"Experience is knowledge; but knowledge, when it is sought only as a material resource, is not always a blessing. Experience is wisdom; but wisdom, with those who lack vision, is not always power. Experience is tolerance; but tolerance, when it is induced by apathy, is not in the least a virtue.",Ameen Rihani,"Knowledge, Experience, Power"
Lion sounds that have not grown from the mouse may exude naked power... but cannot convey any wisdom or understanding... The initial steps on the path to courageous speech then are the first tentative steps into the parts of us that cannot speak.,David Whyte,"Power, Path, Lion"
"I am not the first Buddha who came upon Earth, nor shall I be the last. In due time, another Buddha will arise in the world - a Holy One, a supremely enlightened One, endowed with wisdom in conduct, auspicious, knowing the universe, an incomparable leader of men, a master of angels and mortals.",Buddha,"Time, Men, World"
"I actually don't think that I'm that much smarter than anybody else. It's just that I frequently just seem to know what to do, and I think that's wisdom.",Ben Carson,"Know, Much, Think"
"I know more about what it's like to be elderly and infirm and kind of stupid, the way you get forgetful, but on the other hand I'm a littler, wiser, dare we say? The word 'wisdom' has kind of faded out of our vocabulary, but yeah, I'm a little wiser.",John Updike,"Stupid, Way, Know"
"Today, education does not give you the wisdom and the understanding; it only indoctrinates you to believe something. So the mind knows very less but accepts so many things; it may be science, it may be technology, it may be anything.",Lobsang Tenzin,"Science, Education, Technology"
"Humanity's legacy of stories and storytelling is the most precious we have. All wisdom is in our stories and songs. A story is how we construct our experiences. At the very simplest, it can be: 'He/she was born, lived, died.' Probably that is the template of our stories - a beginning, middle, and end. This structure is in our minds.",Doris Lessing,"Legacy, Humanity, Beginning"
I am not one who was born in the custody of wisdom; I am one who is fond of olden times and intense in quest of the sacred knowing of the ancients.,Gustave Courbet,"I Am, Born, Knowing"
Wisdom alone is the science of other sciences.,Plato,"Science, Alone, Other"
Wisdom allows nothing to be good that will not be so forever; no man to be happy but he that needs no other happiness than what he has within himself; no man to be great or powerful that is not master of himself.,Lucius Annaeus Seneca,"Happiness, Good, Great"
"When we contend, let us contend for all our rights - the doubtful and the certain, the unimportant and essential. It is as easy to contend, or even more so, for the whole as for a part. At the termination of the contest, secure all that our wisdom and valour and the fortune of war will permit.",John C. Calhoun,"War, Will, Easy"
"And when the world is created, it is created in such a way that those eternal objects of God's loving wisdom become actualities - interacting with one another, relating to God in the finite realm.",Rowan Williams,"God, World, Way"
Some wisdom you must learn from one who's wise.,Euripides,"Wise, Must, Learn"
"Except for the grace of God, I would be nobody - and that grace is the opposite of merit - human labour, education or human wisdom.",T. B. Joshua,"Education, God, Grace"
"We are shallow because we are 'mayabang,' ego driven, and do not have the humility to understand that we are only human, much too human to mistake knowledge for wisdom.",F. Sionil Jose,"Knowledge, Mistake, Humility"
He who is taught to live upon little owes more to his father's wisdom than he who has a great deal left him does to his father's care.,William Penn,"Great, Father, Care"
What we call wisdom is the result of all the wisdom of past ages. Our best institutions are like young trees growing upon the roots of the old trunks that have crumbled away.,Henry Ward Beecher,"Best, Past, Result"
"Moderation is the inseparable companion of wisdom, but with it genius has not even a nodding acquaintance.",Charles Caleb Colton,"Genius, Companion, Moderation"
"The best wisdom is earned through experience, particularly mistakes.",Sophia Amoruso,"Best, Experience, Mistakes"
"Some Nickelodeon executives were worried about backing an animated action show with a female lead character. Conventional TV wisdom has it that girls will watch shows about boys, but boys won't watch shows about girls. During test screenings, though, boys said they didn't care that Korra was a girl. They just said she was awesome.",Bryan Konietzko,"Character, Care, Will"
Good economic policy requires not so much the bravado to implement drastic change as the strength and wisdom to make reasonable trade-offs over the many years it takes to transform a country's standard of living.,Peter Blair Henry,"Change, Good, Strength"
I was offered the opportunity at the Mariners to pass on my experiences and wisdom in order to develop the football club back into the football club that it once was.,Mike Phelan,"Football, Opportunity, Back"
You have to know when to stop - that's wisdom.,Hubert de Givenchy,"Know, Stop, You"
"Champions invariably have fervent philosophical beliefs. Philosophy, in its simplest terms, means 'the love of wisdom.'",Zig Ziglar,"Love, Philosophy, Beliefs"
"Surely wisdom will come as we listen to learn from children, parents, partners, neighbors, Church leaders, and the Lord.",Russell M. Nelson,"Parents, Will, Children"
"Though I am fascinated by knowledge, I am even more fascinated by wisdom.",Abraham Verghese,"Knowledge, I Am, More"
This fear of the Lord is indeed the beginning of wisdom. This consciousness of sin is the straight pathway to heaven.,Joseph Barber Lightfoot,"Fear, Beginning, Sin"
"If I am fool, it is, at least, a doubting one; and I envy no one the certainty of his self-approved wisdom.",Lord Byron,"Fool, I Am, Envy"
Holy wisdom confounds Satan and all his wickednesses.,Francis of Assisi,"Satan, Holy, His"
"The ultimate wisdom which deals with beginnings, remains locked in a seed. There it lies, the simplest fact of the universe and at the same time the one which calls faith rather than reason.",Hal Borland,"Faith, Time, Universe"
"A great memory is never made synonymous with wisdom, any more than a dictionary would be called a treatise.",John Henry Newman,"Great, Memory, Never"
"Wisdom alone is true ambition's aim, wisdom is the source of virtue and of fame; obtained with labour, for mankind employed, and then, when most you share it, best enjoyed.",Alfred North Whitehead,"Alone, Best, Aim"
"History does not repeat itself. Nor does it unfold in cycles. The real future is contingent, rich beyond imagining, a perennial gobsmack, tragic and glorious in equal measure; the pundits' future, spun of 'conventional wisdom,' is only a sucker punch to that common-sense fact.",Rick Perlstein,"Future, History, Rich"
Government is a contrivance of human wisdom to provide for human wants. People have the right to expect that these wants will be provided for by this wisdom.,Jimmy Carter,"Government, Will, People"
Silence and reserve will give anyone a reputation for wisdom.,Myrtle Reed,"Silence, Reputation, Will"
"After the knowledge of, and obedience to, the will of God, the next aim must be to know something of His attributes of wisdom, power, and goodness as evidenced by His handiwork.",James Prescott Joule,"God, Knowledge, Power"
Our own physical body possesses a wisdom which we who inhabit the body lack. We give it orders which make no sense.,Henry Miller,"Body, No Sense, Own"
"I imagine God to be like my father. My father was always the voice of certainty in my life. Certainty in the wisdom, certainty in the path, certainty always in God. For me God is certainty in everything. Certainty that everything is good and everything is God.",Yehuda Berg,"Life, God, Good"
It is a remarkable fact in the political history of man that there is scarcely an instance of a free constitutional government which has been the work exclusively of foresight and wisdom. They have all been the result of a fortunate combination of circumstances.,John C. Calhoun,"Work, History, Government"
The best wisdom comes from the hardest struggle.,Xavier Rudd,"Best, Struggle, Hardest"
"I pray before I go into the operating room for every case, and I ask him to give me wisdom, to help me to know what to do - and not only for operating, but for everything.",Ben Carson,"Me, Know, Everything"
"I've always shied away from conventional wisdom, though I know the power of it.",Peter Jennings,"Power, Always, Know"
It is not white hair that engenders wisdom.,Menander,"Hair, White"
"When I speak of family, I immediately think of a support system who can give you a reality check when you need it: a mirror reflection of myself. I believe that we are a result of our family - the people who encourage us and tell us the truth about who we are which helps us to grow through their advice and wisdom.",Tasha Smith,"Family, Truth, Myself"
"I believe we have become paralyzed, paralyzed by our desire to be loved. Now our founding fathers had the wisdom to know that social acceptance and popularity were fleeing, and that this country's principles needed to be rooted in strengths greater than the passions and the emotions of the times.",Chris Christie,"Believe, Acceptance, Emotions"
"If elected Speaker, I promise you that we will have the courage to lead the fight for our conservative principles and make our case to the American people. But we will also have the wisdom to listen to our constituents and each other so that we always move forward together.",Kevin McCarthy,"Courage, Always, Fight"
The greatest wisdom is to realize one's lack of it.,Constantin Stanislavski,"Realize, Greatest, Lack"
"I know that inner wisdom is more precious than wealth. The more you spend it, the more you gain.",Oprah Winfrey,"Wealth, Know, Precious"
"I had more energy at 50. On the other hand, at 75, I've probably got a little more wisdom and good judgment than I had at 50 because I've got more experience. But I haven't really changed. I'm still driven by the same philosophy.",Ted Turner,"Good, Experience, Energy"
"When we looked at the life cycle in our 40s, we looked to old people for wisdom. At 80, though, we look at other 80-year-olds to see who got wise and who not. Lots of old people don't get wise, but you don't get wise unless you age.",Erik Erikson,"Life, Age, Wise"
