title,author,tags
"Great achievement is usually born of great sacrifice, and is never the result of selfishness.",Napoleon Hill,"Sacrifice, Achievement, Result"
Behind every great fortune lies a great crime.,Honore de Balzac,"Crime, Fortune, Behind"
"Some are born great, some achieve greatness, and some have greatness thrust upon them.",William Shakespeare,"Greatness, Born, Achieve"
"To achieve great things, two things are needed; a plan, and not quite enough time.",Leonard Bernstein,"Time, Enough, Plan"
Good health and good sense are two of life's greatest blessings.,Publilius Syrus,"Life, Health, Good"
"The greater the obstacle, the more glory in overcoming it.",Moliere,"Glory, Overcoming, More"
To be yourself in a world that is constantly trying to make you something else is the greatest accomplishment.,Ralph Waldo Emerson,"Yourself, World, Be Yourself"
Nothing great in the world has ever been accomplished without passion.,Georg Wilhelm Friedrich Hegel,"Passion, World, Nothing"
Small opportunities are often the beginning of great enterprises.,Demosthenes,"Beginning, Small, Opportunities"
"Greatness lies, not in being strong, but in the right using of strength; and strength is not used rightly when it serves only to carry a man above his fellows for his own solitary glory. He is the greatest whose strength carries up the most hearts by the attraction of his own.",Henry Ward Beecher,"Strength, Man, Greatness"
Great minds discuss ideas; average minds discuss events; small minds discuss people.,Eleanor Roosevelt,"Ideas, People, Great Minds"
"The heights by great men reached and kept were not attained by sudden flight, but they, while their companions slept, were toiling upward in the night.",Henry Wadsworth Longfellow,"Men, Night, Heights"
"To become truly great, one has to stand with people, not above them.",Montesquieu,"Stand, People, Become"
The greatest weapon against stress is our ability to choose one thought over another.,William James,"Stress, Ability, Choose"
There is no greater agony than bearing an untold story inside you.,Maya Angelou,"Story, Inside, Agony"
The mediocre teacher tells. The good teacher explains. The superior teacher demonstrates. The great teacher inspires.,William Arthur Ward,"Good, Teacher, Good Teacher"
"If you cannot do great things, do small things in a great way.",Napoleon Hill,"Small Things, Way, Great Things"
"Lives of great men all remind us, we can make our lives sublime, and, departing, leave behind us, footprints on the sands of time.",Henry Wadsworth Longfellow,"Time, Men, Behind"
It is a rough road that leads to the heights of greatness.,Lucius Annaeus Seneca,"Greatness, Road, Heights"
The greatest mistake you can make in life is continually fearing that you'll make one.,Elbert Hubbard,"Life, Mistake, Make"
Believe deep down in your heart that you're destined to do great things.,Joe Paterno,"Heart, Your, Believe"
Only those who dare to fail greatly can ever achieve greatly.,Robert Kennedy,"Dare, Achieve, Only"
What wisdom can you find that is greater than kindness?,Jean-Jacques Rousseau,"Wisdom, Kindness, Find"
The greatness of a nation can be judged by the way its animals are treated.,Mahatma Gandhi,"Greatness, Way, Nation"
To do a great right do a little wrong.,William Shakespeare,"Right, Wrong, Little"
Little minds are tamed and subdued by misfortune; but great minds rise above them.,Washington Irving,"Rise, Great Minds, Rise Above"
"I am the greatest, I said that even before I knew I was.",Muhammad Ali,"I Am, Greatest, Said"
You need a little bit of insanity to do great things.,Henry Rollins,"Insanity, Great Things, Things"
"The greater the effort, the greater the glory.",Pierre Corneille,"Effort, Glory, Greater"
Could a greater miracle take place than for us to look through each other's eyes for an instant?,Henry David Thoreau,"Eyes, Look, Place"
"The greater the artist, the greater the doubt. Perfect confidence is granted to the less talented as a consolation prize.",Robert Hughes,"Confidence, Doubt, Perfect"
The greatest discovery of all time is that a person can change his future by merely changing his attitude.,Oprah Winfrey,"Attitude, Future, Change"
We are all faced with a series of great opportunities brilliantly disguised as impossible situations.,Charles R. Swindoll,"Impossible, Opportunities, Series"
Great things are not accomplished by those who yield to trends and fads and popular opinion.,Jack Kerouac,"Trends, Opinion, Great Things"
Life should be great rather than long.,B. R. Ambedkar,"Life, Long, Should"
"After climbing a great hill, one only finds that there are many more hills to climb.",Nelson Mandela,"Hill, Climb, Only"
"Great people talk about ideas, average people talk about things, and small people talk about wine.",Fran Lebowitz,"Ideas, People, Talk"
"There is no greatness where there is no simplicity, goodness and truth.",Leo Tolstoy,"Truth, Greatness, Simplicity"
Great things are done by a series of small things brought together.,Vincent Van Gogh,"Done, Small Things, Together"
One sees great things from the valley; only small things from the peak.,Gilbert K. Chesterton,"Small Things, Great Things, Things"
The first and greatest victory is to conquer yourself; to be conquered by yourself is of all things most shameful and vile.,Plato,"Yourself, Victory, Conquer"
"The principles of living greatly include the capacity to face trouble with courage, disappointment with cheerfulness, and trial with humility.",Thomas S. Monson,"Courage, Face, Humility"
"All the great things are simple, and many can be expressed in a single word: freedom, justice, honor, duty, mercy, hope.",Winston Churchill,"Hope, Freedom, Justice"
The great man is he who does not lose his child's-heart.,Mencius,"Man, Lose, Great Man"
Great things are done when men and mountains meet.,William Blake,"Men, Done, Great Things"
All great achievements require time.,Maya Angelou,"Time, Achievements, Require"
Don't be humble... you're not that great.,Golda Meir,"Humble, Be Humble, You"
"Only passions, great passions can elevate the soul to great things.",Denis Diderot,"Soul, Great Things, Things"
I've got a great ambition to die of exhaustion rather than boredom.,Thomas Carlyle,"Die, Ambition, Boredom"
The greatest good you can do for another is not just to share your riches but to reveal to him his own.,Benjamin Disraeli,"Good, Your, Own"
"It's hard to be humble, when you're as great as I am.",Muhammad Ali,"Humble, I Am, Be Humble"
"I firmly believe that any man's finest hour, the greatest fulfillment of all that he holds dear, is that moment when he has worked his heart out in a good cause and lies exhausted on the field of battle - victorious.",Vince Lombardi,"Good, Heart, Moment"
"Our greatest glory is not in never failing, but in rising up every time we fail.",Ralph Waldo Emerson,"Time, Glory, Never"
"You are your greatest asset. Put your time, effort and money into training, grooming, and encouraging your greatest asset.",Tom Hopkins,"Time, Money, Your"
Those who dare to fail miserably can achieve greatly.,John F. Kennedy,"Dare, Achieve, Who"
All truly great thoughts are conceived by walking.,Friedrich Nietzsche,"Thoughts, Walking, Truly"
"Heaven and hell suppose two distinct species of men, the good and the bad. But the greatest part of mankind float betwixt vice and virtue.",David Hume,"Good, Men, Hell"
A great pleasure in life is doing what people say you cannot do.,Walter Bagehot,"Life, Doing, People"
Great spirits have always encountered violent opposition from mediocre minds.,Albert Einstein,"Always, Opposition, Spirits"
The greatest wealth is to live content with little.,Plato,"Wealth, Live, Content"
"See everything, overlook a great deal, correct a little.",Pope John XXIII,"Everything, See, Deal"
"A man is great by deeds, not by birth.",Chanakya,"Man, Birth, Deeds"
Great things are won by great dangers.,Herodotus,"Great Things, Things, Won"
"Whatever you want to do, if you want to be great at it, you have to love it and be able to make sacrifices for it.",Maya Angelou,"Love, Whatever, Make"
"The great question that has never been answered, and which I have not yet been able to answer, despite my thirty years of research into the feminine soul, is 'What does a woman want?'",Sigmund Freud,"Soul, Research, Woman"
"The greatest accomplishment is not in never falling, but in rising again after you fall.",Vince Lombardi,"Accomplishment, Fall, Falling"
"Just do what must be done. This may not be happiness, but it is greatness.",George Bernard Shaw,"Happiness, Done, Greatness"
The greatest happiness is to know the source of unhappiness.,Fyodor Dostoevsky,"Happiness, Know, Source"
A great man is different from an eminent one in that he is ready to be the servant of the society.,B. R. Ambedkar,"Society, Man, Great Man"
The price of greatness is responsibility.,Winston Churchill,"Responsibility, Greatness, Price"
"For the person for whom small things do not exist, the great is not great.",Jose Ortega y Gasset,"Small Things, Person, Things"
"As a child of God, I am greater than anything that can happen to me.",A. P. J. Abdul Kalam,"God, I Am, Me"
I have learned to use the word 'impossible' with the greatest caution.,Wernher von Braun,"Impossible, I Have Learned, Use"
There is no such thing as a great talent without great will power.,Honore de Balzac,"Power, Talent, Will"
"I long to accomplish a great and noble task, but it is my chief duty to accomplish small tasks as if they were great and noble.",Helen Keller,"Long, Duty, Task"
"Good artists copy, great artists steal.",Pablo Picasso,"Good, Copy, Steal"
"Great minds are to make others great. Their superiority is to be used, not to break the multitude to intellectual vassalage, not to establish over them a spiritual tyranny, but to rouse them from lethargy, and to aid them to judge for themselves.",William Ellery Channing,"Spiritual, Tyranny, Great Minds"
I believe the first test of a truly great man is in his humility.,John Ruskin,"Man, Believe, Humility"
"That some achieve great success, is proof to all that others can achieve it as well.",Abraham Lincoln,"Success, Others, Achieve"
Don't be afraid to give up the good for the great.,Kenny Rogers,"Good, Afraid, Up"
Trust men and they will be true to you; treat them greatly and they will show themselves great.,Ralph Waldo Emerson,"Trust, Men, Treat"
The greatest way to live with honor in this world is to be what we pretend to be.,Socrates,"World, Honor, Way"
Life is either a great adventure or nothing.,Helen Keller,"Life, Nothing, Adventure"
The greatest mistake we make is living in constant fear that we will make one.,John C. Maxwell,"Fear, Mistake, Will"
Never was anything great achieved without danger.,Niccolo Machiavelli,"Never, Anything, Danger"
We grow small trying to be great.,E. Stanley Jones,"Grow, Trying, Small"
"Great thoughts speak only to the thoughtful mind, but great actions speak to all mankind.",Theodore Roosevelt,"Thoughts, Mind, Speak"
To be great is to be misunderstood.,Ralph Waldo Emerson,Misunderstood
"Character may be manifested in the great moments, but it is made in the small ones.",Phillips Brooks,"Character, May, Small"
He who would accomplish little must sacrifice little; he who would achieve much must sacrifice much; he who would attain highly must sacrifice greatly.,James Allen,"Sacrifice, Accomplish, Much"
"Every great work, every big accomplishment, has been brought into manifestation through holding to the vision, and often just before the big achievement, comes apparent failure and discouragement.",Florence Scovel Shinn,"Work, Failure, Vision"
"The greater the difficulty, the more the glory in surmounting it.",Charles de Saint-Évremond,"Glory, Difficulty, More"
The final proof of greatness lies in being able to endure criticism without resentment.,Elbert Hubbard,"Greatness, Criticism, Endure"
Most great people have attained their greatest success just one step beyond their greatest failure.,Napoleon Hill,"Success, Failure, Step"
"Be great in act, as you have been in thought.",Jean Paul,"Act, Thought, Been"
"Do you wish to be great? Then begin by being. Do you desire to construct a vast and lofty fabric? Think first about the foundations of humility. The higher your structure is to be, the deeper must be its foundation.",Saint Augustine,"Your, Humility, Foundation"
A man's worth is no greater than his ambitions.,Marcus Aurelius,"Man, Worth, Than"
"Whatever I have tried to do in life, I have tried with all my heart to do it well; whatever I have devoted myself to, I have devoted myself completely; in great aims and in small I have always thoroughly been in earnest.",Charles Dickens,"Life, Myself, Always"
Great acts are made up of small deeds.,Lao Tzu,"Small, Deeds, Up"
Laws control the lesser man... Right conduct controls the greater one.,Mark Twain,"Man, Control, Right"
"A retentive memory may be a good thing, but the ability to forget is the true token of greatness.",Elbert Hubbard,"Good, Memory, Greatness"
"And what he greatly thought, he nobly dared.",Homer,"Thought, He, Greatly"
"I think what motivates people is not great hate, but great love for other people.",Huey Newton,"Love, Hate, People"
"To have great poets, there must be great audiences.",Walt Whitman,"Must, Poets, Audiences"
One of the greatest diseases is to be nobody to anybody.,Mother Teresa,"Nobody, Greatest, Diseases"
"Seek not greatness, but seek truth and you will find both.",Horace Mann,"Truth, Greatness, Will"
The demand to be loved is the greatest of all arrogant presumptions.,Friedrich Nietzsche,"Loved, Demand, Greatest"
Great men are seldom over-scrupulous in the arrangement of their attire.,Charles Dickens,"Men, Great Men, Attire"
"Great wisdom is generous; petty wisdom is contentious. Great speech is impassioned, small speech cantankerous.",Zhuangzi,"Wisdom, Petty, Speech"
There is no personal charm so great as the charm of a cheerful temperament.,Henry Van Dyke,"Personal, Charm, Temperament"
"To be really great in little things, to be truly noble and heroic in the insipid details of everyday life, is a virtue so rare as to be worthy of canonization.",Harriet Beecher Stowe,"Life, Life Is A, Little Things"
"Because of a great love, one is courageous.",Lao Tzu,"Love, Because, Courageous"
"The most characteristic mark of a great mind is to choose some one important object, and pursue it for life.",Anna Letitia Barbauld,"Life, Mind, Important"
Great talents are the most lovely and often the most dangerous fruits on the tree of humanity. They hang upon the most slender twigs that are easily snapped off.,Carl Jung,"Tree, Humanity, Dangerous"
"Believe that with your feelings and your work you are taking part in the greatest; the more strongly you cultivate this belief, the more will reality and the world go forth from it.",Rainer Maria Rilke,"Work, Your, Believe"
"The world's great men have not commonly been great scholars, nor its great scholars great men.","Oliver Wendell Holmes, Sr.","Men, World, Great Men"
Life in abundance comes only through great love.,Elbert Hubbard,"Life, Love, Through"
It is the nature of all greatness not to be exact.,Edmund Burke,"Nature, Greatness, Exact"
There would be no great men if there were no little ones.,George Herbert,"Men, Great Men, Little"
"A mistake made by many people with great convictions is that they will let nothing stand in the way of their views, not even kindness.",Bryant H. McGill,"Kindness, Mistake, Stand"
The appearance of a single great genius is more than equivalent to the birth of a hundred mediocrities.,Cesare Lombroso,"Genius, Appearance, Birth"
"And the American people are the greatest people in the world. What makes America the greatest nation in the world is the heart of the American people: hardworking, innovative, risk-taking, God- loving, family-oriented American people.",Mitt Romney,"God, Heart, World"
"I have never killed a man, but I have read many obituaries with great pleasure.",Clarence Darrow,"Death, Man, Never"
The most important thing is to try and inspire people so that they can be great in whatever they want to do.,Kobe Bryant,"Positive, Try, Important"
"A certain amount of opposition is a great help to a man. Kites rise against, not with, the wind.",Lewis Mumford,"Brainy, Man, Wind"
Great works are performed not by strength but by perseverance.,Samuel Johnson,"Patience, Strength, Perseverance"
There are two great days in a person's life - the day we are born and the day we discover why.,William Barclay,"Life, Birthday, Day"
Behind every great man is a woman rolling her eyes.,Jim Carrey,"Funny, Eyes, Man"
Rice is great if you're really hungry and want to eat two thousand of something.,Mitch Hedberg,"Hungry, Rice, Eat"
"To accomplish great things, we must not only act, but also dream; not only plan, but also believe.",Anatole France,"Dreams, Believe, Plan"
"We live in a fantasy world, a world of illusion. The great task in life is to find reality.",Iris Murdoch,"Life, Truth, World"
The great aim of education is not knowledge but action.,Herbert Spencer,"Education, Knowledge, Aim"
"Where words are restrained, the eyes often talk a great deal.",Samuel Richardson,"Eyes, Words, Talk"
"Never stop fighting until you arrive at your destined place - that is, the unique you. Have an aim in life, continuously acquire knowledge, work hard, and have perseverance to realise the great life.",A. P. J. Abdul Kalam,"Life, Work, Knowledge"
A great civilization is not conquered from without until it has destroyed itself from within.,Ariel Durant,"Civilization, Until, Without"
I have come to believe that a great teacher is a great artist and that there are as few as there are any other great artists. Teaching might even be the greatest of the arts since the medium is the human mind and spirit.,John Steinbeck,"Teacher, Mind, Believe"
No man will make a great leader who wants to do it all himself or get all the credit for doing it.,Andrew Carnegie,"Leadership, Man, Doing"
"You don't have to be great to start, but you have to start to be great.",Zig Ziglar,"Start, You"
"Harmony makes small things grow, lack of it makes great things decay.",Sallust,"Peace, Small Things, Grow"
It's a great gift to be able to make people laugh.,Brahmanandam,"Gift, Laugh, People"
"I am a great believer in luck, and I find the harder I work the more I have of it.",Stephen Leacock,"Work, Chance, Luck"
"I have great respect for the past. If you don't know where you've come from, you don't know where you're going. I have respect for the past, but I'm a person of the moment. I'm here, and I do my best to be completely centered at the place I'm at, then I go forward to the next place.",Maya Angelou,"Best, Respect, Moment"
An animal's eyes have the power to speak a great language.,Martin Buber,"Power, Pet, Eyes"
It has been great journey from where I have started to where I am today. I am really blessed with God's grace.,Dhanush,"God, Today, Journey"
The idea behind fast food is great - people want convenience.,Kimbal Musk,"Food, People, Fast"
Rarely do great beauty and great virtue dwell together.,Petrarch,"Beauty, Together, Virtue"
"Every day, my daddy told me the same thing. 'Once a task is just begun, never leave it till it's done. Be the labour great or small, do it well or not at all.'",Quincy Jones,"Done, Day, Me"
Hate is too great a burden to bear. It injures the hater more than it injures the hated.,Coretta Scott King,"Hate, Burden, More"
"I am a firm believer in the people. If given the truth, they can be depended upon to meet any national crisis. The great point is to bring them the real facts.",Abraham Lincoln,"Truth, I Am, Facts"
"I love a man with a great sense of humor and who is intelligent - a man who has a great smile. He has to make me laugh. I like a man who is very ambitious and driven and who has a good heart and makes me feel safe. I like a man who is very strong and independent and confident - that is very sexy - but at the same time, he's very kind to people.",Nicole Scherzinger,"Love, Smile, Good"
"I do not know what I may appear to the world, but to myself I seem to have been only like a boy playing on the seashore, and diverting myself in now and then finding a smoother pebble or a prettier shell than ordinary, whilst the great ocean of truth lay all undiscovered before me.",Isaac Newton,"Truth, Trust, Myself"
"First, accept sadness. Realize that without losing, winning isn't so great.",Alyssa Milano,"Sad, Winning, Sadness"
"To free us from the expectations of others, to give us back to ourselves - there lies the great, singular power of self-respect.",Joan Didion,"Power, Respect, Expectations"
"Technology... is a queer thing. It brings you great gifts with one hand, and it stabs you in the back with the other.",Carrie Snow,"Technology, Back, Thing"
We hang the petty thieves and appoint the great ones to public office.,Aesop,"Politics, Thieves, Petty"
"Time is a great teacher, but unfortunately it kills all its pupils.",Hector Berlioz,"Time, Teacher, Unfortunately"
Do the difficult things while they are easy and do the great things while they are small. A journey of a thousand miles must begin with a single step.,Lao Tzu,"Motivational, Journey, Step"
Life is a great big canvas; throw all the paint you can at it.,Danny Kaye,"Life, Life Is A, Canvas"
"I'm proud of my hard work. Working hard won't always lead to the exact things we desire. There are many things I've wanted that I haven't always gotten. But, I have a great satisfaction in the blessings from my mother and father, who instilled a great work ethic in me both personally and professionally.",Tamron Hall,"Work, Hard Work, Always"
"The one question I would have for Donald Trump is inspired by his 'Make America Great Again' cap. I would ask him, 'When was America great? When did America not have an economic depression or a war?'",Tech N9ne,"War, Depression, America"
I've been so lucky to work with such great people: people that are such hard workers and have such a respect and appreciation for one another.,Blake Lively,"Work, Respect, Appreciation"
You can't build a great building on a weak foundation. You must have a solid foundation if you're going to have a strong superstructure.,Gordon B. Hinckley,"Foundation, Solid Foundation, Building"
"We can have democracy in this country, or we can have great wealth concentrated in the hands of a few, but we can't have both.",Louis D. Brandeis,"Democracy, Wealth, Country"
The internet is a great way to get on the net.,Bob Dole,"Technology, Internet, Way"
I don't know of any great man who ever had a great son.,Anthony Mann,"Man, Great Man, Son"
The true revolutionary is guided by a great feeling of love. It is impossible to think of a genuine revolutionary lacking this quality.,Che Guevara,"Love, Impossible, Quality"
"A leader takes people where they want to go. A great leader takes people where they don't necessarily want to go, but ought to be.",Rosalynn Carter,"People, Go, Where"
"I've learned that fear limits you and your vision. It serves as blinders to what may be just a few steps down the road for you. The journey is valuable, but believing in your talents, your abilities, and your self-worth can empower you to walk down an even brighter path. Transforming fear into freedom - how great is that?",Soledad O'Brien,"Freedom, Fear, Journey"
"Your work is going to fill a large part of your life, and the only way to be truly satisfied is to do what you believe is great work. And the only way to do great work is to love what you do. If you haven't found it yet, keep looking. Don't settle. As with all matters of the heart, you'll know when you find it.",Steve Jobs,"Inspirational, Life, Love"
Good design is making something intelligible and memorable. Great design is making something memorable and meaningful.,Dieter Rams,"Design, Good, Memorable"
"Today's a beautiful day, and yesterday was a beautiful day, so that means it's a great life.",Gnash,"Life, Today, Beautiful"
"There is strength in numbers, but organizing those numbers is one of the great challenges.",John C. Mather,"Strength, Challenges, Numbers"
"Singing is my passion, my first love and the secret of my energy. Music to me is like finding my inner self, my soul. It gives me a great joy to see audiences enjoying with me. I have given my heart to singing. When I sing, I can feel romance in everything around me.",Kailash Kher,"Love, Music, Heart"
Don't be afraid to give up the good to go for the great.,John D. Rockefeller,"Good, Go, Afraid"
Only great minds can afford a simple style.,Stendhal,"Simple, Style, Great Minds"
"Society is composed of two great classes those who have more dinners than appetite, and those who have more appetite than dinners.",Nicolas Chamfort,"Society, More, Two"
"If it wasn't hard, everyone would do it. It's the hard that makes it great.",Tom Hanks,"Everyone, Hard, Makes"
I'd rather attempt to do something great and fail than to attempt to do nothing and succeed.,Robert H. Schuller,"Motivational, Nothing, Succeed"
"I'm into very colorful food. Obviously lots of flavor, but I think we eat with our eyes first, so it has to look great. The presentation has to be great.",Giada De Laurentiis,"Food, Eyes, Look"
All great empires die from within.,Terry Bradshaw,"Die, Empires, Within"
"I think we all have our own personality, unique and distinctive, and at the same time, I think that our own unique and distinctive personality blends with the wind, with the footsteps in the street, with the noises around the corner, and with the silence of memory, which is the great producer of ghosts.",Octavio Paz,"Time, Personality, Silence"
Great work is done by people who are not afraid to be great.,Fernando Flores,"Work, Fear, Done"
Great things in business are never done by one person. They're done by a team of people.,Steve Jobs,"Business, Done, People"
