title,author,tags
But Hopes are Shy Birds flying at a great distance seldom reached by the best of Guns.,John James Audubon,"Best, Hope, Guns"
"The great and abiding lesson of American history, particularly the cold war, is that the engine of capitalism, the individual, is mightier than any collective.",Rand Paul,"History, War, Capitalism"
"Study what you love, and you'll never have to work a day in your life. It'll be one great adventure.",David Gerrold,"Life, Love, Work"
"Miami is one of these great places that is a really sensual, physically beautiful place.",Michael Mann,"Beautiful, Beautiful Place, Place"
Curiosity is one of the great secrets of happiness.,Bryant H. McGill,"Happiness, Curiosity, Secrets"
"The leaders who we admire who have been able to bring great change in the past - Gandhi, Martin Luther King, Nelson Mandela - they're all inspirational religious leaders and smart tacticians. It would be nice to find the Muslim Gandhi, wouldn't it?",Dennis C. Blair,"Inspirational, Change, Smart"
Fishing is much more than fish. It is the great occasion when we may return to the fine simplicity of our forefathers.,Herbert Hoover,"Sports, Fishing, Fish"
"In 1881, my dad's grandparents, who were Norwegian farmers, immigrated to the United States - the same year my great grandfather from Laguna Pueblo was put on a train to Carlisle Indian School in Pennsylvania.",Deb Haaland,"Dad, Farmers, School"
Great theatre is about challenging how we think and encouraging us to fantasize about a world we aspire to.,Willem Dafoe,"World, Aspire, Us"
"I've heard the stories. Like, Eric Clapton said he wanted to burn his guitar when he heard Jimi Hendrix play. I never understood that because, when I went and saw a great drummer or heard one, all I wanted to do was practice.",Neil Peart,"Guitar, Practice, Burn"
"Life is short, youth is finite, and opportunities endless. Have you found the intersection of your passion and the potential for world-shaping positive impact? If you don't have a great idea of your own, there are plenty of great teams that need you - unknown startups and established teams in giant companies alike.",Justin Rosenstein,"Positive, Life, Youth"
"If you look at great human civilizations, from the Roman Empire to the Soviet Union, you will see that most do not fail simply due to external threats but because of internal weakness, corruption, or a failure to manifest the values and ideals they espouse.",Cory Booker,"Failure, Corruption, Look"
I think if there's a great depression there might be some hope.,Lawrence Ferlinghetti,"Hope, Depression, Great Depression"
"Great buildings that move the spirit have always been rare. In every case they are unique, poetic, products of the heart.",Arthur Erickson,"Architecture, Always, Heart"
"I'm never bored, never ever bored. If I've got a day off I'll sit in a cafe and watch and observe. I'm a great observer.",David Suchet,"Day, Cafe, Never"
I do not think you can name many great inventions that have been made by married men.,Nikola Tesla,"Men, Name, Think"
"Prosperity tries the fortunate, adversity the great.",Rose Kennedy,"Brainy, Adversity, Prosperity"
"The three great elemental sounds in nature are the sound of rain, the sound of wind in a primeval wood, and the sound of outer ocean on a beach.",Henry Beston,"Nature, Rain, Wind"
"An unexamined faith is not worth having, for fundamentalism and uncritical certitude entail the rejection of one of the great human gifts: that of free will, of the liberty to make up our own minds based on evidence and tradition and reason.",Jon Meacham,"Faith, Free, Will"
"The great thing about getting older is that you become more mellow. Things aren't as black and white, and you become much more tolerant. You can see the good in things much more easily rather than getting enraged as you used to do when you were young.",Maeve Binchy,"Good, Getting Older, Black And White"
"Near the gates and within two cities there will be scourges the like of which was never seen: famine within plague, people put out by steel, crying to the great immortal God for relief.",Nostradamus,"God, Will, People"
Nurture your minds with great thoughts. To believe in the heroic makes heroes.,Benjamin Disraeli,"Inspirational, Thoughts, Your"
Brevity is a great charm of eloquence.,Marcus Tullius Cicero,"Brevity, Charm, Eloquence"
That's the great thing about being a teenager. You think you're a genius.,Daveed Diggs,"Genius, Think, Being A Teenager"
"If fear is the great enemy of intimacy, love is its true friend.",Henri Nouwen,"Love, Fear, Love Is"
Fake eyelashes are a great way to step up your look to the next level.,Jeffree Star,"Your, Step, Look"
"It's always better to shock people and change people's expectations than to give them exactly what they think you can do. It's not unexpected for me to be in a comedy film anymore; I'm no longer the underdog in that world. Not that I'm great or good at it or anything, it's just that I've done a bunch of them, so you're not shocked.",Jonah Hill,"Change, Good, Done"
The great leaders are like the best conductors - they reach beyond the notes to reach the magic in the players.,Blaine Lee,"Best, Business, Magic"
We want to do a lot of stuff; we're not in great shape. We didn't get a good night's sleep. We're a little depressed. Coffee solves all these problems in one delightful little cup.,Jerry Seinfeld,"Good, Coffee, Problems"
"I love getting anything homemade - anything that's from the heart. If you can make or craft your own something, that always goes above and beyond, like, a candle - which is great, but if it's homemade, that's so much better for me.",David Burtka,"Love, Always, Candle"
I love going to the beach and swimming in the ocean. I think it's so relaxing. It's also a great form of active recovery. It's perfect for those rest days when you still want to move a little bit.,Eugenie Bouchard,"Love, Swimming, Rest"
We are all faced with a series of great opportunities - brilliantly disguised as insoluble problems.,John W. Gardner,"Problems, Opportunities, Series"
"There are two powers in the world; one is the sword and the other is the pen. There is a great competition and rivalry between the two. There is a third power stronger than both, that of the women.",Muhammad Ali Jinnah,"Women, Power, Competition"
"The first test of a truly great man is his humility. By humility I don't mean doubt of his powers or hesitation in speaking his opinion, but merely an understanding of the relationship of what he can say and what he can do.",John Ruskin,"Relationship, Man, Humility"
The universe begins to look more like a great thought than a great machine.,James Jeans,"Universe, Look, Machine"
"Great is truth, but still greater, from a practical point of view, is silence about truth. By simply not mentioning certain subjects... totalitarian propagandists have influenced opinion much more effectively than they could have by the most eloquent denunciations.",Aldous Huxley,"Truth, Silence, View"
"Lesser artists borrow, great artists steal.",Igor Stravinsky,"Art, Steal, Borrow"
The world is the great gymnasium where we come to make ourselves strong.,Swami Vivekananda,"Strength, World, Strong"
Mental health needs a great deal of attention. It's the final taboo and it needs to be faced and dealt with.,Adam Ant,"Health, Attention, Mental Health"
"Wealth consists not in having great possessions, but in having few wants.",Epictetus,"Finance, Wealth, Possessions"
"The danger to society is not merely that it should believe wrong things, though that is great enough; but that it should become credulous, and lose the habit of testing things and inquiring into them; for then it must sink back into savagery.",William Kingdon Clifford,"Society, Believe, Lose"
"We don't sell a car, we sell a dream. We are Italy's national team. There are many great soccer teams in our country, but there is only one Ferrari.",Luca Cordero di Montezemolo,"Car, Country, Dream"
Success doesn't necessarily come from breakthrough innovation but from flawless execution. A great strategy alone won't win a game or a battle; the win comes from basic blocking and tackling.,Naveen Jain,"Success, Alone, Battle"
"There is no recipe to be a great teacher, that's what is unique about them.",Robert Sternberg,"Teacher, Unique, Recipe"
Society is like a large piece of frozen water; and skating well is the great art of social life.,Letitia Elizabeth Landon,"Life, Society, Art"
"The ancient Greek philosophers were blonde and blue-eyed and, even then, talked about how their race was mixed with others and how this affected their society negatively. When there were no more natural blondes and no more blue eyes in Greece, they incidentally stopped producing great philosophers.",Varg Vikernes,"Society, Eyes, Blue"
"To the well-organized mind, death is but the next great adventure.",J. K. Rowling,"Death, Mind, Adventure"
I'm a great believer in geography being destiny.,Abraham Verghese,"Destiny, Geography, Believer"
"So she went into the garden to cut a cabbage-leaf, to make an apple-pie; and at the same time a great she-bear, coming up the street, pops its head into the shop. 'What! no soap?' So he died, and she very imprudently married the barber.",Samuel Foote,"Time, Street, Garden"
"In reading the lives of great men, I found that the first victory they won was over themselves... self-discipline with all of them came first.",Harry S Truman,"Men, Victory, Self-Discipline"
"Discrimination due to age is one of the great tragedies of modern life. The desire to work and be useful is what makes life worth living, and to be told your efforts are not needed because you are the wrong age is a crime.",Johnny Ball,"Life, Work, Age"
"I think that any time of great pain is a time of transformation, a fertile time to plant new seeds.",Debbie Ford,"Time, Pain, Plant"
"Man as an individual is a genius. But men in the mass form the headless monster, a great, brutish idiot that goes where prodded.",Charlie Chaplin,"Men, Man, Genius"
It's great to be here. It's great to be anywhere.,Keith Richards,"Here, Anywhere"
"My job as a leader is to make sure everybody in the company has great opportunities, and that they feel they're having a meaningful impact and are contributing to the good of society. As a world, we're doing a better job of that. My goal is for Google to lead, not follow that.",Larry Page,"Good, Society, World"
"Death comes to all, but great achievements build a monument which shall endure until the sun grows cold.",Georg Fabricius,"Death, Sun, Cold"
"I am concerned for the security of our great Nation; not so much because of any threat from without, but because of the insidious forces working from within.",Douglas MacArthur,"I Am, Security, Nation"
"The library of my elementary school had this great biography section, and I read all of these paperback biographies until they were dog-eared. The story of Eleanor Roosevelt and Madame Curie and Martin Luther King and George Washington Carver and on and on and on.",Christine Quinn,"King, Library, School"
Good writers borrow from other writers. Great writers steal from them outright.,Aaron Sorkin,"Good, Steal, Borrow"
"I love photography. My boyfriend's got a great camera, which I bought for his birthday.",Sarah Sutton,"Love, Birthday, Camera"
"Perseverance is a great element of success. If you only knock long enough and loud enough at the gate, you are sure to wake up somebody.",Henry Wadsworth Longfellow,"Success, Perseverance, Long"
"One of the best ways to make yourself happy in the present is to recall happy times from the past. Photos are a great memory-prompt, and because we tend to take photos of happy occasions, they weight our memories to the good.",Gretchen Rubin,"Best, Good, Memories"
"You want to give me chocolate and flowers? That would be great. I love them both. I just don't want them out of guilt, and I don't want them if you're not going to give them to all the people who helped mother our children.",Anne Lamott,"Love, Me, Children"
"The great liability of the engineer compared to men of other professions is that his works are out in the open where all can see them. His acts, step by step, are in hard substance. He cannot bury his mistakes in the grave like the doctors. He cannot argue them into thin air or blame the judge like the lawyers.",Herbert Hoover,"Men, Step, Blame"
"As usual, there is a great woman behind every idiot.",John Lennon,"Women, Woman, Idiot"
What great thing would you attempt if you knew you could not fail?,Robert H. Schuller,"Inspirational, Attempt, Knew"
"A good dancer is not necessarily defined by great technique, skill, or ability to pick up choreography but by confidence. When you feel the music, it penetrates to your soul. Everybody's a dancer. The greatest dancer is someone who is willing to dance, not afraid.",Alyssa Edwards,"Good, Music, Your"
"Great political leaders risk unpopularity, patiently explain their case and confront prejudice, bigotry and vested interests.",Ann Widdecombe,"Political, Political Leaders, Prejudice"
"Great things are not done by impulse, but by a series of small things brought together.",George Eliot,"Done, Small Things, Together"
Zumba is a great dance-cardio option that's an immersive experience for participants and is not only effective but allows you to express yourself while getting in shape.,Jason Derulo,"Experience, Yourself, Express Yourself"
"Curiosity about life in all of its aspects, I think, is still the secret of great creative people.",Leo Burnett,"Life, Curiosity, People"
"Whether it is a tsunami, or whether it is a hurricane, whether it's an earthquake - when we see these great fatal and natural acts, men and women of every ethnic persuasion come together and they just want to help.",Martin Luther King III,"Women, Men, Together"
"Justice, sir, is the great interest of man on earth. It is the ligament which holds civilized beings and civilized nations together.",Daniel Webster,"Politics, Justice, Man"
"If I were not able to separate the art from the artists, I think I would limit myself a great deal, and life wouldn't be nearly as interesting.",Jessye Norman,"Life, Art, Myself"
It's never too late to be great.,Jordan Burroughs,"Never Too Late, Late, Never"
"All of the great leaders have had one characteristic in common: it was the willingness to confront unequivocally the major anxiety of their people in their time. This, and not much else, is the essence of leadership.",John Kenneth Galbraith,"Leadership, Time, People"
The great thing about rock and roll is that someone like me can be a star.,Elton John,"Rock And Roll, Me, Someone"
I have great genes. Thank you to my mom and dad for that one.,Gloria Estefan,"Mom, Dad, Mom And Dad"
"I am not a great cook, I am not a great artist, but I love art, and I love food, so I am the perfect traveller.",Michael Palin,"Love, Art, Food"
Do not say a little in many words but a great deal in a few.,Pythagoras,"Words, Say, Deal"
"One of the easiest things to incorporate into your everyday life is plank exercises: great for your core, great for your lower back.",David Kirsch,"Life, Your, Back"
"When more Americans prefer freebies to freedom, these great United States will become a fertile ground for tyranny.",Allen West,"Freedom, Will, Tyranny"
"I think it's great to be flawed. I am hugely flawed, and I like it this way. That's the fun of life. You fall, get up, make mistakes, learn from them, be human and be you.",Priyanka Chopra,"Life, I Am, Way"
"The past is a great place and I don't want to erase it or to regret it, but I don't want to be its prisoner either.",Mick Jagger,"Regret, Past, Place"
I'm a good teacher and am great at observation and picking out what's wrong and fixing it.,Abby Lee Miller,"Good, Teacher, Good Teacher"
"What is man without the beasts? For if all the beast were gone, man would die of a great loneliness of the spirit.",Chief Seattle,"Loneliness, Man, Die"
Unemployment is a great tragedy. The man who goes about hopelessly seeking work in order to earn bread for his children is a living reproach to civilization.,Carlos Saavedra Lamas,"Work, Man, Living"
"In many ways, human health is the great global connector.",Kathleen Sebelius,"Health, Human, Global"
"I have always loved fashion because it's a great way to express your mood. And I'm definitely a shoe lover. The right pair of shoes can change the feel of an outfit, and even change how a woman feels about herself. A woman can wear confidence on her feet with a high stiletto, or slip into weekend comfort with a soft ballet flat.",Fergie,"Change, Always, Your"
Innovation comes out of great human ingenuity and very personal passions.,Megan Smith,"Innovation, Human, Personal"
"Everybody wants to be good, but not many are prepared to make the sacrifices it takes to be great. To many people, being nice in order to be liked is more important. There's equal merit in that, but you must not confuse being good with being liked.",Paul Arden,"Good, Important, People"
People are going to copy your product if you build great stuff. Just because Yahoo has a search box doesn't make it Google.,Evan Spiegel,"Your, Search, People"
"I think the great part about what I do is that there's a scoreboard. At the end of every week, you know how you did. You know how well you prepared. You know whether you executed your game plan. There's a tangible score.",Tom Brady,"Your, Game, Know"
"It feels great to be home, great to be back as a part of the community.",Brian Jordan,"Home, Community, Back"
"When it's good it's great, it's really great.",Jennifer Connelly,"Good, Really"
Great partnerships thrive because the people need each other.,Courtney A. Kemp,"People, Partnerships, Thrive"
"Great leaders have a heart for people. They take time for people. They view people as the bottom line, not as a tool to get to the bottom line.",Pat Williams,"Time, Heart, View"
Pursue one great decisive aim with force and determination.,Carl von Clausewitz,"Motivational, Determination, Aim"
Meditation is a great way to keep my body well-centered while juggling shooting schedules and recording sessions.,Ariana Grande,"Body, Keep, Way"
"Our government is deeply disordered; its credit is impaired; its debt increasing; its expenditures extravagant and wasteful; its disbursements without efficient accountability; and its taxes (for duties are but taxes) enormous, unequal, and oppressive to the great producing classes of the country.",John C. Calhoun,"Government, Country, Credit"
"I am a firm believer in education and have worked very hard to tell young Latinos that they must go to college and that, if possible, they should pursue an advanced degree. I am convinced that education is the great equalizer.",Jimmy Smits,"Education, I Am, Possible"
Art begins with resistance - at the point where resistance is overcome. No human masterpiece has ever been created without great labor.,Andre Gide,"Art, Overcome, Human"
Being the captain is a great privilege and a responsibility to lead a great group with different cultures.,Sergio Ramos,"Responsibility, Group, Privilege"
"Give a little love to a child, and you get a great deal back.",John Ruskin,"Love, Family, Back"
"Government is the great fiction, through which everybody endeavors to live at the expense of everybody else.",Frederic Bastiat,"Government, Live, Through"
"A lot of people, when a guy scores a lot of goals, think, 'He's a great player', because a goal is very important, but a great player is a player who can do everything on the field. He can do assists, encourage his colleagues, give them confidence to go forward. It is someone who, when a team does not do well, becomes one of the leaders.",Pele,"Colleagues, Confidence, Goals"
The most striking development of the great depression of 1929 is a profound skepticism of the future of contemporary society among large sections of the American people.,C. L. R. James,"Future, Society, Depression"
"Simplicity, clarity, singleness: These are the attributes that give our lives power and vividness and joy as they are also the marks of great art. They seem to be the purpose of God for his whole creation.",Richard Holloway,"God, Power, Art"
An out-and-out fast bowler is one of the great sights in cricket.,James Anderson,"Cricket, Fast, Bowler"
Every great political campaign rewrites the rules; devising a new way to win is what gives campaigns a comparative advantage against their foes.,John Podhoretz,"Political, Win, Way"
"I've always been unhappy with my teeth. I've lost most of them from my bottom jaw, and those in the upper jaw have been screwed in or capped. As a result, I've got great hollows under my cheeks, and my bone structure seems accentuated.",Kate O'Mara,"Always, Result, Lost"
"More than anything, I like a jacket. You can do anything with a great jacket, the bigger the better. You can have any silhouette underneath. It gives you an attitude. It makes a gown look cool.",Rihanna,"Attitude, Cool, Better"
"Myself when young did eagerly frequent doctor and saint, and heard great argument about it and about: but evermore came out by the same door as in I went.",Omar Khayyam,"Myself, Doctor, Door"
The bravest sight in the world is to see a great man struggling against adversity.,Lucius Annaeus Seneca,"Adversity, Man, World"
That's another great thing about getting older. Your life is written on your face.,Frances McDormand,"Life, Your, Getting Older"
"My message, especially to young people is to have courage to think differently, courage to invent, to travel the unexplored path, courage to discover the impossible and to conquer the problems and succeed. These are great qualities that they must work towards. This is my message to the young people.",A. P. J. Abdul Kalam,"Work, Courage, Travel"
You don't concentrate on risks. You concentrate on results. No risk is too great to prevent the necessary job from getting done.,Chuck Yeager,"Chance, Done, Risks"
"High school is what kind of grows you into the person you are. I have great memories, good and bad, some learning experiences and some that I'll take with me the rest of my life.",Giancarlo Stanton,"Life, Good, Learning"
Great deeds are usually wrought at great risks.,Herodotus,"Chance, Risks, Deeds"
"When you don't have anything to lose, you discover something wonderful: you're free to take great risks without fear or reservation.",Tullian Tchividjian,"Fear, Risks, Lose"
We are continually faced by great opportunities brilliantly disguised as insoluble problems.,Lee Iacocca,"Problems, Opportunities, Disguised"
The difference between something good and something great is attention to detail.,Charles R. Swindoll,"Good, Attention, Difference"
"If you listen to your fears, you will die never knowing what a great person you might have been.",Robert H. Schuller,"Business, Your, Die"
"That seems to me the great American danger we're all in, that we'll bargain away the experience of being alive for the appearance of it.",Mike Nichols,"Experience, Me, Alive"
Great dreams of great dreamers are always transcended.,A. P. J. Abdul Kalam,"Dreams, Always, Dreamers"
"Our political leaders have great responsibilities, but as with many situations in life, people often rise or fall to meet your expectations. Our responsibility as citizens is to expect our leaders to lead and to give them enough support so that they may do so.",Paul Polman,"Life, Political, Your"
"As Faulkner says, all of us have the capacity in us for great good and for great evil, for love but also for hate. I wanted to write those kinds of complex character in a fantasy, and not just have all the good people get together to fight the bad guy.",George R. R. Martin,"Love, Good, Character"
"We are all racing towards death. No matter how many great, intellectual conclusions we draw during our lives, we know they're all only man-made, like God. I begin to wonder where it all leads. What can you do, except do what you can do as best you know how.",John Hurt,"Best, God, Death"
"As far as Saddam Hussein being a great military strategist, he is neither a strategist, nor is he schooled in the operational arts, nor is he a tactician, nor is he a general, nor is he a soldier. Other than that, he's a great military man, I want you to know that.",Norman Schwarzkopf,"Man, Know, Soldier"
"Right now I'd love to be sitting on a Greek island somewhere because of being Greek American, eating great octopus salad and some fantastic lamb. Or sipping a little ouzo. I think the Mediterranean diet is one of the healthiest... Lots of nuts, vegetables, fruits, fresh fish, lean meats, yogurt.",Cat Cora,"Love, Diet, Fish"
All great truths begin as blasphemies.,George Bernard Shaw,"Truth, Begin, Truths"
"For everything bad, there's a million really exciting things, whether it's someone puts out a really great book, there's a new movie, there's a new detective, the sky is unbelievably golden, or you have the best cup of coffee you ever had in your life.",Patti Smith,"Life, Best, Sky"
"Dreams can still come true; you need a great deal of energy and determination, and a little bit of luck.",Stefano Gabbana,"Dreams, Determination, Luck"
"Having soon discovered to be great, I must appear so, and therefore studiously avoided mixing in society, and wrapped myself in mystery, devoting my time to fasting and prayer.",Nat Turner,"Time, Society, Myself"
My great hope is to laugh as much as I cry; to get my work done and try to love somebody and have the courage to accept the love in return.,Maya Angelou,"Love, Work, Courage"
"The happiness of most people is not ruined by great catastrophes or fatal errors, but by the repetition of slowly destructive little things.",Ernest Dimnet,"Happiness, Repetition, Little Things"
Love is the great miracle cure. Loving ourselves works miracles in our lives.,Louise L. Hay,"Love, Love Is, Miracles"
