title,author,tags
My mom is definitely my rock.,Alicia Keys,"Mom, Rock, Definitely"
The most important thing a father can do for his children is to love their mother.,Theodore Hesburgh,"Love, Father, Important"
Mother is the name for God in the lips and hearts of little children.,William Makepeace Thackeray,"God, Name, Children"
"All that I am, or hope to be, I owe to my angel mother.",Abraham Lincoln,"Hope, Angel, I Am"
A mother's arms are made of tenderness and children sleep soundly in them.,Victor Hugo,"Sleep, Children, Mother"
My mother is a walking miracle.,Leonardo DiCaprio,"Walking, Mother, Miracle"
Life began with waking up and loving my mother's face.,George Eliot,"Life, Face, Mother"
"God could not be everywhere, and therefore he made mothers.",Rudyard Kipling,"God, Made, Therefore"
Sometimes the strength of motherhood is greater than natural laws.,Barbara Kingsolver,"Strength, Sometimes, Laws"
Motherhood: All love begins and ends there.,Robert Browning,"Love, Motherhood, Begins"
"Mama was my greatest teacher, a teacher of compassion, love and fearlessness. If love is sweet as a flower, then my mother is that sweet flower of love.",Stevie Wonder,"Love, Teacher, Love Is"
"Mother's love is peace. It need not be acquired, it need not be deserved.",Erich Fromm,"Love, Peace, Love Is"
The love of a mother is the veil of a softer light between the heart and the heavenly Father.,Samuel Taylor Coleridge,"Love, Heart, Light"
Children are the anchors that hold a mother to life.,Sophocles,"Life, Children, Mother"
"A mother's happiness is like a beacon, lighting up the future but reflected also on the past in the guise of fond memories.",Honore de Balzac,"Happiness, Future, Memories"
For when a child is born the mother also is born again.,Gilbert Parker,"Mother, Born, Child"
I was always at peace because of the way my mom treated me.,Martina Hingis,"Peace, Mom, Always"
I remember my mother's prayers and they have always followed me. They have clung to me all my life.,Abraham Lincoln,"Life, Always, Remember"
Motherhood is... difficult and... rewarding.,Gloria Estefan,"Difficult, Motherhood, Rewarding"
"If evolution really works, how come mothers only have two hands?",Milton Berle,"Hands, Evolution, Only"
There is nothing in the world of art like the songs mother used to sing.,Billy Sunday,"Art, World, Nothing"
"It may be possible to gild pure gold, but who can make his mother more beautiful?",Mahatma Gandhi,"Beautiful, Gold, Mother"
I got to grow up with a mother who taught me to believe in me.,Antonio Villaraigosa,"Believe, Grow, Me"
With what price we pay for the glory of motherhood.,Isadora Duncan,"Glory, Price, Pay"
When my mother had to get dinner for 8 she'd just make enough for 16 and only serve half.,Gracie Allen,"Dinner, Enough, Mother"
"The babe at first feeds upon the mother's bosom, but it is always on her heart.",Henry Ward Beecher,"Always, Heart, Mother"
Who's a boy gonna talk to if not his mother?,Donald E. Westlake,"Mother, Talk, Boy"
"My dear Mama, you are definitely the hen who hatched a famous duck.",Henri de Toulouse-Lautrec,"Famous, Mama, Duck"
