title,author,tags
"The World is my country, all mankind are my brethren, and to do good is my religion.",Thomas Paine,"Good, World, Country"
"Religion is regarded by the common people as true, by the wise as false, and by the rulers as useful.",Lucius Annaeus Seneca,"Wise, True, People"
"I would rather live my life as if there is a God and die to find out there isn't, than live as if there isn't and to die to find out that there is.",Albert Camus,"Life, God, Die"
"We have to pray with our eyes on God, not on the difficulties.",Oswald Chambers,"God, Eyes, Difficulties"
When the missionaries came to Africa they had the Bible and we had the land. They said 'Let us pray.' We closed our eyes. When we opened them we had the Bible and they had the land.,Desmond Tutu,"Eyes, Bible, Africa"
Prayer is aligning ourselves with the purposes of God.,E. Stanley Jones,"God, Prayer, Ourselves"
Religion is what keeps the poor from murdering the rich.,Napoleon Bonaparte,"Rich, Poor, Keeps"
Science can purify religion from error and superstition. Religion can purify science from idolatry and false absolutes.,Pope John Paul II,"Science, Superstition, False"
"See, I have set before you this day life and good, death and evil... I have set before you life and death, blessing and curse; therefore choose life.",Moses,"Life, Death, Good"
Aim at heaven and you will get earth thrown in. Aim at earth and you get neither.,C. S. Lewis,"Aim, Will, Heaven"
The more I study religions the more I am convinced that man never worshipped anything but himself.,Richard Burton,"Man, I Am, Never"
To be a Christian without prayer is no more possible than to be alive without breathing.,Martin Luther,"Prayer, Alive, Possible"
"The Kingdom of Heaven is not a place, but a state of mind.",John Burroughs,"Mind, Heaven, Place"
Heaven is under our feet as well as over our heads.,Henry David Thoreau,"Feet, Heaven, Well"
"So I say to you, Ask and it will be given to you; search, and you will find; knock, and the door will be opened for you.",Jesus Christ,"Search, Will, Find"
My religion is very simple. My religion is kindness.,Dalai Lama,"Kindness, Simple, Very"
I prayed for twenty years but received no answer until I prayed with my legs.,Frederick Douglass,"Legs, Answer, Until"
"I like the religion that teaches liberty, equality and fraternity.",B. R. Ambedkar,"Equality, Liberty, Fraternity"
"Prayer does not change God, but it changes him who prays.",Soren Kierkegaard,"Change, God, Prayer"
"When I do good I feel good, when I do bad I feel bad, and that's my religion.",Abraham Lincoln,"Good, Bad, Feel Good"
You cannot believe in God until you believe in yourself.,Swami Vivekananda,"God, Believe In Yourself, Believe"
"I do not feel obliged to believe that the same God who has endowed us with sense, reason, and intellect has intended us to forgo their use.",Galileo Galilei,"God, Believe, Feel"
Human beings must be known to be loved; but Divine beings must be loved to be known.,Blaise Pascal,"Human, Divine, Loved"
"Since many of you do not belong to the Catholic Church and others are non-believers, from the bottom of my heart I give this silent blessing to each and every one of you, respecting the conscience of each one of you but knowing that each one of you is a child of God.",Pope Francis,"God, Heart, Blessing"
"There are many of us that are willing to do great things for the Lord, but few of us are willing to do little things.",Dwight L. Moody,"Great, Little Things, Great Things"
Religion is about turning untested belief into unshakable truth through the power of institutions and the passage of time.,Richard Dawkins,"Truth, Power, Time"
"This is my simple religion. There is no need for temples; no need for complicated philosophy. Our own brain, our own heart is our temple; the philosophy is kindness.",Dalai Lama,"Kindness, Brain, Heart"
Prayer is the key of the morning and the bolt of the evening.,Mahatma Gandhi,"Morning, Prayer, Evening"
"When I admire the wonders of a sunset or the beauty of the moon, my soul expands in the worship of the creator.",Mahatma Gandhi,"Beauty, Soul, Moon"
Teach us to give and not to count the cost.,Saint Ignatius,"Us, Cost, Teach"
"Even if a unity of faith is not possible, a unity of love is.",Hans Urs von Balthasar,"Love, Faith, Love Is"
"The Bible shows the way to go to heaven, not the way the heavens go.",Galileo Galilei,"Bible, Way, Heaven"
"Religion is part of the human make-up. It's also part of our cultural and intellectual history. Religion was our first attempt at literature, the texts, our first attempt at cosmology, making sense of where we are in the universe, our first attempt at health care, believing in faith healing, our first attempt at philosophy.",Christopher Hitchens,"Health, Faith, History"
"Religion is everywhere. There are no human societies without it, whether they acknowledge it as a religion or not.",Octavia E. Butler,"Human, Without, Acknowledge"
"There is no need for temples, no need for complicated philosophies. My brain and my heart are my temples; my philosophy is kindness.",Dalai Lama,"Kindness, Brain, Heart"
I am thankful I can see much to admire in all religions.,Alfred Russel Wallace,"Thankful, I Am, All Religions"
Within the covers of the Bible are the answers for all the problems men face.,Ronald Reagan,"Men, Bible, Face"
"I'm a Muslim, but I think Jesus would have a drink with me. He would be cool. He would talk to me.",Mike Tyson,"Cool, Me, Talk"
"I love you when you bow in your mosque, kneel in your temple, pray in your church. For you and I are sons of one religion, and it is the spirit.",Khalil Gibran,"Love, Your, Temple"
Let your religion be less of a theory and more of a love affair.,Gilbert K. Chesterton,"Love, Your, Theory"
A thorough knowledge of the Bible is worth more than a college education.,Theodore Roosevelt,"Education, Knowledge, Bible"
I never knew how to worship until I knew how to love.,Henry Ward Beecher,"Love, Never, Until"
"We are punished by our sins, not for them.",Elbert Hubbard,"Punished, Them, Our"
No man ever believes that the Bible means what it says: He is always convinced that it says what he means.,George Bernard Shaw,"Always, Bible, Man"
The Son of God became man so that we might become God.,Athanasius,"God, Man, Son"
Worship is a way of seeing the world in the light of God.,Abraham Joshua Heschel,"God, Light, World"
"Rivers, ponds, lakes and streams - they all have different names, but they all contain water. Just as religions do - they all contain truths.",Muhammad Ali,"Water, Religions, Different"
"However many holy words you read, however many you speak, what good will they do you if you do not act on upon them?",Buddha,"Good, Will, Words"
Where it is a duty to worship the sun it is pretty sure to be a crime to examine the laws of heat.,John Morley,"Sun, Duty, Crime"
"God made everything out of nothing, but the nothingness shows through.",Paul Valery,"God, Nothing, Everything"
"We can only learn to know ourselves and do what we can - namely, surrender our will and fulfill God's will in us.",Saint Teresa of Avila,"God, Will, Know"
"For God so loved the World that he gave his only Son, that whoever believes in him should not perish but have eternal life.",Jesus Christ,"Life, God, World"
One act of obedience is better than one hundred sermons.,Dietrich Bonhoeffer,"Better, Obedience, Act"
Religion is more like response to a friend than it is like obedience to an expert.,Austin Farrer,"Obedience, Expert, Friend"
"A just laicism allows religious freedom. The state does not impose religion but rather gives space to religions with a responsibility toward civil society, and therefore it allows these religions to be factors in building up society.",Pope Benedict XVI,"Freedom, Society, Space"
"Whether one believes in a religion or not, and whether one believes in rebirth or not, there isn't anyone who doesn't appreciate kindness and compassion.",Dalai Lama,"Kindness, Compassion, Appreciate"
My life was changed in one breath from God.,Donna Summer,"Life, God, My Life"
"The framers of our Constitution meant we were to have freedom of religion, not freedom from religion.",Billy Graham,"Freedom, Constitution, Our"
"If, then, you are looking for the way by which you should go, take Christ, because He Himself is the way.",Thomas Aquinas,"Way, Looking, Go"
We are always on the anvil; by trials God is shaping us for higher things.,Henry Ward Beecher,"God, Always, Trials"
There is nothing evil save that which perverts the mind and shackles the conscience.,Saint Ambrose,"Mind, Nothing, Evil"
"Give yourself entirely to God, enter and hide in the hidden ground of your soul.",Johannes Tauler,"God, Your, Soul"
"Krishna children were taught that in the spiritual world there were no parents, only souls and hence this justified their being kept out of view from others, cloistered in separate buildings and sheltered from the evil material world.",Mary Garden,"World, Parents, View"
The God who existed before any religion counts on you to make the oneness of the human family known and celebrated.,Desmond Tutu,"God, Family, Human"
"Jesus is ideal and wonderful, but you Christians - you are not like him.",Mahatma Gandhi,"Wonderful, Like, Ideal"
We must seek the loving-kindness of God in all the breadth and open-air of common life.,George A. Smith,"Life, God, Must"
Anti-religious sneers are a hallmark of perpetual adolescents.,Camille Paglia,"Hallmark, Perpetual"
The Bible is worth all the other books which have ever been printed.,Patrick Henry,"Bible, Worth, Which"
"My mom's a Catholic, and my dad's a Jew, and they didn't want anything to do with anything.",Isabelle Huppert,"Mom, Dad, Anything"
"When we blindly adopt a religion, a political system, a literary dogma, we become automatons. We cease to grow.",Anais Nin,"Political, Grow, Blindly"
"The Sabbath is a weekly cathedral raised up in my dining room, in my family, in my heart.",Anita Diament,"Family, Heart, Room"
There seems to be a terrible misunderstanding on the part of a great many people to the effect that when you cease to believe you may cease to behave.,Louis Kronenberger,"Great, Believe, Misunderstanding"
I hope I never get so old I get religious.,Ingmar Bergman,"Hope, Never, Old"
Wonder is the basis of worship.,Thomas Carlyle,"Wonder, Worship, Basis"
"The Godhead consists of the Father, the Son, and the Holy Spirit. The Father is a material being.",Orson Pratt,"Father, Son, Holy Spirit"
Only a god can save us.,Martin Heidegger,"God, Us, Only"
Work out your own salvation. Do not depend on others.,Buddha,"Work, Your, Own"
"Religion in its humility restores man to his only dignity, the courage to live by grace.",George Santayana,"Courage, Man, Grace"
"Just as a candle cannot burn without fire, men cannot live without a spiritual life.",Buddha,"Life, Men, Candle"
"Many good sayings are to be found in holy books, but merely reading them will not make one religious.",Ramakrishna,"Good, Will, Reading"
Toleration is the best religion.,Victor Hugo,"Best, Toleration"
"Being religious means asking passionately the question of the meaning of our existence and being willing to receive answers, even if the answers hurt.",Paul Tillich,"Hurt, Meaning, Meaning Of"
"Just as the soul fills the body, so God fills the world. Just as the soul bears the body, so God endures the world. Just as the soul sees but is not seen, so God sees but is not seen. Just as the soul feeds the body, so God gives food to the world.",Marcus Tullius Cicero,"God, Food, Soul"
"It is easy to talk on religion, but difficult to practice it.",Ramakrishna,"Practice, Difficult, Easy"
All religions must be tolerated... for every man must get to heaven in his own way.,Epictetus,"Man, Way, Own"
"Muslims must believe that all power, success and victory comes from God alone.",Abu Bakar Bashir,"Success, Alone, God"
More and more people care about religious tolerance as fewer and fewer care about religion.,Alexander Chase,"Care, Tolerance, People"
Jesus does not give recipes that show the way to God as other teachers of religion do. He is himself the way.,Karl Barth,"God, Way, Teachers"
"Let us not seek to bring religion to others, but let us endeavor to live it ourselves.",Paul Tournier,"Live, Others, Us"
It is only when men begin to worship that they begin to grow.,Calvin Coolidge,"Men, Grow, Only"
"Myself, first of all, I am a Jew. And that is the most important thing for me.",Ariel Sharon,"Myself, I Am, Me"
"My country is the world, and my religion is to do good.",Thomas Paine,"Good, World, Country"
Religion is essentially the art and the theory of the remaking of man. Man is not a finished creation.,Edmund Burke,"Art, Man, Creation"
Nothing is so fatal to religion as indifference.,Edmund Burke,"Nothing, Indifference, Fatal"
Worship means reverence and humility it means revering your real self and humbling delusions.,Bodhidharma,"Your, Humility, Real"
"A religious man is a person who holds God and man in one thought at one time, at all times, who suffers harm done to others, whose greatest passion is compassion, whose greatest strength is love and defiance of despair.",Abraham Joshua Heschel,"Love, God, Strength"
Christianity helps us face the music even when we don't like the tune.,Phillips Brooks,"Music, Face, Us"
"I was raised Catholic, but my father's people were Methodist, so we went to both churches.",Aaron Neville,"Father, People, I Was Raised"
"Earth changes, but thy soul and God stand sure.",Robert Browning,"God, Soul, Stand"
"I think you can judge from somebody's actions a kind of a stability and sense of purpose perhaps created by strong religious roots. I mean, there's a certain patience, a certain discipline, I think, that religion helps you achieve.",George W. Bush,"Patience, Discipline, Purpose"
God is a metaphor for that which transcends all levels of intellectual thought. It's as simple as that.,Joseph Campbell,"God, Simple, Intellectual"
Prayer is the spirit speaking truth to Truth.,Philip James Bailey,"Truth, Prayer, Spirit"
Disturbances in society are never more fearful than when those who are stirring up the trouble can use the pretext of religion to mask their true designs.,Denis Diderot,"Society, Mask, True"
"Morality is of the highest importance - but for us, not for God.",Albert Einstein,"God, Morality, Us"
Doubt is part of all religion. All the religious thinkers were doubters.,Isaac Bashevis Singer,"Doubt, Part, Religious"
"I call religion a natural authority, but it has usually been conceived as a supernatural authority.",Herbert Read,"Authority, Supernatural, Call"
"Religion kept some of my relatives alive, because it was all they had. If they hadn't had some hope of heaven, some companionship in Jesus, they probably would have committed suicide, their lives were so hellish.",Octavia E. Butler,"Hope, Suicide, Alive"
"Science without religion is lame, religion without science is blind.",Albert Einstein,"Science, Blind, Without"
We are a religious people whose institutions presuppose a Supreme Being.,William O. Douglas,"People, Institutions, Being"
"True religion is real living; living with all one's soul, with all one's goodness and righteousness.",Albert Einstein,"Soul, Living, True"
"Religion's in the heart, not in the knees.",Douglas William Jerrold,"Heart, Knees"
The glory of Christianity is to conquer by forgiveness.,William Blake,"Forgiveness, Conquer, Glory"
God is a thought who makes crooked all that is straight.,Friedrich Nietzsche,"God, Straight, Who"
It's wonderful to climb the liquid mountains of the sky. Behind me and before me is God and I have no fears.,Helen Keller,"God, Sky, Me"
"It is wonderful how much time good people spend fighting the devil. If they would only expend the same amount of energy loving their fellow men, the devil would die in his own tracks of ennui.",Helen Keller,"Good, Time, Men"
"I was always respectful of people who were deeply religious because I always felt that if they gave themselves to it, then it had to be important to them. But if you can go through life without it, that's OK, too. It's whatever suits you.",Clint Eastwood,"Life, Always, Important"
This is all the inheritance I give to my dear family. The religion of Christ will give them one which will make them rich indeed.,Patrick Henry,"Family, Rich, Will"
"Every man, either to his terror or consolation, has some sense of religion.",Heinrich Heine,"Man, Sense, Every Man"
"To the first class belong the Gospels and Acts; to the second, the Epistles; to the third, the Revelation.",Philip Schaff,"First, Class, Belong"
To gather with God's people in united adoration of the Father is as necessary to the Christian life as prayer.,Martin Luther,"Life, God, Prayer"
I don't believe in God but I'm very interested in her.,Arthur C. Clarke,"God, Believe, Interested"
Preach the Gospel at all times and when necessary use words.,Unknown,"Words, Gospel, Use"
Religion is the idol of the mob; it adores everything it does not understand.,Frederick the Great,"Understand, Everything, Idol"
"Recounting of a life story, a mind thinking aloud leads one inevitably to the consideration of problems which are no longer psychological but spiritual.",Paul Tournier,"Life, Mind, Thinking"
I know the Bible is inspired because it inspires me.,Dwight L. Moody,"Bible, Me, Know"
The Bible is the fountain of truth.,Joseph Franklin Rutherford,"Truth, Bible, Fountain"
"There must be freedom for all to live, to think, to worship, no book, no avenue must be closed.",James Larkin,"Freedom, Live, Book"
"God is to be worshipped as the one beloved, dearer than everything in this and next life.",Swami Vivekananda,"Life, God, Everything"
Religion is not a department of life; it is something that enters into the whole of it.,Alan Watts,"Life, Something, Whole"
"If the grandfather of the grandfather of Jesus had known what was hidden within him, he would have stood humble and awe-struck before his soul.",Khalil Gibran,"Humble, Soul, Hidden"
Religion is the everlasting dialogue between humanity and God. Art is its soliloquy.,Franz Werfel,"God, Art, Humanity"
"Our Father and Our God, unto thee, O Lord we lift our souls.",William Pennington,"God, Father, Lift"
"This is God's world, not Satan's. Christians are the lawful heirs, not non-Christians.",Gary North,"God, World, Satan"
"I believe in a religion that believes in freedom. Any time I have to accept a religion that won't let me fight a battle for my people, I say to hell with that religion.",Malcolm X,"Freedom, Time, Fight"
I don't have a religion. I believe in a God. I don't know what it looks like but it's MY god. My own interpretation of the supernatural.,Jennifer Aniston,"God, Believe, Know"
"Surely the day will come when color means nothing more than the skin tone, when religion is seen uniquely as a way to speak one's soul, when birth places have the weight of a throw of the dice and all men are born free, when understanding breeds love and brotherhood.",Josephine Baker,"Love, Men, Day"
"There should be no discrimination against languages people speak, skin color, or religion.",Malala Yousafzai,"Equality, Discrimination, Skin"
"One may fall in love anytime and with anyone. One does not decide that based on caste, religion or gender.",Dutee Chand,"Love, Caste, Fall"
There is no higher religion than human service. To work for the common good is the greatest creed.,Woodrow Wilson,"Work, Good, Service"
I am fully aware that cricket is like a second religion in Pakistan.,AB de Villiers,"Cricket, I Am, Pakistan"
"I have no religion, and at times I wish all religions at the bottom of the sea. He is a weak ruler who needs religion to uphold his government; it is as if he would catch his people in a trap.",Mustafa Kemal Ataturk,"Government, Sea, People"
"I think I'm a humanist. I believe all humans should have equal rights to live, express, flourish, love and dissent, irrespective of their gender, caste, class, socio-economic strata, disabilities, political stance, religion or faith.",Sayani Gupta,"Love, Faith, Political"
"I don't care what the religion is called; as far as I'm concerned, one God, the God I adhere to, is in charge of all of them.",Charley Pride,"God, Care, don't Care"
Religion is all-too-often a refuge for scoundrels.,Neal Boortz,"Refuge, Scoundrels"
"Civility is the recognition that all people have dignity that's inherent to their person, no matter their religion, race, gender, sexuality, or ability.",Opal Tometi,"Matter, Sexuality, Dignity"
"Beauty has no boundaries, no rules, no colors. Beauty is like a religion. You can include everything inside it.",Alessandro Michele,"Beauty, Colors, Rules"
"Man is the religious animal. He is the only one that's got true religion, several of them.",Hal Holbrook,"Man, True, Animal"
"I never considered a difference of opinion in politics, in religion, in philosophy, as cause for withdrawing from a friend.",Thomas Jefferson,"Friendship, Politics, Opinion"
"I say you don't need religion, or political ideology, to understand human nature. Science reveals that human nature is greedy and selfish, altruistic and helpful.",Michael Shermer,"Science, Nature, Political"
"Fashion is almost like a religion, for me at least.",ASAP Rocky,"Me, Fashion, Like"
"Religion, in any form, is always interesting to me because of how powerful it is. Not even the religion itself, but to the people that follow it... The effect that it has had on people's minds.",Chino Moreno,"Always, Me, People"
"I don't care if you're Muslim or Christian or Buddhist or whatever your religion is, when you listen to a spiritual song and you really open your heart, you can feel it. You can feel the message of it. Just a simple story.",Valerie June,"Heart, Your, Simple"
"People in love don't see gender, colour or religion. Or age. It's about the other person, the one that you love and who loves you. You don't think of them in terms of a label. You just go with your heart.",Sam Taylor-Johnson,"Love, Age, Heart"
I am against religion because it teaches us to be satisfied with not understanding the world.,Richard Dawkins,"World, I Am, Understanding"
"Animals have come to mean so much in our lives. We live in a fragmented and disconnected culture. Politics are ugly, religion is struggling, technology is stressful, and the economy is unfortunate. What's one thing that we have in our lives that we can depend on? A dog or a cat loving us unconditionally, every day, very faithfully.",Jon Katz,"Politics, Technology, Culture"
"My great religion is a belief in the blood, the flesh, as being wiser than the intellect. We can go wrong in our minds. But what our blood feels and believes and says, is always true. The intellect is only a bit and a bridle.",D. H. Lawrence,"Great, Always, True"
"I just think religion is something... It could be a beautiful thing for the individual, but when it becomes organized, that's when religion starts taking a kind of ugly turn to me.",Daron Malakian,"Beautiful, Me, Ugly"
"The truth is that killing innocent people is always wrong - and no argument or excuse, no matter how deeply believed, can ever make it right. No religion on earth condones the killing of innocent people; no faith tradition tolerates the random killing of our brothers and sisters on this earth.",Feisal Abdul Rauf,"Faith, Truth, Always"
"I don't care what your religion is, as long as it doesn't chastise anybody that's not part of it.",Jon Gries,"Your, Long, Care"
The NHS is the closest thing the English have to a religion.,Nigel Lawson,"NHS, Thing, English"
"It doesn't matter what color, sex, religion, age, sexual orientation, etc., everyone should have the same freedoms and liberties.",Lance Bass,"Age, Sex, Matter"
"Religion is the organization of spirituality into something that became the hand maiden of conquerors. Nearly all religions were brought to people and imposed on people by conquerors, and used as the framework to control their minds.",John Henrik Clarke,"Control, Organization, People"
"It is my goal to love everyone. I hate no one. Regardless of their race, religion, their proclivities, the desire of their heart and how they want to live their life and the decisions that they make. I can even respect people's decisions and lifestyle choices just as I hope they have the courtesy to respect my decisions and my choices.",Kirk Cameron,"Life, Love, Hope"
"If you reject the food, ignore the customs, fear the religion and avoid the people, you might better stay at home.",James A. Michener,"Home, Food, Fear"
"I'm literally fighting for the equality of every man, woman and child regardless of race, religion, color, creed, and sexual orientation and here to spread a message of peace, love, and positivity.",Logic,"Love, Equality, Peace"
"In Iran, there is no freedom of the press, no freedom of speech, no independent judiciary, no free elections. There is no freedom of religion - not even for Shiites, who are forced by Iran's theocracy to adhere to one narrow set of official rules.",Elliott Abrams,"Freedom, Freedom Of Speech, Free"
"God does not discriminate against people, regardless of color, religion, social class, or gender and sexual preferences.",Rodrigo Duterte,"God, Gender, People"
"I'm in favour of religion as a tamer of arrogance. For a Greek Orthodox, the idea of God as creator outside the human is not God in God's terms. My God isn't the God of George Bush.",Nassim Nicholas Taleb,"God, Arrogance, Human"
"We have enslaved the rest of the animal creation, and have treated our distant cousins in fur and feathers so badly that beyond doubt, if they were able to formulate a religion, they would depict the Devil in human form.",William Inge,"Environmental, Devil, Rest"
"I am proud to be a Sikh and am a true disciple of Guru Gobind Singh, who sacrificed his entire family for the Sikh religion.",Harbhajan Singh,"Family, I Am, True"
