title,author,tags
"In my opinion, love is not about gender, it's not about religion. Love has no borders and no boundaries.",Bill Kaulitz,"Love, Love Is, Gender"
"There's so many strict ideas and rules, whether it's from religion or it's just generations and generations.",Ashton Sanders,"Ideas, Rules, Strict"
"A universe with a God would look quite different from a universe without one. A physics, a biology where there is a God is bound to look different. So the most basic claims of religion are scientific. Religion is a scientific theory.",Richard Dawkins,"God, Universe, Biology"
The belief in something bigger and supernatural is not the same thing as linear religion.,Tobias Forge,"Belief, Same Thing, Supernatural"
"I don't do politics, I don't do religion, I don't do ethnic jokes.",Bill Engvall,"Politics, Jokes, Ethnic"
Religion is just mind control.,George Carlin,"Mind, Control, Just"
"As the spiritual leader of six million people, the Dalai Lama can be credited with a significant renunciation of the authority of tradition - of the conventional politics of national self-interest as well as of religion.",Pankaj Mishra,"Politics, Spiritual, People"
"Religion comes from the word 're' or again and 'ligare' meaning to bind or tie back. The purpose of religion is to unite the self with God or the creative force. Music, sacred spaces, and meaningful icons are the way we conjoin our minds with the transcendental.",Alex Grey,"God, Music, Purpose"
"I have no belief in The Bible or religion, but I think Armageddon was a lucky guess. I honestly think it's going to happen.",George Michael,"Bible, Belief, Lucky"
Things are coming to a pretty pass when religion is allowed to invade private life.,"William Lamb, 2nd Viscount Melbourne","Life, Private Life, Coming"
"Skeptical scrutiny is the means, in both science and religion, by which deep thoughts can be winnowed from deep nonsense.",Carl Sagan,"Science, Thoughts, Nonsense"
"India is the meeting place of the religions and among these Hinduism alone is by itself a vast and complex thing, not so much a religion as a great diversified and yet subtly unified mass of spiritual thought, realization and aspiration.",Sri Aurobindo,"Alone, Great, Spiritual"
"I tell my children what I think myself: That religion is not necessarily convincing, but it is still interesting and not to be laughed at or denigrated.",Alain de Botton,"Myself, Children, Tell"
Today's interpretations of religion are often backward and contradict the needs of civilization.,Naguib Mahfouz,"Today, Civilization, Needs"
"Then if your movie clicks with real audiences, you'll be sucked into some sort of Hollywood orbit. It's a devil of a place where the only religion that really counts is box office.",Yahoo Serious,"Your, Devil, Real"
"Religion is a very scary thing, because a pastor is in a position of power. And if you use that power badly, you ruin people's lives, and you ruin your own life.",Eugene H. Peterson,"Life, Power, Your"
Religion has played a big part in eliminating the nuance in humanity. People began to believe things before they knew them. It stopped people from listening and learning with the patience and love of the God they believe in.,Indya Moore,"Love, Patience, God"
"Religion is not merely the opium of the masses, it's the cyanide.",Tom Robbins,"Masses, Opium, Merely"
"A Renaissance pope, they were not overly concerned with their religion - rather more concerned with politics and power. At that time, they still ruled the world.",James Faulkner,"Politics, Power, Time"
"It is an interesting and demonstrable fact, that all children are atheists and were religion not inculcated into their minds, they would remain so.",Ernestine Rose,"Children, Interesting, Would"
Religion has stayed with me even though I rebelled.,Grace Jones,"Me, Even, Though"
"If religion had a good purpose, then man would have created something great. But we're man: we mess up everything. We mess up nature. We mess up God. We take what is given to us and make it into what we think it should be.",Ziggy Marley,"Nature, God, Good"
"Young people all over the world are very frustrated. They are very disillusioned. Many of them are turning their backs on religion. They are walking away from the faith of their parents, and most of this is because religion has failed them.",Myles Munroe,"Faith, World, Parents"
"The three great elements of modern civilization, Gun powder, Printing, and the Protestant religion.",Thomas Carlyle,"Great, Gun, Printing"
"So much about religion has to do with rigid, sacrosanct preciousness. I don't live my life that way, and I don't feel that's what Baha'u'llah teaches.",Rainn Wilson,"Life, My Life, Way"
"I have grown to understand that no matter where we come from, human beings, at heart, are the same. Defining ourselves based on race, religion, and ethnicity is like betraying that.",Shenaz Treasury,"Heart, Matter, Understand"
Mayonnaise: One of the sauces which serve the French in place of a state religion.,Ambrose Bierce,"Place, State, Serve"
The First Amendment freedom of religion is as important today as when the Bill of Rights was first written.,Arlen Specter,"Freedom, Today, Important"
"Someday I want to really talk about religion and blind faith. I explored astrologers, palmistry etcetra at length till I believed it was a scam. Even in '3 Idiots' I take a dig at them.",Rajkumar Hirani,"Faith, Blind, Talk"
"To repay evils with kindness is the religion I was taught to practise, and this will forever be my rule.",John James Audubon,"Kindness, Will, Forever"
"The greatest thing a human soul ever does in this world... to see clearly is poetry, prophecy and religion all in one.",John Ruskin,"Poetry, Soul, World"
"In morals what begins in fear usually ends in wickedness; in religion what begins in fear usually ends in fanaticism. Fear, either as a principle or a motive, is the beginning of all evil.",Anna Jameson,"Fear, Beginning, Evil"
"In this world filled with challenges, we do need help from time to time. Religion, eternal truth, and our missionaries are vital parts of that help.",Russell M. Nelson,"Truth, Time, Challenges"
"I think 'The Searcher' is a departure from my first because it's less grounded in religion and is far more rooted in the mythic tradition: more of an existential thriller where the main character is actually the central mystery, and his journey is all about trying to figure himself out.",Simon Toyne,"Journey, Character, Mystery"
"Hobbies of any kind are boring except to people who have the same hobby. This is also true of religion, although you will not find me saying so in print.",Dave Barry,"Me, Boring, Will"
"Religion can be the enemy of God. It's often what happens when God, like Elvis, has left the building.",Bono,"God, Enemy, Building"
"I believe that the Framers of the Constitution made their intent clear when they wrote the First Amendment. I believe they wanted to keep the new government from endorsing one religion over another, not erase the public consciousness or common faith.",Nick Rahall,"Faith, Government, Believe"
"Religion is a complex and often contradictory force in our world. It fosters hope and comfort but also doubt and guilt. It creates both community and exclusion. It brings societies together around shared belief and tears them apart through war. However, what unites the faithful, whatever their religion, is the unshakeable force of generosity.",Laura Arrillaga-Andreessen,"Hope, War, Community"
"Finding that no religion is based on facts and cannot be true, I began to reflect what must be the condition of mankind trained from infancy to believe in error.",Robert Owen,"Believe, Facts, True"
"It is a truism that almost any sect, cult, or religion will legislate its creed into law if it acquires the political power to do so.",Robert A. Heinlein,"Power, Political, Law"
Religion and God are totally separate. Religion is created by government. God is God.,KRS-One,"God, Government, Separate"
"It is science, and not religion, which has taught men that things are complex and difficult to understand.",Emile Durkheim,"Science, Men, Difficult"
"Religion was nearly dead because there was no longer real belief in future life; but something was struggling to take its place - service - social service - the ants creed, the bees creed.",John Galsworthy,"Life, Future, Service"
"My older brother and I read all the time. My father read, but only things related to religion. One year, he did read a set of stories that was called something like '365 Stories' out loud to us. They followed a family for the year, a page a day. They were about kids with simple problems - like a wheel coming off their bicycle.",Amy Tan,"Family, Time, Day"
"So far as the government is concerned, there is only one holy book, which is the constitution of India. My government will not tolerate or accept any discrimination based on caste, creed and religion.",Narendra Modi,"Government, Discrimination, Will"
"Factually, the Temple Mount is the precise location of the Temple. It's the holiest place in the world for Jews. It's the third holiest place for Muslims. And we need to respect each others' rights, freedom of religion.",Naftali Bennett,"Freedom, Respect, World"
"I think religion is very personal. I definitely identify as Muslim. I consider myself practicing, but I don't think people who observe me from the outside would think of me as devout, and that doesn't bother me because one of the beauties of Islam is the fact that it is personal: you read the Koran, and what you believe is what you believe.",Maysoon Zayid,"Myself, Believe, Me"
"We all dream. We dream vividly, depending on our nature. Our existence is beyond our explanation, whether we believe in God or we have religion or we're atheist.",Anthony Hopkins,"Nature, God, Believe"
Religion is like a map. The route isn't important. It's the destination that matters.,Marianne Williamson,"Destination, Important, Map"
Freedom of religion is a fundamental Constitutional principle. It's a founding principle of this country.,Paul Ryan,"Freedom, Country, Principle"
"There is a holy, mistaken zeal in politics, as well as in religion. By persuading others, we convince ourselves.",Junius,"Politics, Others, Well"
Religion teaches you to be satisfied with nonanswers. It's a sort of crime against childhood.,Richard Dawkins,"Childhood, Crime, Satisfied"
"I found it interesting that as people become more technically oriented all over the world, at the same time people are becoming increasingly spiritual. The success of the Da Vinci code - even though it was a great yawn - also showed people's interest in religion.",Barbara Walters,"Success, Time, Great"
A man will do more for his stubbornness than for his religion or his country.,E. W. Howe,"Man, Will, Country"
"There is no conflict between the ideal of religion and the ideal of science, but science is opposed to theological dogmas because science is founded on fact. To me, the universe is simply a great machine which never came into being and never will end. The human being is no exception to the natural order. Man, like the universe, is a machine.",Nikola Tesla,"Science, Great, Man"
"I'm ready for a Christianity that 'ruins' my life, that captures my heart and makes me uncomfortable. I want to be filled with an astonishment which is so captivating that I am considered wild and unpredictable and... well... dangerous. Yes, I want to be 'dangerous' to a dull and boring religion.",Mike Yaconelli,"Life, Heart, I Am"
You don't have to be a religious person to be affected by religion or a religious movement.,Jim Starlin,"Person, Movement, Religious"
"I think religion is a bunch of hooey, and I think that the holidays are an opportunity for people to get stressed out, getting their rush to shop. It's so conformist.",Ricky Martin,"Opportunity, People, Rush"
"When my kids were growing up, I wanted their teachers to teach them science, reading, math and history. I also wanted them to care about my kids. But I did not want my children's public school teachers teaching them religion. That was my job as a parent and the job of our church, Sunday school, and youth group.",Adam Hamilton,"Science, History, Youth"
"I cannot adequately express the horror I feel for a man who can be so base as to veil his hypocrisy under the cloak of religion, and state the base falsehood he has done.",James K. Polk,"Done, Man, Feel"
"To the man who reads 'Scouting for Boys' superficially, there is a disappointing lack of religion in the book. But to him who tries it in practice, the basic religion underlying it soon becomes apparent.",Robert Baden-Powell,"Man, Practice, Book"
"No one wants critical, 'You can't do this or that' religion. People want authentic love, and that's what we are displaying.",Brian Welch,"Love, People, Want"
"In Lincoln's day a President's religion was a very private affair. There were no public prayer meetings, no attempts to woo the Religious Right. Few of Lincoln's countrymen knew anything at all of his religious beliefs.",David Herbert Donald,"Prayer, Day, Meetings"
"Something happens in school sometimes where you're like, 'Oh, I'm not an expert, and I have to defer to people who are.' And it happens not just in school: it happens in religion, too. Defer to the experts. A printing press is a big deal - they got the Bible, and all of a sudden they could read it for themselves.",Sal Khan,"Bible, People, Sometimes"
Religion will prove to the believer a comforter and a sure guide to the fountain of true happiness.,Ellen G. White,"Happiness, True Happiness, Will"
The most important part of my religion is to play guitar.,Lou Reed,"Guitar, Important, Play"
"Religion is a big problem in Israel and the Arab world, but again, the problem isn't religion but political leaders who want to use the religion.",Mark Kurlansky,"Political, World, Political Leaders"
Nature's God really descends from an ancient Greek tradition that was passed along to the early modern philosophers. And these were quite radical thinkers who were really challenging the ways of thinking of their time and the established religion.,Matthew Stewart,"Nature, God, Time"
I would no more quarrel with a man because of his religion than I would because of his art.,Mary Baker Eddy,"Art, Man, Quarrel"
"God is God, but he has various names in different languages, and each strand of monotheistic religion has multiple ways of describing the godhead.",Jay Parini,"God, Different, Names"
"Culture cannot be separated from politics. The arts, philosophy and metaphysics, religion and the sciences, constitute culture. Politics are the science or art of organizing our relationships to allow for the development of life in society.",Eugene Ionesco,"Life, Science, Politics"
No migrant of any religion has a constitutional right to come to the United States.,Tom Tancredo,"Right, United States, Come"
It was once religion which threatened us with a last judgment at the end of days. It is now our tortured planet which predicts the arrival of such a day without any heavenly intervention.,Hans Jonas,"Day, End, Us"
"Religion, oh, just another of those numerous failures resulting from an attempt to popularize art.",Ezra Pound,"Art, Attempt, Just"
No account of the Renaissance can be complete without some notice of the attempt made by certain Italian scholars of the fifteenth century to reconcile Christianity with the religion of ancient Greece.,Walter Pater,"Renaissance, Ancient, Without"
"Women are oppressed in the east, in the west, in the south, in the north. Women are oppressed inside, outside home, a woman is oppressed in religion, she is oppressed outside religion.",Taslima Nasrin,"Women, Home, Woman"
"The reason Buddhism can be so naturalised is because, stripped of its supernatural elements, its core teachings can be giving a sound, secular philosophical interpretation. In other words, it becomes a religion acceptable to the contemporary, naturalistic mind only when it ceases to be a religion.",Julian Baggini,"Mind, Words, Sound"
"I think Christianity is the same as Buddhism and Hinduism - whenever a religion begins to say that these are the things you have to do to be loved by God, you have a religion.",Erwin McManus,"God, Things, Loved"
"As a religion, bilingualism is the god that failed. It has led to no fairness, produced no unity, and cost Canadian taxpayers untold millions.",Stephen Harper,"God, Unity, Fairness"
Every religion there's something foul going on.,Ja Rule,"Something, Going, Every"
"We peruse one ideal, that of bringing people together in peace, irrespective of race, religion and political convictions, for the benefit of mankind.",Juan Antonio Samaranch,"History, Peace, Political"
"We know too much, and are convinced of too little. Our literature is a substitute for religion, and so is our religion.",T. S. Eliot,"Know, Literature, Much"
Yoga is not a religion to me.,Christy Turlington,"Me, Yoga"
"The problem of the Muslim presence is increasingly worrying. There are more and more clashes, more and more demands. And I doubt the compatibility of Italian law with Muslim law, because it's not just a religion but a law.",Matteo Salvini,"Law, Doubt, Presence"
"In England, football is a religion. In France, football is not a religion. It's wine and food.",Robert Pires,"Food, Football, Wine"
Pluralism has been the driving fact behind political theory now since the Copernican revolution and the wars of religion that were spawned from it.,Barry Gardiner,"Political, Revolution, Behind"
"Let me say this loud and clear. There is a world of difference between terrorist acts and the Islamic Shari'a. Islam is not only a religion, but a way of life. And at its heart lie the sacred principles of tolerance and dialogue.",Hussein of Jordan,"Life, Heart, World"
"I say quite deliberately that the Christian religion, as organized in its Churches, has been and still is the principal enemy of moral progress in the world.",Bertrand Russell,"Progress, World, Enemy"
"I remember how my mother would bring us to chapel on Sundays... and my father used to wait outside. One of the things that I picked up from my father and my mother was the sense that religion often gets in the way of God. For me, at least, it got in the way.",Bono,"God, Wait, Remember"
"Religion features more now in my life than it did when I was a kid - my dad rejected the Catholic church as a young man. I had no religious upbringing, but certainly, Dad was a kind of secular humanist. I don't know if he was an atheist or agnostic. I regret I didn't talk to him about it.",Paul Giamatti,"Life, Dad, Regret"
"Before Christianity became the Roman Empire's official religion in the 4th Century, 'mystery religions,' organized around a central canon of secret knowledge, were widespread. Membership in such religions was limited to people who had passed through secret initiation rituals and had begun to learn a body of hidden knowledge.",Trevor Paglen,"Knowledge, Body, Mystery"
Religion is the sole technique for the validating of values.,Allen Tate,"Values, Technique, Sole"
"I think we need to do some deep soul searching about what's important in our lives and renew our spirit and our spiritual thinking, whether it's through faith-based religion or just through loving nature or helping your fellow man.",Louie Schwartzberg,"Nature, Easter, Man"
"I think you can be cynical about religion on occasion, and certainly skeptical about the degree to which some people use religion to manipulate other people.",Peter Jennings,"People, Degree, Some People"
"I know it's very idealistic and utopian, but I believe we need to just let everyone not be judged in terms of religion, groups or nations or region.",Shah Rukh Khan,"Believe, Know, Everyone"
"Every theistic religion, including Catholicism, Mainline Protestantism, Judaism, Mormonism, and Islam, has traditionally held homosexual congress in moral opprobrium.",Michael J. Knowles,"Congress, Moral, Islam"
"Christmas renews our youth by stirring our wonder. The capacity for wonder has been called our most pregnant human faculty, for in it are born our art, our science, our religion.",Ralph W. Sockman,"Science, Art, Christmas"
"I believe that all men and women are created equal, but it took our country until 1920 to acknowledge this for women. And then it took until 1964, the year before I was born, to outlaw discrimination based on race, color, religion, sex, or national origin. And same-sex marriage became the law of the land in 2015.",Brad Feld,"Women, Men, Marriage"
"It is, then, by those shadows of the hoary Past and their fantastic silhouettes on the external screen of every religion and philosophy, that we can, by checking them as we go along, and comparing them, trace out finally the body that produced them.",Helena Blavatsky,"Past, Body, Shadows"
"I have sung for Americans of every political persuasion, and I am proud that I never refuse to sing to an audience, no matter what religion or color of their skin, or situation in life.",Pete Seeger,"Life, Political, Skin"
"Since the governments are in the pockets of businesses, who's going to control this most powerful institution? Business is more powerful than politics, and it's more powerful than religion. So it's going to have to be the vigilante consumer.",Anita Roddick,"Politics, Business, Control"
"My mother's belief in spiritual healers grew stronger after our family went through a rough patch following my father's death. Sufi saint Karimullah Shah Kadri changed our lives, and all of us converted to Sufism. But it wasn't an instantaneous decision - it took us 10 years to convert. The change in religion was like washing away the past.",A. R. Rahman,"Change, Family, Death"
"From a young age, I saw and placed importance on spirituality within religion.",Lizzo,"Age, Young, Within"
"Where you have no religion, you are sure to have no government, for as religion disappears, anarchy takes place and fixes a compleat Hell on earth till religion returns.",Daniel Morgan,"Government, Hell, Earth"
"My grandad's a gospel singer, and his children were singers, too. But I don't believe in God in the same way... not religion; it breaks us up too much. The same with musical styles - it breaks people up. I believe they are all one thing - why not put them together?",Labrinth,"God, Together, Believe"
"Same-sex marriage is not the final nail in the coffin for traditional marriage. It is just another road sign toward the substitution of government for God. Every moral discussion now pits the wisest moral arbiters among us - the Supreme Court, President Obama - against traditional religion.",Ben Shapiro,"God, Marriage, Government"
"The religion I know most about, which is the Christian one, would simply say that it's not really for one man or woman to know fully and to understand the nature of our brief human existence.",Sebastian Faulks,"Nature, Man, Woman"
"Secularism is categorically not saying that the religious may not speak out publicly or have a say in public life. It is about saying that religion alone should not confer a privileged say in public life, or greater influence on it. It really is as simple as that.",Richard Dawkins,"Life, Alone, Simple"
My father insisted that I and my sisters not be indoctrinated into any religion at any age.,S. T. Joshi,"Age, Father, Sisters"
There's nothing funnier than religion. Try explaining it to a kid. I had it all wrong when I was a kid.,Bonnie Hunt,"Nothing, Try, Wrong"
Islam is misunderstood by many. The extremists grab the headlines; those of us who want to practise our religion and live under this country's laws do not make the news.,Sadiq Khan,"News, Country, Live"
I've always felt like there are certain politicians that wear their religion on their sleeve in a way that you almost feel is disingenuous. I think that your faith has to be first personal. I struggle with those people that preach something and go back behind closed doors and live differently.,Nikki Haley,"Faith, Always, Struggle"
"When theology erodes and organization crumbles, when the institutional framework of religion begins to break up, the search for a direct experience which people can feel to be religious facilitates the rise of cults.",Daniel Bell,"Experience, Organization, Rise"
"I think people's perception of a rich girl is literal, but metaphorically I embrace it as being rich in love, spirit, joy and religion. So it's not about money.",Angie Stone,"Love, Money, Joy"
People don't talk about religion a lot in Hollywood because it's not an incredibly safe place to do it.,Zachary Levi,"People, Safe, Talk"
I've taken a stand against religion for as long I've been able to write and think.,Roy Harper,"Long, Stand, Think"
"I do not have the slightest bit of racism in me. I do not judge people with regards to the colour of their skin, their origin, or their religion. I defend them all, because I defend French people. And, of course, I defend the interests of France, the interests of French people.",Marine Le Pen,"Skin, Racism, Me"
"But let's just say, I'm Irish. I grew up in the 1950s. Religion had a very tight iron fist.",Liam Neeson,"1950s, Say, Iron"
It is easy enough to be friendly to one's friends. But to befriend the one who regards himself as your enemy is the quintessence of true religion. The other is mere business.,Mahatma Gandhi,"Business, Your, True"
I grew up in a secular suburban Jewish household where we only observed the religion on very specific times like a funeral or a Bar Mitzvah.,Jesse Eisenberg,"Only, Where, Bar"
A move to decide citizenship on the basis of religion amounts to rejecting the Constitution.,Pinarayi Vijayan,"Constitution, Citizenship, Decide"
True character arises from a deeper well than religion.,E. O. Wilson,"Character, True, Well"
I still pray a lot. I still believe in God. I just don't believe in any set religion.,Naomie Harris,"God, Believe, Just"
