title,author,tags
"Thousands have lived without love, not one without water.",W. H. Auden,"Love, Water, Without"
"Unity is strength... when there is teamwork and collaboration, wonderful things can be achieved.",Mattie Stepanek,"Unity, Teamwork, Collaboration"
A hero is an ordinary individual who finds the strength to persevere and endure in spite of overwhelming obstacles.,Christopher Reeve,"Hero, Obstacles, Endure"
"A single twig breaks, but the bundle of twigs is strong.",Tecumseh,"Strong, Bundle, Twig"
Some of us think holding on makes us strong; but sometimes it is letting go.,Hermann Hesse,"Sometimes, Go, Holding On"
"Permanence, perseverance and persistence in spite of all obstacles, discouragements, and impossibilities: It is this, that in all things distinguishes the strong soul from the weak.",Thomas Carlyle,"Perseverance, Soul, Persistence"
"Strength does not come from winning. Your struggles develop your strengths. When you go through hardships and decide not to surrender, that is strength.",Arnold Schwarzenegger,"Your, Hardships, Winning"
It doesn't take a lot of strength to hang on. It takes a lot of strength to let go.,J. C. Watts,"Go, Take, Let Go"
"Life is very interesting... in the end, some of your greatest pains, become your greatest strengths.",Drew Barrymore,"Life, Your, End"
Continuous effort - not strength or intelligence - is the key to unlocking our potential.,Liane Cordes,"Intelligence, Effort, Potential"
That which does not kill us makes us stronger.,Friedrich Nietzsche,"Stronger, Us, Which"
"I love those who can smile in trouble, who can gather strength from distress, and grow brave by reflection. 'Tis the business of little minds to shrink, but they whose heart is firm, and whose conscience approves their conduct, will pursue their principles unto death.",Leonardo da Vinci,"Love, Smile, Death"
I like criticism. It makes you strong.,LeBron James,"Criticism, Strong, Like"
"Difficulties are meant to rouse, not discourage. The human spirit is to grow strong by conflict.",William Ellery Channing,"Grow, Conflict, Difficulties"
"Anxiety does not empty tomorrow of its sorrows, but only empties today of its strength.",Charles Spurgeon,"Today, Tomorrow, Empty"
Heroism is endurance for one moment more.,George F. Kennan,"Moment, Endurance, Heroism"
A strong woman is a woman determined to do something others are determined not be done.,Marge Piercy,"Done, Woman, Others"
Out of suffering have emerged the strongest souls; the most massive characters are seared with scars.,Khalil Gibran,"Suffering, Scars, Most"
"When adversity strikes, that's when you have to be the most calm. Take a step back, stay strong, stay grounded and press on.",LL Cool J,"Adversity, Step, Calm"
"If I didn't define myself for myself, I would be crunched into other people's fantasies for me and eaten alive.",Audre Lorde,"Myself, Me, Alive"
"The world breaks everyone, and afterward, some are strong at the broken places.",Ernest Hemingway,"World, Broken, Everyone"
"Nothing is so strong as gentleness, nothing so gentle as real strength.",Saint Francis de Sales,"Nothing, Gentle, Real"
Strength and growth come only through continuous effort and struggle.,Napoleon Hill,"Growth, Struggle, Effort"
No one saves us but ourselves. No one can and no one may. We ourselves must walk the path.,Buddha,"Walk, Path, May"
A truly strong person does not need the approval of others any more than a lion needs the approval of sheep.,Vernon Howard,"Lion, Sheep, Person"
Strength does not come from physical capacity. It comes from an indomitable will.,Mahatma Gandhi,"Will, Come, Capacity"
Don't wait for extraordinary opportunities. Seize common occasions and make them great. Weak men wait for opportunities; strong men make them.,Orison Swett Marden,"Men, Great, Wait"
"There are dark shadows on the earth, but its lights are stronger in the contrast.",Charles Dickens,"Dark, Earth, Shadows"
"Be sure you put your feet in the right place, then stand firm.",Abraham Lincoln,"Your, Feet, Stand"
"I think scars are like battle wounds - beautiful, in a way. They show what you've been through and how strong you are for coming out of it.",Demi Lovato,"Beautiful, Battle, Way"
"As long as we persevere and endure, we can get anything we want.",Mike Tyson,"Long, Endure, Anything"
"Endurance is not just the ability to bear a hard thing, but to turn it into glory.",William Barclay,"Endurance, Glory, Ability"
"Scar tissue is stronger than regular tissue. Realize the strength, move on.",Henry Rollins,"Stronger, Realize, Tissue"
Strength is the capacity to break a chocolate bar into four pieces with your bare hands - and then eat just one of the pieces.,Judith Viorst,"Your, Hands, Chocolate"
The turning point in the process of growing up is when you discover the core of strength within you that survives all hurt.,Max Lerner,"Process, Hurt, Growing Up"
Insincerity is always weakness; sincerity even in error is strength.,George Henry Lewes,"Always, Weakness, Sincerity"
"Character cannot be developed in ease and quiet. Only through experience of trial and suffering can the soul be strengthened, ambition inspired, and success achieved.",Helen Keller,"Success, Experience, Character"
"You have power over your mind - not outside events. Realize this, and you will find strength.",Marcus Aurelius,"Power, Your, Mind"
What is to give light must endure burning.,Anton Wildgans,"Light, Endure, Must"
I think a hero is an ordinary individual who finds strength to persevere and endure in spite of overwhelming obstacles.,Christopher Reeve,"Hero, Obstacles, Endure"
Shallow men believe in luck. Strong men believe in cause and effect.,Ralph Waldo Emerson,"Men, Luck, Believe"
"I learned that it is the weak who are cruel, and that gentleness is to be expected only from the strong.",Leo Rosten,"Strong, Cruel, Weak"
The spirit of man can endure only so much and when it is broken only a miracle can mend it.,John Burroughs,"Man, Broken, Endure"
"Where there is no struggle, there is no strength.",Oprah Winfrey,"Struggle, Where"
Every calamity is to be overcome by endurance.,Virgil,"Endurance, Overcome, Calamity"
Don't expect to build up the weak by pulling down the strong.,Calvin Coolidge,"Down, Build, Strong"
"When we long for life without difficulties, remind us that oaks grow strong in contrary winds and diamonds are made under pressure.",Peter Marshall,"Life, Long, Grow"
"All the adversity I've had in my life, all my troubles and obstacles, have strengthened me... You may not realize it when it happens, but a kick in the teeth may be the best thing in the world for you.",Walt Disney,"Life, Best, Adversity"
Nobody can hurt me without my permission.,Mahatma Gandhi,"Me, Nobody, Hurt"
Only the gentle are ever really strong.,James Dean,"Gentle, Strong, Only"
Only the weak are cruel. Gentleness can only be expected from the strong.,Leo Buscaglia,"Strong, Cruel, Weak"
Good actions give strength to ourselves and inspire good actions in others.,Samuel Smiles,"Good, Inspire, Others"
My bad habits aren't my title. My strengths and my talent are my title.,Layne Staley,"Talent, Bad, Bad Habits"
"If your determination is fixed, I do not counsel you to despair. Few things are impossible to diligence and skill. Great works are performed not by strength, but perseverance.",Samuel Johnson,"Great, Impossible, Perseverance"
This is no time for ease and comfort. It is time to dare and endure.,Winston Churchill,"Time, Comfort, Endure"
"My strength is as the strength of ten, because my heart is pure.",Alfred Lord Tennyson,"Heart, Pure, Because"
The world is the great gymnasium where we come to make ourselves strong.,Swami Vivekananda,"Great, World, Strong"
He who conquers others is strong; He who conquers himself is mighty.,Lao Tzu,"Others, Strong, Who"
Rudeness is a weak imitation of strength.,Eric Hoffer,"Imitation, Weak, Rudeness"
"Fortitude is the marshal of thought, the armor of the will, and the fort of reason.",Francis Bacon,"Will, Reason, Fort"
There is little that can withstand a man who can conquer himself.,Louis XIV,"Man, Conquer, Who"
Even cowards can endure hardship; only the brave can endure suspense.,Mignon McLaughlin,"Brave, Hardship, Endure"
Kites rise highest against the wind - not with it.,Winston Churchill,"Wind, Rise, Against"
"We can be tired, weary and emotionally distraught, but after spending time alone with God, we find that He injects into our bodies energy, power and strength.",Charles Stanley,"Alone, God, Power"
Nothing has more strength than dire necessity.,Euripides,"Nothing, Necessity, More"
"He that is not handsome at 20, nor strong at 30, nor rich at 40, nor wise at 50, will never be handsome, strong, rich or wise.",George Herbert,"Wise, Handsome, Rich"
"Climbing to the top demands strength, whether it is to the top of Mount Everest or to the top of your career.",A. P. J. Abdul Kalam,"Your, Everest, Career"
"The God we serve does not seek out the perfect, but instead uses our imperfections and our shortcomings for his greater good. I am humbled by my own limitations. But where I am weak, He is strong.",Rick Perry,"God, Good, I Am"
You can't really be strong until you see a funny side to things.,Ken Kesey,"Funny, See, Be Strong"
A strong man doesn't have to be dominant toward a woman. He doesn't match his strength against a woman weak with love for him. He matches it against the world.,Marilyn Monroe,"Love, Man, World"
Endure and persist; this pain will turn to good by and by.,Ovid,"Good, Pain, Will"
Every burden is a blessing.,Walt Kelly,"Blessing, Burden, Every"
One who gains strength by overcoming obstacles possesses the only strength which can overcome adversity.,Albert Schweitzer,"Adversity, Obstacles, Overcoming"
The resistance that you fight physically in the gym and the resistance that you fight in life can only build a strong character.,Arnold Schwarzenegger,"Life, Character, Fight"
Fortitude is the guard and support of the other virtues.,John Locke,"Support, Virtues, Fortitude"
Stand up to your obstacles and do something about them. You will find that they haven't half the strength you think they have.,Norman Vincent Peale,"Your, Obstacles, Stand"
Silence is a source of great strength.,Lao Tzu,"Great, Silence, Source"
Nobody picks on a strong man.,Charles Atlas,"Man, Strong Man, Nobody"
"As we advance in life it becomes more and more difficult, but in fighting the difficulties the inmost strength of the heart is developed.",Vincent Van Gogh,"Life, Heart, Difficult"
Perhaps I am stronger than I think.,Thomas Merton,"I Am, Stronger, Think"
"In all my perplexities and distresses, the Bible has never failed to give me light and strength.",Robert E. Lee,"Light, Bible, Me"
Problems are not the problem; coping is the problem.,Virginia Satir,"Problems, Coping, Problem"
Strong and bitter words indicate a weak cause.,Victor Hugo,"Words, Strong, Weak"
The soul that is within me no man can degrade.,Frederick Douglass,"Man, Soul, Me"
Life only demands from you the strength that you possess. Only one feat is possible; not to run away.,Dag Hammarskjold,"Life, Possible, Only"
"The strength of a man's virtue should not be measured by his special exertions, but by his habitual acts.",Blaise Pascal,"Man, Virtue, Special"
Does anybody really think that they didn't get what they had because they didn't have the talent or the strength or the endurance or the commitment?,Nelson Mandela,"Talent, Endurance, Commitment"
"Don't wish me happiness - I don't expect to be happy it's gotten beyond that, somehow. Wish me courage and strength and a sense of humor - I will need them all.",Anne Morrow Lindbergh,"Happiness, Courage, Humor"
"The men who learn endurance, are they who call the whole world, brother.",Charles Dickens,"Men, World, Endurance"
What is important is to believe in something so strongly that you're never discouraged.,Salma Hayek,"Believe, Important, Never"
The strong man is the one who is able to intercept at will the communication between the senses and the mind.,Napoleon Bonaparte,"Communication, Man, Mind"
Force has no place where there is need of skill.,Herodotus,"Skill, Place, Need"
This is the mark of a really admirable man: steadfastness in the face of trouble.,Ludwig van Beethoven,"Man, Face, Trouble"
It is the characteristic excellence of the strong man that he can bring momentous issues to the fore and make a decision about them. The weak are always forced to decide between alternatives they have not chosen themselves.,Dietrich Bonhoeffer,"Always, Man, Decision"
"Strength of character means the ability to overcome resentment against others, to hide hurt feelings, and to forgive quickly.",Lawrence G. Lovasik,"Character, Feelings, Hurt"
"Sure I am of this, that you have only to endure to conquer.",Winston Churchill,"I Am, Conquer, Endure"
"Life is truly known only to those who suffer, lose, endure adversity and stumble from defeat to defeat.",Anais Nin,"Life, Adversity, Lose"
"The days of our lives, for all of us, are numbered. We know that. And yes, there are certainly times when we aren't able to muster as much strength and patience as we would like. It's called being human.",Elizabeth Edwards,"Patience, Know, Being Human"
"A mind at peace, a mind centered and not focused on harming others, is stronger than any physical force in the universe.",Wayne Dyer,"Peace, Mind, Universe"
True strength is delicate.,Louise Berliawsky Nevelson,"True, Delicate, True Strength"
"If you learn how to forgive others for not being strong, then people can learn how to forgive you for your own issues.",T. D. Jakes,"Your, Own, People"
"There are two ways of exerting one's strength: one is pushing down, the other is pulling up.",Booker T. Washington,"Down, Two, Pulling"
"I've been through it all, baby, I'm mother courage.",Elizabeth Taylor,"Courage, Mother, Baby"
When I use my strength in the service of my vision it makes no difference whether or not I am afraid.,Audre Lorde,"Vision, Service, I Am"
Life asks not merely what you can do; it asks how much can you endure and not be spoiled.,Harry Emerson Fosdick,"Life, You Can Do It, Endure"
"I think I was born strong-willed. That's not the kind of thing you can learn. The advantage is, you stick to what you believe in and rarely get pushed out of what you want to do.",Joan Jett,"Believe, Born, Think"
"It does not take much strength to do things, but it requires great strength to decide on what to do.",Elbert Hubbard,"Great, Decide, Much"
"Don't be afraid to give your best to what seemingly are small jobs. Every time you conquer one it makes you that much stronger. If you do the little jobs well, the big ones will tend to take care of themselves.",Dale Carnegie,"Best, Time, Your"
Only one who devotes himself to a cause with his whole strength and soul can be a true master. For this reason mastery demands all of a person.,Albert Einstein,"Soul, True, Person"
Confession of errors is like a broom which sweeps away the dirt and leaves the surface brighter and clearer. I feel stronger for confession.,Mahatma Gandhi,"Feel, Stronger, Confession"
"Because your own strength is unequal to the task, do not assume that it is beyond the powers of man; but if anything is within the powers and province of man, believe that it is within your own compass also.",Marcus Aurelius,"Man, Your, Believe"
"What is exciting is not for one person to be stronger than the other... but for two people to have met their match and yet they are equally as stubborn, as obstinate, as passionate, as crazy as the other.",Barbra Streisand,"Crazy, People, Person"
"Strengthen me by sympathizing with my strength, not my weakness.",Amos Bronson Alcott,"Me, Weakness, Strengthen"
Women are like teabags. We don't know our true strength until we are in hot water!,Unknown,"Women, Water, True"
"Too often the strong, silent man is silent only because he does not know what to say, and is reputed strong only because he has remained silent.",Winston Churchill,"Man, Know, Strong"
Sometimes your disappointments make you a stronger person for the future.,Blanka Vlasic,"Future, Your, Person"
Only by contending with challenges that seem to be beyond your strength to handle at the moment you can grow more surely toward the stars.,Brian Tracy,"Moment, Your, Stars"
"Prayer is more than meditation. In meditation, the source of strength is one's self. When one prays, he goes to a source of strength greater than his own.",Madame de Stael,"Prayer, Own, Self"
With the new day comes new strength and new thoughts.,Eleanor Roosevelt,"Motivational, Thoughts, New Day"
Great works are performed not by strength but by perseverance.,Samuel Johnson,"Patience, Great, Perseverance"
"That though the radiance which was once so bright be now forever taken from my sight. Though nothing can bring back the hour of splendor in the grass, glory in the flower. We will grieve not, rather find strength in what remains behind.",William Wordsworth,"Sympathy, Flower, Nothing"
Faith gives you an inner strength and a sense of balance and perspective in life.,Gregory Peck,"Life, Faith, Balance"
"Greatness lies, not in being strong, but in the right using of strength; and strength is not used rightly when it serves only to carry a man above his fellows for his own solitary glory. He is the greatest whose strength carries up the most hearts by the attraction of his own.",Henry Ward Beecher,"Great, Man, Greatness"
"We don't even know how strong we are until we are forced to bring that hidden strength forward. In times of tragedy, of war, of necessity, people do amazing things. The human capacity for survival and renewal is awesome.",Isabel Allende,"War, Amazing, Survival"
"Looking ahead, I believe that the underlying importance of higher education, of science, of technology, of research and scholarship to our quality of life, to the strength of our economy, to our security in many dimensions will continue to be the most important message.",Charles Vest,"Life, Science, Education"
Aging is not lost youth but a new stage of opportunity and strength.,Betty Friedan,"Age, Youth, Opportunity"
My family is my strength and my weakness.,Aishwarya Rai Bachchan,"Family, Weakness"
"There is always strength in numbers. The more individuals or organizations that you can rally to your cause, the better.",Mark Shields,"Always, Your, Better"
Thank you to all for your prayers and good wishes. It gave me the strength to persevere and warmed my heart.,Steven Cojocaru,"Good, Heart, Your"
"I would fight for my liberty so long as my strength lasted, and if the time came for me to go, the Lord would let them take me.",Harriet Tubman,"Time, Fight, Long"
The undertaking of a new action brings new strength.,Richard L. Evans,"Inspirational, New, Action"
"Love feels no burden, thinks nothing of trouble, attempts what is above its strength, pleads no excuse of impossibility; for it thinks all things lawful for itself, and all things possible.",Thomas a Kempis,"Love, Nothing, Trouble"
"No matter what kind of challenges or difficulties or painful situations you go through in your life, we all have something deep within us that we can reach down and find the inner strength to get through them.",Alana Stewart,"Life, Your, Challenges"
The colour of the skin is in no way connected with strength of the mind or intellectual powers.,Benjamin Banneker,"Mind, Skin, Way"
"There is strength in numbers, but organizing those numbers is one of the great challenges.",John C. Mather,"Great, Challenges, Numbers"
"Power is not an institution, and not a structure; neither is it a certain strength we are endowed with; it is the name that one attributes to a complex strategical situation in a particular society.",Michel Foucault,"Power, Society, Name"
"I do believe in the old saying, 'What does not kill you makes you stronger.' Our experiences, good and bad, make us who we are. By overcoming difficulties, we gain strength and maturity.",Angelina Jolie,"Good, Maturity, Believe"
"The real man smiles in trouble, gathers strength from distress, and grows brave by reflection.",Thomas Paine,"Smile, Brave, Man"
I know there is strength in the differences between us. I know there is comfort where we overlap.,Ani DiFranco,"Comfort, Differences, Know"
The size of your success is measured by the strength of your desire; the size of your dream; and how you handle disappointment along the way.,Robert Kiyosaki,"Success, Your, Disappointment"
"Everybody needs beauty as well as bread, places to play in and pray in, where nature may heal and give strength to body and soul.",John Muir,"Beauty, Health, Nature"
Every good citizen adds to the strength of a nation.,Gordon B. Hinckley,"Good, Nation, Good Citizen"
There will always be obstacles and challenges that stand in your way. Building mental strength will help you develop resilience to those potential hazards so you can continue on your journey to success.,Amy Morin,"Success, Journey, Always"
"My being a black woman is not a deficit. It is a strength. Because I could not be where I am had I not overcome so many other barriers. Which means you know I'm relentless, you know I'm persistent, and you know I'm smart.",Stacey Abrams,"Smart, I Am, Black"
"You really have to look inside yourself and find your own inner strength, and say, 'I'm proud of what I am and who I am, and I'm just going to be myself.'",Mariah Carey,"Myself, Your, Yourself"
"You gain strength, courage, and confidence by every experience in which you really stop to look fear in the face. You are able to say to yourself, 'I lived through this horror. I can take the next thing that comes along.'",Eleanor Roosevelt,"Courage, Experience, Fear"
"Having a superpower has nothing to do with the ability to fly or jump, or superhuman strength. The truest superpowers are the ones we all possess: willpower, integrity, and most importantly, courage.",Jason Reynolds,"Courage, Fly, Integrity"
"Attachment is your biggest strength and your biggest weakness. Though it gives you the power to love someone more than yourself, it becomes difficult to live when you lose something you are attached to. Even when we have lost, we should go beyond that and get truly attached to someone. Loving someone truly is the most beautiful feeling.",Shahid Kapoor,"Love, Power, Beautiful"
"Strength lies in differences, not in similarities.",Stephen Covey,"Differences, Similarities, Lies"
War is peace. Freedom is slavery. Ignorance is strength.,George Orwell,"Freedom, War, Peace"
Discipline and united action are the real source of strength for the nation.,Lal Bahadur Shastri,"Discipline, Action, Real"
"A good life depends on the strength of our relationships with family, friends, neighbours, colleagues and strangers.",David Lammy,"Life, Family, Good"
"The kind of beauty I want most is the hard-to-get kind that comes from within - strength, courage, dignity.",Ruby Dee,"Beauty, Courage, Dignity"
In solitude the mind gains strength and learns to lean upon itself.,Laurence Sterne,"Alone, Mind, Solitude"
"Being deeply loved by someone gives you strength, while loving someone deeply gives you courage.",Lao Tzu,"Love, Courage, Someone"
"We can't all be good at everything. This is partly the logic behind having a team in the first place, so each role can be filled with the person best suited for that role and together, every job and every strength is covered.",Simon Sinek,"Best, Good, Together"
The man who is swimming against the stream knows the strength of it.,Woodrow Wilson,"History, Man, Swimming"
"Social media is reducing social barriers. It connects people on the strength of human values, not identities.",Narendra Modi,"Social Media, Media, People"
"Femininity is not just lipstick, stylish hairdos, and trendy clothes. It is the divine adornment of humanity. It finds expression in your qualities of your capacity to love, your spirituality, delicacy, radiance, sensitivity, creativity, charm, graciousness, gentleness, dignity, and quiet strength.",James E. Faust,"Love, Your, Humanity"
"I never said I wanted a 'happy' life but an interesting one. From separation and loss, I have learned a lot. I have become strong and resilient, as is the case of almost every human being exposed to life and to the world. We don't even know how strong we are until we are forced to bring that hidden strength forward.",Isabel Allende,"Life, World, I Have Learned"
Faith is the strength by which a shattered world shall emerge into the light.,Helen Keller,"Faith, Light, World"
"Our strength as a nation comes in our unity. We are the United States of America, not the divided states. And those who want to divide us are trying to divide us, and we shouldn't let them do it.",Ben Carson,"Unity, America, Trying"
It is time for parents to teach young people early on that in diversity there is beauty and there is strength.,Maya Angelou,"Beauty, Time, Diversity"
We draw our strength from the very despair in which we have been forced to live. We shall endure.,Cesar Chavez,"Live, Endure, Despair"
Don't be intimidated by what you don't know. That can be your greatest strength and ensure that you do things differently from everyone else.,Sara Blakely,"Your, Know, Everyone"
Sometimes the strength of motherhood is greater than natural laws.,Barbara Kingsolver,"Mother's Day, Sometimes, Laws"
I don't have the strength or wisdom to get through a single day without guidance and grace from God.,Tony Dungy,"Wisdom, God, Day"
"Wisdom is the knowledge of good and evil, not the strength to choose between the two.",John Cheever,"Wisdom, Good, Knowledge"
"The difference between a successful person and others is not a lack of strength, not a lack of knowledge, but rather a lack of will.",Vince Lombardi,"Success, Knowledge, Will"
Worry does not empty tomorrow of its sorrow. It empties today of its strength.,Corrie Ten Boom,"Sympathy, Today, Tomorrow"
If one suffers we all suffer. Togetherness is strength. Courage.,Jean-Bertrand Aristide,"Courage, Togetherness, Suffer"
