title,author,tags
"Fitness has always been a strength of mine. People seem to look at ages and think once you get over 30, you're coming to the end. I'd like to think I've got a number of years left in me. I feel really good, and that's down to the great work the staff at the club do looking after us and the facilities we have.",James Milner,"Work, Good, Fitness"
"A religious man is a person who holds God and man in one thought at one time, at all times, who suffers harm done to others, whose greatest passion is compassion, whose greatest strength is love and defiance of despair.",Abraham Joshua Heschel,"Love, God, Time"
"'Swan Lake' is the most difficult thing to portray for a female ballet dancer; it really requires such specific qualities of articulation, agility, strength, and the arm work is something that takes a lot of training.",Benjamin Millepied,"Work, Training, Difficult"
"The first time you hold your baby in your arms, I mean, a sense of strength and love washes over you. It washed over me and I never thought that possible.",Colin Farrell,"Love, Time, Your"
Strength is one of those things you're supposed to have. You don't feel that you have it at the time you're going through it.,Joan Didion,"Time, Feel, Things"
"Christian, learn from Christ how you ought to love Christ. Learn a love that is tender, wise, strong; love with tenderness, not passion, wisdom, not foolishness, and strength, lest you become weary and turn away from the love of the Lord.",Saint Bernard,"Love, Wisdom, Wise"
"I've been told to 'man up' after talking about depression on Twitter. Man up means 'be strong because that's what a man is.' And they don't just mean physical strength, they mean emotional strength. What, because men get into fights or go to wars to fight? It should be 'woman up.'",Limmy,"Men, Man, Fight"
"The type of cuisine I do, especially after being on 'Iron Chef' for several years, is a lot of global cuisine. My strength has always been Mediterranean cuisine across the board from Morocco, Spain, Italy, Greece, France, but I think now I'm doing a lot of very different cuisines all the time.",Cat Cora,"Time, Always, Chef"
"To see a friend who has suffered the loss of all things begin again with trust and love, gives us strength to continue on.",Mother Angelica,"Love, Trust, Continue"
"Without strong communities, we cannot pull together during times of hardship. Our diversity turns from a source of strength to a source of conflict.",Vivek Murthy,"Together, Diversity, Conflict"
"We live in a cerebral society, in which we have forgotten how fascinating strength is.",Patrik Baboumian,"Society, Live, Forgotten"
"I want to show everyone in this world that the soul is the source of our happiness, strength and health. Love actually comes from the soul, from the light.",Wim Hof,"Love, Happiness, Health"
"A living art of teaching, one that rests on a true understanding of the human being, has a thread of strength running through it that stimulates individual students to participate so that it is not necessary to keep their attention through direct 'individualized' treatment.",Rudolf Steiner,"Art, Keep, Understanding"
"On Earth, men are seen as superior because of their physical strength, but it means nothing in space, where there is no gravity.",Yi So-Yeon,"Space, Men, Nothing"
"Always realize that even your strongest advocate and opponent is a part of the human family; albeit they may have small shortcomings and even strength in them, they are part of that human family.",Bernice King,"Family, Always, Your"
"Every team has its weakness, and every team has its strength.",Booger McFarland,"Weakness, Team, Every"
"Wealth brings strength, strength confidence.",John Lothrop Motley,"Confidence, Wealth, Brings"
I can make all the throws. My mental side is a strength as far as understanding defense schemes and our playbook. I'm able to change plays when needed. I think that sets me apart.,Carson Wentz,"Change, Me, Understanding"
"It's a controversial issue: many feminists reasonably worry that by taking the concentration off gender as an independent locus of oppression, we dilute the strength of a women's movement, or of women's rights advocacy.",Rebecca Traister,"Women, Gender, Worry"
The overall strength of Chinese culture and its international influence is not commensurate with China's international status. The international culture of the West is strong while we are weak.,Hu Jintao,"Culture, Influence, Strong"
"While President Bush likes to project an image of strength and courage, the real truth is that in the presence of his large financial contributors, he is a moral coward.",Al Gore,"Courage, Truth, Real"
"The woman is a gentle, loving bond who encourages, consoles, builds, reconciles, and makes all things new and vibrant. The woman is strength in time of suffering, courageous in failure, intuitive in time of danger. A woman is ingenuous when all fails, resourceful in times of want, and a true helpmate for man.",Mother Angelica,"Failure, Time, Man"
"A guy my size needs a tremendous amount of protein on a daily basis, just to maintain peak size, strength, and performance. Basically, that means six or seven small meals a day, so I depend on protein supplementation.",Kevin Nash,"Daily, Day, Protein"
"As much as I value an union of all the states, I would not admit the southern states into the union, unless they agreed to the discontinuance of this disgraceful trade, because it would bring weakness and not strength to the union.",George Mason,"Value, Weakness, Much"
"The strength of self-reliance and self-development is that of science and technology, and the shortcut to implementing the five-year strategy is to give importance and precedence to science and technology.",Kim Jong-un,"Science, Technology, Strategy"
"It takes so much strength to say to your ego, 'You know what? You're going to keep me lonely, so I have to ignore you.'",George Michael,"Your, Me, Keep"
I want the image of disabled people like myself to change into a picture of strength. Fashion needs to redefine its idea of beauty and have more of an open mind.,Lauren Wasser,"Beauty, Change, Myself"
"The most amazing lesson in aerodynamics I ever had was the day I climbed a thermal in a glider at the same time as an eagle. I witnessed, close up, effortlessness and lightness combined with strength, precision and determination.",Norman Foster,"Time, Amazing, Determination"
"To gain strength in our struggles, we must have a positive perspective of the principles in the plan of salvation. We must realize that we have a personal Savior whom we can trust and turn to in our times of need.",L. Lionel Kendrick,"Positive, Trust, Perspective"
"And when a woman's will is as strong as the man's who wants to govern her, half her strength must be concealment.",George Eliot,"Man, Woman, Will"
"Each year, Labor Day gives us an opportunity to recognize the invaluable contributions that working men and women make to our nation, our economy and our collective prosperity. It gives us a chance to show gratitude for workers' grit, dedication, ingenuity and strength, which define our nation's character.",Tom Perez,"Women, Men, Chance"
I gain strength from postive thought and from the daily conversation with God.,Ottmar Hitzfeld,"God, Daily, Conversation"
"God is not accustomed to refusing a good gift to those who ask for one. Since he is good, and especially to those who are faithful to him, let us hold fast to him with all our soul, our heart, our strength, and so enjoy his light and see his glory and possess the grace of supernatural joy.",Saint Ambrose,"God, Good, Heart"
"One of the primary purposes of civilization - and certainly its primary strength - is the guarantee that family life can flourish in unity, peace, and order.",Robert Kennedy,"Life, Family, Peace"
"I think my best skill in this whole deal is as a conduit to try to bring people together, because I think it's in our unity that we'll have the greatest strength.",Woody Harrelson,"Best, Together, Unity"
Chicago's neighborhoods have always been this city's greatest strength.,Jane Byrne,"Always, City, Greatest"
"Trust comes before strength, and it becomes a conduit of influence. Your strength is a little bit threatening before people trust you.",Amy Cuddy,"Trust, Your, Influence"
Courage conquers all things: it even gives strength to the body.,Ovid,"Courage, Body, Things"
I think what weakens people most is fear of wasting their strength.,Etty Hillesum,"Fear, People, Think"
"Not even girls want to be girls so long as our feminine archetype lacks force, strength, and power.",William Moulton Marston,"Power, Long, Want"
"There is great strength in vulnerability, as it takes courage to push through the fear and share one's true self with others. In music, that vulnerability really speaks to listeners as it connects with their own hearts.",Anoushka Shankar,"Courage, Fear, Great"
"Leaders come in many forms, with many styles and diverse qualities. There are quiet leaders and leaders one can hear in the next county. Some find strength in eloquence, some in judgment, some in courage.",John W. Gardner,"Courage, Find, Quiet"
I think ballet has influenced my personality a lot in the sense that I am very disciplined in all of my endeavours. I am always on time; I take things very seriously. I've built up my inner strength and self-esteem over time as I've improved as a dancer.,Yuan Yuan Tan,"Time, Personality, Always"
I was always fascinated by strength. Arnold was an idol of mine.,Brock Lesnar,"Always, Idol, Mine"
"Although men are accused of not knowing their own weakness, yet perhaps few know their own strength. It is in men as in soils, where sometimes there is a vein of gold which the owner knows not of.",Jonathan Swift,"Men, Gold, Know"
Dry deliveries. That helps when I get the ball back in my hand - like I never really stopped throwing. The goal for me is to increase arm strength.,Jake Arrieta,"Me, Never, Back"
"Kettlebells are the best for everything. We do snatches and swings with them for explosiveness and hamstring and lower back strength, and we'll also throw them into conditioning circuits where I'll do a burpee holding the kettlebells and transition into a 2-handed snatch.",Tim Kennedy,"Best, Everything, Back"
We deceive ourselves when we fancy that only weakness needs support. Strength needs it far more.,Sophie Swetchine,"Support, Weakness, Deceive"
The strength of democratic societies relies on their capacity to know how to stand firm against extremism while respecting justice in the means used to fight terrorism.,Tariq Ramadan,"Justice, Fight, Stand"
"If we resist our passions, it is more due to their weakness than our strength.",Francois de La Rochefoucauld,"Weakness, More, Than"
I learned that there is an inner strength that blossoms when one cleanses themselves by processing and attempting to comprehend their situation and/or experience. Writing became my therapy!,Dominique Jackson,"Experience, Situation, Writing"
"As long as I've got my life, health and strength, and I'm in my right mind? I'mma get money.",E-40,"Life, Health, Money"
He knows not his own strength that hath not met adversity.,Cesare Pavese,"Adversity, Own, He"
I have both English bulldog determination and Bengal tiger strength.,Bikram Choudhury,"Determination, Tiger, Bulldog"
"I travel seven months a year, so it's a lot of hotels and airplanes. I teach about three hours a day. I always go for a run. I try to lift some weights if I have the time and the strength. But running and teaching, that's my life.",Royce Gracie,"Life, Time, Travel"
"I draw my strength from my mom, who passed away a few years ago. She taught me from the day I was just a little boy to never give up and be proud of who I am.",Big Freedia,"Mom, Day, Never Give Up"
I once wrote a book on courage and what made people courageous. I found it was a strength of belief matched by a strength of willpower.,Gordon Brown,"Courage, People, Belief"
"My personal style icons are Diane Von Furstenberg and Linda Fargo. For strength and their own style, Christine Lagarde and Angela Merkel.",Maye Musk,"Style, Own, Personal"
"The most important characteristic that has allowed me to succeed is confidence. I have always been comfortable in my own skin, and even when I was just starting out in my career, had the strength and self-assurance to ask tough questions and push for answers.",Heather Bresch,"Always, Confidence, Skin"
"Our young people are patriots and heroes whom we can be proud of before the world; that they have a large contingent of such trustworthy young people is a great blessing for the Workers' Party of Korea and a source of pride for Korea, and this assures the great strength of our dignified state and its bright future.",Kim Jong-un,"Future, Great, World"
Remember to look at your glass half full and not half empty. A lot of my strength comes from God. God has given me a gift - the gift of life - and it's amazing that I live each day.,Mattie Stepanek,"Life, God, Amazing"
Something called 'the Oklahoma Standard' became known throughout the world. It means resilience in the face of adversity. It means a strength and compassion that will not be defeated.,Brad Henry,"Adversity, World, Face"
"I see that I have, as part of my stock in trade, a very regal personality and carriage. I see that I have a kind of strength, a kind of command, and a kind of power that one would associated with a monarch.",Laurence Fishburne,"Power, Personality, See"
The strength and power of despotism consists wholly in the fear of resistance.,Thomas Paine,"Power, Fear, Resistance"
I would just say that human beings are stronger together. Relying on someone else is not a sign of weakness; it shows strength that you're able to accept that you need help.,Dove Cameron,"Together, Weakness, Accept"
"I remember myself as an asthmatic child, having great difficulties at 7, 8 and 9 years old, falling totally in love with 'Tarzan, Lord of the Jungle' and dreaming of having his strength to leap into trees and throw mighty lions to the ground.",Gene Roddenberry,"Love, Great, Myself"
"We live in a world where to admit anything negative about yourself is seen as a weakness, when it's actually a strength. It's not a weak move to say, 'I need help.' In the long run, it's way better, because you have to fix it.",Jon Hamm,"Yourself, World, Long"
I am climbing a difficult road; but the glory gives me strength.,Sextus Propertius,"I Am, Me, Road"
"It has been my honor to support and work with President Barack Obama, a man who has brought courage and character to the presidency. President Obama's strength of character leads him to do the right thing, even when it isn't the easy thing.",Harry Reid,"Work, Courage, Character"
"When liberals finally grasped the strength of popular feeling about the family, they cried to appropriate the rhetoric and symbolism of family values for their own purposes.",Christopher Lasch,"Family, Own, Feeling"
The first thing is that we're being attacked by both the Writers Guild and the Producers Guild. Both of these groups are trying to diminish the importance and strength of the director. They're trying to do it through both frontal and side attacks.,John Frankenheimer,"Trying, First, Director"
"I believe in the Prince of Peace. I believe that War is Murder. I believe that armies and navies are at bottom the tinsel and braggadocio of oppression and wrong, and I believe that the wicked conquest of weaker and darker nations by nations whiter and stronger but foreshadows the death of that strength.",W. E. B. Du Bois,"Death, War, Peace"
Most people don't think about plyometrics when they think about powerful strength. But I do lots of them to build mine.,Allyson Felix,"People, Build, Mine"
"For me, the perfect romantic suspense hero has got to be tough on the outside but tender at his core. A take-charge kind of guy who has his own inner strength and a strong sense of right and wrong - which might not dovetail with the conventional wisdom. I mean, he might bend the law if he thinks the ends justify the means.",Ruth Glick,"Wisdom, Romantic, Hero"
"There is something about my aura or essence, or whatever, that draws the ex-wife characters to me. I don't seek them out, but people tend to think of me for that particular archetype, or whatever you want to call it, and I don't mind it. I think there is a strength to it.",Natalie Zea,"Mind, Me, People"
"I think naturally, if you're an actor, there's a high level of assertiveness that you need to have to survive this business. There's boldness in being assertive, and there's strength and confidence.",Bryan Cranston,"Business, Confidence, Survive"
I have a more personal insight into the importance of core strength because my wife Louise runs a Pilates studio in London. I have enjoyed getting into Pilates. I am not the most supple but I enjoy Pilates more than yoga.,Jos Buttler,"Wife, I Am, Insight"
"I get paralyzingly nervous a lot of times, so I tried bravado. The way I dress and carry myself, a lot of people find it intimidating. I think my whole career can be boiled down to the one word I always say in meetings: 'strength.'",Lorde,"Myself, Always, Dress"
"My strength is my unpredictablity. I can wrestle, I can strike, I can move fast, and I do a good job of covering up. And because of my experience, I'm able to put myself in good positions in the ring. The guys I fight, they have to be ready for anything.",Tyron Woodley,"Good, Experience, Myself"
"As far as I can judge, English football is not for everybody. You need to have the lungs for it, you need to have the strength for it.",Ryan Babel,"Football, I Can, Judge"
"I do all core-based alignment training and strength training. If I don't die at the end of 90 minutes, then it hasn't been a good workout.",Lauren Cohan,"Good, Die, Training"
"In every decision that we've ever made that's important, the more input, the more people we've heard from, the better the result. And so that will never change in the business model of NASCAR, because the ideas come from all over the place, and that's the strength that we have.",Brian France,"Change, Business, Decision"
"Part of my advantage is that my strength is economic forecasting, but that only works in free markets, when markets are smarter than people. That's how I started. I watched the stock market, how equities reacted to change in levels of economic activity, and I could understand how price signals worked and how to forecast them.",Stanley Druckenmiller,"Change, Free, Stock Market"
"Being a winger or a wide mid, I have to run continuously for 90 minutes, which not only takes endurance but also strength in my legs to be able to be explosive for 90 minutes. I think weight training has really allowed me to sustain for those 90 minutes.",Megan Rapinoe,"Training, Me, Endurance"
"It was helpful to have the American troops there in great strength. They knew there'd be consequences if they didn't move back. Now, there has been some removal of the foreign forces.",Warren Christopher,"Great, American, Consequences"
"As a single mother of four, my mother taught me that you always want to show up strong for the moments that really matter with family, friends, and community. I now recognize how her strength helped shape the person I am today and the mother that I have become.",Andie MacDowell,"Family, Today, Always"
"What provides me with the strength and conviction to walk proudly among protesters so angry about the policies I endorse is the support I absorb when I am in my own constituency. Whenever I am at home, I am met with smiling faces, and words of thanks, even hugs.",Layla Moran,"Home, Walk, Angry"
"It's so important to be chosen for the national team. For the Copa America, for the World Cup, or just friendly matches, it's such an honour to reach that stage and be chosen for the team. People expect players to wear Brazil's shirt, win the title with pride, and keep winning. You have to have the mental strength to get over this pressure.",Zico,"World, Win, Pride"
"I normally did isolation/bodybuilding-style workouts. But since coming to the Performance Center, the strength and conditioning coach has me doing a lot of different workouts I've never done before, and it's really shocked my body in a good way.",Ricochet,"Good, Done, Body"
Mental strength is something you either have or you haven't.,Katie Taylor,"Something, Either, Mental"
"Well you know I'm very supportive of what the Tea Party is trying to do. They're very concerned with spending, the deficit, the bailouts, you know all of those kinds of things. But I really think that the strength of the Tea Party is being a grassroots movement.",John Boozman,"Tea, Know, Trying"
"The strength of our economy allows us to maintain the mightiest military in the world, effectively enforcing a Pax Americana.",Ted Cruz,"World, Us, Economy"
"I like a women who's got some balls, some strength. As long as I can beat her at arm wrestling, that's fine.",James Hetfield,"Women, Long, Beat"
"My greatest strength is my speed and power. This is what stands out more but I'll get better, I have many attributes.",Adama Traore,"Power, Better, Speed"
"Mohammed was not an apparent failure. He was a dazzling success, politically as well as spiritually, and Islam went from strength to strength to strength.",Karen Armstrong,"Success, Failure, Islam"
"'Tis skill, not strength, that governs a ship.",Thomas Fuller,"Skill, Ship, Tis"
"Give us grace and strength to forbear and to persevere. Give us courage and gaiety and the quiet mind, spare to us our friends, soften to us our enemies.",Robert Louis Stevenson,"Courage, Grace, Mind"
We are a long time in learning that all our strength and salvation is in God.,David Brainerd,"Faith, God, Learning"
"Mental strength is really important because you either win or lose in your mind. And I'm not solely talking about sporting matches, boxing events - anything you do, you do it first with your mental strength. And you can actually train and develop it, and I am responsible for what I'm saying because I have experience with that.",Wladimir Klitschko,"Experience, Your, Mind"
"The authority of a life for Christ always has greater influence than the authority of talking. A young person can possess all of the benefits of authority - influence, respect, and strength - just by following Jesus wherever he leads.",Mike Yaconelli,"Life, Respect, Always"
When you have a wife who has been a tower of strength and shown more courage than you dreamed existed - that's the finest I know.,Lou Gehrig,"Courage, Wife, Know"
A conviction that you are a daughter of God gives you a feeling of comfort in your self-worth. It means that you can find strength in the balm of Christ. It will help you meet the heartaches and challenges with faith and serenity.,James E. Faust,"Faith, God, Your"
Draw great strength from your family and give in turn to those who come after you.,Janet Reno,"Family, Great, Your"
"Indeed, the existence of class, of social hierarchy, is as old as man himself. It prevails in the jungle where strength determines hierarchy; among men, it has also been savagely the same, whereby rulers vested with power through personal combat, or through lineal heritage as in the case of royalty, ravage their subjects.",F. Sionil Jose,"Power, Men, Man"
I think that we should remember that social change can happen when people join together with some strength.,Haskell Wexler,"Change, Together, Remember"
"I do breakfast first, which is a small bowl of oatmeal and some sort of protein, like hard-boiled eggs. And then I work out - 40 minutes of cardio and maybe some strength training.",Jake Tapper,"Work, Breakfast, Training"
My strength was that I am more balanced and calmer than most other riders.,Miguel Indurain,"I Am, More, Most"
"The 'Bird's Nest' National Stadium, which I helped to conceive, is designed to embody the Olympic spirit of 'fair competition.' It tells people that freedom is possible but needs fairness, courage and strength.",Ai Weiwei,"Courage, Freedom, Bird"
"I am not someone like A. B. de Villiers, Gayle, or Dhoni. I don't have that much power. I have to use my brain to manipulate the field and stick to my strength, which is to hit through the lines.",Rohit Sharma,"Power, Brain, I Am"
I gain strength out of familiar surroundings.,Fedor Emelianenko,"Surroundings, Gain, Familiar"
"Billie Holiday, Aretha Franklin. Now, they are so subtle, they can milk you with two notes. They can make you feel like they told you the whole universe. But I don't know that yet. All I got now is strength. Maybe if I keep singing, maybe I'll get it.",Janis Joplin,"Universe, Keep, Singing"
I've always enjoyed singing and can't recall a time in my life where I wasn't singing. I'm most grateful for the strength I have in that department. I have a lot of bad habits on the guitar which limits my playing ability. But I get a little better each year.,Jason Mraz,"Life, Time, Always"
"When it comes to Pakistan, the first word that comes to the mind of the Chinese is 'iron brother.' To us Chinese, Pakistan is always a trustworthy friend who is as solid as iron. Actually, Chinese netizens refer to Pakistan as 'Iron Pak.' This testifies to the strength of China-Pakistan friendship.",Li Keqiang,"Friendship, Always, Mind"
"Those who have the strength and the love to sit with a dying patient in the silence that goes beyond words will know that this moment is neither frightening nor painful, but a peaceful cessation of the functioning of the body.",Elisabeth Kubler-Ross,"Love, Death, Moment"
"To have ego means to believe in your own strength. And to also be open to other people's views. It is to be open, not closed. So, yes, my ego is big, but it's also very small in some areas. My ego is responsible for my doing what I do - bad or good.",Barbra Streisand,"Good, Your, Believe"
