title,author,tags
Strength of mind rests in sobriety; for this keeps your reason unclouded by passion.,Pythagoras,"Your, Passion, Mind"
"When restraint and courtesy are added to strength, the latter becomes irresistible.",Mahatma Gandhi,"Courtesy, Restraint, Latter"
"Many classical musicians lack pulse and rhythmical strength and precision, so for us it was very important to acquire and learn those.",Luka Sulic,"Important, Musicians, Us"
It's being willing to walk away that gives you strength and power - if you're willing to accept the consequences of doing what you want to do.,Whoopi Goldberg,"Power, Walk, Doing"
"When a president makes life and death decisions, he should draw strength and wisdom from broad and deep experience with the reasons for and the risks of committing our children to our defense. For no matter how many others are involved in the decision, the president is a lonely man in a dark room when the casualty reports come in.",John McCain,"Life, Wisdom, Death"
"Poesy must not be drawn by the ears: it must be gently led, or rather, it must lead, which was partly the cause that made the ancient learned affirm it was a divine, and no human skill, since all other knowledges lie ready for any that have strength of wit; a poet no industry can make, if his own genius be not carried into it.",Philip Sidney,"Lie, Skill, Genius"
Prayer is more than meditation. In meditation the source of strength is one's self. When one prays he goes to a source of strength greater than his own.,Chiang Kai-shek,"Prayer, Own, Self"
"We can take full comfort in realizing the continuing strength of our nation. America's lands remain radiantly rich with diversity, and freedom still reigns.",Ben Nelson,"Freedom, Diversity, Comfort"
"I realized over the years if I'm writing about humor, irony, satire, I much prefer to do that in English. And if there is sorrow, melancholy, longing, I much prefer to do that in Turkish. Each language has its own strength to me, and I feel connected and attached to both Turkish and English. I dream in more than one language.",Elif Safak,"Humor, Me, Language"
"I mean I'm not smarter than the market, but I can recognize a good tape and a bad tape. I recognize when it's right and when it's wrong and that's what my strength is.",Jim Cramer,"Good, Bad, I Can"
"The more mental strength you have, the better. If you look at some of the best players that we have seen over the years and that I have been playing with, mentally they are the best competitors as well, something I have worked hard on.",Kevin Anderson,"Best, Better, Look"
"One of the things that always comes up in my writing is the search for freedom, especially in women. I always write about women who are marginalized, who have no means or resources and somehow manage to get out of those situations with incredible strength - and that is more important than anything.",Isabel Allende,"Women, Freedom, Always"
"I just like to keep things small and subtle and authentic, and ground everything in reality. So that is something that I feel is my strength as a director and I try to achieve as an actor.",Pamela Adlon,"Reality, Try, Keep"
"But after this natural burst of indignation, no man of sense, courage, or prudence will waste his time or his strength in retrospective reproaches or repinings.",Robert Peel,"Courage, Time, Man"
"I think there's a great strength in having the courage and also having the support to do what you want to do when you're an artist in any way, shape or form.",Dave Gahan,"Courage, Great, Support"
"I get up every morning and say, 'Father, give me strength today, not strength so I can lift 500 pounds, but give me strength, Lord, so when I speak, my words might motivate, might inspire somebody, Lord, when they see me, let them see you. When they hear me, Lord, let them hear you. In your holy name I pray.'",Mr. T,"Morning, Today, Your"
I firmly believe in prayer. It is possible to reach out and tap the unseen power which gives strength and anchor in time of need.,Ezra Taft Benson,"Power, Time, Prayer"
"People in football love to talk about mental strength. Well, I'm the strongest dude you're ever going to meet.",Romelu Lukaku,"Love, Football, People"
"Sometimes a little kid will come up to me and ask me to show him some tricks. I always have to say: 'I can't do any tricks.' They want to see some sort of magic: keepie-uppies, around-the-worlds, that sort of thing. It's not really my strength.",Thomas Muller,"Always, Me, Will"
"Exercise helps me with stress. It changes your brain chemistry. I turn to Ashtanga yoga when I feel the need to relax. I love it, but it's not right for everybody. It's taught to you a little bit at a time, according to your body type and your strength. That keeps things challenging.",Lisa Edelstein,"Love, Time, Relax"
It takes a great deal of character strength to apologize quickly out of one's heart rather than out of pity. A person must possess himself and have a deep sense of security in fundamental principles and values in order to genuinely apologize.,Stephen Covey,"Great, Character, Heart"
I have always had good strength in my legs from working out with weights. I have also been riding a bike of some sort for most of my life and have good agility.,Mark-Paul Gosselaar,"Life, Good, Always"
"We can reach our potential, but to do so, we must reach within ourselves. We must summon the strength, the will, and the faith to move forward - to be bold - to invest in our future.",John Hoeven,"Future, Faith, Will"
"I am not writing to try and convert people to fundamental Christianity. I am just trying to share my experience, strength and hope, that someone who is as messed up and neurotic and scarred and scared can be fully accepted by our dear Lord, no questions asked.",Anne Lamott,"Hope, Experience, I Am"
"In my perfect day, I wake up next to the woman of my dreams, and she's crying tears of joy because she's so excited about the life we have together. I'm preparing to compete in the 2016 Olympics with U.S.A. Team Handball, so I head to an intense training session with my coach to increase my physical strength and athleticism.",Lewis Howes,"Life, Dreams, Day"
"We did everything we could to save my legs, and it just came to a point where if we didn't amputate my legs, I wouldn't survive. In that situation, you kind of go into survival mode, and you find strength.",Amy Purdy,"Survival, Situation, Find"
Better than the strength of men and horses is our wisdom.,Xenophanes,"Wisdom, Men, Better"
The first movement ballerina should be a paradigm of strength and authority.,Robert Gottlieb,"First, Authority, Movement"
Internationalism on the other hand admits that spiritual achievements have their roots deep in national life; from this national consciousness art and literature derive their character and strength and on it even many of the humanistic sciences are firmly based.,Christian Lous Lange,"Life, Art, Character"
"My mental strength was definitely a weakness back in the karting days, and I've worked hard on that to be as ready as possible for whenever I had the chance in F1.",Charles Leclerc,"Chance, Weakness, Possible"
He knows not his own strength that has not met adversity.,Ben Jonson,"Adversity, Own, He"
"Difficulty, my brethren, is the nurse of greatness - a harsh nurse, who roughly rocks her foster - children into strength and athletic proportion.",William Cullen Bryant,"Greatness, Children, Rocks"
"Quarreling over food and drink, having neither scruples nor shame, not knowing right from wrong, not trying to avoid death or injury, not fearful of greater strength or of greater numbers, greedily aware only of food and drink - such is the bravery of the dog and boar.",Xun Kuang,"Death, Food, Dog"
The men who have guided the destiny of the United States have found the strength for their tasks by going to their knees. This private unity of public men and their God is an enduring source of reassurance for the people of America.,Lyndon B. Johnson,"God, Men, Unity"
I'm an activist for gay marriage equality and children's rights. I'm the face of Share Our Strength.,Sandra Lee,"Equality, Marriage, Face"
"I look forward to a great future for America - a future in which our country will match its military strength with our moral restraint, its wealth with our wisdom, its power with our purpose.",John F. Kennedy,"Wisdom, Future, Power"
"Our real problem, then, is not our strength today; it is rather the vital necessity of action today to ensure our strength tomorrow.",Dwight D. Eisenhower,"Today, Tomorrow, Action"
"With the proper motivation, you can do anything. I was just a poor kid that ate pork and beans out of a can and apple sauce. I went from rags to riches. But it does take a lot of determination, inner strength, drive, and discipline.",Lee Haney,"Determination, Discipline, Drive"
"What I've learned is that unless it's an emergency, like a fire or brain surgery, hierarchy is not necessary and may be damaging. If you have a hierarchy, you're repeating the strengths and weaknesses of one person without allowing for the accumulative strength of a group.",Gloria Steinem,"Brain, Fire, Person"
"Being a caregiver requires infinite patience, physical and emotional strength, health care navigation skills, and a sense of humor - which can be hard to come by after sleepless nights and demanding days.",Rosalynn Carter,"Health, Patience, Humor"
"Carrie is my child, and I love her with every ounce of strength I possess.",Debbie Reynolds,"Love, Child, Her"
Only actions give life strength; only moderation gives it charm.,Jean Paul,"Life, Only, Moderation"
"In 1995, I was diagnosed with cancer, and I had to practice what I preached. I had always said to 'believe in God' and 'don't give up' to little kids who had been diagnosed with cancer. I then thought if I can't call on that same God and same strength that I told people about, I would be a liar and a phony.",Mr. T,"God, Always, Believe"
"Our strength is not just in the size of our defense budget, but in the size of our hearts, in the size of our gratitude for their sacrifice. And that's not just measured in words or gestures.",Jennifer Granholm,"Sacrifice, Gratitude, Words"
"Muhammad Ali was such an original - his antics, his character, his charisma, his strength, his individuality.",Jon Jones,"Character, Individuality, Charisma"
"Experience acquired in the heroic battle against Batista's tyranny showed that the enemy, no matter what his strength, could not defeat the Cuban people.",Fidel Castro,"Experience, Battle, Matter"
"I have behind me not only the splendid traditions and the annals of more than a thousand years but the living strength and majesty of the Commonwealth and Empire; of societies old and new; of lands and races different in history and origins but all, by God's Will, united in spirit and in aim.",Queen Elizabeth II,"God, History, Aim"
Will power is only the tensile strength of one's own disposition. One cannot increase it by a single ounce.,Cesare Pavese,"Power, Will, Own"
"Families are the tie that reminds us of yesterday, provide strength and support today, and give us hope for tomorrow. No government, no matter how well-intentioned, or well-managed, can provide what our families provide.",Bill Owens,"Hope, Government, Today"
"As a child growing up in refugee camps, life taught me that many things were impossible. My older sister, Claire, taught me otherwise when her strength and resilience made the impossible possible in the way she worked, behaved, and took control of our lives.",Clemantine Wamariya,"Life, Impossible, Me"
All the strength and force of man comes from his faith in things unseen. He who believes is strong; he who doubts is weak. Strong convictions precede great actions.,James Freeman Clarke,"Faith, Great, Man"
"Rag paper, containing hemp fiber, is the highest quality and longest lasting paper ever made. It can be torn when wet, but returns to its full strength when dry.",Jack Herer,"Quality, Paper, Longest"
"We had idyllic summer holidays, building sandcastles with my father on the beach at Bridlington. It might sound strange, but I think that secure cocoon of familial love was so nourishing, it gave me the strength to live life on my own.",Kiki Dee,"Life, Love, Me"
"Baseball players need strength but also the ability to make fast-paced, explosive movements, so their training is all about strengthening the tendons around the bone and the joint so you don't tear the muscles from the bones.",Chadwick Boseman,"Training, Ability, Baseball"
"Hillary Clinton has taken some fire over 40 years of her fight for families and children. How does she do it? That's what I want to know. Where does she get her grit and her grace? Where do any of our female firsts, our pathbreakers, where do they find that strength?",Meryl Streep,"Fight, Grace, Fire"
"Words don't define me. Actions, my faith, and the strength of my relationships and family do.",Rachel Campos-Duffy,"Faith, Family, Me"
"Keep America strong. Strong in our values, strong in our economy, and strong in our military might. We hope to never have to use our military strength, but the world counts on a strong America to keep the worst actors from doing the worst things.",Mitt Romney,"Hope, World, Doing"
"A number of bloggers in economics and the financial sector have risen to prominence through the sheer strength of their work. Note it was not their family connections nor ties to Ivy League schools or elite banks, but rather the strength of their research, analysis and writing.",Barry Ritholtz,"Work, Family, Economics"
"Communism everywhere has paid the price of rigidity and dogmatism. Freedom has the strength of compassion and flexibility. It has, above all, the strength of intellectual honesty.",Robert Kennedy,"Freedom, Honesty, Compassion"
"I bring a lot of energy and passion to what I do. Plus, I've had some weird feats of superhuman strength!",John Cena,"Passion, Energy, Weird"
I believe the continually advancing Information Revolution will lend us the wisdom and strength to address humanity's previously unsolvable problems and help us make a positive impact on all of society.,Masayoshi Son,"Positive, Wisdom, Society"
We will not find the inner strength to evolve to a higher level if we do not inwardly develop this profound feeling that there is something higher than ourselves.,Rudolf Steiner,"Will, Find, Feeling"
The wisest use of American strength is to advance freedom.,George W. Bush,"Freedom, American, Use"
"My family, especially my mother is my biggest strength. She has helped me through so much in life.",Rashami Desai,"Life, Family, Me"
My greatest strength as a consultant is to be ignorant and ask a few questions.,Peter Drucker,"Questions, Consultant, Ignorant"
"I don't really go out and do too much like networking and Hollywood events kind of thing. But I do some writing, and I find it helps me as an actor in terms of giving yourself back the power and feeling a bit of strength in that respect.",Scottie Thompson,"Power, Respect, Yourself"
"If the leader is filled with high ambition and if he pursues his aims with audacity and strength of will, he will reach them in spite of all obstacles.",Carl von Clausewitz,"Obstacles, Ambition, Will"
"Uncontrolled, the hunger and thirst after God may become an obstacle, cutting off the soul from what it desires. If a man would travel far along the mystic road, he must learn to desire God intensely but in stillness, passively and yet with all his heart and mind and strength.",Aldous Huxley,"God, Travel, Heart"
Religion is an illusion and it derives its strength from the fact that it falls in with our instinctual desires.,Sigmund Freud,"Religion, Illusion, Fact"
"Growing up, I heard a lot about strength. My dad - a Holocaust survivor - embodied it, though he would never say that about himself. Not only did he survive one of the most horrific events in history, but he never lost hope along the way, crediting acts of kindness with keeping him alive.",Daniel Lubetzky,"Hope, History, Dad"
"I think the beauty of Catholicism is its consistency through both successes and difficulties. I've counted on my faith to give me strength through both training and competition - but also in school, with my family and everyday life.",Katie Ledecky,"Life, Beauty, Faith"
I've always found poverty a source of strength.,Stephen Frears,"Always, Poverty, Source"
"We know, from our mothers, our sisters, our daughters, our friends, that our strength comes - female strength - comes in all kinds of forms.",Niki Caro,"Know, Friends, Daughters"
"It is no use painting the foot of the tree white, the strength of the bark cries out from beneath the paint.",Aime Cesaire,"Tree, Painting, White"
"I can't distract myself enough here, for sketches to a new opera are constantly buzzing around in my head, to the extent that I need all my strength to wrest myself from them.",Richard Wagner,"Myself, New, Enough"
"The earliest paintings I loved were always the most non-referential paintings you can imagine, by painters such as Mondrian. I was thrilled by them because they didn't refer to anything else. They stood alone, and they were just charged magic objects that did not get their strength from being connected to anything else.",Brian Eno,"Alone, Always, Magic"
"We use our shoulder muscles to accomplish practically every pulling, pushing, and hoisting task we do (they really do carry the weight of the world!), so they're a great place to start building strength.",Denise Austin,"Great, World, Start"
Freedom and order are not incompatible... truth is strength... free discussion is the very life of truth.,Thomas Huxley,"Life, Truth, Freedom"
"In view of China's growing military strength and intentions, the best way to safeguard Asia's permanent peace and prosperity is to have all Asian countries join forces with other democratic countries in the world to form a global community of democracies.",Jim Costa,"Best, Peace, Community"
"I see the beauty in boxing. It teaches me strength physically, but mostly mentally. I had to learn my strength, because for so long I could have been tougher than I was.",Kelly Rowland,"Beauty, Long, Me"
"Atheism shows strength of mind, but only to a certain degree.",Blaise Pascal,"Mind, Degree, Only"
"We set ourselves limits, but we are all strong enough to aim higher, to achieve our goals. All we have to do is find such strength within ourselves. Know how to develop it.",Alain Robert,"Goals, Aim, Limits"
My father has been a constant source of love and strength in my life.,Hunter Biden,"Life, Love, My Life"
"See, I hold myself through my own muscle strength. That is why I'm built like Arnold Schwarzenegger.",Toyah Willcox,"Myself, Own, Muscle"
I think our strength is this strong relationship we have all together.,Guy Forget,"Relationship, Together, Strong"
"I think if you go to 'Strength of the World,' a song like that, the chorus isn't that great, but you go into the bridge and other things and the catchier parts and the better melodies we were really focused on.",Synyster Gates,"Great, World, Bridge"
"If I don't make heritage visible and the strength of mother tongue important for my grandchildren, it scares me that they might say in 20 years from now, 'Well, it is rumoured that we used to be Africans long ago.' And in many urban areas, it's already happening.",Hugh Masekela,"Long, Me, Heritage"
"All my life, since the time I was little, has been a long distraction. At least that is the way some people want to perceive it, but for me, it's given me a lot of strength.",Hope Solo,"Life, Time, Long"
"As much as we pump iron and we run to build our strength up, we need to build our mental strength up... so we can focus... so we can be in concert with one another.",Phil Jackson,"Focus, Build, Much"
"The Israeli public's willingness to enlist, the warm embrace for the soldiers and the residents of the south, and the desire to contribute and to give at any given moment really warm the heart, and it gives all of us strength.",Yair Lapid,"Heart, Moment, Desire"
God grant you the strength to fight off the temptations of surrender.,Walter Annenberg,"God, Fight, Surrender"
"I am never going to be much of a physical presence. For me, it's more about taking my strength and finding a way to use it as an advantage.",Connor McDavid,"I Am, Me, Way"
"Much to my surprise, not a moment have I been made to feel, 'Alright, a woman - probably the prime minister wanted to make a token gesture.' The ease with which people have taken this thought of a woman minister has been a great strength for me and has made my job far easier.",Nirmala Sitharaman,"Great, Moment, Surprise"
I was introduced to the church through my parents but I had to struggle and find it on my own. In the end I learned much of my faith and found much of my strength through watching my father's and mother's journeys.,John Carter Cash,"Faith, Struggle, Parents"
"I get curious about new things. My real strength is going into a field that has not been investigated before, and finding new approaches to it.",Joshua Lederberg,"New, New Things, Curious"
"When the characters are believable and endearing, action scenes, for example, make an impact. Otherwise, the audience gets no kick out of action. The biggest strength of 'MCA' is that its characters are real.",Nani,"Action, Impact, Real"
A strength to harm is perilous in the hand of an ambitious head.,Elizabeth I,"Head, Harm, Hand"
"It is a sign of contraction of the mind when it is content, or of weariness. A spirited mind never stops within itself; it is always aspiring and going beyond its strength.",Michel de Montaigne,"Always, Mind, Never"
"Do you really think it is weakness that yields to temptation? I tell you that there are terrible temptations which it requires strength, strength and courage to yield to.",Oscar Wilde,"Courage, Temptation, Weakness"
"As long as I have health and strength, I will gladly work all my days.",Frederic Chopin,"Work, Health, Long"
I couldn't change by myself. I needed my faith and belief in Christ to give me the strength to break free and allow people to help me to change.,Eddie Guerrero,"Faith, Change, Myself"
"After a post-Bill Berry softening with albums like 'Up' and 'Reveal,' R.E.M. seems to be toughening up again; on the strength of the first single, 'Discoverer,' the band's new record looks to continue with the same muscular rock and roll that defined its last album, 'Accelerate.'",Karan Mahajan,"Rock And Roll, New, First"
"Within my first year of moving abroad living on my own, my sister got ill - she got cancer - and at the same time, my mum got cancer, and she passed away. I think at that time it was a hard challenge for me to deal with it, but in a way, I have always taken strength out of anything that has come at me.",Vincent Kompany,"Time, Always, Me"
"Together we can build the Michigan we believe in, because we still have what we need most - the strength, the talent, the vision and the grit of the incredible people of this state.",Gretchen Whitmer,"Vision, Together, Believe"
I think the thing that is most influential about 'Haxan' is the casting of the witches as just old women and the strength of that.,Robert Eggers,"Women, Old, Think"
"One killer exercise that's really great is pull-ups with your legs out level. That's my favourite. It's such functional core strength, and that's why I can climb up trees and down vines.",Bear Grylls,"Great, Your, Climb"
"My knee is as strong as it was before, if not stronger, and it's a matter of getting my leg strong. I lost six years of strength in about six month's time, so it's going to take another year or two to get that leg back up to full strength, but I'm good to go so far.",Picabo Street,"Good, Time, Lost"
I never won anything by myself. I was always strong because of help that gave me extra strength to win.,Dan Gable,"Myself, Always, Win"
"Being a strongman is a real test of functional strength. What can you pick up, carry and how fast can you move it. It's not a weight room strength, it takes brute strength and power to lift, carry and pull all types objects from fire engines, Mack trucks, transport planes and large stones.",Brian Shaw,"Power, Fire, Fast"
"Each is under the most sacred obligation not to squander the material committed to him, not to sap his strength in folly and vice, and to see at the least that he delivers a product worthy the labor and cost which have been expended on him.",Anna Julia Cooper,"Product, See, Labor"
"Inner-thigh strength is important, and not just for appearance sake. If you enjoy - or have always wanted to try - ice skating or roller blading, strong inner thighs will come in handy.",Denise Austin,"Always, Try, Will"
I hope to God that the inner strength that will vindicate my deeds will in good time spring forth from my own people. I have done as I had to on the prompting of my inner voice.,Kurt Huber,"God, Hope, Good"
"Arm strength, I think, is a thing that's, like, incredibly overrated in the NFL.",Matt Hasselbeck,"Think, Like, Overrated"
"There are simply more young people than there ever were. You get this feeling of strength. Also, large numbers can be a drawback, making it difficult to lose one's anonymity.",John Knowles,"Lose, Difficult, People"
People are deeply interested in rewriting the established narratives and challenging what we see as the norm in every way. We want to see a new definition of beauty and sexy. We want to see different people look vulnerable and show strength and redefine what it means to be strong.,Winston Duke,"Beauty, Sexy, Look"
We have achieved tremendous success in Ireland and internationally on the strength of our creativity and design skills.,John Rocha,"Success, Design, Creativity"
