title,author,tags
"Ministers should not pray so loud, and long, as to exhaust the strength. It is not necessary to weary the throat and lungs in prayer. God's ear is ever open to hear the heart-felt petitions of his humble servants, and he does not require them to wear out the organs of speech in addressing him.",Ellen G. White,"God, Prayer, Humble"
"Public corruption is the FBI's top criminal priority. The threat - which involves the corruption of local, state, and federally elected, appointed, or contracted officials - strikes at the heart of government, eroding public confidence and undermining the strength of our democracy.",James Comey,"Government, Democracy, Heart"
I am an example of what is possible when girls from the very beginning of their lives are loved and nurtured by people around them. I was surrounded by extraordinary women in my life who taught me about quiet strength and dignity.,Michelle Obama,"Life, Women, I Am"
"My emotions are usually my weakness, but they are my strength while acting.",Amruta Khanvilkar,"Emotions, Weakness, Acting"
"Core strength and stability is very important to me. Tennis is all about rotation of the body and my ability to create power. I incorporate a lot of abdominal, back and glute exercises into my gym sessions.",Samantha Stosur,"Power, Body, Me"
I don't think I've ever been as humbled as I have been in Pilates. It's incredible how much body control and how much isolated strength you have to have to complete these movements successfully.,Jake Arrieta,"Body, Control, Humbled"
"From my perspective, I absolutely believe in a greater spiritual power, far greater than I am, from which I have derived strength in moments of sadness or fear. That's what I believe, and it was very, very strong in the forest.",Jane Goodall,"Power, Fear, Believe"
Organized religion is a sham and a crutch for weak-minded people who need strength in numbers.,Jesse Ventura,"Religion, People, Numbers"
"God's grace is amazing! We're saved by grace - God's undeserved favor - and we live by grace, which is also God's power in our lives to do what we could never do in our own strength. And it's all because God is love, and He loves us unconditionally, constantly and completely.",Joyce Meyer,"Love, God, Power"
"Being an American is a state of mind, and to be in a family is to feel the power of belonging, the power of your roots. Family is a tree, the strength of a tree, the roots, the leaves, the past and the present, the future, the fruits, the seeds.",Esai Morales,"Future, Family, Power"
Through prayers I get the strength to face all the difficulties.,Jasmin Bhasin,"Face, Difficulties, Through"
"The French Revolution will be found to have had great influence on the strength of parties, and on the subsequent political transactions of the United States.",John Marshall,"Great, Political, Will"
"Wondrous is the strength of cheerfulness, and its power of endurance - the cheerful man will do more in the same time, will do it; better, will preserve it longer, than the sad or sullen.",Thomas Carlyle,"Positive, Sad, Power"
Our passion is our strength.,Billie Joe Armstrong,"Passion, Our"
"Since I was a little girl, I have witnessed the strength and courage that energized my mother, who left every sorrow and pain in the past, who would work unyieldingly to obtain her goals, who was the great warrior from whom I learned all the values that are today fundamental pillars of my every day.",Thalia,"Work, Courage, Great"
"It took more strength and hard work than I would've believed myself capable of, but with God's grace and strength, I managed to lift myself up and become a better person that I'd ever imagined - I believe I have become a loving husband, a compassionate father, and a stronger wrestler.",Eddie Guerrero,"Work, God, Hard Work"
"Strength of character may be learned at work, but beauty of character is learned at home.",Henry Drummond,"Beauty, Work, Home"
"It is labor that keeps the strong man strong. And spiritual labor, toil and burden-bearing, is what will give strength to the church of Christ.",Ellen G. White,"Man, Strong Man, Spiritual"
"If you would know strength and patience, welcome the company of trees.",Hal Borland,"Patience, Welcome, Know"
The key element in tragedy is that heroes and heroines are destroyed by that which appears to be their greatest strength.,Robert Shea,"Tragedy, Key, Greatest"
"It takes strength to make your way through grief, to grab hold of life and let it pull you forward.",Patti Davis,"Life, Your, Way"
Good composition is like a suspension bridge - each line adds strength and takes none away.,Robert Henri,"Good, Bridge, Like"
"People judge you really quickly, at first just on your facial features. There are two dimensions - warmth and competence. You can think of them as trustworthiness and strength. They're first judging you on warmth; evaluating whether or not you are trustworthy. That's much more important to them than whether or not you're competent.",Amy Cuddy,"Your, Important, People"
"To be an effective leader, you have to have a manipulative streak - you have to figure out the people working for you and give each tasks that will take advantage of his strength.",Norman Schwarzkopf,"Will, People, Take"
"Before I became a fighter pilot, everyone said that women didn't have the physical strength. Well, I had just completed the Hawaii Ironman Triathlon.",Martha McSally,"Women, Fighter, Everyone"
"Of course! It takes a lot of strength to mend a broken heart. Channelising energies into your work helps, but also to be able to accept situations for what they are instead of questioning them helps immensely.",Deepika Padukone,"Work, Heart, Your"
"As a boss, as a CEO, as a creative director, as a chef, I've learned that failure will always come. I've learned to give it a big squeeze, smile at it, humble myself to it and then use it as a springboard to send me on my way to strength, success, and fulfillment.",Christina Tosi,"Smile, Success, Failure"
The military might of a country represents its national strength. Only when it builds up its military might in every way can it develop into a thriving country.,Kim Jong-un,"Country, Way, Only"
Mourning is tough. But faith and family are the greatest sources of strength.,Kerry Kennedy,"Faith, Family, Tough"
"They say that pace is the first thing to go, but my game was never based on pace. It was about strength and power and withstanding challenges and getting in the right position.",Mark Hughes,"Power, Challenges, Game"
"People are realising that vulnerability isn't a weakness, and the rise of mental health-related humour is making vulnerability feel like a strength.",Phoebe Bridgers,"Rise, Feel, People"
"Strengths are not activities you're good at, they're activities that strengthen you. A strength is an activity that before you're doing it you look forward to doing it; while you're doing it, time goes by quickly and you can concentrate; after you've done it, it seems to fulfill a need of yours.",Marcus Buckingham,"Good, Time, Done"
"When it comes to tyrants, dictators and terrorists, strength and the threat of force is the only language they understand.",Kevin McCarthy,"Language, Understand, Tyrants"
"I have butt muscles, thigh muscles, and then my upper body is super skinny - except for in my shoulders, which you need for a little bit of strength to hold other players off the ball. So I think I've developed muscles 100 per cent from just shooting the ball and running. Every single thing about my body looks like soccer.",Christen Press,"Body, Butt, Shoulders"
"Lust is to the other passions what the nervous fluid is to life; it supports them all, lends strength to them all ambition, cruelty, avarice, revenge, are all founded on lust.",Marquis de Sade,"Life, Revenge, Ambition"
"A lot of guys have muscles. A lot of strong men in this world. I think it's important to show that even under all this strength there's a fragile side, a side that can be affected.",Sylvester Stallone,"Men, World, Important"
"Tears shed for self are tears of weakness, but tears shed for others are a sign of strength.",Billy Graham,"Moving On, Tears, Weakness"
My faith is an important part of my life and over the years I've learnt that it takes a proud man to say he doesn't need anything. It has been a quiet strength and a backbone through a lot of difficult times.,Bear Grylls,"Life, Faith, Man"
"A coach once told me there are four factors that determine a players' performance: his tactical awareness, his physical condition, his technical ability and his mental strength.",Gary Neville,"Me, Awareness, Performance"
"The fact that over 50 per cent of the residents of Toronto are not from Canada, that is always a good thing, creatively, and for food especially. That is easily a city's biggest strength, and it is Toronto's unique strength.",Anthony Bourdain,"Good, Food, Always"
"Some say that I should settle down, go slower and not push so hard, so quickly for such transformational change. To them, I say that you misunderstand the size of the problems we face, the strength of the status quo and the urgency of the people's desire for change.",Eliot Spitzer,"Change, Face, Problems"
"All species capable of grasping this fact manage better in the struggle for existence than those which rely upon their own strength alone: the wolf, which hunts in a pack, has a greater chance of survival than the lion, which hunts alone.",Christian Lous Lange,"Alone, Chance, Struggle"
Victoria's Secret is really about celebrating women and what they stand for: the strength.,Cara Delevingne,"Women, Stand, Secret"
"Sacrifice, discipline and prayer are essential. We gain strength through God's word. We receive grace from the sacrament. And when we fumble due to sin - and it's gonna happen - confession puts us back on the field.",Lou Holtz,"God, Sacrifice, Prayer"
"With F1, it's really a combination of many things. You have to have good endurance, good strength in certain muscles, you need to be fast, have good reactions and good decisions. It's not as simple as one thing. You need to be a complete athlete.",Valtteri Bottas,"Good, Simple, Endurance"
My strength is that I'm an empath.,Catriona Gray,
"Whatever I lack in size and strength and speed, I kind of make up for in being grittier. When it comes to something like basketball I'm definitely not the best guy on the court, but I love elbowing and pushing people out or boxing them out.",Steven Yeun,"Love, Best, People"
"What are the symbols of American strength, wealth, power and modernity? Certainly not jazz and rock and roll, not chewing-gum or hamburgers, Broadway or Hollywood. It's their skyscrapers. Their Pentagon. Their science. Their technology.",Oriana Fallaci,"Science, Power, Technology"
"Willingness to change is a strength, even if it means plunging part of the company into total confusion for a while.",Jack Welch,"Change, Business, Confusion"
Music makes us want to live. You don't know how many times people have told me that they'd been down and depressed and just wanted to die. But then a special song caught their ear and that helped give them renewed strength. That's the power music has.,Mary J. Blige,"Power, Music, Die"
"Wolves and women are relational by nature, inquiring, possessed of great endurance and strength. They are deeply intuitive, intensely concerned with their young, their mate and their pack. Yet both have been hounded, harassed and falsely imputed to be devouring and devious, overly aggressive, of less value than those who are their detractors.",Clarissa Pinkola Estes,"Nature, Women, Great"
We gain the strength of the temptation we resist.,Ralph Waldo Emerson,"Wisdom, Temptation, Gain"
"When we meet real tragedy in life, we can react in two ways - either by losing hope and falling into self-destructive habits, or by using the challenge to find our inner strength. Thanks to the teachings of Buddha, I have been able to take this second way.",Dalai Lama,"Life, Hope, React"
"In this outward and physical ceremony we attest once again to the inner and spiritual strength of our Nation. As my high school teacher, Miss Julia Coleman, used to say: 'We must adjust to changing times and still hold to unchanging principles.'",Jimmy Carter,"Teacher, Graduation, Spiritual"
"For me, my greatest weakness is also my greatest strength: I'm a complete overthinker about everything.",Sasha Velour,"Me, Weakness, Everything"
"I believe that my greatest strength is a deep-rooted, unshakeable trust to never let myself give up.",Alexander Dreymon,"Trust, Myself, Believe"
"I place no hope in my strength, nor in my works: but all my confidence is in God my protector, who never abandons those who have put all their hope and thought in him.",Francois Rabelais,"God, Hope, Confidence"
"I, with a deeper instinct, choose a man who compels my strength, who makes enormous demands on me, who does not doubt my courage or my toughness, who does not believe me naive or innocent, who has the courage to treat me like a woman.",Anais Nin,"Courage, Relationship, Man"
Try to look at your weakness and convert it into your strength. That's success.,Zig Ziglar,"Success, Your, Look"
"Self-belief, I think, is my biggest strength. The mental toughness comes into play whenever the chips are down.",Jasprit Bumrah,"Down, Play, Chips"
"We have to nurture our young women and understand the beauty and the strength of being a woman. It's kind of a catch-22: Strength in women isn't appreciated, and vulnerability in women isn't appreciated. It's like, 'What the hell do you do?' What you do is you don't allow anyone to dictate who you are.",Jada Pinkett Smith,"Beauty, Women, Hell"
"It's so easy to be there when it's all sunshine, but it really takes strength and courage to be there for each other during the dark times.",Bindi Irwin,"Courage, Sunshine, Easy"
The awareness of our own strength makes us modest.,Paul Cezanne,"Awareness, Own, Us"
"In the midst of the heartbreak and wreckage of 9-11, the world also witnessed what is America's greatest strength. Firefighters, nurses, police officers, first responders and local residents worked around the clock to rescue and care for those injured.",Dan Coats,"Police, World, Clock"
"Old age is not a disease - it is strength and survivorship, triumph over all kinds of vicissitudes and disappointments, trials and illnesses.",Maggie Kuhn,"Age, Old Age, Trials"
"Love for your work, love for another person, love for yourself - love is a huge pond, and it's never empty. You can go and take from it, and it will give you strength.",Vicky Krieps,"Love, Work, Love Is"
"God gave me the strength to see, and breathe, and talk.",Leon Spinks,"God, Me, Talk"
"A nation' s strength ultimately consists in what it can do on its own, and not in what it can borrow from others.",Indira Gandhi,"Own, Nation, Others"
He is greatest whose strength carries up the most hearts by the attraction of his own.,Henry Ward Beecher,"Own, Greatest, Attraction"
"I was the only child born to Josephine Perry that survived. Mama had six other children before me, and all had passed very quickly and very young, all succumbing to a combination of illness and disease and the lack of strength to fight off both.",Isabel Sanford,"Fight, Me, Mama"
I think women are amazing for being able to show what they feel. I admire women who do. I think it's a mistake when women cover their emotions to look tough. I say let's own who we are and use it as a strength.,Gal Gadot,"Women, Amazing, Mistake"
"The far right was on the march in the 1930s, and we defeated the fascists through a great united working-class effort. That sense of unity and strength is what gave people confidence to change things.",Ken Loach,"Change, Great, Effort"
"God, our Creator, has stored within our minds and personalities, great potential strength and ability. Prayer helps us tap and develop these powers.",A. P. J. Abdul Kalam,"Faith, God, Great"
"I grew up in Nacogdoches, Texas... raised by my grandmother. We were very poor and had no indoor plumbing. My grandmother was a very religious woman, though, and she gave me a lot of faith and inner strength.",Alana Stewart,"Faith, Me, Woman"
Only strength can cooperate. Weakness can only beg.,Dwight D. Eisenhower,"Weakness, Only, Beg"
"If Christ has died for me, ungodly as I am, without strength as I am, then I cannot live in sin any longer, but must arouse myself to love and serve Him who has redeemed me.",Charles Spurgeon,"Love, Myself, I Am"
I have the people behind me and the people are my strength.,Huey Newton,"Me, People, Behind"
"My hope is that the Chinese government will come to realise that it is futile to repress free speech, and that contrary to what they believe a regime's strength rests not its suppression of a plurality of opinions and ideas, but in its capacity and willingness to encourage them.",Ma Jian,"Hope, Government, Believe"
"I wish I'd known that apologizing is a sign of strength. I had the impression that if you apologize, it's a sign of weakness. I kind of picked up the message from my father, 'Real men don't apologize. You just do your best, and if you happen to hurt some people, that's their fault. You just go on. Don't apologize. That's a sign of weakness.'",Gary Chapman,"Best, Men, Do Your Best"
A robust economy is a source of national strength for Japan.,Shinzo Abe,"Source, Economy, Japan"
"I would never bet against Peyton Manning. You know about the age and the neck and the strength. But I had George Blanda, and as he got older, he got smarter, and he just got rid of the ball quicker. I watch Peyton, and I see George Blanda.",John Madden,"Age, Know, Never"
"Part of the problem with America is that letting go of emotions is viewed as a weakness, but it's my strength. That enabled me to write my songs.",Melanie Martinez,"Me, Emotions, America"
"Now, when you get a viral infection, what normally happens is it takes days or weeks for your body to fight back at full strength, and that might be too late. When you're pre-immunized, what happens is you have forces in your body pre-trained to recognize and defeat specific foes. So that's really how vaccines work.",Seth Berkley,"Work, Your, Fight"
America's strength is not our diversity; our strength is our ability to unite people of different backgrounds around common principles. A common language is necessary to reach that goal.,Ernest Istook,"Diversity, Language, America"
Being vulnerable is not a sign of weakness. It's a sign of strength.,Karamo Brown,"Weakness, Sign, Being"
Stand and fight for those who are not weak but have yet to discover the strength that the evil of this world has done its best to conceal.,Logic,"Best, Done, Fight"
"If you want to become physically stronger, you'll need healthy habits - like going to the gym. You'll also have to give up unhealthy habits - like eating junk food. Building mental strength requires healthy habits - like practicing gratitude - while also giving up unhealthy behavior, like giving up after the first failure.",Amy Morin,"Failure, Food, Gratitude"
"I know I have great inner strength; I always have. I can blank things out, cut people out, and I know that I can go and live in a cave on my own if necessary.",Charlotte Rampling,"Great, Always, Know"
"You have been chosen, and you must therefore use such strength and heart and wits as you have.",J. R. R. Tolkien,"Heart, Use, Must"
"Ronald Reagan was a president of strength. His philosophy was a philosophy of strength - a strong military, a strong economy and strong families.",Mitt Romney,"Strong Economy, Strong, Philosophy"
"The mask can be a limitation, but you just deal with it. You do get superhuman strength and pumpkin bombs and all this other stuff to express yourself with.'",Willem Dafoe,"Yourself, Mask, Express Yourself"
"The source of my power and strength is God, and I know it, without a shadow of a doubt.",Derek Fisher,"God, Power, Shadow"
"London's greatest strength is our diversity, and it's wonderful to see Londoners celebrating our capital's different traditions, determined to stand up to division.",Sadiq Khan,"Diversity, Stand, Stand Up"
"As long as God gives me strength to work and try to make things real for my children, I'm going to work for it - even if it means making the ultimate sacrifice.",Medgar Evers,"Work, God, Sacrifice"
"Right now, when we're hearing so much disturbing and hateful rhetoric, it is so important to remember that our diversity has been - and will always be - our greatest source of strength and pride here in the United States.",Michelle Obama,"Always, Diversity, Remember"
"Once you have speech, you don't have to wait for natural selection! If you want more strength, you build a stealth bomber; if you don't like bacteria, you invent penicillin; if you want to communicate faster, you invent the Internet. Once speech evolved, all of human life changed.",Tom Wolfe,"Life, Internet, Wait"
"America has the highest standard of living of any major country in the entire world. To maintain and enhance that standard of living, America should continue to embrace those qualities which have made America great: openness and dynamism. Openness to new technologies, new ideas and new people is America's greatest source of strength.",Alex Tabarrok,"Great, World, Country"
"The transfer of power is always a test of the constitutional system, a test of its strength.",Vladimir Putin,"Power, Always, Test"
"When what we introduce into the children's world of ideas and feelings is in line with the direction of the developmental forces of a given stage of life, we strengthen the entire developing person in a way that remains a source of strength throughout that person's life.",Rudolf Steiner,"Life, World, Direction"
Women's strong qualities have become despised because of their weakness. The obvious remedy is to create a feminine character with all the strength of Superman plus all the allure of a good and beautiful woman.,William Moulton Marston,"Women, Good, Beautiful"
People do not lack strength; they lack will.,Victor Hugo,"Will, People, Lack"
The strength people need to proceed along the path of human development can come only from the spiritual worlds.,Rudolf Steiner,"Path, Spiritual, People"
"Movies, to a large extent, stand or fall on the strength of their scripts. But a documentary is a collection of found objects: fragments you've collected, accidents of interview and happenstance, pieces of stock footage that surface in the course of six to nine months of research and production.",David Fanning,"Movies, Research, Stand"
"Whenever the strength of God is not recognized as the source of our strength, we are breaking the First Commandment: Do not have any gods before me.",John Piper,"God, Me, First"
"My greatest strength as a child, I realize now, was my imagination. While every other kid was reading and writing, I had seven whole hours a day to practice my imagination. When do you get that space in your life, ever?",Barbara Corcoran,"Life, Space, Imagination"
Fitness is getting creative as gym equipment is not available at home. I am making do with the resources I have. I'm being given a schedule I can follow by my trainer. Of course it is not close to the exercises I can do in the gym. But I am trying to do as much as I can to maintain my strength.,Mithali Raj,"Home, Fitness, I Am"
The joy of the mind is the measure of its strength.,Ninon de L'Enclos,"Brainy, Mind, Joy"
"Gene Roddenberry continually reminded us that the Star Trek Enterprise was a metaphor for starship Earth. And the strength in this starship came from its diversity, coming together and working in concert as a team. That is the strength of our countries, Canada and the United States. We are nations of diversity.",George Takei,"Together, Diversity, Earth"
"No difficulty can discourage, no obstacle dismay, no trouble dishearten the man who has acquired the art of being alive. Difficulties are but dares of fate, obstacles but hurdles to try his skill, troubles but bitter tonics to give him strength; and he rises higher and looms greater after each encounter with adversity.",Ella Wheeler Wilcox,"Art, Adversity, Man"
I like form and shape and strength in pictures.,Herb Ritts,"Shape, Pictures, Like"
The only thing I pray for is the strength to go out without complaining.,Tiny Tim,"Complaining, Go, Only"
"In all human affairs there are efforts, and there are results, and the strength of the effort is the measure of the result.",James Allen,"Effort, Result, Measure"
"In world mythology, there are countless examples of tragic characters whose greatest strength is also the source of their undoing. But the ancient Greeks and Romans also held the view that acceptance is the beginning of wisdom.",Simon Van Booy,"Wisdom, World, View"
We must keep both our femininity and our strength.,Indra Devi,"Keep, Femininity, Must"
"All Anne Lister wanted was a wife, and the other liaisons couldn't commit, but Ann Walker did. She took sacrament with her, and they became wife and wife. That shows extraordinary strength.",Sophie Rundle,"Wife, Extraordinary, Sacrament"
Ronald Reagan succeeded in bringing down the Iron Curtain by showing strength and resolutely standing up to the Soviet Union. President Trump needs to be similarly resolute towards Putin.,Dan Lipinski,"Down, Soviet Union, Curtain"
Men are apt to mistake the strength of their feeling for the strength of their argument. The heated mind resents the chill touch and relentless scrutiny of logic.,William E. Gladstone,"Men, Chill, Mind"
"I found strength in what hurt me. And in my family - that's my strength as well. I'm truly grateful to be hurt as many times as I have, because I'm happy!",Selena Gomez,"Family, Me, Grateful"
"What is a superhero? They're supposed to represent hope, opportunity, and strength for everybody.",Aldis Hodge,"Hope, Opportunity, Represent"
