title,author,tags
Never be afraid to trust an unknown future to a known God.,Corrie Ten Boom,"Future, God, Never"
To be trusted is a greater compliment than being loved.,George MacDonald,"Compliment, Loved, Being"
"You may be deceived if you trust too much, but you will live in torment if you don't trust enough.",Frank Crane,"Will, Enough, Live"
A lie can travel half way around the world while the truth is putting on its shoes.,Charles Spurgeon,"Truth, Travel, World"
"Trust yourself, you know more than you think you do.",Benjamin Spock,"Yourself, Know, Think"
"For every good reason there is to lie, there is a better reason to tell the truth.",Bo Bennett,"Truth, Good, Better"
"I do not know what I may appear to the world, but to myself I seem to have been only like a boy playing on the seashore, and diverting myself in now and then finding a smoother pebble or a prettier shell than ordinary, whilst the great ocean of truth lay all undiscovered before me.",Isaac Newton,"Truth, Great, Myself"
Trust is built with consistency.,Lincoln Chafee,"Consistency, Built"
The most important lesson that I have learned is to trust God in every circumstance. Lots of times we go through different trials and following God's plan seems like it doesn't make any sense at all. God is always in control and he will never leave us.,Allyson Felix,"God, Always, Control"
"Trust in what you love, continue to do it, and it will take you where you need to go.",Natalie Goldberg,"Love, Will, What You Love"
Trust is hard to come by. That's why my circle is small and tight. I'm kind of funny about making new friends.,Eminem,"Funny, New Friends, Circle"
Learning to trust is one of life's most difficult tasks.,Isaac Watts,"Life, Learning, Difficult"
If the people cannot trust their government to do the job for which it exists - to protect them and to promote their common welfare - all else is lost.,Barack Obama,"Government, Lost, People"
"Love all, trust a few, do wrong to none.",William Shakespeare,"Love, Wrong, Few"
"Trust yourself. Create the kind of self that you will be happy to live with all your life. Make the most of yourself by fanning the tiny, inner sparks of possibility into flames of achievement.",Golda Meir,"Life, Achievement, Your"
"As soon as you trust yourself, you will know how to live.",Johann Wolfgang von Goethe,"Yourself, Will, Know"
"My trust in a higher power that wants me to survive and have love in my life, is what keeps me moving forward.",Kenny Loggins,"Life, Love, Power"
The trust of the innocent is the liar's most useful tool.,Stephen King,"Liar, Innocent, Useful"
Better to trust the man who is frequently in error than the one who is never in doubt.,Eric Sevareid,"Man, Better, Doubt"
"Trust your own instinct. Your mistakes might as well be your own, instead of someone else's.",Billy Wilder,"Your, Mistakes, Own"
"Trust no friend without faults, and love a woman, but no angel.",Doris Lessing,"Love, Angel, Woman"
A man who trusts nobody is apt to be the kind of man nobody trusts.,Harold MacMillan,"Man, Nobody, Who"
"The more you trust your intuition, the more empowered you become, the stronger you become, and the happier you become.",Gisele Bundchen,"Your, Stronger, More"
"Although the life of a person is in a land full of thorns and weeds, there is always a space in which the good seed can grow. You have to trust God.",Pope Francis,"Life, God, Good"
Trust is the glue of life. It's the most essential ingredient in effective communication. It's the foundational principle that holds all relationships.,Stephen Covey,"Life, Communication, Principle"
"It is better to suffer wrong than to do it, and happier to be sometimes cheated than not to trust.",Samuel Johnson,"Better, Sometimes, Wrong"
Not everyone can be trusted. I think we all have to be very selective about the people we trust.,Shelley Long,"People, Everyone, Think"
Trust is the first step to love.,Munshi Premchand,"Love, Step, First Step"
I would rather trust a woman's instinct than a man's reason.,Stanley Baldwin,"Man, Woman, Reason"
"Never trust a man, who when left alone with a tea cosey... Doesn't try it on.",Billy Connolly,"Alone, Man, Tea"
Trust dies but mistrust blossoms.,Sophocles,"Mistrust, Blossoms, Dies"
"In almost every profession - whether it's law or journalism, finance or medicine or academia or running a small business - people rely on confidential communications to do their jobs. We count on the space of trust that confidentiality provides. When someone breaches that trust, we are all worse off for it.",Hillary Clinton,"Business, Space, Finance"
The only way to make a man trustworthy is to trust him.,Henry L. Stimson,"Man, Way, Make"
"Beware of anyone who says they know. Trust me, they don't, or they wouldn't have to say they did.",Harvey Fierstein,"Me, Know, Say"
All I have seen teaches me to trust the creator for all I have not seen.,Ralph Waldo Emerson,"Me, Creator, Seen"
I'm a dirt person. I trust the dirt. I don't trust diamonds and gold.,Eartha Kitt,"Gold, Diamonds, Person"
I cannot trust a man to control others who cannot control himself.,Robert E. Lee,"Man, Control, Others"
Trust in yourself. Your perceptions are often far more accurate than you are willing to believe.,Claudia Black,"Your, Believe, Yourself"
"Trust, but verify.",Ronald Reagan,Verify
"How can people trust the harvest, unless they see it sown?",Mary Renault,"Harvest, People, See"
"Trust is to human relationships what faith is to gospel living. It is the beginning place, the foundation upon which more can be built. Where trust is, love can flourish.",Barbara Smith,"Love, Faith, Foundation"
Trusting our intuition often saves us from disaster.,Anne Wilson Schaef,"Disaster, Us, Intuition"
I believe fundamental honesty is the keystone of business.,Harvey S. Firestone,"Business, Believe, Honesty"
Whoever is careless with the truth in small matters cannot be trusted with important matters.,Albert Einstein,"Truth, Important, Careless"
Never trust sheep.,Ryan Stiles,"Sheep, Never"
Someone who thinks the world is always cheating him is right. He is missing that wonderful feeling of trust in someone or something.,Eric Hoffer,"Always, World, Cheating"
Whoever has trusted a woman has trusted deceivers.,Hesiod,"Woman, Whoever, Trusted"
"And I'm afraid, in this day and age, trust, which I count so, you know, I love loyalty. I love trust.",Elton John,"Love, Age, Day"
"I think a good friend, to me, is all about trust and loyalty. You don't ever want to second-guess whether you can tell your friend something.",Lauren Conrad,"Good, Your, Loyalty"
"Seize the day, and put the least possible trust in tomorrow.",Horace,"Tomorrow, Day, Possible"
"Sometimes it is said that man cannot be trusted with the government of himself. Can he, then be trusted with the government of others? Or have we found angels in the form of kings to govern him? Let history answer this question.",Thomas Jefferson,"History, Government, Man"
You must trust and believe in people or life becomes impossible.,Anton Chekhov,"Life, Impossible, Believe"
Trust your hunches. They're usually based on facts filed away just below the conscious level.,Joyce Brothers,"Your, Facts, Level"
"Trust has to be earned, and should come only after the passage of time.",Arthur Ashe,"Time, Only, Come"
"Few things can help an individual more than to place responsibility on him, and to let him know that you trust him.",Booker T. Washington,"Responsibility, Know, Place"
"You have got to discover you, what you do, and trust it.",Barbra Streisand,"Discover, Got, You"
You can't trust anybody with power.,Newt Gingrich,"Power, Anybody, You"
Never trust anything that can think for itself if you can't see where it keeps its brain.,J. K. Rowling,"Brain, Never, See"
Trust should be the basis for all our moral training.,Robert Baden-Powell,"Training, Moral, Should"
One must be fond of people and trust them if one is not to make a mess of life.,E. M. Forster,"Life, People, Mess"
Men trust their ears less than their eyes.,Herodotus,"Men, Eyes, Ears"
Trust and belief are two prime considerations. You must not allow yourself to be opinionated.,James Dean,"Yourself, Belief, Two"
"If we really want to be full and generous in spirit, we have no choice but to trust at some level.",Rita Dove,"Choice, Spirit, Want"
"Only trust thyself, and another shall not betray thee.",William Penn,"Only, Betray, Shall"
"Trust your instinct to the end, though you can render no reason.",Ralph Waldo Emerson,"Your, End, Reason"
"Trust everybody, but cut the cards.",Finley Peter Dunne,"Cards, Cut, Everybody"
The chief lesson I have learned in a long life is that the only way you can make a man trustworthy is to trust him; and the surest way to make him untrustworthy is to distrust him.,Henry L. Stimson,"Life, Man, Long"
"I know it when I don't know it. Sometimes I know it when I don't think I know it. I need to trust myself in these moments, these rare moments of self-doubt.",Rush Limbaugh,"Myself, Know, Sometimes"
Trust not too much to appearances.,Virgil,"Much, Too Much, Appearances"
"I can trust my friends These people force me to examine myself, encourage me to grow.",Cher,"Myself, Grow, Me"
"He who does not trust enough, Will not be trusted.",Lao Tzu,"Will, Enough, Who"
It doesn't make any sense... that's why I trust it!,Kate Winslet,"Why, Make, Sense"
"Depend upon yourself. Make your judgement trustworthy by trusting it. You can develop good judgement as you do the muscles of your body - by judicious, daily exercise. To be known as a man of sound judgement will be much in your favor.",Grantland Rice,"Good, Daily, Man"
Few delights can equal the presence of one whom we trust utterly.,George MacDonald,"Equal, Presence, Whom"
What we learn only through the ears makes less impression upon our minds than what is presented to the trustworthy eye.,Horace,"Eye, Impression, Through"
Put more trust in nobility of character than in an oath.,Solon,"Character, More, Oath"
"I felt I did trust in Christ, Christ alone for salvation, and an assurance was given me that he had taken away my sins, even mine, and saved me from the law of sin and death.",John Wesley,"Alone, Death, Me"
"A blessed thing it is for any man or woman to have a friend, one human soul whom we can trust utterly, who knows the best and worst of us, and who loves us in spite of all our faults.",Charles Kingsley,"Best, Man, Soul"
It's a delight to trust somebody so completely.,Jeff Goldblum,"Delight, Somebody"
Who would not rather trust and be deceived?,Eliza Cook,"Deceived, Who, Rather"
Trust is a great force multiplier.,Tom Ridge,"Great, Force"
Trusting your individual uniqueness challenges you to lay yourself open.,James Broughton,"Your, Yourself, Challenges"
You can't trust water: Even a straight stick turns crooked in it.,W. C. Fields,"Water, Straight, Stick"
The toughest thing about the power of trust is that it's very difficult to build and very easy to destroy. The essence of trust building is to emphasize the similarities between you and the customer.,Thomas J. Watson,"Power, Difficult, Easy"
The trust of the people in the leaders reflects the confidence of the leaders in the people.,Paulo Freire,"Confidence, People, Leaders"
"Are we at last brought to such humiliating and debasing degradation, that we cannot be trusted with arms for our defense?",Patrick Henry,"Cannot, Last, Defense"
"To persevere, trusting in what hopes he has, is courage in a man.",Euripides,"Courage, Man, Hopes"
Do not trust your memory; it is a net full of holes; the most beautiful prizes slip through it.,Georges Duhamel,"Beautiful, Your, Memory"
"A half truth, like half a brick, is always more forcible as an argument than a whole one. It carries better.",Stephen Leacock,"Truth, Always, Better"
"I have made it a rule of my life to trust a man long after other people gave him up, but I don't see how I can ever trust any human being again.",Ulysses S. Grant,"Life, Man, Long"
I like to see honesty out of people. People who are trustworthy. I like to see people who are involved with The Lord.,Ray Lewis,"Honesty, People, See"
I learned you can't trust the judgment of good friends.,Carl Sandburg,"Good, Friends, Judgment"
"In these times, God's people must trust him for rest of body and soul.",David Wilkerson,"God, Soul, Body"
"Never trust anyone who wants what you've got. Friend or no, envy is an overwhelming emotion.",Eubie Blake,"Envy, Never, Friend"
Trust your ability!,Itzhak Perlman,"Your, Ability"
I have no fear that the result of our experiment will be that men may be trusted to govern themselves without a master.,Thomas Jefferson,"Men, Fear, Result"
"It is impossible to go through life without trust: that is to be imprisoned in the worst cell of all, oneself.",Graham Greene,"Life, Impossible, Worst"
Those who trust to chance must abide by the results of chance.,Calvin Coolidge,"Chance, Results, Must"
We are all selfish and I no more trust myself than others with a good motive.,Lord Byron,"Good, Myself, Selfish"
"When trust improves, the mood improves.",Fernando Flores,"Mood, Improves"
"We're never so vulnerable than when we trust someone - but paradoxically, if we cannot trust, neither can we find love or joy.",Walter Anderson,"Love, Joy, Find"
"He that takes truth for his guide, and duty for his end, may safely trust to God's providence to lead him aright.",Blaise Pascal,"God, Truth, Duty"
Put your trust in the Lord and go ahead. Worry gets you no place.,Roy Acuff,"Your, Worry, Ahead"
"I believe in trusting men, not only once but twice - in giving a failure another chance.",James Cash Penney,"Failure, Men, Chance"
"I repeat... that all power is a trust; that we are accountable for its exercise; that from the people and for the people all springs, and all must exist.",Benjamin Disraeli,"Power, People, Exercise"
"Trust him not with your secrets, who, when left alone in your room, turns over your papers.",Johann Kaspar Lavater,"Alone, Your, Secrets"
Let every eye negotiate for itself and trust no agent.,William Shakespeare,"Eye, Agent, Negotiate"
Whatever happens in life is fine - just trust in that.,Orlando Bloom,"Life, Happens, Whatever"
We must trust our own thinking. Trust where we're going. And get the job done.,Wilma Mankiller,"Done, Thinking, Own"
"When I get logical, and I don't trust my instincts - that's when I get in trouble.",Angelina Jolie,"Trouble, Logical, Get"
"Men are able to trust one another, knowing the exact degree of dishonesty they are entitled to expect.",Stephen Leacock,"Men, Dishonesty, Degree"
"If we put our trust in the common sense of common men and 'with malice toward none and charity for all' go forward on the great adventure of making political, economic and social democracy a practical reality, we shall not fail.",Henry A. Wallace,"Men, Great, Democracy"
Responsibilities are given to him on whom trust rests. Responsibility is always a sign of trust.,James Cash Penney,"Always, Responsibility, Sign"
"When you explain to people what you're trying to do, as opposed to just making demands or delegating tasks, you can build instant trust, even if it's just for that short time you're on the phone.",Simon Sinek,"Time, People, Phone"
Would you want to do business with a person who was 99% honest?,Sydney Madwed,"Business, Person, Want"
Let no such man be trusted.,William Shakespeare,"Man, Trusted"
"I've only ever trusted my gut on everything. I don't trust my head, I don't trust my heart, I trust my gut.",Bryan Adams,"Heart, Everything, Head"
"Even in the common affairs of life, in love, friendship, and marriage, how little security have we when we trust our happiness in the hands of others!",William Hazlitt,"Life, Friendship, Love"
If women believed in their husbands they would be a good deal happier and also a good deal more foolish.,H. L. Mencken,"Women, Good, More"
"Who can I trust? You have to invest in somebody and chances are you're probably going to invest in somebody who's going to deceive you. I've been conned a couple of times, but now I'm a little more savvy.",Maggie Gyllenhaal,"Chances, Deceive, More"
"That no government, so called, can reasonably be trusted, or reasonably be supposed to have honest purposes in view, any longer than it depends wholly upon voluntary support.",Lysander Spooner,"Government, View, Support"
Don't trust anyone over 30.,Pat Boone,"Over, Anyone"
"It is unfortunate, considering that enthusiasm moves the world, that so few enthusiasts can be trusted to speak the truth.",Arthur Balfour,"Truth, World, Speak"
I always trust my gut reaction; it's always right.,Kiana Tom,"Always, Right, Reaction"
I never trusted good-looking boys.,Frances McDormand,"Never, Good-Looking, Trusted"
I have to trust what I do and then do it.,Ednita Nazario,Then
"When we, through our educational culture, through the media, through the entertainment culture, give our children the impression that human beings cannot control their passions, we are telling them, in effect, that human beings cannot be trusted with freedom.",Alan Keyes,"Freedom, Culture, Control"
I always have issues with trust.,Vin Diesel,"Always, Issues"
"If you have three people in your life that you can trust, you can consider yourself the luckiest person in the whole world.",Selena Gomez,"Life, Your, Yourself"
Do not let your hearts be troubled. Trust in God; trust also in me.,Jesus Christ,"God, Your, Me"
"Love myself I do. Not everything, but I love the good as well as the bad. I love my crazy lifestyle, and I love my hard discipline. I love my freedom of speech and the way my eyes get dark when I'm tired. I love that I have learned to trust people with my heart, even if it will get broken. I am proud of everything that I am and will become.",Johnny Weir,"Love, Good, Freedom"
"Love yourself for who you are, and trust me, if you are happy from within, you are the most beautiful person, and your smile is your best asset.",Ileana D'Cruz,"Love, Smile, Best"
"Did I offer peace today? Did I bring a smile to someone's face? Did I say words of healing? Did I let go of my anger and resentment? Did I forgive? Did I love? These are the real questions. I must trust that the little bit of love that I sow now will bear many fruits, here in this world and the life to come.",Henri Nouwen,"Positive, Life, Love"
"I truly believe that everything that we do and everyone that we meet is put in our path for a purpose. There are no accidents; we're all teachers - if we're willing to pay attention to the lessons we learn, trust our positive instincts and not be afraid to take risks or wait for some miracle to come knocking at our door.",Marla Gibbs,"Positive, Risks, Path"
"Never trust anyone completely but God. Love people, but put your full trust only in God.",Lawrence Welk,"Love, God, Your"
The friend in my adversity I shall always cherish most. I can better trust those who helped to relieve the gloom of my dark hours than those who are so ready to enjoy with me the sunshine of my prosperity.,Ulysses S. Grant,"Friendship, Always, Adversity"
"I believe if you keep your faith, you keep your trust, you keep the right attitude, if you're grateful, you'll see God open up new doors.",Joel Osteen,"Positive, Attitude, Faith"
Never trust a computer you can't throw out a window.,Steve Wozniak,"Computers, Window, Never"
"Disappointment is inevitable. But to become discouraged, there's a choice I make. God would never discourage me. He would always point me to himself to trust him. Therefore, my discouragement is from Satan. As you go through the emotions that we have, hostility is not from God, bitterness, unforgiveness, all of these are attacks from Satan.",Charles Stanley,"God, Always, Disappointment"
"Faith is not belief without proof, but trust without reservation.",D. Elton Trueblood,"Faith, Belief, Proof"
"You can't connect the dots looking forward; you can only connect them looking backwards. So you have to trust that the dots will somehow connect in your future. You have to trust in something - your gut, destiny, life, karma, whatever. This approach has never let me down, and it has made all the difference in my life.",Steve Jobs,"Life, Future, Your"
"Woe to the man whose heart has not learned while young to hope, to love - and to put its trust in life.",Joseph Conrad,"Life, Love, Hope"
"My father always said, 'Never trust anyone whose TV is bigger than their book shelf' - so I make sure I read.",Emilia Clarke,"Always, Father, Never"
"Trust in dreams, for in them is hidden the gate to eternity.",Khalil Gibran,"Positive, Dreams, Gate"
"To have faith is to trust yourself to the water. When you swim you don't grab hold of the water, because if you do you will sink and drown. Instead you relax, and float.",Alan Watts,"Faith, Relax, Water"
A garden is a grand teacher. It teaches patience and careful watchfulness; it teaches industry and thrift; above all it teaches entire trust.,Gertrude Jekyll,"Patience, Teacher, Gardening"
"Old wood best to burn, old wine to drink, old friends to trust, and old authors to read.",Athenaeus,"Best, Old Friends, Burn"
"A wedding anniversary is the celebration of love, trust, partnership, tolerance and tenacity. The order varies for any given year.",Paul Sweeney,"Love, Anniversary, Wedding"
"Boldness doesn't mean rude, obnoxious, loud, or disrespectful. Being bold is being firm, sure, confident, fearless, daring, strong, resilient, and not easily intimidated. It means you're willing to go where you've never been, willing to try what you've never tried, and willing to trust what you've never trusted. Boldness is quiet, not noisy.",Mike Yaconelli,"Try, Fearless, Rude"
"Choose your friends wisely, and also choose friends that you can trust.",Elyn Saks,"Your, Choose, Friends"
Trust brings a higher level of communication and a higher level of commitment and accountability.,Bruce Arians,"Communication, Commitment, Level"
Most good relationships are built on mutual trust and respect.,Mona Sutphen,"Good, Respect, Relationships"
"Keep the faith, don't lose your perseverance and always trust your gut extinct.",Paula Abdul,"Faith, Perseverance, Always"
"I don't trust politicians. I think that by the time they've made it, with the concessions they've had to make in that position, I don't believe they still have the beliefs they had at the root.",Rick Astley,"Time, Believe, Politicians"
"It starts with trusting yourself, even if people are telling you you're too young to trust yourself.",SZA,"Yourself, People, Young"
"Trust me, you can't change anything without causing some degree of disruption. It's impossible, that is exactly what change is. Some people are uncomfortable with the disruption that change causes, but the disruption is necessary if anything is going to change.",Afeni Shakur,"Change, Impossible, Me"
We are dying from overthinking. We are slowly killing ourselves by thinking about everything. Think. Think. Think. You can never trust the human mind anyway. It's a death trap.,Anthony Hopkins,"Death, Mind, Thinking"
Brands are all about trust. That trust is built in drops and lost in buckets.,Kevin Plank,"Lost, Drops, About"
A healthy relationship is built on unwavering trust.,Beau Mirchoff,"Relationship, Healthy, Built"
"Thanks to Allah, I trust myself to distinguish between right and wrong.",Mohammad Amir,"Myself, Allah, Right"
"I believe that a trusting attitude and a patient attitude go hand in hand. You see, when you let go and learn to trust God, it releases joy in your life. And when you trust God, you're able to be more patient. Patience is not just about waiting for something... it's about how you wait, or your attitude while waiting.",Joyce Meyer,"Life, Attitude, Patience"
The best way to find out if you can trust somebody is to trust them.,Ernest Hemingway,"Best, Way, Find"
"As you enter positions of trust and power, dream a little before you think.",Toni Morrison,"Power, Dream, Think"
"I'm lucky to have a great support system in my friends and some of my family. If you have those people that you trust, go ahead and fall back into them and let them be your hammock and cocoon and let them embrace you.",JoJo,"Family, Great, Your"
"There are ups and downs, but whatever happens, you have to trust and believe in yourself.",Luka Modric,"Believe In Yourself, Ups And Downs, Ups"
I am the product of hustlers who taught me how to do it. They gave me a hustler's ambition. Not a bad thing to get from your parents. But hustling only gets you so far. You have to trust yourself. And you have to be ready to fall on your face and be okay when it happens.,Jay Pharoah,"Your, Yourself, Face"
You might not trust me. Please give me a chance and time. I will prove myself for all of you.,Yingluck Shinawatra,"Time, Chance, Myself"
"We believe that transparency is needed to create trust, and it's also needed to create a dialogue.",Julie Sweet,"Believe, Transparency, Create"
Never trust anyone who doesn't drink coffee.,AJ Lee,"Coffee, Never, Drink"
"This world of ours... must avoid becoming a community of dreadful fear and hate, and be, instead, a proud confederation of mutual trust and respect.",Dwight D. Eisenhower,"Respect, Fear, Hate"
"I just trust the director and never overanalyse the script, screenplay, etc. You are just taking a bet at the end of the day, so confidence, be it on the filmmaker or the script, is all that counts.",Ravi Teja,"Day, Confidence, End Of The Day"
"Me, I'm dishonest, and you can always trust a dishonest man to be dishonest. Honestly, it's the honest ones you have to watch out for.",Johnny Depp,"Always, Man, Me"
"Camaraderie doesn't happen by accident; developing a strong sense of trust, accountability, and togetherness around team goals requires intentional effort.",Don Yaeger,"Effort, Goals, Togetherness"
"Trust your own instincts, go inside, follow your heart. Right from the start. go ahead and stand up for what you believe in. As I've learned, that's the path to happiness.",Lesley Ann Warren,"Happiness, Heart, Path"
