title,author,tags
"For this equilibrium now in sight, let us trust that mankind, as it has occurred in the greatest periods of its past, will find for itself a new code of ethics, common to all, made of tolerance, of courage, and of faith in the Spirit of men.",Albert Claude,"Faith, Courage, Men"
Strange bonds of trust and self-deception tend to grow between journalists and their subjects.,Sam Harris,"Grow, Strange, Bonds"
"Don't trust the heart, it wants your blood.",Stanislaw Jerzy Lec,"Heart, Your, Blood"
"Trust me, people that know me know I ain't perfect, but I do try to live my life in a way that hopefully can be pleasing to my maker because I know I'm going to meet Him one day, and He's not going to pat me on the back and talk about how many wins I had or how many Coach of the Year trophies we got or how much money I made.",Dabo Swinney,"Life, Money, Day"
"It's so interesting that when I finished 'The X-Files' in 2002, the - call it the political and cultural climate in America - was one of fear, and trust of government. Because we put ourselves in the hands of the authority who was going to protect us. And, you know, we gave up a lot of our liberties to Homeland Security, etc.",Chris Carter,"Fear, Government, Political"
"I had no idea of the size of my bank account as a teen, and I didn't care to know. That was my mom's job, I figured that I would just find out when I turned 18. If you can't trust your mom, then who can you trust?",Anna Chlumsky,"Teen, Mom, Your"
"You can become quite blase, and also, I have no sense of home; I don't have roots. I've never had that feeling that someone else is going to take care of me, ever. I don't trust people.",Lykke Li,"Home, No Sense, Me"
"Trust me, I have had my days where I don't feel great about myself. You have those days where you kind of get down. But for the most part, I have been able to stay focused and happy and use my time wisely.",Shawn Kemp,"Time, Great, Myself"
"Bob summed it up best when he was on his knees at the end of the night saying, 'Don't trust in Guided By Voices.' You were there; was the show awful or something? I know it was sloppy, but they're not really that tight anyway, but was it embarrassing, was it sad?",Kim Deal,"Best, Sad, Night"
I want to thank the people of Tennessee's Fourth Congressional District for once again putting their faith in my ability to serve them; I promise I will never take that trust for granted.,Scott DesJarlais,"Faith, Will, People"
"The moment someone chooses to trust in Jesus Christ, his sins are wiped away, and he is adopted into God's family. That individual is set apart as a child of God, with a sacred purpose.",Charles Stanley,"God, Family, Easter"
"There is definitely a sense that when you, as a CIA ops officer... are handling assets, they are delivering to you their trust and their well-being. And you feel very protective of them, even if they're not very nice people.",Valerie Plame,"Well-Being, Feel, People"
"Great companies that build an enduring brand have an emotional relationship with customers that has no barrier. And that emotional relationship is on the most important characteristic, which is trust.",Howard Schultz,"Relationship, Great, Important"
Feeding is a very important ritual for me. I don't trust people who don't like to eat.,Gina Gershon,"Diet, Me, Important"
"Trust me, I play the game for the fans, my family and myself.",David Ortiz,"Family, Myself, Game"
"Trust is not very easy for me at all. I want to be a trusting person, but I've been bruised so many times - not to sound woe-is-me about my life.",Mariah Carey,"Life, Me, My Life"
"We've all grown wary of being lied to online - let's face it, dudes are always exaggerating their heights - so trust is a hot commodity.",Matthew Hussey,"Always, Face, Hot"
"I'm worried about privacy issues, I'm worried about Russian attacks. They literally, if you if you look at what their insidious aims are - to divide this country, is to make us hate each other, to make us not to trust media.",Cory Booker,"Hate, Privacy, Look"
I believe chemistry is based on the trust between two performers. What actually works is something intangible - being extremely comfortable in each other's presence.,Deepika Padukone,"Believe, Chemistry, I Believe"
"Here in the United States, our profession is much maligned, people simply don't trust or like journalists anymore and that's sad.",Christiane Amanpour,"Sad, People, Much"
We are demanding police transparency and accountability so we can build trust and work together to make our communities safer.,Malcolm Jenkins,"Work, Together, Police"
I have tried to generate hope and trust as a person.,Urmila Matondkar,"Hope, Person, Tried"
"The moment for action has arrived, and I know that I can trust in you to save our country.",George B. McClellan,"Moment, Country, Know"
I don't have any romantic ideas about marriage. Trust me. A white dress... ? No. It's not something for me.,Diane Kruger,"Marriage, Romantic, Dress"
"There are very few people who I can trust. I look at those people and say, Why do you keep coming back?",Kate Gosselin,"Look, Keep, People"
"I have known a vast quantity of nonsense talked about bad men not looking you in the face. Don't trust that conventional idea. Dishonesty will stare honesty out of countenance any day in the week, if there is anything to be got by it.",Charles Dickens,"Men, Day, Honesty"
"Some people assume I'm a spoilt trust fund kid who's never had to work for anything, while others think the best of me because of the good experience they had with my grandfather. It's difficult to digest the fact that they may never see me for who I am.",Ethan Peck,"Work, Best, Good"
I trust Russia and China and Iran and North Korea like I trust a Jussie Smollett police report.,John Kennedy,"Police, Russia, China"
"Mr. Speaker, the Delaware River deepening project is important for my constituents, for our region and for the entire nation. I trust that, when they examine the facts about it, every one of my colleagues will join me in supporting it.",Robert Brady,"Colleagues, River, Me"
What we've gone through in the last several years has caused some people to question 'Can we trust Microsoft?',Steve Ballmer,"Business, People, Some People"
"Through art, through people working together and building relationships and trust, people can overcome the problems of politics.",Cai Guo-Qiang,"Politics, Art, Together"
My motto is 'In Tina Fey I trust.',Jane Krakowski,"Motto, My Motto, Fey"
"I was no chief and never had been, but because I had been more deeply wronged than others, this honor was conferred upon me, and I resolved to prove worthy of the trust.",Geronimo,"Honor, Me, Never"
"Fear leads to more fear, and trust leads to more trust.",Dean Ornish,"Fear, More, Leads"
"Trust me, my runners aren't going to run one event while looking past it to the second event. When they get on the line for the 10K, that's a do-or-die situation for them.",Alberto Salazar,"Past, Me, Situation"
"Over many years, I have been a supporter of the National Trust and the vital work that they do in preserving our heritage and landscapes - long may this continue.",Vera Lynn,"Work, Long, Heritage"
"In properly organized groups no faith is required; what is required is simply a little trust and even that only for a little while, for the sooner a man begins to verify all he hears the better it is for him.",George Gurdjieff,"Faith, Man, Better"
"Americans broadly consent to funding clinical research because they believe in the promise of medical research. But people support scientific work only if they trust that it serves societal interests, respects patient dignity and operates with guardrails.",Scott Gottlieb,"Work, Medical, Believe"
I now announce myself as candidate for the Presidency. I anticipate criticism; but however unfavorable I trust that my sincerity will not be called into question.,Victoria Woodhull,"Myself, Will, Sincerity"
"At my funeral, if one said, 'Nick was a generous person,' trust me I won't be doing cartwheels in my coffin. Recognition from people is never and never will be a goal. Some people strive for that respect or honor. Living a life to just reach for the position and status is vanity and sin.",Nick Vujicic,"Life, Respect, Honor"
I love my country. It's just the government I don't trust.,Sixto Rodriguez,"Love, Government, Country"
The Christian must trust in a withdrawing God.,William Gurnall,"God, Christian, Must"
"Trust is very important. In 'Goodfellas' in the 'Go home and get your shine box!' scene, we must have filmed 15 takes. If you played each take back, the timing would be exactly the same each time.",Frank Vincent,"Time, Home, Your"
"In the long run, we will need many more African-American, Latino, and Native American leaders, and leaders from low-income communities, who can bring additional insight and a deeply grounded sense of urgency, and who are the most likely to inspire the necessary trust and engagement among students' parents and community leaders.",Wendy Kopp,"Community, Long, Parents"
The biggest lesson I learned from Vietnam is not to trust our own government statements. I had no idea until then that you could not rely on them.,J. William Fulbright,"Government, Own, Lesson"
I love to travel with my family or my two best friends because I completely trust them. I forced my two best friends into learning to scuba dive with me in Sri Lanka - it was amazing but also hideous because we were learning in very difficult seas.,Julia Sawalha,"Love, Best, Family"
Building trust is very important.,Eric Yuan,"Important, Building, Very"
"Trust is a big word for a manager. You expect certain standards and attitudes and they know if they lower those standards, I'll jump on them.",Neil Warnock,"Know, Jump, Big"
"There have been times where I've said, 'Jesus, I don't believe in you anymore, get out of here. I don't know. I don't even trust you.' And it's like, okay. And he's still hanging on.",Mike Yaconelli,"Believe, Know, Okay"
"I talk to God every single day. And I say, 'God, my life is in your hands, and I trust you with me.'",Tammy Faye Bakker,"Life, God, Your"
"I have in sincerity pledged myself to your service, as so many of you are pledged to mine. Throughout all my life and with all my heart I shall strive to be worthy of your trust.",Queen Elizabeth II,"Life, Myself, Heart"
"Evolution is unobservable. It's based on blind faith in a few dry bones and on unreliable dating systems in which the gullible trust. Kids should be allowed to make up their own minds about this issue, and not be censored to 'one side is all we will let you hear.'",Ray Comfort,"Faith, Dating, Blind"
"I am a planter - a cotton planter. I am a Southern man and a slaveholder - a kind and a merciful one, I trust - and none the worse for being a slaveholder.",John C. Calhoun,"Man, I Am, Cotton"
"The single best machine to measure trust is a human being. We haven't figured out a metric that works better than our own sort of, like, 'There's something fishy about you.'",Simon Sinek,"Best, Better, Own"
"If you've had a marriage that ended because of a betrayal in trust on your spouse's behalf, the idea of trusting another person with your heart can seem completely ridiculous.",Emily V. Gordon,"Marriage, Heart, Your"
"It's become hard for me to trust people and though I'm the type to go, 'everybody is born good,' you come to question that.",Eric Nam,"Good, Me, People"
"Okay, I'm not in the news business, and I'm not going to tell anyone how to do their job. However, it'd be good to have news reporting that I could trust again, and there's evidence that fact-checking is an idea whose time has come.",Craig Newmark,"Good, Time, Business"
There are only two sorts of people in life you can trust - good Christians and good Communists.,Joe Slovo,"Life, Good, People"
"Gentlemen, I fervently trust that before long the principle of arbitration may win such confidence as to justify its extension to a wider field of international differences.",Henry Campbell-Bannerman,"Confidence, Long, Win"
"It's hard for me to trust people, and especially girls it's - I don't really like doing the whole opening-up thing with girls.",The Kid Laroi,"Me, Doing, People"
"This Bush administration has a growing credibility gap, maybe even a credibility chasm, on environmental policy. The President has lost the trust of the American people when it comes to the environment.",Jim Jeffords,"Environmental, Lost, People"
I don't think Donald Trump represents the Republican Party... I think more and more people are going to realize that they really don't trust him.,Betsy DeVos,"People, Republican, Donald Trump"
Love is unknown. To open the heart in trust is unknown. They say love hurts. It doesn't have to.,Don Miguel Ruiz,"Love, Love Is, Heart"
"After doing two years in prison, trust me, I've seen a lot of tough guys pray. They're not just praying for themselves; they're praying for their family and the people they've let down.",Ja Rule,"Family, Me, Doing"
Just trust that good things will happen if you're working hard and making plays.,Adam Thielen,"Good, Will, Good Things"
"The people you are supposed to be able to trust the most is your family, and when that trust is broken, it's painful.",Kim Zolciak-Biermann,"Family, Your, People"
"When I was 18, and when I entered my family business, I soon realised that it wasn't as easy as I thought. I had to deal with people of my father's generation. Building trust was key to doing business.",Binod Chaudhary,"Family, Business, Father"
"What stalwart Republican would stop Trump from profiteering for his businesses from the White House the way he's gamed his companies and the tax code for decades, or prevent him from letting his adult children milk their father's position to benefit his supposed 'blind trust?'",Joy Reid,"Father, Blind, Way"
"I hold an office in trust, not a title. I don't want to say it's a kamikaze approach to life, but it's ingrained.",Bob Latta,"Life, Say, Want"
"I spoke to a UFO researcher about an experience that I had. It was very strange and trust me, you don't want to hear about it.",Jessica Origliasso,"Experience, Me, Strange"
"The bonds of trust between the United States and Israel have been frayed, but even the hostility and disrespect the Obama administration has shown has not severed those bonds.",Adam Hasner,"Disrespect, Israel, Administration"
I would say what you have to do as a screenwriter is strip the book back to find the skeleton. When you've found the skeleton - that's what you trust - you reclothe.,David Farr,"Find, Back, Book"
So near is falsehood to truth that a wise man would do well not to trust himself on the narrow edge.,Marcus Tullius Cicero,"Truth, Wise, Man"
"It's hard knowing who to trust with your personal life. When you cry in your room at night, you don't always know who to call. So I am very close to my family.",Lady Gaga,"Life, Family, Always"
There's a lot of trust being built up. I think we have a lot of work ahead of us.,Jack Lew,"Work, Ahead, Us"
"You want to show your people that you value them, and you're not going to hurt them just to get a little more money in the short term. Not furloughing people breeds loyalty. It breeds a sense of security. It breeds a sense of trust.",Herb Kelleher,"Money, Your, Value"
You wouldn't want to be in a rock band - trust me.,Jenny Lewis,"Me, Band, Rock"
"To be honest, the fact that people trust you gives you a lot of power over people. Having another person's trust is more powerful than all other management techniques put together.",Linus Torvalds,"Power, Together, Management"
"Trust me: you make a movie about time travel, and you know for a fact humans will never travel through time. The paradoxes that come up just from trying to tell a story with time travel really illuminates the fact that it's impossible. It will never happen. We can barely get through a movie that involves time travel.",Doug Liman,"Time, Travel, Impossible"
"The cyberspace earnings I get from Linux come in the format of having a Network of people that know me and trust me, and that I can depend on in return.",Linus Torvalds,"Me, Know, People"
"People are rapidly losing hope and trust. They believe their government has been captured by special interests and no longer cares about them, and they are right.",Marcy Kaptur,"Hope, Government, Believe"
"People make suggestions on what to say all the time. I'll give you an example; I don't read what's handed to me. People say, 'Here, here's your speech, or here's an idea for a speech.' They're changed. Trust me.",George W. Bush,"Time, Your, Me"
"Trust me, the only real way to understand 'Chic' is in highfalutin terms. Our chord progressions were based on European modal melodies. I made those early 'Chic' records to impress my jazz friends.",Nile Rodgers,"Me, Way, Jazz"
"There's a beauty in being part of a band, when there's equality and trust.",Scott Weiland,"Beauty, Equality, Band"
"I like women, but you can't always trust them. Some of them are big liars, like this one woman I met who had a dog. I asked her her dog's name and then I asked, 'Does he bite?' and she said, 'No.' And I said, 'So how does he eat?' Liar!",Demetri Martin,"Women, Always, Liar"
"There must be free and open interdepartmental discussion and consideration of everyone's ideas and opinions. These internal discussions must not be considered an invasion of turf, and must remain private... When everyone is on the same page, trust develops, and teams can grow and succeed together.",Jerry Reinsdorf,"Together, Grow, Free"
"Many times, my intuition wins. I trust my intuition a lot. A lot.",Thalia,"Intuition, Many, Times"
"A lot of why I climb is for the friendship, the loyalty and trust, the shared experience of being in that moment.",Jimmy Chin,"Friendship, Experience, Moment"
"We should demand the enactment of the Prevention and Public Health Trust Fund, and commit as a nation to the prevention of diseases. America cannot afford to do less.",Margaret Cuomo,"Health, America, Nation"
"Having faith and trust that one day things will be greater, it sometimes is the one thing you need to stay positive in a negative situation.",Shaquem Griffin,"Positive, Faith, Day"
"I trust online banking. You know why? Because if somebody hacks into my account and defrauds my credit card company, or my online bank account, guess who takes the loss? The bank, not me.",Kevin Mitnick,"Me, Credit, Know"
"If we can by any method establish a relation of mutual trust between the laborer and the employer, we shall lay the foundation stone of a structure that will endure for all time.",Mark Hanna,"Time, Foundation, Will"
"Just as the web democratized publishing and development, Bitcoin can democratize building new financial services. Contracts can be entered into, verified, and enforced completely electronically, using any third-party that you care to trust, or by the code itself.",Naval Ravikant,"Bitcoin, Care, New"
I spoke with Zidane and he insisted that Casemiro is the player who gives Real Madrid balance. I decided to trust him and make him a starter.,Tite,"Balance, Real, Make"
I believe that our vote is both a public duty and a sacred trust.,Gordon Brown,"Believe, Duty, I Believe That"
"My mother had taught shorthand and typing to support us since my father died, and secretly she hated it and hated him for dying and leaving no money because he didn't trust life insurance salesmen.",Sylvia Plath,"Life, Money, Father"
One reason I didn't trust my writing for so long was that I always considered myself a serious dramatic actor. But people would always laugh when I shared my writing with them. It took my husband to help me see that I really am part humorist.,Ruby Dee,"Myself, Always, Long"
"Whoever places his trust into a system will soon be without a home. While you are building your third story, the two lower ones have already been dismantled.",Franz Grillparzer,"Home, Your, Will"
"When we put our trust in diplomacy, it is not because it is an inspiring or uplifting discourse or because it helps us see the common humanity in others. The stylized circumlocutions of diplomats can make them seem ridiculous or irrelevant: they never seem to be talking about what is really going on.",Noah Feldman,"Humanity, Diplomacy, Never"
"It's difficult for me to trust a woman. Men are attracted to beautiful women. Women are attracted to men who offer security - financial security. And if you have money and you're famous, women find that sexy.",Curtis Jackson,"Women, Money, Men"
"I trust my makeup artist to apply dark lipstick, but I get nervous about reapplying it, so I'll just use gloss instead. The last time I tried to reapply dark lipstick, I dropped it on my dress and it left a spot.",Jessica Biel,"Time, Dress, Dark"
"The maid that loves goes out to sea upon a shattered plank, and puts her trust in miracles for safety.",Edward Young,"Sea, Safety, Miracles"
"Jim Bakker came along. He said, Jessica Hahn, listen. You're a virgin. As God as my witness. He said, We need a girl that we can trust.",Jessica Hahn,"God, Girl, Need"
"For ice skating, you really have to block out your fears and throw yourself into it - there must be trust in your partner and a trust that you will be safe.",Emily Atack,"Your, Yourself, Will"
"You've got to trust your steps, trust your guys that are on the field with you, and when the ball is on the ground, you've got to do that every single time.",Adam Vinatieri,"Time, Your, Ground"
"The key to high-quality communication is trust, and it's hard to trust somebody that you don't know.",Ben Horowitz,"Communication, Know, Hard"
There's obviously nothing wrong with selling your art - only an idiot with a trust fund would tell you otherwise. But it's confusing to know how far you should take it.,Banksy,"Art, Your, Nothing"
"There is something at work that's bigger than us. It's about having a trust in life and being at peace that things are happening the way they should. You do what you do as well as you can do it, and then you don't worry or agonize about the outcome.",Sherilyn Fenn,"Life, Work, Peace"
Never trust a man who speaks well of everybody.,John Churton Collins,"Man, Never, Well"
A global democracy works only when countries trust one another.,Armstrong Williams,"Democracy, Only, Global"
"Girls especially are fond of exchanging confidences with those whom they think they can trust; it is one of the most charming traits of a simple, earnest-hearted girlhood, and they are the happiest women who never lose it entirely.",Lucy Larcom,"Women, Lose, Simple"
Counterintuitive actions prove we can trust real knowledge and do the opposite of what we feel makes sense.,Penn Jillette,"Knowledge, Feel, Real"
"Obviously, the bulk of my Nike shares have been set up in a trust.",Phil Knight,"Nike, Up, Set"
I'm grateful to have the trust and support of Kentucky's Fraternal Order of Police.,Andy Beshear,"Police, Grateful, Support"
"Until I was on Twitter, trust me: I was completely wiped off everybody's consciousness in Hollywood.",Lexi Alexander,"Me, Consciousness, Until"
"Some people ask, 'How do you attract the young and so many different people when your poetry is complicated and different?' I say, 'My accomplishment is that my readers trust me and accept my suggestions for change.'",Mahmoud Darwish,"Change, Poetry, Your"
"Botox, trust me I've been tempted - but I resist! Think about what happens to your muscles - and your skin - if you're sick and don't move for a few days. It all atrophies! Plus, if you freeze a muscle in your face, other muscles have to compensate! And once you stop, what does that look like?",Salma Hayek,"Your, Face, Skin"
"I've got no brothers or sisters, so it's really important for me to have friends who I've known for years that I really know I can trust and rely on.",Debra Stephenson,"Me, Important, Know"
"Ah! yes, I know: those who see me rarely trust my word: I must look too intelligent to keep it.",Jean-Paul Sartre,"Intelligence, Me, Look"
"As trust in institutions erodes, the basic assumptions of fairness, shared values, and equal opportunity traditionally upheld by 'the system' are no longer taken for granted.",Richard Edelman,"Opportunity, Assumptions, Values"
"I place my life in the hands of God each day. And I trust that He knows what He's doing, even when I do not.",Marianne Williamson,"Life, God, Day"
"Therefore trust to thy heart, and to what the world calls illusions.",Henry Wadsworth Longfellow,"Heart, World, Thy"
"People in north Michigan are not different at all from people in southern Alabama. Trust me, someone who's spent a lot of time in both places. They're all hardworking, simple people.",Kid Rock,"Time, Simple, Me"
"A lot of what we do is built on trust, because basically, you go out there with a live mic on live television, and the WWE is putting their brand in your hands. Basically, they are entrusting you to go out there and to be a role model for children and keep everything that you are doing within the PG confines of this great brand.",Enzo Amore,"Great, Your, Doing"
"Trust the young. Young people have a lot to contribute, but generation after generation, those who reach power protect that power rather than teach others how to attain it. I resolved that if I ever became successful, I would trust the young.",Guy Laliberte,"Power, Generation, People"
The Constitution preserves the advantage of being armed which Americans possess over the people of almost every other nation where the governments are afraid to trust the people with arms.,James Madison,"Constitution, People, Nation"
The chief internal enemies of any state are those public officials who betray the trust imposed upon them by the people.,Dalton Trumbo,"Enemies, People, Who"
