title,author,tags
"I didn't see it then, but it turned out that getting fired from Apple was the best thing that could have ever happened to me. The heaviness of being successful was replaced by the lightness of being a beginner again, less sure about everything. It freed me to enter one of the most creative periods of my life.",Steve Jobs,"Life, Me, My Life"
"Common hedging techniques include shorting stocks, buying put options, writing call options, and various types of leverage and paired transactions. While I do reserve the right to use these tools if and when appropriate, my firm opinion is that the best hedge is buying an appropriately safe and cheap stock.",Michael Burry,"Opinion, Tools, Safe"
"I think my mom put it best. She said, 'Little girls soften their daddy's hearts.'",Paul Walker,"Father's Day, Mom, She"
The best protection any woman can have... is courage.,Elizabeth Cady Stanton,"Courage, Woman, Protection"
Everyone knows the best time to do laundry is later.,Emily Hampshire,"Time, Everyone, Laundry"
"You owe it to yourself to be the best person possible. Because if you are, others will want to be with you, want to provide you with the things you want in exchange for what you're giving to them.",Harry Browne,"Yourself, Will, Person"
"When we seek to discover the best in others, we somehow bring out the best in ourselves.",William Arthur Ward,"Inspirational, Others, Discover"
"Arthur Russell is very important to me on many levels, and when I read Tim Lawrence's biography on him, 'Hold on to Your Dreams,' one of the things I took away was: first thought, best thought. I live by that when I make my own music.",Arca,"Dreams, Music, Your"
"Sometimes the best thing we can ask for is change, and a fresh start forces us to confront change head-on.",Natalya Neidhart,"Change, Start, Sometimes"
I did not vote for Donald Trump and I do not support him but I believe that Trump is the best thing to happen to this country in a long time. He's bringing out the country's ugliness. There's no turning a blind eye anymore.,Daryl Davis,"Time, Believe, Long"
"My very best friend died in a car accident when I was 16 years old. That was the hardest blow emotionally that I have ever had to endure. Suddenly, you realize tomorrow might not come. Now I live by the motto, 'Today is what I have.'",Amber Heard,"Car, Today, Tomorrow"
"You can't draft for need. You draft for need, you get fired. Draft the best player, and if you've got two of them now you've got three of them. Just take the best players available for you.",Bruce Arians,"Three, Players, Need"
"Every company has messy data, and even the best of AI companies are not fully satisfied with their data. If you have data, it is probably a good idea to get an AI team to have a look at it and give feedback. This can develop into a positive feedback loop for both the IT and AI teams in any company.",Andrew Ng,"Positive, Good, Look"
The ladder of success is best climbed by stepping on the rungs of opportunity.,Ayn Rand,"Success, Opportunity, Ladder"
"I want to be the best teammate I can be, the fastest learner, the hardest worker, and just go out there in any way that I can help in each game.",Donovan Mitchell,"Game, Way, I Can"
"With modeling, you pose. You want to look your best all the time. With acting, you have to be aware of the camera, but the more you show your imperfections, the better you're going to be.",Diane Kruger,"Time, Your, Better"
"I like to think that today is the best day of my life and tomorrow will be the next best day of my life. And if you think that way, you're living for the beauty of today.",Conrad Anker,"Life, Beauty, Today"
You don't ever want to go out there and not be the best. You want to be the best cop that you can. Be the best writer you can be. Everybody has their goals. Everybody has their dreams.,Bryce Harper,"Dreams, Goals, Go"
The best thing about being rich is the freedom; freedom to do whatever you want whenever you want. It doesn't suck.,Tommy Lee,"Freedom, Rich, Being Rich"
"I'm just here and I'm doin' the best I can. If you don't understand that, then what can I do?",Paul Prudhomme,"Understand, I Can, Here"
"If you die you're completely happy and your soul somewhere lives on. I'm not afraid of dying. Total peace after death, becoming someone else is the best hope I've got.",Kurt Cobain,"Death, Hope, Peace"
He serves his party best who serves his country best.,Rutherford B. Hayes,"Country, Who, He"
"When you're the best, and you know you're the best, and your contemporaries know you're the best, that's a terrific edge.",Raymond Floyd,"Your, Know, Edge"
"As much as I love and respect my brother, I'm doing my best to distance myself from him and kind of show people that, even though we do look similar and have similar mannerisms, we are completely different.",Dave Franco,"Love, Respect, Myself"
"In matters of conscience, first thoughts are best. In matters of prudence, last thoughts are best.",Robert Hall,"Thoughts, Conscience, First"
I'm doing the best I can with what I got and that's all anybody in my band is doing.,Jerry Cantrell,"Doing, I Can, Band"
"I can't resist South Indian cuisine, particularly what is prepared at home. My mom is my favourite cook. She can cook a variety of cuisines. I savour her cooking at home, and she's undoubtedly the best.",Deepika Padukone,"Home, Mom, Cooking"
The best government is a benevolent tyranny tempered by an occasional assassination.,Voltaire,"Government, Tyranny, Assassination"
Most of us start out with a positive attitude and a plan to do our best.,Marilu Henner,"Positive, Attitude, Start"
"History, after all, is a process, not a position, and it is not best written in bronze and marble. It is complex, plastic and ever-changing; all things that heroic statues are not.",David Olusoga,"History, Process, Marble"
"A job is the best cure for poverty, and that's why economic development and job creation has been my principle focus.",Luther Strange,"Focus, Poverty, Creation"
I was never one to patiently pick up broken fragments and glue them together again and tell myself that the mended whole was as good as new. What is broken is broken - and I'd rather remember it as it was at its best than mend it and see the broken places as long as I lived.,Margaret Mitchell,"Good, Myself, Together"
"You must accept that you might fail; then, if you do your best and still don't win, at least you can be satisfied that you've tried. If you don't accept failure as a possibility, you don't set high goals, you don't branch out, you don't try - you don't take the risk.",Rosalynn Carter,"Failure, Do Your Best, Your"
The best government is that which teaches us to govern ourselves.,Johann Wolfgang von Goethe,"Government, Us, Govern"
It is literally true that you can succeed best and quickest by helping others to succeed.,Napoleon Hill,"True, Succeed, Others"
The best way to pay for a lovely moment is to enjoy it.,Richard Bach,"Happiness, Moment, Way"
"There's nothing like a home-cooked meal - nothing! When people ask me what the best restaurant in L.A. is, I say, 'Uh, my house.' It's more intimate. Food can connect people in a forever sort of way.",Giada De Laurentiis,"Food, Me, Restaurant"
"Man, being reasonable, must get drunk; the best of life is but intoxication.",Lord Byron,"Life, Man, Drunk"
Politics is not perfect but it's the best available nonviolent means of changing how we live.,Maynard Jackson,"Politics, Not Perfect, Perfect"
"Examinations are formidable even to the best prepared, for the greatest fool may ask more than the wisest man can answer.",Charles Caleb Colton,"Fool, Man, May"
Always remember that your calmness under fire is your best defense in any argument or discussion.,Robert Greene,"Always, Your, Fire"
"It is with children that we have the best chance of studying the development of logical knowledge, mathematical knowledge, physical knowledge, and so forth.",Jean Piaget,"Education, Knowledge, Chance"
"When a man's suit fits, when the construction is beautiful, when the sewing and fabrics are there... in the end, you'll look the best in it.",John Varvatos,"Beautiful, Man, Look"
Nature study will show you how full of beautiful and wonderful things God has made the world for you to enjoy. Be contented with what you have got and make the best of it. Look on the bright side of things instead of the gloomy one.,Robert Baden-Powell,"Nature, God, Beautiful"
Time is generally the best doctor.,Ovid,"Time, Medical, Doctor"
"Among the natural rights of the colonists are these: First a right to life, secondly to liberty, and thirdly to property; together with the right to defend them in the best manner they can.",Samuel Adams,"Life, Together, Liberty"
"Sometimes words are not needed, and the simplicity of expressing yourself through an art form is one of the best ways of communication.",Emmanuel Jal,"Communication, Art, Yourself"
"The best thing you can do is learn from those mistakes so that you continue to get better. That's the management style or leadership style I believe in, which is push people to their limit such that they can become better than they thought they could be. That certainly has helped me.",Lisa Su,"Leadership, Believe, Better"
Losing is no disgrace if you've given your best.,Jim Palmer,"Failure, Your, Losing"
I want to represent my country to the best of my abilities. I want to make Reese Witherspoon proud.,Adam Rippon,"Country, Proud, Make"
Being hardworking is the best thing you can show children.,David Beckham,"Children, Show, Being"
"I love Dallas, Austin and Houston. Why? Because some of the best comedians, like Bill Hicks and Sam Kinison, started their careers in Texas, and because the crowds there are comedy-educated.",Bobby Lee,"Love, Why, Texas"
"If you put all your strength and faith and vigor into a job and try to do the best you can, the money will come.",Lawrence Welk,"Work, Faith, Strength"
"If you are fearful, a horse will back off. If you are calm and confident, it will come forward. For those who are often flattered or feared, the horse can be a welcome mirror of the best in human nature.",Clare Balding,"Nature, Welcome, Mirror"
"I think the best of us comes when we are working together collectively. And it doesn't mean that we can't disagree. We've got to learn, as Dad taught us, to disagree without being disagreeable.",Martin Luther King III,"Dad, Together, Working Together"
"I keep my thoughts to myself, and I think that's one of the best ways to be.",Tito Jackson,"Myself, Thoughts, Keep"
My best friend died in a high-speed chase.,Roddy Ricch,"Friend, Chase, Best Friend"
"Marriage is all about knowing the ins and outs and the intimate details, and your wife is supposed to be the person you know best. But my brother and I think alike, know everything about one another, and when we get together, we block everything else out. Nothing exists in our world except for us.",Jon Heder,"Marriage, Your, Wife"
"Age appears to be best in four things; old wood best to burn, old wine to drink, old friends to trust, and old authors to read.",Francis Bacon,"Trust, Age, Old Friends"
"My best man was my best friend of almost 20 years, Matt Ryan. He actually plays John Constantine on the new NBC show 'Constantine,' but we've been friends since we were teenagers.",Joseph Morgan,"Man, New, Friend"
"I do believe that the original sources of all religions should be taught, because with that we will find our similarities, not just our differences. I believe that if Mohammed, Buddha, Jesus, and Moses all got together they would be best of friends because the spiritual basis of all religions is something that builds unity.",Yehuda Berg,"Together, Unity, Believe"
The best advice comes from people who don't give advice.,Matthew McConaughey,"Advice, People, Who"
"A rich, robust, well-resourced public education is one of the best routes out of poverty and a pathway to prosperity.",Randi Weingarten,"Education, Rich, Poverty"
"I'm from Indiana. I know what you're thinking, Indiana... Mafia. But in Indiana it's not like New York where everyone's like, 'We're from New York and we're the best' or 'We're from Texas and we like things big' it's more like 'We're from Indiana and we're gonna move.'",Jim Gaffigan,"Thinking, New, Know"
Perfect partners don't exist. Perfect conditions exist for a limited time in which partnerships express themselves best.,Wayne Rooney,"Time, Partnerships, Perfect"
"I started playing instruments before I started making beats, and I was never the best guitarist or the best pianist or the best drummer. And when I started making beats, I was not the best beatmaker, and when I started making hooks, I was not the best vocal melody person. When I first started rapping, I wasn't the best rapper at all.",Russ,"Person, Drummer, Never"
"It is best to love wisely, no doubt; but to love foolishly is better than not to be able to love at all.",William Makepeace Thackeray,"Love, Better, Doubt"
"Punishment may make us obey the orders we are given, but at best it will only teach an obedience to authority, not a self-control which enhances our self-respect.",Bruno Bettelheim,"Will, Punishment, Obedience"
Health is the thing that makes you feel that now is the best time of the year.,Franklin Pierce Adams,"Health, Time, Fitness"
"I've known my best friend since I was a baby, and I don't know what I would do without her. She is always straight with me and can make me laugh hysterically. Everyone should have someone like that in their life.",Jasmine Guinness,"Life, Always, Me"
"There is only one thing for us to do, and that is to do our level best right where we are every day of our lives; To use our best judgment, and then to trust the rest to that Power which holds the forces of the universe in his hands.",Orison Swett Marden,"Positive, Trust, Power"
"And while the law of competition may be sometimes hard for the individual, it is best for the race, because it ensures the survival of the fittest in every department.",Andrew Carnegie,"Business, Competition, Law"
"If your best friend has stolen your girlfriend, it does become life and death.",Ben Kingsley,"Life, Death, Dating"
"I am happy to do anything that comes my way, and I will always do my best in anything that presents itself.",Drew McIntyre,"Always, I Am Happy, I Am"
"The abduction of a child is a tragedy. No one can fully understand or appreciate what a parent goes through at such a time, unless they have faced a similar tragedy. Every parent responds differently. Each parent copes with this nightmare in the best way he or she knows how.",John Walsh,"Time, Way, Understand"
Love and scandal are the best sweeteners of tea.,Henry Fielding,"Love, Tea, Scandal"
"When you are entrusted with an assignment, you do your best.",Tu Youyou,"Do Your Best, Your, Assignment"
"Libertarians regard the state as the Supreme, the eternal, the best organized aggressor against the persons and property of the mass of the public. All states everywhere, whether democratic, dictatorial, or monarchical, whether red, white, blue or brown.",Murray Rothbard,"Blue, White, Red"
"I'd realize it's not worth our time to worry. You do your best, and God will put the right people in your path.",Taya Kyle,"God, Time, Do Your Best"
"The best kind of accountability on a team is peer-to-peer. Peer pressure is more efficient and effective than going to the leader, anonymously complaining, and having them stop what they are doing to intervene.",Patrick Lencioni,"Doing, Pressure, Stop"
"What's a bigger mystery box than a movie theater? You go to the theater, you're just so excited to see anything - the moment the lights go down is often the best part.",J. J. Abrams,"Moment, Mystery, Down"
"Everyone says Toyota is the best company in the world, but the customer doesn't care about the world. They care if we are the best in town, or not. That's what I want to be.",Akio Toyoda,"World, Care, Everyone"
"If I wanted to play soccer, I'd step out on that soccer field like I'm the best soccer player. Even though I don't have that much experience, I always try to have that type of confidence in myself just to make people believe it.",Polo G,"Experience, Myself, Always"
"The best solutions are often simple, yet unexpected.",Julian Casablancas,"Unexpected, Simple, Often"
Friends are the best to turn to when you're having a rough day.,Justin Bieber,"Friendship, Day, Turn"
Truth is the best defense.,Ward Churchill,"Truth, Truth Is, Defense"
I'm just trying to do my best in the circumstances and am very happy for everyone else to do the same so I don't cultivate enemies.,Martin Bashir,"Enemies, Circumstances, Everyone"
Hands-on experience is the best way to learn about all the interdisciplinary aspects of robotics.,Rodney Brooks,"Experience, Way, Robotics"
"It is difficult to get organic food at most restaurants, so when possible, eat at home. When not, do your best.",Suzanne Somers,"Home, Food, Do Your Best"
Every job is good if you do your best and work hard. A man who works hard stinks only to the ones that have nothing to do but smell.,Laura Ingalls Wilder,"Work, Good, Do Your Best"
"You have to be confident in who you are and what you're doing. Of course, you try to evolve. I would never tell you, 'Today is the best I will ever be.' I'm always trying to be a better chef, a better dad, a better person.",Guy Fieri,"Dad, Today, Always"
The best way to get a bad law repealed is to enforce it strictly.,Abraham Lincoln,"Legal, Law, Bad"
"It's not easy. I got lots of rejections when I first started out. If you want to write, you have to believe in yourself and not give up. You have to do your best to practice and get better.",Rick Riordan,"Do Your Best, Believe In Yourself, Your"
My parents always made education and school the number one priority. They believed that an education is the best gift you can give to your child.,Debra Messing,"Education, Always, Your"
"The pursuit, even of the best things, ought to be calm and tranquil.",Marcus Tullius Cicero,"Peace, Calm, Things"
Soap and water and common sense are the best disinfectants.,William Osler,"Water, Common Sense, Soap"
I work best when there's a safety trampoline of kindness.,Ruth Negga,"Work, Kindness, Safety"
The best thing of all is God is with us.,John Wesley,"God, Us, Thing"
"The best solution to income inequality is providing a high-quality education for everybody. In our highly technological, globalized economy, people without education will not be able to improve their economic situation.",Ben Bernanke,"Education, Will, Solution"
"My dad is always there for me, and no matter how busy, he always makes it a point to answer my calls. I think he knows what is best for me better than me and is very involved in planning my career. Feel blessed to have a dad like him.",Ram Charan,"Dad, Always, Busy"
"Trust is not simply a matter of truthfulness, or even constancy. It is also a matter of amity and goodwill. We trust those who have our best interests at heart, and mistrust those who seem deaf to our concerns.",Gary Hamel,"Trust, Heart, Matter"
"Cognitive psychology has shown that the mind best understands facts when they are woven into a conceptual fabric, such as a narrative, mental map, or intuitive theory. Disconnected facts in the mind are like unlinked pages on the Web: They might as well not exist.",Steven Pinker,"Mind, Facts, Map"
"Seek home for rest, for home is best.",Thomas Tusser,"Home, Rest, Seek"
My best wishes are with Indian cricket in general. I wish each one of our cricketers success at the international and domestic level.,Kapil Dev,"Success, Cricket, Wish"
"Marrying Jared was the best decision I've ever made. You realize in life, not that many things matter that much, but your choice of a spouse is everything. We're truly partners - he supports my work and my ambitions. I know that he's always got my back, and I've got his.",Ivanka Trump,"Life, Work, Always"
"I did the best I could, and in some arenas, my best was not good enough. I've made some bad choices.",Amy Grant,"Good, Bad, Choices"
"Change doesn't always mean progress, but the status quo isn't always the best result either. It is merely the most convenient.",Harsha Bhogle,"Change, Always, Progress"
The age of a woman doesn't mean a thing. The best tunes are played on the oldest fiddles.,Ralph Waldo Emerson,"Women, Age, Woman"
Try to be the best version of yourself.,Sara Sampaio,"Yourself, Try, Version"
"Blueberries, strawberries and blackberries are true super foods. Naturally sweet and juicy, berries are low in sugar and high in nutrients - they are among the best foods you can eat.",Joel Fuhrman,"Sweet, True, Sugar"
"For a while there I wasn't sure that anybody cared about being the best at anything, and it's nice to have a group of guys that feel like we're doing it for the cause. Maybe we're just really young and naive for thinking music can matter, but it does to us.",Ryan Ross,"Music, Thinking, Doing"
"I got to meet some of the best people I've ever met, and we all grew as people and as entertainers.",Carrie Underwood,"People, Meet, Got"
A study of economics usually reveals that the best time to buy anything is last year.,Marty Allen,"Time, Economics, Anything"
"If I could time travel into the future, my first port of call would be the point where medical technology is at its best because, like most people on this planet, I have this aversion to dying.",Neal Asher,"Future, Technology, Time"
"Youth is the best time to be rich, and the best time to be poor.",Euripides,"Time, Age, Youth"
We don't have to be perfect today. We don't have to be better than someone else. All we have to do is to be the very best we can.,Joseph B. Wirthlin,"Today, Better, Perfect"
"I can only control my own performance. If I do my best, then I can feel good at the end of the day.",Michael Phelps,"Good, Day, End Of The Day"
"We are all travelers in the wilderness of this world, and the best we can find in our travels is an honest friend.",Robert Louis Stevenson,"Travel, World, Find"
The best gift you can give yourself is getting over the fear of embarrassment because then you're completely free to try anything.,Jesse Itzler,"Fear, Yourself, Gift"
"Someone once asked, 'What's your best pickup line?' I said, 'My best pickup line is, 'Hi, my name is Hugh Hefner.'",Hugh Hefner,"Your, Name, Someone"
"The ideal man bears the accidents of life with dignity and grace, making the best of circumstances.",Aristotle,"Life, Man, Grace"
"When you do something best in life, you don't really want to give that up - and for me it's tennis.",Roger Federer,"Life, Me, Tennis"
"The boundaries which divide Life from Death are at best shadowy and vague. Who shall say where the one ends, and where the other begins?",Edgar Allan Poe,"Life, Death, Boundaries"
The actions of men are the best interpreters of their thoughts.,James Joyce,"Men, Brainy, Thoughts"
"The best way to change it is to do it. Right? And then after a while you become it, and it's easy.",Ursula Burns,"Change, Way, Easy"
"Heroes represent the best of ourselves, respecting that we are human beings. A hero can be anyone from Gandhi to your classroom teacher, anyone who can show courage when faced with a problem. A hero is someone who is willing to help others in his or her best capacity.",Ricky Martin,"Courage, Teacher, Hero"
The man who has nothing to boast of but his illustrious ancestry is like the potato - the best part under ground.,Thomas Overbury,"Man, Nothing, Ground"
"Throughout my years, I've had the pleasure of assembling and training what I believe to be the best group of people in the world. People with the presence of mind to deal with any flare-up, including my own. People who share the belief that nothing is impossible.",Red Adair,"Impossible, Mind, Believe"
"You do what you can for as long as you can, and when you finally can't, you do the next best thing. You back up but you don't give up.",Chuck Yeager,"Long, Back, Next"
"I was raised in a Jewish family, but since I was adopted, my parents sent me to Hebrew school and Bible chapel, so I got the best of both worlds - singing in both a choir in Bible chapel and a chorus in Hebrew school. It shaped me and my voice.",Michelle Visage,"Family, Bible, Parents"
Perhaps I know best why it is man alone who laughs; he alone suffers so deeply that he had to invent laughter.,Friedrich Nietzsche,"Alone, Man, Laughter"
"So if diva means giving your best, then yes, I guess I am a diva.",Patti LaBelle,"Your, I Am, Guess"
"There's nothing masculine about being competitive. There's nothing masculine about trying to be the best at everything you do, nor is there anything wrong with it. I don't know why a female athlete has to defend her femininity just because she chooses to play sports.",Rebecca Lobo,"Sports, Nothing, Know"
The best prophet of the future is the past.,Lord Byron,"Future, Past, Prophet"
"I wasn't the best waitress in the world, but I was cheerful and worked hard.",Lucy Alibar,"World, Hard, Cheerful"
Music's always been really cathartic. It's the best drug for me to get away from the everyday pressures just for a second via a good song.,Ville Valo,"Good, Music, Always"
I believe that democracy is the best guarantor for peace and cooperation among nations.,Atal Bihari Vajpayee,"Peace, Democracy, Believe"
"My job is to play quarterback, and I'm going to do that the best way I know how, because I owe that to my teammates regardless of who is out there on the field with me.",Tom Brady,"Me, Way, Know"
"A good leader, in my view, should have a clear vision of the future they want and the society they need to build. They must also have a connection with the people who work for them and be able to mobilise their best energies to create teams where people can be most creative and happy.",Winnie Byanyima,"Work, Future, Good"
