title,author,tags
"Ruin is the destination toward which all men rush, each pursuing his own best interest in a society that believes in the freedom of the commons.",Garrett Hardin,"Freedom, Society, Men"
"If you don't do what's best for your body, you're the one who comes up on the short end.",Julius Erving,"Your, Body, End"
"My husband and I are best of friends first and foremost. We fight like cats and dogs, but never stay mad for long. I was lucky to find him, he is in every way, my soulmate.",Carnie Wilson,"Marriage, Fight, Long"
"Since scarcity is the basic economic problem, if it does not exist then there is no reason for my economics course. Devoting time to the study of how people use limited resources to fulfill unlimited wants and needs should help us to discover how to best utilize the resources we have at our disposal.",Kurt Bills,"Time, Economics, People"
"The best lack all conviction, while the worst are full of passionate intensity.",William Butler Yeats,"Worst, Intensity, Conviction"
The best way to find out whether you're on the right path? Stop looking at the path.,Marcus Buckingham,"Path, Way, Find"
"There are no guarantees in life, but I believe faith provides all of us with a foundation to live the best lives possible - knowing that there is a higher being who loves us and will never leave us. Through the many struggles in my life, my faith is sometimes the only thing I have to hold onto. God was my only friend.",Gretchen Carlson,"Life, Faith, God"
"I grew up in a very strong, nuclear family. My father was a sportsman. He represented South Africa in a couple of sports, so he was a very positive person and someone who encouraged you to be your best and give your best with everything that you do.",Gail Kelly,"Positive, Family, Sports"
"As long as you as an individual... can convince yourself that in order to move forward as best you can you have to be optimistic, you can be described as 'one of the faithful,' one of those people who can say, 'Well, look, something's going to happen! Let's just keep trying. Let's not give up.",Tom Hanks,"Positive, Yourself, Long"
Good humor is one of the best articles of dress one can wear in society.,William Makepeace Thackeray,"Attitude, Good, Humor"
Sleep is the best meditation.,Dalai Lama,"Dreams, Sleep, Meditation"
"Live like you're already dead, man. Have a good time. Do your best. Let it all come ripping right through you.",Jeff Bridges,"Good, Time, Do Your Best"
I've only had two rules: Do all you can and do it the best you can. It's the only way you ever get that feeling of accomplishing something.,Colonel Sanders,"Way, Rules, Feeling"
"I had one of the best days of my life. I spent the afternoon with my two kids and my ex-wife at Serendipity. Then I came to the theater, and you know, I think I did the play the best I've ever done it.",Gabriel Byrne,"Life, Done, My Life"
"Let me be the first to tell you, drinking alcohol is the worst thing to do in cold weather. Hot soup is the best because the process of digesting food helps to warm you up.",Morgan Freeman,"Food, Weather, Me"
The best way to celebrate the holidays is with some delicious food.,Rachel Hollis,"Food, Celebrate, Way"
The great leaders are like the best conductors - they reach beyond the notes to reach the magic in the players.,Blaine Lee,"Business, Great, Magic"
"Being forced to work, and forced to do your best, will breed in you temperance and self-control, diligence and strength of will, cheerfulness and content, and a hundred virtues which the idle will never know.",Charles Kingsley,"Work, Strength, Do Your Best"
"War is big business. It's a lot of money going to and fro, and unfortunately a lot of angst, and a lot of fear, and a lot of doubt. And eventually a lot of wonderful people, like soldiers, like men and women that are out there trying to do the best they can, they come back being wounded on many levels.",Jon Anderson,"Women, Business, War"
"I believe in pink. I believe that laughing is the best calorie burner. I believe in kissing, kissing a lot. I believe in being strong when everything seems to be going wrong. I believe that happy girls are the prettiest girls. I believe that tomorrow is another day and I believe in miracles.",Audrey Hepburn,"Inspirational, Tomorrow, Day"
"God gave you a brain. Do the best you can with it. And you don't have to be Einstein, but Einstein was mentally tough. He believed what he believed. And he worked out things. And he argued with people who disagreed with him. But I'm sure he didn't call everybody jerks.",Clint Eastwood,"God, Brain, People"
"There's an ease that I have living in Australia. The best things about Sydney are free: the sunshine's free, and the harbour's free, and the beach is free.",Russell Crowe,"Sunshine, Free, Living"
The high road and positivity is never the easy way but always the best way.,Nancy Wilson,"Always, Road, Way"
"An author knows his landscape best; he can stand around, smell the wind, get a feel for his place.",Tony Hillerman,"Wind, Stand, Feel"
"I want to be the best at what I do, and that's just me. That's what comes with Mack.",Khalil Mack,"Me, Want, Just"
"I may have hurt some people along the way, but I would like to be seen as somebody who has done his best to do the right thing for any situation and not compromised.",Ratan Tata,"Done, The Right Thing, Way"
"Family is a unique gift that needs to be appreciated and treasured, even when they're driving you crazy. As much as they make you mad, interrupt you, annoy you, curse at you, try to control you, these are the people who know you the best and who love you.",Jenna Morasca,"Love, Family, Gift"
"I always try and do my best and put out the best and find the best in me, as well. But I'm not thinking about it beforehand.",David Ferrer,"Always, Thinking, Me"
Of all my wife's relations I like myself the best.,Joseph Cook,"Myself, Wife, Like"
"Fear brings out the best in some people and the worst in others. It's a test of character, for individuals and nations.",David Ignatius,"Fear, Character, People"
Money is just a way to keep score. The best people in any field are motivated by passion. That becomes more true the higher the skill level gets.,Eric S. Raymond,"Money, Passion, Skill"
"The best thing is to look natural, but it takes makeup to look natural.",Calvin Klein,"Look, Makeup, Thing"
"Beer, it's the best damn drink in the world.",Jack Nicholson,"World, Beer, Damn"
"I don't feel like I'm in competitive with anybody. If I'm worried about beating somebody else, I'm not going to be the best version of me. It shouldn't be a competition because somebody else winning is not going to make me lose.",Megan Thee Stallion,"Competition, Lose, Me"
He who gets the best players usually wins.,Bobby Bowden,"Players, Who, He"
"Honestly, I'm just trying to do the best I can with every opportunity I'm given, and when I'm given the opportunities make the most of them.",Tim Tebow,"Opportunity, Trying, I Can"
I don't care whether people like me or dislike me. I'm not on earth to win a popularity contest. I'm here to be the best human being I possibly can be.,Tab Hunter,"Win, Me, Care"
"Being from Miami, you're used to the fact that your home is a vacation spot. But that's what makes Miami one of the best places in the world. We're so rich in different cultures, being so close to Haiti, Cuba, the Dominican Republic, and Puerto Rico, and then you've got people who travel from all over the world just to come visit.",Flo Rida,"Home, Travel, Your"
Being a mother is the best thing that ever happened to me. Before you have your first baby you are a girl and then you become a mother. There is no transition into being a woman; you literally become a mum and being a mum means you always love someone else more than yourself and it is an unexplainable situation.,Brigitte Nielsen,"Love, Always, Your"
"Someone said adversity builds character, but someone else said adversity reveals character. I'm pleasantly surprised with my resilience. I persevere, and not just blindly. I take the best, get rid of the rest, and move on, realizing that you can make a choice to take the good.",Brooke Shields,"Good, Character, Adversity"
"Childhood obesity is best tackled at home through improved parental involvement, increased physical exercise, better diet and restraint from eating.",Bob Filner,"Home, Parenting, Diet"
"I don't mind my eyebrows. They add... something to me. I wouldn't say they were my best feature, though. People tell me they like my eyes. They distract from the eyebrows.",Nicholas Hoult,"Eyes, Mind, Me"
Only a mediocre person is always at his best.,W. Somerset Maugham,"Always, Person, Only"
"The best way to obtain truth and wisdom is not to ask from books, but to go to God in prayer, and obtain divine teaching.","Joseph Smith, Jr.","Wisdom, God, Truth"
The best things in life sometimes happen spontaneously.,Jason Statham,"Life, Sometimes, Things"
The FBI Academy teaches new agents that the best predictor of future behavior is past behavior.,Ronald Kessler,"Future, Past, Behavior"
"Experience hath shewn, that even under the best forms of government those entrusted with power have, in time, and by slow operations, perverted it into tyranny.",Thomas Jefferson,"Experience, Power, Time"
My dad has given me the best gift anyone has ever given me. He gave me wings to fly.,Adria Arjona,"Dad, Fly, Gift"
"God is my best friend. I talk to God every day. And no one can tell me how to talk to God - not no imam, not no priest, not no rabbi, no pastor.",Eve,"God, Day, Me"
Leadership consists of picking good men and helping them do their best.,Chester W. Nimitz,"Leadership, Good, Men"
You have to surround yourself with people who love you and want the best for you.,Mena Suvari,"Love, Surround Yourself, Yourself"
I'm a corporate thug. That's the best way to be.,E-40,"Way, Thug, Best Way"
Everyone is your best friend when you are successful. Make sure that the people that you surround yourself with are also the people that you are not afraid of failing with.,Paula Abdul,"Business, Your, Surround Yourself"
I'm an optimistic realist. I kind of expect the worst but prepare for the best.,Trixie Mattel,"Worst, Prepare, Realist"
"I hope I'm better today than I was yesterday. I don't believe in glory days or anything like that, so I think the best is tomorrow or later this afternoon!",Edie Brickell,"Hope, Today, Tomorrow"
"One of the best ways to make yourself happy in the present is to recall happy times from the past. Photos are a great memory-prompt, and because we tend to take photos of happy occasions, they weight our memories to the good.",Gretchen Rubin,"Good, Great, Memories"
"The best success, for me, is not one trophy. It's not harmony. It's when players improve and grow.",Unai Emery,"Success, Grow, Me"
"I give no quarter, and I ask for none. Out there, I'm going to fight for my team and do the best I can.",Diego Costa,"Fight, I Can, Team"
"I believe in hard work, not luck factor. The best efforts will reap the best fruits. Nobody can take all the credit. We don't even talk about the efforts of the director, the writers, other technicians, etc. They all together take a film to another level.",Rakul Preet Singh,"Work, Hard Work, Luck"
"To be the best, I had to work harder than everyone else.",Jahangir Khan,"Work, Everyone, Else"
"Every parent wants to do what's best for their child. Whatever I can afford, I'm going to get my kid the best education I can get.",Michael Moore,"Education, I Can, Whatever"
Nations don't have friends; they have interests. The best motivation for a state to act if it is remote from an epidemic is if its own security is at risk.,Joanne Liu,"Security, Own, Motivation"
"We are biological creatures. We are born, we live, we die. There is no transcendent purpose to existence. At best we are creatures of reason, and by using reason we can cure ourselves of emotional excess. Purged of both hope and fear, we find courage in the face of helplessness, insignificance and uncertainty.",Jonathan Sacks,"Courage, Hope, Fear"
A 'naughty pickle' is how I'd best describe myself. I think fun and laughter is the whole point of life.,Celia Imrie,"Life, Myself, Naughty"
"Love God; love others; do your best in all you do, even if you fall short!",Bethany Hamilton,"Love, God, Do Your Best"
"I'm trying to show people that I'm a person, and I deal with the same things as you guys, and I'm trying to make the best of it.",Charli D'Amelio,"People, Person, Trying"
The best fitness tip is that you don't need to be out of breath and do cardio to get in shape.,Caroline Flack,"Fitness, Cardio, Breath"
"Failure has been my best friend as a writer. It tests you, to see if you have what it takes to see it through.",Markus Zusak,"Failure, See, Friend"
"The best thing you can learn from the worst times of your life is that it always gets better. It may take a month, a year, a decade, but it will get better if you leave yourself open to it.",Janis Ian,"Life, Always, Your"
"You get the best effort from others not by lighting a fire beneath them, but by building a fire within.",Bob Nelson,"Effort, Fire, Building"
"Candy is childhood, the best and bright moments you wish could have lasted forever.",Dylan Lauren,"Childhood, Wish, Bright"
"I'm a little bit of an eternal optimist. People always say to me, 'If you go do this and it fails, what are you going to do?' I don't care. I'm going to give it my best shot. That's what I'm going to do. If it doesn't work, it doesn't work. And I'll try again.",Jamie Dimon,"Work, Always, Me"
"Treat your friends as you do your best pictures, and place them in their best light.",Lady Randolph Churchill,"Do Your Best, Light, Your"
I say that in the most humble way: I always knew that I could perform with the best of 'em and I could deliver with the best of 'em.,Nipsey Hussle,"Always, Humble, Way"
The portrait I do best is of the person I know best.,Nadar,"Know, Person, Portrait"
"If you're going to do something, you're going to do it to be the best.",Colin Kaepernick,"Something, Going, You"
"The communism of Karl Marx would probably be actually the best for everybody as a whole. But what he didn't figure into was human nature, and that's what corrupts it.",Jesse Ventura,"Nature, Communism, Human Nature"
"God is not on the side of the big battalions, but on the side of those who shoot best.",Voltaire,"God, Shoot, Big"
The best cartoons have no words at all - just the image pops out.,Jeff MacNelly,"Words, No Words, Cartoons"
"When you run a part of the relay and pass on the baton, there is no sense of unfinished business in your mind. There is just the sense of having done your part to the best of your ability. That is it. The hope is to pass on the baton to somebody who will run faster and run a better marathon.",N. R. Narayana Murthy,"Hope, Business, Done"
"I didn't want to grow old and find that I didn't do what I could have done, that I didn't put my best foot forward. I didn't want to have any regrets.",Lonnie Johnson,"Done, Grow, Find"
"The goal of any farmer, after producing enough to feed his own family, has always been to find the best place to sell the year's crop.",Sonny Perdue,"Family, Always, Farmer"
"The optimist proclaims that we live in the best of all possible worlds, and the pessimist fears this is true.",James Branch Cabell,"True, Possible, Live"
My best friend is the one who brings out the best in me.,Henry Ford,"Friendship, Me, Friend"
"The best thing I've learned is that you have to listen to your body, and you have to be your own physician. Don't ignore those little groaning aches and pains.",Valerie Cruz,"Your, Body, Ignore"
"No matter what comes, I will always work hard and do my best.",Shelly-Ann Fraser-Pryce,"Work, Always, Matter"
"Every single job is a challenge. You are walking into a new set, a new character, creating a world and trying to get comfortable to do your best work.",Felicia Day,"Work, Do Your Best, Character"
"From my experience, the best advisors help in three ways: encourage you to look at the problem or opportunity from multiple angles; help you balance the tug of the short-term with important long-term priorities; and ask the tough questions you need to know to reach the best solution.",Margo Georgiadis,"Experience, Opportunity, Balance"
"With data collection, 'The sooner the better' is always the best answer.",Marissa Mayer,"Always, Better, Data"
I am awesome. I'm the most must-see WWE superstar: I'm proven inside the ring and outside the ring. I'm the best on the mic; I get the ratings.,The Miz,"I Am, Ring, Mic"
"Love is the best thing in the world, and the thing that lives the longest.",Henry Van Dyke,"Love, Love Is, World"
"I know what I bring to the table. I know my game offensively and defensively. I think I'm one of the best, if not the best, playing two-ways.",Paul George,"Game, Know, Table"
"I think on some level, you do your best things when you're a little off-balance, a little scared. You've got to work from mystery, from wonder, from not knowing.",Willem Dafoe,"Work, Do Your Best, Your"
"Sometimes when you innovate, you make mistakes. It is best to admit them quickly, and get on with improving your other innovations.",Steve Jobs,"Business, Your, Mistakes"
"The key to life is your attitude. Whether you're single or married or have kids or don't have kids, it's how you look at your life, what you make of it. It's about making the best of your life wherever you are in life.",Candace Bushnell,"Life, Attitude, Your"
Wisdom denotes the pursuing of the best ends by the best means.,Francis Hutcheson,"Wisdom, Means, Pursuing"
If you try to do your best there is no failure.,Mike Farrell,"Failure, Do Your Best, Your"
"The most significant barrier to female leadership is the actual lack of females in leadership. The best advice I can give to women is to go out and start something, ideally their own businesses. If you can't see a path for leadership within your own company, go blaze a trail of your own.",Safra A. Catz,"Leadership, Women, Path"
"Now you know my credo: Free-market capitalism is the best path to prosperity. And let me add to that from our Founding Fathers: Our Creator endowed us with the inalienable rights to life, liberty, and the pursuit of happiness. In other words, freedom.",Lawrence Kudlow,"Life, Happiness, Freedom"
"We run around so much - with the best intentions: I want to save the rain forest. I've gotta clean up the oceans. I've gotta save the dolphins. All worthy efforts, but if you're not centered and you don't have the serenity in your life you need to accomplish that task, you're not going to do a very good job.","Ed Begley, Jr.","Life, Good, Rain"
"I get a lot of the ideas when I'm resting - either when I'm meditating or getting some kind of work done on my back, like physical therapy or acupuncture. That's where I get my best ideas, maybe because I'm balancing my body.",Katy Perry,"Work, Done, Body"
"Obviously, I have a lot of memories here... but at the same time I'm going to put all my energies into moving forward and doing my best for the Thrashers.",Peter Bondra,"Time, Memories, Moving Forward"
"If you're nervous, that means you care and you want to give your best.",Adriana Lima,"Your, Care, Nervous"
"The best teacher is the one who suggests rather than dogmatizes, and inspires his listener with the wish to teach himself.",Edward G. Bulwer-Lytton,"Teacher, Wish, Who"
"You can get a million different opinions from different people, but I always like to watch myself to see what I did and how I performed because the best critic is yourself.",Mandy Rose,"Myself, Always, Yourself"
"If you love your work, you'll be out there every day trying to do it the best you possibly can, and pretty soon everybody around will catch the passion from you - like a fever.",Sam Walton,"Love, Work, Your"
Sometimes the solitary voice can be the best one.,Frank Miller,"Voice, Sometimes, Solitary"
You had better live your best and act your best and think your best today; for today is the sure preparation for tomorrow and all the other tomorrows that follow.,Harriet Martineau,"Today, Tomorrow, Your"
"I'm at my best when people are depending on me. If it's just on me and I don't have nothing to do, I'm going to be lazy. On the football field, it's every single day, every play, knowing that people are depending on me to make my play. That helps me elevate my game to another level.",Von Miller,"Football, Day, Game"
"Throughout COVID, I just consistently grinded at my craft. I didn't let COVID get in the way of my goal and the goal is to be the best me that I can be for the team.",Mohamed Sanu,"Me, Way, I Can"
Life at best is bittersweet.,Jack Kirby,"Life, Bittersweet"
"Never die easy. Why run out of bounds and die easy? Make that linebacker pay. It carries into all facets of your life. It's okay to lose, to die, but don't die without trying, without giving it your best.",Walter Payton,"Life, Your, Lose"
The best weapon against an enemy is another enemy.,Friedrich Nietzsche,"War, Enemy, Weapon"
"We are all racing towards death. No matter how many great, intellectual conclusions we draw during our lives, we know they're all only man-made, like God. I begin to wonder where it all leads. What can you do, except do what you can do as best you know how.",John Hurt,"God, Death, Great"
"Kendrick Lamar is 10-times the rapper I am, but I just feel I'm the best at getting my own point across.",JPEGMAFIA,"I Am, Feel, Own"
"The Court's legitimacy arises from the source of its authority - which is, of course, the Constitution - and is best preserved by adhering to decision methods that neither expand nor contract but legitimize the power of judicial review.",Diane S. Sykes,"Power, Decision, Constitution"
"For everything bad, there's a million really exciting things, whether it's someone puts out a really great book, there's a new movie, there's a new detective, the sky is unbelievably golden, or you have the best cup of coffee you ever had in your life.",Patti Smith,"Life, Great, Sky"
"The longer I live, the more I feel that the individual is not so much to blame - not even the worst individuals, not even the 'best' citizens - as the system of corruption which has grown up about us, and which rewards an honest man with a mere living and a crook with all the magnificence of our magnificent modern life.",Lincoln Steffens,"Life, Man, Corruption"
You're not obligated to win. You're obligated to keep trying to do the best you can every day.,Marian Wright Edelman,"Day, Win, Keep"
"If you feel rooted in your home and family, if you're active in your community, there's nothing more empowering. The best way to make a difference in the world is to start by making a difference in your own life.",Julia Louis-Dreyfus,"Life, Family, Home"
"Whatever you go into, you have to go in there to be the best. There's no formulas. It's all about passion and honesty and hard work. It might look glamorous, but it takes a lot of hard work. The blessing with the arts is that you can do it forever.",Hugh Masekela,"Work, Hard Work, Passion"
"I owe the best of myself to geology, but everything it has taught me tends to turn me away from dead things.",Pierre Teilhard de Chardin,"Myself, Me, Dead"
"I love my work, I love the people I work with, I do the best I can.",Mandy Patinkin,"Love, Work, People"
"Solitude is creativity's best friend, and solitude is refreshment for our souls.",Naomi Judd,"Solitude, Creativity, Refreshment"
"There are still some people out there who believe comic books are nothing more than, well, comic books. But the true cognoscenti know graphic novels are - at their best - an amazing blend of art literature and the theater of the mind.",John Ridley,"Art, Amazing, Mind"
Silence is true wisdom's best reply.,Euripides,"Wisdom, Silence, True"
"The patient's autonomy always, always should be respected, even if it is absolutely contrary - the decision is contrary to best medical advice and what the physician wants.",Jack Kevorkian,"Medical, Always, Decision"
"Gamble, cheat, lie, and steal. Let me explain: Gamble for your best shot in life - dare to take risks. Cheat those who would have you be less than you are. Lie in the arms of those you love. And finally, steal every moment of happiness.",Caitlyn Jenner,"Life, Love, Happiness"
The best way to persuade people is with your ears - by listening to them.,Dean Rusk,"Your, Way, Listening"
"Every day, every one of us sets the stage for our sentiment, our confidence, and our success by getting dressed. When you feel great, when you feel your best, it opens up a world of possibility. Feeling confident and self-assured are important inputs into good days, successful days, and happy days.",Katrina Lake,"Success, Good, Great"
"Our criminal justice system is fallible. We know it, even though we don't like to admit it. It is fallible despite the best efforts of most within it to do justice. And this fallibility is, at the end of the day, the most compelling, persuasive, and winning argument against a death penalty.",Eliot Spitzer,"Death, Justice, Day"
"Your best ideas, those eureka moments that turn the world upside down, seldom come when you're juggling emails, rushing to meet the 5 P.M. deadline or straining to make your voice heard in a high-stress meeting. They come when you're walking the dog, soaking in the bath or swinging in a hammock.",Carl Honore,"Your, World, Voice"
"I never for a day gave up listening to the songs of our birds, or watching their peculiar habits, or delineating them in the best way I could.",John James Audubon,"Day, Way, Listening"
"You say it best, when you say nothing at all.",Alison Krauss,"Nothing, Say, You"
My customer has her own sense of style and knows herself well. My goal is to help women become the best version of themselves.,Tom Ford,"Women, Style, Own"
