title,author,tags
The best way to predict the future is to create it.,Peter Drucker,"Future, Way, Predict"
A problem is a chance for you to do your best.,Duke Ellington,"Chance, Do Your Best, Your"
"To give anything less than your best, is to sacrifice the gift.",Steve Prefontaine,"Sacrifice, Your, Gift"
Living well is the best revenge.,George Herbert,"Revenge, Living, Well"
"There are some things you learn best in calm, and some in storm.",Willa Cather,"Storm, Calm, Things"
"I'm selfish, impatient, and a little insecure. I make mistakes, I'm out of control, and at times hard to handle. But if you can't handle me at my worst, then you sure as hell don't deserve me at my best.",Marilyn Monroe,"Selfish, Hell, Me"
"Whether it's the best of times or the worst of times, it's the only time we've got.",Art Buchwald,"Time, Worst, Only"
That's your best friend and your worst enemy - your own brain.,Fred Durst,"Brain, Your, Enemy"
The best revenge is massive success.,Frank Sinatra,"Success, Revenge, Massive"
Nobody who ever gave his best regretted it.,George Halas,"Nobody, Who, Ever"
The best way to find yourself is to lose yourself in the service of others.,Mahatma Gandhi,"Yourself, Service, Lose"
"I did my best, and God did the rest.",Hattie McDaniel,"God, Rest, Did"
The best revenge is to live on and prove yourself.,Eddie Vedder,"Yourself, Revenge, Live"
"It's a funny thing about life; if you refuse to accept anything but the best, you very often get it.",W. Somerset Maugham,"Life, Funny, Accept"
Things turn out best for the people who make the best of the way things turn out.,John Wooden,"Way, People, Turn"
The best thing about the future is that it comes only one day at a time.,Dean Acheson,"Future, Time, Day"
I have the simplest tastes. I am always satisfied with the best.,Oscar Wilde,"Always, I Am, Satisfied"
"In any moment of decision, the best thing you can do is the right thing, the next best thing is the wrong thing, and the worst thing you can do is nothing.",Theodore Roosevelt,"Moment, Decision, The Right Thing"
Do right. Do your best. Treat others as you want to be treated.,Lou Holtz,"Do Your Best, Your, Treat"
"To be nobody but yourself in a world which is doing its best, night and day, to make you everybody else - means to fight the hardest battle which any human being can fight; and never stop fighting.",e. e. cummings,"Day, Fight, Battle"
"If you want to go somewhere, it is best to find someone who has already been there.",Robert Kiyosaki,"Find, Someone, Go"
The best way to cheer yourself up is to try to cheer somebody else up.,Mark Twain,"Yourself, Try, Way"
Grow old with me! The best is yet to be.,Robert Browning,"Grow, Me, Old"
Expect the best. Prepare for the worst. Capitalize on what comes.,Zig Ziglar,"Worst, Prepare, Expect"
"I have made the choices that work best for me. I know I cannot please everyone, and that's fine.",Marlee Matlin,"Work, Me, Please Everyone"
I do the very best I know how - the very best I can; and I mean to keep on doing so until the end.,Abraham Lincoln,"Doing, Keep, Know"
"Do what you love to do and give it your very best. Whether it's business or baseball, or the theater, or any field. If you don't love what you're doing and you can't give it your best, get out of it. Life is too short. You'll be an old man before you know it.",Al Lopez,"Life, Love, Business"
"To love and win is the best thing. To love and lose, the next best.",William Makepeace Thackeray,"Love, Lose, Win"
Just do what you do best.,Red Auerbach,"Just, You"
"I am as bad as the worst, but, thank God, I am as good as the best.",Walt Whitman,"God, Good, Thank God"
Find out what you like doing best and get someone to pay you for it.,Katharine Whitehorn,"Doing, Find, Someone"
"Life doesn't require that we be the best, only that we try our best.","H. Jackson Brown, Jr.","Life, Try, Only"
The best way to find out if you can trust somebody is to trust them.,Ernest Hemingway,"Trust, Way, Find"
"The most basic question is not what is best, but who shall decide what is best.",Thomas Sowell,"Decide, Who, Question"
"At its best, life is completely unpredictable.",Christopher Walken,"Life, Unpredictable"
Old friends are best.,John Selden,"Old Friends, Old, Friends"
Knowing your own darkness is the best method for dealing with the darknesses of other people.,Carl Jung,"Your, Darkness, Own"
"A person always doing his or her best becomes a natural leader, just by example.",Joe DiMaggio,"Always, Doing, Person"
"When things are bad, it's the best time to reinvent yourself.",George Lopez,"Time, Yourself, Bad"
This is the precept by which I have lived: Prepare for the worst; expect the best; and take what comes.,Hannah Arendt,"Worst, Prepare, Expect"
"The best doctors in the world are Doctor Diet, Doctor Quiet, and Doctor Merryman.",Jonathan Swift,"Diet, Doctor, World"
"At his best, man is the noblest of all animals; separated from law and justice he is the worst.",Aristotle,"Justice, Man, Law"
"Enthusiasm is the best protection in any situation. Wholeheartedness is contagious. Give yourself, if you wish to get others.",David Seabury,"Yourself, Situation, Wish"
The man who has done his best has done everything.,Charles M. Schwab,"Done, Man, Everything"
"In the practice of tolerance, one's enemy is the best teacher.",Dalai Lama,"Teacher, Practice, Tolerance"
Learn to say 'no' to the good so you can say 'yes' to the best.,John C. Maxwell,"Good, Say, Learn"
Just do the best you can. No one can do more than that.,John Wooden,"More, Just, Than"
The best mirror is an old friend.,Peter Nivio Zarlenga,"Mirror, Old, Friend"
The best preparation for tomorrow is to do today's work superbly well.,William Osler,"Work, Today, Tomorrow"
Life is best when you are in love.,Michael Moriarty,"Life, Love, You"
"That best portion of a man's life, his little, nameless, unremembered acts of kindness and love.",William Wordsworth,"Life, Love, Kindness"
The best person to get something done is a busy person.,Mark Burnett,"Done, Busy, Person"
The best revenge is to be unlike him who performed the injury.,Marcus Aurelius,"Revenge, Injury, Who"
The best vision is insight.,Malcolm Forbes,"Vision, Insight"
"Since we live in this world, we have to do our best for this world.",Aung San Suu Kyi,"World, Live, Since"
I will do my best. That is all I can do. I ask for your help - and God's.,Lyndon B. Johnson,"God, Your, Will"
The best way of removing negativity is to laugh and be joyous.,David Icke,"Laugh, Way, Negativity"
The worst thing that happens to you may be the best thing for you if you don't let it get the best of you.,Will Rogers,"Worst, Happens, May"
"Look for your choices, pick the best one, then go with it.",Pat Riley,"Your, Look, Choices"
"Why don't you start believing that no matter what you have or haven't done, that your best days are still out in front of you.",Joel Osteen,"Done, Your, Start"
He who knows best knows how little he knows.,Thomas Jefferson,"Who, How, Little"
The best work is not what is most difficult for you; it is what you do best.,Jean-Paul Sartre,"Work, Difficult, Most"
"Do the best you can, and don't take life too serious.",Will Rogers,"Life, Serious, Take"
You have to accept whatever comes and the only important thing is that you meet it with courage and with the best that you have to give.,Eleanor Roosevelt,"Courage, Important, Accept"
"It was the best of times, it was the worst of times.",Charles Dickens,"Worst, Times"
The best ideas come as jokes. Make your thinking as funny as possible.,David Ogilvy,"Funny, Your, Thinking"
You get the best out of others when you get the best out of yourself.,Harvey S. Firestone,"Yourself, Others, Out"
The best way to resolve any problem in the human world is for all sides to sit down and talk.,Dalai Lama,"World, Way, Talk"
"A woman knows by intuition, or instinct, what is best for herself.",Marilyn Monroe,"Woman, Intuition, Herself"
First gain the victory and then make the best use of it you can.,Horatio Nelson,"Victory, First, Make"
I have found the best way to give advice to your children is to find out what they want and then advise them to do it.,Harry S Truman,"Your, Advice, Way"
I never had a policy; I have just tried to do my very best each and every day.,Abraham Lincoln,"Day, Every Day, Never"
The best intelligence test is what we do with our leisure.,Laurence J. Peter,"Intelligence, Leisure, Test"
"We are at our very best, and we are happiest, when we are fully engaged in work we enjoy on the journey toward the goal we've established for ourselves. It gives meaning to our time off and comfort to our sleep. It makes everything else in life so wonderful, so worthwhile.",Earl Nightingale,"Life, Work, Time"
The best books... are those that tell you what you know already.,George Orwell,"Know, Tell, Books"
"Best to live lightly, unthinkingly.",Sophocles,"Live, Lightly, Unthinkingly"
"Usually, the stuff that's your best idea or work is going to be attacked the most.",Francis Ford Coppola,"Work, Your, Going"
I am easily satisfied with the very best.,Winston Churchill,"I Am, Satisfied, Very"
One of the best things to do sometimes is simply to be.,Eric Butterworth,"Sometimes, Things, Simply"
"I always prefer to believe the best of everybody, it saves so much trouble.",Rudyard Kipling,"Always, Believe, Trouble"
The best cure for the body is a quiet mind.,Napoleon Bonaparte,"Mind, Body, Quiet"
The things we know best are the things we haven't been taught.,Luc de Clapiers,"Know, Things, Taught"
"When we do the best that we can, we never know what miracle is wrought in our life, or in the life of another.",Helen Keller,"Life, Know, Never"
The best is the enemy of the good.,Voltaire,"Good, Enemy"
The best thing to do with the best things in life is to give them up.,Ambrose Bierce,"Life, Things, Up"
The best luck of all is the luck you make for yourself.,Douglas MacArthur,"Luck, Yourself, Make"
There is only one real sin and that is to persuade oneself that the second best is anything but second best.,Doris Lessing,"Sin, Real, Anything"
The best time for you to hold your tongue is the time you feel you must say something or bust.,Josh Billings,"Time, Your, Feel"
It is best for the wise man not to seem wise.,Aeschylus,"Wise, Man, Wise Man"
Look your best - who said love is blind?,Mae West,"Love, Love Is, Your"
The days you work are the best days.,Georgia O'Keeffe,"Work, Days, You"
"Clever men are good, but they are not the best.",Thomas Carlyle,"Good, Men, Clever"
"The creed of a true saint is to make the best of life, and to make the most of it.",Edwin Hubbel Chapin,"Life, True, Make"
He who has done his best for his own time has lived for all times.,Friedrich Schiller,"Time, Done, Own"
"If a man does his best, what else is there?",George S. Patton,"Man, Else, Does"
The only real failure in life is not to be true to the best one knows.,Buddha,"Life, Failure, True"
The best road to progress is freedom's road.,John F. Kennedy,"Freedom, Progress, Road"
"I believe that a simple and unassuming manner of life is best for everyone, best both for the body and the mind.",Albert Einstein,"Life, Mind, Believe"
The worst men often give the best advice.,Francis Bacon,"Men, Advice, Worst"
But I always think that the best way to know God is to love many things.,Vincent Van Gogh,"Love, God, Always"
The best way to keep one's word is not to give it.,Napoleon Bonaparte,"Keep, Way, Best Way"
"Everybody's got a job to do, and I do mine as best I can.",Marlee Matlin,"Job, I Can, Mine"
To give and then not feel that one has given is the very best of all ways of giving.,Max Beerbohm,"Feel, Giving, Ways"
"Next to acquiring good friends, the best acquisition is that of good books.",Charles Caleb Colton,"Good, Next, Friends"
The best way to hold a man is in your arms.,Mae West,"Man, Your, Way"
The best things in life are silly.,Scott Adams,"Life, Things, Silly"
The best way to keep your friends is not to give them away.,Wilson Mizner,"Your, Keep, Way"
The best thing about animals is that they don't talk much.,Thornton Wilder,"Talk, Animals, Much"
"Most of the things we decide are not what we know to be the best. We say yes, merely because we are driven into a corner and must say something.",Frank Crane,"Know, Decide, Corner"
You'll live. Only the best get killed.,Charles de Gaulle,"Live, Only, Get"
But men are men; the best sometimes forget.,William Shakespeare,"Men, Sometimes, Forget"
Culture is the habit of being pleased with the best and knowing why.,Henry Van Dyke,"Culture, Habit, Why"
When you do not know what you are doing and what you are doing is the best - that is inspiration.,Robert Bresson,"Doing, Know, Inspiration"
The best way to navigate through life is to give up all of our controls.,Gerald Jampolsky,"Life, Way, Through"
Our best thoughts come from others.,Ralph Waldo Emerson,"Thoughts, Others, Come"
I am the best in baseball.,Reggie Jackson,"I Am, Baseball, Am"
The best and most beautiful things in the world cannot be seen or even touched - they must be felt with the heart.,Helen Keller,"Inspirational, Beautiful, Heart"
The best preparation for tomorrow is doing your best today.,"H. Jackson Brown, Jr.","Inspirational, Today, Tomorrow"
"Good, better, best. Never let it rest. 'Til your good is better and your better is best.",St. Jerome,"Motivational, Good, Your"
"A strong, positive self-image is the best possible preparation for success.",Joyce Brothers,"Positive, Success, Preparation"
"I am prepared for the worst, but hope for the best.",Benjamin Disraeli,"Hope, I Am, Worst"
"Work hard, stay positive, and get up early. It's the best part of the day.","George Allen, Sr.","Positive, Work, Day"
"A failure is not always a mistake, it may simply be the best one can do under the circumstances. The real mistake is to stop trying.",B. F. Skinner,"Failure, Always, Mistake"
"Try and leave this world a little better than you found it, and when your turn comes to die, you can die happy in feeling that at any rate, you have not wasted your time but have done your best.",Robert Baden-Powell,"Time, Done, Your"
Things are never quite as scary when you've got a best friend.,Bill Watterson,"Friendship, Never, Things"
Only the mediocre are always at their best.,Jean Giraudoux,"Funny, Always, Only"
The human body is the best picture of the human soul.,Ludwig Wittgenstein,"Fitness, Soul, Body"
A professional is someone who can do his best work when he doesn't feel like it.,Alistair Cooke,"Work, Feel, Professional"
"Love yourself for who you are, and trust me, if you are happy from within, you are the most beautiful person, and your smile is your best asset.",Ileana D'Cruz,"Love, Smile, Trust"
"There is so much good in the worst of us, and so much bad in the best of us, that it ill behooves any of us to find fault with the rest of us.",James Truslow Adams,"Good, Rest, Bad"
"Always Do Your Best. Your best is going to change from moment to moment; it will be different when you are healthy as opposed to sick. Under any circumstance, simply do your best, and you will avoid self-judgment, self-abuse and regret.",Don Miguel Ruiz,"Positive, Change, Do Your Best"
The best time to make friends is before you need them.,Ethel Barrymore,"Friendship, Time, Make"
"Smiling is definitely one of the best beauty remedies. If you have a good sense of humor and a good approach to life, that's beautiful.",Rashida Jones,"Life, Smile, Beauty"
"Heavy hearts, like heavy clouds in the sky, are best relieved by the letting of a little water.",Christopher Morley,"Sad, Sky, Clouds"
The best way to make your dreams come true is to wake up.,Paul Valery,"Dreams, Your, Your Dreams"
And I believe that the best buy in public health today must be a combination of regular physical exercise and a healthy diet.,Julie Bishop,"Health, Fitness, Diet"
"If you have a positive attitude and constantly strive to give your best effort, eventually you will overcome your immediate problems and find you are ready for greater challenges.",Pat Riley,"Positive, Attitude, Your"
Don't let the fear of the time it will take to accomplish something stand in the way of your doing it. The time will pass anyway; we might just as well put that passing time to the best possible use.,Earl Nightingale,"Time, Fear, Your"
"If you do what you love, it is the best way to relax.",Christian Louboutin,"Love, Relax, Do What You Love"
"If you want to be the best, you have to do things that other people aren't willing to do.",Michael Phelps,"People, Things, Willing"
"It's not that diamonds are a girl's best friend, but it's your best friends who are your diamonds. It's your best friends who are supremely resilient, made under pressure and of astonishing value. They're everlasting; they can cut glass if they need to.",Gina Barreca,"Your, Value, Diamonds"
"Sleep is good, death is better; but of course, the best thing would to have never been born at all.",Heinrich Heine,"Death, Good, Better"
"I'm not perfect; I make mistakes all the time. All I can do is to try my best to learn from my mistakes, take responsibility for them, and do a better job tomorrow.",Lana,"Time, Tomorrow, Responsibility"
"I believe that in life, you have to give things your best shot, do your best. You have to focus on what needs to be done, do the right thing, not the popular thing.",David Cameron,"Life, Done, Do Your Best"
"I have great respect for the past. If you don't know where you've come from, you don't know where you're going. I have respect for the past, but I'm a person of the moment. I'm here, and I do my best to be completely centered at the place I'm at, then I go forward to the next place.",Maya Angelou,"Respect, Great, Moment"
Doing the best at this moment puts you in the best place for the next moment.,Oprah Winfrey,"Moment, Doing, Place"
Happiness does not come from doing easy work but from the afterglow of satisfaction that comes after the achievement of a difficult task that demanded our best.,Theodore Isaac Rubin,"Happiness, Work, Business"
A satisfied customer is the best business strategy of all.,Michael LeBoeuf,"Business, Strategy, Satisfied"
Perfection is impossible; just strive to do your best.,Angela Watson,"Impossible, Do Your Best, Perfection"
The optimist thinks this is the best of all possible worlds. The pessimist fears it is true.,J. Robert Oppenheimer,"True, Possible, Pessimist"
Difficult times often bring out the best in people.,Bernie Sanders,"Difficult, People, Difficult Times"
"Lay this unto your breast: Old friends, like old swords, still are trusted best.",John Webster,"Friendship, Your, Old Friends"
Your best teacher is your last mistake.,Ralph Nader,"Teacher, Your, Mistake"
Good manners will open doors that the best education cannot.,Clarence Thomas,"Education, Good, Manners"
"My life motto is 'Do my best, so that I can't blame myself for anything.'",Magdalena Neuner,"Life, Myself, My Life"
"Employees are a company's greatest asset - they're your competitive advantage. You want to attract and retain the best; provide them with encouragement, stimulus, and make them feel that they are an integral part of the company's mission.",Anne M. Mulcahy,"Your, Feel, Mission"
"My mama always used to tell me: 'If you can't find somethin' to live for, you best find somethin' to die for.'",Tupac Shakur,"Always, Die, Me"
"Whatever you do, do with determination. You have one life to live; do your work with passion and give your best. Whether you want to be a chef, doctor, actor, or a mother, be passionate to get the best result.",Alia Bhatt,"Life, Work, Determination"
I think the people in this country have had enough of experts with organisations from acronyms saying that they know what is best and getting it consistently wrong.,Michael Gove,"Country, Know, Enough"
I've been through a lot of things in my personal and family life. That turned me into a fighter. I always strive to be the best I possibly can.,Hope Solo,"Life, Family, Always"
An investment in knowledge pays the best interest.,Benjamin Franklin,"Education, Knowledge, Investment"
The best things in life are often waiting for you at the exit ramp of your comfort zone.,Karen Salmansohn,"Life, Waiting, Your"
My belief is that communication is the best way to create strong relationships.,Jada Pinkett Smith,"Communication, Way, Create"
"Social media is something of a double-edged sword. At its best, social media offers unprecedented opportunities for marginalized people to speak and bring much needed attention to the issues they face. At its worst, social media also offers 'everyone' an unprecedented opportunity to share in collective outrage without reflection.",Roxane Gay,"Social Media, Opportunity, Reflection"
"Ultimately, leadership is not about glorious crowning acts. It's about keeping your team focused on a goal and motivated to do their best to achieve it, especially when the stakes are high and the consequences really matter. It is about laying the groundwork for others' success, and then standing back and letting them shine.",Chris Hadfield,"Success, Leadership, Your"
Life is a lot like jazz... it's best when you improvise.,George Gershwin,"Life, Life Is A, Jazz"
Good teachers know how to bring out the best in students.,Charles Kuralt,"Good, Teacher, Know"
"If you want to be the best, you've got to beat the best. The only problem is when I get that belt, who's going to be left to fight? That's what I want to know.",Donald Cerrone,"Fight, Know, Beat"
"If you work hard and you do your best, you can do anything.",Erin Heatherton,"Work, Do Your Best, Your"
"Expect the best, plan for the worst, and prepare to be surprised.",Denis Waitley,"Plan, Worst, Prepare"
"Life is about not knowing, having to change, taking the moment and making the best of it, without knowing what's going to happen next.",Gilda Radner,"Life, Change, Moment"
Making money is art and working is art and good business is the best art.,Andy Warhol,"Good, Business, Art"
The best education I have ever received was through travel.,Lisa Ling,"Education, Travel, Through"
The best form of government is that which is most likely to prevent the greatest sum of evil.,James Monroe,"Government, Evil, Greatest"
You are a product of your environment. So choose the environment that will best develop you toward your objective. Analyze your life in terms of its environment. Are the things around you helping you toward success - or are they holding you back?,W. Clement Stone,"Life, Wisdom, Success"
Technology is best when it brings people together.,Matt Mullenweg,"Technology, Together, People"
"While I relish our warm months, winter forms our character and brings out our best.",Tom Allen,"Character, Winter, Warm"
"I'm just here for good times, man. I want people to have the best time ever. Especially if they're around me.",Travis Scott,"Good, Time, Man"
"Old wood best to burn, old wine to drink, old friends to trust, and old authors to read.",Athenaeus,"Trust, Old Friends, Burn"
The best advice I ever got was that knowledge is power and to keep reading.,David Bailey,"Knowledge, Power, Knowledge Is Power"
"You don't fight racism with racism, the best way to fight racism is with solidarity.",Bobby Seale,"Fight, Racism, Solidarity"
The best route is to stay humble and stay true to yourself.,Rich the Kid,"Humble, Yourself, True"
"If it's your job to eat a frog, it's best to do it first thing in the morning. And If it's your job to eat two frogs, it's best to eat the biggest one first.",Mark Twain,"Morning, Your, Job"
"The best way to predict the future is to study the past, or prognosticate.",Robert Kiyosaki,"Future, Past, Way"
"'Thank you' is the best prayer that anyone could say. I say that one a lot. Thank you expresses extreme gratitude, humility, understanding.",Alice Walker,"Thankful, Prayer, Humility"
"So much of what is best in us is bound up in our love of family, that it remains the measure of our stability because it measures our sense of loyalty. All other pacts of love or fear derive from it and are modeled upon it.",Haniel Long,"Love, Family, Fear"
"When you have balance in your life, work becomes an entirely different experience. There is a passion that moves you to a whole new level of fulfillment and gratitude, and that's when you can do your best... for yourself and for others.",Cara Delevingne,"Life, Work, Experience"
Taking joy in living is a woman's best cosmetic.,Rosalind Russell,"Beauty, Joy, Woman"
"The price of success is hard work, dedication to the job at hand, and the determination that whether we win or lose, we have applied the best of ourselves to the task at hand.",Vince Lombardi,"Success, Work, Hard Work"
"The most important thing is, whatever you do decide to choose, take it seriously and do your best.",Tom Sturridge,"Do Your Best, Your, Important"
"When you look good, you feel good. Confidence with what you're wearing is very important. If you feel good, you will always perform your best without worrying about anything.",Maria Sharapova,"Good, Always, Your"
"It is not enough to do your best; you must know what to do, and then do your best.",W. Edwards Deming,"Do Your Best, Your, Know"
"Nobody can predict the future. You just have to give your all to the relationship you're in and do your best to take care of your partner, communicate and give them every last drop of love you have. I think one of the most important things in a relationship is caring for your significant other through good times and bad.",Nick Cannon,"Love, Future, Good"
She's always there for me when I need her; She's my best friend; she's just my everything.,Ashley Olsen,"Always, Me, Everything"
"Always do your best. What you plant now, you will harvest later.",Og Mandino,"Motivational, Do Your Best, Always"
The best thing one can do when it's raining is to let it rain.,Henry Wadsworth Longfellow,"Nature, Rain, Raining"
"Yes'm, old friends is always best, 'less you can catch a new one that's fit to make an old one out of.",Sarah Orne Jewett,"Friendship, Always, Old Friends"
